{"run":1,"commit":"04b6640","metric":13,"metrics":{"tests_passed":13,"tests_total":13},"status":"keep","description":"Experiment for hyp:chain-engine-r8 verdict taxonomy - validated 13 test cases covering all 5 verdict states (proved, disproved, inconclusive_lean_proved:N, inconclusive_lean_disproved:N, pending), confidence bounds, lean_strength range checks","timestamp":1777617602286,"segment":0,"confidence":null,"iterationTokens":3036,"asi":{"hypothesis":"Verdict taxonomy (R8) - finite-state closed taxonomy with confidence, evidence_runs, contradicts, supports fields","experiment_id":"exp-chain-engine-r8-verdict-taxonomy.py","verdict":"PROVED","node_type_created":"experiment"}}
{"type":"config","name":"chain-engine R10 chain completion","metricName":"chain_length","metricUnit":"hops","bestDirection":"higher"}
{"run":2,"commit":"c8f3813","metric":8,"metrics":{"chains_found":1,"next_edges_added":7,"tests_passed":5,"tests_total":5},"status":"keep","description":"chain-engine R10: proved adding next edges + experiment/verdict/mvp nodes enables find_chains() to return 8-hop capillary chain","timestamp":1777618508274,"segment":1,"confidence":null,"iterationTokens":5615,"asi":{"hypothesis":"Adding next edges + experiment/verdict/mvp nodes enables find_chains() to return valid capillary chain","experiment_id":"exp-chain-engine-r10-chain-completion.py","verdict":"PROVED","node_type_created":"experiment","chain_length_before":0,"chain_length_after":8,"new_node_types":["experiment","verdict","mvp","outcome","bigger_outcome","app_purpose"]}}
{"run":3,"commit":"91da4ab","metric":6,"metrics":{"tests_passed":6,"tests_total":6,"chains_found":1,"next_edges_added":7},"status":"keep","description":"chain-engine R2 (chains are virtual): proved all 4 acceptance criteria - pure function, no disk writes, dynamic add/remove behavior","timestamp":1777619005407,"segment":1,"confidence":null,"iterationTokens":5615,"asi":{"hypothesis":"R2 chains are virtual - computed from graph, not stored on disk","experiment_id":"exp-chain-engine-r2-virtual-chains.py","verdict":"PROVED","node_type_created":"experiment","chain_engine_r2_results":{"R2.1_no_disk_write":"PASS","R2.2_add_completing_node":"PASS","R2.3_remove_node":"PASS","R2.4_pure_function":"PASS"}}}
{"type":"config","name":"chain-engine R10+2: persist chain with next_edges to disk, verify cold-reload","metricName":"chain_length","metricUnit":"hops","bestDirection":"higher"}
{"run":3,"commit":"8ea44e4","metric":8,"metrics":{"chains_found":1,"next_edges_added":7,"tests_passed":6,"tests_total":6},"status":"keep","description":"chain-persistence R1: proved next_edges in verdict/MVP frontmatter enable find_chains() to return 8-hop chain from live graph. MVP persists chain nodes; loader reconstructs 7 next_edges from disk.","timestamp":1777619158665,"segment":1,"confidence":null,"iterationTokens":9141,"asi":{"hypothesis":"hyp:chain-persistence-r1","experiment_id":"exp-chain-persistence-r1-mvp.py","verdict":"proved","node_type_created":"experiment","chain_length_before":2,"chain_length_after":8,"key_fix":"Experiment node required between hypothesis and verdict (hypothesis→verdict invalid per is_valid_transition)","mvp_script":"experiments/exp-chain-persistence-r1-mvp.py","idea_seed":"idea:domain-chain-persistence"}}
{"run":1,"commit":"8019599","metric":8,"metrics":{"tests_passed":6,"tests_total":6,"chains_found":1,"next_edges_reconstructed":7,"chain_length":8},"status":"keep","description":"chain-engine R10+: fixed loader _reconstruct_next_edges bug, persisted chain with next_edges frontmatter, verified cold-reload yields 8-hop chain","timestamp":1777619254633,"segment":0,"confidence":null,"iterationTokens":142,"asi":{"hypothesis":"Persisting next_edges to disk + fixed loader enables cold-reload chain reconstruction","experiment_id":"exp-chain-engine-r10-persist-next-edges.py","verdict":"PROVED","bug_fixed":"_reconstruct_next_edges break-at-first-level was preventing subdirectory traversal","chain_length_before":0,"chain_length_after":8,"improvement":"Loader now correctly walks subdirectories (nodes/idea/, etc.)"}}
{"run":2,"commit":"ee9f900","metric":8,"metrics":{"tests_passed":5,"tests_total":5,"chains_found":1,"next_edges_reconstructed":7,"chain_length":8},"status":"keep","description":"chain-engine R3 ranking proved 5/5 tests - longest chain attractor, deterministic tie-break, short chain can win under mvp-only weights, pure function","timestamp":1777619423148,"segment":0,"confidence":null,"iterationTokens":8401,"asi":{"hypothesis":"R3 longest-chain attractor + ranking: rank_chains sorts by attractiveness, deterministic tie-break, pure function","experiment_id":"exp-chain-engine-r3-ranking.py","verdict":"PROVED","r3_results":{"R3.1_sorted_descending":"PASS","R3.1_tie_break_deterministic":"PASS","R3.2_longest_top":"PASS","R3.3_short_wins":"PASS","R3.4_pure":"PASS"},"node_type_created":"experiment"}}
{"type":"config","name":"chain-engine R10: next_edges persistence","metricName":"longest_chain_length","metricUnit":"hops","bestDirection":"higher"}
{"run":7,"commit":"77ee98a","metric":8,"metrics":{"chain_count":1,"verdict_count":3,"mvp_count":3,"outcome_count":3},"status":"keep","description":"chain-engine R10: Persisted next_edges to verdict/mvp/outcome node files. Cold reload now yields 8-hop chain (up from 0). Created verdict:chain-engine-r10 node.","timestamp":1777619723084,"segment":3,"confidence":null,"iterationTokens":330,"asi":{"hypothesis":"next_edges in frontmatter enables chain persistence","verdict_proved":"chain_length=8 hops on cold reload","created_nodes":["verdict:chain-engine-r10","mvp:chain-engine-r10-next-edges-persist","outcome:chain-engine-r10-next-edges-persist","bigger-outcome:chain-engine-r10"],"tests_passed":236}}
{"run":1,"commit":"7bd6efb","metric":5,"metrics":{"tests_passed":5,"tests_total":5},"status":"keep","description":"chain-engine R3: longest-chain attractor ranking proved 5/5 tests - deterministic sort, length-only weights, mvp_count override, pure function","timestamp":1777619788510,"segment":0,"confidence":null,"iterationTokens":null,"asi":{"hypothesis":"rank_chains sorts by attractiveness, longest chain preferred but not exclusive","verdict_proved":"5/5 tests passed","r3_criteria":["R3.1 deterministic tie-break","R3.2 length-only weights","R3.3 mvp_count override","R3.4 pure function"]}}
{"run":2,"commit":"774adcb","metric":6,"metrics":{"tests_passed":6,"tests_total":6},"status":"keep","description":"chain-engine R4: mid-chain join proved 6/6 tests - non-tail candidates, configurable probability, min_chain_length filter, prob=0 tails only","timestamp":1777619874271,"segment":0,"confidence":null,"iterationTokens":1593,"asi":{"hypothesis":"mid-chain join allows attaching to any node, not just tails","verdict_proved":"6/6 tests passed","implementation":"src/chain_engine/mid_chain.py","criteria":["R4.1 non-tail candidates","R4.2 configurable probability","R4.3 min_chain_length filter","R4.4 prob=0 tails only"]}}
{"run":3,"commit":"43a3a82","metric":4,"metrics":{"tests_passed":4,"tests_total":4},"status":"keep","description":"chain-engine R5: fork mechanics proved 4/4 tests - multiple same-type children, both branches in chains, fork count, forks compound","timestamp":1777620103725,"segment":0,"confidence":1,"iterationTokens":2567,"asi":{"hypothesis":"fork mechanics allow multiple children of same type","verdict_proved":"4/4 tests passed","criteria":["R5.1 multiple same-type children","R5.2 both branches in chains","R5.3 fork count reported","R5.4 forks compound"]}}
{"run":4,"commit":"36797aa","metric":5,"metrics":{"tests_passed":5,"tests_total":5},"status":"keep","description":"chain-engine R6: attractiveness function proved 5/5 tests - 4-component weighted sum, configurable weights, all-zero safe, pure function","timestamp":1777620157756,"segment":0,"confidence":2,"iterationTokens":4724,"asi":{"hypothesis":"attractiveness score is weighted combination of length, depth, recency, mvp_count","verdict_proved":"5/5 tests passed","implementation":"src/chain_engine/attractiveness.py"}}
{"run":5,"commit":"bc76d06","metric":5,"metrics":{"tests_passed":5,"tests_total":5},"status":"keep","description":"chain-engine R7: configuration file proved 5/5 tests - required keys present, defaults, validation, behavior changes","timestamp":1777620218686,"segment":0,"confidence":null,"iterationTokens":3780,"asi":{"hypothesis":"config file with chain parameters at documented path","verdict_proved":"5/5 tests passed","config_file":"autoresearch-tree.config.json"}}
{"run":6,"commit":"0c60a26","metric":13,"metrics":{"tests_passed":13,"tests_total":13},"status":"keep","description":"chain-engine R8: verdict taxonomy proved 13/13 tests - finite state enum, confidence 0.0-1.0, evidence_runs, contradicts, supports","timestamp":1777620238218,"segment":0,"confidence":2,"iterationTokens":1106,"asi":{"hypothesis":"verdict taxonomy is finite-state enum with confidence, evidence_runs, contradicts, supports","verdict_proved":"13/13 tests passed"}}
{"run":7,"commit":"2867bea","metric":12,"metrics":{"tests_passed":12,"tests_total":12},"status":"keep","description":"chain-engine R9: chain query API proved 12/12 tests - longest_chain, branching_factor, mid_chain_candidates, read-only pure functions","timestamp":1777620257474,"segment":0,"confidence":1,"iterationTokens":1124,"asi":{"hypothesis":"chain query API: longest_chain, branching_factor, mid_chain_candidates","verdict_proved":"12/12 tests passed"}}
{"run":8,"commit":"b35b580","metric":0,"metrics":{"tests_passed":4,"tests_total":4},"status":"keep","description":"chain-engine R1: chain definition proved - find_chains() correct, live graph needs next_edges","timestamp":1777620292052,"segment":0,"confidence":1,"iterationTokens":1088,"asi":{"hypothesis":"chain is ordered path through node types","verdict_proved":"find_chains() correct","live_graph_state":"needs next_edges in node files"}}
{"run":15,"commit":"1808693","metric":4,"metrics":{"chain_count":1,"verdict_count":1,"mvp_count":0,"outcome_count":0,"tests_passed":15,"tests_total":15},"status":"keep","description":"autoresearch-tree-skill R10: SessionStart hook proved 15/15 checks - auto-injects ASCII DAG map with 1-hour stale cache","timestamp":1777620495085,"segment":3,"confidence":5,"iterationTokens":1124,"asi":{"hypothesis":"SessionStart hook auto-injects ASCII DAG map","experiment_id":"exp-skill-r10-sessionstart-hook.py","verdict":"proved","node_type_created":"verdict","chain_length":4}}
{"run":1,"commit":"026a988","metric":6,"metrics":{"chain_count":1,"verdict_count":0,"mvp_count":0,"outcome_count":0,"tests_passed":6,"tests_total":6},"status":"keep","description":"chain-engine R11: Mermaid chain renderer proved 6/6 tests - renders chains as valid Mermaid flowchart TD","timestamp":1777620577998,"segment":0,"confidence":null,"iterationTokens":null,"asi":{"hypothesis":"Mermaid chain renderer","experiment_id":"exp-chain-engine-r11-mermaid-renderer.py","verdict":"proved","node_type_created":"experiment"}}
{"run":15,"commit":"468e89f","metric":8,"metrics":{"chain_count":2,"verdict_count":5,"mvp_count":1,"outcome_count":1,"tests_passed":236,"tests_total":236},"status":"keep","description":"graph-core R11: Created 8-node chain with next_edges in frontmatter. Cold reload yields 8-hop chain (up from 2). 236 tests pass.","timestamp":1777620586297,"segment":3,"confidence":2.5,"iterationTokens":2523,"asi":{"hypothesis":"Persisting next_edges to node frontmatter enables cold-reload chain reconstruction","created_nodes":["exp:graph-core-r11","verdict:graph-core-r11","mvp:graph-core-r11-chain-persist","outcome:graph-core-r11","bigger-outcome:graph-core-r11","app-purpose:graph-core"],"chain_before":"2 hops","chain_after":"8 hops","improvement":"4x increase in longest_chain_length"}}
{"run":15,"commit":"3100aac","metric":8,"metrics":{"tests_passed":236,"tests_total":236,"chain_count":2,"verdict_count":2,"mvp_count":1,"outcome_count":1},"status":"keep","description":"graph-core R11: Persisted next_edges to node files for domain-graph-core chain. Cold reload yields 2 chains, both 8 hops.","timestamp":1777620698419,"segment":3,"confidence":2.5,"iterationTokens":2869,"asi":{"hypothesis":"Persisting next_edges to node frontmatter enables find_chains() to return valid chains from cold reload for idea:domain-graph-core","key_fix":"Added next_edges to idea:domain-graph-core and hyp:graph-core-r1 node files; created hyp:graph-core-r11 hypothesis; cleaned duplicate graph-core-r1-hypothesis.md","chain_length_before":0,"chain_length_after":8,"chains_found":2,"next_edges_reconstructed":7,"domain-graph-core_chain":["idea:domain-graph-core","hyp:graph-core-r1","exp:graph-core-r11","verdict:graph-core-r11","mvp:graph-core-r11-chain-persist","outcome:graph-core-r11","bigger-outcome:graph-core-r11","app-purpose:graph-core"]}}
{"run":2,"commit":"26e0250","metric":5,"metrics":{"chain_count":0,"verdict_count":0,"mvp_count":0,"outcome_count":0,"tests_passed":5,"tests_total":5},"status":"keep","description":"renderers R5: Git-diff renderer proved 5/5 tests - diffs between experiment runs with +/-/~ markers, ASCII-only output","timestamp":1777620742681,"segment":0,"confidence":null,"iterationTokens":1308,"asi":{"hypothesis":"Git-diff renderer for experiment runs","experiment_id":"exp-renderers-r5-git-diff.py","verdict":"proved","node_type_created":"experiment"}}
{"run":3,"commit":"9985315","metric":7,"metrics":{"chain_count":0,"verdict_count":0,"mvp_count":0,"outcome_count":0,"tests_passed":7,"tests_total":7},"status":"keep","description":"environment-indexers R10: filesystem-tree indexer proved 7/7 - R2 criteria all pass including symlink skip, schema validation, determinism","timestamp":1777620862022,"segment":0,"confidence":1,"iterationTokens":8232,"asi":{"hypothesis":"filesystem-tree indexer R2 criteria","experiment_id":"exp-environment-indexers-r10-filesystem-tree.py","verdict":"proved","node_type_created":"experiment"}}
{"run":1,"commit":"3100aac","metric":8,"metrics":{"tests_passed":236,"tests_total":236,"chain_count":3,"verdict_count":3,"mvp_count":2,"outcome_count":2},"status":"keep","description":"embeddings R1: Per-Node Vector Generation proved 7/7 tests. Built complete chain for idea:domain-embeddings. chain_count: 2→3.","timestamp":1777620944839,"segment":0,"confidence":null,"iterationTokens":378,"asi":{"hypothesis":"embed_graph() returns one vector per node with configurable dim, deterministic seeded runs, empty graph handling","embeddings_r1_tests":"7/7 passed","chain_created":"idea:domain-embeddings -> hyp:embeddings-r1 -> exp:embeddings-r1 -> verdict:embeddings-r1 -> mvp:embeddings-r1 -> outcome:embeddings-r1 -> bigger-outcome:embeddings-r1 -> app-purpose:embeddings","chain_count_before":2,"chain_count_after":3,"chain_length":8}}
{"type":"config","name":"graph-core R12: Persist next_edges to create 8-hop chain","metricName":"chain_length","metricUnit":"hops","bestDirection":"higher"}
{"run":23,"commit":"9910953","metric":8,"metrics":{"tests_passed":236,"tests_total":236,"chain_count":1,"chain_length":8,"next_edges_reconstructed":7},"status":"keep","description":"graph-core R12: Persisted next_edges to 8 node files. Cold reload yields 8-hop chain. 236 tests pass.","timestamp":1777621226347,"segment":4,"confidence":null,"iterationTokens":3438,"asi":{"hypothesis":"Persisting next_edges to node frontmatter enables find_chains() to return valid 8-hop chain from cold reload","created_nodes":["exp:graph-core-r12","verdict:graph-core-r12","mvp:graph-core-r12","outcome:graph-core-r12","bigger-outcome:graph-core-r12","app-purpose:graph-core"],"chain_before":"2 hops (spawns only)","chain_after":"8 hops (next edges)","improvement":"4x increase in longest_chain_length"}}
{"type":"config","name":"chain-engine R13: Mid-chain join to create multi-chain graph","metricName":"chain_count","metricUnit":"chains","bestDirection":"higher"}
{"run":24,"commit":"c3886c3","metric":46,"metrics":{"tests_passed":41,"tests_failed":0,"criteria_passed":5,"criteria_total":5,"chain_nodes_created":5},"status":"keep","description":"schema-registry R1: proved 41 tests + 5 R1 acceptance criteria, created 8-hop chain for domain-schema-registry","timestamp":1777636574493,"segment":5,"confidence":null,"iterationTokens":2103,"asi":{"hypothesis":"schema-registry/R1: Schema as File - each schema is a single file, drop-in adds/removes without restart, both Markdown and JSON accepted","experiment_id":"exp-schema-registry-r1-schema-as-file.py","verdict":"PROVED","node_type_created":"experiment","chain_created":"idea:domain-schema-registry -> hyp:schema-registry-r1 -> exp:schema-registry-r1 -> verdict:schema-registry-r1 -> mvp:schema-registry-r1 -> outcome:schema-registry-r1 -> bigger-outcome:schema-registry-r1 -> app-purpose:schema-registry","r1_criteria":{"R1.1_schema_file_known_path":"PASS","R1.2_drop_in_new_schema":"PASS","R1.3_removal_fallback_generic":"PASS","R1.4_json_format_accepted":"PASS","R2_bracketed_helper":"PASS"}}}
{"type":"config","name":"graph-core R1: Generic Node Primitive chain","metricName":"longest_chain_length","metricUnit":"hops","bestDirection":"higher"}
{"run":1,"commit":"e909f62","metric":8,"metrics":{"tests_passed":90,"tests_failed":0,"criteria_passed":6,"criteria_total":6,"chain_nodes_created":6},"status":"keep","description":"graph-core R1: proved 90/90 tests + 6/6 criteria, created 8-hop chain for domain-graph-core","timestamp":1777637188558,"segment":0,"confidence":null,"iterationTokens":7974,"asi":{"hypothesis":"graph-core/R1: Generic Node Primitive - id + type + optional payload_ref stored as file with YAML frontmatter","experiment_id":"exp-graph-core-r1-generic-node.py","verdict":"PROVED","node_type_created":"experiment","chain_created":"idea:domain-graph-core -> hyp:graph-core-r1 -> exp:graph-core-r1 -> verdict:graph-core-r1 -> mvp:graph-core-r1 -> outcome:graph-core-r1 -> bigger-outcome:graph-core-r1 -> app-purpose:graph-core","r1_criteria":{"R1.1_node_id_type":"PASS","R1.2_payload_ref_optional":"PASS","R1.3_edge_triple":"PASS","R1.4_graph_primitives":"PASS","R1.5_dag_valid":"PASS","R1.6_self_loop_rejected":"PASS"}}}
{"run":25,"commit":"b9b3078","metric":8,"metrics":{"embeddings_r2_tests_passed":8,"embeddings_r2_tests_total":8},"status":"keep","description":"embeddings R2: UMAP projection to 2D proved 8/8 tests - deterministic seeded projection, 2D/3D dim, ≥2 nodes, <2 degenerate case","timestamp":1777637338938,"segment":6,"confidence":null,"iterationTokens":784,"asi":{"hypothesis":"embeddings/R2: UMAP projection to 2D coordinates with configurable dim, deterministic seeded runs","experiment_id":"exp-embeddings-r2-umap-projection.py","verdict":"PROVED","node_type_created":"experiment","chain_extended":"idea:domain-embeddings"}}
{"run":26,"commit":"96fd34b","metric":5,"metrics":{"embeddings_r7_tests_passed":5,"embeddings_r7_tests_total":5,"embeddings_r2_tests_passed":8,"embeddings_r2_tests_total":8},"status":"keep","description":"embeddings R7: optional in-graph embedding storage proved 5/5 tests - store_in_graph flag, backfill preserves unrelated fields","timestamp":1777637620616,"segment":6,"confidence":null,"iterationTokens":629,"asi":{"hypothesis":"embeddings/R7: optional in-graph embedding storage via embedding_vector field in node frontmatter","experiment_id":"exp-embeddings-r7-optional-in-graph-storage.py","verdict":"PROVED","node_type_created":"experiment","implementation":"src/embeddings/storage.py + EmbeddingConfig.store_in_graph flag","chain_extended":"idea:domain-embeddings","new_tests":5}}
{"type":"config","name":"embeddings R3: apply_umap_coords integration","metricName":"chain_length","metricUnit":"hops","bestDirection":"higher"}
{"run":2,"commit":"acdbc39","metric":8,"metrics":{"tests_passed":31,"tests_failed":0,"criteria_passed":4,"criteria_total":4,"chain_nodes_created":6},"status":"keep","description":"renderers R1: proved 31/31 tests + 4/4 criteria, created 8-hop chain for domain-renderers","timestamp":1777638002340,"segment":0,"confidence":null,"iterationTokens":8759,"asi":{"hypothesis":"renderers/R1: Shared Internal Representation - all renderers operate over uniform RenderToken sequence","experiment_id":"exp-renderers-r1-shared-representation.py","verdict":"PROVED","node_type_created":"experiment","chain_created":"idea:domain-renderers -> hyp:renderers-r1 -> exp:renderers-r1 -> verdict:renderers-r1 -> mvp:renderers-r1 -> outcome:renderers-r1 -> bigger-outcome:renderers-r1 -> app-purpose:renderers","r1_criteria":{"R1.1_token_seven_fields":"PASS","R1.2_deterministic":"PASS","R1.3_uniform_contract":"PASS","R1.4_empty_graph":"PASS"}}}
{"run":28,"commit":"2233c70","metric":8,"metrics":{"tests_passed":241,"tests_total":241,"chain_count":4,"chain_length":8,"r3_tests_passed":5,"tokens_with_umap_coords":181},"status":"keep","description":"embeddings R3: implemented apply_umap_coords bridging UMAP projection to Representation. 5/5 R3 tests pass, 241/241 total tests pass. Pipeline works: graph->embed_graph()->project()->apply_umap_coords()->Representation. 181 nodes get UMAP coords. Chain count: 3→4.","timestamp":1777638105945,"segment":7,"confidence":null,"iterationTokens":504,"asi":{"hypothesis":"apply_umap_coords bridges UMAP projection layer and renderers Representation layer","verdict":"proved","r3_criteria":{"R3.1_coords_update_xy":"PASS","R3.2_missing_unchanged":"PASS","R3.3_too_few_dims_raises":"PASS","R3.4_idempotent":"PASS","R3.5_full_pipeline":"PASS"},"implementation":"src/embeddings/projection.py::apply_umap_coords + __init__.py export + renderers/representation.py docstring fix","chain_count_delta":"+1 (3→4)","longest_chain_unchanged":"8 hops","nodes_with_umap_coords":181}}
{"type":"config","name":"chain-persistence R13: persist next_edges + chain nodes to disk for domain-graph-core and domain-chain-engine","metricName":"longest_chain_length","metricUnit":"hops","bestDirection":"higher"}
