{"type":"message","id":"8c02dee0","parentId":"0c3f1576","timestamp":"2026-04-30T07:59:23.986Z","message":{"role":"assistant","content":[{"type":"thinking","thinking":"The sessions/ directory has many session jsonl files. Let me look at what's remaining for data parsing. The ideas.md says:\n- Parse knowledge/ directory (15 files)\n- Parse handoff/ directory (9 files)\n- Parse archive/ directory (5 files)\n\nBut those don't exist in .hermes/agi. Let me check if there's a belam-codex repo or other places with those.\n\nAlso, the primary metric is at 0.03ms - the noise floor. The session is looking at trying to find remaining data sources. Let me check the current graph_builder more thoroughly and see what could be parsed.","thinkingSignature":"03253c3f963729d5164f56a4fdf9379930fceeaa9f54124e5f6cb28552b460ff"},{"type":"toolCall","id":"call_function_e2b6kk7xutul_1","name":"read","arguments":{"path":"/home/ubuntu/.hermes/agi/graph_builder.py","offset":250,"limit":200}}],"api":"anthropic-messages","provider":"minimax","model":"MiniMax-M2.7","usage":{"input":28970,"output":184,"cacheRead":10071,"cacheWrite":0,"totalTokens":39225,"cost":{"input":0.008690999999999999,"output":0.0002208,"cacheRead":0.0006042599999999999,"cacheWrite":0,"total":0.00951606}},"stopReason":"toolUse","timestamp":1777535957819,"responseId":"06423ed6d3090f1e22aefaed27035dd4"}}
{"type":"message","id":"b2a5de31","parentId":"8c02dee0","timestamp":"2026-04-30T07:59:23.989Z","message":{"role":"toolResult","toolCallId":"call_function_e2b6kk7xutul_1","toolName":"read","content":[{"type":"text","text":"                        pass\n\n            return count\n        except (json.JSONDecodeError, Exception):\n            return 0\n\n    def parse_decisions(self, decisions_dir: str, limit: int = 20) -> int:\n        \"\"\"Parse decision files into graph nodes.\"\"\"\n        if not os.path.isdir(decisions_dir):\n            return 0\n\n        files = sorted(os.listdir(decisions_dir), reverse=True)[:limit]\n        count = 0\n        for filename in files:\n            if not filename.endswith('.md'):\n                continue\n            filepath = os.path.join(decisions_dir, filename)\n            try:\n                with open(filepath, \"r\") as f:\n                    content = f.read()\n\n                # Extract frontmatter\n                fm_match = _RE_FRONT_MATTER.match(content)\n                meta = {}\n                if fm_match:\n                    for line in fm_match.group(1).split('\\n'):\n                        m = _RE_YAML_PAIR.match(line)\n                        if m:\n                            meta[m.group(1)] = m.group(2)\n\n                # Extract decision title\n                title_match = re.search(r'^#\\s+(.+)$', content, re.MULTILINE)\n                title = title_match.group(1)[:60] if title_match else filename[:-3]\n\n                # Extract key rationale\n                rationale_match = re.search(r'Decision\\s*\\n\\n(.+?)(?:\\n\\n|##)', content, re.DOTALL)\n                rationale = rationale_match.group(1).strip()[:100] if rationale_match else \"\"\n\n                status = meta.get('status', 'draft')\n                decision_id = self.add_node(\n                    \"decision\",\n                    title,\n                    rationale,\n                    f\"decisions/{filename}\",\n                    f\"decision_{filename[:-3]}\"\n                )\n                count += 1\n\n                # Skip tag nodes - not needed for core graph, saves nodes/edges\n\n            except Exception:\n                pass\n        return count\n\n    def parse_lessons(self, lessons_dir: str, limit: int = 20) -> int:\n        \"\"\"Parse lesson files into graph nodes.\"\"\"\n        if not os.path.isdir(lessons_dir):\n            return 0\n\n        files = sorted(os.listdir(lessons_dir), reverse=True)[:limit]\n        count = 0\n        for filename in files:\n            if not filename.endswith('.md'):\n                continue\n            filepath = os.path.join(lessons_dir, filename)\n            try:\n                with open(filepath, \"r\") as f:\n                    content = f.read()\n\n                # Extract frontmatter\n                fm_match = _RE_FRONT_MATTER.match(content)\n                meta = {}\n                if fm_match:\n                    for line in fm_match.group(1).split('\\n'):\n                        m = _RE_YAML_PAIR.match(line)\n                        if m:\n                            meta[m.group(1)] = m.group(2)\n\n                # Extract lesson title\n                title_match = re.search(r'^#\\s+(.+)$', content, re.MULTILINE)\n                title = title_match.group(1)[:60] if title_match else filename[:-3]\n\n                # Extract lesson summary\n                lesson_match = re.search(r'## Lesson\\s*\\n\\n(.+?)(?:\\n\\n|##)', content, re.DOTALL)\n                lesson_text = lesson_match.group(1).strip()[:100] if lesson_match else \"\"\n\n                self.add_node(\n                    \"lesson\",\n                    title,\n                    lesson_text,\n                    f\"lessons/{filename}\",\n                    f\"lesson_{filename[:-3]}\"\n                )\n                count += 1\n\n            except Exception:\n                pass\n        return count\n\n    def parse_tasks(self, tasks_dir: str, limit: int = 50) -> int:\n        \"\"\"Parse task files into graph nodes with status/priority edges.\"\"\"\n        if not os.path.isdir(tasks_dir):\n            return 0\n\n        files = sorted(os.listdir(tasks_dir), reverse=True)\n        # Filter to .md files only\n        md_files = [f for f in files if f.endswith('.md')][:limit]\n\n        task_ids = {}  # filename -> node_id for dependency linking\n        count = 0\n\n        for filename in md_files:\n            filepath = os.path.join(tasks_dir, filename)\n            try:\n                with open(filepath, \"r\") as f:\n                    content = f.read()\n\n                # Extract frontmatter\n                fm_match = _RE_FRONT_MATTER.match(content)\n                meta = {}\n                if fm_match:\n                    for line in fm_match.group(1).split('\\n'):\n                        m = _RE_YAML_PAIR.match(line)\n                        if m:\n                            meta[m.group(1)] = m.group(2)\n\n                # Extract task title\n                title_match = re.search(r'^#\\s+(.+)$', content, re.MULTILINE)\n                title = title_match.group(1)[:60] if title_match else filename[:-3]\n\n                # Extract goal summary (first paragraph after frontmatter)\n                goal_match = re.search(r'### Goal\\s*\\n\\n(.+?)(?:\\n\\n|##)', content, re.DOTALL)\n                goal_text = goal_match.group(1).strip()[:100] if goal_match else \"\"\n\n                status = meta.get('status', 'open')\n                priority = meta.get('priority', 'medium')\n                created = meta.get('created', '')\n\n                # Summary label: title + status\n                label = f\"{title[:50]}\"\n                summary = f\"{status}|{priority}|{created[:10]}|{goal_text[:40]}\"\n\n                task_key = filename[:-3]  # strip .md\n                task_id = self.add_node(\n                    \"task\",\n                    label,\n                    summary,\n                    f\"tasks/{filename}\",\n                    f\"task_{task_key[:50]}\"\n                )\n                task_ids[task_key] = task_id\n                count += 1\n\n            except Exception:\n                pass\n\n        # Second pass: add depends_on edges\n        for filename in md_files:\n            filepath = os.path.join(tasks_dir, filename)\n            try:\n                with open(filepath, \"r\") as f:\n                    content = f.read()\n                fm_match = _RE_FRONT_MATTER.match(content)\n                if not fm_match:\n                    continue\n                meta = {}\n                for line in fm_match.group(1).split('\\n'):\n                    m = _RE_YAML_PAIR.match(line)\n                    if m:\n                        meta[m.group(1)] = m.group(2)\n\n                dep_str = meta.get('depends_on', '').strip('[] ')\n                if not dep_str:\n                    continue\n\n                depends = [d.strip().strip(\"'\").strip('\"') for d in dep_str.split(',') if d.strip()]\n                src_key = filename[:-3]\n                src_id = task_ids.get(src_key)\n                if not src_id:\n                    continue\n\n                for dep in depends:\n                    dep_id = task_ids.get(dep)\n                    if dep_id:\n                        self.add_edge(src_id, dep_id, \"depends_on\")\n\n            except Exception:\n                pass\n\n        return count\n\n    def parse_goals(self, goals_dir: str) -> int:\n        \"\"\"Parse goal files into graph nodes with status/urgency metadata.\"\"\"\n        if not os.path.isdir(goals_dir):\n            return 0\n\n        files = sorted(os.listdir(goals_dir))\n        md_files = [f for f in files if f.endswith('.md')]\n        count = 0\n\n\n[694 more lines in file. Use offset=450 to continue.]"}],"isError":false,"timestamp":1777535963988}}
{"type":"message","id":"2e4a7628","parentId":"b2a5de31","timestamp":"2026-04-30T07:59:28.446Z","message":{"role":"assistant","content":[{"type":"thinking","thinking":"Let me look at the build_graph function and the parse_canvas methods to understand the current state better.","thinkingSignature":"6ff0d219ac4bdb42854479783e7983550b426e66cd081c926028934bd12da2f2"},{"type":"toolCall","id":"call_function_7ezrx4rfsz9g_1","name":"read","arguments":{"path":"/home/ubuntu/.hermes/agi/graph_builder.py","offset":450,"limit":200}}],"api":"anthropic-messages","provider":"minimax","model":"MiniMax-M2.7","usage":{"input":30751,"output":78,"cacheRead":10071,"cacheWrite":0,"totalTokens":40900,"cost":{"input":0.009225299999999999,"output":0.0000936,"cacheRead":0.0006042599999999999,"cacheWrite":0,"total":0.009923159999999999}},"stopReason":"toolUse","timestamp":1777535963989,"responseId":"06423edc9ca4eb045aa6e294cb60f406"}}
{"type":"message","id":"2159572e","parentId":"2e4a7628","timestamp":"2026-04-30T07:59:28.449Z","message":{"role":"toolResult","toolCallId":"call_function_7ezrx4rfsz9g_1","toolName":"read","content":[{"type":"text","text":"        for filename in md_files:\n            filepath = os.path.join(goals_dir, filename)\n            try:\n                with open(filepath, \"r\") as f:\n                    content = f.read()\n\n                # Extract frontmatter\n                fm_match = _RE_FRONT_MATTER.match(content)\n                meta = {}\n                if fm_match:\n                    for line in fm_match.group(1).split('\\n'):\n                        m = _RE_YAML_PAIR.match(line)\n                        if m:\n                            meta[m.group(1)] = m.group(2)\n\n                # Extract goal title\n                title_match = re.search(r'^#\\s+(.+)$', content, re.MULTILINE)\n                title = title_match.group(1)[:60] if title_match else filename[:-3]\n\n                # Extract \"Why Critical\" or first section for context\n                why_match = re.search(r'## Why[\\s\\S]*?\\n\\n(.+?)(?:\\n\\n|##)', content)\n                why_text = why_match.group(1).strip()[:100] if why_match else \"\"\n\n                status = meta.get('status', 'unknown')\n                priority = meta.get('priority', 'medium')\n                created = meta.get('created', '')\n\n                label = title[:50]\n                summary = f\"{status}|{priority}|{created[:10]}|{why_text[:40]}\"\n\n                self.add_node(\n                    \"goal\",\n                    label,\n                    summary,\n                    f\"goals/{filename}\",\n                    f\"goal_{filename[:-3]}\"\n                )\n                count += 1\n\n            except Exception:\n                pass\n        return count\n\n    def parse_agent_roles(self, agents_dir: str) -> int:\n        \"\"\"Parse agent role definition files into graph nodes.\"\"\"\n        if not os.path.isdir(agents_dir):\n            return 0\n\n        files = sorted(os.listdir(agents_dir))\n        md_files = [f for f in files if f.endswith('.md')]\n        count = 0\n        agent_ids = {}  # agent_id -> node_id for communication edges\n\n        for filename in md_files:\n            filepath = os.path.join(agents_dir, filename)\n            try:\n                with open(filepath, \"r\") as f:\n                    content = f.read()\n\n                # Extract frontmatter\n                fm_match = _RE_FRONT_MATTER.match(content)\n                meta = {}\n                if fm_match:\n                    for line in fm_match.group(1).split('\\n'):\n                        m = _RE_YAML_PAIR.match(line)\n                        if m:\n                            meta[m.group(1)] = m.group(2)\n\n                agent_id = meta.get('agent_id', filename[:-3])\n                role = meta.get('role', '')\n                model = meta.get('model', '')\n                status = meta.get('status', 'unknown')\n                skills = meta.get('skills', '')\n\n                # Extract agent title\n                title_match = re.search(r'^#\\s+Agent:\\s*(.+)$', content, re.MULTILINE)\n                title = title_match.group(1).strip()[:60] if title_match else agent_id\n\n                label = title[:50]\n                summary = f\"{status}|{role[:30]}|{model[:30]}|{skills[:30]}\"\n\n                agent_id_key = filename[:-3]  # strip .md\n                node_id = self.add_node(\n                    \"agent_role\",\n                    label,\n                    summary,\n                    f\"agents/{filename}\",\n                    f\"agent_{agent_id_key}\"\n                )\n                agent_ids[agent_id] = node_id\n                count += 1\n\n                # Extract \"What I Do\" sections for actionable items\n                does_match = re.search(r'## What I Do\\s*\\n([\\s\\S]+?)(?:##|\\Z)', content)\n                if does_match:\n                    for line in does_match.group(1).split('\\n'):\n                        if line.strip().startswith('✅') or line.strip().startswith('-'):\n                            action = line.strip().lstrip('✅- ').strip()[:60]\n                            if len(action) > 5:\n                                action_id = self.add_node(\n                                    \"agent_capability\",\n                                    action[:60],\n                                    \"\",\n                                    f\"agents/{filename}\",\n                                    f\"cap_{agent_id_key}_{hash(action) & 0xFFFF}\"\n                                )\n                                self.add_edge(node_id, action_id, \"can_do\")\n                                count += 1\n\n                # Extract \"What I Do NOT Do\" sections\n                not_does_match = re.search(r'## What I Do NOT Do\\s*\\n([\\s\\S]+?)(?:##|\\Z)', content)\n                if not_does_match:\n                    for line in not_does_match.group(1).split('\\n'):\n                        if line.strip().startswith('❌') or line.strip().startswith('-'):\n                            action = line.strip().lstrip('❌- ').strip()[:60]\n                            if len(action) > 5:\n                                action_id = self.add_node(\n                                    \"agent_boundary\",\n                                    action[:60],\n                                    \"\",\n                                    f\"agents/{filename}\",\n                                    f\"bound_{agent_id_key}_{hash(action) & 0xFFFF}\"\n                                )\n                                self.add_edge(node_id, action_id, \"refuses_to\")\n                                count += 1\n\n            except Exception:\n                pass\n\n        # Second pass: add communication edges between agents\n        for filename in md_files:\n            filepath = os.path.join(agents_dir, filename)\n            try:\n                with open(filepath, \"r\") as f:\n                    content = f.read()\n                fm_match = _RE_FRONT_MATTER.match(content)\n                if not fm_match:\n                    continue\n                meta = {}\n                for line in fm_match.group(1).split('\\n'):\n                    m = _RE_YAML_PAIR.match(line)\n                    if m:\n                        meta[m.group(1)] = m.group(2)\n\n                agent_id = meta.get('agent_id', filename[:-3])\n                src_id = agent_ids.get(agent_id)\n                if not src_id:\n                    continue\n\n                # Parse communicates_with: [architect, critic, builder]\n                comm_str = meta.get('communicates_with', '').strip('[] ')\n                if not comm_str:\n                    continue\n\n                peers = [c.strip().strip(\"'\").strip('\"') for c in comm_str.split(',') if c.strip()]\n                for peer in peers:\n                    tgt_id = agent_ids.get(peer)\n                    if tgt_id:\n                        self.add_edge(src_id, tgt_id, \"communicates_with\")\n\n            except Exception:\n                pass\n\n        return count\n\n    def parse_canvas_graph(self, canvas_dir: str) -> Tuple[int, int]:\n        \"\"\"Parse canvas graph_data.json with pre-computed cross-primitive edges.\n        \n        Returns (nodes_added, edges_added). Adds 105 nodes (lesson, decision, task,\n        project, pipeline, command, skill, knowledge) and 8 causal edges from\n        LLM-judged relationship data.\n        \"\"\"\n        graph_file = os.path.join(canvas_dir, \"graph_data.json\")\n        if not os.path.exists(graph_file):\n            return 0, 0\n\n        try:\n            with open(graph_file) as f:\n                data = json.load(f)\n        except Exception:\n            return 0, 0\n\n        canvas_nodes = data.get('nodes', [])\n        canvas_edges = data.get('edges', [])\n\n        if not canvas_nodes:\n            return 0, 0\n\n        # Build ID mapping: canvas slug -> our node_id\n        # Canvas format: 'decision/belam-codex-resurrection'\n        # Our format: 'decision_belam-codex-resurrection' or 'decision_belam_codex_resurrection'\n        slug_to_id = {}\n        id_type_map = {}  # canvas_id -> (type_label, node_id)\n\n        nodes_added = 0\n        for cn in canvas_nodes:\n            canvas_id = cn.get('id', '')\n            node_type = cn.get('type', 'primitive')\n            title = cn.get('title', canvas_id)[:60]\n            tags = ','.join(cn.get('tags', [])[:5])[:60]\n\n[494 more lines in file. Use offset=650 to continue.]"}],"isError":false,"timestamp":1777535968449}}
{"type":"message","id":"e3e4164d","parentId":"2159572e","timestamp":"2026-04-30T07:59:36.645Z","message":{"role":"assistant","content":[{"type":"thinking","thinking":"Now I understand the current state. The primary metric is at 0.03ms noise floor. Let me look at what's left to explore. The ideas.md mentions:\n\nRemaining data sources:\n- knowledge/ directory (15 files) - doesn't exist in .hermes/agi\n- handoff/ directory (9 files) - doesn't exist\n- archive/ directory (5 files) - doesn't exist\n- canvas mapper_batch files\n\nSince the primary metric is saturated at 0.03ms, and the remaining data sources don't exist, I should look for something else to try. Let me check if there are any other parsing opportunities, or look at the benchmark to see if there are any secondary metrics to optimize.\n\nLet me look at the remaining parts of graph_builder.py and the benchmark.","thinkingSignature":"80b2df5b77a5a4825c7e1dd909596658f5971908a90d287efd8cf12fb2819630"},{"type":"toolCall","id":"call_function_7pxg80hdljwv_1","name":"read","arguments":{"path":"/home/ubuntu/.hermes/agi/graph_builder.py","offset":650,"limit":300}}],"api":"anthropic-messages","provider":"minimax","model":"MiniMax-M2.7","usage":{"input":32565,"output":216,"cacheRead":10071,"cacheWrite":0,"totalTokens":42852,"cost":{"input":0.0097695,"output":0.0002592,"cacheRead":0.0006042599999999999,"cacheWrite":0,"total":0.01063296}},"stopReason":"toolUse","timestamp":1777535968450,"responseId":"06423ee0f25e7ee06a18eaa04276b10f"}}
