{"type":"message","id":"b05fb3d1","parentId":"b7731e0b","timestamp":"2026-04-30T08:32:02.889Z","message":{"role":"assistant","content":[{"type":"thinking","thinking":"The mapper_batch files are raw LLM prompts (relationship judgment tasks), not responses. The ideas doc already marked this as \"SKIP (raw LLM prompts, not parseable without LLM)\".\n\nLet me look for other data sources. Looking at the ideas backlog again:\n- Parse machinelearning/ for cross-repo graph edges — SKIP (doesn't exist)- Parse archive/codex-layer-v1-modules/*.py — DONE\n- Mermaid diagram output — could add\n- pi /tree adapter integration — broken, could fix\n\nSince the primary metric is saturated, let me focus on adding something that improves secondary metrics or structural richness without affecting the primary metric.\n\nLooking at what's been tried:\n1. The pi_tree_adapter.py is broken (accessing tuples as dicts)\n2. There could be other directories to parse\n\nLet me check if there's a skills directory or other sources worth parsing:","thinkingSignature":"507d2a5584a1c3f74b73a3c1d348a264c4d28cac43092e3c6f75965756afc548"},{"type":"toolCall","id":"call_function_shfvpe1zbhlv_1","name":"bash","arguments":{"command":"ls /home/ubuntu/.hermes/skills/ 2>/dev/null"}},{"type":"toolCall","id":"call_function_shfvpe1zbhlv_2","name":"bash","arguments":{"command":"cat /home/ubuntu/.hermes/skills/github/github-code-review/SKILL.md 2>/dev/null | head -30"}}],"api":"anthropic-messages","provider":"minimax","model":"MiniMax-M2.7","usage":{"input":28231,"output":267,"cacheRead":10071,"cacheWrite":0,"totalTokens":38569,"cost":{"input":0.008469299999999999,"output":0.0003204,"cacheRead":0.0006042599999999999,"cacheWrite":0,"total":0.00939396}},"stopReason":"toolUse","timestamp":1777537911572,"responseId":"06424677d8581e1c881dc6c23a517e6f"}}
{"type":"message","id":"a65ff4a3","parentId":"b05fb3d1","timestamp":"2026-04-30T08:32:02.901Z","message":{"role":"toolResult","toolCallId":"call_function_shfvpe1zbhlv_1","toolName":"bash","content":[{"type":"text","text":"apple\nautonomous-ai-agents\ncommunication\ncreative\ndata-science\ndevops\ndiagramming\ndogfood\ndomain\nemail\nfeeds\ngaming\ngifs\ngithub\ninference-sh\nleisure\nmcp\nmedia\nmlops\nnote-taking\nproductivity\nred-teaming\nresearch\nsmart-home\nsocial-media\nsoftware-development\n"}],"isError":false,"timestamp":1777537922901}}
{"type":"message","id":"a701a6ff","parentId":"a65ff4a3","timestamp":"2026-04-30T08:32:02.902Z","message":{"role":"toolResult","toolCallId":"call_function_shfvpe1zbhlv_2","toolName":"bash","content":[{"type":"text","text":"---\nname: github-code-review\ndescription: Review code changes by analyzing git diffs, leaving inline comments on PRs, and performing thorough pre-push review. Works with gh CLI or falls back to git + GitHub REST API via curl.\nversion: 1.1.0\nauthor: Hermes Agent\nlicense: MIT\nmetadata:\n  hermes:\n    tags: [GitHub, Code-Review, Pull-Requests, Git, Quality]\n    related_skills: [github-auth, github-pr-workflow]\n---\n\n# GitHub Code Review\n\nPerform code reviews on local changes before pushing, or review open PRs on GitHub. Most of this skill uses plain `git` — the `gh`/`curl` split only matters for PR-level interactions.\n\n## Prerequisites\n\n- Authenticated with GitHub (see `github-auth` skill)\n- Inside a git repository\n\n### Setup (for PR interactions)\n\n```bash\nif command -v gh &>/dev/null && gh auth status &>/dev/null; then\n  AUTH=\"gh\"\nelse\n  AUTH=\"git\"\n  if [ -z \"$GITHUB_TOKEN\" ]; then\n    if [ -f ~/.hermes/.env ] && grep -q \"^GITHUB_TOKEN=\" ~/.hermes/.env; then\n"}],"isError":false,"timestamp":1777537922902}}
{"type":"message","id":"a38e9fcf","parentId":"a701a6ff","timestamp":"2026-04-30T08:32:13.781Z","message":{"role":"assistant","content":[{"type":"thinking","thinking":"There are 26 skill categories in the skills directory. Each has a SKILL.md with metadata including related_skills. I could parse these to create a skill_graph with skill → related_skill edges.\n\nHowever, looking at the current node count (960 nodes), adding skill nodes might not significantly improve anything since the primary metric is saturated and lru_cache absorbs all data size.\n\nLet me think about what would be a good targeted change:\n\n1. **Fix pi_tree_adapter.py** — It's broken due to accessing tuples as dicts. This could improve integration but isn't measured.\n\n2. **Parse skills/ directory** — Add skill nodes and related_skill edges. This would increase node/edge counts but wouldn't affect primary metric.\n\n3. **Mermaid diagram output** — Add alternative visualization format.\n\nGiven that the primary metric is saturated and I need to make one targeted change:\n\nLet me focus on **parsing the skills/ directory** since:\n- It would add new node types (skill nodes)\n- It would create related_skill edges\n- It's not yet explored in the ideas backlog (as a concrete implementation)\n- lru_cache will absorb the additional parsing time\n\nLet me check the structure of a few skills to understand the metadata:","thinkingSignature":"565a63ff5536f6f27fe3f45af0bdd11c9d969f8449ee86cf9a1853c3af13fedf"},{"type":"toolCall","id":"call_function_rfy5zpdt833o_1","name":"bash","arguments":{"command":"ls /home/ubuntu/.hermes/skills/github/ 2>/dev/null"}},{"type":"toolCall","id":"call_function_rfy5zpdt833o_2","name":"bash","arguments":{"command":"ls /home/ubuntu/.hermes/skills/github/github-auth/ 2>/dev/null && cat /home/ubuntu/.hermes/skills/github/github-auth/SKILL.md 2>/dev/null | head -25"}}],"api":"anthropic-messages","provider":"minimax","model":"MiniMax-M2.7","usage":{"input":28855,"output":356,"cacheRead":10071,"cacheWrite":0,"totalTokens":39282,"cost":{"input":0.0086565,"output":0.0004272,"cacheRead":0.0006042599999999999,"cacheWrite":0,"total":0.00968796}},"stopReason":"toolUse","timestamp":1777537922904,"responseId":"064246833f7054c617f0313b90ea76b4"}}
{"type":"message","id":"e7dd469a","parentId":"a38e9fcf","timestamp":"2026-04-30T08:32:13.794Z","message":{"role":"toolResult","toolCallId":"call_function_rfy5zpdt833o_1","toolName":"bash","content":[{"type":"text","text":"DESCRIPTION.md\ncodebase-inspection\ngithub-auth\ngithub-code-review\ngithub-issues\ngithub-pr-workflow\ngithub-repo-management\n"}],"isError":false,"timestamp":1777537933794}}
{"type":"message","id":"1da5d743","parentId":"e7dd469a","timestamp":"2026-04-30T08:32:13.797Z","message":{"role":"toolResult","toolCallId":"call_function_rfy5zpdt833o_2","toolName":"bash","content":[{"type":"text","text":"SKILL.md\nscripts\n---\nname: github-auth\ndescription: Set up GitHub authentication for the agent using git (universally available) or the gh CLI. Covers HTTPS tokens, SSH keys, credential helpers, and gh auth — with a detection flow to pick the right method automatically.\nversion: 1.1.0\nauthor: Hermes Agent\nlicense: MIT\nmetadata:\n  hermes:\n    tags: [GitHub, Authentication, Git, gh-cli, SSH, Setup]\n    related_skills: [github-pr-workflow, github-code-review, github-issues, github-repo-management]\n---\n\n# GitHub Authentication Setup\n\nThis skill sets up authentication so the agent can work with GitHub repositories, PRs, issues, and CI. It covers two paths:\n\n- **`git` (always available)** — uses HTTPS personal access tokens or SSH keys\n- **`gh` CLI (if installed)** — richer GitHub API access with a simpler auth flow\n\n## Detection Flow\n\nWhen a user asks you to work with GitHub, run this check first:\n\n```bash\n# Check what's available\n"}],"isError":false,"timestamp":1777537933797}}
{"type":"message","id":"beae0734","parentId":"1da5d743","timestamp":"2026-04-30T08:32:20.381Z","message":{"role":"assistant","content":[{"type":"thinking","thinking":"Good. I can see the skills have:\n- name\n- description\n- version\n- metadata.hermes.tags\n- metadata.hermes.related_skills\n\nThis would be useful to add a `parse_skills` method to the graph_builder that:\n1. Parses all skills directories\n2. Creates skill nodes with type `skill`\n3. Creates `related_to` edges between skills based on related_skills metadata\n\nThis would add semantic knowledge about the skill ecosystem and create more inter-cluster edges.\n\nLet me implement this as a targeted change:","thinkingSignature":"cc8f65981c0118f4230a7427eb4fb9bb68970dea725e52bdd41e582dcacc90f6"},{"type":"text","text":"I'll add a `parse_skills` method to graph_builder.py to parse the skills/ directory. This adds skill nodes and creates `related_skill` edges based on metadata relationships.\n"},{"type":"toolCall","id":"call_function_xt4thyyk46eh_1","name":"read","arguments":{"path":"/home/ubuntu/.hermes/agi/graph_builder.py","offset":680,"limit":80}}],"api":"anthropic-messages","provider":"minimax","model":"MiniMax-M2.7","usage":{"input":29480,"output":206,"cacheRead":10071,"cacheWrite":0,"totalTokens":39757,"cost":{"input":0.008844,"output":0.0002472,"cacheRead":0.0006042599999999999,"cacheWrite":0,"total":0.00969546}},"stopReason":"toolUse","timestamp":1777537933799,"responseId":"0642468e39fedb939ecb741d2a9d9fa7"}}
{"type":"message","id":"977c870d","parentId":"beae0734","timestamp":"2026-04-30T08:32:20.384Z","message":{"role":"toolResult","toolCallId":"call_function_xt4thyyk46eh_1","toolName":"read","content":[{"type":"text","text":"    def parse_knowledge(self, knowledge_dir: str) -> int:\n        \"\"\"Parse knowledge files into graph nodes.\n        \n        Knowledge files have frontmatter with topic, tags, related, sources.\n        Each file becomes a knowledge node with tag and related edges.\n        \"\"\"\n        if not os.path.isdir(knowledge_dir):\n            return 0\n\n        files = sorted(os.listdir(knowledge_dir))\n        md_files = [f for f in files if f.endswith('.md')]\n        count = 0\n\n        for filename in md_files:\n            filepath = os.path.join(knowledge_dir, filename)\n            try:\n                with open(filepath, \"r\") as f:\n                    content = f.read()\n\n                # Extract frontmatter\n                fm_match = _RE_FRONT_MATTER.match(content)\n                meta = {}\n                if fm_match:\n                    for line in fm_match.group(1).split('\\n'):\n                        m = _RE_YAML_PAIR.match(line)\n                        if m:\n                            meta[m.group(1)] = m.group(2)\n\n                topic = meta.get('topic', filename[:-3])\n                tags_str = meta.get('tags', '[]')\n                related_str = meta.get('related', '[]')\n                created = meta.get('created', '')\n\n                # Extract first section body as content\n                body_match = re.search(r'## Claim\\s*\\n+(.+?)(?:\\n##|\\Z)', content, re.DOTALL)\n                body = body_match.group(1).strip()[:100] if body_match else \"\"\n\n                label = topic[:50]\n                summary = f\"tags:{tags_str[:60]}|related:{related_str[:40]}\"\n\n                node_id = self.add_node(\n                    \"knowledge\",\n                    label,\n                    summary,\n                    f\"knowledge/{filename}\",\n                    f\"knowledge_{filename[:-3]}\"\n                )\n                count += 1\n\n                # Parse related references as edges (to existing nodes)\n                if related_str and related_str != '[]':\n                    related_items = re.findall(r'(\\w+(?:-\\w+)*)', related_str)\n                    for rel in related_items[:5]:\n                        rel_id = self._find_or_add_reference(rel, f\"knowledge/{filename}\")\n                        if rel_id:\n                            self.add_edge(node_id, rel_id, \"related_to\")\n\n            except Exception:\n                pass\n        return count\n\n    def _find_or_add_reference(self, ref: str, source: str) -> Optional[str]:\n        \"\"\"Find existing node by slug-like reference or add a stub reference node.\"\"\"\n        # Convert slug to node ID format used in our graph\n        candidates = [\n            f\"decision_{ref.replace('/', '_')}\",\n            f\"lesson_{ref.replace('/', '_')}\",\n            f\"knowledge_{ref.replace('/', '_')}\",\n            f\"canvas_decision_{ref.replace('/', '_')}\",\n            f\"canvas_lesson_{ref.replace('/', '_')}\",\n        ]\n        for cid in candidates:\n            if cid in self._node_ids:\n                return cid\n        # Stub reference node\n        stub_id = f\"ref_{ref.replace('/', '_')[:50]}\"\n        if stub_id not in self._node_ids:\n            self.add_node(\"reference\", ref[:60], \"\", source, stub_id)\n        return stub_id\n\n\n[835 more lines in file. Use offset=760 to continue.]"}],"isError":false,"timestamp":1777537940384}}
{"type":"message","id":"5fef9d63","parentId":"977c870d","timestamp":"2026-04-30T08:32:44.606Z","message":{"role":"assistant","content":[{"type":"thinking","thinking":"Now I need to add a parse_skills method. Let me find a good insertion point - after parse_knowledge:","thinkingSignature":"77bff3fd4e9b60432c86a33d89133510b57ec3658cec80c83b45e8f0fe9a87aa"},{"type":"toolCall","id":"call_function_qpan64d0sg6e_1","name":"edit","arguments":{"path":"/home/ubuntu/.hermes/agi/graph_builder.py","edits":[{"oldText":"            except Exception:\n                pass\n        return count\n\n    def _find_or_add_reference(self, ref: str, source: str) -> Optional[str]:","newText":"            except Exception:\n                pass\n        return count\n\n    def parse_skills(self, skills_dir: str) -> int:\n        \"\"\"Parse hermes/skills/ directory into skill nodes with related_skill edges.\n        \n        Each skill category becomes a skill_type node.\n        Each individual skill becomes a skill node with tags and related_skill edges.\n        \"\"\"\n        if not os.path.isdir(skills_dir):\n            return 0\n\n        count = 0\n        skill_ids = {}  # skill_name -> node_id for related_skill edges\n        category_ids = {}  # category_name -> node_id\n\n        # First pass: create category and skill nodes\n        categories = sorted(os.listdir(skills_dir))\n        for category in categories:\n            category_path = os.path.join(skills_dir, category)\n            if not os.path.isdir(category_path):\n                continue\n\n            # Create category node\n            category_id = self.add_node(\n                \"skill_type\",\n                category,\n                f\"category: {category}\",\n                f\"skills/{category}\",\n                f\"skill_type_{category}\"\n            )\n            category_ids[category] = category_id\n            count += 1\n\n            # Find SKILL.md files (may be in subdirectories)\n            skill_mds = []\n            for root, _, files in os.walk(category_path):\n                for f in files:\n                    if f == 'SKILL.md':\n                        skill_mds.append(os.path.join(root, f))\n\n            for skill_md in skill_mds:\n                try:\n                    with open(skill_md, \"r\") as f:\n                        content = f.read()\n\n                    # Extract frontmatter\n                    fm_match = _RE_FRONT_MATTER.match(content)\n                    meta = {}\n                    if fm_match:\n                        for line in fm_match.group(1).split('\\n'):\n                            m = _RE_YAML_PAIR.match(line)\n                            if m:\n                                meta[m.group(1)] = m.group(2)\n\n                    skill_name = meta.get('name', os.path.basename(os.path.dirname(skill_md)))\n                    description = meta.get('description', '')[:80]\n                    tags_str = meta.get('tags', '[]')\n                    related_str = meta.get('related_skills', meta.get('related', '[]'))\n                    version = meta.get('version', '1.0.0')\n\n                    # Create skill node\n                    skill_node_id = self.add_node(\n                        \"skill\",\n                        skill_name[:50],\n                        description,\n                        f\"skills/{skill_md}\",\n                        f\"skill_{skill_name.replace('-', '_').replace(' ', '_')}\"\n                    )\n                    skill_ids[skill_name] = skill_node_id\n                    self.add_edge(category_id, skill_node_id, \"belongs_to\")\n                    count += 1\n\n                    # Parse related_skill references (add to queue for second pass)\n                    if related_str and related_str != '[]':\n                        related = re.findall(r'\\[?([\\w-]+)\\]?', related_str)\n                        for rel in related[:5]:\n                            rel_clean = rel.strip()\n                            if rel_clean != skill_name and rel_clean not in skill_ids:\n                                # Create stub skill node for related skill\n                                stub_id = self.add_node(\n                                    \"skill\",\n                                    rel_clean[:50],\n                                    f\"related_skill (stub)\",\n                                    f\"skills/{skill_md}\",\n                                    f\"skill_{rel_clean.replace('-', '_').replace(' ', '_')}\"\n                                )\n                                skill_ids[rel_clean] = stub_id\n                                count += 1\n\n                except Exception:\n                    pass\n\n        # Second pass: add related_skill edges between actual skill nodes\n        edges_added = 0\n        for category in categories:\n            category_path = os.path.join(skills_dir, category)\n            if not os.path.isdir(category_path):\n                continue\n\n            for root, _, files in os.walk(category_path):\n                for f in files:\n                    if f != 'SKILL.md':\n                        continue\n                    skill_md = os.path.join(root, f)\n                    try:\n                        with open(skill_md, \"r\") as fh:\n                            content = fh.read()\n\n                        fm_match = _RE_FRONT_MATTER.match(content)\n                        if not fm_match:\n                            continue\n                        meta = {}\n                        for line in fm_match.group(1).split('\\n'):\n                            m = _RE_YAML_PAIR.match(line)\n                            if m:\n                                meta[m.group(1)] = m.group(2)\n\n                        skill_name = meta.get('name', '')\n                        src_id = skill_ids.get(skill_name)\n                        if not src_id:\n                            continue\n\n                        related_str = meta.get('related_skills', meta.get('related', '[]'))\n                        if not related_str or related_str == '[]':\n                            continue\n\n                        related = re.findall(r'\\[?([\\w-]+)\\]?', related_str)\n                        for rel in related[:5]:\n                            rel_clean = rel.strip()\n                            tgt_id = skill_ids.get(rel_clean)\n                            if tgt_id and tgt_id != src_id:\n                                self.add_edge(src_id, tgt_id, \"related_skill\")\n                                edges_added += 1\n\n                    except Exception:\n                        pass\n\n        return count\n\n    def _find_or_add_reference(self, ref: str, source: str) -> Optional[str]:"}]}}],"api":"anthropic-messages","provider":"minimax","model":"MiniMax-M2.7","usage":{"input":30397,"output":1384,"cacheRead":10071,"cacheWrite":0,"totalTokens":41852,"cost":{"input":0.0091191,"output":0.0016607999999999998,"cacheRead":0.0006042599999999999,"cacheWrite":0,"total":0.01138416}},"stopReason":"toolUse","timestamp":1777537940385,"responseId":"06424694e28e78f79920c7a487f1b772"}}
