{"type":"message","id":"fb1a7923","parentId":"0d447a0b","timestamp":"2026-04-30T09:11:54.763Z","message":{"role":"assistant","content":[{"type":"thinking","thinking":"The experiment is logged. Let me provide the one-line summary as requested.","thinkingSignature":"c2eb85712a2024357a67142a08c681b9b8e4e0ae3e53bea7a9cc16e23d5c031c"},{"type":"text","text":"**iter-44 result: ✅ keep** — 0.03ms (1,451 nodes, 1,493 edges) — enhanced parse_templates with rich YAML metadata (role/action/session/cli) for template_stage nodes. Primary metric unchanged at noise floor."}],"api":"anthropic-messages","provider":"minimax","model":"MiniMax-M2.7","usage":{"input":60735,"output":74,"cacheRead":10071,"cacheWrite":0,"totalTokens":70880,"cost":{"input":0.0182205,"output":0.00008879999999999999,"cacheRead":0.0006042599999999999,"cacheWrite":0,"total":0.01891356}},"stopReason":"stop","timestamp":1777540310063,"responseId":"06424fd7f7bf41c6531cdcdab8731497"}}
{"type":"message","id":"b67d9c6a","parentId":"fb1a7923","timestamp":"2026-04-30T09:11:54.774Z","message":{"role":"user","content":[{"type":"text","text":"Autoresearch loop ended (likely context limit). Resume the experiment loop — read autoresearch.md and git log for context. Check autoresearch.ideas.md for promising paths to explore. Prune stale/tried ideas. Be careful not to overfit to the benchmarks and do not cheat on the benchmarks."}],"timestamp":1777540314766}}
