{"type":"message","id":"ea00464b","parentId":"d134ec2d","timestamp":"2026-04-30T08:59:19.756Z","message":{"role":"assistant","content":[{"type":"thinking","thinking":"Now I can see the exact text. Let me make the edits. The `build_adjacency` ends with `_precompute_key_paths()` on line 2055. I need to add a call to `_precompute_reachability` after it, and add the new methods.","thinkingSignature":"fc8266a6d48f3c492837758dd1f565716dfc54aef7aacf5f5dafe287a5d5805a"},{"type":"toolCall","id":"call_function_9xxvsl9pn6ho_1","name":"edit","arguments":{"path":"/home/ubuntu/.hermes/agi/graph_builder.py","edits":[{"oldText":"        # Pre-compute key paths for benchmark query (first→last section)\n        self._precompute_key_paths()\n\n    def _precompute_key_paths(self):","newText":"        # Pre-compute key paths for benchmark query (first→last section)\n        self._precompute_key_paths()\n        # Pre-compute reachability from hub nodes (cold build only; pickled with graph)\n        self._precompute_reachability(hub_count=32)\n\n    def _precompute_key_paths(self):"},{"oldText":"            self._precomputed_paths[(start, end)] = path\n\n    def _bfs_path(self, start_id: str, end_id: str) -> Optional[List[str]]:","newText":"            self._precomputed_paths[(start, end)] = path\n\n    def _precompute_reachability(self, hub_count: int = 32) -> None:\n        \"\"\"Pre-compute reachability from high-degree hub nodes.\n        \n        Enables O(1) reachability queries: 'is node X reachable from hub Y?'\n        Stored as hub_reachable[hub_id] = frozenset(reachable_node_ids).\n        Cold build cost: O(hub_count * (n + m)). Pickled with graph cache.\n        Warm load cost: 0 (just dict lookup).\n        \"\"\"\n        # Find hub nodes: highest degree (most connected)\n        degree = {}\n        for node_id in self._node_ids:\n            degree[node_id] = len(self.adj.get(node_id, []))\n        hubs = sorted(degree.keys(), key=lambda x: -degree[x])[:hub_count]\n\n        self.hub_reachable: Dict[str, frozenset] = {}\n        for hub in hubs:\n            reachable = self._bfs_reachable(hub)\n            self.hub_reachable[hub] = frozenset(reachable)\n\n    def _bfs_reachable(self, start_id: str) -> List[str]:\n        \"\"\"Return list of all nodes reachable from start_id via BFS.\"\"\"\n        from collections import deque\n        if start_id not in self._node_ids:\n            return []\n        visited = {start_id}\n        queue = deque([start_id])\n        while queue:\n            current = queue.popleft()\n            for neighbor in self.adj.get(current, []):\n                if neighbor not in visited:\n                    visited.add(neighbor)\n                    queue.append(neighbor)\n        return list(visited)\n\n    def _bfs_path(self, start_id: str, end_id: str) -> Optional[List[str]]:"}]}}],"api":"anthropic-messages","provider":"minimax","model":"MiniMax-M2.7","usage":{"input":24010,"output":702,"cacheRead":10071,"cacheWrite":0,"totalTokens":34783,"cost":{"input":0.007202999999999999,"output":0.0008424,"cacheRead":0.0006042599999999999,"cacheWrite":0,"total":0.00864966}},"stopReason":"toolUse","timestamp":1777539548735,"responseId":"06424cdd149bd1ae3446abc5c1ccac51"}}
{"type":"message","id":"d9149cb7","parentId":"ea00464b","timestamp":"2026-04-30T08:59:19.774Z","message":{"role":"toolResult","toolCallId":"call_function_9xxvsl9pn6ho_1","toolName":"edit","content":[{"type":"text","text":"Successfully replaced 2 block(s) in /home/ubuntu/.hermes/agi/graph_builder.py."}],"details":{"diff":"      ...\n 2052                 self.adj[edge[\"from\"]].append(edge[\"to\"])\n 2053                 self.adj[edge[\"to\"]].append(edge[\"from\"])\n 2054         # Pre-compute key paths for benchmark query (first→last section)\n 2055         self._precompute_key_paths()\n+2056         # Pre-compute reachability from hub nodes (cold build only; pickled with graph)\n+2057         self._precompute_reachability(hub_count=32)\n 2056 \n 2057     def _precompute_key_paths(self):\n 2058         \"\"\"Pre-compute BFS paths between key node pairs for O(1) query_time.\n 2059         \n      ...\n 2068             start, end = section_nodes[0], section_nodes[-1]\n 2069             path = self._bfs_path(start, end)\n 2070             self._precomputed_paths[(start, end)] = path\n 2071 \n+2074     def _precompute_reachability(self, hub_count: int = 32) -> None:\n+2075         \"\"\"Pre-compute reachability from high-degree hub nodes.\n+2076         \n+2077         Enables O(1) reachability queries: 'is node X reachable from hub Y?'\n+2078         Stored as hub_reachable[hub_id] = frozenset(reachable_node_ids).\n+2079         Cold build cost: O(hub_count * (n + m)). Pickled with graph cache.\n+2080         Warm load cost: 0 (just dict lookup).\n+2081         \"\"\"\n+2082         # Find hub nodes: highest degree (most connected)\n+2083         degree = {}\n+2084         for node_id in self._node_ids:\n+2085             degree[node_id] = len(self.adj.get(node_id, []))\n+2086         hubs = sorted(degree.keys(), key=lambda x: -degree[x])[:hub_count]\n+2087 \n+2088         self.hub_reachable: Dict[str, frozenset] = {}\n+2089         for hub in hubs:\n+2090             reachable = self._bfs_reachable(hub)\n+2091             self.hub_reachable[hub] = frozenset(reachable)\n+2092 \n+2093     def _bfs_reachable(self, start_id: str) -> List[str]:\n+2094         \"\"\"Return list of all nodes reachable from start_id via BFS.\"\"\"\n+2095         from collections import deque\n+2096         if start_id not in self._node_ids:\n+2097             return []\n+2098         visited = {start_id}\n+2099         queue = deque([start_id])\n+2100         while queue:\n+2101             current = queue.popleft()\n+2102             for neighbor in self.adj.get(current, []):\n+2103                 if neighbor not in visited:\n+2104                     visited.add(neighbor)\n+2105                     queue.append(neighbor)\n+2106         return list(visited)\n+2107 \n 2072     def _bfs_path(self, start_id: str, end_id: str) -> Optional[List[str]]:\n 2073         \"\"\"BFS path finder (used for pre-computation).\"\"\"\n 2074         from collections import deque\n 2075         if start_id not in self._node_ids or end_id not in self._node_ids:\n      ...","firstChangedLine":2056},"isError":false,"timestamp":1777539559773}}
{"type":"message","id":"065acc07","parentId":"d9149cb7","timestamp":"2026-04-30T08:59:25.782Z","message":{"role":"assistant","content":[{"type":"thinking","thinking":"Now I need to include `hub_reachable` in the pickle cache. Let me update `_save_graph_cache` to include it.","thinkingSignature":"d75f12484c8030b7b5f80c89b5a9b4455f00608b847d0802c1a56be408ca80f8"},{"type":"text","text":"Now include `hub_reachable` in the pickle cache:\n"},{"type":"toolCall","id":"call_function_qu187wabx18d_1","name":"edit","arguments":{"path":"/home/ubuntu/.hermes/agi/graph_builder.py","edits":[{"oldText":"        cached = {\n            'nodes': builder.nodes,\n            'edges': builder.edges,\n            'adj': dict(builder.adj),\n            '_node_ids': builder._node_ids,\n            '_gitnexus_cache': gitnexus_cache,\n            '_precomputed_paths': builder._precomputed_paths,\n        }","newText":"        cached = {\n            'nodes': builder.nodes,\n            'edges': builder.edges,\n            'adj': dict(builder.adj),\n            '_node_ids': builder._node_ids,\n            '_gitnexus_cache': gitnexus_cache,\n            '_precomputed_paths': builder._precomputed_paths,\n            'hub_reachable': getattr(builder, 'hub_reachable', {}),\n        }"}]}}],"api":"anthropic-messages","provider":"minimax","model":"MiniMax-M2.7","usage":{"input":24748,"output":251,"cacheRead":10071,"cacheWrite":0,"totalTokens":35070,"cost":{"input":0.007424399999999999,"output":0.0003012,"cacheRead":0.0006042599999999999,"cacheWrite":0,"total":0.00832986}},"stopReason":"toolUse","timestamp":1777539559775,"responseId":"06424ce86ec7b4018a342dae7962f2f4"}}
{"type":"message","id":"4f9c2219","parentId":"065acc07","timestamp":"2026-04-30T08:59:25.791Z","message":{"role":"toolResult","toolCallId":"call_function_qu187wabx18d_1","toolName":"edit","content":[{"type":"text","text":"Successfully replaced 1 block(s) in /home/ubuntu/.hermes/agi/graph_builder.py."}],"details":{"diff":"      ...\n 2225             'adj': dict(builder.adj),\n 2226             '_node_ids': builder._node_ids,\n 2227             '_gitnexus_cache': gitnexus_cache,\n 2228             '_precomputed_paths': builder._precomputed_paths,\n+2229             'hub_reachable': getattr(builder, 'hub_reachable', {}),\n 2229         }\n 2230         with open(cache_file, 'wb') as f:\n 2231             pickle.dump(cached, f, protocol=pickle.HIGHEST_PROTOCOL)\n 2232     except Exception:\n      ...","firstChangedLine":2229},"isError":false,"timestamp":1777539565791}}
{"type":"message","id":"dbe237e0","parentId":"4f9c2219","timestamp":"2026-04-30T08:59:30.220Z","message":{"role":"assistant","content":[{"type":"thinking","thinking":"Now let me also update the `_cached_build_builder` return to restore `hub_reachable` from the pickle if available (for the pickle cache fallback path):","thinkingSignature":"99c143a2fc311766483b68a20297c30cc670e02bd96e21cb14a31791959a0f70"},{"type":"text","text":"Now restore `hub_reachable` in the pickle fallback path:\n"},{"type":"toolCall","id":"call_function_8vczyhr0op3u_1","name":"read","arguments":{"path":"/home/ubuntu/.hermes/agi/graph_builder.py","offset":2150,"limit":20}}],"api":"anthropic-messages","provider":"minimax","model":"MiniMax-M2.7","usage":{"input":25035,"output":103,"cacheRead":10071,"cacheWrite":0,"totalTokens":35209,"cost":{"input":0.0075105,"output":0.0001236,"cacheRead":0.0006042599999999999,"cacheWrite":0,"total":0.00823836}},"stopReason":"toolUse","timestamp":1777539565792,"responseId":"06424cee253d7deff9f5db242a9a8cee"}}
{"type":"message","id":"3991e464","parentId":"dbe237e0","timestamp":"2026-04-30T08:59:30.223Z","message":{"role":"toolResult","toolCallId":"call_function_8vczyhr0op3u_1","toolName":"read","content":[{"type":"text","text":"    except Exception:\n        return \"\"\n\n\n# Graph pickle cache file\n_GRAPH_CACHE_FILE = None\nimport pickle  # Module-level for faster cache loads\n\ndef _get_graph_cache_file(agi_dir: str) -> str:\n    global _GRAPH_CACHE_FILE\n    if _GRAPH_CACHE_FILE is None:\n        _GRAPH_CACHE_FILE = os.path.join(agi_dir, \".graph_cache.pkl\")\n    return _GRAPH_CACHE_FILE\n\ndef _get_source_mtimes(hermes_dir: str) -> Dict[str, float]:\n    \"\"\"Collect modification times of all graph source files.\"\"\"\n    mtimes = {}\n    paths = [\n        os.path.join(hermes_dir, \"belam-codex\", \"AGENTS.md\"),\n    ]\n\n[349 more lines in file. Use offset=2170 to continue.]"}],"isError":false,"timestamp":1777539570223}}
{"type":"message","id":"84faac57","parentId":"3991e464","timestamp":"2026-04-30T08:59:33.586Z","message":{"role":"assistant","content":[{"type":"thinking","thinking":"I need to find the `_try_load_graph_cache` function to add hub_reachable restoration. Let me search for it.","thinkingSignature":"a408a91eb46986eed93e5fa7516a2fc691b305ff5f2bc6367a7e803b71a7e423"},{"type":"toolCall","id":"call_function_x6llzzd89y71_1","name":"bash","arguments":{"command":"grep -n \"_try_load_graph_cache\\|hub_reachable\" /home/ubuntu/.hermes/agi/graph_builder.py"}}],"api":"anthropic-messages","provider":"minimax","model":"MiniMax-M2.7","usage":{"input":25319,"output":75,"cacheRead":10071,"cacheWrite":0,"totalTokens":35465,"cost":{"input":0.0075956999999999995,"output":0.00008999999999999999,"cacheRead":0.0006042599999999999,"cacheWrite":0,"total":0.008289959999999999}},"stopReason":"toolUse","timestamp":1777539570225,"responseId":"06424cf2bf11c748470e83813266cb68"}}
{"type":"message","id":"b3eeef02","parentId":"84faac57","timestamp":"2026-04-30T08:59:33.596Z","message":{"role":"toolResult","toolCallId":"call_function_x6llzzd89y71_1","toolName":"bash","content":[{"type":"text","text":"2078:        Stored as hub_reachable[hub_id] = frozenset(reachable_node_ids).\n2088:        self.hub_reachable: Dict[str, frozenset] = {}\n2091:            self.hub_reachable[hub] = frozenset(reachable)\n2187:def _try_load_graph_cache(agi_dir: str, source_mtimes: Dict[str, float],\n2229:            'hub_reachable': getattr(builder, 'hub_reachable', {}),\n2386:    builder = _try_load_graph_cache(agi_dir, {}, gitnexus_cache)\n"}],"isError":false,"timestamp":1777539573596}}
{"type":"message","id":"4591a668","parentId":"b3eeef02","timestamp":"2026-04-30T08:59:36.831Z","message":{"role":"assistant","content":[{"type":"thinking","thinking":"I need to find and update the `_try_load_graph_cache` function to restore `hub_reachable`. Let me read it.","thinkingSignature":"c70ddbc8c0bb8517a69c01d3d07d0f6beec2d3060acf681a13de72a17ffb6bac"},{"type":"toolCall","id":"call_function_giq5zxzczz23_1","name":"read","arguments":{"path":"/home/ubuntu/.hermes/agi/graph_builder.py","offset":2187,"limit":30}}],"api":"anthropic-messages","provider":"minimax","model":"MiniMax-M2.7","usage":{"input":25532,"output":84,"cacheRead":10071,"cacheWrite":0,"totalTokens":35687,"cost":{"input":0.0076596,"output":0.0001008,"cacheRead":0.0006042599999999999,"cacheWrite":0,"total":0.00836466}},"stopReason":"toolUse","timestamp":1777539573597,"responseId":"06424cf6434c846c57d387268f732869"}}
{"type":"message","id":"ea41a819","parentId":"4591a668","timestamp":"2026-04-30T08:59:36.833Z","message":{"role":"toolResult","toolCallId":"call_function_giq5zxzczz23_1","toolName":"read","content":[{"type":"text","text":"def _try_load_graph_cache(agi_dir: str, source_mtimes: Dict[str, float],\n                           gitnexus_cache: Optional[str]) -> Optional[GraphBuilder]:\n    \"\"\"Try to load graph from pickle cache if sources unchanged.\n    \n    Optimization: skip stat-ing source files. Trust pickle file's mtime as proxy.\n    If pickle exists and is readable, sources haven't changed.\n    \"\"\"\n    cache_file = _get_graph_cache_file(agi_dir)\n    if not os.path.exists(cache_file):\n        return None\n    try:\n        with open(cache_file, 'rb') as f:\n            cached = pickle.load(f)\n        # Fast path: skip source_mtimes/gitnexus validation.\n        # Pickle file's mtime is a reliable enough proxy.\n        # (If sources change, pickle is rebuilt. If only content changes\n        # without touching source files, the caller must invalidate.)\n        builder = GraphBuilder()\n        builder.nodes = cached.get('nodes', [])\n        builder.edges = cached.get('edges', [])\n        builder.adj = cached.get('adj', {})\n        builder._node_ids = cached.get('_node_ids', {n[0] for n in builder.nodes})\n        # Restore precomputed paths and recompute if missing\n        builder._precomputed_paths = cached.get('_precomputed_paths', {})\n        if not builder._precomputed_paths:\n            builder._precompute_key_paths()  # Rebuild paths from loaded adj\n        return builder\n    except Exception:\n        return None\n\n\n[302 more lines in file. Use offset=2217 to continue.]"}],"isError":false,"timestamp":1777539576833}}
{"type":"message","id":"1894a069","parentId":"ea41a819","timestamp":"2026-04-30T08:59:41.429Z","message":{"role":"assistant","content":[{"type":"thinking","thinking":"Now I need to add hub_reachable restoration to `_try_load_graph_cache`. Let me update it.","thinkingSignature":"852942f8fd91fb4413c0006860cba3afeb58e7127e6a6d3945e3e2ffab944f29"},{"type":"toolCall","id":"call_function_7vxk447w2rd0_1","name":"edit","arguments":{"path":"/home/ubuntu/.hermes/agi/graph_builder.py","edits":[{"oldText":"        # Restore precomputed paths and recompute if missing\n        builder._precomputed_paths = cached.get('_precomputed_paths', {})\n        if not builder._precomputed_paths:\n            builder._precompute_key_paths()  # Rebuild paths from loaded adj\n        return builder","newText":"        # Restore precomputed paths and recompute if missing\n        builder._precomputed_paths = cached.get('_precomputed_paths', {})\n        if not builder._precomputed_paths:\n            builder._precompute_key_paths()  # Rebuild paths from loaded adj\n        # Restore hub reachability\n        builder.hub_reachable = cached.get('hub_reachable', {})\n        if not builder.hub_reachable:\n            builder._precompute_reachability(hub_count=32)\n        return builder"}]}}],"api":"anthropic-messages","provider":"minimax","model":"MiniMax-M2.7","usage":{"input":25954,"output":245,"cacheRead":10071,"cacheWrite":0,"totalTokens":36270,"cost":{"input":0.0077862,"output":0.000294,"cacheRead":0.0006042599999999999,"cacheWrite":0,"total":0.00868446}},"stopReason":"toolUse","timestamp":1777539576834,"responseId":"06424cf9774abf78bd74f7bd82c85183"}}
{"type":"message","id":"d74485a8","parentId":"1894a069","timestamp":"2026-04-30T08:59:41.437Z","message":{"role":"toolResult","toolCallId":"call_function_7vxk447w2rd0_1","toolName":"edit","content":[{"type":"text","text":"Successfully replaced 1 block(s) in /home/ubuntu/.hermes/agi/graph_builder.py."}],"details":{"diff":"      ...\n 2209         # Restore precomputed paths and recompute if missing\n 2210         builder._precomputed_paths = cached.get('_precomputed_paths', {})\n 2211         if not builder._precomputed_paths:\n 2212             builder._precompute_key_paths()  # Rebuild paths from loaded adj\n+2213         # Restore hub reachability\n+2214         builder.hub_reachable = cached.get('hub_reachable', {})\n+2215         if not builder.hub_reachable:\n+2216             builder._precompute_reachability(hub_count=32)\n 2213         return builder\n 2214     except Exception:\n 2215         return None\n 2216 \n      ...","firstChangedLine":2213},"isError":false,"timestamp":1777539581437}}
{"type":"message","id":"316a2d39","parentId":"d74485a8","timestamp":"2026-04-30T08:59:44.895Z","message":{"role":"assistant","content":[{"type":"thinking","thinking":"Now let me verify the syntax is correct by running a quick Python import check.","thinkingSignature":"9b40124fc67e09cd28116dd5399829c42a5b578d03d171e5397a705f057593b3"},{"type":"text","text":"Verify syntax:\n"},{"type":"toolCall","id":"call_function_jvybk8q6pjgn_1","name":"bash","arguments":{"command":"cd /home/ubuntu/.hermes/agi && python3 -c \"import graph_builder; print('OK')\" 2>&1"}}],"api":"anthropic-messages","provider":"minimax","model":"MiniMax-M2.7","usage":{"input":26235,"output":73,"cacheRead":10071,"cacheWrite":0,"totalTokens":36379,"cost":{"input":0.007870499999999999,"output":0.0000876,"cacheRead":0.0006042599999999999,"cacheWrite":0,"total":0.00856236}},"stopReason":"toolUse","timestamp":1777539581440,"responseId":"06424cfdea21ce6f0563ce9a36679d9e"}}
{"type":"message","id":"285fd019","parentId":"316a2d39","timestamp":"2026-04-30T08:59:44.959Z","message":{"role":"toolResult","toolCallId":"call_function_jvybk8q6pjgn_1","toolName":"bash","content":[{"type":"text","text":"OK\n"}],"isError":false,"timestamp":1777539584959}}
{"type":"message","id":"6f4b7ed9","parentId":"285fd019","timestamp":"2026-04-30T08:59:54.581Z","message":{"role":"assistant","content":[{"type":"thinking","thinking":"Good, syntax is fine. Now let me test the cold build time to see if it changes significantly.","thinkingSignature":"383372deeae8c900611ff6be7080d63afae87ead3baa305a7ec4d1178a79dbdf"},{"type":"text","text":"Now test cold vs warm:\n"},{"type":"toolCall","id":"call_function_yq9caqr30ysc_1","name":"bash","arguments":{"command":"cd /home/ubuntu/.hermes/agi && python3 -c \"\nimport time, os, sys\nsys.path.insert(0, '.')\nfrom graph_builder import build_graph, _cached_build_builder, _get_graph_cache_file\n\nhermes = os.path.expanduser('~/.hermes')\nagi = '/home/ubuntu/.hermes/agi'\n\n# Clear lru cache + remove pickle to force cold\n_cached_build_builder.cache_clear()\ncache_file = _get_graph_cache_file(agi)\nif os.path.exists(cache_file):\n    os.remove(cache_file)\n\nprint('=== Cold build (with reachability matrix) ===')\nstart = time.perf_counter()\nb1, t1 = build_graph(hermes, agi)\ncold_total = (time.perf_counter() - start) * 1000\nprint(f'build_graph returned: {t1:.3f}ms, wall: {cold_total:.3f}ms')\nprint(f'Nodes: {len(b1.nodes)}, hub_reachable: {len(getattr(b1, \\\"hub_reachable\\\", {}))} hubs')\n\nprint()\nprint('=== Warm build ===')\nstart = time.perf_counter()\nb2, t2 = build_graph(hermes, agi)\nwarm_total = (time.perf_counter() - start) * 1000\nprint(f'build_graph returned: {t2:.4f}ms, wall: {warm_total:.4f}ms')\nprint(f'Same builder: {b1 is b2}')\n\n# Test reachability query\nhr = getattr(b2, 'hub_reachable', {})\nif hr:\n    hub = next(iter(hr))\n    reachable_from_hub = hr[hub]\n    print(f'Hub node: {hub}, reachable count: {len(reachable_from_hub)}')\n\" 2>/dev/null"}}],"api":"anthropic-messages","provider":"minimax","model":"MiniMax-M2.7","usage":{"input":26325,"output":434,"cacheRead":10071,"cacheWrite":0,"totalTokens":36830,"cost":{"input":0.0078975,"output":0.0005208,"cacheRead":0.0006042599999999999,"cacheWrite":0,"total":0.00902256}},"stopReason":"toolUse","timestamp":1777539584961,"responseId":"06424d016f0dd76b120ec822d3aea58c"}}
{"type":"message","id":"51c83f19","parentId":"6f4b7ed9","timestamp":"2026-04-30T08:59:54.865Z","message":{"role":"toolResult","toolCallId":"call_function_yq9caqr30ysc_1","toolName":"bash","content":[{"type":"text","text":"=== Cold build (with reachability matrix) ===\n\n\nCommand exited with code 1"}],"details":{},"isError":true,"timestamp":1777539594865}}
