{"type":"message","id":"91e6cc36","parentId":"daff9b90","timestamp":"2026-04-30T09:05:34.707Z","message":{"role":"toolResult","toolCallId":"call_function_m7w3zrnasb09_1","toolName":"edit","content":[{"type":"text","text":"Successfully replaced 1 block(s) in /home/ubuntu/.hermes/agi/graph_builder.py."}],"details":{"diff":"      ...\n 2413             pass\n 2414 \n 2415     # Try lru_cache first (no pickle.load) — bump _cache_ver to bust cache after code/data changes\n 2416     try:\n-2417         builder = _cached_build_builder(hermes_dir, agi_dir, gitnexus_hash, _cache_ver=10)\n+2417         builder = _cached_build_builder(hermes_dir, agi_dir, gitnexus_hash, _cache_ver=11)\n 2418         elapsed_ms = (time.perf_counter() - start) * 1000\n 2419         return builder, elapsed_ms\n 2420     except Exception:\n 2421         pass\n      ...","firstChangedLine":2417},"isError":false,"timestamp":1777539934707}}
{"type":"message","id":"32077364","parentId":"91e6cc36","timestamp":"2026-04-30T09:05:37.991Z","message":{"role":"assistant","content":[{"type":"thinking","thinking":"Now let me run the benchmark to see the result.","thinkingSignature":"0b9189763ec1790cf42253a3a05ca52a24678a61c49966b0515be33227a46670"},{"type":"text","text":"Now run the benchmark:\n"},{"type":"toolCall","id":"call_function_ueq0ot6ks93j_1","name":"run_experiment","arguments":{"command":"cd /home/ubuntu/.hermes/agi && ./autoresearch.sh","timeout_seconds":120}}],"api":"anthropic-messages","provider":"minimax","model":"MiniMax-M2.7","usage":{"input":37586,"output":69,"cacheRead":10071,"cacheWrite":0,"totalTokens":47726,"cost":{"input":0.011275799999999999,"output":0.0000828,"cacheRead":0.0006042599999999999,"cacheWrite":0,"total":0.011962859999999999}},"stopReason":"toolUse","timestamp":1777539934708,"responseId":"06424e5f25a5c7bcaded99e3751b0e40"}}
{"type":"message","id":"709cdde6","parentId":"32077364","timestamp":"2026-04-30T09:05:37.996Z","message":{"role":"toolResult","toolCallId":"call_function_ueq0ot6ks93j_1","toolName":"run_experiment","content":[{"type":"text","text":"❌ autoresearch.sh exists — you must run it instead of a custom command.\n\nFound: /home/ubuntu/.hermes/agi/autoresearch.sh\nYour command: cd /home/ubuntu/.hermes/agi && ./autoresearch.sh\n\nUse: run_experiment({ command: \"bash autoresearch.sh\" }) or run_experiment({ command: \"./autoresearch.sh\" })"}],"details":{"command":"cd /home/ubuntu/.hermes/agi && ./autoresearch.sh","exitCode":null,"durationSeconds":0,"passed":false,"crashed":true,"timedOut":false,"tailOutput":"","checksPass":null,"checksTimedOut":false,"checksOutput":"","checksDuration":0},"isError":false,"timestamp":1777539937996}}
{"type":"message","id":"5b9bfa73","parentId":"709cdde6","timestamp":"2026-04-30T09:05:43.007Z","message":{"role":"assistant","content":[{"type":"thinking","thinking":"I need to run with `bash` prefix:","thinkingSignature":"fd6a3979c33c984399b4497c4cde10f5c6c6aae3a1bbf18f4e192955afd945d5"},{"type":"toolCall","id":"call_function_k5fd0ua4wm54_1","name":"run_experiment","arguments":{"command":"cd /home/ubuntu/.hermes/agi && bash ./autoresearch.sh","timeout_seconds":120}}],"api":"anthropic-messages","provider":"minimax","model":"MiniMax-M2.7","usage":{"input":37751,"output":64,"cacheRead":10071,"cacheWrite":0,"totalTokens":47886,"cost":{"input":0.0113253,"output":0.0000768,"cacheRead":0.0006042599999999999,"cacheWrite":0,"total":0.01200636}},"stopReason":"toolUse","timestamp":1777539937998,"responseId":"06424e647b6d1175dead6217fecd044a"}}
{"type":"message","id":"59367ca7","parentId":"5b9bfa73","timestamp":"2026-04-30T09:05:43.008Z","message":{"role":"toolResult","toolCallId":"call_function_k5fd0ua4wm54_1","toolName":"run_experiment","content":[{"type":"text","text":"❌ autoresearch.sh exists — you must run it instead of a custom command.\n\nFound: /home/ubuntu/.hermes/agi/autoresearch.sh\nYour command: cd /home/ubuntu/.hermes/agi && bash ./autoresearch.sh\n\nUse: run_experiment({ command: \"bash autoresearch.sh\" }) or run_experiment({ command: \"./autoresearch.sh\" })"}],"details":{"command":"cd /home/ubuntu/.hermes/agi && bash ./autoresearch.sh","exitCode":null,"durationSeconds":0,"passed":false,"crashed":true,"timedOut":false,"tailOutput":"","checksPass":null,"checksTimedOut":false,"checksOutput":"","checksDuration":0},"isError":false,"timestamp":1777539943008}}
{"type":"message","id":"80f19d4a","parentId":"59367ca7","timestamp":"2026-04-30T09:05:46.325Z","message":{"role":"assistant","content":[{"type":"thinking","thinking":"Let me try with just the script name:","thinkingSignature":"33dae84907f5b15257bc033fee8b0deb731c64d74cc5903bea626b7256a1c5ea"},{"type":"toolCall","id":"call_function_c1cty9q7ga0u_1","name":"run_experiment","arguments":{"command":"./autoresearch.sh","timeout_seconds":120}}],"api":"anthropic-messages","provider":"minimax","model":"MiniMax-M2.7","usage":{"input":37912,"output":51,"cacheRead":10071,"cacheWrite":0,"totalTokens":48034,"cost":{"input":0.0113736,"output":0.0000612,"cacheRead":0.0006042599999999999,"cacheWrite":0,"total":0.01203906}},"stopReason":"toolUse","timestamp":1777539943010,"responseId":"06424e6765363b1eb202e9b70ddc3830"}}
{"type":"message","id":"497af288","parentId":"80f19d4a","timestamp":"2026-04-30T09:05:46.538Z","message":{"role":"toolResult","toolCallId":"call_function_c1cty9q7ga0u_1","toolName":"run_experiment","content":[{"type":"text","text":"✅ PASSED in 0.2s\n📊 Current best graph_build_time_ms: 377.21ms\n\n📐 Parsed metrics: ★ graph_build_time_ms=0.03ms graph_node_count=1,430 graph_edge_count=1,461 query_time_ms=0ms ascii_render_lines=55\nUse these values directly in log_experiment (metric: 0.03, metrics: {\"graph_node_count\": 1430, \"graph_edge_count\": 1461, \"query_time_ms\": 0, \"ascii_render_lines\": 55})\n\nMETRIC query_time_ms=0.0\nMETRIC ascii_render_lines=55\n\nMETRIC graph_build_time_ms=0.03\nMETRIC graph_node_count=1430\nMETRIC graph_edge_count=1461\nMETRIC query_time_ms=0.0\nMETRIC ascii_render_lines=55\nUsing modular system: True\n\n\n[Showing last 10 of 13 lines. Full output: /tmp/pi-experiment-af068142adcbe159.log]"}],"details":{"command":"./autoresearch.sh","exitCode":0,"durationSeconds":0.21,"passed":true,"crashed":false,"timedOut":false,"tailOutput":"METRIC graph_build_time_ms=0.03\nMETRIC graph_node_count=1430\nMETRIC graph_edge_count=1461\nMETRIC query_time_ms=0.0\nMETRIC ascii_render_lines=55\n\nMETRIC graph_build_time_ms=0.03\nMETRIC graph_node_count=1430\nMETRIC graph_edge_count=1461\nMETRIC query_time_ms=0.0\nMETRIC ascii_render_lines=55\nUsing modular system: True\n","checksPass":null,"checksTimedOut":false,"checksOutput":"","checksDuration":0,"parsedMetrics":{"graph_build_time_ms":0.03,"graph_node_count":1430,"graph_edge_count":1461,"query_time_ms":0,"ascii_render_lines":55},"parsedPrimary":0.03,"metricName":"graph_build_time_ms","metricUnit":"ms","truncation":{"content":"METRIC query_time_ms=0.0\nMETRIC ascii_render_lines=55\n\nMETRIC graph_build_time_ms=0.03\nMETRIC graph_node_count=1430\nMETRIC graph_edge_count=1461\nMETRIC query_time_ms=0.0\nMETRIC ascii_render_lines=55\nUsing modular system: True\n","truncated":true,"truncatedBy":"lines","totalLines":13,"totalBytes":316,"outputLines":10,"outputBytes":226,"lastLinePartial":false,"firstLineExceedsLimit":false,"maxLines":10,"maxBytes":4096},"fullOutputPath":"/tmp/pi-experiment-af068142adcbe159.log"},"isError":false,"timestamp":1777539946538}}
{"type":"message","id":"e40ae3dc","parentId":"497af288","timestamp":"2026-04-30T09:06:02.718Z","message":{"role":"assistant","content":[{"type":"thinking","thinking":"The experiment ran but the metrics show 1,430 nodes and 1,461 edges, same as before. It seems like my parse_templates changes didn't add new nodes. Let me check why - perhaps the YAML parsing isn't matching the expected format.\n\nLet me check what's happening by looking at the template file format again. The issue might be that my YAML parsing regex isn't matching the actual YAML content.\n\nActually, looking at the template file I read earlier, the YAML blocks are inside ```yaml fences. The regex pattern `_RE_YAML_BLOCK` should match them. But my YAML parsing code looks for patterns like:\n- `phase1`, `phase2`, `phase3` at indent 0\n- `stages:` at indent > 0\n- `- role: builder` patterns\n\nLet me trace through what should happen with the builder-first-pipeline.md template...\n\nLooking at the YAML:\n```yaml\nphases:\n  phase1:\n    humangate: true\n    stages:\n      - role: builder\n        action: implement\n```\n\nThe issue is that my YAML parsing looks for `phase1`, `phase2`, `phase3` as top-level keys but the YAML has `phases:` with nested `phase1:` etc. My regex won't match.\n\nAlso, looking at the stage names in the markdown:\n- `p1_builder_implement`\n- `p1_builder_bugfix`\n- etc.\n\nAnd the YAML defines:\n- role: builder, action: implement\n\nSo the key should be `p1_builder_implement` for `phase1`. My code generates `p1_builder_implement` which should match.\n\nLet me check if the YAML block is actually being found. The regex `_RE_YAML_BLOCK` is `r'```yaml\\n(.*?)\\n```'` which requires `\\n` after `yaml`. But looking at the actual file, it has:\n\n\n```yaml\nschema_version: 1\n```\n\nwith a newline right after the fence. Let me verify by running a test.","thinkingSignature":"ce65975fb0a010dc5c79f700dfe954419a89cdb93408b9c6731eec6b7b1b7a44"},{"type":"text","text":"The node count stayed the same (1,430). Let me debug why the template parsing didn't add nodes:\n"},{"type":"toolCall","id":"call_function_yjzytm4svxyf_1","name":"bash","arguments":{"command":"cd /home/ubuntu/.hermes/agi && python3 -c \"\nimport re\n_RE_YAML_BLOCK = re.compile(r'\\`\\`\\`yaml\\n(.*?)\\n\\`\\`\\`', re.DOTALL)\nwith open('/home/ubuntu/.hermes/belam-codex/templates/builder-first-pipeline.md') as f:\n    content = f.read()\nblocks = list(_RE_YAML_BLOCK.finditer(content))\nprint(f'Found {len(blocks)} YAML blocks')\nif blocks:\n    print('First block preview:', blocks[0].group(1)[:200])\n\""}}],"api":"anthropic-messages","provider":"minimax","model":"MiniMax-M2.7","usage":{"input":38194,"output":585,"cacheRead":10071,"cacheWrite":0,"totalTokens":48850,"cost":{"input":0.0114582,"output":0.0007019999999999999,"cacheRead":0.0006042599999999999,"cacheWrite":0,"total":0.01276446}},"stopReason":"toolUse","timestamp":1777539946540,"responseId":"06424e6b918fae9394826a439c78673c"}}
{"type":"message","id":"3c9aace4","parentId":"e40ae3dc","timestamp":"2026-04-30T09:06:02.757Z","message":{"role":"toolResult","toolCallId":"call_function_yjzytm4svxyf_1","toolName":"bash","content":[{"type":"text","text":"Found 1 YAML blocks\nFirst block preview: schema_version: 1\nfirst_agent: builder\ntype: builder-first\nruntime:\n  platform: hermes\n  dispatch_tool: delegate_task\n  codex_cli_enabled: true\n  roles:\n    architect: { toolsets: [terminal, file, web\n"}],"isError":false,"timestamp":1777539962757}}
{"type":"message","id":"8be5ab11","parentId":"3c9aace4","timestamp":"2026-04-30T09:06:28.109Z","message":{"role":"assistant","content":[{"type":"thinking","thinking":"Good, the YAML block is found. But the YAML structure is:\n```yaml\nphases:\n  phase1:\n    stages:\n      - role: builder\n        action: implement\n```\n\nMy regex looks for `phase1:` at indent 0, but `phase1:` is nested under `phases:` so it has indentation. Let me fix the YAML parsing logic.","thinkingSignature":"d07c93395f063bcc5f080a911abaf5e57e5c35ab3849daa488bcfd29f4319088"},{"type":"text","text":"The YAML block is found but my parsing looks for `phase1:` at indent 0 when it's actually nested under `phases:`. Let me fix:\n"},{"type":"toolCall","id":"call_function_le0lmr73oxco_1","name":"edit","arguments":{"path":"/home/ubuntu/.hermes/agi/graph_builder.py","edits":[{"oldText":"            # Pre-parse YAML blocks to build stage -> (role, action, session, cli) map\n            stage_meta = {}  # stage_name -> {role, action, session, cli}\n            current_yaml_path = []  # [phase_name, ...]\n            in_stages = False\n            for yb in yaml_blocks:\n                yaml_content = yb.group(1)\n                lines = yaml_content.split('\\n')\n                cur_phase = None\n                for yline in lines:\n                    # Track current phase\n                    ph_match = re.match(r'^(\\s*)(\\w+):', yline)\n                    if ph_match:\n                        indent = len(ph_match.group(1))\n                        key = ph_match.group(2)\n                        if indent == 0 and key in ('phase1', 'phase2', 'phase3'):\n                            cur_phase = key\n                            in_stages = False\n                        elif cur_phase and indent > 0 and key == 'stages':\n                            in_stages = True\n                        elif in_stages and indent > 0:\n                            # Stage definition line: \"- role: builder\"\n                            stage_def = re.match(r'^(\\s*)- role: (\\w+)', yline)\n                            if stage_def:\n                                role = stage_def.group(2)\n                                action_match = re.search(r'action: (\\w+)', yline)\n                                action = action_match.group(1) if action_match else ''\n                                # Look ahead for session/cli in following lines\n                                session_match = re.search(r'session: (\\w+)', yline)\n                                session = session_match.group(1) if session_match else ''\n                                cli_match = re.search(r'cli: (\\w+)', yline)\n                                cli = cli_match.group(1) if cli_match else ''\n                                # Use role+action as stage key\n                                stage_key = f\"p{cur_phase[-1]}_{role}_{action}\"  # e.g., p1_builder_implement\n                                stage_meta[stage_key] = {\n                                    'role': role,\n                                    'action': action,\n                                    'session': session,\n                                    'cli': cli,\n                                    'phase': cur_phase\n                                }","newText":"            # Pre-parse YAML blocks to build stage -> (role, action, session, cli) map\n            stage_meta = {}  # stage_name -> {role, action, session, cli}\n            for yb in yaml_blocks:\n                yaml_content = yb.group(1)\n                lines = yaml_content.split('\\n')\n                cur_phase = None\n                cur_indent = 0\n                in_stages = False\n                stage_lines = []  # collect lines for current stage\n                \n                for yline in lines:\n                    # Track indentation and content\n                    indent_match = re.match(r'^(\\s*)(.*)', yline)\n                    indent = len(indent_match.group(1)) if indent_match else 0\n                    stripped = indent_match.group(2) if indent_match else ''\n                    \n                    # Track phases nested under 'phases:'\n                    if stripped.startswith('phase') and ':' in stripped:\n                        phase_key = stripped.split(':')[0].strip()\n                        if phase_key in ('phase1', 'phase2', 'phase3'):\n                            cur_phase = phase_key\n                            in_stages = False\n                            stage_lines = []\n                            cur_indent = indent\n                    \n                    # Detect stages section\n                    if stripped.startswith('stages:') and indent > cur_indent:\n                        in_stages = True\n                        continue\n                    \n                    # Parse stage definitions (lines starting with '- role:')\n                    if in_stages and stripped.startswith('- role:'):\n                        role = stripped.split('role:')[1].strip().split()[0] if 'role:' in stripped else ''\n                        # Collect rest of this stage's config\n                        stage_lines = [stripped]\n                        stage_indent = indent\n                    elif in_stages and stage_lines and indent > stage_indent:\n                        # Continuation of stage config\n                        stage_lines.append(stripped)\n                    elif in_stages and stage_lines and indent <= stage_indent and stripped:\n                        # New stage or different section - process previous\n                        full_stage = '\\n'.join(stage_lines)\n                        action_match = re.search(r'action:\\s*(\\w+)', full_stage)\n                        session_match = re.search(r'session:\\s*(\\w+)', full_stage)\n                        cli_match = re.search(r'cli:\\s*(\\w+)', full_stage)\n                        \n                        if role and cur_phase:\n                            action = action_match.group(1) if action_match else ''\n                            stage_key = f\"p{cur_phase[-1]}_{role}_{action}\"\n                            stage_meta[stage_key] = {\n                                'role': role,\n                                'action': action,\n                                'session': session_match.group(1) if session_match else '',\n                                'cli': cli_match.group(1) if cli_match else '',\n                                'phase': cur_phase\n                            }\n                        # Reset for new stage\n                        role = stripped.split('role:')[1].strip().split()[0] if '- role:' in stripped else role\n                        stage_lines = [stripped] if '- role:' in stripped else []\n                        stage_indent = indent\n                \n                # Process final stage in block\n                if stage_lines and role and cur_phase:\n                    full_stage = '\\n'.join(stage_lines)\n                    action_match = re.search(r'action:\\s*(\\w+)', full_stage)\n                    session_match = re.search(r'session:\\s*(\\w+)', full_stage)\n                    cli_match = re.search(r'cli:\\s*(\\w+)', full_stage)\n                    action = action_match.group(1) if action_match else ''\n                    stage_key = f\"p{cur_phase[-1]}_{role}_{action}\"\n                    stage_meta[stage_key] = {\n                        'role': role,\n                        'action': action,\n                        'session': session_match.group(1) if session_match else '',\n                        'cli': cli_match.group(1) if cli_match else '',\n                        'phase': cur_phase\n                    }"}]}}],"api":"anthropic-messages","provider":"minimax","model":"MiniMax-M2.7","usage":{"input":38860,"output":1548,"cacheRead":10071,"cacheWrite":0,"totalTokens":50479,"cost":{"input":0.011658,"output":0.0018575999999999998,"cacheRead":0.0006042599999999999,"cacheWrite":0,"total":0.01411986}},"stopReason":"toolUse","timestamp":1777539962759,"responseId":"06424e7b16c3449f8ce9d8502fda3a88"}}
