{"type":"message","id":"cf7ee372","parentId":"6cc2bf9f","timestamp":"2026-04-30T09:13:35.047Z","message":{"role":"toolResult","toolCallId":"call_function_n5x14pod2j7i_1","toolName":"read","content":[{"type":"text","text":"#!/usr/bin/env python3\n\"\"\"\npi_tree_adapter.py — Adapter to feed graph output into pi's /tree feature\nDB-augmented directed code generation via unified graph memory\n\"\"\"\n\nimport json\nimport os\nimport sys\nfrom typing import List, Dict, Any, Optional\n\n# Add parent directory for imports\nsys.path.insert(0, os.path.dirname(os.path.abspath(__file__)))\n\nfrom graph_builder import build_graph, GraphBuilder\nfrom asciirender import ASCIIRenderer\n\n\nclass PiTreeAdapter:\n    \"\"\"\n    Adapter to convert graph data into pi's /tree format.\n    \n    pi's /tree feature expects a specific JSON structure:\n    {\n      \"nodes\": [\n        {\"id\": \"...\", \"label\": \"...\", \"children\": [...]}\n      ]\n    }\n    \"\"\"\n    \n    def __init__(self, builder: GraphBuilder):\n        self.builder = builder\n        self._node_lookup = {n[\"id\"]: n for n in builder.nodes}\n    \n    def to_pi_tree(self, root_id: Optional[str] = None, \n                   max_depth: int = 3) -> Dict[str, Any]:\n        \"\"\"Convert graph to pi's tree format.\"\"\"\n        if not self.builder.nodes:\n            return {\"nodes\": [], \"stats\": {}}\n        \n        # Find root(s)\n        if root_id is None:\n            # Use doc_sections as roots\n            section_nodes = [n for n in self.builder.nodes if n[\"type\"] == \"doc_section\"]\n            roots = section_nodes[:3] if section_nodes else [self.builder.nodes[0]]\n        else:\n            roots = [self._node_lookup[root_id]] if root_id in self._node_lookup else []\n        \n        nodes = []\n        visited = set()\n        \n        for root in roots:\n            tree = self._build_tree_recursive(root[\"id\"], visited, max_depth, 0)\n            nodes.append(tree)\n        \n        return {\n            \"nodes\": nodes,\n            \"stats\": {\n                \"total_nodes\": len(self.builder.nodes),\n                \"total_edges\": len(self.builder.edges),\n                \"rendered_nodes\": len(visited)\n            }\n        }\n    \n    def _build_tree_recursive(self, node_id: str, visited: set, \n                              max_depth: int, current_depth: int) -> Dict[str, Any]:\n        \"\"\"Recursively build tree structure.\"\"\"\n        if node_id in visited or current_depth > max_depth:\n            return {\"id\": node_id, \"label\": \"...\", \"collapsed\": True}\n        \n        visited.add(node_id)\n        node = self._node_lookup.get(node_id)\n        \n        if not node:\n            return {\"id\": node_id, \"label\": \"unknown\"}\n        \n        children = []\n        \n        # Get child edges\n        for edge in self.builder.edges:\n            if edge[\"from\"] == node_id and edge[\"type\"] == \"contains\":\n                child = self._build_tree_recursive(\n                    edge[\"to\"], visited, max_depth, current_depth + 1\n                )\n                children.append(child)\n        \n        result = {\n            \"id\": node[\"id\"],\n            \"label\": node[\"label\"][:50],\n            \"type\": node[\"type\"]\n        }\n        \n        if children:\n            result[\"children\"] = children\n        \n        return result\n    \n    def to_pi_search_format(self, query: str) -> Dict[str, Any]:\n        \"\"\"Convert search results to pi format.\"\"\"\n        results = []\n        \n        query_lower = query.lower()\n        for node in self.builder.nodes:\n            score = 0\n            if query_lower in node.get(\"label\", \"\").lower():\n                score += 2\n            if query_lower in node.get(\"content\", \"\").lower():\n                score += 1\n            \n            if score > 0:\n                results.append({\n                    \"id\": node[\"id\"],\n                    \"label\": node[\"label\"],\n                    \"type\": node[\"type\"],\n                    \"source\": node[\"source\"],\n                    \"score\": score\n                })\n        \n        results.sort(key=lambda x: -x[\"score\"])\n        \n        return {\n            \"query\": query,\n            \"results\": results[:20],\n            \"total_matches\": len(results)\n        }\n    \n    def to_pi_path_format(self, path: List[str]) -> Dict[str, Any]:\n        \"\"\"Convert a path to pi's format.\"\"\"\n        nodes = []\n        \n        for node_id in path:\n            node = self._node_lookup.get(node_id)\n            if node:\n                nodes.append({\n                    \"id\": node[\"id\"],\n                    \"label\": node[\"label\"],\n                    \"type\": node[\"type\"],\n                    \"content\": node.get(\"content\", \"\")[:100]\n                })\n        \n        return {\n            \"path\": nodes,\n            \"length\": len(nodes),\n            \"formatted\": self._format_path_ascii(path)\n        }\n    \n    def _format_path_ascii(self, path: List[str]) -> str:\n        \"\"\"Format path as ASCII art.\"\"\"\n        lines = []\n        \n        for i, node_id in enumerate(path):\n            node = self._node_lookup.get(node_id)\n            if not node:\n                continue\n            \n            if i == 0:\n                lines.append(f\"╭─ {node['label'][:50]}\")\n            elif i == len(path) - 1:\n                lines.append(f\"╰─ {node['label'][:50]}\")\n            else:\n                lines.append(f\"├─ {node['label'][:50]}\")\n        \n        return '\\n'.join(lines)\n    \n    def to_pi_subgraph(self, center_id: str, radius: int = 2) -> Dict[str, Any]:\n        \"\"\"Get subgraph around a center node for pi.\"\"\"\n        if center_id not in self._node_lookup:\n            return {\"error\": f\"Node not found: {center_id}\"}\n        \n        # BFS to find reachable nodes\n        reachable = {center_id}\n        frontier = {center_id}\n        \n        for _ in range(radius):\n            next_frontier = set()\n            for node in frontier:\n                for neighbor in self.builder.adj.get(node, []):\n                    if neighbor not in reachable:\n                        reachable.add(neighbor)\n                        next_frontier.add(neighbor)\n            frontier = next_frontier\n        \n        # Build subgraph\n        nodes = [self._node_lookup[n] for n in reachable if n in self._node_lookup]\n        edges = [e for e in self.builder.edges \n                if e[\"from\"] in reachable and e[\"to\"] in reachable]\n        \n        return {\n            \"center\": center_id,\n            \"radius\": radius,\n            \"nodes\": nodes,\n            \"edges\": edges,\n            \"node_count\": len(nodes),\n            \"edge_count\": len(edges)\n        }\n\n\ndef output_for_pi(builder: GraphBuilder, output_path: str):\n    \"\"\"Output graph in pi-compatible format.\"\"\"\n    adapter = PiTreeAdapter(builder)\n    \n    # Main tree\n    tree = adapter.to_pi_tree()\n    \n    # Search format\n    search = adapter.to_pi_search_format(\"agent\")\n    \n    # Stats\n    stats = builder.get_stats()\n    \n    output = {\n        \"tree\": tree,\n        \"search\": search,\n        \"stats\": stats,\n        \"generated_at\": __import__('time').time()\n    }\n    \n    with open(output_path, 'w') as f:\n        json.dump(output, f, indent=2)\n\n\nif __name__ == \"__main__\":\n    hermes = os.path.expanduser(\"~/.hermes\")\n    agi = os.path.dirname(os.path.abspath(__file__))\n    \n    print(\"Building graph...\")\n    builder, build_time = build_graph(hermes, agi)\n    print(f\"Build: {build_time:.2f}ms\")\n    \n    adapter = PiTreeAdapter(builder)\n    \n    # Output pi tree\n    tree = adapter.to_pi_tree()\n    print(f\"\\nPi tree: {len(tree['nodes'])} root nodes\")\n    print(json.dumps(tree, indent=2)[:500])\n"}],"isError":false,"timestamp":1777540415047}}
{"type":"message","id":"e26823f7","parentId":"cf7ee372","timestamp":"2026-04-30T09:13:35.052Z","message":{"role":"toolResult","toolCallId":"call_function_n5x14pod2j7i_2","toolName":"bash","content":[{"type":"text","text":"__pycache__\n_benchmark.py\nasciirender.py\nautoresearch.config.json\nautoresearch.ideas.md\nautoresearch.jsonl\nautoresearch.md\nautoresearch.sh\nexperiments\ngraph_builder.py\nloop.log\npi-agi.log\npi_tree_adapter.py\nquery_engine.py\nrun-loop.sh\nschema.sql\nsessions\nstart.sh\n---\n!cat\nAGENTS.md\nCLAUDE.md\nCOCKPIT_REFACTOR_GUIDE.md\nCODEX.codex\nCONTEXT_BOOT.md\nDockerfile\nHEARTBEAT.md\nIDENTITY.md\nMEMORY.md\nSOUL.md\nTOOLS.md\nUSER.md\nagents\narchive\nbin\ncanvas\ncodex_legend.md\ndata\ndecisions\ndocker\ndocker-compose.yml\ndocs\nextensions-backup\ngoals\nhandoff\nhooks\nincarnate.sh\nknowledge\nlessons\n---\nSOUL.md\nagi\naudio_cache\nauth.json\nauth.lock\nbelam-codex\nbin\ncache\nchannel_directory.json\nconfig.yaml\ncron\ngateway.pid\ngateway_state.json\nhermes-agent\nhooks\nimage_cache\nlogs\nmemories\nmodels_dev_cache.json\npairing\npatches\nplugins\nprocesses.json\nsandboxes\nsession_logs\nsessions\nskills\nstate.db\nstate.db-shm\nstate.db-wal\nwhatsapp\n"}],"isError":false,"timestamp":1777540415052}}
{"type":"message","id":"3663d9d1","parentId":"e26823f7","timestamp":"2026-04-30T09:13:43.378Z","message":{"role":"assistant","content":[{"type":"thinking","thinking":"Interesting! There's a `hooks/` directory in belam-codex. Let me check what's in it - the ideas.md said \"Parse hooks/ (3 subdirs: memory-extract, pipeline-dispatch, supermap-boot)\" but marked it as \"low priority\". Let me check if it's populated.\n\nAlso, let me look for `scripts/` which was mentioned as unexplored.\n\nAnd let me check what's in the pi_tree_adapter.py - it's already been created but uses `n[\"id\"]` and `n[\"type\"]` which are dict-based, but our nodes are tuples: `(id, type, label, content, source)`. \n\nThe PiTreeAdapter has a bug where it's trying to access dictionary keys instead of tuple indices. I should fix that, but first let me verify what's actually in the hooks directory and whether scripts/ exists.","thinkingSignature":"31eeb43c97ff1baca5e61354ba9f73901211c56a122cc2a0feac0dee7a812219"},{"type":"toolCall","id":"call_function_k6odgvpli0f6_1","name":"bash","arguments":{"command":"ls /home/ubuntu/.hermes/belam-codex/hooks/ 2>/dev/null && echo \"---\" && find /home/ubuntu/.hermes/belam-codex/hooks/ -type f 2>/dev/null | head -20 && echo \"---\" && ls /home/ubuntu/.hermes/belam-codex/scripts/ 2>/dev/null || echo \"scripts/ dir not found\""}}],"api":"anthropic-messages","provider":"minimax","model":"MiniMax-M2.7","usage":{"input":43327,"output":287,"cacheRead":10071,"cacheWrite":0,"totalTokens":53685,"cost":{"input":0.0129981,"output":0.00034439999999999997,"cacheRead":0.0006042599999999999,"cacheWrite":0,"total":0.01394676}},"stopReason":"toolUse","timestamp":1777540415054,"responseId":"0642503f9fbab56a1907897a1ca43c0e"}}
{"type":"message","id":"10023137","parentId":"3663d9d1","timestamp":"2026-04-30T09:13:43.391Z","message":{"role":"toolResult","toolCallId":"call_function_k6odgvpli0f6_1","toolName":"bash","content":[{"type":"text","text":"memory-extract\npipeline-dispatch\nsupermap-boot\n---\n/home/ubuntu/.hermes/belam-codex/hooks/pipeline-dispatch/handler.ts\n/home/ubuntu/.hermes/belam-codex/hooks/pipeline-dispatch/HOOK.md\n/home/ubuntu/.hermes/belam-codex/hooks/supermap-boot/handler.ts\n/home/ubuntu/.hermes/belam-codex/hooks/supermap-boot/HOOK.md\n/home/ubuntu/.hermes/belam-codex/hooks/memory-extract/handler.ts\n/home/ubuntu/.hermes/belam-codex/hooks/memory-extract/HOOK.md\n---\n__pycache__\nagent_memory_update.py\nagent_pingpong.py\nagent_questions.py\nanalyze_experiment.py\nanalyze_local_results.py\narchive_session_transcript.py\narchived\naudit_primitives.py\nauto_wiggum.py\nbelam.sh\nbelam_extract.sh\nbelam_index.py\nbridge_watchdog.sh\nbuild_notebook.py\nbuild_report.py\ncleanup_stale_sessions.py\ncli_registry.py\ncodex_codec.py\ncodex_engine.py\ncodex_engine.py.pre_v2_modes_backup\ncodex_lm_platform.py\ncodex_lm_renderer.py\ncodex_materialize.py\ncodex_mcp_server.py\ncodex_panes.py\ncodex_ram.py\ncodex_stream.py\ncodex_watch.py\ncollect_mapper_results.py\ncommand_registry.py\ncreate_primitive.py\ncreate_revision_request.py\ndemo_tictactoe.py\ndependency_graph.py\ndispatch_adapters.py\ndocker-build.sh\ndocker-install.sh\ndocker-run.sh\ndocker-stop.sh\ndocker-update.sh\ndocker-validate.sh\nedit_primitive.py\nexport_agent_conversations.py\nexport_graph_data.py\nextract_session_memory.sh\nfinalize_memory_extraction.py\nfix_validate_scheme_b.py\ngateway_watchdog.sh\ngenerate_session_context.py\nhandoff_diff.py\nhermes_orchestrate.py\nhook_verification_report.md\ninstall_interface_bootstrap.py\ninstall_openclaw_hooks_plugin.py\nknowledge_quality_gate.py\nlaunch_analysis_pipeline.py\nlaunch_pipeline.py\nlaunch_pipeline.py.bak\nlog_memory.py\nmap_relationships.py\nmemory_daily_linker.py\nmemory_file_update_checker.py\nmemory_monthly_consolidation.py\nmemory_session_loader.py\nmemory_weekly_consolidation.py\nmigrate_pipeline_frontmatter.py\nmigrate_promotion_fields.py\nmigrate_task_schema_v2.py\nmobile_format.py\nmonitoring_views.py\nobserve.sh\nobserve_setup.sh\norchestrate_memory_extraction.py\norchestration_engine.py\norchestration_engine.py.bak\norchestration_engine.py.v1_backup\nparse_session_transcript.py\npersona_loader.py\npipeline_automate.py\npipeline_autorun.py\npipeline_autorun.py.bak\npipeline_dashboard.py\npipeline_orchestrate.py\npipeline_orchestrate.py.bak\npipeline_rewind.py\npipeline_stall_recovery.py\npipeline_update.py\npipeline_verify.py\npost_edit_hooks.py\nreactive_daemon.py\nrender_supermap.py\nreport_to_video.py\nrun_experiment.py\nrun_mapper_burst.py\nrun_memory_extraction.py\nrun_pipeline_stage.py\nruntime_resolution.py\nsetup_analysis_pipeline.py\nsetup_backtest_env.sh\nsetup_memory_crons.py\nsetup_pipeline.py\nsync_knowledge_repo.py\ntemplate_parser.py\ntemporal_overlay.py\ntemporal_schema\ntemporal_schema.py\ntemporal_sync.py\ntests\ntranscribe_audio.py\ntrigger_embed.py\nverify_hooks.py\nvideo_assembler.py\nvideo_script_generator.py\nvideo_subtitles.py\nvideo_thumbnail.py\nvideo_tts.py\nvideo_visuals.py\nwal_watcher.py\nweekly_knowledge_sync.py\nworld_api.py\n"}],"isError":false,"timestamp":1777540423391}}
{"type":"message","id":"9ed9fec2","parentId":"10023137","timestamp":"2026-04-30T09:14:05.022Z","message":{"role":"assistant","content":[{"type":"thinking","thinking":"So `hooks/` has 3 subdirs with TypeScript handlers. These are hook files, not Python. And `scripts/` has a huge number of Python CLI tools.\n\nThe hooks are TypeScript, so parsing them as-is wouldn't add much without a TypeScript parser. The scripts are Python files but many are complex. Let me think about what would be a meaningful, targeted change.\n\nLooking at the pi_tree_adapter.py, there's a bug: it uses `n[\"id\"]`, `n[\"type\"]`, `n[\"label\"]`, `n[\"content\"]`, `n[\"source\"]` — treating nodes as dicts — but our nodes are tuples: `(node_id, node_type, label, content, source)`. \n\nI need to fix the pi_tree_adapter.py to handle tuples correctly, but the real issue is that it's not even being called in the benchmark right now. I could add a Mermaid output format as a secondary metric, though that might bloat the benchmark. Another option is parsing the scripts/ directory to extract script_reference nodes, though these files are pretty complex and would need careful regex work.\n\nLooking at what's actually worthwhile here, I think the best move is to add a Mermaid diagram output to the benchmark since it directly measures visualization capability. The pi_tree_adapter.py already has tuple access bugs that would crash it anyway, so that's not viable. I could also try parsing hooks to create hook_reference nodes with metadata like command, trigger, and description.\n\nBut I'm realizing I should step back and look for something that could actually improve the primary metric. The graph_build_time_ms is already at the noise floor around 0.03ms, so the most realistic wins would be either a cold build optimization—maybe using persistent subprocess pre-loading or faster pickle protocol—or parsing more data sources to enrich the graph without hitting that floor.\n\nLooking at what's left to explore, the scripts directory is a goldmine with over 100 Python tools and no parsing at all, whereas the hooks directory only has 3 TypeScript files which would require a TypeScript parser to be useful. Since the lru_cache warm load is independent of data size, I could safely add script parsing to enrich the graph.\n\nThe pi_tree_adapter also has a critical bug where it's treating tuple nodes as dictionaries—the access patterns like `n[\"id\"]` and `n[\"label\"]` are completely wrong for tuple indexing, which would crash the code immediately.\n\nLet me prioritize what to tackle: the scripts/ parsing is worth doing since it's a massive unexplored source, and I should fix the pi_tree_adapter for correctness. But I'm also wondering if there's something more impactful—maybe the cold build path has room for optimization, or perhaps I could pre-load the graph cache at Python startup to eliminate that overhead entirely. Though actually, the cold build timing isn't even measured in the benchmark right now, so that's not the bottleneck here.\n\nLooking at what the benchmark actually measures: the warm path via lru_cache is O(1) and already at the hardware noise floor, the precomputed BFS paths make query_time_ms essentially free, and the ASCII rendering is fixed at 55 lines. The only thing left to improve is the node and edge count, which could grow with scripts/ parsing. Let me dig into the hooks directory and see what's actually there.","thinkingSignature":"886559cb8c582eea5cac46e03075b04463457430ea8ca412fd5bd24d4ddb6ee9"},{"type":"toolCall","id":"call_function_2aw9nbayvnit_1","name":"read","arguments":{"path":"/home/ubuntu/.hermes/belam-codex/hooks/memory-extract/HOOK.md"}},{"type":"toolCall","id":"call_function_2aw9nbayvnit_2","name":"read","arguments":{"path":"/home/ubuntu/.hermes/belam-codex/hooks/pipeline-dispatch/HOOK.md"}},{"type":"toolCall","id":"call_function_2aw9nbayvnit_3","name":"read","arguments":{"path":"/home/ubuntu/.hermes/belam-codex/hooks/supermap-boot/HOOK.md"}}],"api":"anthropic-messages","provider":"minimax","model":"MiniMax-M2.7","usage":{"input":44443,"output":801,"cacheRead":10071,"cacheWrite":0,"totalTokens":55315,"cost":{"input":0.0133329,"output":0.0009611999999999999,"cacheRead":0.0006042599999999999,"cacheWrite":0,"total":0.014898360000000001}},"stopReason":"toolUse","timestamp":1777540423394,"responseId":"06425047bb9a72fddcc4866fbcdc0571"}}
{"type":"message","id":"1854fa6b","parentId":"9ed9fec2","timestamp":"2026-04-30T09:14:05.045Z","message":{"role":"toolResult","toolCallId":"call_function_2aw9nbayvnit_1","toolName":"read","content":[{"type":"text","text":"---\nname: memory-extract\ndescription: \"Save session context and extract memories on /new or /reset\"\nmetadata:\n  openclaw:\n    emoji: \"🧠\"\n    events: [\"command\"]\n    requires:\n      config: [\"workspace.dir\"]\n---\n\n# Memory Extract Hook\n\nCombined session-memory + extraction hook. Fires on `/new` and `/reset` commands.\n\n**Step 1 — Save session context** (replaces bundled session-memory):\n- Writes a summary markdown file to `memory/YYYY-MM-DD-HHMM.md`\n- Uses timestamp slug (no LLM call — keeps it fast)\n\n**Step 2 — Extract primitives** (fire-and-forget):\n- Runs `extract_session_memory.sh` to parse the ended session transcript\n- Spawns sage agent in background to create memory/lesson/decision primitives\n- Tags every primitive with `instance:<name>`\n\nAll errors logged to `logs/memory-extract.log` for debugging.\n"}],"isError":false,"timestamp":1777540445045}}
{"type":"message","id":"d4e54bcd","parentId":"1854fa6b","timestamp":"2026-04-30T09:14:05.047Z","message":{"role":"toolResult","toolCallId":"call_function_2aw9nbayvnit_2","toolName":"read","content":[{"type":"text","text":"---\nname: pipeline-dispatch\ndescription: \"Auto-dispatch next pipeline agent when current agent completes a stage\"\nmetadata:\n  openclaw:\n    emoji: \"🔄\"\n    events: [\"agent:end\"]\n    requires:\n      config: [\"workspace.dir\"]\n---\n\n# Pipeline Dispatch Hook\n\nFires on `agent:end`. Checks the pipeline state JSON for a pending dispatch\n(written by `pipeline_orchestrate.py complete`). If found, spawns the next\nagent via native OpenClaw `sessions_spawn` — no CLI subprocess needed.\n\nThis replaces `fire_and_forget_dispatch` (Popen → `openclaw agent`) with\na native hook that runs inside the agent runtime and has direct API access.\n"}],"isError":false,"timestamp":1777540445047}}
{"type":"message","id":"1fa44f0e","parentId":"d4e54bcd","timestamp":"2026-04-30T09:14:05.048Z","message":{"role":"toolResult","toolCallId":"call_function_2aw9nbayvnit_3","toolName":"read","content":[{"type":"text","text":"---\nname: supermap-boot\ndescription: \"Regenerate Codex Engine supermap in AGENTS.md before each session bootstrap\"\nmetadata:\n  openclaw:\n    emoji: \"🗺️\"\n    events: [\"agent:bootstrap\"]\n    requires:\n      config: [\"workspace.dir\"]\n---\n\n# Supermap Boot Hook\n\nRuns `R boot` on every `agent:bootstrap` event to regenerate the Codex Engine \nsupermap section in AGENTS.md. This ensures the coordinate-addressable primitive map \nis always fresh in context without relying on separate embed_primitives runs.\n"}],"isError":false,"timestamp":1777540445048}}
