{"type":"message","id":"147b08e4","parentId":"6adc3016","timestamp":"2026-04-30T09:03:59.424Z","message":{"role":"toolResult","toolCallId":"call_function_egprzxd8if3z_2","toolName":"read","content":[{"type":"text","text":"#!/usr/bin/env python3\n\"\"\"\ngraph_builder.py - Modular graph construction for unified graph memory\nDB-augmented directed code generation via unified graph memory\n\"\"\"\n\nimport os\nimport re\nimport json\nimport time\nfrom functools import lru_cache\nfrom typing import List, Dict, Any, Optional, Tuple\nfrom collections import defaultdict\n\n# Pre-compiled regex patterns\n_RE_SECTION_SPLIT = re.compile(r'\\n(?=#)')\n_RE_CODE_BLOCK = re.compile(r'`([^`]+)`')\n_RE_FRONT_MATTER = re.compile(r'^---\\n(.*?)\\n---', re.DOTALL)\n_RE_YAML_PAIR = re.compile(r'^(\\w+):\\s*(.*)$')\n\n# Cache for gitnexus output\n_GITNEXUS_CACHE_FILE = None\n_gitnexus_cache = None\n\ndef init_cache(cache_dir: str):\n    \"\"\"Initialize cache file path.\"\"\"\n    global _GITNEXUS_CACHE_FILE, _gitnexus_cache\n    _GITNEXUS_CACHE_FILE = os.path.join(cache_dir, \".gitnexus_cache.json\")\n    if os.path.exists(_GITNEXUS_CACHE_FILE):\n        try:\n            mtime = os.path.getmtime(_GITNEXUS_CACHE_FILE)\n            age_hours = (time.time() - mtime) / 3600\n            if age_hours < 24:\n                with open(_GITNEXUS_CACHE_FILE) as f:\n                    _gitnexus_cache = f.read()\n        except Exception:\n            pass\n\ndef _save_cache(data: str):\n    \"\"\"Save gitnexus result to cache.\"\"\"\n    global _GITNEXUS_CACHE_FILE, _gitnexus_cache\n    _gitnexus_cache = data\n    if _GITNEXUS_CACHE_FILE:\n        try:\n            with open(_GITNEXUS_CACHE_FILE, 'w') as f:\n                f.write(data)\n        except Exception:\n            pass\n\nclass GraphBuilder:\n    \"\"\"Builds a unified graph from multiple source materials.\"\"\"\n    __slots__ = ('nodes', 'edges', 'adj', '_node_ids', '_section_stack', '_precomputed_paths', 'hub_reachable')\n\n    def __init__(self):\n        self.nodes: List[Dict[str, Any]] = []\n        self.edges: List[Dict[str, str]] = []\n        self.adj: Dict[str, List[str]] = defaultdict(list)\n        self._node_ids: set = set()\n        self._section_stack: List[int] = []\n        self._precomputed_paths: Dict[str, Any] = {}  # (start, end) -> path or None\n        self.hub_reachable: Dict[str, frozenset] = {}  # hub_id -> frozenset of reachable node ids\n\n    def add_node(self, node_type: str, label: str, content: str = \"\",\n                 source: str = \"\", node_id: Optional[str] = None) -> str:\n        \"\"\"Add a node to the graph as a compact tuple (id, type, label, content, source).\"\"\"\n        if node_id is None:\n            node_id = f\"{node_type}_{len(self.nodes)}\"\n\n        # Ensure unique ID\n        base_id = node_id\n        counter = 0\n        while node_id in self._node_ids:\n            counter += 1\n            node_id = f\"{base_id}_{counter}\"\n\n        self._node_ids.add(node_id)\n        # Store as tuple: smaller pickle, faster load than dict\n        self.nodes.append((node_id, node_type, label[:60], content[:120] if content else \"\", source))\n        return node_id\n\n    def add_edge(self, from_id: str, to_id: str, edge_type: str = \"references\"):\n        \"\"\"Add an edge between nodes.\"\"\"\n        if from_id in self._node_ids and to_id in self._node_ids:\n            self.edges.append({\"from\": from_id, \"to\": to_id, \"type\": edge_type})\n            self.adj[from_id].append(to_id)\n            self.adj[to_id].append(from_id)  # Bidirectional for traversal\n\n    def parse_agents_md(self, filepath: str) -> int:\n        \"\"\"Parse AGENTS.md into graph nodes.\"\"\"\n        if not os.path.exists(filepath):\n            return 0\n\n        with open(filepath, \"r\") as f:\n            content = f.read()\n\n        sections = _RE_SECTION_SPLIT.split(content)\n        last_section_idx = -1\n\n        for i, section in enumerate(sections):\n            lines = section.strip().split('\\n')\n            if not lines:\n                continue\n\n            header = lines[0].strip('#').strip()\n            body = '\\n'.join(lines[1:]).strip()[:120]\n\n            section_id = self.add_node(\n                \"doc_section\", header, body, \"AGENTS.md\",\n                f\"agents_section_{i}\"\n            )\n\n            if last_section_idx >= 0:\n                self.add_edge(\n                    f\"agents_section_{last_section_idx}\",\n                    section_id,\n                    \"sequential\"\n                )\n            last_section_idx = i\n\n            # Parse code references within section\n            for match in _RE_CODE_BLOCK.finditer(section):\n                code = match.group(1)\n                if len(code) > 3 and ' ' in code:\n                    ref_id = self.add_node(\n                        \"code_reference\", code[:60], code, \"AGENTS.md\",\n                        f\"code_ref_{match.start()}\"\n                    )\n                    self.add_edge(section_id, ref_id, \"contains\")\n\n        return i + 1\n\n    def parse_memory_files(self, memory_dir: str, limit: int = 10) -> int:\n        \"\"\"Parse memory files into graph nodes.\"\"\"\n        if not os.path.isdir(memory_dir):\n            return 0\n\n        memory_files = sorted(\n            [f for f in os.listdir(memory_dir) if f.endswith('.md')],\n            reverse=True\n        )[:limit]\n\n        count = 0\n        for filename in memory_files:\n            filepath = os.path.join(memory_dir, filename)\n            try:\n                with open(filepath, \"r\") as f:\n                    content = f.read()\n\n                # Extract session header\n                header_match = re.search(r'# Session: (.+)', content)\n                session_label = header_match.group(1) if header_match else filename[:-3]\n\n                # Extract conversation summary (first few paragraphs)\n                summary_match = re.search(r'## Conversation Summary\\s*\\n+(.+?)(?:\\n##|\\Z)', content, re.DOTALL)\n                summary = summary_match.group(1).strip()[:120] if summary_match else \"\"\n\n                session_id = self.add_node(\n                    \"memory_session\",\n                    session_label[:60],\n                    summary,\n                    f\"memory/{filename}\",\n                    f\"memory_{filename[:19]}\"  # Use date prefix as ID\n                )\n                count += 1\n\n                # Link to agents sections (approximate linking based on content)\n                if \"agent:main\" in content or \"model:\" in content:\n                    self.add_edge(session_id, \"agents_section_0\", \"references\")\n\n            except Exception:\n                pass\n\n        return count\n\n    def parse_schema_files(self, schema_dir: str) -> int:\n        \"\"\"Parse schema files into graph nodes. Creates entity + field nodes.\"\"\"\n        if not os.path.isdir(schema_dir):\n            return 0\n\n        count = 0\n        for filename in os.listdir(schema_dir):\n            if not filename.endswith(('.md', '.yaml', '.yml')):\n                continue\n\n            filepath = os.path.join(schema_dir, filename)\n            try:\n                with open(filepath, \"r\") as f:\n                    content = f.read()\n\n                # Extract primitive name\n                name_match = re.search(r'^primitive:\\s*(\\w+)', content, re.MULTILINE)\n                if name_match:\n                    schema_name = name_match.group(1)\n                    \n                    # Create entity node with field count summary\n                    field_nodes = []\n                    for field_match in re.finditer(r'^\\s+(\\w+):\\s*(\\w+)', content, re.MULTILINE):\n                        field_nodes.append((field_match.group(1), field_match.group(2)))\n                    \n                    field_count = len(field_nodes)\n                    entity_id = self.add_node(\n                        \"schema_entity\",\n                        schema_name,\n                        f\"{field_count} fields\",\n                        f\"schemas/{filename}\",\n                        f\"schema_{schema_name}\"\n                    )\n                    count += 1\n                    \n                    # Create field nodes (restores ~142 nodes for richer graph)\n                    for fname, ftype in field_nodes:\n                        field_id = self.add_node(\n                            \"schema_field\",\n                            f\"{schema_name}.{fname}\",\n                            ftype,\n                            f\"schemas/{filename}\",\n                            f\"field_{schema_name}_{fname}\"\n                        )\n                        self.add_edge(entity_id, field_id, \"has_field\")\n                        count += 1\n\n            except Exception:\n                pass\n\n        return count\n\n    def process_gitnexus_cache(self, cache_data: Optional[str]) -> int:\n        \"\"\"Process cached gitnexus data into graph nodes.\"\"\"\n        if not cache_data or not cache_data.strip():\n            return 0\n\n        try:\n            result = json.loads(cache_data)\n            count = 0\n\n            for category in ['definitions', 'process_symbols', 'processes']:\n                items = result.get(category, [])\n                for item in items[:30]:\n                    node_type = f\"gitnexus_{category.rstrip('s')}\"\n                    sym_id = self.add_node(\n                        node_type,\n                        item.get('name', item.get('id', ''))[:60],\n                        f\"{item.get('filePath', '')}:{item.get('startLine', '')}\",\n                        \"gitnexus_index\",\n                        f\"gitnexus_{category}_{item.get('id', str(hash(str(item))))}\"[:60]\n                    )\n                    count += 1\n\n                    # Link definitions to their source files\n                    if category == 'definitions' and 'filePath' in item:\n                        # Could link to schema nodes if matching\n                        pass\n\n            return count\n        except (json.JSONDecodeError, Exception):\n            return 0\n\n    def parse_decisions(self, decisions_dir: str, limit: int = 20) -> int:\n        \"\"\"Parse decision files into graph nodes with upstream/downstream edges.\"\"\"\n        if not os.path.isdir(decisions_dir):\n            return 0\n\n        files = sorted(os.listdir(decisions_dir), reverse=True)[:limit]\n        count = 0\n        decision_ids = {}  # slug -> node_id for upstream/downstream linking\n        file_contents = {}  # filename -> (content, meta) for second pass\n\n        # First pass: create nodes and collect metadata\n        for filename in files:\n            if not filename.endswith('.md'):\n                continue\n            filepath = os.path.join(decisions_dir, filename)\n            try:\n                with open(filepath, \"r\") as f:\n                    content = f.read()\n\n                # Extract frontmatter\n                fm_match = _RE_FRONT_MATTER.match(content)\n                meta = {}\n                if fm_match:\n                    for line in fm_match.group(1).split('\\n'):\n                        m = _RE_YAML_PAIR.match(line)\n                        if m:\n                            meta[m.group(1)] = m.group(2)\n\n                # Extract decision title\n                title_match = re.search(r'^#\\s+(.+)$', content, re.MULTILINE)\n                title = title_match.group(1)[:60] if title_match else filename[:-3]\n\n                # Extract key rationale\n                rationale_match = re.search(r'Decision\\s*\\n\\n(.+?)(?:\\n\\n|##)', content, re.DOTALL)\n                rationale = rationale_match.group(1).strip()[:100] if rationale_match else \"\"\n\n                status = meta.get('status', 'draft')\n                decision_slug = filename[:-3]\n                decision_id = self.add_node(\n                    \"decision\",\n                    title,\n                    rationale,\n                    f\"decisions/{filename}\",\n                    f\"decision_{decision_slug}\"\n                )\n                decision_ids[decision_slug] = decision_id\n                file_contents[filename] = (content, meta)\n                count += 1\n\n            except Exception:\n                pass\n\n        # Second pass: add upstream/downstream edges\n        for filename, (content, meta) in file_contents.items():\n            src_slug = filename[:-3]\n            src_id = decision_ids.get(src_slug)\n            if not src_id:\n                continue\n\n            for dir_key in ('upstream', 'downstream'):\n                refs_str = meta.get(dir_key, '').strip('[] ')\n                if not refs_str:\n                    continue\n                refs = [r.strip().strip(\"'\").strip('\"') for r in refs_str.split(',') if r.strip()]\n                for ref in refs[:5]:  # cap at 5 per direction\n                    tgt_id = decision_ids.get(ref)\n                    if tgt_id and tgt_id != src_id:\n                        self.add_edge(src_id, tgt_id, dir_key)\n\n        return count\n\n    def parse_lessons(self, lessons_dir: str, limit: int = 20) -> int:\n        \"\"\"Parse lesson files into graph nodes with upstream/downstream edges.\"\"\"\n        if not os.path.isdir(lessons_dir):\n            return 0\n\n        files = sorted(os.listdir(lessons_dir), reverse=True)[:limit]\n        count = 0\n        lesson_ids = {}  # slug -> node_id for upstream/downstream linking\n        file_meta = {}  # filename -> meta dict\n\n        # First pass: create nodes\n        for filename in files:\n            if not filename.endswith('.md'):\n                continue\n            filepath = os.path.join(lessons_dir, filename)\n            try:\n                with open(filepath, \"r\") as f:\n                    content = f.read()\n\n                # Extract frontmatter\n                fm_match = _RE_FRONT_MATTER.match(content)\n                meta = {}\n                if fm_match:\n                    for line in fm_match.group(1).split('\\n'):\n                        m = _RE_YAML_PAIR.match(line)\n                        if m:\n                            meta[m.group(1)] = m.group(2)\n\n                # Extract lesson title\n                title_match = re.search(r'^#\\s+(.+)$', content, re.MULTILINE)\n                title = title_match.group(1)[:60] if title_match else filename[:-3]\n\n                # Extract lesson summary\n                lesson_match = re.search(r'## Lesson\\s*\\n\\n(.+?)(?:\\n\\n|##)', content, re.DOTALL)\n                lesson_text = lesson_match.group(1).strip()[:100] if lesson_match else \"\"\n\n                lesson_slug = filename[:-3]\n                self.add_node(\n                    \"lesson\",\n                    title,\n                    lesson_text,\n                    f\"lessons/{filename}\",\n                    f\"lesson_{lesson_slug}\"\n                )\n                lesson_ids[lesson_slug] = f\"lesson_{lesson_slug}\"\n                file_meta[filename] = meta\n                count += 1\n\n            except Exception:\n                pass\n\n        # Second pass: add upstream/downstream edges between lessons\n        for filename, meta in file_meta.items():\n            src_slug = filename[:-3]\n            src_id = lesson_ids.get(src_slug)\n            if not src_id:\n                continue\n\n            for dir_key in ('upstream', 'downstream'):\n                refs_str = meta.get(dir_key, '').strip('[] ')\n                if not refs_str:\n                    continue\n                refs = [r.strip().strip(\"'\").strip('\"') for r in refs_str.split(',') if r.strip()]\n                for ref in refs[:5]:\n                    tgt_id = lesson_ids.get(ref)\n                    if tgt_id and tgt_id != src_id:\n                        self.add_edge(src_id, tgt_id, dir_key)\n\n        return count\n\n    def parse_tasks(self, tasks_dir: str, limit: int = 50) -> int:\n        \"\"\"Parse task files into graph nodes with status/priority edges.\"\"\"\n        if not os.path.isdir(tasks_dir):\n            return 0\n\n        files = sorted(os.listdir(tasks_dir), reverse=True)\n        # Filter to .md files only\n        md_files = [f for f in files if f.endswith('.md')][:limit]\n\n        task_ids = {}  # filename -> node_id for dependency linking\n        count = 0\n\n        for filename in md_files:\n            filepath = os.path.join(tasks_dir, filename)\n            try:\n                with open(filepath, \"r\") as f:\n                    content = f.read()\n\n                # Extract frontmatter\n                fm_match = _RE_FRONT_MATTER.match(content)\n                meta = {}\n                if fm_match:\n                    for line in fm_match.group(1).split('\\n'):\n                        m = _RE_YAML_PAIR.match(line)\n                        if m:\n                            meta[m.group(1)] = m.group(2)\n\n                # Extract task title\n                title_match = re.search(r'^#\\s+(.+)$', content, re.MULTILINE)\n                title = title_match.group(1)[:60] if title_match else filename[:-3]\n\n                # Extract goal summary (first paragraph after frontmatter)\n                goal_match = re.search(r'### Goal\\s*\\n\\n(.+?)(?:\\n\\n|##)', content, re.DOTALL)\n                goal_text = goal_match.group(1).strip()[:100] if goal_match else \"\"\n\n                status = meta.get('status', 'open')\n                priority = meta.get('priority', 'medium')\n                created = meta.get('created', '')\n\n                # Summary label: title + status\n                label = f\"{title[:50]}\"\n                summary = f\"{status}|{priority}|{created[:10]}|{goal_text[:40]}\"\n\n                task_key = filename[:-3]  # strip .md\n                task_id = self.add_node(\n                    \"task\",\n                    label,\n                    summary,\n                    f\"tasks/{filename}\",\n                    f\"task_{task_key[:50]}\"\n                )\n                task_ids[task_key] = task_id\n                count += 1\n\n            except Exception:\n                pass\n\n        # Second pass: add depends_on edges\n        for filename in md_files:\n            filepath = os.path.join(tasks_dir, filename)\n            try:\n                with open(filepath, \"r\") as f:\n                    content = f.read()\n                fm_match = _RE_FRONT_MATTER.match(content)\n                if not fm_match:\n                    continue\n                meta = {}\n                for line in fm_match.group(1).split('\\n'):\n                    m = _RE_YAML_PAIR.match(line)\n                    if m:\n                        meta[m.group(1)] = m.group(2)\n\n                dep_str = meta.get('depends_on', '').strip('[] ')\n                if not dep_str:\n                    continue\n\n                depends = [d.strip().strip(\"'\").strip('\"') for d in dep_str.split(',') if d.strip()]\n                src_key = filename[:-3]\n                src_id = task_ids.get(src_key)\n                if not src_id:\n                    continue\n\n                for dep in depends:\n                    dep_id = task_ids.get(dep)\n                    if dep_id:\n                        self.add_edge(src_id, dep_id, \"depends_on\")\n\n            except Exception:\n                pass\n\n        return count\n\n    def parse_goals(self, goals_dir: str) -> int:\n        \"\"\"Parse goal files into graph nodes with status/urgency metadata.\"\"\"\n        if not os.path.isdir(goals_dir):\n            return 0\n\n        files = sorted(os.listdir(goals_dir))\n        md_files = [f for f in files if f.endswith('.md')]\n        count = 0\n\n        for filename in md_files:\n            filepath = os.path.join(goals_dir, filename)\n            try:\n                with open(filepath, \"r\") as f:\n                    content = f.read()\n\n                # Extract frontmatter\n                fm_match = _RE_FRONT_MATTER.match(content)\n                meta = {}\n                if fm_match:\n                    for line in fm_match.group(1).split('\\n'):\n                        m = _RE_YAML_PAIR.match(line)\n                        if m:\n                            meta[m.group(1)] = m.group(2)\n\n                # Extract goal title\n                title_match = re.search(r'^#\\s+(.+)$', content, re.MULTILINE)\n                title = title_match.group(1)[:60] if title_match else filename[:-3]\n\n                # Extract \"Why Critical\" or first section for context\n                why_match = re.search(r'## Why[\\s\\S]*?\\n\\n(.+?)(?:\\n\\n|##)', content)\n                why_text = why_match.group(1).strip()[:100] if why_match else \"\"\n\n                status = meta.get('status', 'unknown')\n                priority = meta.get('priority', 'medium')\n                created = meta.get('created', '')\n\n                label = title[:50]\n                summary = f\"{status}|{priority}|{created[:10]}|{why_text[:40]}\"\n\n                self.add_node(\n                    \"goal\",\n                    label,\n                    summary,\n                    f\"goals/{filename}\",\n                    f\"goal_{filename[:-3]}\"\n                )\n                count += 1\n\n            except Exception:\n                pass\n        return count\n\n    def parse_agent_roles(self, agents_dir: str) -> int:\n        \"\"\"Parse agent role definition files into graph nodes.\"\"\"\n        if not os.path.isdir(agents_dir):\n            return 0\n\n        files = sorted(os.listdir(agents_dir))\n        md_files = [f for f in files if f.endswith('.md')]\n 