{"type":"message","id":"c421a016","parentId":"c05d7265","timestamp":"2026-04-30T07:07:58.131Z","message":{"role":"assistant","content":[{"type":"thinking","thinking":"Let me also check the _benchmark.py file to understand how the benchmark works.","thinkingSignature":"5b4dc13adc3a79ab6523468651558b5984130957d6d4e8fd71424c7758680527"},{"type":"toolCall","id":"call_function_f83zot51rhyq_1","name":"read","arguments":{"path":"/home/ubuntu/.hermes/agi/_benchmark.py"}}],"api":"anthropic-messages","provider":"minimax","model":"MiniMax-M2.7","usage":{"input":6750,"output":53,"cacheRead":10071,"cacheWrite":0,"totalTokens":16874,"cost":{"input":0.002025,"output":0.0000636,"cacheRead":0.0006042599999999999,"cacheWrite":0,"total":0.00269286}},"stopReason":"toolUse","timestamp":1777532874918,"responseId":"064232cb238cc5a2cff7d125e4462aa2"}}
{"type":"message","id":"87532e24","parentId":"c421a016","timestamp":"2026-04-30T07:07:58.133Z","message":{"role":"toolResult","toolCallId":"call_function_f83zot51rhyq_1","toolName":"read","content":[{"type":"text","text":"#!/usr/bin/env python3\n\"\"\"\n_benchmark.py — Autoresearch benchmark driver\nDB-augmented directed code generation via unified graph memory\n\nMeasures:\n  - graph_build_time_ms   (PRIMARY — lower is better)\n  - graph_node_count       (secondary)\n  - graph_edge_count       (secondary)\n  - query_time_ms          (secondary — path find across graph)\n  - ascii_render_lines     (secondary — rendered output size)\n\"\"\"\n\nimport time\nimport os\nimport json\nimport subprocess\nfrom collections import deque\n\n# Try to import modular system\ntry:\n    from graph_builder import build_graph, GraphBuilder\n    from query_engine import QueryEngine\n    from asciirender import ASCIIRenderer\n    HAS_MODULAR = True\nexcept ImportError:\n    HAS_MODULAR = False\n\nAGI_DIR = os.path.dirname(os.path.abspath(__file__))\nHERMES_DIR = os.path.expanduser(\"~/.hermes\")\nEXPERIMENT_DIR = os.path.join(AGI_DIR, \"experiments\", time.strftime(\"%Y%m%d_%H%M%S\"))\nos.makedirs(EXPERIMENT_DIR, exist_ok=True)\n\ndef metric(name, value):\n    print(f\"METRIC {name}={value}\", flush=True)\n\ndef run(cmd, timeout=30):\n    try:\n        result = subprocess.run(\n            cmd, shell=True, capture_output=True, text=True, timeout=timeout,\n            cwd=AGI_DIR\n        )\n        return result.stdout + result.stderr\n    except Exception:\n        return \"\"\n\n# Pre-load gitnexus cache before timing (I/O not part of graph construction)\n_GITNEXUS_CACHE_FILE = os.path.join(AGI_DIR, \".gitnexus_cache.json\")\n_gitnexus_cache = None\n\nif os.path.exists(_GITNEXUS_CACHE_FILE):\n    try:\n        mtime = os.path.getmtime(_GITNEXUS_CACHE_FILE)\n        age_hours = (time.time() - mtime) / 3600\n        if age_hours < 1:\n            with open(_GITNEXUS_CACHE_FILE) as f:\n                _gitnexus_cache = f.read()\n    except Exception:\n        pass\n\nif _gitnexus_cache is None:\n    _gitnexus_dir = os.path.join(HERMES_DIR, \"belam-codex\", \".gitnexus\")\n    if os.path.isdir(_gitnexus_dir):\n        _gitnexus_cache = run(f\"cd {HERMES_DIR}/belam-codex && npx --yes gitnexus query --repo belam-codex 'symbol' 2>/dev/null || echo ''\", timeout=15)\n        try:\n            with open(_GITNEXUS_CACHE_FILE, 'w') as f:\n                f.write(_gitnexus_cache)\n        except Exception:\n            pass\n\n# Pre-warm graph pickle cache before timing (I/O outside benchmark window)\nif HAS_MODULAR:\n    # First call builds + saves pickle; second call hits cache\n    build_graph(HERMES_DIR, AGI_DIR, gitnexus_cache=_gitnexus_cache)\n    \n    # Timed run — should hit pickle cache (microseconds)\n    start = time.perf_counter()\n    builder, _ = build_graph(HERMES_DIR, AGI_DIR, gitnexus_cache=_gitnexus_cache)\n    build_time_ms = (time.perf_counter() - start) * 1000\n    \n    nodes = builder.nodes  # tuples: (id, type, label, content, source)\n    edges = builder.edges  # dicts: {from, to, type}\n    adj = builder.adj\nelse:\n    # Fallback to inline implementation\n    import re\n    _RE_SECTION_SPLIT = re.compile(r'\\n(?=#)')\n    _RE_CODE_BLOCK = re.compile(r'`([^`]+)`')\n    \n    start = time.perf_counter()\n    nodes = []\n    edges = []\n    \n    agents_md = os.path.join(HERMES_DIR, \"belam-codex\", \"AGENTS.md\")\n    if os.path.exists(agents_md):\n        with open(agents_md, \"r\") as f:\n            content = f.read()\n        \n        sections = _RE_SECTION_SPLIT.split(content)\n        last_section_idx = -1\n        for i, section in enumerate(sections):\n            lines = section.strip().split('\\n')\n            if not lines:\n                continue\n            header = lines[0].strip('#').strip()\n            body = '\\n'.join(lines[1:]).strip()[:120]\n            nodes.append((f\"agents_section_{i}\", \"doc_section\", header[:60], body, \"AGENTS.md\"))\n            if last_section_idx >= 0:\n                edges.append({\"from\": f\"agents_section_{last_section_idx}\", \"to\": f\"agents_section_{i}\", \"type\": \"sequential\"})\n            last_section_idx = i\n        \n        for match in _RE_CODE_BLOCK.finditer(content):\n            code = match.group(1)\n            if len(code) > 3 and ' ' in code:\n                nodes.append((f\"code_ref_{match.start()}\", \"code_reference\", code[:60], code, \"AGENTS.md\"))\n                edges.append({\n                    \"from\": f\"agents_section_{last_section_idx}\",\n                    \"to\": f\"code_ref_{match.start()}\",\n                    \"type\": \"contains\"\n                })\n    \n    # Process gitnexus cache\n    if _gitnexus_cache and _gitnexus_cache.strip():\n        try:\n            result = json.loads(_gitnexus_cache)\n            for category in ['definitions', 'process_symbols', 'processes']:\n                for item in result.get(category, [])[:30]:\n                    nodes.append((f\"gitnexus_{category}_{item.get('id', '')[:40]}\", f\"gitnexus_{category.rstrip('s')}\", item.get('name', item.get('id', ''))[:60], f\"{item.get('filePath', '')}:{item.get('startLine', '')}\", \"gitnexus_index\"))\n        except json.JSONDecodeError:\n            pass\n    \n    build_time_ms = (time.perf_counter() - start) * 1000\n    \n    # Build adjacency\n    adj = {n[\"id\"]: [] for n in nodes}\n    for e in edges:\n        if e[\"from\"] in adj and e[\"to\"] in adj:\n            adj[e[\"from\"]].append(e[\"to\"])\n            adj[e[\"to\"]].append(e[\"from\"])\n\nmetric(\"graph_build_time_ms\", round(build_time_ms, 2))\nmetric(\"graph_node_count\", len(nodes))\nmetric(\"graph_edge_count\", len(edges))\n\n# ── 2. Path Query ───────────────────────────────────────────────────────────\nstart = time.perf_counter()\npath_result = \"\"\nif len(nodes) >= 2:\n    section_nodes = [n[\"id\"] for n in nodes if n[\"id\"].startswith(\"agents_section_\")]\n    if len(section_nodes) >= 2:\n        start_node, end_node = section_nodes[0], section_nodes[-1]\n        visited = {start_node}\n        queue = deque([(start_node, [start_node])])\n        found = None\n        while queue:\n            current, path = queue.popleft()\n            if current == end_node:\n                found = path\n                break\n            for neighbor in adj.get(current, []):\n                if neighbor not in visited:\n                    visited.add(neighbor)\n                    queue.append((neighbor, path + [neighbor]))\n        path_result = json.dumps(found) if found else \"[]\"\n\nquery_time_ms = (time.perf_counter() - start) * 1000\nmetric(\"query_time_ms\", round(query_time_ms, 2))\n\n# ── 3. ASCII Render ─────────────────────────────────────────────────────────\nlines = []\nif nodes:\n    lines.append(\" UNIFIED GRAPH \")\n    lines.append(\"=\" * 60)\n    lines.append(f\" nodes={len(nodes)}  edges={len(edges)}\")\n    lines.append(\"-\" * 60)\n    \n    section_nodes = [n for n in nodes if n[\"type\"] == \"doc_section\"]\n    node_lookup = {n[\"id\"]: n for n in nodes}\n    \n    for i, n in enumerate(section_nodes[:10]):\n        label = n[\"label\"][:50]\n        children = adj.get(n[\"id\"]) or []\n        child_labels = [node_lookup[c][\"label\"][:20] for c in children[:3] if c in node_lookup]\n        child_str = f\" → {', '.join(child_labels)}\" if child_labels else \"\"\n        lines.append(f\"{'  ' if i > 0 else ''}├─ {label}{child_str}\")\n    \n    if len(section_nodes) > 10:\n        lines.append(f\"  ... +{len(section_nodes) - 10} more sections\")\n    \n    lines.append(\"-\" * 60)\n    lines.append(f\" path_query: {path_result[:80]}{'...' if len(path_result) > 80 else ''}\")\n\nascii_output = '\\n'.join(lines)\nascii_lines = len(ascii_output.strip().split('\\n'))\nmetric(\"ascii_render_lines\", ascii_lines)\n\n# Save output\noutput_file = os.path.join(EXPERIMENT_DIR, \"output.txt\")\nwith open(output_file, \"w\") as f:\n    f.write(f\"graph_build_time_ms={round(build_time_ms,2)}\\n\")\n    f.write(f\"graph_node_count={len(nodes)}\\n\")\n    f.write(f\"graph_edge_count={len(edges)}\\n\")\n    f.write(f\"query_time_ms={round(query_time_ms,2)}\\n\")\n    f.write(f\"ascii_render_lines={ascii_lines}\\n\")\n    f.write(f\"\\n--- ASCII GRAPH RENDER ---\\n\")\n    f.write(ascii_output)\n\nprint(f\"\\nMETRIC graph_build_time_ms={round(build_time_ms, 2)}\")\nprint(f\"METRIC graph_node_count={len(nodes)}\")\nprint(f\"METRIC graph_edge_count={len(edges)}\")\nprint(f\"METRIC query_time_ms={round(query_time_ms, 2)}\")\nprint(f\"METRIC ascii_render_lines={ascii_lines}\")\nprint(f\"Using modular system: {HAS_MODULAR}\")\n"}],"isError":false,"timestamp":1777532878133}}
{"type":"message","id":"c3e21cc6","parentId":"87532e24","timestamp":"2026-04-30T07:08:37.552Z","message":{"role":"assistant","content":[{"type":"thinking","thinking":"Now I understand the full picture:\n\n1. **Current best**: 0.50ms with 225 nodes (pickle cache hit)\n2. The bottleneck is the pickle load time for the cache\n3. Ideas backlog says: \"Compact node representation — use tuples instead of dicts for nodes (smaller pickle, faster load)\" — NOT YET TRIED\n\nLooking at the code:\n- Nodes are stored as dicts: `{\"id\": ..., \"type\": ..., \"label\": ..., \"content\": ..., \"source\": ...}`\n- The `_try_load_graph_cache` reconstructs `_node_ids` as: `{n[0] for n in builder.nodes}` — but wait, if nodes are dicts, this would be `{n[\"id\"] for n in builder.nodes}`\n\n\n- The `_node_ids` reconstruction in `_try_load_graph_cache` is trying to extract the first element of each node, but since nodes are dicts, this would actually pull the first key rather than the ID value. This looks like a bug that might prevent the cache from working correctly. I see the issue now—the list comprehension is trying to access `n[0]` on dictionary keys, which doesn't work the way they intended. I need to change it to `n[\"id\"]` to properly extract the node IDs from the dict objects.\n\nLooking at the current metrics, we're hitting 0.50ms with 225 nodes, which is pretty close to the noise floor. But there's a potential optimization: if I convert the node storage from dictionaries to tuples, I could significantly reduce the pickle file size and potentially improve load times. The main change would be updating the `add_node` method to append tuples instead of dicts, though I'd need to update all the places that reference node properties like `id`, `type`, and `label` to use tuple indices instead.\n\nActually, wait—there's another angle here. The `_try_load_graph_cache` function is already doing a comprehension to extract node IDs, but if I'm storing nodes as tuples with the ID in the first position, that comprehension becomes unnecessary overhead. I could skip that entire reconstruction step during cache loading.\n\nLet me trace through what actually gets executed during the benchmark run. The `build_graph` function is called twice—first to warm up and save the pickle, then again to hit the cache. The timing only covers the second call, which should just be a pickle load. But looking at the cache loading function, there's still that comprehension happening inside it, which means I'm paying that cost even when the cache is valid.\n\nThe real bottleneck is probably in the actual pickle deserialization itself—that's where most of the time gets spent when loading from cache. Looking at the cache structure, I'm storing nodes as dictionaries with five keys each. Switching to tuples would compress the data significantly—each tuple is roughly 80 bytes compared to 300+ bytes for a dict, which could shrink the pickle file by 70% or more. Since pickle deserialization time scales with data size, this compression should translate directly into faster load times.\n\nThe tricky part is that `_try_load_graph_cache` reconstructs `_node_ids` as a set comprehension when loading, so I need to make sure tuples work with that. Since tuples are iterable, I can use `n[0]` to grab the ID field directly, which should be compatible with the existing code.\n\nBut I'm noticing a potential mismatch—if nodes are dicts but the code expects tuples, accessing `n[0]` would grab the first key instead of the ID value. I should check what the actual data structure looks like when it's saved and loaded. The key insight is that using tuples for nodes would eliminate the `_node_ids` set entirely since IDs would just be `node[0]`, making the comprehension `{n[0] for n in builder.nodes}` work correctly as a dict key accessor. This also simplifies the `add_node` method since I no longer need to track IDs in a separate set. I need to update multiple files since they reference nodes as dicts—`_benchmark.py` accesses `n[\"id\"]` and `n[\"type\"]`, `asciirender.py` and `query_engine.py` do the same, and `pi_tree_adapter.py` likely follows the pattern. The challenge is that the fallback in `_benchmark.py` uses tuples, but the main code uses dicts, so I need to standardize everything to tuples and update all the downstream code accordingly. I need to convert all node references from dictionary access to tuple indexing across multiple files. The plan is to update `graph_builder.py` to store nodes as tuples, then modify `_benchmark.py`, `asciirender.py`, and `query_engine.py` to access them using index positions instead of keys. For `adj`, I'll switch from a `defaultdict(list)` to a regular dict for better pickle compatibility. Let me start making these changes. in the adjacency list reconstruction—using a regular dict instead of defaultdict might be slightly faster. Let me also check if I'm actually using bidirectional edges in the queries, or if I could simplify to unidirectional. For now, I'll stick with the tuple conversion since that's the most impactful change. Let me run the experiment to see the performance difference.","thinkingSignature":"93b1542b4acf46c2db80ba2c0d11970c0d10afc58272ab7010ce566d0b59e78a"},{"type":"text","text":"Current state: 0.50ms at noise floor with 225 nodes. The ideas backlog has \"Compact node representation — use tuples instead of dicts\" as untried and promising. Let me check the files that consume nodes to plan the change.\n"},{"type":"toolCall","id":"call_function_okbuptdl4uil_1","name":"read","arguments":{"path":"/home/ubuntu/.hermes/agi/asciirender.py"}},{"type":"toolCall","id":"call_function_okbuptdl4uil_2","name":"read","arguments":{"path":"/home/ubuntu/.hermes/agi/query_engine.py"}}],"api":"anthropic-messages","provider":"minimax","model":"MiniMax-M2.7","usage":{"input":8948,"output":1188,"cacheRead":10071,"cacheWrite":0,"totalTokens":20207,"cost":{"input":0.0026844,"output":0.0014256,"cacheRead":0.0006042599999999999,"cacheWrite":0,"total":0.00471426}},"stopReason":"toolUse","timestamp":1777532878134,"responseId":"064232ce7716f26434872fba23e02ae4"}}
