{"type":"message","id":"ae780b76","parentId":"5e3d9406","timestamp":"2026-04-30T09:04:06.932Z","message":{"role":"toolResult","toolCallId":"call_function_uuz2phdzoao8_1","toolName":"read","content":[{"type":"text","text":"                    if tgt_id and tgt_id != src_id:\n                        self.add_edge(src_id, tgt_id, \"communicates_with\")\n\n            except Exception:\n                pass\n        return count\n\n    def parse_research_projects(self, hermes_dir: str) -> int:\n        \"\"\"Parse research/, projects/, modes/, runbooks/ directories into knowledge nodes.\n        \n        - research/: technical research documents (containerization, orchestration tooling, etc.)\n        - projects/: project definitions with frontmatter (status, priority, owner, tags)\n        - modes/: orchestration mode definitions (create, edit, extend, orchestrate)\n        - runbooks/: operational how-to guides\n        \n        Each becomes a knowledge node with category edges. Returns total nodes added.\n        \"\"\"\n        count = 0\n        base = os.path.join(hermes_dir, \"belam-codex\")\n\n        # research/ — technical documents (markdown prose, tables, code)\n        research_dir = os.path.join(base, \"research\")\n        if os.path.isdir(research_dir):\n            for filename in sorted(os.listdir(research_dir)):\n                if not filename.endswith('.md'):\n                    continue\n                filepath = os.path.join(research_dir, filename)\n                try:\n                    with open(filepath, \"r\") as f:\n                        content = f.read()\n                    title_match = re.search(r'^#\\s+(.+)$', content, re.MULTILINE)\n                    title = title_match.group(1).strip()[:60] if title_match else filename[:-3]\n                    # Extract first paragraph after metadata block\n                    body_match = re.search(r'(?:\\n\\n)(.+?)(?:\\n\\n|##)', content, re.DOTALL)\n                    body = body_match.group(1).strip()[:100] if body_match else \"\"\n                    node_id = self.add_node(\n                        \"knowledge\",\n                        title[:50],\n                        body,\n                        f\"research/{filename}\",\n                        f\"research_{filename[:-3]}\"\n                    )\n                    # Category edge\n                    cat_id = \"category_research\"\n                    if cat_id not in self._node_ids:\n                        self.add_node(\"tag\", \"research\", \"\", f\"research/{filename}\", cat_id)\n                    self.add_edge(node_id, cat_id, \"categorized_as\")\n                    count += 1\n                except Exception:\n                    pass\n\n        # projects/ — project definitions with frontmatter\n        projects_dir = os.path.join(base, \"projects\")\n        if os.path.isdir(projects_dir):\n            for filename in sorted(os.listdir(projects_dir)):\n                if not filename.endswith('.md'):\n                    continue\n                filepath = os.path.join(projects_dir, filename)\n                try:\n                    with open(filepath, \"r\") as f:\n                        content = f.read()\n                    fm_match = _RE_FRONT_MATTER.match(content)\n                    meta = {}\n                    if fm_match:\n                        for line in fm_match.group(1).split('\\n'):\n                            m = _RE_YAML_PAIR.match(line)\n                            if m:\n                                meta[m.group(1)] = m.group(2)\n                    title_match = re.search(r'^#\\s+(.+)$', content, re.MULTILINE)\n                    title = title_match.group(1).strip()[:60] if title_match else filename[:-3]\n                    status = meta.get('status', '')\n                    priority = meta.get('priority', '')\n                    tags_str = meta.get('tags', '[]')\n                    owner = meta.get('owner', '')\n                    summary = f\"{status}|{priority}|{owner[:20]}|{tags_str[:40]}\"\n                    node_id = self.add_node(\n                        \"knowledge\",\n                        title[:50],\n                        summary,\n                        f\"projects/{filename}\",\n                        f\"project_{filename[:-3]}\"\n                    )\n                    # Tag edges\n                    if tags_str and tags_str != '[]':\n                        tags = re.findall(r'[\\w-]+', tags_str)\n                        for tag in tags[:5]:\n                            tag_id = f\"tag_{tag}\"\n                            if tag_id not in self._node_ids:\n                                self.add_node(\"tag\", tag, \"\", f\"projects/{filename}\", tag_id)\n                            self.add_edge(node_id, tag_id, \"tagged_with\")\n                            count += 1\n                    # Category edge\n                    cat_id = \"category_project\"\n                    if cat_id not in self._node_ids:\n                        self.add_node(\"tag\", \"project\", \"\", f\"projects/{filename}\", cat_id)\n                    self.add_edge(node_id, cat_id, \"categorized_as\")\n                    count += 1\n                except Exception:\n                    pass\n\n        # modes/ — orchestration mode definitions (create, edit, extend, orchestrate)\n        modes_dir = os.path.join(base, \"modes\")\n        if os.path.isdir(modes_dir):\n            for filename in sorted(os.listdir(modes_dir)):\n                if not filename.endswith('.md'):\n                    continue\n                filepath = os.path.join(modes_dir, filename)\n                try:\n                    with open(filepath, \"r\") as f:\n                        content = f.read()\n                    title_match = re.search(r'^#\\s+(.+)$', content, re.MULTILINE)\n                    title = title_match.group(1).strip()[:60] if title_match else filename[:-3]\n                    # Extract first paragraph\n                    body_match = re.search(r'\\n\\n(.+?)(?:\\n\\n|##)', content, re.DOTALL)\n                    body = body_match.group(1).strip()[:100] if body_match else \"\"\n                    mode_type = filename[:-3]  # create, edit, extend, orchestrate\n                    node_id = self.add_node(\n                        \"agent_capability\",\n                        title[:50],\n                        body,\n                        f\"modes/{filename}\",\n                        f\"mode_{mode_type}\"\n                    )\n                    # Sequential edges between modes\n                    if hasattr(self, '_last_mode_id') and self._last_mode_id:\n                        self.add_edge(self._last_mode_id, node_id, \"next_mode\")\n                    self._last_mode_id = node_id\n                    count += 1\n                except Exception:\n                    pass\n\n        # runbooks/ — operational how-to guides\n        runbooks_dir = os.path.join(base, \"runbooks\")\n        if os.path.isdir(runbooks_dir):\n            for filename in sorted(os.listdir(runbooks_dir)):\n                if not filename.endswith('.md'):\n                    continue\n                filepath = os.path.join(runbooks_dir, filename)\n                try:\n                    with open(filepath, \"r\") as f:\n                        content = f.read()\n                    title_match = re.search(r'^#\\s+(.+)$', content, re.MULTILINE)\n                    title = title_match.group(1).strip()[:60] if title_match else filename[:-3]\n                    body_match = re.search(r'\\n\\n(.+?)(?:\\n\\n|##)', content, re.DOTALL)\n                    body = body_match.group(1).strip()[:100] if body_match else \"\"\n                    node_id = self.add_node(\n                        \"knowledge\",\n                        title[:50],\n                        body,\n                        f\"runbooks/{filename}\",\n                        f\"runbook_{filename[:-3]}\"\n                    )\n                    # Category edge\n                    cat_id = \"category_runbook\"\n                    if cat_id not in self._node_ids:\n                        self.add_node(\"tag\", \"runbook\", \"\", f\"runbooks/{filename}\", cat_id)\n                    self.add_edge(node_id, cat_id, \"categorized_as\")\n                    count += 1\n                except Exception:\n                    pass\n\n        # Reset _last_mode_id if it was set\n        if hasattr(self, '_last_mode_id'):\n            delattr(self, '_last_mode_id')\n\n        return count\n\n    def parse_pipelines(self, pipelines_dir: str) -> int:\n        \"\"\"Parse pipelines/ directory into pipeline + pipeline_stage nodes.\n\n        Each pipeline file has YAML frontmatter (version, status, priority, type,\n        agents, tags, project) and per-phase stage history tables.\n\n        Node types:\n          - pipeline: top-level pipeline record\n          - pipeline_stage: individual stage entries from stage history tables\n\n        Edges:\n          - has_stage: pipeline → pipeline_stage (ordered by occurrence)\n          - uses_agent: pipeline → agent_role\n          - tagged_with: pipeline → tag\n          - belongs_to_project: pipeline → knowledge (project)\n          - next_stage: pipeline_stage → pipeline_stage (temporal order)\n          - categorized_as: pipeline → tag (status, priority, type)\n        \"\"\"\n        if not os.path.isdir(pipelines_dir):\n            return 0\n\n        # Also scan archive/pipelines/\n        archive_pipelines = os.path.join(pipelines_dir, \"archive\")\n        dirs_to_scan = [pipelines_dir]\n        if os.path.isdir(archive_pipelines):\n            dirs_to_scan.append(archive_pipelines)\n\n        count = 0\n        _RE_STAGE_TABLE = re.compile(\n            r'^\\|\\s*Stage\\s*\\|.*?\\|.*?\\|.*?\\|.*?\\|\\n((?:\\|.*?\\n)+)',\n            re.MULTILINE\n        )\n        _RE_STAGE_ROW = re.compile(\n            r'^\\|\\s*([^|]+?)\\s*\\|\\s*([^|]+?)\\s*\\|\\s*([^|]+?)\\s*\\|\\s*(.+?)\\s*\\|$'\n        )\n        _RE_PHASE_SECTION = re.compile(\n            r'^## (Phase \\d+[^\\n]*)\\n.*?\\n(?:### Stage History\\n)?((?:\\|.*?\\n)+)',\n            re.MULTILINE\n        )\n        _RE_PHASE_SIMPLE = re.compile(r'^## (Phase \\d+[^\\n]*?)(?:\\n| )', re.MULTILINE)\n\n        for base_d in dirs_to_scan:\n            subdir = \"pipelines\" if base_d == pipelines_dir else \"archive/pipelines\"\n            try:\n                files = sorted(os.listdir(base_d))\n            except Exception:\n                continue\n\n            for filename in files:\n                if not filename.endswith('.md') or filename.startswith('.'):\n                    continue\n                # Skip non-pipeline files (e.g., handoffs/ subdir)\n                if not os.path.isfile(os.path.join(base_d, filename)):\n                    continue\n\n                filepath = os.path.join(base_d, filename)\n                try:\n                    with open(filepath, \"r\") as f:\n                        content = f.read()\n                except Exception:\n                    continue\n\n                # Extract YAML frontmatter\n                fm_match = _RE_FRONT_MATTER.match(content)\n                meta = {}\n                if fm_match:\n                    for line in fm_match.group(1).split('\\n'):\n                        m = _RE_YAML_PAIR.match(line)\n                        if m:\n                            meta[m.group(1)] = m.group(2).strip()\n\n                version = meta.get('version', filename[:-3])\n                status = meta.get('status', '')\n                priority = meta.get('priority', '')\n                ptype = meta.get('type', '')\n                agents_str = meta.get('agents', '')\n                tags_str = meta.get('tags', '[]')\n                project = meta.get('project', '')\n                pending = meta.get('pending_action', '')\n\n                # Extract title\n                title_match = re.search(r'^#\\s+Implementation Pipeline:\\s*(.+)$', content, re.MULTILINE)\n                title = title_match.group(1).strip()[:60] if title_match else version\n\n                pipeline_id = self.add_node(\n                    \"pipeline\",\n                    title[:50],\n                    f\"{status}|{priority}|{ptype}\",\n                    f\"{subdir}/{filename}\",\n                    f\"pipeline_{version}\"\n                )\n                count += 1\n\n                # Tag edges (from YAML tags)\n                if tags_str and tags_str != '[]':\n                    tags = re.findall(r'[\\w-]+', tags_str)\n                    for tag in tags[:8]:\n                        tag_id = f\"tag_{tag}\"\n                        if tag_id not in self._node_ids:\n                            self.add_node(\"tag\", tag, \"\", f\"{subdir}/{filename}\", tag_id)\n                        self.add_edge(pipeline_id, tag_id, \"tagged_with\")\n                        count += 1\n\n                # Agent edges\n                if agents_str:\n                    agents = re.findall(r'[\\w-]+', agents_str)\n                    for agent in agents[:6]:\n                        role_id = f\"agent_role_{agent}\"\n                        if role_id not in self._node_ids:\n                            self.add_node(\"agent_role\", agent, \"\", f\"{subdir}/{filename}\", role_id)\n                        self.add_edge(pipeline_id, role_id, \"uses_agent\")\n\n                # Status/priority/type category edges\n                for cat_val, cat_prefix in [(status, \"pipeline_status\"), (priority, \"pipeline_priority\"), (ptype, \"pipeline_type\")]:\n                    if cat_val:\n                        cat_id = f\"tag_{cat_prefix}_{cat_val}\"\n                        if cat_id not in self._node_ids:\n                            self.add_node(\"tag\", f\"{cat_prefix}:{cat_val}\", \"\", f\"{subdir}/{filename}\", cat_id)\n                        self.add_edge(pipeline_id, cat_id, \"categorized_as\")\n\n                # Project edge\n                if project:\n                    proj_id = f\"project_{project}\"\n                    if proj_id not in self._node_ids:\n                        self.add_node(\"knowledge\", project, f\"project:{project}\", f\"{subdir}/{filename}\", proj_id)\n                        count += 1\n                    self.add_edge(pipeline_id, proj_id, \"belongs_to_project\")\n\n                # Extract stage history: parse all | Stage | Date | Agent | Notes | table rows\n                all_stages = []\n                # Find phase sections with stage history tables\n                for ph_match in _RE_PHASE_SECTION.finditer(content):\n                    phase_name = ph_match.group(1).strip()\n                    table_block = ph_match.group(2)\n                    for row_match in _RE_STAGE_ROW.finditer(table_block):\n                        stage_name = row_match.group(1).strip()\n                        stage_date = row_match.group(2).strip()\n                        stage_agent = row_match.group(3).strip()\n                        stage_notes = row_match.group(4).strip()[:80]\n                        all_stages.append((stage_name, stage_date, stage_agent, stage_notes))\n\n                # Also extract standalone stage tables (some pipelines put them without phase headers)\n                if not all_stages:\n                    for tbl_match in _RE_STAGE_TABLE.finditer(content):\n                        table_block = tbl_match.group(1)\n                        for row_match in _RE_STAGE_ROW.finditer(table_block):\n                            stage_name = row_match.group(1).strip()\n                            stage_date = row_match.group(2).strip()\n                            stage_agent = row_match.group(3).strip()\n                            stage_notes = row_match.group(4).strip()[:80]\n                            all_stages.append((stage_name, stage_date, stage_agent, stage_notes))\n\n                # Create pipeline_stage nodes\n                prev_stage_id = None\n                for (stage_name, stage_date, stage_agent, stage_notes) in all_stages[:40]:\n                    stage_id = self.add_node(\n                        \"pipeline_stage\",\n                        stage_name[:40],\n                        f\"{stage_date}|{stage_agent}|{stage_notes}\",\n                        f\"{subdir}/{filename}#{stage_name}\",\n                        f\"pipeline_{version}_stage_{stage_name}\"\n                    )\n                    count += 1\n                    self.add_edge(pipeline_id, stage_id, \"has_stage\")\n                    if prev_stage_id:\n                        self.add_edge(prev_stage_id, stage_id, \"next_stage\")\n                    prev_stage_id = stage_id\n\n                    # Agent node for stage actor\n                    if stage_agent and stage_agent not in ('unknown', 'belam-main'):\n                        role_id = f\"agent_role_{stage_agent}\"\n                        if role_id not in self._node_ids:\n                            self.add_node(\"agent_role\", stage_agent, \"\", f\"{subdir}/{filename}\", role_id)\n                        self.add_edge(stage_id, role_id, \"executed_by\")\n\n                # Phase summary nodes (Phase 1, Phase 2, etc.)\n                phase_names_seen = set()\n                for ph_match in _RE_PHASE_SIMPLE.finditer(content):\n                    phase_name = ph_match.group(1).strip()\n                    if phase_name not in phase_names_seen:\n                        phase_names_seen.add(phase_name)\n                        phase_id = self.add_node(\n                            \"pipeline_phase\",\n                            phase_name[:40],\n                            \"\",\n                            f\"{subdir}/{filename}#{phase_name}\",\n                            f\"pipeline_{version}_phase_{len(phase_names_seen)}\"\n                        )\n                        count += 1\n                        self.add_edge(pipeline_id, phase_id, \"has_phase\")\n\n        return count\n\n    def parse_templates(self, templates_dir: str) -> int:\n        \"\"\"Parse templates/ directory into template_stage nodes.\n\n        Templates define pipeline stage patterns with YAML stage definitions.\n        Each template has a type, phases, and named stages per phase.\n\n        Node type: template_stage (extracted stage definitions from YAML blocks)\n        Edges: follows_template → pipeline_stage (if a pipeline uses this template)\n        \"\"\"\n        if not os.path.isdir(templates_dir):\n            return 0\n\n        count = 0\n        _RE_YAML_BLOCK = re.compile(r'```yaml\\n(.*?)\\n```', re.DOTALL)\n        _RE_PHASE_HDR = re.compile(r'^###\\s+Phase\\s+(\\d+)([^\\n]*)\\n', re.MULTILINE)\n        _RE_STAGE_HDR = re.compile(r'^####\\s+`([\\w_]+)`\\n', re.MULTILINE)\n        _RE_YAML_KEY = re.compile(r'^(\\s*)([\\w_]+):\\s*(.*)$', re.MULTILINE)\n\n        try:\n            files = sorted(os.listdir(templates_dir))\n        except Exception:\n            return 0\n\n        for filename in files:\n            if not filename.endswith('.md') or filename.startswith('.') or filename == 'retired':\n                continue\n            filepath = os.path.join(templates_dir, filename)\n            if not os.path.isfile(filepath):\n                continue\n\n            try:\n                with open(filepath, \"r\") as f:\n                    content = f.read()\n            except Exception:\n                continue\n\n            # Template-level info\n            title_match = re.search(r'^#\\s+(.+)$', content, re.MULTILINE)\n            title = title_match.group(1).strip()[:60] if title_match else filename[:-3]\n            tmpl_id = f\"template_{filename[:-3]}\"\n            self.add_node(\"reference\", title[:50], f\"template:{filename}\", f\"templates/{filename}\", tmpl_id)\n            count += 1\n\n            # Category edge\n            cat_id = \"category_template\"\n            if cat_id not in self._node_ids:\n                self.add_node(\"tag\", \"template\", \"\", f\"templates/{filename}\", cat_id)\n                count += 1\n            self.add_edge(tmpl_id, cat_id, \"categorized_as\")\n\n            # Extract YAML blocks (stage definitions)\n            yaml_blocks = list(_RE_YAML_BLOCK.finditer(content))\n\n            # Extract phase + stage hierarchy from markdown headings\n            current_phase = None\n            current_stage = None\n            phase_ids = []\n\n            for line_num, line in enumerate(content.split('\\n'), 1):\n                ph_match = _RE_PHASE_HDR.match(line)\n                if ph_match:\n                    phase_num = ph_match.group(1)\n                    phase_suffix = ph_match.group(2).strip()[:40]\n                    phase_id = f\"template_{filename[:-3]}_phase{phase_num}\"\n                    self.add_node(\"reference\", f\"Phase {phase_num} {phase_suffix}\", \"\", f\"templates/{filename}#phase{phase_num}\", phase_id)\n                    count += 1\n                    self.add_edge(tmpl_id, phase_id, \"has_phase\")\n                    if phase_ids:\n                        self.add_edge(phase_ids[-1], phase_id, \"next_phase\")\n                    phase_ids.append(phase_id)\n                    current_phase = phase_id\n                    current_stage = None\n                    continue\n\n                st_match = _RE_STAGE_HDR.match(line)\n                if st_match and current_phase:\n                    stage_name = st_match.group(1)\n                    stage_id = f\"template_{filename[:-3]}_stage_{stage_name}\"\n                    self.add_node(\"reference\", stage_name, f\"phase:{current_phase}\", f\"templates/{filename}#{stage_name}\", stage_id)\n                    count += 1\n                    self.add_edge(current_phase, stage_id, \"has_stage\")\n                    current_stage = 