{"type":"message","id":"68d19997","parentId":"805b2f18","timestamp":"2026-04-30T09:15:26.826Z","message":{"role":"toolResult","toolCallId":"call_function_c13o3sekvvs9_1","toolName":"edit","content":[{"type":"text","text":"Successfully replaced 1 block(s) in /home/ubuntu/.hermes/agi/graph_builder.py."}],"details":{"diff":"      ...\n 2016                     count += 1\n 2017 \n 2018         return count\n 2019 \n+2020     def parse_hooks(self, hooks_dir: str) -> int:\n+2021         \"\"\"Parse hermes/belam-codex/hooks/ for hook reference nodes.\n+2022         \n+2023         Each hook has HOOK.md with frontmatter (name, description, events, requires)\n+2024         and a handler.ts TypeScript file. Creates hook_reference nodes with\n+2025         event-based edges to the hook system.\n+2026         \"\"\"\n+2027         if not os.path.isdir(hooks_dir):\n+2028             return 0\n+2029 \n+2030         count = 0\n+2031         hook_subdirs = ['memory-extract', 'pipeline-dispatch', 'supermap-boot']\n+2032 \n+2033         for subdir in hook_subdirs:\n+2034             hook_md = os.path.join(hooks_dir, subdir, 'HOOK.md')\n+2035             if not os.path.exists(hook_md):\n+2036                 continue\n+2037             try:\n+2038                 with open(hook_md, 'r') as f:\n+2039                     content = f.read()\n+2040 \n+2041                 fm_match = _RE_FRONT_MATTER.match(content)\n+2042                 meta = {}\n+2043                 if fm_match:\n+2044                     for line in fm_match.group(1).split('\\n'):\n+2045                         m = _RE_YAML_PAIR.match(line)\n+2046                         if m:\n+2047                             meta[m.group(1)] = m.group(2)\n+2048 \n+2049                 hook_name = meta.get('name', subdir)\n+2050                 description = meta.get('description', '')\n+2051                 events_str = meta.get('metadata.openclaw.events', '[]')\n+2052                 requires_str = meta.get('metadata.openclaw.requires.config', '[]')\n+2053 \n+2054                 # Extract first body paragraph as summary\n+2055                 body_match = re.search(r'(?:^---.*?---\\n\\n)(.+?)(?:\\n\\n|##)', content, re.DOTALL)\n+2056                 body = body_match.group(1).strip()[:100] if body_match else description[:100]\n+2057 \n+2058                 node_id = self.add_node(\n+2059                     \"hook_reference\",\n+2060                     hook_name[:50],\n+2061                     body[:80],\n+2062                     f\"hooks/{subdir}/HOOK.md\",\n+2063                     f\"hook_{hook_name.replace('-', '_').replace(' ', '_')}\"\n+2064                 )\n+2065                 count += 1\n+2066 \n+2067                 # Event-based edges (what triggers this hook)\n+2068                 events = re.findall(r'\\w+(?:/\\w+)*', events_str)\n+2069                 for event in events[:3]:\n+2070                     event_id = f\"tag_hook_event_{event.replace('/', '_')}\"\n+2071                     if event_id not in self._node_ids:\n+2072                         self.add_node(\"tag\", event, f\"hook event: {event}\", f\"hooks/{subdir}/HOOK.md\", event_id)\n+2073                         count += 1\n+2074                     self.add_edge(node_id, event_id, \"fires_on\")\n+2075 \n+2076             except Exception:\n+2077                 pass\n+2078         return count\n+2079 \n+2080     def parse_scripts(self, scripts_dir: str) -> int:\n+2081         \"\"\"Parse belam-codex/scripts/ Python CLI tools as script_reference nodes.\n+2082         \n+2083         Selects ~40 key operational scripts (CLI tools, not internal modules).\n+2084         For each script, creates a script_reference node. Top-level def/class names\n+2085         become child nodes (script_function, script_class). Filters out:\n+2086         private (leading _), test files, .pyc, backups, __init__, __pycache__.\n+2087         \"\"\"\n+2088         if not os.path.isdir(scripts_dir):\n+2089             return 0\n+2090 \n+2091         _RE_SHEBANG = re.compile(r'^#!.*python', re.IGNORECASE)\n+2092         _RE_CLI_DECORATOR = re.compile(r'@(cli|command|argument|option)\\(', re.MULTILINE)\n+2093         _RE_TOP_DEF = re.compile(r'^def\\s+(\\w+)\\s*\\(', re.MULTILINE)\n+2094         _RE_TOP_CLASS = re.compile(r'^class\\s+(\\w+)\\s*[:(]', re.MULTILINE)\n+2095 \n+2096         # Target scripts: CLI tools (not internal modules, not tests, not backups)\n+2097         SKIP_PREFIXES = ('__', '_', 'tests/', 'archived/')\n+2098         SKIP_SUFFIXES = ('.pyc', '.bak', '.backup', '_backup', '.v1_backup', \n+2099                          '.pre_v2_modes_backup')\n+2100         TARGET_SCRIPTS = [\n+2101             'belam.sh', 'belam_extract.sh', 'build_notebook.py', 'cli_registry.py',\n+2102             'codex_codec.py', 'codex_engine.py', 'codex_lm_platform.py',\n+2103             'codex_lm_renderer.py', 'codex_materialize.py', 'codex_mcp_server.py',\n+2104             'codex_ram.py', 'codex_stream.py', 'codex_watch.py',\n+2105             'command_registry.py', 'create_primitive.py', 'dispatch_adapters.py',\n+2106             'export_graph_data.py', 'generate_session_context.py',\n+2107             'handoff_diff.py', 'hermes_orchestrate.py',\n+2108             'launch_analysis_pipeline.py', 'launch_pipeline.py',\n+2109             'log_memory.py', 'map_relationships.py', 'memory_daily_linker.py',\n+2110             'memory_file_update_checkcheck.py', 'memory_monthly_consolidation.py',\n+2111             'memory_session_loader.py', 'memory_weekly_consolidation.py',\n+2112             'migrate_pipeline_frontmatter.py', 'migrate_promotion_fields.py',\n+2113             'migrate_task_schema_v2.py', 'orchestration_engine.py',\n+2114             'parse_session_transcript.py', 'persona_loader.py',\n+2115             'pipeline_automate.py', 'pipeline_autorun.py', 'pipeline_dashboard.py',\n+2116             'pipeline_orchestrate.py', 'pipeline_rewind.py',\n+2117             'pipeline_stall_recovery.py', 'pipeline_update.py', 'pipeline_verify.py',\n+2118             'render_supermap.py', 'run_experiment.py', 'run_memory_extraction.py',\n+2119             'run_pipeline_stage.py', 'runtime_resolution.py', 'setup_analysis_pipeline.py',\n+2120             'setup_backtest_env.sh', 'setup_memory_crons.py', 'setup_pipeline.py',\n+2121             'sync_knowledge_repo.py', 'template_parser.py', 'temporal_overlay.py',\n+2122             'temporal_sync.py', 'transcribe_audio.py', 'trigger_embed.py',\n+2123             'video_thumbnail_generator.py', 'video_tts.py', 'weekly_knowledge_sync.py',\n+2124         ]\n+2125         # Map to actual filenames (some may not exist, that's fine)\n+2126         target_set = set(TARGET_SCRIPTS)\n+2127 \n+2128         count = 0\n+2129         skipped_private = 0\n+2130 \n+2131         for filename in sorted(os.listdir(scripts_dir)):\n+2132             if filename in SKIP_SUFFIXES:\n+2133                 skipped_private += 1\n+2134                 continue\n+2135             if any(filename.startswith(p) for p in SKIP_PREFIXES):\n+2136                 skipped_private += 1\n+2137                 continue\n+2138             if not (filename.endswith('.py') or filename.endswith('.sh')):\n+2139                 continue\n+2140             # Only parse target scripts (keep it selective)\n+2141             if filename not in target_set:\n+2142                 continue\n+2143 \n+2144             filepath = os.path.join(scripts_dir, filename)\n+2145             if not os.path.isfile(filepath):\n+2146                 continue\n+2147 \n+2148             try:\n+2149                 with open(filepath, 'r') as f:\n+2150                     content = f.read(4096)  # Read first 4KB for header parsing\n+2151 \n+2152                 lines = content.split('\\n')\n+2153                 is_cli = False\n+2154 \n+2155                 # Detect CLI tool: shebang or @cli decorator\n+2156                 if lines and (_RE_SHEBANG.match(lines[0]) or 'argparse' in content[:500] or 'click' in content[:500]):\n+2157                     is_cli = True\n+2158                 elif _RE_CLI_DECORATOR.search(content[:500]):\n+2159                     is_cli = True\n+2160 \n+2161                 # Extract docstring title\n+2162                 doc_match = re.search(r'\"\"\"\\n?(.+?)\"\"\"', content[:1000], re.DOTALL)\n+2163                 title = doc_match.group(1).strip().split('\\n')[0][:80] if doc_match else filename\n+2164 \n+2165                 # Determine script type\n+2166                 if filename.endswith('.sh'):\n+2167                     script_type = 'shell_script'\n+2168                 else:\n+2169                     script_type = 'script_reference'\n+2170 \n+2171                 node_id = self.add_node(\n+2172                     script_type,\n+2173                     title[:50],\n+2174                     f\"cli:{is_cli}\",\n+2175                     f\"scripts/{filename}\",\n+2176                     f\"script_{filename.replace('.', '_')}\"\n+2177                 )\n+2178                 count += 1\n+2179 \n+2180                 # Extract top-level defs and classes (fast: first 4KB of each file)\n+2181                 for def_match in _RE_TOP_DEF.finditer(content):\n+2182                     fn_name = def_match.group(1)\n+2183                     if fn_name.startswith('_') and fn_name != '__init__':\n+2184                         continue\n+2185                     # Skip dunder methods that aren't __init__\n+2186                     if fn_name.startswith('__'):\n+2187                         continue\n+2188                     fn_id = self.add_node(\n+2189                         \"script_function\",\n+2190                         fn_name[:50],\n+2191                         \"\",\n+2192                         f\"scripts/{filename}\",\n+2193                         f\"fn_{filename[:-3]}_{fn_name}\"\n+2194                     )\n+2195                     self.add_edge(node_id, fn_id, \"defines\")\n+2196                     count += 1\n+2197 \n+2198                 for cls_match in _RE_TOP_CLASS.finditer(content):\n+2199                     cls_name = cls_match.group(1)\n+2200                     if cls_name.startswith('_'):\n+2201                         continue\n+2202                     # Skip common stdlib wrappers\n+2203                     if cls_name in ('Optional', 'List', 'Dict', 'Any', 'Tuple', \n+2204                                      'Callable', 'Type', 'Union', 'Literal'):\n+2205                         continue\n+2206                     cls_id = self.add_node(\n+2207                         \"script_class\",\n+2208                         cls_name[:50],\n+2209                         \"\",\n+2210                         f\"scripts/{filename}\",\n+2211                         f\"cls_{filename[:-3]}_{cls_name}\"\n+2212                     )\n+2213                     self.add_edge(node_id, cls_id, \"defines\")\n+2214                     count += 1\n+2215 \n+2216             except Exception:\n+2217                 pass\n+2218         return count\n+2219 \n 2020     def build_tag_bridges(self, hermes_dir: str) -> int:\n 2021         \"\"\"Bridge isolated clusters via shared tags.\n 2022 \n 2023         Decisions, lessons, and tasks are largely isolated (94% unreachable in 5 hops).\n      ...","firstChangedLine":2020},"isError":false,"timestamp":1777540526826}}
{"type":"message","id":"786b47f5","parentId":"68d19997","timestamp":"2026-04-30T09:15:39.505Z","message":{"role":"assistant","content":[{"type":"thinking","thinking":"Now I need to:\n1. Add calls to `parse_hooks()` and `parse_scripts()` in both `_cached_build_builder()` and the cold build path\n2. Bump `_cache_ver` from 11 to 12\n\nLet me find the right place to add these calls in `_cached_build_builder()` and the cold build path.","thinkingSignature":"7d1ffe2b47c6a4c0ed15545d61cace47b788d8e589de047bf793d7aa880b0b76"},{"type":"text","text":"Now wire the new parsers into both build paths and bump the cache version:\n"},{"type":"toolCall","id":"call_function_lxu6feuxi0gd_1","name":"edit","arguments":{"path":"/home/ubuntu/.hermes/agi/graph_builder.py","edits":[{"oldText":"    # Parse templates/ (pipeline stage templates with YAML definitions)\n    templates_dir = os.path.join(hermes_dir, \"belam-codex\", \"templates\")\n    if os.path.isdir(templates_dir):\n        builder.parse_templates(templates_dir)\n\n    # Bridge isolated clusters via shared tags (170 tags span decision/lesson/task)\n    builder.build_tag_bridges(hermes_dir)","newText":"    # Parse templates/ (pipeline stage templates with YAML definitions)\n    templates_dir = os.path.join(hermes_dir, \"belam-codex\", \"templates\")\n    if os.path.isdir(templates_dir):\n        builder.parse_templates(templates_dir)\n\n    # Parse hooks/ (3 hook definitions with event-based trigger metadata)\n    hooks_dir = os.path.join(hermes_dir, \"belam-codex\", \"hooks\")\n    if os.path.isdir(hooks_dir):\n        builder.parse_hooks(hooks_dir)\n\n    # Parse scripts/ (~40 Python CLI tools with top-level def/class nodes)\n    scripts_dir = os.path.join(hermes_dir, \"belam-codex\", \"scripts\")\n    if os.path.isdir(scripts_dir):\n        builder.parse_scripts(scripts_dir)\n\n    # Bridge isolated clusters via shared tags (170 tags span decision/lesson/task)\n    builder.build_tag_bridges(hermes_dir)"},{"oldText":"    # Parse templates/ (pipeline stage templates with YAML definitions)\n    templates_dir = os.path.join(hermes_dir, \"belam-codex\", \"templates\")\n    if os.path.isdir(templates_dir):\n        builder.parse_templates(templates_dir)\n\n    # Bridge isolated clusters via shared tags\n    builder.build_tag_bridges(hermes_dir)","newText":"    # Parse templates/ (pipeline stage templates with YAML definitions)\n    templates_dir = os.path.join(hermes_dir, \"belam-codex\", \"templates\")\n    if os.path.isdir(templates_dir):\n        builder.parse_templates(templates_dir)\n\n    # Parse hooks/ (3 hook definitions with event-based trigger metadata)\n    hooks_dir = os.path.join(hermes_dir, \"belam-codex\", \"hooks\")\n    if os.path.isdir(hooks_dir):\n        builder.parse_hooks(hooks_dir)\n\n    # Parse scripts/ (~40 Python CLI tools with top-level def/class nodes)\n    scripts_dir = os.path.join(hermes_dir, \"belam-codex\", \"scripts\")\n    if os.path.isdir(scripts_dir):\n        builder.parse_scripts(scripts_dir)\n\n    # Bridge isolated clusters via shared tags\n    builder.build_tag_bridges(hermes_dir)"},{"oldText":"        builder = _cached_build_builder(hermes_dir, agi_dir, gitnexus_hash, _cache_ver=11)","newText":"        builder = _cached_build_builder(hermes_dir, agi_dir, gitnexus_hash, _cache_ver=12)"}]}}],"api":"anthropic-messages","provider":"minimax","model":"MiniMax-M2.7","usage":{"input":51635,"output":818,"cacheRead":10071,"cacheWrite":0,"totalTokens":62524,"cost":{"input":0.015490499999999999,"output":0.0009816,"cacheRead":0.0006042599999999999,"cacheWrite":0,"total":0.01707636}},"stopReason":"toolUse","timestamp":1777540526827,"responseId":"064250afd14e9e59df1120978574ff79"}}
{"type":"message","id":"ce80b71a","parentId":"786b47f5","timestamp":"2026-04-30T09:15:39.533Z","message":{"role":"toolResult","toolCallId":"call_function_lxu6feuxi0gd_1","toolName":"edit","content":[{"type":"text","text":"Successfully replaced 3 block(s) in /home/ubuntu/.hermes/agi/graph_builder.py."}],"details":{"diff":"      ...\n 2588     templates_dir = os.path.join(hermes_dir, \"belam-codex\", \"templates\")\n 2589     if os.path.isdir(templates_dir):\n 2590         builder.parse_templates(templates_dir)\n 2591 \n+2592     # Parse hooks/ (3 hook definitions with event-based trigger metadata)\n+2593     hooks_dir = os.path.join(hermes_dir, \"belam-codex\", \"hooks\")\n+2594     if os.path.isdir(hooks_dir):\n+2595         builder.parse_hooks(hooks_dir)\n+2596 \n+2597     # Parse scripts/ (~40 Python CLI tools with top-level def/class nodes)\n+2598     scripts_dir = os.path.join(hermes_dir, \"belam-codex\", \"scripts\")\n+2599     if os.path.isdir(scripts_dir):\n+2600         builder.parse_scripts(scripts_dir)\n+2601 \n 2592     # Bridge isolated clusters via shared tags (170 tags span decision/lesson/task)\n 2593     builder.build_tag_bridges(hermes_dir)\n 2594 \n 2595     # Process gitnexus cache\n      ...\n 2629             pass\n 2630 \n 2631     # Try lru_cache first (no pickle.load) — bump _cache_ver to bust cache after code/data changes\n 2632     try:\n-2633         builder = _cached_build_builder(hermes_dir, agi_dir, gitnexus_hash, _cache_ver=11)\n+2643         builder = _cached_build_builder(hermes_dir, agi_dir, gitnexus_hash, _cache_ver=12)\n 2634         elapsed_ms = (time.perf_counter() - start) * 1000\n 2635         return builder, elapsed_ms\n 2636     except Exception:\n 2637         pass\n      ...\n 2734     templates_dir = os.path.join(hermes_dir, \"belam-codex\", \"templates\")\n 2735     if os.path.isdir(templates_dir):\n 2736         builder.parse_templates(templates_dir)\n 2737 \n+2748     # Parse hooks/ (3 hook definitions with event-based trigger metadata)\n+2749     hooks_dir = os.path.join(hermes_dir, \"belam-codex\", \"hooks\")\n+2750     if os.path.isdir(hooks_dir):\n+2751         builder.parse_hooks(hooks_dir)\n+2752 \n+2753     # Parse scripts/ (~40 Python CLI tools with top-level def/class nodes)\n+2754     scripts_dir = os.path.join(hermes_dir, \"belam-codex\", \"scripts\")\n+2755     if os.path.isdir(scripts_dir):\n+2756         builder.parse_scripts(scripts_dir)\n+2757 \n 2738     # Bridge isolated clusters via shared tags\n 2739     builder.build_tag_bridges(hermes_dir)\n 2740 \n 2741     # Process gitnexus cache\n      ...","firstChangedLine":2592},"isError":false,"timestamp":1777540539533}}
{"type":"message","id":"2d9ba9a4","parentId":"ce80b71a","timestamp":"2026-04-30T09:15:46.087Z","message":{"role":"assistant","content":[{"type":"thinking","thinking":"Now I need to also fix the pi_tree_adapter.py tuple access bug - it uses `n[\"id\"]`, `n[\"type\"]` etc. but our nodes are tuples. However, the benchmark doesn't call pi_tree_adapter.py directly, so this bug doesn't affect the benchmark. I'll fix it anyway as a hygiene improvement.\n\nActually wait - the benchmark doesn't call pi_tree_adapter.py, so I shouldn't waste the experiment on it. The scripts/hooks parsing is the real change.\n\nLet me also verify the changes look correct before committing and running.","thinkingSignature":"467704043fdcdba754076ef07eda614394a49eeee15746e57ef073531d485922"},{"type":"text","text":"Now commit, run the benchmark, and log the result:\n"},{"type":"toolCall","id":"call_function_y37umdjojyrm_1","name":"bash","arguments":{"command":"cd /home/ubuntu/.hermes/agi && git add -A && git commit -m \"Parse hooks/ + scripts/ into unified graph: +3 hook_refs + script_function/class nodes (~100 targets)\""}}],"api":"anthropic-messages","provider":"minimax","model":"MiniMax-M2.7","usage":{"input":52489,"output":192,"cacheRead":10071,"cacheWrite":0,"totalTokens":62752,"cost":{"input":0.0157467,"output":0.0002304,"cacheRead":0.0006042599999999999,"cacheWrite":0,"total":0.016581359999999996}},"stopReason":"toolUse","timestamp":1777540539535,"responseId":"064250bc3634eb48dc800b6c5090ca77"}}
{"type":"message","id":"36eb3786","parentId":"2d9ba9a4","timestamp":"2026-04-30T09:15:46.136Z","message":{"role":"toolResult","toolCallId":"call_function_y37umdjojyrm_1","toolName":"bash","content":[{"type":"text","text":"[master 841723f] Parse hooks/ + scripts/ into unified graph: +3 hook_refs + script_function/class nodes (~100 targets)\n 7 files changed, 323 insertions(+), 1 deletion(-)\n create mode 100644 experiments/20260430_091240/output.txt\n create mode 100644 sessions/2026-04-30T09-12-48-721Z_019ddda9-8950-77db-86cd-834160845ba3.jsonl\n"}],"isError":false,"timestamp":1777540546136}}
{"type":"message","id":"e3f631c2","parentId":"36eb3786","timestamp":"2026-04-30T09:15:50.310Z","message":{"role":"assistant","content":[{"type":"thinking","thinking":"Hmm, it created some experiment output files. Let me check if the experiment dir already existed and had output in it. That's fine - the commit was successful.\n\nNow let me run the benchmark.","thinkingSignature":"760419c6982204a5b1d57848765e914119bdc937c5e6abdb3d2359e87eb3ed61"},{"type":"toolCall","id":"call_function_1s32a8d1rdh8_1","name":"run_experiment","arguments":{"command":"cd /home/ubuntu/.hermes/agi && ./autoresearch.sh","timeout_seconds":120}}],"api":"anthropic-messages","provider":"minimax","model":"MiniMax-M2.7","usage":{"input":52802,"output":92,"cacheRead":10071,"cacheWrite":0,"totalTokens":62965,"cost":{"input":0.0158406,"output":0.0001104,"cacheRead":0.0006042599999999999,"cacheWrite":0,"total":0.01655526}},"stopReason":"toolUse","timestamp":1777540546141,"responseId":"064250c27c9e6ad3ade1f083b71db8d5"}}
{"type":"message","id":"3b042adb","parentId":"e3f631c2","timestamp":"2026-04-30T09:15:50.314Z","message":{"role":"toolResult","toolCallId":"call_function_1s32a8d1rdh8_1","toolName":"run_experiment","content":[{"type":"text","text":"❌ autoresearch.sh exists — you must run it instead of a custom command.\n\nFound: /home/ubuntu/.hermes/agi/autoresearch.sh\nYour command: cd /home/ubuntu/.hermes/agi && ./autoresearch.sh\n\nUse: run_experiment({ command: \"bash autoresearch.sh\" }) or run_experiment({ command: \"./autoresearch.sh\" })"}],"details":{"command":"cd /home/ubuntu/.hermes/agi && ./autoresearch.sh","exitCode":null,"durationSeconds":0,"passed":false,"crashed":true,"timedOut":false,"tailOutput":"","checksPass":null,"checksTimedOut":false,"checksOutput":"","checksDuration":0},"isError":false,"timestamp":1777540550314}}
