{"type":"message","id":"5c604a53","parentId":"e587fdbe","timestamp":"2026-04-30T07:50:30.423Z","message":{"role":"toolResult","toolCallId":"call_function_6enzzplz0l02_1","toolName":"bash","content":[{"type":"text","text":"[{\"key_a\": \"decisions/orchestration-architecture\", \"key_b\": \"memories/2026-03-19_204801_design-principle-from-shael-clock-cycles\", \"score\": 23, \"task\": \"RELATIONSHIP JUDGMENT TASK \\u2014 respond with your judgment only, no conversational text.\\n\\nEvaluate whether a causal upstream/downstream relationship exists between these two primitives:\\n\\n  A: decisions/orchestration-architecture  \\u2192  /home/ubuntu/.openclaw/workspace/decisions/orchestration-architecture.md (2/3 upstream slots used)\\n  B: memories/2026-03-19_204801_design-principle-from-shael-clock-cycles  \\u2192  /home/ubuntu/.openclaw/workspace/memory/entries/2026-03-19_204801_design-principle-from-shael-clock-cycles.md\\n\\nINSTRUCTIONS:\\n1. Read both files to understand their content\\n2. If you need more context, use memory_search or read related files \\u2014 check conversation logs, git history, whatever helps you judge causation\\n3. Determine if A caused/enabled/motivated B, or B caused/enabled/motivated A, or neither\\n\\nSEMANTICS:\\n- Upstream = A causally informed, enabled, or is a prerequisite for B\\n- Only genuinely CAUSAL links \\u2014 shared tags or topic is NOT enough\\n- \\\"A happened, and because of that, B exists\\\" is the test\\n- Soft cap: 3 upstream links per primitive. Prefer the strongest causal link.\\n- When in doubt, output NONE \\u2014 missing a link is better than a false one\\n\\nRESPOND WITH EXACTLY:\\nLine 1: `LINK: {upstream_ref} > {downstream_ref}` or `NONE`\\nLine 2: One-sentence rationale\\n\\nUse exact type/slug refs like: decisions/orchestration-architecture or memories/2026-03-19_204801_design-principle-from-shael-clock-cycles\"}, {\"key_a\": \"decisions/phase2-human-gate\", \"key_b\": \"memories/2026-03-17_171127_phase-2-direction-received-from-shael-fo\", \"score\": 23, \"task\": \"RELATIONSHIP JUDGMENT TASK \\u2014 respond with your judgment only, no conversational text.\\n\\nEvaluate whether a causal upstream/downstream relationship exists between these two primitives:\\n\\n  A: decisions/phase2-human-gate  \\u2192  /home/ubuntu/.openclaw/workspace/decisions/phase2-human-gate.md (1/3 upstream slots used)\\n  B: memories/2026-03-17_171127_phase-2-direction-received-from-shael-fo  \\u2192  /home/ubuntu/.openclaw/workspace/memory/entries/2026-03-17_171127_phase-2-direction-received-from-shael-fo.md (1/3 upstream slots used)\\n\\nINSTRUCTIONS:\\n1. Read both files to understand their content\\n2. If you need more context, use memory_search or read related files \\u2014 check conversation logs, git history, whatever helps you judge causation\\n3. Determine if A caused/enabled/motivated B, or B caused/enabled/motivated A, or neither\\n\\nSEMANTICS:\\n- Upstream = A causally informed, enabled, or is a prerequisite for B\\n- Only genuinely CAUSAL links \\u2014 shared tags or topic is NOT enough\\n- \\\"A happened, and because of that, B exists\\\" is the test\\n- Soft cap: 3 upstream links per primitive. Prefer the strongest causal link.\\n- When in doubt, output NONE \\u2014 missing a link is better than a false one\\n\\nRESPOND WITH EXACTLY:\\nLine 1: `LINK: {upstream_ref} > {downstream_ref}` or `NONE`\\nLine 2: One-sentence rationale\\n\\nUse exact type/slug refs like: decisions/phase2-human-gate or memories/2026-03-17_171127_phase-2-direction-received-from-shael-fo\"}, {\"key_a\": \"decisions/phase2-human-gate\", \"key_b\": \"memories/2026-03-19_005231_primitives-are-the-universal-organizatio\", \"score\": 23, \"task\": \"RELATIONSHIP JUDGMENT TASK \\u2014 respond with your judgment only, no conversational text.\\n\\nEvaluate whether a causal upstream/downstream relationship exists between these two primitives:\\n\\n  A: decisions/phase2-human-gate  \\u2192  /home/ubuntu/.openclaw/workspace/decisions/phase2-human-gate.md (1/3 upstream slots used)\\n  B: memories/2026-03-19_005231_primitives-are-the-universal-organizatio  \\u2192  /home/ubuntu/.openclaw/workspace/memory/entries/2026-03-19_005231_primitives-are-the-universal-organizatio.md (9/3 upstream slots used)\\n\\nINSTRUCTIONS:\\n1. Read both files to understand their content\\n2. If you need more context, use memory_search or read related files \\u2014 check conversation logs, git history, whatever helps you judge causation\\n3. Determine if A caused/enabled/motivated B, or B caused/enabled/motivated A, or neither\\n\\nSEMANTICS:\\n- Upstream = A causally informed, enabled, or is a prerequisite for B\\n- Only genuinely CAUSAL links \\u2014 shared tags or topic is NOT enough\\n- \\\"A happened, and because of that, B exists\\\" is the test\\n- Soft cap: 3 upstream links per primitive. Prefer the strongest causal link.\\n- When in doubt, output NONE \\u2014 missing a link is better than a false one\\n\\nRESPOND WITH EXACTLY:\\nLine 1: `LINK: {upstream_ref} > {downstream_ref}` or `NONE`\\nLine 2: One-sentence rationale\\n\\nUse exact type/slug refs like: decisions/phase2-human-gate or memories/2026-03-19_005231_primitives-are-the-universal-organizatio\"}, {\"key_a\": \"decisions/phase2-human-gate\", \"key_b\": \"memories/2026-03-19_150631_built-pipeline-integrated-local-experime\", \"score\": 23, \"task\": \"RELATIONSHIP JUDGMENT TASK \\u2014 respond with your judgment only, no conversational text.\\n\\nEvaluate whether a causal upstream/downstream relationship exists between these two primitives:\\n\\n  A: decisions/phase2-human-gate  \\u2192  /home/ubuntu/.openclaw/workspace/decisions/phase2-human-gate.md (1/3 upstream slots used)\\n  B: memories/2026-03-19_150631_built-pipeline-integrated-local-experime  \\u2192  /home/ubuntu/.openclaw/workspace/memory/entries/2026-03-19_150631_built-pipeline-integrated-local-experime.md (9/3 upstream slots used)\\n\\nINSTRUCTIONS:\\n1. Read both files to understand their content\\n2. If you need more context, use memory_search or read related files \\u2014 check conversation logs, git history, whatever helps you judge causation\\n3. Determine if A caused/enabled/motivated B, or B caused/enabled/motivated A, or neither\\n\\nSEMANTICS:\\n- Upstream = A causally informed, enabled, or is a prerequisite for B\\n- Only genuinely CAUSAL links \\u2014 shared tags or topic is NOT enough\\n- \\\"A happened, and because of that, B exists\\\" is the test\\n- Soft cap: 3 upstream links per primitive. Prefer the strongest causal link.\\n- When in doubt, output NONE \\u2014 missing a link is better than a false one\\n\\nRESPOND WITH EXACTLY:\\nLine 1: `LINK: {upstream_ref} > {downstream_ref}` or `NONE`\\nLine 2: One-sentence rationale\\n\\nUse exact type/slug refs like: decisions/phase2-human-gate or memories/2026-03-19_150631_built-pipeline-integrated-local-experime\"}, {\"key_a\": \"decisions/phase2-human-gate\", \"key_b\": \"memories/2026-03-19_165124_built-local-analysis-pipeline-experiment\", \"score\": 23, \"task\": \"RELATIONSHIP JUDGMENT TASK \\u2014 respond with your judgment only, no conversational text.\\n\\nEvaluate whether a causal upstream/downstream relationship exists between these two primitives:\\n\\n  A: decisions/phase2-human-gate  \\u2192  /home/ubuntu/.openclaw/workspace/decisions/phase2-human-gate.md (1/3 upstream slots used)\\n  B: memories/2026-03-19_165124_built-local-analysis-pipeline-experiment  \\u2192  /home/ubuntu/.openclaw/workspace/memory/entries/2026-03-19_165124_built-local-analysis-pipeline-experiment.md (5/3 upstream slots used)\\n\\nINSTRUCTIONS:\\n1. Read both files to understand their content\\n2. If you need more context, use memory_search or read related files \\u2014 check conversation logs, git history, whatever helps you judge causation\\n3. Determine if A caused/enabled/motivated B, or B caused/enabled/motivated A, or neither\\n\\nSEMANTICS:\\n- Upstream = A causally informed, enabled, or is a prerequisite for B\\n- Only genuinely CAUSAL links \\u2014 shared tags or topic is NOT enough\\n- \\\"A happened, and because of that, B exists\\\" is the test\\n- Soft cap: 3 upstream links per primitive. Prefer the strongest causal link.\\n- When in doubt, output NONE \\u2014 missing a link is better than a false one\\n\\nRESPOND WITH EXACTLY:\\nLine 1: `LINK: {upstream_ref} > {downstream_ref}` or `NONE`\\nLine 2: One-sentence rationale\\n\\nUse exact type/slug refs like: decisions/phase2-human-gate or memories/2026-03-19_165124_built-local-analysis-pipeline-experiment\"}, {\"key_a\": \"decisions/phase2-human-gate\", \"key_b\": \"memories/2026-03-19_204801_design-principle-from-shael-clock-cycles\", \"score\": 23, \"task\": \"RELATIONSHIP JUDGMENT TASK \\u2014 respond with your judgment only, no conversational text.\\n\\nEvaluate whether a causal upstream/downstream relationship exists between these two primitives:\\n\\n  A: decisions/phase2-human-gate  \\u2192  /home/ubuntu/.openclaw/workspace/decisions/phase2-human-gate.md (1/3 upstream slots used)\\n  B: memories/2026-03-19_204801_design-principle-from-shael-clock-cycles  \\u2192  /home/ubuntu/.openclaw/workspace/memory/entries/2026-03-19_204801_design-principle-from-shael-clock-cycles.md\\n\\nINSTRUCTIONS:\\n1. Read both files to understand their content\\n2. If you need more context, use memory_search or read related files \\u2014 check conversation logs, git history, whatever helps you judge causation\\n3. Determine if A caused/enabled/motivated B, or B caused/enabled/motivated A, or neither\\n\\nSEMANTICS:\\n- Upstream = A causally informed, enabled, or is a prerequisite for B\\n- Only genuinely CAUSAL links \\u2014 shared tags or topic is NOT enough\\n- \\\"A happened, and because of that, B exists\\\" is the test\\n- Soft cap: 3 upstream links per primitive. Prefer the strongest causal link.\\n- When in doubt, output NONE \\u2014 missing a link is better than a false one\\n\\nRESPOND WITH EXACTLY:\\nLine 1: `LINK: {upstream_ref} > {downstream_ref}` or `NONE`\\nLine 2: One-sentence rationale\\n\\nUse exact type/slug refs like: decisions/phase2-human-gate or memories/2026-03-19_204801_design-principle-from-shael-clock-cycles\"}, {\"key_a\": \"decisions/primitive-relationship-graph\", \"key_b\": \"memories/2026-03-19_033706_completed-workspace-refactor-three-works\", \"score\": 23, \"task\": \"RELATIONSHIP JUDGMENT TASK \\u2014 respond with your judgment only, no conversational text.\\n\\nEvaluate whether a causal upstream/downstream relationship exists between these two primitives:\\n\\n  A: decisions/primitive-relationship-graph  \\u2192  /home/ubuntu/.openclaw/workspace/decisions/primitive-relationship-graph.md (1/3 upstream slots used)\\n  B: memories/2026-03-19_033706_completed-workspace-refactor-three-works  \\u2192  /home/ubuntu/.openclaw/workspace/memory/entries/2026-03-19_033706_completed-workspace-refactor-three-works.md (9/3 upstream slots used)\\n\\nINSTRUCTIONS:\\n1. Read both files to understand their content\\n2. If you need more context, use memory_search or read related files \\u2014 check conversation logs, git history, whatever helps you judge causation\\n3. Determine if A caused/enabled/motivated B, or B caused/enabled/motivated A, or neither\\n\\nSEMANTICS:\\n- Upstream = A causally informed, enabled, or is a prerequisite for B\\n- Only genuinely CAUSAL links \\u2014 shared tags or topic is NOT enough\\n- \\\"A happened, and because of that, B exists\\\" is the test\\n- Soft cap: 3 upstream links per primitive. Prefer the strongest causal link.\\n- When in doubt, output NONE \\u2014 missing a link is better than a false one\\n\\nRESPOND WITH EXACTLY:\\nLine 1: `LINK: {upstream_ref} > {downstream_ref}` or `NONE`\\nLine 2: One-sentence rationale\\n\\nUse exact type/slug refs like: decisions/primitive-relationship-graph or memories/2026-03-19_033706_completed-workspace-refactor-three-works\"}, {\"key_a\": \"decisions/primitive-relationship-graph\", \"key_b\": \"memories/2026-03-19_204801_design-principle-from-shael-clock-cycles\", \"score\": 23, \"task\": \"RELATIONSHIP JUDGMENT TASK \\u2014 respond with your judgment only, no conversational text.\\n\\nEvaluate whether a causal upstream/downstream relationship exists between these two primitives:\\n\\n  A: decisions/primitive-relationship-graph  \\u2192  /home/ubuntu/.openclaw/workspace/decisions/primitive-relationship-graph.md (1/3 upstream slots used)\\n  B: memories/2026-03-19_204801_design-principle-from-shael-clock-cycles  \\u2192  /home/ubuntu/.openclaw/workspace/memory/entries/2026-03-19_204801_design-principle-from-shael-clock-cycles.md\\n\\nINSTRUCTIONS:\\n1. Read both files to understand their content\\n2. If you need more context, use memory_search or read related files \\u2014 check conversation logs, git history, whatever helps you judge causation\\n3. Determine if A caused/enabled/motivated B, or B caused/enabled/motivated A, or neither\\n\\nSEMANTICS:\\n- Upstream = A causally informed, enabled, or is a prerequisite for B\\n- Only genuinely CAUSAL links \\u2014 shared tags or topic is NOT enough\\n- \\\"A happened, and because of that, B exists\\\" is the test\\n- Soft cap: 3 upstream links per primitive. Prefer the strongest causal link.\\n- When in doubt, output NONE \\u2014 missing a link is better than a false one\\n\\nRESPOND WITH EXACTLY:\\nLine 1: `LINK: {upstream_ref} > {downstream_ref}` or `NONE`\\nLine 2: One-sentence rationale\\n\\nUse exact type/slug refs like: decisions/primitive-relationship-graph or memories/2026-03-19_204801_design-principle-from-shael-clock-cycles\"}, {\"key_a\": \"decisions/skill-primitive-pairing\", \"key_b\": \"memories/2026-03-18_225239_major-workspace-infrastructure-session-1\", \"score\": 23, \"task\": \"RELATIONSHIP JUDGMENT TASK \\u2014 respond with your judgment only, no conversational text.\\n\\nEvaluate whether a causal upstream/downstream relationship exists between these two primitives:\\n\\n  A: decisions/skill-primitive-pairing  \\u2192  /home/ubuntu/.openclaw/workspace/decisions/skill-primitive-pairing.md\\n  B: memories/2026-03-18_225239_major-workspace-infrastructure-session-1  \\u2192  /home/ubuntu/.openclaw/workspace/memory/entries/2026-03-18_225239_major-workspace-infrastructure-session-1.md (7/3 upstream slots used)\\n\\nINSTRUCTIONS:\\n1. Read both files to understand their content\\n2. If you need more context, use memory_search or read related files \\u2014 check conversation logs, git history, whatever helps you judge causation\\n3. Determine if A caused/enabled/motivated B, or B caused/enabled/motivated A, or neither\\n\\nSEMANTICS:\\n- Upstream = A causally informed, enabled, or is a prerequisite for B\\n- Only genuinely CAUSAL links \\u2014 shared tags or topic is NOT enough\\n- \\\"A happened, and because of that, B exists\\\" is the test\\n- Soft cap: 3 upstream links per primitive. Prefer the strongest causal link.\\n- When in doubt, output NONE \\u2014 missing a link is better than a false one\\n\\nRESPOND WITH EXACTLY:\\nLine 1: `LINK: {upstream_ref} > {downstream_ref}` or `NONE`\\nLine 2: One-sentence rationale\\n\\nUse exact type/slug refs like: decisions/skill-primitive-pairing or memories/2026-03-18_225239_major-workspace-infrastructure-session-1\"}, {\"key_a\": \"decisions/skill-primitive-pairing\", \"key_b\": \"memories/2026-03-19_005231_primitives-are-the-universal-organizatio\", \"score\": 23, \"task\": \"RELATIONSHIP JUDGMENT TASK \\u2014 respond with your judgment only, no conversational text.\\n\\nEvaluate whether a causal upstream/downstream relationship exists between these two primitives:\\n\\n  A: decisions/skill-primitive-pairing  \\u2192  /home/ubuntu/.openclaw/workspace/decisions/skill-primitive-pairing.md\\n  B: memories/2026-03-19_005231_primitives-are-the-universal-organizatio  \\u2192  /home/ubuntu/.openclaw/workspace/memory/entries/2026-03-19_005231_primitives-are-the-universal-organizatio.md (9/3 upstream slots used)\\n\\nINSTRUCTIONS:\\n1. Read both files to understand their content\\n2. If you need more context, use memory_search or read related files \\u2014 check conversation logs, git history, whatever helps you judge causation\\n3. Determine if A caused/enabled/motivated B, or B caused/enabled/motivated A, or neither\\n\\nSEMANTICS:\\n- Upstream = A causally informed, enabled, or is a prerequisite for B\\n- Only genuinely CAUSAL links \\u2014 shared tags or topic is NOT enough\\n- \\\"A happened, and because of that, B exists\\\" is the test\\n- Soft cap: 3 upstream links per primitive. Prefer the strongest causal link.\\n- When in doubt, output NONE \\u2014 missing a link is better than a false one\\n\\nRESPOND WITH EXACTLY:\\nLine 1: `LINK: {upstream_ref} > {downstream_ref}` or `NONE`\\nLine 2: One-sentence rationale\\n\\nUse exact type/slug refs like: decisions/skill-primitive-pairing or memories/2026-03-19_005231_primitives-are-the-universal-organizatio\"}, {\"key_a\": \"decisions/supervised-builder-experiments\", \"key_b\": \"memories/2026-03-19_212142_voice-transcription-capability-establish\", \"score\": 23, \"task\": \"RELATIONSHIP JUDGMENT TASK \\u2014 respond with your judgment only, no conversational text.\\n\\nEvaluate whether a causal upstream/downstream relationship exists between these two primitives:\\n\\n  A: decisions/supervised-builder-experiments  \\u2192  /home/ubuntu/.openclaw/workspace/decisions/supervised-builder-experiments.md\\n  B: memories/2026-03-19_212142_voice-transcription-capability-establish  \\u2192  /home/ubuntu/.openclaw/workspace/memory/entries/2026-03-19_212142_voice-transcription-capability-establish.md (3/3 upstream slots used)\\n\\nINSTRUCTIONS:\\n1. Read both files to understand their content\\n2. If you need more context, use memory_search or read related files \\u2014 check conversation logs, git history, whatever helps you judge causation\\n3. Determine if A caused/enabled/motivated B, or B caused/enabled/motivated A, or neither\\n\\nSEMANTICS:\\n- Upstream = A causally informed, enabled, or is a prerequisite for B\\n- Only genuinely CAUSAL links \\u2014 shared tags or topic is NOT enough\\n- \\\"A happened, and because of that, B exists\\\" is the test\\n- Soft cap: 3 upstream links per primitive. Prefer the strongest causal link.\\n- When in doubt, output NONE \\u2014 missing a link is better than a false one\\n\\nRESPOND WITH EXACTLY:\\nLine 1: `LINK: {upstream_ref} > {downstream_ref}` or `NONE`\\nLine 2: One-sentence rationale\\n\\nUse exact type/slug refs like: decisions/supervised-builder-experiments or memories/2026-03-19_212142_voice-transcription-capability-establish\"}, {\"key_a\": \"lessons/always-back-up-workspace-to-github\", \"key_b\": \"memories/2026-03-19_005231_primitives-are-the-universal-organizatio\", \"score\": 23, \"task\": \"RELATIONSHIP JUDGMENT TASK \\u2014 respond with your judgment only, no conversational text.\\n\\nEvaluate whether a causal upstream/downstream relationship exists between these two primitives:\\n\\n  A: lessons/always-back-up-workspace-to-github  \\u2192  /home/ubuntu/.openclaw/workspace/lessons/always-back-up-workspace-to-github.md (1/3 upstream slots used)\\n  B: memories/2026-03-19_005231_primitives-are-the-universal-organizatio  \\u2192  /home/ubuntu/.openclaw/workspace/memory/entries/2026-03-19_005231_primitives-are-the-universal-organizatio.md (9/3 upstream slots used)\\n\\nINSTRUCTIONS:\\n1. Read both files to understand their content\\n2. If you need more context, use memory_search or read related files \\u2014 check conversation logs, git history, whatever helps you judge causation\\n3. Determine if A caused/enabled/motivated B, or B caused/enabled/motivated A, or neither\\n\\nSEMANTICS:\\n- Upstream = A causally informed, enabled, or is a prerequisite for B\\n- Only genuinely CAUSAL links \\u2014 shared tags or topic is NOT enough\\n- \\\"A happened, and because of that, B exists\\\" is the test\\n- Soft cap: 3 upstream links per primitive. Prefer the strongest causal link.\\n- When in doubt, output NONE \\u2014 missing a link is better than a false one\\n\\nRESPOND WITH EXACTLY:\\nLine 1: `LINK: {upstream_ref} > {downstream_ref}` or `NONE`\\nLine 2: One-sentence rationale\\n\\nUse exact type/slug refs like: lessons/always-back-up-workspace-to-github or memories/2026-03-19_005231_primitives-are-the-universal-organizatio\"}, {\"key_a\": \"lessons/always-back-up-workspace-to-github\", \"key_b\": \"memories/2026-03-19_204801_design-principle-from-shael-clock-cycles\", \"score\": 23, \"task\": \"RELATIONSHIP JUDGMENT TASK \\u2014 respond with your judgment only, no conversational text.\\n\\nEvaluate whether a causal upstream/downstream relationship exists between these two primitives:\\n\\n  A: lessons/always-back-up-workspace-to-github  \\u2192  /home/ubuntu/.openclaw/workspace/lessons/always-back-up-workspace-to-github.md (1/3 upstream slots used)\\n  B: memories/2026-03-19_204801_design-principle-from-shael-clock-cycles  \\u2192  /home/ubuntu/.openclaw/workspace/memory/entries/2026-03-19_204801_design-principle-from-shael-clock-cycles.md\\n\\nINSTRUCTIONS:\\n1. Read both files to understand their content\\n2. If you need more context, use memory_search or read related files \\u2014 check conversation logs, git history, whatever helps you judge causation\\n3. Determine if A caused/enabled/motivated B, or B caused/enabled/motivated A, or neither\\n\\nSEMANTICS:\\n- Upstream = A causally informed, enabled, or is a prerequisite for B\\n- Only genuinely CAUSAL links \\u2014 shared tags or topic is NOT enough\\n- \\\"A happened, and because of that, B exists\\\" is the test\\n- Soft cap: 3 upstream links per primitive. Prefer the strongest causal link.\\n- When in doubt, output NONE \\u2014 missing a link is better than a false one\\n\\nRESPOND WITH EXACTLY:\\nLine 1: `LINK: {upstream_ref} > {downstream_ref}` or `NONE`\\nLine 2: One-sentence rationale\\n\\nUse exact type/slug refs like: lessons/al