{"type":"message","id":"3f55db89","parentId":"cea2d60e","timestamp":"2026-04-30T09:11:42.668Z","message":{"role":"assistant","content":[{"type":"thinking","thinking":"Now I need to log the experiment result. The primary metric (0.03ms) is unchanged, but we have more nodes and edges. Since the primary metric is noise-floor saturated, this is a \"keep\" for secondary metrics improvement.","thinkingSignature":"03f10f67a1e049b7544be585784c6dfecc51d809b986dd6aee44f119d8351b2a"},{"type":"toolCall","id":"call_function_ktrs27kfn4os_1","name":"log_experiment","arguments":{"commit":"e220139","metric":0.03,"status":"keep","description":"parse_templates: template_stage nodes with rich YAML metadata (role/action/session/cli). +21 nodes (15 template_stages + 6 agent_role links), +32 edges. Primary metric unchanged at 0.03ms noise floor.","metrics":{"graph_node_count":1451,"graph_edge_count":1493,"query_time_ms":0,"ascii_render_lines":55},"asi":{"change":"enhanced parse_templates() to create template_stage nodes with rich YAML metadata","nodes_added":21,"edges_added":32,"primary_metric_unchanged":true,"qualitative_improvement":"template_stage nodes now contain role/action/session/cli metadata instead of generic reference nodes"}}}],"api":"anthropic-messages","provider":"minimax","model":"MiniMax-M2.7","usage":{"input":59783,"output":275,"cacheRead":10071,"cacheWrite":0,"totalTokens":70129,"cost":{"input":0.0179349,"output":0.00033,"cacheRead":0.0006042599999999999,"cacheWrite":0,"total":0.01886916}},"stopReason":"toolUse","timestamp":1777540296073,"responseId":"06424fc8b29850f23be7cd2eae4e8e5f"}}
{"type":"message","id":"be86ec30","parentId":"3f55db89","timestamp":"2026-04-30T09:11:42.676Z","message":{"role":"toolResult","toolCallId":"call_function_ktrs27kfn4os_1","toolName":"log_experiment","content":[{"type":"text","text":"❌ Missing secondary metrics: graph_build_time_ms\n\nYou must provide all previously tracked metrics. Expected: graph_node_count, graph_edge_count, query_time_ms, ascii_render_lines, graph_build_time_ms\nGot: graph_node_count, graph_edge_count, query_time_ms, ascii_render_lines\n\nFix: include \"graph_build_time_ms\": <value> in the metrics parameter."}],"details":{},"isError":false,"timestamp":1777540302676}}
{"type":"message","id":"61b1f767","parentId":"be86ec30","timestamp":"2026-04-30T09:11:50.009Z","message":{"role":"assistant","content":[{"type":"thinking","thinking":"I need to include graph_build_time_ms in the metrics. The primary metric is 0.03, but it also needs to be in the metrics dict.","thinkingSignature":"86fe8cd8aa2e0b7053660a38d6f96f307154d577c7b7c94efbfb7f49be5ebff5"},{"type":"toolCall","id":"call_function_oidz2eifooqp_1","name":"log_experiment","arguments":{"commit":"e220139","metric":0.03,"status":"keep","description":"parse_templates: template_stage nodes with rich YAML metadata (role/action/session/cli). +21 nodes (15 template_stages + 6 agent_role links), +32 edges. Primary metric unchanged at 0.03ms noise floor.","metrics":{"graph_build_time_ms":0.03,"graph_node_count":1451,"graph_edge_count":1493,"query_time_ms":0,"ascii_render_lines":55},"asi":{"change":"enhanced parse_templates() to create template_stage nodes with rich YAML metadata","nodes_added":21,"edges_added":32,"primary_metric_unchanged":true,"qualitative_improvement":"template_stage nodes now contain role/action/session/cli metadata instead of generic reference nodes"}}}],"api":"anthropic-messages","provider":"minimax","model":"MiniMax-M2.7","usage":{"input":60150,"output":269,"cacheRead":10071,"cacheWrite":0,"totalTokens":70490,"cost":{"input":0.018045,"output":0.0003228,"cacheRead":0.0006042599999999999,"cacheWrite":0,"total":0.01897206}},"stopReason":"toolUse","timestamp":1777540302678,"responseId":"06424fd00ba9e44170c0409ef95081fd"}}
