{"type":"message","id":"2a4bd857","parentId":"7a9957ad","timestamp":"2026-04-30T09:07:59.250Z","message":{"role":"toolResult","toolCallId":"call_function_0qu1a5pih3a6_1","toolName":"bash","content":[{"type":"text","text":"Set cur_phase=phase1\nStages section started at line 22\nFound stage at line 23: role=builder, cur_phase=phase1\n  Checking line 24: 'action: implement'\n    Breaking on: 'action: implement'\n  Added: p1_builder_NONE\nFound stage at line 28: role=builder, cur_phase=phase1\n  Checking line 29: 'action: bugfix'\n    Breaking on: 'action: bugfix'\n  Added: p1_builder_NONE\nFound stage at line 33: role=critic, cur_phase=phase1\n  Checking line 34: 'action: review'\n    Breaking on: 'action: review'\n  Added: p1_critic_NONE\nSet cur_phase=phase2\nStages section started at line 41\nFound stage at line 42: role=architect, cur_phase=phase2\n  Checking line 43: 'action: design'\n    Breaking on: 'action: design'\n  Added: p2_architect_NONE\nFound stage at line 47: role=builder, cur_phase=phase2\n  Checking line 48: 'action: implement'\n    Breaking on: 'action: implement'\n  Added: p2_builder_NONE\nFound stage at line 52: role=builder, cur_phase=phase2\n  Checking line 53: 'action: bugfix'\n    Breaking on: 'action: bugfix'\n  Added: p2_builder_NONE\nFound stage at line 57: role=critic, cur_phase=phase2\n  Checking line 58: 'action: review'\n    Breaking on: 'action: review'\n  Added: p2_critic_NONE\nSet cur_phase=phase3\nStages section started at line 65\nFound stage at line 66: role=architect, cur_phase=phase3\n  Checking line 67: 'action: design'\n    Breaking on: 'action: design'\n  Added: p3_architect_NONE\nFound stage at line 71: role=builder, cur_phase=phase3\n  Checking line 72: 'action: implement'\n    Breaking on: 'action: implement'\n  Added: p3_builder_NONE\nFound stage at line 76: role=builder, cur_phase=phase3\n  Checking line 77: 'action: bugfix'\n    Breaking on: 'action: bugfix'\n  Added: p3_builder_NONE\nFound stage at line 81: role=critic, cur_phase=phase3\n  Checking line 82: 'action: review'\n    Breaking on: 'action: review'\n  Added: p3_critic_NONE\n\nFinal: 8 stages\n"}],"isError":false,"timestamp":1777540079250}}
{"type":"message","id":"fdaa5ed6","parentId":"2a4bd857","timestamp":"2026-04-30T09:08:14.897Z","message":{"role":"assistant","content":[{"type":"thinking","thinking":"The issue is clear now! My break condition is wrong. When I check `if next_stripped.startswith('- role:') or (next_stripped and not next_stripped.startswith(' ') and not next_stripped.startswith('-'))`, I'm breaking when `next_stripped` is `'action: implement'` because it doesn't start with `- role:` but it DOES start with a space, so the second condition is FALSE and I'm NOT breaking.But wait - looking at the output, I AM breaking on `'action: implement'`. Let me look more carefully at the condition:```python\nif next_stripped.startswith('- role:') or (next_stripped and not next_stripped.startswith(' ') and not next_stripped.startswith('-')):\n    print(f'    Breaking on: {repr(next_stripped)[:40]}')\n    break\n```For `'action: implement'`:- `next_stripped.startswith('- role:')` → False\n- `next_stripped and not next_stripped.startswith(' ')` → `'action: implement' and not True` → `'action: implement' and False` → False\n- `not next_stripped.startswith('-')` → TrueSo the full condition is `False or (True)` → True! So it breaks.The issue is my condition logic. I want to break when I see the NEXT `- role:` but NOT when I see continuation lines. Let me fix:","thinkingSignature":"6f188fb1d4e63770909869f55a9541881ae9d6b1192997a151e9778326cf9116"},{"type":"text","text":"Found the bug! The condition `not next_stripped.startswith(' ')` is TRUE for `'action: implement'` because it DOES start with a space, but my comment says \"continue if starts with space\". The logic is inverted. Let me fix:\n"},{"type":"toolCall","id":"call_function_td5k5o9jjud9_1","name":"edit","arguments":{"path":"/home/ubuntu/.hermes/agi/graph_builder.py","edits":[{"oldText":"                    # Parse stage definitions: collect multi-line until next '- role:'\n                    if in_stages and stripped.startswith('- role:'):\n                        role = stripped.split('role:')[1].strip().split()[0]\n                        # Collect continuation lines until next '- role:'\n                        stage_lines = [stripped]\n                        j = i + 1\n                        while j < len(lines):\n                            next_stripped = lines[j].strip()\n                            if next_stripped.startswith('- role:') or (next_stripped and not next_stripped.startswith(' ') and not next_stripped.startswith('-')):\n                                break\n                            if next_stripped:\n                                stage_lines.append(next_stripped)\n                            j += 1","newText":"                    # Parse stage definitions: collect multi-line until next '- role:'\n                    if in_stages and stripped.startswith('- role:'):\n                        role = stripped.split('role:')[1].strip().split()[0]\n                        # Collect continuation lines (indented lines) until next '- role:'\n                        stage_lines = [stripped]\n                        j = i + 1\n                        while j < len(lines):\n                            next_stripped = lines[j].strip()\n                            # Break if we hit another stage definition or non-indented content\n                            if next_stripped.startswith('- role:'):\n                                break\n                            # Break on non-indented content (end of stages section)\n                            if next_stripped and not lines[j].startswith(' '):\n                                break\n                            if next_stripped:\n                                stage_lines.append(next_stripped)\n                            j += 1"}]}}],"api":"anthropic-messages","provider":"minimax","model":"MiniMax-M2.7","usage":{"input":46551,"output":768,"cacheRead":10071,"cacheWrite":0,"totalTokens":57390,"cost":{"input":0.0139653,"output":0.0009216,"cacheRead":0.0006042599999999999,"cacheWrite":0,"total":0.01549116}},"stopReason":"toolUse","timestamp":1777540079252,"responseId":"06424eef60758fbc29edfeba4f5f2947"}}
{"type":"message","id":"6fffa9fd","parentId":"fdaa5ed6","timestamp":"2026-04-30T09:08:14.904Z","message":{"role":"toolResult","toolCallId":"call_function_td5k5o9jjud9_1","toolName":"edit","content":[{"type":"text","text":"Could not find the exact text in /home/ubuntu/.hermes/agi/graph_builder.py. The old text must match exactly including all whitespace and newlines."}],"details":{},"isError":true,"timestamp":1777540094903}}
{"type":"message","id":"94d2df16","parentId":"6fffa9fd","timestamp":"2026-04-30T09:08:18.566Z","message":{"role":"assistant","content":[{"type":"thinking","thinking":"Let me find the exact text in the file:","thinkingSignature":"74c30226ac5200c282e6063a81c3de7316f28e24a194e45dc6fad162fbe04176"},{"type":"toolCall","id":"call_function_bic4tkia9uh1_1","name":"bash","arguments":{"command":"grep -n \"Parse stage definitions\" /home/ubuntu/.hermes/agi/graph_builder.py"}}],"api":"anthropic-messages","provider":"minimax","model":"MiniMax-M2.7","usage":{"input":47367,"output":55,"cacheRead":10071,"cacheWrite":0,"totalTokens":57493,"cost":{"input":0.0142101,"output":0.00006599999999999999,"cacheRead":0.0006042599999999999,"cacheWrite":0,"total":0.01488036}},"stopReason":"toolUse","timestamp":1777540094905,"responseId":"06424effdd77ab3afc69fc73b533184c"}}
{"type":"message","id":"b2ea040c","parentId":"94d2df16","timestamp":"2026-04-30T09:08:18.576Z","message":{"role":"toolResult","toolCallId":"call_function_bic4tkia9uh1_1","toolName":"bash","content":[{"type":"text","text":"1716:                    # Parse stage definitions: collect multi-line until next '- role:'\n"}],"isError":false,"timestamp":1777540098576}}
{"type":"message","id":"f6043203","parentId":"b2ea040c","timestamp":"2026-04-30T09:08:22.563Z","message":{"role":"assistant","content":[{"type":"thinking","thinking":"Let me read the exact section:","thinkingSignature":"e067a402a0f98373e55f27608c961d4e07f0520606a3a66e7f7c3fca56cdce2f"},{"type":"toolCall","id":"call_function_8aqwihdrv790_1","name":"read","arguments":{"path":"/home/ubuntu/.hermes/agi/graph_builder.py","offset":1714,"limit":20}}],"api":"anthropic-messages","provider":"minimax","model":"MiniMax-M2.7","usage":{"input":47455,"output":65,"cacheRead":10071,"cacheWrite":0,"totalTokens":57591,"cost":{"input":0.0142365,"output":0.000078,"cacheRead":0.0006042599999999999,"cacheWrite":0,"total":0.01491876}},"stopReason":"toolUse","timestamp":1777540098579,"responseId":"06424f0375a0835e314c94489def1f15"}}
{"type":"message","id":"4387d756","parentId":"f6043203","timestamp":"2026-04-30T09:08:22.565Z","message":{"role":"toolResult","toolCallId":"call_function_8aqwihdrv790_1","toolName":"read","content":[{"type":"text","text":"                        continue\n                    \n                    # Parse stage definitions: collect multi-line until next '- role:'\n                    if in_stages and stripped.startswith('- role:'):\n                        role = stripped.split('role:')[1].strip().split()[0]\n                        # Collect continuation lines until next '- role:' or end\n                        stage_lines = [stripped]\n                        j = i + 1\n                        while j < len(lines):\n                            next_stripped = lines[j].strip()\n                            if next_stripped.startswith('- role:') or (next_stripped and not next_stripped.startswith(' ') and not next_stripped.startswith('-')):\n                                break\n                            if next_stripped:\n                                stage_lines.append(next_stripped)\n                            j += 1\n                        \n                        full_stage = '\\n'.join(stage_lines)\n                        action_match = re.search(r'action:\\s*(\\w+)', full_stage)\n                        session_match = re.search(r'session:\\s*(\\w+)', full_stage)\n                        cli_match = re.search(r'cli:\\s*(\\w+)', full_stage)\n\n[837 more lines in file. Use offset=1734 to continue.]"}],"isError":false,"timestamp":1777540102565}}
{"type":"message","id":"440493df","parentId":"4387d756","timestamp":"2026-04-30T09:08:31.349Z","message":{"role":"assistant","content":[{"type":"thinking","thinking":"I see, the file has slightly different text. Let me match exactly:","thinkingSignature":"edf02713940b043bd16a6e716ab32ad3fffef7b3543efc0c1b06b9cdbabd800a"},{"type":"toolCall","id":"call_function_evvzvi99yq51_1","name":"edit","arguments":{"path":"/home/ubuntu/.hermes/agi/graph_builder.py","edits":[{"oldText":"                    # Parse stage definitions: collect multi-line until next '- role:'\n                    if in_stages and stripped.startswith('- role:'):\n                        role = stripped.split('role:')[1].strip().split()[0]\n                        # Collect continuation lines until next '- role:' or end\n                        stage_lines = [stripped]\n                        j = i + 1\n                        while j < len(lines):\n                            next_stripped = lines[j].strip()\n                            if next_stripped.startswith('- role:') or (next_stripped and not next_stripped.startswith(' ') and not next_stripped.startswith('-')):\n                                break\n                            if next_stripped:\n                                stage_lines.append(next_stripped)\n                            j += 1","newText":"                    # Parse stage definitions: collect multi-line until next '- role:'\n                    if in_stages and stripped.startswith('- role:'):\n                        role = stripped.split('role:')[1].strip().split()[0]\n                        # Collect continuation lines (indented) until next '- role:'\n                        stage_lines = [stripped]\n                        j = i + 1\n                        while j < len(lines):\n                            next_stripped = lines[j].strip()\n                            # Break on next stage definition\n                            if next_stripped.startswith('- role:'):\n                                break\n                            # Break on non-indented content (end of stages)\n                            if next_stripped and not lines[j].startswith(' '):\n                                break\n                            if next_stripped:\n                                stage_lines.append(next_stripped)\n                            j += 1"}]}}],"api":"anthropic-messages","provider":"minimax","model":"MiniMax-M2.7","usage":{"input":47776,"output":422,"cacheRead":10071,"cacheWrite":0,"totalTokens":58269,"cost":{"input":0.0143328,"output":0.0005064,"cacheRead":0.0006042599999999999,"cacheWrite":0,"total":0.015443460000000001}},"stopReason":"toolUse","timestamp":1777540102567,"responseId":"06424f079693fbfb2abf718296a5bc82"}}
{"type":"message","id":"36ef271f","parentId":"440493df","timestamp":"2026-04-30T09:08:31.356Z","message":{"role":"toolResult","toolCallId":"call_function_evvzvi99yq51_1","toolName":"edit","content":[{"type":"text","text":"Successfully replaced 1 block(s) in /home/ubuntu/.hermes/agi/graph_builder.py."}],"details":{"diff":"      ...\n 1715                     \n 1716                     # Parse stage definitions: collect multi-line until next '- role:'\n 1717                     if in_stages and stripped.startswith('- role:'):\n 1718                         role = stripped.split('role:')[1].strip().split()[0]\n-1719                         # Collect continuation lines until next '- role:' or end\n+1719                         # Collect continuation lines (indented) until next '- role:'\n 1720                         stage_lines = [stripped]\n 1721                         j = i + 1\n 1722                         while j < len(lines):\n 1723                             next_stripped = lines[j].strip()\n-1724                             if next_stripped.startswith('- role:') or (next_stripped and not next_stripped.startswith(' ') and not next_stripped.startswith('-')):\n+1724                             # Break on next stage definition\n+1725                             if next_stripped.startswith('- role:'):\n 1725                                 break\n+1727                             # Break on non-indented content (end of stages)\n+1728                             if next_stripped and not lines[j].startswith(' '):\n+1729                                 break\n 1726                             if next_stripped:\n 1727                                 stage_lines.append(next_stripped)\n 1728                             j += 1\n 1729                         \n      ...","firstChangedLine":1719},"isError":false,"timestamp":1777540111356}}
{"type":"message","id":"3c732ef3","parentId":"36ef271f","timestamp":"2026-04-30T09:08:39.673Z","message":{"role":"assistant","content":[{"type":"thinking","thinking":"Now, I'll run it again:","thinkingSignature":"af262095bf7d5da307a337af005e7153ab3d59edd6166f751d8cfdab3a45b3c1"},{"type":"toolCall","id":"call_function_bld4spcv076t_1","name":"bash","arguments":{"command":"cd /home/ubuntu/.hermes/agi && python3 -c \"\nimport re\ncontent = open('/home/ubuntu/.hermes/belam-codex/templates/builder-first-pipeline.md').read()\n_RE_YAML_BLOCK = re.compile(r'\\`\\`\\`yaml\\n(.*?)\\n\\`\\`\\`', re.DOTALL)\nblocks = list(_RE_YAML_BLOCK.finditer(content))\n\nstage_meta = {}\nfor yb in blocks:\n    yaml_content = yb.group(1)\n    lines = yaml_content.split('\\n')\n    cur_phase = None\n    in_stages = False\n    \n    for i, yline in enumerate(lines):\n        stripped = yline.strip()\n        \n        if stripped.startswith('phase') and ':' in stripped:\n            phase_key = stripped.split(':')[0].strip()\n            if phase_key in ('phase1', 'phase2', 'phase3'):\n                cur_phase = phase_key\n                in_stages = False\n        \n        if stripped.startswith('stages:'):\n            in_stages = True\n            continue\n        \n        if in_stages and stripped.startswith('- role:'):\n            role = stripped.split('role:')[1].strip().split()[0]\n            stage_lines = [stripped]\n            j = i + 1\n            while j < len(lines):\n                next_stripped = lines[j].strip()\n                if next_stripped.startswith('- role:'):\n                    break\n                if next_stripped and not lines[j].startswith(' '):\n                    break\n                if next_stripped:\n                    stage_lines.append(next_stripped)\n                j += 1\n            \n            full_stage = '\\n'.join(stage_lines)\n            action_match = re.search(r'action:\\s*(\\w+)', full_stage)\n            session_match = re.search(r'session:\\s*(\\w+)', full_stage)\n            if role and cur_phase:\n                action = action_match.group(1) if action_match else ''\n                stage_key = f\\\"p{cur_phase[-1]}_{role}_{action}\\\"\n                stage_meta[stage_key] = {'role': role, 'action': action}\n\nprint(f'Parsed {len(stage_meta)} stages:')\nfor k, v in sorted(stage_meta.items()):\n    print(f'  {k}: {v}')\n\""}}],"api":"anthropic-messages","provider":"minimax","model":"MiniMax-M2.7","usage":{"input":48234,"output":511,"cacheRead":10071,"cacheWrite":0,"totalTokens":58816,"cost":{"input":0.014470199999999999,"output":0.0006131999999999999,"cacheRead":0.0006042599999999999,"cacheWrite":0,"total":0.01568766}},"stopReason":"toolUse","timestamp":1777540111358,"responseId":"06424f0fea69dac2516b4eb4768ed714"}}
{"type":"message","id":"c2296a77","parentId":"3c732ef3","timestamp":"2026-04-30T09:08:39.712Z","message":{"role":"toolResult","toolCallId":"call_function_bld4spcv076t_1","toolName":"bash","content":[{"type":"text","text":"Parsed 11 stages:\n  p1_builder_bugfix: {'role': 'builder', 'action': 'bugfix'}\n  p1_builder_implement: {'role': 'builder', 'action': 'implement'}\n  p1_critic_review: {'role': 'critic', 'action': 'review'}\n  p2_architect_design: {'role': 'architect', 'action': 'design'}\n  p2_builder_bugfix: {'role': 'builder', 'action': 'bugfix'}\n  p2_builder_implement: {'role': 'builder', 'action': 'implement'}\n  p2_critic_review: {'role': 'critic', 'action': 'review'}\n  p3_architect_design: {'role': 'architect', 'action': 'design'}\n  p3_builder_bugfix: {'role': 'builder', 'action': 'bugfix'}\n  p3_builder_implement: {'role': 'builder', 'action': 'implement'}\n  p3_critic_review: {'role': 'critic', 'action': 'review'}\n"}],"isError":false,"timestamp":1777540119712}}
{"type":"message","id":"9bfa1be2","parentId":"c2296a77","timestamp":"2026-04-30T09:08:44.936Z","message":{"role":"assistant","content":[{"type":"thinking","thinking":"Now we're parsing 11 stages correctly with role and action! Let me also check that these match the stage names in the markdown headings:","thinkingSignature":"c58b5df209d7ae3133f5ed77dc005fa69b73605e09e75c29ce5cdba3f2478661"},{"type":"text","text":"Now the YAML parsing works. Let me verify the stage names match the markdown:\n"},{"type":"toolCall","id":"call_function_cysj92jqtquh_1","name":"bash","arguments":{"command":"grep -oP '(?<=#### `)[^`]+(?=`)' /home/ubuntu/.hermes/belam-codex/templates/builder-first-pipeline.md"}}],"api":"anthropic-messages","provider":"minimax","model":"MiniMax-M2.7","usage":{"input":48986,"output":103,"cacheRead":10071,"cacheWrite":0,"totalTokens":59160,"cost":{"input":0.0146958,"output":0.0001236,"cacheRead":0.0006042599999999999,"cacheWrite":0,"total":0.01542366}},"stopReason":"toolUse","timestamp":1777540119715,"responseId":"06424f181d1b53d2b65d2ad44f3de296"}}
{"type":"message","id":"25945777","parentId":"9bfa1be2","timestamp":"2026-04-30T09:08:44.946Z","message":{"role":"toolResult","toolCallId":"call_function_cysj92jqtquh_1","toolName":"bash","content":[{"type":"text","text":"p1_builder_implement\np1_builder_bugfix\np1_critic_review\np2_architect_design\np2_builder_implement\np2_builder_bugfix\np2_critic_review\n"}],"isError":false,"timestamp":1777540124946}}
{"type":"message","id":"14f83019","parentId":"25945777","timestamp":"2026-04-30T09:08:52.166Z","message":{"role":"assistant","content":[{"type":"thinking","thinking":"Good, the stage names in markdown are:\n- p1_builder_implement\n- p1_builder_bugfix- p1_critic_review\n- p2_architect_design\n- p2_builder_implement\n- p2_builder_bugfix\n- p2_critic_reviewAnd my YAML parsing produces:- p1_builder_bugfix- p1_builder_implement\n- p1_critic_review\n- p2_architect_design\n- p2_builder_bugfix\n- p2_builder_implement- p2_critic_review\n- p3_architect_design\n- p3_builder_bugfix- p3_builder_implement\n- p3_critic_review\n\nPhase 3 stages are in the YAML but not in the markdown headings. That's fine - they'll just have no markdown description but will still have the YAML metadata.Now let me run the full benchmark to see the node count change:","thinkingSignature":"e8c2c53589387c0a16f4db3f0b3d9e2d0fc6d5379c32a3ea079c66826065c7b9"},{"type":"text","text":"Now run the benchmark to see the new node count:\n"},{"type":"toolCall","id":"call_function_xeljr2gztbtn_1","name":"run_experiment","arguments":{"command":"./autoresearch.sh","timeout_seconds":120}}],"api":"anthropic-messages","provider":"minimax","model":"MiniMax-M2.7","usage":{"input":49148,"output":241,"cacheRead":10071,"cacheWrite":0,"totalTokens":59460,"cost":{"input":0.0147444,"output":0.0002892,"cacheRead":0.0006042599999999999,"cacheWrite":0,"total":0.01563786}},"stopReason":"toolUse","timestamp":1777540124950,"responseId":"06424f1d1f845fc4df6ffb77635a3ae9"}}
