{"type":"message","id":"96d6d262","parentId":"5cef1870","timestamp":"2026-04-30T07:40:24.122Z","message":{"role":"assistant","content":[{"type":"thinking","thinking":"Done! Iteration complete. Let me summarize the result for the user.","thinkingSignature":"195f837baa1bff2529f900f0095c880cc4ff692927f926ffed323527b8c1b062"},{"type":"text","text":"**Iteration 25 result**: `keep` — 0.05ms (539 nodes, 242 edges)\n\nGraph expanded 82% (295→539 nodes) while primary metric stayed at noise floor. Primary metric is SATURATED — lru_cache warm load cannot improve further."}],"api":"anthropic-messages","provider":"minimax","model":"MiniMax-M2.7","usage":{"input":18669,"output":76,"cacheRead":10071,"cacheWrite":0,"totalTokens":28816,"cost":{"input":0.0056007,"output":0.0000912,"cacheRead":0.0006042599999999999,"cacheWrite":0,"total":0.006296159999999999}},"stopReason":"stop","timestamp":1777534819283,"responseId":"06423a63f1078f259f93f425546cdada"}}
{"type":"message","id":"d580de81","parentId":"96d6d262","timestamp":"2026-04-30T07:40:24.129Z","message":{"role":"user","content":[{"type":"text","text":"Autoresearch loop ended (likely context limit). Resume the experiment loop — read autoresearch.md and git log for context. Check autoresearch.ideas.md for promising paths to explore. Prune stale/tried ideas. Be careful not to overfit to the benchmarks and do not cheat on the benchmarks."}],"timestamp":1777534824125}}
