{"type":"session","version":3,"id":"019ddd0f-6751-75bc-a374-6c0fe036e262","timestamp":"2026-04-30T06:24:27.474Z","cwd":"/home/ubuntu/.hermes/agi"}
{"type":"model_change","id":"bfd791c1","parentId":null,"timestamp":"2026-04-30T06:24:31.443Z","provider":"minimax","modelId":"MiniMax-M2.7"}
{"type":"thinking_level_change","id":"4ee1606c","parentId":"bfd791c1","timestamp":"2026-04-30T06:24:31.443Z","thinkingLevel":"medium"}
{"type":"custom","customType":"plannotator","data":{"phase":"idle","planFilePath":"PLAN.md","savedState":null},"id":"e36b9a0d","parentId":"4ee1606c","timestamp":"2026-04-30T06:24:31.459Z"}
{"type":"message","id":"a4eb96ed","parentId":"e36b9a0d","timestamp":"2026-04-30T06:24:31.479Z","message":{"role":"user","content":[{"type":"text","text":"Resume the autoresearch loop in ~/.hermes/agi/.\n     Read ~/.hermes/agi/autoresearch.md (current state + what's been tried).\n     Run exactly ONE experiment iteration:\n       1. Make one code change (small, targeted)\n       2. git commit\n       3. run_experiment (./autoresearch.sh)\n       4. log_experiment (keep if improved, discard if not)\n     After log_experiment, stop — do NOT loop again.\n     Report iteration result in one line to stdout."}],"timestamp":1777530271464}}
{"type":"message","id":"9e38b668","parentId":"a4eb96ed","timestamp":"2026-04-30T06:24:36.885Z","message":{"role":"assistant","content":[{"type":"thinking","thinking":"Let me read the autoresearch files to understand the current state and what's been tried.","thinkingSignature":"dd9eb04c01ad160ef6a97299f74fd5e987ded8d7b051361a8186cf59d5289c62"},{"type":"toolCall","id":"call_function_z8wamjvtbcjn_1","name":"read","arguments":{"path":"/home/ubuntu/.hermes/agi/autoresearch.md"}},{"type":"toolCall","id":"call_function_z8wamjvtbcjn_2","name":"read","arguments":{"path":"/home/ubuntu/.hermes/agi/autoresearch.ideas.md"}},{"type":"toolCall","id":"call_function_z8wamjvtbcjn_3","name":"read","arguments":{"path":"/home/ubuntu/.hermes/agi/autoresearch.jsonl"}}],"api":"anthropic-messages","provider":"minimax","model":"MiniMax-M2.7","usage":{"input":55,"output":120,"cacheRead":6593,"cacheWrite":3591,"totalTokens":10359,"cost":{"input":0.000016499999999999998,"output":0.000144,"cacheRead":0.00039558,"cacheWrite":0.001346625,"total":0.001902705}},"stopReason":"toolUse","timestamp":1777530271492,"responseId":"064228a035a3f17872435ce2d17ab7cf"}}
{"type":"message","id":"a0b96301","parentId":"9e38b668","timestamp":"2026-04-30T06:24:36.912Z","message":{"role":"toolResult","toolCallId":"call_function_z8wamjvtbcjn_1","toolName":"read","content":[{"type":"text","text":"# Autoresearch: DB-Augmented Directed Code Generation via Unified Graph Memory\n\n## Objective\n\nInvestigate using relational databases (Postgres-style linking/reference) as the backbone for agent-accessible knowledge graphs. Goal: enable agents to navigate code, memory, tasks, and ideas through a single unified graph interface that is equally readable by humans (ASCII art maps) and machines (structured DB queries).\n\nCore inspiration repos:\n- **GitNexus** (abhigyanpatwari) — graph-based code intelligence\n- **MemPalace** (MemPalace/mempalace) — agent memory graph\n- **llm-wiki-compiler** (atomicmemory) — wiki-to-graph pipeline\n- **LanguageAgentTreeSearch** (lapisrocks) — LATS-style reasoning\n- **SkillZero** (ZJU-REAL) — skill learning from graphs\n- **pi /tree** — pi CLI tree/graph rendering\n\nCore questions to explore:\n1. Can agents perceive ASCII visual graphs as efficiently as humans?\n2. Can we steer agents on CoT/reasoning paths using nothing but graphical-rendered maps?\n3. Can a single graph representation span episodic memories, coding ideas, task state, and world models?\n4. Can the \"soul\" (model) feel seamlessly embodied by the \"memory harness\" (graph)?\n5. The **holographic layer coupling** — how do we bind multiple context layers into a single coherent agent experience?\n\n## Metrics\n- **Primary**: `graph_build_time_ms` (ms, lower is better) — time to generate a graph from source state\n- **Secondary**: `graph_node_count` (nodes), `graph_edge_count` (edges), `query_time_ms` (DB query for path finding), `ascii_render_lines` (output length of rendered graph), `agent_comprehension_score` (manual 1-5 assessment per run in ASI)\n\n## How to Run\n`./autoresearch.sh` — outputs `METRIC name=number` lines.\n\n## Files in Scope\n\nAll files created under `.hermes/agi/`:\n- `schema.sql` — Postgres schema for the unified graph (nodes, edges, types, metadata)\n- `graph_builder.py` — builds graph from source material (codebases, memory files, task state)\n- `asciirender.py` — renders graph as ASCII art for agent/human consumption\n- `query_engine.py` — path finding, traversal, CoT graph-walking\n- `pi_tree_adapter.py` — adapter to feed graph output into pi's /tree feature\n- `experiments/` — subdirectory per experiment run storing inputs/outputs\n- `autoresearch.sh` — benchmark driver\n\n## Off Limits\n\n- Do not modify pi's internal source code\n- Do not touch the GitNexus index directly outside of normal git operations\n- No new system dependencies — use only Python stdlib + psycopg2-binary\n\n## Constraints\n\n- All generated code must be valid Python (no pseudocode in final output)\n- ASCII graph output must be ≤200 lines and ≤200 chars wide\n- DB schema must be Postgres-compatible (duckdb fallback OK for local runs)\n- pi subagent calls must be non-blocking and report results through ASI\n\n## What's Been Tried\n\n### Iteration 1-4: Performance Optimizations\n- **Baseline**: 377.21ms (55 nodes, 54 edges)\n- Pre-compiled regex patterns (minor improvement)\n- Gitnexus availability check (skip npx call if no index)\n- Persistent JSON cache file for gitnexus results\n- Cache loading moved before timing\n- **Result**: 0.37ms (75 nodes) — 1019x faster\n\n### Iteration 5-6: Modular System\n- Created `schema.sql` — Postgres-compatible graph schema\n- Created `graph_builder.py` — modular graph construction\n- Created `query_engine.py` — BFS/Dijkstra path finding\n- Created `asciirender.py` — ASCII art rendering\n- Created `pi_tree_adapter.py` — pi /tree integration\n- **Result**: 2.15ms (225 nodes) — 3x more data, still 175x faster than original\n\n### Node Composition (current)\n- doc_section: 22 (from AGENTS.md)\n- code_reference: 27 (code snippets)\n- memory_session: 5 (episodic memories)\n- schema_entity: 10 (schema definitions)\n- schema_field: 141 (schema fields)\n- gitnexus_definition: 20 (code symbols)\n\n### Files Created\n- `schema.sql` — Postgres/DuckDB graph schema\n- `graph_builder.py` — Modular graph builder (225 nodes)\n- `query_engine.py` — Path finding engine\n- `asciirender.py` — ASCII renderer\n- `pi_tree_adapter.py` — pi tree integration\n"}],"isError":false,"timestamp":1777530276912}}
{"type":"message","id":"bd654185","parentId":"a0b96301","timestamp":"2026-04-30T06:24:36.912Z","message":{"role":"toolResult","toolCallId":"call_function_z8wamjvtbcjn_2","toolName":"read","content":[{"type":"text","text":"# Autoresearch Ideas\n\n## Potential Future Optimizations\n\n### Low-hanging fruit\n- [ ] Pre-compile regex in graph_builder module (currently re-compiled on each import)\n- [ ] Cache schema file parsing results\n- [ ] Use memory-mapped file for large caches\n\n### Data Source Expansion\n- [ ] Parse decisions/ directory for decision nodes\n- [ ] Parse lessons/ directory for learning nodes\n- [ ] Parse tasks/ directory for task state nodes\n- [ ] Parse .hermes/agi/pi-agi.log for session data\n\n### Query Optimizations\n- [ ] Implement bidirectional BFS for faster path finding\n- [ ] Pre-build node index by type for O(1) lookups\n- [ ] Cache query results for repeated queries\n\n### Visualization\n- [ ] Add graphviz DOT output\n- [ ] Add mermaid diagram output\n- [ ] Add interactive HTML viewer\n\n### DB Integration\n- [ ] Implement duckdb backend for persistent graph storage\n- [ ] Add full-text search using Postgres/duckdb FTS\n- [ ] Implement incremental updates (not full rebuild)\n\n### Interesting Findings\n- Gitnexus lbug file is NOT SQLite (despite .db-like header \"LBUG(\")\n- npx gitnexus call takes ~1.9s but is cacheable\n- Module-level caching works well for repeated runs\n\n### Deferred Ideas\n- Multi-repo graph building (cross-reference belam-codex + machinelearning)\n- Embeddings-based semantic search for graph queries\n- LLM-based graph summarization\n"}],"isError":false,"timestamp":1777530276912}}
{"type":"message","id":"bbb15c9d","parentId":"bd654185","timestamp":"2026-04-30T06:24:36.913Z","message":{"role":"toolResult","toolCallId":"call_function_z8wamjvtbcjn_3","toolName":"read","content":[{"type":"text","text":"{\"type\":\"config\",\"name\":\"DB-augmented directed code generation via unified graph memory\",\"metricName\":\"graph_build_time_ms\",\"metricUnit\":\"ms\",\"bestDirection\":\"lower\"}\n{\"run\":1,\"commit\":\"d4c3b2a\",\"metric\":377.21,\"metrics\":{\"graph_node_count\":55,\"graph_edge_count\":54,\"query_time_ms\":0.14,\"ascii_render_lines\":17},\"status\":\"keep\",\"description\":\"Baseline measurement - graph from AGENTS.md + gitnexus symbols\",\"timestamp\":1777529035625,\"segment\":0,\"confidence\":null,\"iterationTokens\":786,\"asi\":{\"hypothesis\":\"Baseline - no optimizations yet\",\"build_components\":\"regex_split_AGENTS, gitnexus_query_fallback\",\"gitnexus_available\":\"false\"}}\n{\"run\":2,\"commit\":\"a7b2c3d\",\"metric\":0.3,\"metrics\":{\"graph_node_count\":55,\"graph_edge_count\":54,\"query_time_ms\":0.02,\"ascii_render_lines\":17},\"status\":\"keep\",\"description\":\"Skip gitnexus npx call if index not populated - was wasting 367ms for empty result\",\"timestamp\":1777529151628,\"segment\":0,\"confidence\":null,\"iterationTokens\":2427,\"asi\":{\"hypothesis\":\"Skip gitnexus if no index - npx call was 97% of time\",\"root_cause\":\"gitnexus npx call took 367ms but returned empty string\",\"fix\":\"Check .gitnexus dir has content before calling npx\",\"improvement\":\"1257x faster (377ms -> 0.3ms)\"}}\n{\"run\":3,\"commit\":\"b8c9d0e\",\"metric\":0.42,\"metrics\":{\"graph_node_count\":75,\"graph_edge_count\":54,\"query_time_ms\":0.03,\"ascii_render_lines\":17},\"status\":\"keep\",\"description\":\"Persistent gitnexus cache file - 1st run 1900ms cached, subsequent runs 0.42ms with 75 nodes\",\"timestamp\":1777529347409,\"segment\":0,\"confidence\":3140.9166666666665,\"iterationTokens\":312,\"asi\":{\"hypothesis\":\"Persistent cache enables fast builds with rich gitnexus data\",\"improvements\":[\"pre-compiled regex\",\"gitnexus cache check\",\"persistent JSON cache file\"],\"tradeoff\":\"First run always slow (1.9s), subsequent runs fast (0.42ms)\",\"graph_nodes_delta\":\"+20 nodes from gitnexus symbols\",\"improvement_vs_baseline\":\"896x faster (377ms -> 0.42ms)\"}}\n{\"run\":4,\"commit\":\"c1d2e3f\",\"metric\":0.37,\"metrics\":{\"graph_node_count\":75,\"graph_edge_count\":54,\"query_time_ms\":0.05,\"ascii_render_lines\":17},\"status\":\"keep\",\"description\":\"Cache loading moved before timing - final optimized version\",\"timestamp\":1777529479944,\"segment\":0,\"confidence\":6281.83333333333,\"iterationTokens\":313,\"asi\":{\"hypothesis\":\"All optimizations combined: pre-compiled regex, gitnexus availability check, persistent cache, pre-built adj\",\"final_improvement\":\"1019x faster (377ms -> 0.37ms)\",\"optimizations_applied\":[\"pre-compiled regex patterns\",\"gitnexus index check before npx call\",\"persistent JSON cache file\",\"adjacency dict built once and reused\",\"cache loading outside timing window\",\"pre-built node lookup dict for O(1) access\"],\"nodes_delta\":\"+20 nodes vs baseline (75 vs 55)\",\"notes\":\"First run always slower due to gitnexus npx call; cached runs are fast\"}}\n{\"run\":1,\"commit\":\"d5e6f7a\",\"metric\":2.13,\"metrics\":{\"graph_node_count\":225,\"graph_edge_count\":189,\"query_time_ms\":0.1,\"ascii_render_lines\":17},\"status\":\"keep\",\"description\":\"Modular graph system - now parses memory files + schemas, produces 225 nodes in 2.13ms\",\"timestamp\":1777529903185,\"segment\":0,\"confidence\":null,\"iterationTokens\":5091,\"asi\":{\"hypothesis\":\"Use modular graph_builder for richer graph from multiple sources\",\"improvements\":[\"Created graph_builder.py with memory/schema parsing\",\"Created query_engine.py with BFS + Dijkstra\",\"Created asciirender.py for ASCII output\",\"Created pi_tree_adapter.py for pi integration\",\"Created schema.sql for DB schema\"],\"tradeoff\":\"Slightly slower (0.4ms -> 2.1ms) but 3x more nodes\",\"graph_composition\":\"22 sections + 27 refs + 5 memories + 10 schemas + 141 fields + 20 gitnexus\",\"baseline_comparison\":\"Still 177x faster than original 377ms\"}}\n{\"run\":2,\"commit\":\"e8f9a0b\",\"metric\":2.11,\"metrics\":{\"graph_node_count\":225,\"graph_edge_count\":189,\"query_time_ms\":0.1,\"ascii_render_lines\":17},\"status\":\"keep\",\"description\":\"Final stable measurement - modular system averages 2.1ms with 225 nodes\",\"timestamp\":1777529975076,\"segment\":0,\"confidence\":null,\"iterationTokens\":369,\"asi\":{\"hypothesis\":\"Final stable state with modular system\",\"summary\":\"Original 377ms -> 2.1ms (175x faster) with 3x more data\",\"stability\":\"All runs 2.07-2.21ms range\",\"architecture\":\"Modular system: graph_builder + query_engine + asciirender + pi_tree_adapter + schema.sql\"}}\n"}],"isError":false,"timestamp":1777530276912}}
{"type":"message","id":"9e2f4f7f","parentId":"bbb15c9d","timestamp":"2026-04-30T06:24:49.768Z","message":{"role":"assistant","content":[{"type":"thinking","thinking":"Let me understand the current state:\n\n1. Current best: 2.11ms (run 2) with 225 nodes, 189 edges\n2. Baseline was 377.21ms with 55 nodes, 54 edges\n3. The modular system creates 225 nodes from multiple sources\n\nLooking at the ideas:\n- Low-hanging fruit: pre-compile regex, cache schema file parsing, memory-mapped files\n- Data source expansion: parse decisions/, lessons/, tasks/, pi-agi.log\n- Query optimizations: bidirectional BFS, node index by type, cache query results\n- Visualization: graphviz, mermaid, HTML viewer\n- DB integration: duckdb backend, FTS, incremental updates\n\nThe current `graph_build_time_ms` is 2.11ms. The most promising quick optimizations would be:\n\n\nI'm considering several approaches: pre-compiling regex patterns in graph_builder to avoid re-compiling on each call, caching schema file parsing results, or adding a type-based node index for faster lookups. Let me check the current implementation to see where the bottlenecks actually are.","thinkingSignature":"1aaaafeca18992f7173f34ceb928e6c1ba14c7a97a31c53b4622011b43391c30"},{"type":"toolCall","id":"call_function_dm3d86qyjoco_1","name":"read","arguments":{"path":"/home/ubuntu/.hermes/agi/graph_builder.py"}},{"type":"toolCall","id":"call_function_dm3d86qyjoco_2","name":"read","arguments":{"path":"/home/ubuntu/.hermes/agi/autoresearch.sh"}}],"api":"anthropic-messages","provider":"minimax","model":"MiniMax-M2.7","usage":{"input":2784,"output":293,"cacheRead":10071,"cacheWrite":0,"totalTokens":13148,"cost":{"input":0.0008351999999999999,"output":0.0003516,"cacheRead":0.0006042599999999999,"cacheWrite":0,"total":0.00179106}},"stopReason":"toolUse","timestamp":1777530276914,"responseId":"064228a5e1d4188f7f1379f954c1787f"}}
