{"type":"message","id":"5a6cfdac","parentId":"869fc205","timestamp":"2026-04-30T08:49:59.917Z","message":{"role":"toolResult","toolCallId":"call_function_o2iuslt3dain_1","toolName":"edit","content":[{"type":"text","text":"Successfully replaced 1 block(s) in /home/ubuntu/.hermes/agi/graph_builder.py."}],"details":{"diff":"      ...\n 1442             delattr(self, '_last_mode_id')\n 1443 \n 1444         return count\n 1445 \n+1446     def parse_pipelines(self, pipelines_dir: str) -> int:\n+1447         \"\"\"Parse pipelines/ directory into pipeline + pipeline_stage nodes.\n+1448 \n+1449         Each pipeline file has YAML frontmatter (version, status, priority, type,\n+1450         agents, tags, project) and per-phase stage history tables.\n+1451 \n+1452         Node types:\n+1453           - pipeline: top-level pipeline record\n+1454           - pipeline_stage: individual stage entries from stage history tables\n+1455 \n+1456         Edges:\n+1457           - has_stage: pipeline → pipeline_stage (ordered by occurrence)\n+1458           - uses_agent: pipeline → agent_role\n+1459           - tagged_with: pipeline → tag\n+1460           - belongs_to_project: pipeline → knowledge (project)\n+1461           - next_stage: pipeline_stage → pipeline_stage (temporal order)\n+1462           - categorized_as: pipeline → tag (status, priority, type)\n+1463         \"\"\"\n+1464         if not os.path.isdir(pipelines_dir):\n+1465             return 0\n+1466 \n+1467         # Also scan archive/pipelines/\n+1468         archive_pipelines = os.path.join(pipelines_dir, \"archive\")\n+1469         dirs_to_scan = [pipelines_dir]\n+1470         if os.path.isdir(archive_pipelines):\n+1471             dirs_to_scan.append(archive_pipelines)\n+1472 \n+1473         count = 0\n+1474         _RE_STAGE_TABLE = re.compile(\n+1475             r'^\\|\\s*Stage\\s*\\|.*?\\|.*?\\|.*?\\|.*?\\|\\n((?:\\|.*?\\n)+)',\n+1476             re.MULTILINE\n+1477         )\n+1478         _RE_STAGE_ROW = re.compile(\n+1479             r'^\\|\\s*([^|]+?)\\s*\\|\\s*([^|]+?)\\s*\\|\\s*([^|]+?)\\s*\\|\\s*(.+?)\\s*\\|$'\n+1480         )\n+1481         _RE_PHASE_SECTION = re.compile(\n+1482             r'^## (Phase \\d+[^\\n]*)\\n.*?\\n(?:### Stage History\\n)?((?:\\|.*?\\n)+)',\n+1483             re.MULTILINE\n+1484         )\n+1485         _RE_PHASE_SIMPLE = re.compile(r'^## (Phase \\d+[^\\n]*?)(?:\\n| )', re.MULTILINE)\n+1486 \n+1487         for base_d in dirs_to_scan:\n+1488             subdir = \"pipelines\" if base_d == pipelines_dir else \"archive/pipelines\"\n+1489             try:\n+1490                 files = sorted(os.listdir(base_d))\n+1491             except Exception:\n+1492                 continue\n+1493 \n+1494             for filename in files:\n+1495                 if not filename.endswith('.md') or filename.startswith('.'):\n+1496                     continue\n+1497                 # Skip non-pipeline files (e.g., handoffs/ subdir)\n+1498                 if not os.path.isfile(os.path.join(base_d, filename)):\n+1499                     continue\n+1500 \n+1501                 filepath = os.path.join(base_d, filename)\n+1502                 try:\n+1503                     with open(filepath, \"r\") as f:\n+1504                         content = f.read()\n+1505                 except Exception:\n+1506                     continue\n+1507 \n+1508                 # Extract YAML frontmatter\n+1509                 fm_match = _RE_FRONT_MATTER.match(content)\n+1510                 meta = {}\n+1511                 if fm_match:\n+1512                     for line in fm_match.group(1).split('\\n'):\n+1513                         m = _RE_YAML_PAIR.match(line)\n+1514                         if m:\n+1515                             meta[m.group(1)] = m.group(2).strip()\n+1516 \n+1517                 version = meta.get('version', filename[:-3])\n+1518                 status = meta.get('status', '')\n+1519                 priority = meta.get('priority', '')\n+1520                 ptype = meta.get('type', '')\n+1521                 agents_str = meta.get('agents', '')\n+1522                 tags_str = meta.get('tags', '[]')\n+1523                 project = meta.get('project', '')\n+1524                 pending = meta.get('pending_action', '')\n+1525 \n+1526                 # Extract title\n+1527                 title_match = re.search(r'^#\\s+Implementation Pipeline:\\s*(.+)$', content, re.MULTILINE)\n+1528                 title = title_match.group(1).strip()[:60] if title_match else version\n+1529 \n+1530                 pipeline_id = self.add_node(\n+1531                     \"pipeline\",\n+1532                     title[:50],\n+1533                     f\"{status}|{priority}|{ptype}\",\n+1534                     f\"{subdir}/{filename}\",\n+1535                     f\"pipeline_{version}\"\n+1536                 )\n+1537                 count += 1\n+1538 \n+1539                 # Tag edges (from YAML tags)\n+1540                 if tags_str and tags_str != '[]':\n+1541                     tags = re.findall(r'[\\w-]+', tags_str)\n+1542                     for tag in tags[:8]:\n+1543                         tag_id = f\"tag_{tag}\"\n+1544                         if tag_id not in self._node_ids:\n+1545                             self.add_node(\"tag\", tag, \"\", f\"{subdir}/{filename}\", tag_id)\n+1546                         self.add_edge(pipeline_id, tag_id, \"tagged_with\")\n+1547                         count += 1\n+1548 \n+1549                 # Agent edges\n+1550                 if agents_str:\n+1551                     agents = re.findall(r'[\\w-]+', agents_str)\n+1552                     for agent in agents[:6]:\n+1553                         role_id = f\"agent_role_{agent}\"\n+1554                         if role_id not in self._node_ids:\n+1555                             self.add_node(\"agent_role\", agent, \"\", f\"{subdir}/{filename}\", role_id)\n+1556                         self.add_edge(pipeline_id, role_id, \"uses_agent\")\n+1557 \n+1558                 # Status/priority/type category edges\n+1559                 for cat_val, cat_prefix in [(status, \"pipeline_status\"), (priority, \"pipeline_priority\"), (ptype, \"pipeline_type\")]:\n+1560                     if cat_val:\n+1561                         cat_id = f\"tag_{cat_prefix}_{cat_val}\"\n+1562                         if cat_id not in self._node_ids:\n+1563                             self.add_node(\"tag\", f\"{cat_prefix}:{cat_val}\", \"\", f\"{subdir}/{filename}\", cat_id)\n+1564                         self.add_edge(pipeline_id, cat_id, \"categorized_as\")\n+1565 \n+1566                 # Project edge\n+1567                 if project:\n+1568                     proj_id = f\"project_{project}\"\n+1569                     if proj_id not in self._node_ids:\n+1570                         self.add_node(\"knowledge\", project, f\"project:{project}\", f\"{subdir}/{filename}\", proj_id)\n+1571                         count += 1\n+1572                     self.add_edge(pipeline_id, proj_id, \"belongs_to_project\")\n+1573 \n+1574                 # Extract stage history: parse all | Stage | Date | Agent | Notes | table rows\n+1575                 all_stages = []\n+1576                 # Find phase sections with stage history tables\n+1577                 for ph_match in _RE_PHASE_SECTION.finditer(content):\n+1578                     phase_name = ph_match.group(1).strip()\n+1579                     table_block = ph_match.group(2)\n+1580                     for row_match in _RE_STAGE_ROW.finditer(table_block):\n+1581                         stage_name = row_match.group(1).strip()\n+1582                         stage_date = row_match.group(2).strip()\n+1583                         stage_agent = row_match.group(3).strip()\n+1584                         stage_notes = row_match.group(4).strip()[:80]\n+1585                         all_stages.append((stage_name, stage_date, stage_agent, stage_notes))\n+1586 \n+1587                 # Also extract standalone stage tables (some pipelines put them without phase headers)\n+1588                 if not all_stages:\n+1589                     for tbl_match in _RE_STAGE_TABLE.finditer(content):\n+1590                         table_block = tbl_match.group(1)\n+1591                         for row_match in _RE_STAGE_ROW.finditer(table_block):\n+1592                             stage_name = row_match.group(1).strip()\n+1593                             stage_date = row_match.group(2).strip()\n+1594                             stage_agent = row_match.group(3).strip()\n+1595                             stage_notes = row_match.group(4).strip()[:80]\n+1596                             all_stages.append((stage_name, stage_date, stage_agent, stage_notes))\n+1597 \n+1598                 # Create pipeline_stage nodes\n+1599                 prev_stage_id = None\n+1600                 for (stage_name, stage_date, stage_agent, stage_notes) in all_stages[:40]:\n+1601                     stage_id = self.add_node(\n+1602                         \"pipeline_stage\",\n+1603                         stage_name[:40],\n+1604                         f\"{stage_date}|{stage_agent}|{stage_notes}\",\n+1605                         f\"{subdir}/{filename}#{stage_name}\",\n+1606                         f\"pipeline_{version}_stage_{stage_name}\"\n+1607                     )\n+1608                     count += 1\n+1609                     self.add_edge(pipeline_id, stage_id, \"has_stage\")\n+1610                     if prev_stage_id:\n+1611                         self.add_edge(prev_stage_id, stage_id, \"next_stage\")\n+1612                     prev_stage_id = stage_id\n+1613 \n+1614                     # Agent node for stage actor\n+1615                     if stage_agent and stage_agent not in ('unknown', 'belam-main'):\n+1616                         role_id = f\"agent_role_{stage_agent}\"\n+1617                         if role_id not in self._node_ids:\n+1618                             self.add_node(\"agent_role\", stage_agent, \"\", f\"{subdir}/{filename}\", role_id)\n+1619                         self.add_edge(stage_id, role_id, \"executed_by\")\n+1620 \n+1621                 # Phase summary nodes (Phase 1, Phase 2, etc.)\n+1622                 phase_names_seen = set()\n+1623                 for ph_match in _RE_PHASE_SIMPLE.finditer(content):\n+1624                     phase_name = ph_match.group(1).strip()\n+1625                     if phase_name not in phase_names_seen:\n+1626                         phase_names_seen.add(phase_name)\n+1627                         phase_id = self.add_node(\n+1628                             \"pipeline_phase\",\n+1629                             phase_name[:40],\n+1630                             \"\",\n+1631                             f\"{subdir}/{filename}#{phase_name}\",\n+1632                             f\"pipeline_{version}_phase_{len(phase_names_seen)}\"\n+1633                         )\n+1634                         count += 1\n+1635                         self.add_edge(pipeline_id, phase_id, \"has_phase\")\n+1636 \n+1637                 except_count = 0\n+1638 \n+1639         return count\n+1640 \n 1446     def parse_archive_tasks(self, archive_dir: str) -> int:\n 1447         \"\"\"Parse archive/tasks/ into archive_task nodes with upstream/downstream edges.\n 1448         \n 1449         Archive tasks have rich frontmatter (status, priority, upstream, downstream, tags)\n      ...","firstChangedLine":1446},"isError":false,"timestamp":1777538999917}}
{"type":"message","id":"4f17ed54","parentId":"5a6cfdac","timestamp":"2026-04-30T08:50:05.773Z","message":{"role":"assistant","content":[{"type":"thinking","thinking":"Now I need to wire the `parse_pipelines` call into `build_graph`. Let me add it after `parse_research_projects`.","thinkingSignature":"065b433b2082d42654a1dd1d4e22cb5f5c475c56d83f607ab49fa1c7454e7644"},{"type":"text","text":"Now wire `parse_pipelines` into `build_graph`:\n"},{"type":"toolCall","id":"call_function_9n264vr0k5s4_1","name":"edit","arguments":{"path":"/home/ubuntu/.hermes/agi/graph_builder.py","edits":[{"oldText":"    # Parse research/, projects/, modes/, runbooks/ directories\n    builder.parse_research_projects(hermes_dir)\n\n    # Bridge isolated clusters","newText":"    # Parse research/, projects/, modes/, runbooks/ directories\n    builder.parse_research_projects(hermes_dir)\n\n    # Parse pipelines/ (45+ pipeline specs with stage history, phase tracking)\n    pipelines_dir = os.path.join(hermes_dir, \"belam-codex\", \"pipelines\")\n    if os.path.isdir(pipelines_dir):\n        builder.parse_pipelines(pipelines_dir)\n\n    # Bridge isolated clusters"}]}}],"api":"anthropic-messages","provider":"minimax","model":"MiniMax-M2.7","usage":{"input":21022,"output":233,"cacheRead":10071,"cacheWrite":0,"totalTokens":31326,"cost":{"input":0.0063066,"output":0.00027959999999999997,"cacheRead":0.0006042599999999999,"cacheWrite":0,"total":0.007190459999999999}},"stopReason":"toolUse","timestamp":1777538999918,"responseId":"06424ab83d5847a421a606ceca72f588"}}
{"type":"message","id":"60b0c12d","parentId":"4f17ed54","timestamp":"2026-04-30T08:50:05.776Z","message":{"role":"toolResult","toolCallId":"call_function_9n264vr0k5s4_1","toolName":"edit","content":[{"type":"text","text":"Found 2 occurrences of the text in /home/ubuntu/.hermes/agi/graph_builder.py. The text must be unique. Please provide more context to make it unique."}],"details":{},"isError":true,"timestamp":1777539005776}}
{"type":"message","id":"2958c237","parentId":"60b0c12d","timestamp":"2026-04-30T08:50:10.291Z","message":{"role":"assistant","content":[{"type":"thinking","thinking":"There are 2 occurrences. Let me find both and add more context to target the right one (in `build_graph`, which is near the end of the file).","thinkingSignature":"af84500f4db4edde594539381799c72a4bf273fa7b5feeb6ad1dcf8c2351a491"},{"type":"toolCall","id":"call_function_jhr6okeqxr9j_1","name":"bash","arguments":{"command":"grep -n \"parse_research_projects\\|parse_skills\\|build_tag_bridges\" /home/ubuntu/.hermes/agi/graph_builder.py"}}],"api":"anthropic-messages","provider":"minimax","model":"MiniMax-M2.7","usage":{"input":21306,"output":91,"cacheRead":10071,"cacheWrite":0,"totalTokens":31468,"cost":{"input":0.0063917999999999996,"output":0.0001092,"cacheRead":0.0006042599999999999,"cacheWrite":0,"total":0.0071052599999999995}},"stopReason":"toolUse","timestamp":1777539005777,"responseId":"06424abe9cda9dbb5c8bf25ef46a2351"}}
{"type":"message","id":"230b6af9","parentId":"2958c237","timestamp":"2026-04-30T08:50:10.301Z","message":{"role":"toolResult","toolCallId":"call_function_jhr6okeqxr9j_1","toolName":"bash","content":[{"type":"text","text":"789:    def parse_skills(self, skills_dir: str) -> int:\n1286:    def parse_research_projects(self, hermes_dir: str) -> int:\n1869:    def build_tag_bridges(self, hermes_dir: str) -> int:\n2163:        builder.parse_skills(skills_dir)\n2188:    builder.parse_research_projects(hermes_dir)\n2191:    builder.build_tag_bridges(hermes_dir)\n2299:        builder.parse_skills(skills_dir)\n2324:    builder.parse_research_projects(hermes_dir)\n2327:    builder.build_tag_bridges(hermes_dir)\n"}],"isError":false,"timestamp":1777539010301}}
{"type":"message","id":"f3da0eeb","parentId":"230b6af9","timestamp":"2026-04-30T08:50:14.749Z","message":{"role":"assistant","content":[{"type":"thinking","thinking":"Both occurrences are identical. Let me check which one to target (in `_cached_build_builder`). Let me get the context around lines 2188 and 2324.","thinkingSignature":"b220824ada084a2f30ec5b17befd35216049580a5580b01be2a39ae65db12ca5"},{"type":"toolCall","id":"call_function_st4nm4sxdmks_1","name":"read","arguments":{"path":"/home/ubuntu/.hermes/agi/graph_builder.py","offset":2180,"limit":15}},{"type":"toolCall","id":"call_function_st4nm4sxdmks_2","name":"read","arguments":{"path":"/home/ubuntu/.hermes/agi/graph_builder.py","offset":2320,"limit":15}}],"api":"anthropic-messages","provider":"minimax","model":"MiniMax-M2.7","usage":{"input":21555,"output":143,"cacheRead":10071,"cacheWrite":0,"totalTokens":31769,"cost":{"input":0.0064665,"output":0.0001716,"cacheRead":0.0006042599999999999,"cacheWrite":0,"total":0.00724236}},"stopReason":"toolUse","timestamp":1777539010304,"responseId":"06424ac2e9527279395e1fcfe25252dc"}}
{"type":"message","id":"d0a8d2a0","parentId":"f3da0eeb","timestamp":"2026-04-30T08:50:14.751Z","message":{"role":"toolResult","toolCallId":"call_function_st4nm4sxdmks_1","toolName":"read","content":[{"type":"text","text":"        builder.parse_docs(docs_dir)\n\n    # Parse personas/ (agent archetype definitions)\n    personas_dir = os.path.join(hermes_dir, \"belam-codex\", \"personas\")\n    if os.path.isdir(personas_dir):\n        builder.parse_personas(personas_dir)\n\n    # Parse research/, projects/, modes/, runbooks/ directories\n    builder.parse_research_projects(hermes_dir)\n\n    # Bridge isolated clusters via shared tags (170 tags span decision/lesson/task)\n    builder.build_tag_bridges(hermes_dir)\n\n    # Process gitnexus cache\n    cache_to_use = None\n\n[168 more lines in file. Use offset=2195 to continue.]"}],"isError":false,"timestamp":1777539014751}}
{"type":"message","id":"a847f166","parentId":"d0a8d2a0","timestamp":"2026-04-30T08:50:14.752Z","message":{"role":"toolResult","toolCallId":"call_function_st4nm4sxdmks_2","toolName":"read","content":[{"type":"text","text":"    if os.path.isdir(personas_dir):\n        builder.parse_personas(personas_dir)\n\n    # Parse research/, projects/, modes/, runbooks/ directories\n    builder.parse_research_projects(hermes_dir)\n\n    # Bridge isolated clusters via shared tags\n    builder.build_tag_bridges(hermes_dir)\n\n    # Process gitnexus cache\n    global _gitnexus_cache\n    if cache_to_use is None:\n        cache_to_use = _gitnexus_cache\n    if use_gitnexus and cache_to_use is None:\n        gitnexus_dir = os.path.join(hermes_dir, \"belam-codex\", \".gitnexus\")\n\n[28 more lines in file. Use offset=2335 to continue.]"}],"isError":false,"timestamp":1777539014752}}
{"type":"message","id":"765acbdf","parentId":"a847f166","timestamp":"2026-04-30T08:50:22.666Z","message":{"role":"assistant","content":[{"type":"thinking","thinking":"Both are identical. I need to pick one. Let me add more context to target the first one (in `build_graph`, not `_cached_build_builder`). I'll add the `if os.path.isdir(personas_dir):` context before.","thinkingSignature":"0a5416225f529a5c3deaa67833e0536bd6932d46c3231105bb8185aba9e7d5cc"},{"type":"toolCall","id":"call_function_s38q6g5gfyu4_1","name":"edit","arguments":{"path":"/home/ubuntu/.hermes/agi/graph_builder.py","edits":[{"oldText":"    personas_dir = os.path.join(hermes_dir, \"belam-codex\", \"personas\")\n    if os.path.isdir(personas_dir):\n        builder.parse_personas(personas_dir)\n\n    # Parse research/, projects/, modes/, runbooks/ directories\n    builder.parse_research_projects(hermes_dir)\n\n    # Bridge isolated clusters via shared tags (170 tags span decision/lesson/task)\n    builder.build_tag_bridges(hermes_dir)\n\n    # Process gitnexus cache\n    cache_to_use = None","newText":"    personas_dir = os.path.join(hermes_dir, \"belam-codex\", \"personas\")\n    if os.path.isdir(personas_dir):\n        builder.parse_personas(personas_dir)\n\n    # Parse research/, projects/, modes/, runbooks/ directories\n    builder.parse_research_projects(hermes_dir)\n\n    # Parse pipelines/ (45+ pipeline specs with stage history, phase tracking)\n    pipelines_dir = os.path.join(hermes_dir, \"belam-codex\", \"pipelines\")\n    if os.path.isdir(pipelines_dir):\n        builder.parse_pipelines(pipelines_dir)\n\n    # Bridge isolated clusters via shared tags (170 tags span decision/lesson/task)\n    builder.build_tag_bridges(hermes_dir)\n\n    # Process gitnexus cache\n    cache_to_use = None"}]}}],"api":"anthropic-messages","provider":"minimax","model":"MiniMax-M2.7","usage":{"input":22006,"output":416,"cacheRead":10071,"cacheWrite":0,"totalTokens":32493,"cost":{"input":0.0066018,"output":0.0004992,"cacheRead":0.0006042599999999999,"cacheWrite":0,"total":0.007705259999999999}},"stopReason":"toolUse","timestamp":1777539014753,"responseId":"06424ac71f75397f889ccd543405349d"}}
{"type":"message","id":"660579f1","parentId":"765acbdf","timestamp":"2026-04-30T08:50:22.674Z","message":{"role":"toolResult","toolCallId":"call_function_s38q6g5gfyu4_1","toolName":"edit","content":[{"type":"text","text":"Successfully replaced 1 block(s) in /home/ubuntu/.hermes/agi/graph_builder.py."}],"details":{"diff":"      ...\n 2186 \n 2187     # Parse research/, projects/, modes/, runbooks/ directories\n 2188     builder.parse_research_projects(hermes_dir)\n 2189 \n+2190     # Parse pipelines/ (45+ pipeline specs with stage history, phase tracking)\n+2191     pipelines_dir = os.path.join(hermes_dir, \"belam-codex\", \"pipelines\")\n+2192     if os.path.isdir(pipelines_dir):\n+2193         builder.parse_pipelines(pipelines_dir)\n+2194 \n 2190     # Bridge isolated clusters via shared tags (170 tags span decision/lesson/task)\n 2191     builder.build_tag_bridges(hermes_dir)\n 2192 \n 2193     # Process gitnexus cache\n      ...","firstChangedLine":2190},"isError":false,"timestamp":1777539022674}}
