{"type":"message","id":"98fba7b4","parentId":"e3e4164d","timestamp":"2026-04-30T07:59:36.650Z","message":{"role":"toolResult","toolCallId":"call_function_7pxg80hdljwv_1","toolName":"read","content":[{"type":"text","text":"            source = f\"canvas/graph_data.json\"\n            # Create our node ID: type_slug format\n            our_id = canvas_id.replace('/', '_')\n            node_id = self.add_node(\n                f\"canvas_{node_type}\",\n                title,\n                tags,\n                source,\n                our_id\n            )\n            slug_to_id[canvas_id] = our_id\n            id_type_map[canvas_id] = (node_type, node_id)\n            nodes_added += 1\n\n        edges_added = 0\n        for ce in canvas_edges:\n            src = ce.get('source', '')\n            tgt = ce.get('target', '')\n            if not src or not tgt:\n                continue\n            # Map canvas IDs to our IDs\n            src_id = slug_to_id.get(src)\n            tgt_id = slug_to_id.get(tgt)\n            if src_id and tgt_id and src_id in self._node_ids and tgt_id in self._node_ids:\n                self.add_edge(src_id, tgt_id, \"causes\")\n                edges_added += 1\n\n        return nodes_added, edges_added\n\n    def parse_knowledge(self, knowledge_dir: str) -> int:\n        \"\"\"Parse knowledge files into graph nodes.\n        \n        Knowledge files have frontmatter with topic, tags, related, sources.\n        Each file becomes a knowledge node with tag and related edges.\n        \"\"\"\n        if not os.path.isdir(knowledge_dir):\n            return 0\n\n        files = sorted(os.listdir(knowledge_dir))\n        md_files = [f for f in files if f.endswith('.md')]\n        count = 0\n\n        for filename in md_files:\n            filepath = os.path.join(knowledge_dir, filename)\n            try:\n                with open(filepath, \"r\") as f:\n                    content = f.read()\n\n                # Extract frontmatter\n                fm_match = _RE_FRONT_MATTER.match(content)\n                meta = {}\n                if fm_match:\n                    for line in fm_match.group(1).split('\\n'):\n                        m = _RE_YAML_PAIR.match(line)\n                        if m:\n                            meta[m.group(1)] = m.group(2)\n\n                topic = meta.get('topic', filename[:-3])\n                tags_str = meta.get('tags', '[]')\n                related_str = meta.get('related', '[]')\n                created = meta.get('created', '')\n\n                # Extract first section body as content\n                body_match = re.search(r'## Claim\\s*\\n+(.+?)(?:\\n##|\\Z)', content, re.DOTALL)\n                body = body_match.group(1).strip()[:100] if body_match else \"\"\n\n                label = topic[:50]\n                summary = f\"tags:{tags_str[:60]}|related:{related_str[:40]}\"\n\n                node_id = self.add_node(\n                    \"knowledge\",\n                    label,\n                    summary,\n                    f\"knowledge/{filename}\",\n                    f\"knowledge_{filename[:-3]}\"\n                )\n                count += 1\n\n                # Parse related references as edges (to existing nodes)\n                if related_str and related_str != '[]':\n                    related_items = re.findall(r'(\\w+(?:-\\w+)*)', related_str)\n                    for rel in related_items[:5]:\n                        rel_id = self._find_or_add_reference(rel, f\"knowledge/{filename}\")\n                        if rel_id:\n                            self.add_edge(node_id, rel_id, \"related_to\")\n\n            except Exception:\n                pass\n        return count\n\n    def _find_or_add_reference(self, ref: str, source: str) -> Optional[str]:\n        \"\"\"Find existing node by slug-like reference or add a stub reference node.\"\"\"\n        # Convert slug to node ID format used in our graph\n        candidates = [\n            f\"decision_{ref.replace('/', '_')}\",\n            f\"lesson_{ref.replace('/', '_')}\",\n            f\"knowledge_{ref.replace('/', '_')}\",\n            f\"canvas_decision_{ref.replace('/', '_')}\",\n            f\"canvas_lesson_{ref.replace('/', '_')}\",\n        ]\n        for cid in candidates:\n            if cid in self._node_ids:\n                return cid\n        # Stub reference node\n        stub_id = f\"ref_{ref.replace('/', '_')[:50]}\"\n        if stub_id not in self._node_ids:\n            self.add_node(\"reference\", ref[:60], \"\", source, stub_id)\n        return stub_id\n\n    def parse_handoff(self, handoff_dir: str) -> int:\n        \"\"\"Parse handoff files into graph nodes.\n        \n        Handoff files are TODO/planning documents with controller, timestamp,\n        goals, and investigation notes. Creates handoff nodes with goal edges.\n        \"\"\"\n        if not os.path.isdir(handoff_dir):\n            return 0\n\n        files = sorted(os.listdir(handoff_dir), reverse=True)\n        md_files = [f for f in files if f.endswith('.md')]\n        count = 0\n\n        for filename in md_files:\n            filepath = os.path.join(handoff_dir, filename)\n            try:\n                with open(filepath, \"r\") as f:\n                    content = f.read()\n\n                # Extract frontmatter\n                fm_match = _RE_FRONT_MATTER.match(content)\n                meta = {}\n                if fm_match:\n                    for line in fm_match.group(1).split('\\n'):\n                        m = _RE_YAML_PAIR.match(line)\n                        if m:\n                            meta[m.group(1)] = m.group(2)\n\n                controller = meta.get('controller', '')\n                timestamp = meta.get('timestamp', '')\n                goal_match = re.search(r'## User goal\\s*\\n\\n(.+?)(?:\\n\\n|##)', content, re.DOTALL)\n                goal = goal_match.group(1).strip()[:100] if goal_match else \"\"\n\n                # Extract TODO items\n                todo_items = re.findall(r'(?:^[-*]\\s*(.+)$|TODO:\\s*(.+)$)', content, re.MULTILINE)\n                todos = [t[0] or t[1] for t in todo_items if t[0] or t[1]][:5]\n\n                label = filename[:50]\n                summary = f\"{controller}|{timestamp[:10]}|{goal[:50]}\"\n\n                node_id = self.add_node(\n                    \"handoff\",\n                    label,\n                    summary,\n                    f\"handoff/{filename}\",\n                    f\"handoff_{filename[:40]}\"\n                )\n                count += 1\n\n                # Add TODO items as child nodes\n                for i, todo in enumerate(todos):\n                    todo_id = self.add_node(\n                        \"handoff_item\",\n                        todo[:60],\n                        \"\",\n                        f\"handoff/{filename}\",\n                        f\"handoff_item_{filename[:30]}_{i}\"\n                    )\n                    self.add_edge(node_id, todo_id, \"contains\")\n                    count += 1\n\n            except Exception:\n                pass\n        return count\n\n    def build_adjacency(self):\n        \"\"\"Build adjacency dict from edges.\"\"\"\n        self.adj = defaultdict(list)\n        for edge in self.edges:\n            if edge[\"from\"] in self._node_ids and edge[\"to\"] in self._node_ids:\n                self.adj[edge[\"from\"]].append(edge[\"to\"])\n                self.adj[edge[\"to\"]].append(edge[\"from\"])\n\n    def get_stats(self) -> Dict[str, Any]:\n        \"\"\"Get graph statistics.\"\"\"\n        return {\n            \"node_count\": len(self.nodes),\n            \"edge_count\": len(self.edges),\n            \"nodes_by_type\": self._count_by_type(),\n            \"node_ids\": len(self._node_ids)\n        }\n\n    def _count_by_type(self) -> Dict[str, int]:\n        \"\"\"Count nodes by type (tuple access: [1] = type).\"\"\"\n        counts = defaultdict(int)\n        for node in self.nodes:\n            counts[node[1]] += 1\n        return dict(counts)\n\n\ndef run_subprocess(cmd: str, timeout: int = 30) -> str:\n    \"\"\"Run subprocess command.\"\"\"\n    import subprocess\n    try:\n        result = subprocess.run(\n            cmd, shell=True, capture_output=True, text=True, timeout=timeout\n        )\n        return result.stdout + result.stderr\n    except Exception:\n        return \"\"\n\n\n# Graph pickle cache file\n_GRAPH_CACHE_FILE = None\nimport pickle  # Module-level for faster cache loads\n\ndef _get_graph_cache_file(agi_dir: str) -> str:\n    global _GRAPH_CACHE_FILE\n    if _GRAPH_CACHE_FILE is None:\n        _GRAPH_CACHE_FILE = os.path.join(agi_dir, \".graph_cache.pkl\")\n    return _GRAPH_CACHE_FILE\n\ndef _get_source_mtimes(hermes_dir: str) -> Dict[str, float]:\n    \"\"\"Collect modification times of all graph source files.\"\"\"\n    mtimes = {}\n    paths = [\n        os.path.join(hermes_dir, \"belam-codex\", \"AGENTS.md\"),\n    ]\n    # Memory files\n    memory_dir = os.path.join(hermes_dir, \"belam-codex\", \"memory\")\n    if os.path.isdir(memory_dir):\n        for f in sorted(os.listdir(memory_dir))[:10]:\n            if f.endswith('.md'):\n                paths.append(os.path.join(memory_dir, f))\n    # Schema files\n    schema_dir = os.path.join(hermes_dir, \"belam-codex\", \"schemas\")\n    if os.path.isdir(schema_dir):\n        for f in os.listdir(schema_dir):\n            if f.endswith(('.md', '.yaml', '.yml')):\n                paths.append(os.path.join(schema_dir, f))\n    for p in paths:\n        if os.path.exists(p):\n            mtimes[p] = os.path.getmtime(p)\n    return mtimes\n\ndef _try_load_graph_cache(agi_dir: str, source_mtimes: Dict[str, float],\n                           gitnexus_cache: Optional[str]) -> Optional[GraphBuilder]:\n    \"\"\"Try to load graph from pickle cache if sources unchanged.\n    \n    Optimization: skip stat-ing source files. Trust pickle file's mtime as proxy.\n    If pickle exists and is readable, sources haven't changed.\n    \"\"\"\n    cache_file = _get_graph_cache_file(agi_dir)\n    if not os.path.exists(cache_file):\n        return None\n    try:\n        with open(cache_file, 'rb') as f:\n            cached = pickle.load(f)\n        # Fast path: skip source_mtimes/gitnexus validation.\n        # Pickle file's mtime is a reliable enough proxy.\n        # (If sources change, pickle is rebuilt. If only content changes\n        # without touching source files, the caller must invalidate.)\n        builder = GraphBuilder()\n        builder.nodes = cached.get('nodes', [])\n        builder.edges = cached.get('edges', [])\n        builder.adj = cached.get('adj', {})\n        builder._node_ids = cached.get('_node_ids', {n[0] for n in builder.nodes})\n        return builder\n    except Exception:\n        return None\n\ndef _save_graph_cache(agi_dir: str, builder: GraphBuilder,\n                       gitnexus_cache: Optional[str]):\n    \"\"\"Save built graph to pickle cache.\"\"\"\n    try:\n        cache_file = _get_graph_cache_file(agi_dir)\n        cached = {\n            'nodes': builder.nodes,\n            'edges': builder.edges,\n            'adj': dict(builder.adj),\n            '_node_ids': builder._node_ids,\n            '_gitnexus_cache': gitnexus_cache,\n        }\n        with open(cache_file, 'wb') as f:\n            pickle.dump(cached, f, protocol=pickle.HIGHEST_PROTOCOL)\n    except Exception:\n        pass\n\n@lru_cache(maxsize=1)\ndef _cached_build_builder(hermes_dir: str, agi_dir: str, gitnexus_hash: int, _cache_ver: int = 1) -> GraphBuilder:\n    \"\"\"Cached builder internals — returns serializable parts only.\n    \n    lru_cache eliminates pickle.load entirely for warm calls.\n    gitnexus_hash is a cache-busting int derived from gitnexus content.\n    \"\"\"\n    # Initialize cache\n    init_cache(agi_dir)\n\n    # Build from sources\n    builder = GraphBuilder()\n\n\n[194 more lines in file. Use offset=950 to continue.]"}],"isError":false,"timestamp":1777535976650}}
{"type":"message","id":"913ebbbb","parentId":"98fba7b4","timestamp":"2026-04-30T07:59:41.088Z","message":{"role":"assistant","content":[{"type":"thinking","thinking":"I see the `parse_knowledge` and `parse_handoff` methods already exist in the code. The question is whether those directories exist and whether they are being called. Let me check the `build_graph` function to see what's being called.","thinkingSignature":"54dbb626509271e4baeb67404837570c947fe660a0126a53fb9cf7be321e4a6f"},{"type":"toolCall","id":"call_function_709k98rokoon_1","name":"read","arguments":{"path":"/home/ubuntu/.hermes/agi/graph_builder.py","offset":950,"limit":150}}],"api":"anthropic-messages","provider":"minimax","model":"MiniMax-M2.7","usage":{"input":35337,"output":107,"cacheRead":10071,"cacheWrite":0,"totalTokens":45515,"cost":{"input":0.010601099999999999,"output":0.0001284,"cacheRead":0.0006042599999999999,"cacheWrite":0,"total":0.01133376}},"stopReason":"toolUse","timestamp":1777535976651,"responseId":"06423ee9aa0c515afd31eae830815be4"}}
{"type":"message","id":"862afebf","parentId":"913ebbbb","timestamp":"2026-04-30T07:59:41.090Z","message":{"role":"toolResult","toolCallId":"call_function_709k98rokoon_1","toolName":"read","content":[{"type":"text","text":"    # Parse AGENTS.md\n    agents_md = os.path.join(hermes_dir, \"belam-codex\", \"AGENTS.md\")\n    builder.parse_agents_md(agents_md)\n\n    # Parse memory files (expanded to all 58)\n    memory_dir = os.path.join(hermes_dir, \"belam-codex\", \"memory\")\n    builder.parse_memory_files(memory_dir, limit=58)\n\n    # Parse schema files\n    schema_dir = os.path.join(hermes_dir, \"belam-codex\", \"schemas\")\n    builder.parse_schema_files(schema_dir)\n\n    # Parse decisions (all 128 files)\n    decisions_dir = os.path.join(hermes_dir, \"belam-codex\", \"decisions\")\n    if os.path.isdir(decisions_dir):\n        builder.parse_decisions(decisions_dir, limit=999)\n\n    # Parse lessons (all 208 files)\n    lessons_dir = os.path.join(hermes_dir, \"belam-codex\", \"lessons\")\n    if os.path.isdir(lessons_dir):\n        builder.parse_lessons(lessons_dir, limit=999)\n\n    # Parse tasks (all 84 files)\n    tasks_dir = os.path.join(hermes_dir, \"belam-codex\", \"tasks\")\n    if os.path.isdir(tasks_dir):\n        builder.parse_tasks(tasks_dir, limit=999)\n\n    # Parse goals (goal nodes with status/priority/urgency)\n    goals_dir = os.path.join(hermes_dir, \"belam-codex\", \"goals\")\n    if os.path.isdir(goals_dir):\n        builder.parse_goals(goals_dir)\n\n    # Parse agent roles (main, architect, builder, critic)\n    agents_dir = os.path.join(hermes_dir, \"belam-codex\", \"agents\")\n    if os.path.isdir(agents_dir):\n        builder.parse_agent_roles(agents_dir)\n\n    # Parse canvas graph (pre-computed cross-primitive causal edges)\n    canvas_dir = os.path.join(hermes_dir, \"belam-codex\", \"canvas\")\n    if os.path.isdir(canvas_dir):\n        builder.parse_canvas_graph(canvas_dir)\n\n    # Parse knowledge directory (semantic knowledge nodes with tag edges)\n    knowledge_dir = os.path.join(hermes_dir, \"belam-codex\", \"knowledge\")\n    if os.path.isdir(knowledge_dir):\n        builder.parse_knowledge(knowledge_dir)\n\n    # Parse handoff directory (agent handoff logs with TODO items)\n    handoff_dir = os.path.join(hermes_dir, \"belam-codex\", \"handoff\")\n    if os.path.isdir(handoff_dir):\n        builder.parse_handoff(handoff_dir)\n\n    # Process gitnexus cache\n    cache_to_use = None\n    gitnexus_cache_file = os.path.join(agi_dir, \".gitnexus_cache.json\")\n    if os.path.exists(gitnexus_cache_file):\n        try:\n            with open(gitnexus_cache_file) as f:\n                cache_to_use = f.read()\n        except Exception:\n            pass\n\n    builder.process_gitnexus_cache(cache_to_use)\n\n    # Build adjacency\n    builder.build_adjacency()\n\n    # Save to pickle cache (for cold starts)\n    _save_graph_cache(agi_dir, builder, cache_to_use)\n\n    # Return builder directly — lru_cache on GraphBuilder means warm calls are O(1) object return\n    return builder\n\n\ndef build_graph(hermes_dir: str, agi_dir: str, use_gitnexus: bool = True,\n                 gitnexus_cache: Optional[str] = None) -> Tuple[GraphBuilder, float]:\n    \"\"\"Main graph building function with lru_cache for warm calls.\"\"\"\n    start = time.perf_counter()\n\n    # Get gitnexus hash for cache busting\n    gitnexus_hash = 0\n    gitnexus_cache_file = os.path.join(agi_dir, \".gitnexus_cache.json\")\n    if os.path.exists(gitnexus_cache_file):\n        try:\n            gitnexus_hash = os.path.getsize(gitnexus_cache_file)\n        except Exception:\n            pass\n\n    # Try lru_cache first (no pickle.load) — bump _cache_ver=2 to bust cache after code/data changes\n    try:\n        builder = _cached_build_builder(hermes_dir, agi_dir, gitnexus_hash, _cache_ver=3)\n        elapsed_ms = (time.perf_counter() - start) * 1000\n        return builder, elapsed_ms\n    except Exception:\n        pass\n\n    # Fallback: try pickle cache\n    init_cache(agi_dir)\n    cache_to_use = gitnexus_cache\n    builder = _try_load_graph_cache(agi_dir, {}, gitnexus_cache)\n    if builder is not None:\n        elapsed_ms = (time.perf_counter() - start) * 1000\n        return builder, elapsed_ms\n\n    # Cold build path\n    init_cache(agi_dir)\n    builder = GraphBuilder()\n\n    # Parse AGENTS.md\n    agents_md = os.path.join(hermes_dir, \"belam-codex\", \"AGENTS.md\")\n    builder.parse_agents_md(agents_md)\n\n    # Parse memory files (expanded to all 58)\n    memory_dir = os.path.join(hermes_dir, \"belam-codex\", \"memory\")\n    builder.parse_memory_files(memory_dir, limit=58)\n\n    # Parse schema files\n    schema_dir = os.path.join(hermes_dir, \"belam-codex\", \"schemas\")\n    builder.parse_schema_files(schema_dir)\n\n    # Parse decisions (all 128 files)\n    decisions_dir = os.path.join(hermes_dir, \"belam-codex\", \"decisions\")\n    if os.path.isdir(decisions_dir):\n        builder.parse_decisions(decisions_dir, limit=999)\n\n    # Parse lessons (all 208 files)\n    lessons_dir = os.path.join(hermes_dir, \"belam-codex\", \"lessons\")\n    if os.path.isdir(lessons_dir):\n        builder.parse_lessons(lessons_dir, limit=999)\n\n    # Parse tasks (expanded to all 84)\n    tasks_dir = os.path.join(hermes_dir, \"belam-codex\", \"tasks\")\n    if os.path.isdir(tasks_dir):\n        builder.parse_tasks(tasks_dir, limit=999)\n\n    # Parse goals (goal nodes with status/priority/urgency)\n    goals_dir = os.path.join(hermes_dir, \"belam-codex\", \"goals\")\n    if os.path.isdir(goals_dir):\n        builder.parse_goals(goals_dir)\n\n    # Parse agent roles (main, architect, builder, critic)\n    agents_dir = os.path.join(hermes_dir, \"belam-codex\", \"agents\")\n    if os.path.isdir(agents_dir):\n        builder.parse_agent_roles(agents_dir)\n\n    # Parse canvas graph (pre-computed cross-primitive causal edges)\n    canvas_dir = os.path.join(hermes_dir, \"belam-codex\", \"canvas\")\n    if os.path.isdir(canvas_dir):\n        builder.parse_canvas_graph(canvas_dir)\n\n\n[44 more lines in file. Use offset=1100 to continue.]"}],"isError":false,"timestamp":1777535981090}}
{"type":"message","id":"49a08e35","parentId":"862afebf","timestamp":"2026-04-30T07:59:46.523Z","message":{"role":"assistant","content":[{"type":"thinking","thinking":"The build_graph function already calls `parse_knowledge` and `parse_handoff` if the directories exist. The directories are in `hermes_dir/belam-codex/knowledge` and `hermes_dir/belam-codex/handoff`. Let me check if those directories exist.","thinkingSignature":"cb9be4ad98d110d03cd917a5d617714598e2bc98d05a2195214618be5ac94f03"},{"type":"toolCall","id":"call_function_l1z9g6uto94p_1","name":"bash","arguments":{"command":"ls /home/ubuntu/.hermes/belam-codex/ 2>/dev/null && echo \"---\" && ls /home/ubuntu/.hermes/belam-codex/knowledge/ 2>/dev/null | wc -l && ls /home/ubuntu/.hermes/belam-codex/handoff/ 2>/dev/null | wc -l"}}],"api":"anthropic-messages","provider":"minimax","model":"MiniMax-M2.7","usage":{"input":36955,"output":160,"cacheRead":10071,"cacheWrite":0,"totalTokens":47186,"cost":{"input":0.0110865,"output":0.000192,"cacheRead":0.0006042599999999999,"cacheWrite":0,"total":0.01188276}},"stopReason":"toolUse","timestamp":1777535981091,"responseId":"06423eed468c2e02c62daa44a6070a01"}}
{"type":"message","id":"7448d637","parentId":"49a08e35","timestamp":"2026-04-30T07:59:46.536Z","message":{"role":"toolResult","toolCallId":"call_function_l1z9g6uto94p_1","toolName":"bash","content":[{"type":"text","text":"!cat\nAGENTS.md\nCLAUDE.md\nCOCKPIT_REFACTOR_GUIDE.md\nCODEX.codex\nCONTEXT_BOOT.md\nDockerfile\nHEARTBEAT.md\nIDENTITY.md\nMEMORY.md\nSOUL.md\nTOOLS.md\nUSER.md\nagents\narchive\nbin\ncanvas\ncodex_legend.md\ndata\ndecisions\ndocker\ndocker-compose.yml\ndocs\nextensions-backup\ngoals\nhandoff\nhooks\nincarnate.sh\nknowledge\nlessons\nlocal_plugins\nlogs\nmachinelearning\nmemory\nmodes\npersonas\npipeline_builds\npipelines\nplugins\nprojects\nrequirements-backtest.txt\nrequirements-base.txt\nrequirements-ml.txt\nrequirements-video.txt\nresearch\nrunbooks\nschemas\nscripts\nskills\nspecs\nstate\ntasks\ntemplates\ntests\n---\n15\n9\n"}],"isError":false,"timestamp":1777535986536}}
