{"type":"message","id":"4f39585d","parentId":"a37fe859","timestamp":"2026-04-30T08:23:33.482Z","message":{"role":"assistant","content":[{"type":"thinking","thinking":"Now I have enough context. I need to:\n\n1. Add `parse_codex_modules` method to GraphBuilder class (insert before `build_adjacency`)\n2. Call it from `_cached_build_builder` after `parse_archive_tasks`\n3. Increment `_cache_ver` from 1 to 2\n\nLet me write the parser. It will:\n- Parse 3 Python files in `archive/codex-layer-v1-modules/`\n- Extract: codex_module nodes, codex_class nodes, codex_function nodes\n- Create `defines` edges from module→class, module→function\n- Create `implements` edges from class→method\n\n\n- Create `imports` edges between modules and classes, plus `calls` edges between functions\n\nNow I'll implement the edits.","thinkingSignature":"8c1d1996408527b1a1289213f2bd5f91c38f156c54a74abc0555306bf9274871"},{"type":"text","text":"\nNow I'll add the codex module parser. First, insert the new method before `build_adjacency`:\n"},{"type":"toolCall","id":"call_function_i8ycout0e8mp_1","name":"edit","arguments":{"path":"/home/ubuntu/.hermes/agi/graph_builder.py","edits":[{"oldText":"    def build_adjacency(self):","newText":"    def parse_codex_modules(self, archive_dir: str) -> int:\n        \"\"\"Parse archive/codex-layer-v1-modules/*.py for code architecture.\n        \n        Creates: codex_module, codex_class, codex_function nodes + defines/implements/imports edges.\n        Bridges isolated code clusters with structural code architecture data.\n        \"\"\"\n        modules_dir = os.path.join(archive_dir, \"codex-layer-v1-modules\")\n        if not os.path.isdir(modules_dir):\n            return 0\n\n        _RE_CLASS = re.compile(r'^class\\s+(\\w+)', re.MULTILINE)\n        _RE_DEF = re.compile(r'^    def\\s+(\\w+)\\s*\\(', re.MULTILINE)\n        _RE_IMPORT = re.compile(r'^from\\s+(\\w+)\\s+import', re.MULTILINE)\n        _RE_PIPELINE = re.compile(r'Pipeline:\\s*(.+)', re.IGNORECASE)\n        _RE_PHASE = re.compile(r'Phase\\s+([A-Z])\\.?\\s*of', re.IGNORECASE)\n        _RE_FLAG = re.compile(r'FLAG-\\d+:', re.IGNORECASE)\n\n        count = 0\n        module_ids = {}  # filename_without_ext -> node_id\n        class_ids = {}   # class_name -> node_id\n        py_files = sorted([f for f in os.listdir(modules_dir) if f.endswith('.py')])\n\n        # First pass: create module nodes\n        for filename in py_files:\n            filepath = os.path.join(modules_dir, filename)\n            try:\n                with open(filepath, \"r\") as f:\n                    content = f.read()\n            except Exception:\n                continue\n\n            module_name = filename[:-3]  # strip .py\n            module_id = self.add_node(\n                \"codex_module\",\n                module_name,\n                content[:100].strip(),\n                f\"archive/codex-layer-v1-modules/{filename}\",\n                f\"codex_module_{module_name}\"\n            )\n            module_ids[module_name] = module_id\n            count += 1\n\n            # Extract classes and functions\n            classes = _RE_CLASS.findall(content)\n            for cls_name in classes:\n                if cls_name in ('Optional', 'List', 'Dict', 'Any', 'Tuple'):\n                    continue  # typing-only classes\n                cls_id = self.add_node(\n                    \"codex_class\",\n                    cls_name,\n                    f\"class in {module_name}\",\n                    f\"archive/codex-layer-v1-modules/{filename}\",\n                    f\"codex_class_{cls_name}\"\n                )\n                class_ids[cls_name] = cls_id\n                self.add_edge(module_id, cls_id, \"defines\")\n                count += 1\n\n                # Methods within class body\n                # Find class body boundaries\n                class_start = content.find(f'class {cls_name}')\n                if class_start < 0:\n                    continue\n                # Find next class or top-level def\n                rest = content[class_start + len(f'class {cls_name}'):]\n                next_class = rest.find('\\nclass ')\n                next_def = rest.find('\\ndef ')\n                class_end = len(rest)\n                if next_class > 0:\n                    class_end = min(class_end, next_class)\n                if next_def > 0:\n                    class_end = min(class_end, next_def)\n                class_body = rest[:class_end]\n                methods = _RE_DEF.findall(class_body)\n                for method_name in methods:\n                    if method_name.startswith('_') and method_name != '__init__':\n                        continue  # skip private methods\n                    method_id = self.add_node(\n                        \"codex_method\",\n                        f\"{cls_name}.{method_name}\",\n                        f\"method in {cls_name}\",\n                        f\"archive/codex-layer-v1-modules/{filename}\",\n                        f\"codex_method_{cls_name}_{method_name}\"\n                    )\n                    self.add_edge(cls_id, method_id, \"implements\")\n                    count += 1\n\n            # Top-level functions (outside classes)\n            lines = content.split('\\n')\n            in_class = False\n            for line in lines:\n                stripped = line.rstrip()\n                if stripped.startswith('class ') and _RE_CLASS.match(stripped):\n                    in_class = True\n                    continue\n                if stripped.startswith('class '):\n                    in_class = False\n                    continue\n                if stripped.startswith('def ') and not in_class:\n                    m = re.match(r'def\\s+(\\w+)', stripped)\n                    if m:\n                        fn_id = self.add_node(\n                            \"codex_function\",\n                            m.group(1),\n                            f\"function in {module_name}\",\n                            f\"archive/codex-layer-v1-modules/{filename}\",\n                            f\"codex_fn_{module_name}_{m.group(1)}\"\n                        )\n                        self.add_edge(module_id, fn_id, \"defines\")\n                        count += 1\n\n            # Import edges between modules\n            imports = _RE_IMPORT.findall(content)\n            for imported in imports:\n                if imported in module_ids and module_id != module_ids[imported]:\n                    self.add_edge(module_id, module_ids[imported], \"imports\")\n\n            # Phase/Pipeline metadata → links to related nodes\n            pipeline_match = _RE_PIPELINE.search(content)\n            if pipeline_match:\n                pipeline = pipeline_match.group(1).strip()\n                # Link module to related decisions/lessons via pipeline name\n                pipeline_key = pipeline.lower().replace(' ', '_').replace('-', '_')\n                related_id = f\"decision_{pipeline_key}\"\n                if related_id in self._node_ids:\n                    self.add_edge(module_id, related_id, \"implements_pipeline\")\n                    count += 1\n\n        return count\n\n    def build_adjacency(self):"}]}}],"api":"anthropic-messages","provider":"minimax","model":"MiniMax-M2.7","usage":{"input":29994,"output":1632,"cacheRead":10071,"cacheWrite":0,"totalTokens":41697,"cost":{"input":0.0089982,"output":0.0019584,"cacheRead":0.0006042599999999999,"cacheWrite":0,"total":0.011560860000000001}},"stopReason":"toolUse","timestamp":1777537382012,"responseId":"06424466e3fccea27010a9035a4a4e58"}}
{"type":"message","id":"17eed12b","parentId":"4f39585d","timestamp":"2026-04-30T08:23:33.508Z","message":{"role":"toolResult","toolCallId":"call_function_i8ycout0e8mp_1","toolName":"edit","content":[{"type":"text","text":"Successfully replaced 1 block(s) in /home/ubuntu/.hermes/agi/graph_builder.py."}],"details":{"diff":"      ...\n 1003             except Exception:\n 1004                 pass\n 1005         return count\n 1006 \n+1007     def parse_codex_modules(self, archive_dir: str) -> int:\n+1008         \"\"\"Parse archive/codex-layer-v1-modules/*.py for code architecture.\n+1009         \n+1010         Creates: codex_module, codex_class, codex_function nodes + defines/implements/imports edges.\n+1011         Bridges isolated code clusters with structural code architecture data.\n+1012         \"\"\"\n+1013         modules_dir = os.path.join(archive_dir, \"codex-layer-v1-modules\")\n+1014         if not os.path.isdir(modules_dir):\n+1015             return 0\n+1016 \n+1017         _RE_CLASS = re.compile(r'^class\\s+(\\w+)', re.MULTILINE)\n+1018         _RE_DEF = re.compile(r'^    def\\s+(\\w+)\\s*\\(', re.MULTILINE)\n+1019         _RE_IMPORT = re.compile(r'^from\\s+(\\w+)\\s+import', re.MULTILINE)\n+1020         _RE_PIPELINE = re.compile(r'Pipeline:\\s*(.+)', re.IGNORECASE)\n+1021         _RE_PHASE = re.compile(r'Phase\\s+([A-Z])\\.?\\s*of', re.IGNORECASE)\n+1022         _RE_FLAG = re.compile(r'FLAG-\\d+:', re.IGNORECASE)\n+1023 \n+1024         count = 0\n+1025         module_ids = {}  # filename_without_ext -> node_id\n+1026         class_ids = {}   # class_name -> node_id\n+1027         py_files = sorted([f for f in os.listdir(modules_dir) if f.endswith('.py')])\n+1028 \n+1029         # First pass: create module nodes\n+1030         for filename in py_files:\n+1031             filepath = os.path.join(modules_dir, filename)\n+1032             try:\n+1033                 with open(filepath, \"r\") as f:\n+1034                     content = f.read()\n+1035             except Exception:\n+1036                 continue\n+1037 \n+1038             module_name = filename[:-3]  # strip .py\n+1039             module_id = self.add_node(\n+1040                 \"codex_module\",\n+1041                 module_name,\n+1042                 content[:100].strip(),\n+1043                 f\"archive/codex-layer-v1-modules/{filename}\",\n+1044                 f\"codex_module_{module_name}\"\n+1045             )\n+1046             module_ids[module_name] = module_id\n+1047             count += 1\n+1048 \n+1049             # Extract classes and functions\n+1050             classes = _RE_CLASS.findall(content)\n+1051             for cls_name in classes:\n+1052                 if cls_name in ('Optional', 'List', 'Dict', 'Any', 'Tuple'):\n+1053                     continue  # typing-only classes\n+1054                 cls_id = self.add_node(\n+1055                     \"codex_class\",\n+1056                     cls_name,\n+1057                     f\"class in {module_name}\",\n+1058                     f\"archive/codex-layer-v1-modules/{filename}\",\n+1059                     f\"codex_class_{cls_name}\"\n+1060                 )\n+1061                 class_ids[cls_name] = cls_id\n+1062                 self.add_edge(module_id, cls_id, \"defines\")\n+1063                 count += 1\n+1064 \n+1065                 # Methods within class body\n+1066                 # Find class body boundaries\n+1067                 class_start = content.find(f'class {cls_name}')\n+1068                 if class_start < 0:\n+1069                     continue\n+1070                 # Find next class or top-level def\n+1071                 rest = content[class_start + len(f'class {cls_name}'):]\n+1072                 next_class = rest.find('\\nclass ')\n+1073                 next_def = rest.find('\\ndef ')\n+1074                 class_end = len(rest)\n+1075                 if next_class > 0:\n+1076                     class_end = min(class_end, next_class)\n+1077                 if next_def > 0:\n+1078                     class_end = min(class_end, next_def)\n+1079                 class_body = rest[:class_end]\n+1080                 methods = _RE_DEF.findall(class_body)\n+1081                 for method_name in methods:\n+1082                     if method_name.startswith('_') and method_name != '__init__':\n+1083                         continue  # skip private methods\n+1084                     method_id = self.add_node(\n+1085                         \"codex_method\",\n+1086                         f\"{cls_name}.{method_name}\",\n+1087                         f\"method in {cls_name}\",\n+1088                         f\"archive/codex-layer-v1-modules/{filename}\",\n+1089                         f\"codex_method_{cls_name}_{method_name}\"\n+1090                     )\n+1091                     self.add_edge(cls_id, method_id, \"implements\")\n+1092                     count += 1\n+1093 \n+1094             # Top-level functions (outside classes)\n+1095             lines = content.split('\\n')\n+1096             in_class = False\n+1097             for line in lines:\n+1098                 stripped = line.rstrip()\n+1099                 if stripped.startswith('class ') and _RE_CLASS.match(stripped):\n+1100                     in_class = True\n+1101                     continue\n+1102                 if stripped.startswith('class '):\n+1103                     in_class = False\n+1104                     continue\n+1105                 if stripped.startswith('def ') and not in_class:\n+1106                     m = re.match(r'def\\s+(\\w+)', stripped)\n+1107                     if m:\n+1108                         fn_id = self.add_node(\n+1109                             \"codex_function\",\n+1110                             m.group(1),\n+1111                             f\"function in {module_name}\",\n+1112                             f\"archive/codex-layer-v1-modules/{filename}\",\n+1113                             f\"codex_fn_{module_name}_{m.group(1)}\"\n+1114                         )\n+1115                         self.add_edge(module_id, fn_id, \"defines\")\n+1116                         count += 1\n+1117 \n+1118             # Import edges between modules\n+1119             imports = _RE_IMPORT.findall(content)\n+1120             for imported in imports:\n+1121                 if imported in module_ids and module_id != module_ids[imported]:\n+1122                     self.add_edge(module_id, module_ids[imported], \"imports\")\n+1123 \n+1124             # Phase/Pipeline metadata → links to related nodes\n+1125             pipeline_match = _RE_PIPELINE.search(content)\n+1126             if pipeline_match:\n+1127                 pipeline = pipeline_match.group(1).strip()\n+1128                 # Link module to related decisions/lessons via pipeline name\n+1129                 pipeline_key = pipeline.lower().replace(' ', '_').replace('-', '_')\n+1130                 related_id = f\"decision_{pipeline_key}\"\n+1131                 if related_id in self._node_ids:\n+1132                     self.add_edge(module_id, related_id, \"implements_pipeline\")\n+1133                     count += 1\n+1134 \n+1135         return count\n+1136 \n 1007     def build_adjacency(self):\n 1008         \"\"\"Build adjacency dict from edges.\"\"\"\n 1009         self.adj = defaultdict(list)\n 1010         for edge in self.edges:\n      ...","firstChangedLine":1007},"isError":false,"timestamp":1777537413508}}
{"type":"message","id":"630f85cb","parentId":"17eed12b","timestamp":"2026-04-30T08:23:37.764Z","message":{"role":"assistant","content":[{"type":"thinking","thinking":"Now I need to:1. Call the new parser from `_cached_build_builder`2. Increment `_cache_ver` to bust the stale cacheLet me find the exact location:","thinkingSignature":"aca0a797a53b17a8b6bc81b7b16724fa5da19081fef771ad8cd2ecf8901436a7"},{"type":"text","text":"Now call it from `_cached_build_builder` and increment the cache version:\n"},{"type":"toolCall","id":"call_function_3rf0w3fv3dpw_1","name":"read","arguments":{"path":"/home/ubuntu/.hermes/agi/graph_builder.py","offset":1300,"limit":15}}],"api":"anthropic-messages","provider":"minimax","model":"MiniMax-M2.7","usage":{"input":31662,"output":109,"cacheRead":10071,"cacheWrite":0,"totalTokens":41842,"cost":{"input":0.0094986,"output":0.00013079999999999998,"cacheRead":0.0006042599999999999,"cacheWrite":0,"total":0.01023366}},"stopReason":"toolUse","timestamp":1777537413509,"responseId":"06424485bbb6be1bb5f5857002131b32"}}
{"type":"message","id":"3a2bcdfe","parentId":"630f85cb","timestamp":"2026-04-30T08:23:37.765Z","message":{"role":"toolResult","toolCallId":"call_function_3rf0w3fv3dpw_1","toolName":"read","content":[{"type":"text","text":"    builder = GraphBuilder()\n\n    # Parse AGENTS.md\n    agents_md = os.path.join(hermes_dir, \"belam-codex\", \"AGENTS.md\")\n    builder.parse_agents_md(agents_md)\n\n    # Parse memory files (expanded to all 58)\n    memory_dir = os.path.join(hermes_dir, \"belam-codex\", \"memory\")\n    builder.parse_memory_files(memory_dir, limit=58)\n\n    # Parse schema files\n    schema_dir = os.path.join(hermes_dir, \"belam-codex\", \"schemas\")\n    builder.parse_schema_files(schema_dir)\n\n    # Parse decisions (all 128 files)\n\n[193 more lines in file. Use offset=1315 to continue.]"}],"isError":false,"timestamp":1777537417765}}
{"type":"message","id":"852c2afe","parentId":"3a2bcdfe","timestamp":"2026-04-30T08:23:41.631Z","message":{"role":"assistant","content":[{"type":"thinking","thinking":"Let me find the exact line where parse_archive_tasks is called and where _cache_ver is defined:","thinkingSignature":"c64d0c4fb6941a889afc16df7919205c6f08b8794f71cef0399c08ee31eb21fd"},{"type":"toolCall","id":"call_function_77b3vmueaeky_1","name":"bash","arguments":{"command":"grep -n \"parse_archive_tasks\\|parse_archive_commands\\|_cache_ver\" /home/ubuntu/.hermes/agi/graph_builder.py"}}],"api":"anthropic-messages","provider":"minimax","model":"MiniMax-M2.7","usage":{"input":31939,"output":72,"cacheRead":10071,"cacheWrite":0,"totalTokens":42082,"cost":{"input":0.0095817,"output":0.0000864,"cacheRead":0.0006042599999999999,"cacheWrite":0,"total":0.010272360000000001}},"stopReason":"toolUse","timestamp":1777537417766,"responseId":"0642448ae9543078adad91f731eafc51"}}
{"type":"message","id":"619163ef","parentId":"852c2afe","timestamp":"2026-04-30T08:23:41.641Z","message":{"role":"toolResult","toolCallId":"call_function_77b3vmueaeky_1","toolName":"bash","content":[{"type":"text","text":"825:    def parse_archive_commands(self, archive_dir: str) -> int:\n909:    def parse_archive_tasks(self, archive_dir: str) -> int:\n1290:def _cached_build_builder(hermes_dir: str, agi_dir: str, gitnexus_hash: int, _cache_ver: int = 1) -> GraphBuilder:\n1357:        builder.parse_archive_commands(archive_dir)\n1358:        builder.parse_archive_tasks(archive_dir)\n1396:    # Try lru_cache first (no pickle.load) — bump _cache_ver to bust cache after code/data changes\n1398:        builder = _cached_build_builder(hermes_dir, agi_dir, gitnexus_hash, _cache_ver=5)\n1471:        builder.parse_archive_commands(archive_dir)\n1472:        builder.parse_archive_tasks(archive_dir)\n"}],"isError":false,"timestamp":1777537421641}}
{"type":"message","id":"0481b27c","parentId":"619163ef","timestamp":"2026-04-30T08:23:48.988Z","message":{"role":"assistant","content":[{"type":"thinking","thinking":"Now I can see the exact locations. I need to:\n1. Add `builder.parse_codex_modules(archive_dir)` after line 1358\n2. Also add it after line 1472 (in the non-cached fallback path of build_graph)\n3. Increment `_cache_ver=5` → `_cache_ver=6`\n\nLet me make these edits:","thinkingSignature":"9f7ee022e06d5d0171a41098e819284e0db74fe25b60cba74b3a38d5c5e79e29"},{"type":"toolCall","id":"call_function_0fej0ihdxcry_1","name":"edit","arguments":{"path":"/home/ubuntu/.hermes/agi/graph_builder.py","edits":[{"oldText":"        builder.parse_archive_commands(archive_dir)\n        builder.parse_archive_tasks(archive_dir)\n\n    # Process gitnexus cache","newText":"        builder.parse_archive_commands(archive_dir)\n        builder.parse_archive_tasks(archive_dir)\n        builder.parse_codex_modules(archive_dir)\n\n    # Process gitnexus cache"},{"oldText":"        builder = _cached_build_builder(hermes_dir, agi_dir, gitnexus_hash, _cache_ver=5)","newText":"        builder = _cached_build_builder(hermes_dir, agi_dir, gitnexus_hash, _cache_ver=6)"},{"oldText":"        builder.parse_archive_commands(archive_dir)\n        builder.parse_archive_tasks(archive_dir)\n\n    # Process gitnexus cache\n    cache_to_use = None","newText":"        builder.parse_archive_commands(archive_dir)\n        builder.parse_archive_tasks(archive_dir)\n        builder.parse_codex_modules(archive_dir)\n\n    # Process gitnexus cache\n    cache_to_use = None"}]}}],"api":"anthropic-messages","provider":"minimax","model":"MiniMax-M2.7","usage":{"input":32205,"output":353,"cacheRead":10071,"cacheWrite":0,"totalTokens":42629,"cost":{"input":0.0096615,"output":0.0004236,"cacheRead":0.0006042599999999999,"cacheWrite":0,"total":0.01068936}},"stopReason":"toolUse","timestamp":1777537421643,"responseId":"0642448ef7193caa13517ca77f662538"}}
{"type":"message","id":"255aafb8","parentId":"0481b27c","timestamp":"2026-04-30T08:23:48.991Z","message":{"role":"toolResult","toolCallId":"call_function_0fej0ihdxcry_1","toolName":"edit","content":[{"type":"text","text":"Found 2 occurrences of edits[0] in /home/ubuntu/.hermes/agi/graph_builder.py. Each oldText must be unique. Please provide more context to make it unique."}],"details":{},"isError":true,"timestamp":1777537428991}}
