{"type":"message","id":"bc2769a0","parentId":"9eedbe85","timestamp":"2026-04-30T08:22:13.609Z","message":{"role":"assistant","content":[{"type":"thinking","thinking":"There IS an archive/codex-layer-v1-modules directory! Let me check what files are there.","thinkingSignature":"60c125fd33021aaa3bb5b4a8261c3005d5257b89a313c36b8e37842902ba5ba6"},{"type":"toolCall","id":"call_function_39gd19u1qyti_1","name":"bash","arguments":{"command":"find ~/.hermes/belam-codex/archive/codex-layer-v1-modules -type f | head -20"}},{"type":"toolCall","id":"call_function_39gd19u1qyti_2","name":"bash","arguments":{"command":"ls ~/.hermes/belam-codex/archive/codex-layer-v1-modules/"}}],"api":"anthropic-messages","provider":"minimax","model":"MiniMax-M2.7","usage":{"input":16956,"output":103,"cacheRead":10071,"cacheWrite":0,"totalTokens":27130,"cost":{"input":0.0050868,"output":0.0001236,"cacheRead":0.0006042599999999999,"cacheWrite":0,"total":0.005814659999999999}},"stopReason":"toolUse","timestamp":1777537330216,"responseId":"06424432d23fd44c83fb801a4c94a0bd"}}
{"type":"message","id":"d169dfb9","parentId":"bc2769a0","timestamp":"2026-04-30T08:22:13.623Z","message":{"role":"toolResult","toolCallId":"call_function_39gd19u1qyti_1","toolName":"bash","content":[{"type":"text","text":"/home/ubuntu/.hermes/belam-codex/archive/codex-layer-v1-modules/codex_interceptor.py\n/home/ubuntu/.hermes/belam-codex/archive/codex-layer-v1-modules/codex_dispatch.py\n/home/ubuntu/.hermes/belam-codex/archive/codex-layer-v1-modules/codex_output_codec.py\n"}],"isError":false,"timestamp":1777537333623}}
{"type":"message","id":"712f1e7b","parentId":"d169dfb9","timestamp":"2026-04-30T08:22:13.624Z","message":{"role":"toolResult","toolCallId":"call_function_39gd19u1qyti_2","toolName":"bash","content":[{"type":"text","text":"codex_dispatch.py\ncodex_interceptor.py\ncodex_output_codec.py\n"}],"isError":false,"timestamp":1777537333624}}
{"type":"message","id":"c91440c7","parentId":"712f1e7b","timestamp":"2026-04-30T08:22:18.730Z","message":{"role":"assistant","content":[{"type":"thinking","thinking":"There are 3 Python files in the archive/codex-layer-v1-modules directory. These contain the actual code structure of the codex system. I can parse these to add:\n- function nodes\n- class nodes\n- method nodes\n- imports/references between modules\n\nLet me look at one of these files to understand the structure:","thinkingSignature":"57218bd0ffe628931f9727f156f6d2c0a38ba2460e0d33461ce4c488533222f0"},{"type":"toolCall","id":"call_function_fh7r3n9jrsl6_1","name":"read","arguments":{"path":"/home/ubuntu/.hermes/belam-codex/archive/codex-layer-v1-modules/codex_dispatch.py"}},{"type":"toolCall","id":"call_function_fh7r3n9jrsl6_2","name":"bash","arguments":{"command":"wc -l ~/.hermes/belam-codex/archive/codex-layer-v1-modules/*.py"}}],"api":"anthropic-messages","provider":"minimax","model":"MiniMax-M2.7","usage":{"input":17164,"output":155,"cacheRead":10071,"cacheWrite":0,"totalTokens":27390,"cost":{"input":0.0051492,"output":0.000186,"cacheRead":0.0006042599999999999,"cacheWrite":0,"total":0.00593946}},"stopReason":"toolUse","timestamp":1777537333625,"responseId":"06424436f78ec7d2c597ba78378b522a"}}
{"type":"message","id":"271b75e6","parentId":"c91440c7","timestamp":"2026-04-30T08:22:18.741Z","message":{"role":"toolResult","toolCallId":"call_function_fh7r3n9jrsl6_1","toolName":"read","content":[{"type":"text","text":"\"\"\"Codex Dispatch — unified dispatch grammar for workspace interaction.\n\nPhase B of the Codex Layer. Routes all input through:\n  - Bare coords    → codex engine      (t5, e1t5, e0)\n  - Prefix .       → render verbs      (.d, .a, .v1)\n  - Prefix !       → shell passthrough (!git status)\n  - Pipe |>        → output chaining   (e0 |> _.p1)\n  - Prefix _       → result register   (_, _1, _.status)\n  - No prefix      → interceptor check (Phase C) then shell fallback\n\nFLAG-2 FIX: Uses |> for pipes (not ' > ') to avoid shell redirect collision.\n             ! prefix checked BEFORE pipe splitting to prevent misrouting.\n\nPipeline: build-codex-layer-v1\n\"\"\"\n\nfrom __future__ import annotations\n\nimport re\nimport subprocess\nfrom pathlib import Path\nfrom typing import Optional\n\nfrom codex_output_codec import CodexResult, ResultRegister, output_to_codex\n\n# Coordinate grammar regex (matches codex coordinate patterns)\nCOORD_RE = re.compile(r'^(md|mw|lm|[a-z])\\d*$', re.IGNORECASE)\n\n# Extended: match e{n}{coord} compounds (e1t6, e0p3) + bare coords (t5, lm3, d1-d5)\nEXTENDED_COORD_RE = re.compile(\n    r'^(?:e\\d+(?:(?:md|mw|[a-z])\\d*)?|(?:md|mw|lm|[a-z])\\d*(?:-(?:md|mw|lm|[a-z])?\\d+)?)$',\n    re.IGNORECASE,\n)\n\n# Render verb patterns\nRENDER_RE = re.compile(r'^\\.[a-z]')\n\n# Pipe operator (FLAG-2: |> not ' > ')\nPIPE_OP = '|>'\n\n\nclass CodexDispatcher:\n    \"\"\"Unified dispatch for all workspace interaction.\"\"\"\n\n    def __init__(self, workspace: Path):\n        self.workspace = workspace\n        self.register = ResultRegister(workspace)\n        self.interceptor = None  # set by Phase C\n\n    def dispatch(self, input_str: str) -> CodexResult:\n        \"\"\"Route input through the dispatch grammar.\n\n        Order (FLAG-2 fix: ! checked before pipes):\n        1. Shell passthrough: ! prefix (BEFORE pipe check)\n        2. Pipe chains: |> operator\n        3. Render verbs: . prefix\n        4. Result register: _ prefix\n        5. Coordinate resolution: matches coord grammar\n        6. Interceptor check (Phase C)\n        7. Fallback: execute as shell\n        \"\"\"\n        input_str = input_str.strip()\n        if not input_str:\n            return CodexResult(source='empty', rendered='(empty input)')\n\n        # 1. Shell passthrough — checked FIRST, before pipe splitting\n        #    This prevents !git log > file.txt from being misrouted\n        if input_str.startswith('!'):\n            return self._dispatch_shell(input_str[1:])\n\n        # 2. Pipe chains: split on |> and execute sequentially\n        if PIPE_OP in input_str:\n            return self._dispatch_pipe(input_str)\n\n        # 3. Render verbs: . prefix\n        if RENDER_RE.match(input_str):\n            return self._dispatch_render(input_str)\n\n        # 4. Result register: _ prefix\n        if input_str.startswith('_'):\n            return self._dispatch_register(input_str)\n\n        # 5. Coordinate resolution: matches coord grammar\n        first_token = input_str.split()[0]\n        if EXTENDED_COORD_RE.match(first_token):\n            return self._dispatch_coord(input_str)\n\n        # 6. Interceptor check (Phase C)\n        if self.interceptor:\n            redirect = self.interceptor.check(input_str)\n            if redirect:\n                return redirect\n\n        # 7. Fallback: shell execution\n        return self._dispatch_shell(input_str)\n\n    def _dispatch_pipe(self, input_str: str) -> CodexResult:\n        \"\"\"Chain commands via |> operator. Previous result available as _.\"\"\"\n        parts = [p.strip() for p in input_str.split(PIPE_OP)]\n        result = None\n        for part in parts:\n            if not part:\n                continue\n            # Substitute _ references from previous result\n            if result:\n                part = self._substitute_register_refs(part, result)\n            result = self.dispatch(part)\n            self.register.push(result)\n        return result or CodexResult(source='pipe', rendered='(empty pipe)')\n\n    def _dispatch_shell(self, command: str) -> CodexResult:\n        \"\"\"Execute shell command and run output through codec.\"\"\"\n        command = command.strip()\n        try:\n            proc = subprocess.run(\n                command, shell=True,\n                capture_output=True, text=True,\n                cwd=str(self.workspace),\n                timeout=30,\n            )\n            result = output_to_codex(command, proc.stdout, proc.stderr, proc.returncode)\n            if proc.returncode != 0 and proc.stderr:\n                result.rendered += f'\\n[exit {proc.returncode}] {proc.stderr[:200]}'\n            self.register.push(result)\n            return result\n        except subprocess.TimeoutExpired:\n            return CodexResult(\n                source=command, content_type='text',\n                rendered=f'[timeout after 30s] {command}',\n            )\n        except Exception as e:\n            return CodexResult(\n                source=command, content_type='text',\n                rendered=f'[error] {e}',\n            )\n\n    def _dispatch_render(self, input_str: str) -> CodexResult:\n        \"\"\"Route render verb to codex engine.\"\"\"\n        return self._dispatch_coord(input_str)\n\n    def _dispatch_register(self, input_str: str) -> CodexResult:\n        \"\"\"Resolve result register reference.\"\"\"\n        # Field access: _.status, _2.p1\n        if '.' in input_str:\n            val = self.register.resolve_field(input_str)\n            if val is not None:\n                return CodexResult(\n                    coord=input_str, source='register',\n                    content_type='text', fields={'value': val},\n                    rendered=val,\n                )\n        # Bare register: _, _1\n        result = self.register.resolve(input_str)\n        if result:\n            return result\n        return CodexResult(\n            source='register', content_type='text',\n            rendered=f'Register {input_str} is empty',\n        )\n\n    def _dispatch_coord(self, input_str: str) -> CodexResult:\n        \"\"\"Route coordinate to codex_engine.\"\"\"\n        try:\n            proc = subprocess.run(\n                ['python3', 'scripts/codex_engine.py'] + input_str.split(),\n                capture_output=True, text=True,\n                cwd=str(self.workspace),\n                timeout=10,\n            )\n            result = output_to_codex(\n                f'codex_engine.py {input_str}',\n                proc.stdout, proc.stderr, proc.returncode,\n            )\n            self.register.push(result)\n            return result\n        except Exception as e:\n            return CodexResult(\n                source=input_str, content_type='text',\n                rendered=f'[coord error] {e}',\n            )\n\n    def _substitute_register_refs(self, text: str, prev: CodexResult) -> str:\n        \"\"\"Replace _ references in text with values from previous result.\"\"\"\n        # _.field references\n        def replace_field(m):\n            field_name = m.group(1)\n            val = prev.fields.get(field_name, m.group(0))\n            return str(val)\n\n        text = re.sub(r'_\\.(\\w+)', replace_field, text)\n        # Bare _ → previous rendered output (first line)\n        # Only substitute standalone _ (not inside identifiers like _my_var)\n        if '_' in text and not re.search(r'_\\.\\w', text):\n            first_line = prev.rendered.split('\\n')[0] if prev.rendered else ''\n            text = re.sub(r'(?<!\\w)_(?!\\w)', first_line, text)\n        return text\n\n\n# ── CLI entry point ─────────────────────────────────────────────────────────\n\nif __name__ == '__main__':\n    import sys\n    workspace = Path(sys.argv[1]) if len(sys.argv) > 1 else Path.home() / '.openclaw' / 'workspace'\n    dispatcher = CodexDispatcher(workspace)\n\n    if len(sys.argv) > 2:\n        result = dispatcher.dispatch(' '.join(sys.argv[2:]))\n        print(result.rendered)\n    else:\n        print('Usage: codex_dispatch.py <workspace> <command>')\n        print('  e.g.: codex_dispatch.py /path/to/workspace \"t5\"')\n        print('  e.g.: codex_dispatch.py /path/to/workspace \"!git status\"')\n        print('  e.g.: codex_dispatch.py /path/to/workspace \"e0 |> _.p1\"')\n"}],"isError":false,"timestamp":1777537338740}}
{"type":"message","id":"ce9fe842","parentId":"271b75e6","timestamp":"2026-04-30T08:22:18.741Z","message":{"role":"toolResult","toolCallId":"call_function_fh7r3n9jrsl6_2","toolName":"bash","content":[{"type":"text","text":"  213 /home/ubuntu/.hermes/belam-codex/archive/codex-layer-v1-modules/codex_dispatch.py\n  214 /home/ubuntu/.hermes/belam-codex/archive/codex-layer-v1-modules/codex_interceptor.py\n  353 /home/ubuntu/.hermes/belam-codex/archive/codex-layer-v1-modules/codex_output_codec.py\n  780 total\n"}],"isError":false,"timestamp":1777537338741}}
{"type":"message","id":"313ce988","parentId":"ce9fe842","timestamp":"2026-04-30T08:22:28.275Z","message":{"role":"assistant","content":[{"type":"thinking","thinking":"There are 3 Python files with 780 lines total. These contain:\n- CodexDispatcher class\n- CodexInterceptor class\n- CodexResult, ResultRegister, output_to_codex functions\n\nI can parse these for:\n1. `codex_module` nodes — one per file\n2. `codex_class` nodes — CodexDispatcher, CodexInterceptor\n3. `codex_function` nodes — dispatch, _dispatch_shell, _dispatch_pipe, etc.\n4. `codex_import` edges — links between modules\n\nThis adds meaningful structural data about the codex system architecture. Let me look at the other two files briefly:","thinkingSignature":"7ec51d9dc08875e45cecf7ba0b2fc04d940ae1926f0e48b4ebe7bac2e94eb972"},{"type":"toolCall","id":"call_function_1bn932hbbtjm_1","name":"read","arguments":{"path":"/home/ubuntu/.hermes/belam-codex/archive/codex-layer-v1-modules/codex_interceptor.py"}},{"type":"toolCall","id":"call_function_1bn932hbbtjm_2","name":"read","arguments":{"path":"/home/ubuntu/.hermes/belam-codex/archive/codex-layer-v1-modules/codex_output_codec.py"}}],"api":"anthropic-messages","provider":"minimax","model":"MiniMax-M2.7","usage":{"input":19283,"output":220,"cacheRead":10071,"cacheWrite":0,"totalTokens":29574,"cost":{"input":0.0057849,"output":0.00026399999999999997,"cacheRead":0.0006042599999999999,"cacheWrite":0,"total":0.00665316}},"stopReason":"toolUse","timestamp":1777537338743,"responseId":"0642443bb65185d1f7529e4746bfe283"}}
