{"type":"session","version":3,"id":"019ddd48-838c-7349-ac79-f88e03a125bc","timestamp":"2026-04-30T07:26:50.252Z","cwd":"/home/ubuntu/.hermes/agi"}
{"type":"model_change","id":"26132404","parentId":null,"timestamp":"2026-04-30T07:26:54.326Z","provider":"minimax","modelId":"MiniMax-M2.7"}
{"type":"thinking_level_change","id":"6c737321","parentId":"26132404","timestamp":"2026-04-30T07:26:54.327Z","thinkingLevel":"medium"}
{"type":"custom","customType":"plannotator","data":{"phase":"idle","planFilePath":"PLAN.md","savedState":null},"id":"f6d082fa","parentId":"6c737321","timestamp":"2026-04-30T07:26:54.343Z"}
{"type":"message","id":"f9ad7132","parentId":"f6d082fa","timestamp":"2026-04-30T07:26:54.364Z","message":{"role":"user","content":[{"type":"text","text":"Resume the autoresearch loop in ~/.hermes/agi/.\n     Read ~/.hermes/agi/autoresearch.md (current state + what's been tried).\n     Run exactly ONE experiment iteration:\n       1. Make one code change (small, targeted)\n       2. git commit\n       3. run_experiment (./autoresearch.sh)\n       4. log_experiment (keep if improved, discard if not)\n     After log_experiment, stop — do NOT loop again.\n     Report iteration result in one line to stdout."}],"timestamp":1777534014349}}
{"type":"message","id":"de9e5fa3","parentId":"f9ad7132","timestamp":"2026-04-30T07:27:01.011Z","message":{"role":"assistant","content":[{"type":"thinking","thinking":"The user wants me to resume an autoresearch loop. Let me start by reading the current state and what's been tried.","thinkingSignature":"7d3eff8855545d26c71b00b247a58b51141e5dbee4af4d2e17451486540afc6a"},{"type":"toolCall","id":"call_function_ag6gw1s0ovmq_1","name":"read","arguments":{"path":"/home/ubuntu/.hermes/agi/autoresearch.md"}},{"type":"toolCall","id":"call_function_ag6gw1s0ovmq_2","name":"read","arguments":{"path":"/home/ubuntu/.hermes/agi/autoresearch.ideas.md"}},{"type":"toolCall","id":"call_function_ag6gw1s0ovmq_3","name":"read","arguments":{"path":"/home/ubuntu/.hermes/agi/autoresearch.jsonl"}}],"api":"anthropic-messages","provider":"minimax","model":"MiniMax-M2.7","usage":{"input":55,"output":127,"cacheRead":10071,"cacheWrite":113,"totalTokens":10366,"cost":{"input":0.000016499999999999998,"output":0.0001524,"cacheRead":0.0006042599999999999,"cacheWrite":0.000042375,"total":0.0008155349999999999}},"stopReason":"toolUse","timestamp":1777534014378,"responseId":"0642373f60f5375b04fc9ab6dc45f00c"}}
{"type":"message","id":"8b1bc86a","parentId":"de9e5fa3","timestamp":"2026-04-30T07:27:01.038Z","message":{"role":"toolResult","toolCallId":"call_function_ag6gw1s0ovmq_1","toolName":"read","content":[{"type":"text","text":"# Autoresearch: DB-Augmented Directed Code Generation via Unified Graph Memory\n\n## Objective\n\nInvestigate using relational databases (Postgres-style linking/reference) as the backbone for agent-accessible knowledge graphs. Goal: enable agents to navigate code, memory, tasks, and ideas through a single unified graph interface that is equally readable by humans (ASCII art maps) and machines (structured DB queries).\n\nCore inspiration repos:\n- **GitNexus** (abhigyanpatwari) — graph-based code intelligence\n- **MemPalace** (MemPalace/mempalace) — agent memory graph\n- **llm-wiki-compiler** (atomicmemory) — wiki-to-graph pipeline\n- **LanguageAgentTreeSearch** (lapisrocks) — LATS-style reasoning\n- **SkillZero** (ZJU-REAL) — skill learning from graphs\n- **pi /tree** — pi CLI tree/graph rendering\n\nCore questions to explore:\n1. Can agents perceive ASCII visual graphs as efficiently as humans?\n2. Can we steer agents on CoT/reasoning paths using nothing but graphical-rendered maps?\n3. Can a single graph representation span episodic memories, coding ideas, task state, and world models?\n4. Can the \"soul\" (model) feel seamlessly embodied by the \"memory harness\" (graph)?\n5. The **holographic layer coupling** — how do we bind multiple context layers into a single coherent agent experience?\n\n## Metrics\n- **Primary**: `graph_build_time_ms` (ms, lower is better) — time to generate a graph from source state\n- **Secondary**: `graph_node_count` (nodes), `graph_edge_count` (edges), `query_time_ms` (DB query for path finding), `ascii_render_lines` (output length of rendered graph), `agent_comprehension_score` (manual 1-5 assessment per run in ASI)\n\n## How to Run\n`./autoresearch.sh` — outputs `METRIC name=number` lines.\n\n## Files in Scope\n\nAll files created under `.hermes/agi/`:\n- `schema.sql` — Postgres schema for the unified graph (nodes, edges, types, metadata)\n- `graph_builder.py` — builds graph from source material (codebases, memory files, task state)\n- `asciirender.py` — renders graph as ASCII art for agent/human consumption\n- `query_engine.py` — path finding, traversal, CoT graph-walking\n- `pi_tree_adapter.py` — adapter to feed graph output into pi's /tree feature\n- `experiments/` — subdirectory per experiment run storing inputs/outputs\n- `autoresearch.sh` — benchmark driver\n\n## Off Limits\n\n- Do not modify pi's internal source code\n- Do not touch the GitNexus index directly outside of normal git operations\n- No new system dependencies — use only Python stdlib + psycopg2-binary\n\n## Constraints\n\n- All generated code must be valid Python (no pseudocode in final output)\n- ASCII graph output must be ≤200 lines and ≤200 chars wide\n- DB schema must be Postgres-compatible (duckdb fallback OK for local runs)\n- pi subagent calls must be non-blocking and report results through ASI\n\n## What's Been Tried\n\n### Iteration 1-4: Performance Optimizations\n- **Baseline**: 377.21ms (55 nodes, 54 edges)\n- Pre-compiled regex patterns (minor improvement)\n- Gitnexus availability check (skip npx call if no index)\n- Persistent JSON cache file for gitnexus results\n- Cache loading moved before timing\n- **Result**: 0.37ms (75 nodes) — 1019x faster\n\n### Iteration 5-6: Modular System\n- Created `schema.sql` — Postgres-compatible graph schema\n- Created `graph_builder.py` — modular graph construction\n- Created `query_engine.py` — BFS/Dijkstra path finding\n- Created `asciirender.py` — ASCII art rendering\n- Created `pi_tree_adapter.py` — pi /tree integration\n- **Result**: 2.15ms (225 nodes) — 3x more data, still 175x faster than original\n\n### Node Composition (current)\n- doc_section: 22 (from AGENTS.md)\n- code_reference: 27 (code snippets)\n- memory_session: 5 (episodic memories)\n- schema_entity: 10 (schema definitions)\n- schema_field: 142 (schema fields) ← restored\n- gitnexus_definition: 20 (code symbols)\n- **Total**: 225 nodes, 189 edges\n\n### Noise Floor Confirmed\n- Pickle load dominates: ~0.3-0.5ms regardless of optimization\n- Further micro-optimizations on pickle path unlikely to help\n- Shift to: richer data sources, query ops, or architectural changes (duckdb)\n\n### Files Created\n- `schema.sql` — Postgres/DuckDB graph schema\n- `graph_builder.py` — Modular graph builder (225 nodes)\n- `query_engine.py` — Path finding engine\n- `asciirender.py` — ASCII renderer\n- `pi_tree_adapter.py` — pi tree integration\n\n### Iteration 1 (this session): Restore graph richness + tuple verification\n- Restored 142 schema_field nodes (was accidentally removed in earlier optimization)\n- Extended gitnexus cache TTL 1hr → 24hr\n- Tuple nodes: 0.50ms→0.45ms at 225 nodes (10% faster, noise floor)\n- **Result**: 0.45ms (225 nodes, 189 edges) — **keep**\n\n### Baseline\n- Original: 377.21ms (55 nodes, 54 edges) — pure Python parsing\n- **Current best**: 0.45ms (225 nodes, 189 edges) — tuple nodes + pickle cache, 838x faster\n"}],"isError":false,"timestamp":1777534021038}}
{"type":"message","id":"0887ff92","parentId":"8b1bc86a","timestamp":"2026-04-30T07:27:01.038Z","message":{"role":"toolResult","toolCallId":"call_function_ag6gw1s0ovmq_2","toolName":"read","content":[{"type":"text","text":"# Autoresearch Ideas\n\n## Tried & Stale (NOT worth revisiting)\n- [x] Pre-compile regex in graph_builder module — done in iter 1-4\n- [x] Module-level pickle import — no effect (noise floor)\n- [x] __slots__ on GraphBuilder — no effect (pickle.load is the bottleneck)\n- [x] Add decisions/lessons parsers — 2.4x slower at 436 nodes (pickle scales with size)\n- [x] Persistent gitnexus JSON cache — done earlier\n- [x] Pre-warm pickle cache before timing — done, gives 0.50ms\n- [x] json instead of pickle — REGRESSION: 1.67ms vs 0.50ms\n- [x] Pre-build node index — no effect\n- [x] Skip adj from pickle cache — REGRESSION: 1.16ms vs 0.50ms\n- [x] Skip `_node_ids` reconstruction — noise floor\n- [x] Compact node representation (tuples) — 0.50ms→0.45ms at 225 nodes (10% faster). Noise floor ~0.3-0.5ms. DONE.\n- [x] msgpack instead of pickle — REGRESSION: 1.77ms vs 0.45ms. Pickle faster for Python tuples/lists.\n- [x] mmap for pickle load — no improvement: 0.46ms vs 0.45ms baseline. Overhead exceeds syscall savings for 8KB file.\n\n## Promising (not tried)\n- [ ] Incremental pickle updates via file watcher — delta patching vs full rebuild\n- [ ] duckdb backend — persistent graph DB, fast SQL queries, avoids pickle entirely\n\n## Data Source Expansion (secondary metric: node richness, ~225→400+ nodes)\n- [ ] Parse tasks/ directory for task state nodes\n- [ ] Parse state/ directory for runtime state nodes\n- [ ] Parse belam-codex decisions/ for decision nodes (limit to 10)\n- [ ] Parse belam-codex lessons/ for lesson nodes (limit to 10)\n\n## Query Optimizations (secondary metric: query_time_ms)\n- [ ] Bidirectional BFS — faster path finding for disconnected graphs\n- [ ] Pre-compute reachability matrix for common query pairs\n\n## Visualization\n- [ ] Add mermaid diagram output\n- [ ] Compact ASCII renderer (pack more nodes per line)\n\n## Interesting Findings\n- Gitnexus lbug file is NOT SQLite (despite .db-like header \"LBUG(\")\n- npx gitnexus call takes ~1.9s but is cacheable\n- **Noise floor confirmed**: ~0.3-0.5ms for pickle.load at 225 nodes\n- Pickle load time scales linearly with node count (~0.5ms/225 nodes = ~2.2µs/node)\n- 142 schema_field nodes were accidentally removed in earlier optimization; restored\n- gitnexus cache TTL was 1hr (too short); extended to 24hr\n\n## Deferred Ideas\n- Multi-repo graph building (belam-codex + machinelearning cross-ref)\n- Embeddings-based semantic search for graph queries\n- LLM-based graph summarization\n- pi /tree adapter integration for graph viz\n\n## Current Best\n- 0.45ms (225 nodes, 189 edges) — tuple nodes + pickle cache + schema_field nodes restored\n- 0.32ms (84 nodes) — shorter TTL, fewer nodes, NOT comparable\n- Original baseline: 377.21ms (55 nodes, 54 edges) — 838x faster\n"}],"isError":false,"timestamp":1777534021038}}
