{"type":"session","version":3,"id":"019ddd36-f207-727a-a724-ee6f7d7c64d2","timestamp":"2026-04-30T07:07:38.888Z","cwd":"/home/ubuntu/.hermes/agi"}
{"type":"model_change","id":"614a8313","parentId":null,"timestamp":"2026-04-30T07:07:42.935Z","provider":"minimax","modelId":"MiniMax-M2.7"}
{"type":"thinking_level_change","id":"8a4e32a4","parentId":"614a8313","timestamp":"2026-04-30T07:07:42.935Z","thinkingLevel":"medium"}
{"type":"custom","customType":"plannotator","data":{"phase":"idle","planFilePath":"PLAN.md","savedState":null},"id":"f92ba5db","parentId":"8a4e32a4","timestamp":"2026-04-30T07:07:42.957Z"}
{"type":"message","id":"cd2f4040","parentId":"f92ba5db","timestamp":"2026-04-30T07:07:42.981Z","message":{"role":"user","content":[{"type":"text","text":"Resume the autoresearch loop in ~/.hermes/agi/.\n     Read ~/.hermes/agi/autoresearch.md (current state + what's been tried).\n     Run exactly ONE experiment iteration:\n       1. Make one code change (small, targeted)\n       2. git commit\n       3. run_experiment (./autoresearch.sh)\n       4. log_experiment (keep if improved, discard if not)\n     After log_experiment, stop — do NOT loop again.\n     Report iteration result in one line to stdout."}],"timestamp":1777532862965}}
{"type":"message","id":"501e11c5","parentId":"cd2f4040","timestamp":"2026-04-30T07:07:47.724Z","message":{"role":"assistant","content":[{"type":"thinking","thinking":"Let me read the autoresearch state file to understand what's been tried and what the current state is.","thinkingSignature":"31d5846970fb8556db40ebb5e6c32faefb9b9186fdd3be04d2b8451cd283203c"},{"type":"toolCall","id":"call_function_f0cppo7ooz57_1","name":"read","arguments":{"path":"/home/ubuntu/.hermes/agi/autoresearch.md"}},{"type":"toolCall","id":"call_function_f0cppo7ooz57_2","name":"read","arguments":{"path":"/home/ubuntu/.hermes/agi/autoresearch.ideas.md"}}],"api":"anthropic-messages","provider":"minimax","model":"MiniMax-M2.7","usage":{"input":55,"output":91,"cacheRead":10071,"cacheWrite":113,"totalTokens":10330,"cost":{"input":0.000016499999999999998,"output":0.0001092,"cacheRead":0.0006042599999999999,"cacheWrite":0.000042375,"total":0.0007723349999999999}},"stopReason":"toolUse","timestamp":1777532862995,"responseId":"064232c1afd1e58cdfd1e12020aba83b"}}
{"type":"message","id":"f6967b38","parentId":"501e11c5","timestamp":"2026-04-30T07:07:47.752Z","message":{"role":"toolResult","toolCallId":"call_function_f0cppo7ooz57_1","toolName":"read","content":[{"type":"text","text":"# Autoresearch: DB-Augmented Directed Code Generation via Unified Graph Memory\n\n## Objective\n\nInvestigate using relational databases (Postgres-style linking/reference) as the backbone for agent-accessible knowledge graphs. Goal: enable agents to navigate code, memory, tasks, and ideas through a single unified graph interface that is equally readable by humans (ASCII art maps) and machines (structured DB queries).\n\nCore inspiration repos:\n- **GitNexus** (abhigyanpatwari) — graph-based code intelligence\n- **MemPalace** (MemPalace/mempalace) — agent memory graph\n- **llm-wiki-compiler** (atomicmemory) — wiki-to-graph pipeline\n- **LanguageAgentTreeSearch** (lapisrocks) — LATS-style reasoning\n- **SkillZero** (ZJU-REAL) — skill learning from graphs\n- **pi /tree** — pi CLI tree/graph rendering\n\nCore questions to explore:\n1. Can agents perceive ASCII visual graphs as efficiently as humans?\n2. Can we steer agents on CoT/reasoning paths using nothing but graphical-rendered maps?\n3. Can a single graph representation span episodic memories, coding ideas, task state, and world models?\n4. Can the \"soul\" (model) feel seamlessly embodied by the \"memory harness\" (graph)?\n5. The **holographic layer coupling** — how do we bind multiple context layers into a single coherent agent experience?\n\n## Metrics\n- **Primary**: `graph_build_time_ms` (ms, lower is better) — time to generate a graph from source state\n- **Secondary**: `graph_node_count` (nodes), `graph_edge_count` (edges), `query_time_ms` (DB query for path finding), `ascii_render_lines` (output length of rendered graph), `agent_comprehension_score` (manual 1-5 assessment per run in ASI)\n\n## How to Run\n`./autoresearch.sh` — outputs `METRIC name=number` lines.\n\n## Files in Scope\n\nAll files created under `.hermes/agi/`:\n- `schema.sql` — Postgres schema for the unified graph (nodes, edges, types, metadata)\n- `graph_builder.py` — builds graph from source material (codebases, memory files, task state)\n- `asciirender.py` — renders graph as ASCII art for agent/human consumption\n- `query_engine.py` — path finding, traversal, CoT graph-walking\n- `pi_tree_adapter.py` — adapter to feed graph output into pi's /tree feature\n- `experiments/` — subdirectory per experiment run storing inputs/outputs\n- `autoresearch.sh` — benchmark driver\n\n## Off Limits\n\n- Do not modify pi's internal source code\n- Do not touch the GitNexus index directly outside of normal git operations\n- No new system dependencies — use only Python stdlib + psycopg2-binary\n\n## Constraints\n\n- All generated code must be valid Python (no pseudocode in final output)\n- ASCII graph output must be ≤200 lines and ≤200 chars wide\n- DB schema must be Postgres-compatible (duckdb fallback OK for local runs)\n- pi subagent calls must be non-blocking and report results through ASI\n\n## What's Been Tried\n\n### Iteration 1-4: Performance Optimizations\n- **Baseline**: 377.21ms (55 nodes, 54 edges)\n- Pre-compiled regex patterns (minor improvement)\n- Gitnexus availability check (skip npx call if no index)\n- Persistent JSON cache file for gitnexus results\n- Cache loading moved before timing\n- **Result**: 0.37ms (75 nodes) — 1019x faster\n\n### Iteration 5-6: Modular System\n- Created `schema.sql` — Postgres-compatible graph schema\n- Created `graph_builder.py` — modular graph construction\n- Created `query_engine.py` — BFS/Dijkstra path finding\n- Created `asciirender.py` — ASCII art rendering\n- Created `pi_tree_adapter.py` — pi /tree integration\n- **Result**: 2.15ms (225 nodes) — 3x more data, still 175x faster than original\n\n### Node Composition (current)\n- doc_section: 22 (from AGENTS.md)\n- code_reference: 27 (code snippets)\n- memory_session: 5 (episodic memories)\n- schema_entity: 10 (schema definitions)\n- schema_field: 141 (schema fields)\n- gitnexus_definition: 20 (code symbols)\n\n### Files Created\n- `schema.sql` — Postgres/DuckDB graph schema\n- `graph_builder.py` — Modular graph builder (225 nodes)\n- `query_engine.py` — Path finding engine\n- `asciirender.py` — ASCII renderer\n- `pi_tree_adapter.py` — pi tree integration\n"}],"isError":false,"timestamp":1777532867751}}
{"type":"message","id":"2ec46ebd","parentId":"f6967b38","timestamp":"2026-04-30T07:07:47.752Z","message":{"role":"toolResult","toolCallId":"call_function_f0cppo7ooz57_2","toolName":"read","content":[{"type":"text","text":"# Autoresearch Ideas\n\n## Tried & Stale (NOT worth revisiting)\n- [x] Pre-compile regex in graph_builder module — done in iter 1-4\n- [x] Module-level pickle import — no effect (noise floor)\n- [x] __slots__ on GraphBuilder — no effect (pickle.load is the bottleneck)\n- [x] Add decisions/lessons parsers — 2.4x slower at 436 nodes (pickle scales with size)\n- [x] Persistent gitnexus JSON cache — done earlier\n- [x] Pre-warm pickle cache before timing — done, gives 0.50ms\n\n## Promising (not tried)\n- [x] Use `json` module instead of `pickle` for cache — REGRESSION: 1.67ms vs 0.50ms (tuple↔list conversion + json parsing dominates)\n- [x] Pre-build node index — no effect (get_stats called after timing, not in hot path)\n- [x] Skip adj from pickle cache — REGRESSION: 1.16ms vs 0.50ms (adj rebuild cost > pickle size savings)\n- [x] Skip `_node_ids` reconstruction on cache load — already microseconds, noise floor\n- [ ] Compact node representation — use tuples instead of dicts for nodes (smaller pickle, faster load)\n- [ ] Incremental updates via file watcher — update pickle delta instead of full rebuild (would need cache invalidation strategy)\n\n## Data Source Expansion (secondary metric: node richness)\n- [ ] Parse tasks/ directory for task state nodes\n- [ ] Parse state/ directory for runtime state nodes\n- [ ] Parse pi-agi.log for session activity patterns\n\n## Query Optimizations (secondary metric: query_time_ms)\n- [ ] Bidirectional BFS — faster path finding for disconnected graphs\n- [ ] Pre-compute reachability matrix for common query pairs\n\n## Visualization\n- [ ] Add graphviz DOT output\n- [ ] Add mermaid diagram output\n- [ ] Compact ASCII renderer (pack more nodes per line)\n\n## Interesting Findings\n- Gitnexus lbug file is NOT SQLite (despite .db-like header \"LBUG(\")\n- npx gitnexus call takes ~1.9s but is cacheable\n- 0.50ms = noise floor for pickle-based caching with current data (225 nodes)\n- Pickle load time scales linearly with node count (~0.5ms/225 nodes = ~2.2µs per node)\n\n## Deferred Ideas\n- Multi-repo graph building (cross-reference belam-codex + machinelearning)\n- Embeddings-based semantic search for graph queries\n- LLM-based graph summarization\n- duckdb backend for persistent graph storage\n\n## Baseline\n- Original: 377.21ms (55 nodes, 54 edges) — pure Python parsing\n- Best optimized: 0.50ms (225 nodes) — pickle cache hit, 754x faster\n"}],"isError":false,"timestamp":1777532867752}}
{"type":"message","id":"2cd17bc2","parentId":"2ec46ebd","timestamp":"2026-04-30T07:07:54.914Z","message":{"role":"assistant","content":[{"type":"thinking","thinking":"Let me understand the current state:\n\n1. **Primary metric**: `graph_build_time_ms` — currently at 0.50ms (best) with 225 nodes\n2. **Baseline**: 377.21ms with 55 nodes\n3. **Speedup**: 754x faster than original\n\nThe ideas backlog mentions:\n- **Compact node representation** — use tuples instead of dicts for nodes (smaller pickle, faster load) — NOT TRIED YET\n- Various other ideas\n\nLet me check the current code to see what can be optimized. The best result is 0.50ms which is at the \"noise floor\" according to the doc. But there might be room to squeeze more out.\n\n\nI'm looking at the graph_builder.py file to understand how nodes are currently structured and where tuple-based representations could reduce the pickle overhead.","thinkingSignature":"f4e51f5f763bc37a7e977f9f7ff6e825612a3e1db4f0b79686dab0b87e3e965f"},{"type":"toolCall","id":"call_function_6nc1j0qr0qse_1","name":"read","arguments":{"path":"/home/ubuntu/.hermes/agi/graph_builder.py"}},{"type":"toolCall","id":"call_function_6nc1j0qr0qse_2","name":"read","arguments":{"path":"/home/ubuntu/.hermes/agi/autoresearch.sh"}}],"api":"anthropic-messages","provider":"minimax","model":"MiniMax-M2.7","usage":{"input":1898,"output":241,"cacheRead":10071,"cacheWrite":0,"totalTokens":12210,"cost":{"input":0.0005694,"output":0.0002892,"cacheRead":0.0006042599999999999,"cacheWrite":0,"total":0.0014628599999999999}},"stopReason":"toolUse","timestamp":1777532867753,"responseId":"064232c4328034a45aa52e3c91dc0f45"}}
