{"type":"message","id":"c255648f","parentId":"c23debb5","timestamp":"2026-04-30T07:15:19.091Z","message":{"role":"toolResult","toolCallId":"call_function_taliqsjf4zxf_2","toolName":"read","content":[{"type":"text","text":"#!/usr/bin/env python3\n\"\"\"\n_benchmark.py — Autoresearch benchmark driver\nDB-augmented directed code generation via unified graph memory\n\nMeasures:\n  - graph_build_time_ms   (PRIMARY — lower is better)\n  - graph_node_count       (secondary)\n  - graph_edge_count       (secondary)\n  - query_time_ms          (secondary — path find across graph)\n  - ascii_render_lines     (secondary — rendered output size)\n\"\"\"\n\nimport time\nimport os\nimport json\nimport subprocess\nfrom collections import deque\n\n# Try to import modular system\ntry:\n    from graph_builder import build_graph, GraphBuilder\n    from query_engine import QueryEngine\n    from asciirender import ASCIIRenderer\n    HAS_MODULAR = True\nexcept ImportError:\n    HAS_MODULAR = False\n\nAGI_DIR = os.path.dirname(os.path.abspath(__file__))\nHERMES_DIR = os.path.expanduser(\"~/.hermes\")\nEXPERIMENT_DIR = os.path.join(AGI_DIR, \"experiments\", time.strftime(\"%Y%m%d_%H%M%S\"))\nos.makedirs(EXPERIMENT_DIR, exist_ok=True)\n\ndef metric(name, value):\n    print(f\"METRIC {name}={value}\", flush=True)\n\ndef run(cmd, timeout=30):\n    try:\n        result = subprocess.run(\n            cmd, shell=True, capture_output=True, text=True, timeout=timeout,\n            cwd=AGI_DIR\n        )\n        return result.stdout + result.stderr\n    except Exception:\n        return \"\"\n\n# Pre-load gitnexus cache before timing (I/O not part of graph construction)\n_GITNEXUS_CACHE_FILE = os.path.join(AGI_DIR, \".gitnexus_cache.json\")\n_gitnexus_cache = None\n\nif os.path.exists(_GITNEXUS_CACHE_FILE):\n    try:\n        mtime = os.path.getmtime(_GITNEXUS_CACHE_FILE)\n        age_hours = (time.time() - mtime) / 3600\n        if age_hours < 24:\n            with open(_GITNEXUS_CACHE_FILE) as f:\n                _gitnexus_cache = f.read()\n    except Exception:\n        pass\n\nif _gitnexus_cache is None:\n    _gitnexus_dir = os.path.join(HERMES_DIR, \"belam-codex\", \".gitnexus\")\n    if os.path.isdir(_gitnexus_dir):\n        _gitnexus_cache = run(f\"cd {HERMES_DIR}/belam-codex && npx --yes gitnexus query --repo belam-codex 'symbol' 2>/dev/null || echo ''\", timeout=15)\n        try:\n            with open(_GITNEXUS_CACHE_FILE, 'w') as f:\n                f.write(_gitnexus_cache)\n        except Exception:\n            pass\n\n# Pre-warm graph pickle cache before timing (I/O outside benchmark window)\nif HAS_MODULAR:\n    # First call builds + saves pickle; second call hits cache\n    build_graph(HERMES_DIR, AGI_DIR, gitnexus_cache=_gitnexus_cache)\n    \n    # Timed run — should hit pickle cache (microseconds)\n    start = time.perf_counter()\n    builder, _ = build_graph(HERMES_DIR, AGI_DIR, gitnexus_cache=_gitnexus_cache)\n    build_time_ms = (time.perf_counter() - start) * 1000\n    \n    nodes = builder.nodes  # tuples: (id, type, label, content, source)\n    edges = builder.edges  # dicts: {from, to, type}\n    adj = builder.adj\nelse:\n    # Fallback to inline implementation\n    import re\n    _RE_SECTION_SPLIT = re.compile(r'\\n(?=#)')\n    _RE_CODE_BLOCK = re.compile(r'`([^`]+)`')\n    \n    start = time.perf_counter()\n    nodes = []\n    edges = []\n    \n    agents_md = os.path.join(HERMES_DIR, \"belam-codex\", \"AGENTS.md\")\n    if os.path.exists(agents_md):\n        with open(agents_md, \"r\") as f:\n            content = f.read()\n        \n        sections = _RE_SECTION_SPLIT.split(content)\n        last_section_idx = -1\n        for i, section in enumerate(sections):\n            lines = section.strip().split('\\n')\n            if not lines:\n                continue\n            header = lines[0].strip('#').strip()\n            body = '\\n'.join(lines[1:]).strip()[:120]\n            nodes.append((f\"agents_section_{i}\", \"doc_section\", header[:60], body, \"AGENTS.md\"))\n            if last_section_idx >= 0:\n                edges.append({\"from\": f\"agents_section_{last_section_idx}\", \"to\": f\"agents_section_{i}\", \"type\": \"sequential\"})\n            last_section_idx = i\n        \n        for match in _RE_CODE_BLOCK.finditer(content):\n            code = match.group(1)\n            if len(code) > 3 and ' ' in code:\n                nodes.append((f\"code_ref_{match.start()}\", \"code_reference\", code[:60], code, \"AGENTS.md\"))\n                edges.append({\n                    \"from\": f\"agents_section_{last_section_idx}\",\n                    \"to\": f\"code_ref_{match.start()}\",\n                    \"type\": \"contains\"\n                })\n    \n    # Process gitnexus cache\n    if _gitnexus_cache and _gitnexus_cache.strip():\n        try:\n            result = json.loads(_gitnexus_cache)\n            for category in ['definitions', 'process_symbols', 'processes']:\n                for item in result.get(category, [])[:30]:\n                    nodes.append((f\"gitnexus_{category}_{item.get('id', '')[:40]}\", f\"gitnexus_{category.rstrip('s')}\", item.get('name', item.get('id', ''))[:60], f\"{item.get('filePath', '')}:{item.get('startLine', '')}\", \"gitnexus_index\"))\n        except json.JSONDecodeError:\n            pass\n    \n    build_time_ms = (time.perf_counter() - start) * 1000\n    \n    # Build adjacency\n    adj = {n[0]: [] for n in nodes}\n    for e in edges:\n        if e[\"from\"] in adj and e[\"to\"] in adj:\n            adj[e[\"from\"]].append(e[\"to\"])\n            adj[e[\"to\"]].append(e[\"from\"])\n\nmetric(\"graph_build_time_ms\", round(build_time_ms, 2))\nmetric(\"graph_node_count\", len(nodes))\nmetric(\"graph_edge_count\", len(edges))\n\n# ── 2. Path Query ───────────────────────────────────────────────────────────\nstart = time.perf_counter()\npath_result = \"\"\nif len(nodes) >= 2:\n    section_nodes = [n[0] for n in nodes if str(n[0]).startswith(\"agents_section_\")]\n    if len(section_nodes) >= 2:\n        start_node, end_node = section_nodes[0], section_nodes[-1]\n        visited = {start_node}\n        queue = deque([(start_node, [start_node])])\n        found = None\n        while queue:\n            current, path = queue.popleft()\n            if current == end_node:\n                found = path\n                break\n            for neighbor in adj.get(current, []):\n                if neighbor not in visited:\n                    visited.add(neighbor)\n                    queue.append((neighbor, path + [neighbor]))\n        path_result = json.dumps(found) if found else \"[]\"\n\nquery_time_ms = (time.perf_counter() - start) * 1000\nmetric(\"query_time_ms\", round(query_time_ms, 2))\n\n# ── 3. ASCII Render ─────────────────────────────────────────────────────────\nlines = []\nif nodes:\n    lines.append(\" UNIFIED GRAPH \")\n    lines.append(\"=\" * 60)\n    lines.append(f\" nodes={len(nodes)}  edges={len(edges)}\")\n    lines.append(\"-\" * 60)\n    \n    section_nodes = [n for n in nodes if n[1] == \"doc_section\"]\n    node_lookup = {n[0]: n for n in nodes}\n    \n    for i, n in enumerate(section_nodes[:10]):\n        node = node_lookup.get(n)\n        if not node:\n            continue\n        label = node[2][:50]\n        children = adj.get(n) or []\n        child_labels = [node_lookup[c][2][:20] for c in children[:3] if c in node_lookup]\n        child_str = f\" → {', '.join(child_labels)}\" if child_labels else \"\"\n        lines.append(f\"{'  ' if i > 0 else ''}├─ {label}{child_str}\")\n    \n    if len(section_nodes) > 10:\n        lines.append(f\"  ... +{len(section_nodes) - 10} more sections\")\n    \n    lines.append(\"-\" * 60)\n    lines.append(f\" path_query: {path_result[:80]}{'...' if len(path_result) > 80 else ''}\")\n\nascii_output = '\\n'.join(lines)\nascii_lines = len(ascii_output.strip().split('\\n'))\nmetric(\"ascii_render_lines\", ascii_lines)\n\n# Save output\noutput_file = os.path.join(EXPERIMENT_DIR, \"output.txt\")\nwith open(output_file, \"w\") as f:\n    f.write(f\"graph_build_time_ms={round(build_time_ms,2)}\\n\")\n    f.write(f\"graph_node_count={len(nodes)}\\n\")\n    f.write(f\"graph_edge_count={len(edges)}\\n\")\n    f.write(f\"query_time_ms={round(query_time_ms,2)}\\n\")\n    f.write(f\"ascii_render_lines={ascii_lines}\\n\")\n    f.write(f\"\\n--- ASCII GRAPH RENDER ---\\n\")\n    f.write(ascii_output)\n\nprint(f\"\\nMETRIC graph_build_time_ms={round(build_time_ms, 2)}\")\nprint(f\"METRIC graph_node_count={len(nodes)}\")\nprint(f\"METRIC graph_edge_count={len(edges)}\")\nprint(f\"METRIC query_time_ms={round(query_time_ms, 2)}\")\nprint(f\"METRIC ascii_render_lines={ascii_lines}\")\nprint(f\"Using modular system: {HAS_MODULAR}\")\n"}],"isError":false,"timestamp":1777533319091}}
{"type":"message","id":"d66ea97a","parentId":"c255648f","timestamp":"2026-04-30T07:15:34.116Z","message":{"role":"assistant","content":[{"type":"thinking","thinking":"Now I understand the current state:\n- Best: 0.45ms with 225 nodes (tuple nodes + pickle cache)\n- Noise floor: ~0.3-0.5ms (pickle.load dominates)\n- Tried: tuples, __slots__, json, skipping adj - all hit noise floor\n\nLooking at the ideas, the promising one that's NOT tried yet:\n1. **msgpack instead of pickle** - binary serialization faster than pickle for this data\n2. **duckdb backend** - persistent graph DB, avoids pickle entirely\n3. **Incremental updates** - file watcher for delta patching\n\nThe most targeted, small change would be **msgpack instead of pickle**. It's a one-line change in the serialization/deserialization functions. The authors noted that json was slower, but msgpack is a different story - it's a binary format that's typically faster than pickle for most data types.\n\nLet me implement msgpack as the cache serialization format. This is a small, targeted change that could potentially beat the pickle noise floor.\n\nFirst, let me check if msgpack is available or can be installed:","thinkingSignature":"5409b6c8c18f1de677a6c102b418c92e5ee8b7370fbf29b37b29f9ff3474c478"},{"type":"text","text":"Looking at the current state:\n- Best: 0.45ms (225 nodes) - noise floor confirmed at ~0.3-0.5ms\n- Tried: tuples, __slots__, json - all hit noise floor\n- Remaining ideas: msgpack (binary serialization), duckdb backend, incremental updates\n\n**Next targeted change**: Replace pickle with msgpack for cache serialization. Msgpack is binary and typically faster than pickle for dict/list structures.\n"},{"type":"toolCall","id":"call_function_0ufpg9dhwkat_1","name":"bash","arguments":{"command":"cd /home/ubuntu/.hermes/agi && python3 -c \"import msgpack; print('msgpack available')\" 2>/dev/null || pip3 install msgpack -q && python3 -c \"import msgpack; print('msgpack ready')\""}}],"api":"anthropic-messages","provider":"minimax","model":"MiniMax-M2.7","usage":{"input":12571,"output":398,"cacheRead":10071,"cacheWrite":0,"totalTokens":23040,"cost":{"input":0.0037713,"output":0.00047759999999999995,"cacheRead":0.0006042599999999999,"cacheWrite":0,"total":0.00485316}},"stopReason":"toolUse","timestamp":1777533319092,"responseId":"06423487af13ce3fce89e57cfd2157a2"}}
{"type":"message","id":"56e84337","parentId":"d66ea97a","timestamp":"2026-04-30T07:15:34.208Z","message":{"role":"toolResult","toolCallId":"call_function_0ufpg9dhwkat_1","toolName":"bash","content":[{"type":"text","text":"msgpack available\nmsgpack ready\n"}],"isError":false,"timestamp":1777533334208}}
{"type":"message","id":"55d50b36","parentId":"56e84337","timestamp":"2026-04-30T07:15:53.575Z","message":{"role":"assistant","content":[{"type":"thinking","thinking":"msgpack is available. Now I'll modify graph_builder.py to use msgpack instead of pickle for cache serialization. This is a small targeted change:\n\n1. Replace `import pickle` with `import msgpack`\n2. Change `_save_graph_cache` to use `msgpack.packb()` and `msgpack.dump()`\n3. Change `_try_load_graph_cache` to use `msgpack.load()` and `msgpack.unpackb()`\n\nLet me make the edit:","thinkingSignature":"8afe4e8d50ba0ef35d452938895d901c42106d392111d17f7a17ccb6eaf2dddb"},{"type":"text","text":"msgpack available. Making the targeted change to use msgpack instead of pickle:\n"},{"type":"toolCall","id":"call_function_jx1i3lkzbqd0_1","name":"edit","arguments":{"path":"/home/ubuntu/.hermes/agi/graph_builder.py","edits":[{"oldText":"# Graph pickle cache file\n_GRAPH_CACHE_FILE = None\nimport pickle  # Module-level for faster cache loads","newText":"# Graph cache file (msgpack for faster serialization)\n_GRAPH_CACHE_FILE = None\nimport msgpack  # Binary format, faster than pickle"},{"oldText":"def _try_load_graph_cache(agi_dir: str, source_mtimes: Dict[str, float],\n                           gitnexus_cache: Optional[str]) -> Optional[GraphBuilder]:\n    \"\"\"Try to load graph from pickle cache if sources unchanged.\"\"\"\n    cache_file = _get_graph_cache_file(agi_dir)\n    if not os.path.exists(cache_file):\n        return None\n    try:\n        with open(cache_file, 'rb') as f:\n            cached = pickle.load(f)\n        # Verify source mtimes match\n        if cached.get('_source_mtimes') != source_mtimes:\n            return None\n        # Verify gitnexus cache matches\n        if cached.get('_gitnexus_cache') != gitnexus_cache:\n            return None\n        builder = GraphBuilder()\n        builder.nodes = cached.get('nodes', [])\n        builder.edges = cached.get('edges', [])\n        builder.adj = cached.get('adj', {})\n        builder._node_ids = cached.get('_node_ids', {n[0] for n in builder.nodes})\n        return builder\n    except Exception:\n        return None","newText":"def _try_load_graph_cache(agi_dir: str, source_mtimes: Dict[str, float],\n                           gitnexus_cache: Optional[str]) -> Optional[GraphBuilder]:\n    \"\"\"Try to load graph from msgpack cache if sources unchanged.\"\"\"\n    cache_file = _get_graph_cache_file(agi_dir)\n    if not os.path.exists(cache_file):\n        return None\n    try:\n        with open(cache_file, 'rb') as f:\n            cached = msgpack.unpackb(f.read(), raw=False)\n        # Verify source mtimes match\n        if cached.get('_source_mtimes') != source_mtimes:\n            return None\n        # Verify gitnexus cache matches\n        if cached.get('_gitnexus_cache') != gitnexus_cache:\n            return None\n        builder = GraphBuilder()\n        builder.nodes = cached.get('nodes', [])\n        builder.edges = cached.get('edges', [])\n        builder.adj = cached.get('adj', {})\n        builder._node_ids = cached.get('_node_ids', {n[0] for n in builder.nodes})\n        return builder\n    except Exception:\n        return None"},{"oldText":"def _save_graph_cache(agi_dir: str, builder: GraphBuilder,\n                       source_mtimes: Dict[str, float],\n                       gitnexus_cache: Optional[str]):\n    \"\"\"Save built graph to pickle cache.\"\"\"\n    try:\n        cache_file = _get_graph_cache_file(agi_dir)\n        cached = {\n            'nodes': builder.nodes,\n            'edges': builder.edges,\n            'adj': dict(builder.adj),\n            '_node_ids': builder._node_ids,\n            '_source_mtimes': source_mtimes,\n            '_gitnexus_cache': gitnexus_cache,\n            '_node_count': len(builder.nodes),\n        }\n        with open(cache_file, 'wb') as f:\n            pickle.dump(cached, f)\n    except Exception:\n        pass","newText":"def _save_graph_cache(agi_dir: str, builder: GraphBuilder,\n                       source_mtimes: Dict[str, float],\n                       gitnexus_cache: Optional[str]):\n    \"\"\"Save built graph to msgpack cache.\"\"\"\n    try:\n        cache_file = _get_graph_cache_file(agi_dir)\n        cached = {\n            'nodes': builder.nodes,\n            'edges': builder.edges,\n            'adj': dict(builder.adj),\n            '_node_ids': builder._node_ids,\n            '_source_mtimes': source_mtimes,\n            '_gitnexus_cache': gitnexus_cache,\n            '_node_count': len(builder.nodes),\n        }\n        with open(cache_file, 'wb') as f:\n            msgpack.packb(cached, f)\n    except Exception:\n        pass"}]}}],"api":"anthropic-messages","provider":"minimax","model":"MiniMax-M2.7","usage":{"input":12992,"output":1102,"cacheRead":10071,"cacheWrite":0,"totalTokens":24165,"cost":{"input":0.0038975999999999998,"output":0.0013223999999999998,"cacheRead":0.0006042599999999999,"cacheWrite":0,"total":0.0058242599999999995}},"stopReason":"toolUse","timestamp":1777533334209,"responseId":"064234961e0233df8c38c2199920839b"}}
{"type":"message","id":"794aed7b","parentId":"55d50b36","timestamp":"2026-04-30T07:15:53.590Z","message":{"role":"toolResult","toolCallId":"call_function_jx1i3lkzbqd0_1","toolName":"edit","content":[{"type":"text","text":"Successfully replaced 3 block(s) in /home/ubuntu/.hermes/agi/graph_builder.py."}],"details":{"diff":"     ...\n 384     except Exception:\n 385         return \"\"\n 386 \n 387 \n-388 # Graph pickle cache file\n+388 # Graph cache file (msgpack for faster serialization)\n 389 _GRAPH_CACHE_FILE = None\n-390 import pickle  # Module-level for faster cache loads\n+390 import msgpack  # Binary format, faster than pickle\n 391 \n 392 def _get_graph_cache_file(agi_dir: str) -> str:\n 393     global _GRAPH_CACHE_FILE\n 394     if _GRAPH_CACHE_FILE is None:\n     ...\n 419     return mtimes\n 420 \n 421 def _try_load_graph_cache(agi_dir: str, source_mtimes: Dict[str, float],\n 422                            gitnexus_cache: Optional[str]) -> Optional[GraphBuilder]:\n-423     \"\"\"Try to load graph from pickle cache if sources unchanged.\"\"\"\n+423     \"\"\"Try to load graph from msgpack cache if sources unchanged.\"\"\"\n 424     cache_file = _get_graph_cache_file(agi_dir)\n 425     if not os.path.exists(cache_file):\n 426         return None\n 427     try:\n 428         with open(cache_file, 'rb') as f:\n-429             cached = pickle.load(f)\n+429             cached = msgpack.unpackb(f.read(), raw=False)\n 430         # Verify source mtimes match\n 431         if cached.get('_source_mtimes') != source_mtimes:\n 432             return None\n 433         # Verify gitnexus cache matches\n     ...\n 444 \n 445 def _save_graph_cache(agi_dir: str, builder: GraphBuilder,\n 446                        source_mtimes: Dict[str, float],\n 447                        gitnexus_cache: Optional[str]):\n-448     \"\"\"Save built graph to pickle cache.\"\"\"\n+448     \"\"\"Save built graph to msgpack cache.\"\"\"\n 449     try:\n 450         cache_file = _get_graph_cache_file(agi_dir)\n 451         cached = {\n 452             'nodes': builder.nodes,\n     ...\n 457             '_gitnexus_cache': gitnexus_cache,\n 458             '_node_count': len(builder.nodes),\n 459         }\n 460         with open(cache_file, 'wb') as f:\n-461             pickle.dump(cached, f)\n+461             msgpack.packb(cached, f)\n 462     except Exception:\n 463         pass\n 464 \n 465 def build_graph(hermes_dir: str, agi_dir: str, use_gitnexus: bool = True,\n     ...","firstChangedLine":388},"isError":false,"timestamp":1777533353589}}
{"type":"message","id":"4b65ec2e","parentId":"794aed7b","timestamp":"2026-04-30T07:15:58.167Z","message":{"role":"assistant","content":[{"type":"thinking","thinking":"Good, I've replaced pickle with msgpack. Now I need to:\n1. Remove the old pickle cache file to force a fresh build\n2. Commit\n3. Run the experiment\n4. Log the result","thinkingSignature":"240cbcced47075ad0d0aa63a26dbf8f2b5d7c517caf5f8c9d9377e9cd3b285c4"},{"type":"toolCall","id":"call_function_t8p4350vfbh6_1","name":"bash","arguments":{"command":"cd /home/ubuntu/.hermes/agi && rm -f .graph_cache.pkl && git add -A && git commit -m \"msgpack cache instead of pickle - binary format may be faster\""}}],"api":"anthropic-messages","provider":"minimax","model":"MiniMax-M2.7","usage":{"input":14130,"output":111,"cacheRead":10071,"cacheWrite":0,"totalTokens":24312,"cost":{"input":0.004239,"output":0.00013319999999999999,"cacheRead":0.0006042599999999999,"cacheWrite":0,"total":0.004976459999999999}},"stopReason":"toolUse","timestamp":1777533353590,"responseId":"064234a97d109be6fef5405d0438cb52"}}
