{"type":"message","id":"95dc018c","parentId":"ed3f2ec4","timestamp":"2026-04-30T08:49:20.064Z","message":{"role":"toolResult","toolCallId":"call_function_7jwqo8ygbhup_1","toolName":"read","content":[{"type":"text","text":"        # Reset _last_mode_id if it was set\n        if hasattr(self, '_last_mode_id'):\n            delattr(self, '_last_mode_id')\n\n        return count\n\n    def parse_archive_tasks(self, archive_dir: str) -> int:\n        \"\"\"Parse archive/tasks/ into archive_task nodes with upstream/downstream edges.\n        \n        Archive tasks have rich frontmatter (status, priority, upstream, downstream, tags)\n        that can create cross-type edges bridging isolated graph clusters.\n        \"\"\"\n        tasks_dir = os.path.join(archive_dir, \"tasks\")\n        if not os.path.isdir(tasks_dir):\n            return 0\n\n        files = sorted(os.listdir(tasks_dir))\n        md_files = [f for f in files if f.endswith('.md')]\n        count = 0\n        task_ids = {}  # filename -> node_id for downstream linking\n\n        for filename in md_files:\n            filepath = os.path.join(tasks_dir, filename)\n            try:\n                with open(filepath, \"r\") as f:\n                    content = f.read()\n\n                # Extract frontmatter\n                fm_match = _RE_FRONT_MATTER.match(content)\n                meta = {}\n\n[698 more lines in file. Use offset=1470 to continue.]"}],"isError":false,"timestamp":1777538960064}}
{"type":"message","id":"869fc205","parentId":"95dc018c","timestamp":"2026-04-30T08:49:59.885Z","message":{"role":"assistant","content":[{"type":"thinking","thinking":"Now I have enough context to write the pipeline parser. Let me find the right place to add it — after `parse_research_projects`. Let me check the line number of the end of that method.","thinkingSignature":"72341e1927e5bff95fcff12bdfcd367dc5731873021a3b3ab2ad5306d9208888"},{"type":"text","text":"Now I have enough context. I'll add the pipeline parser method and wire it into `build_graph`.\n"},{"type":"toolCall","id":"call_function_o2iuslt3dain_1","name":"edit","arguments":{"path":"/home/ubuntu/.hermes/agi/graph_builder.py","edits":[{"oldText":"    def parse_archive_tasks(self, archive_dir: str) -> int:","newText":"    def parse_pipelines(self, pipelines_dir: str) -> int:\n        \"\"\"Parse pipelines/ directory into pipeline + pipeline_stage nodes.\n\n        Each pipeline file has YAML frontmatter (version, status, priority, type,\n        agents, tags, project) and per-phase stage history tables.\n\n        Node types:\n          - pipeline: top-level pipeline record\n          - pipeline_stage: individual stage entries from stage history tables\n\n        Edges:\n          - has_stage: pipeline → pipeline_stage (ordered by occurrence)\n          - uses_agent: pipeline → agent_role\n          - tagged_with: pipeline → tag\n          - belongs_to_project: pipeline → knowledge (project)\n          - next_stage: pipeline_stage → pipeline_stage (temporal order)\n          - categorized_as: pipeline → tag (status, priority, type)\n        \"\"\"\n        if not os.path.isdir(pipelines_dir):\n            return 0\n\n        # Also scan archive/pipelines/\n        archive_pipelines = os.path.join(pipelines_dir, \"archive\")\n        dirs_to_scan = [pipelines_dir]\n        if os.path.isdir(archive_pipelines):\n            dirs_to_scan.append(archive_pipelines)\n\n        count = 0\n        _RE_STAGE_TABLE = re.compile(\n            r'^\\|\\s*Stage\\s*\\|.*?\\|.*?\\|.*?\\|.*?\\|\\n((?:\\|.*?\\n)+)',\n            re.MULTILINE\n        )\n        _RE_STAGE_ROW = re.compile(\n            r'^\\|\\s*([^|]+?)\\s*\\|\\s*([^|]+?)\\s*\\|\\s*([^|]+?)\\s*\\|\\s*(.+?)\\s*\\|$'\n        )\n        _RE_PHASE_SECTION = re.compile(\n            r'^## (Phase \\d+[^\\n]*)\\n.*?\\n(?:### Stage History\\n)?((?:\\|.*?\\n)+)',\n            re.MULTILINE\n        )\n        _RE_PHASE_SIMPLE = re.compile(r'^## (Phase \\d+[^\\n]*?)(?:\\n| )', re.MULTILINE)\n\n        for base_d in dirs_to_scan:\n            subdir = \"pipelines\" if base_d == pipelines_dir else \"archive/pipelines\"\n            try:\n                files = sorted(os.listdir(base_d))\n            except Exception:\n                continue\n\n            for filename in files:\n                if not filename.endswith('.md') or filename.startswith('.'):\n                    continue\n                # Skip non-pipeline files (e.g., handoffs/ subdir)\n                if not os.path.isfile(os.path.join(base_d, filename)):\n                    continue\n\n                filepath = os.path.join(base_d, filename)\n                try:\n                    with open(filepath, \"r\") as f:\n                        content = f.read()\n                except Exception:\n                    continue\n\n                # Extract YAML frontmatter\n                fm_match = _RE_FRONT_MATTER.match(content)\n                meta = {}\n                if fm_match:\n                    for line in fm_match.group(1).split('\\n'):\n                        m = _RE_YAML_PAIR.match(line)\n                        if m:\n                            meta[m.group(1)] = m.group(2).strip()\n\n                version = meta.get('version', filename[:-3])\n                status = meta.get('status', '')\n                priority = meta.get('priority', '')\n                ptype = meta.get('type', '')\n                agents_str = meta.get('agents', '')\n                tags_str = meta.get('tags', '[]')\n                project = meta.get('project', '')\n                pending = meta.get('pending_action', '')\n\n                # Extract title\n                title_match = re.search(r'^#\\s+Implementation Pipeline:\\s*(.+)$', content, re.MULTILINE)\n                title = title_match.group(1).strip()[:60] if title_match else version\n\n                pipeline_id = self.add_node(\n                    \"pipeline\",\n                    title[:50],\n                    f\"{status}|{priority}|{ptype}\",\n                    f\"{subdir}/{filename}\",\n                    f\"pipeline_{version}\"\n                )\n                count += 1\n\n                # Tag edges (from YAML tags)\n                if tags_str and tags_str != '[]':\n                    tags = re.findall(r'[\\w-]+', tags_str)\n                    for tag in tags[:8]:\n                        tag_id = f\"tag_{tag}\"\n                        if tag_id not in self._node_ids:\n                            self.add_node(\"tag\", tag, \"\", f\"{subdir}/{filename}\", tag_id)\n                        self.add_edge(pipeline_id, tag_id, \"tagged_with\")\n                        count += 1\n\n                # Agent edges\n                if agents_str:\n                    agents = re.findall(r'[\\w-]+', agents_str)\n                    for agent in agents[:6]:\n                        role_id = f\"agent_role_{agent}\"\n                        if role_id not in self._node_ids:\n                            self.add_node(\"agent_role\", agent, \"\", f\"{subdir}/{filename}\", role_id)\n                        self.add_edge(pipeline_id, role_id, \"uses_agent\")\n\n                # Status/priority/type category edges\n                for cat_val, cat_prefix in [(status, \"pipeline_status\"), (priority, \"pipeline_priority\"), (ptype, \"pipeline_type\")]:\n                    if cat_val:\n                        cat_id = f\"tag_{cat_prefix}_{cat_val}\"\n                        if cat_id not in self._node_ids:\n                            self.add_node(\"tag\", f\"{cat_prefix}:{cat_val}\", \"\", f\"{subdir}/{filename}\", cat_id)\n                        self.add_edge(pipeline_id, cat_id, \"categorized_as\")\n\n                # Project edge\n                if project:\n                    proj_id = f\"project_{project}\"\n                    if proj_id not in self._node_ids:\n                        self.add_node(\"knowledge\", project, f\"project:{project}\", f\"{subdir}/{filename}\", proj_id)\n                        count += 1\n                    self.add_edge(pipeline_id, proj_id, \"belongs_to_project\")\n\n                # Extract stage history: parse all | Stage | Date | Agent | Notes | table rows\n                all_stages = []\n                # Find phase sections with stage history tables\n                for ph_match in _RE_PHASE_SECTION.finditer(content):\n                    phase_name = ph_match.group(1).strip()\n                    table_block = ph_match.group(2)\n                    for row_match in _RE_STAGE_ROW.finditer(table_block):\n                        stage_name = row_match.group(1).strip()\n                        stage_date = row_match.group(2).strip()\n                        stage_agent = row_match.group(3).strip()\n                        stage_notes = row_match.group(4).strip()[:80]\n                        all_stages.append((stage_name, stage_date, stage_agent, stage_notes))\n\n                # Also extract standalone stage tables (some pipelines put them without phase headers)\n                if not all_stages:\n                    for tbl_match in _RE_STAGE_TABLE.finditer(content):\n                        table_block = tbl_match.group(1)\n                        for row_match in _RE_STAGE_ROW.finditer(table_block):\n                            stage_name = row_match.group(1).strip()\n                            stage_date = row_match.group(2).strip()\n                            stage_agent = row_match.group(3).strip()\n                            stage_notes = row_match.group(4).strip()[:80]\n                            all_stages.append((stage_name, stage_date, stage_agent, stage_notes))\n\n                # Create pipeline_stage nodes\n                prev_stage_id = None\n                for (stage_name, stage_date, stage_agent, stage_notes) in all_stages[:40]:\n                    stage_id = self.add_node(\n                        \"pipeline_stage\",\n                        stage_name[:40],\n                        f\"{stage_date}|{stage_agent}|{stage_notes}\",\n                        f\"{subdir}/{filename}#{stage_name}\",\n                        f\"pipeline_{version}_stage_{stage_name}\"\n                    )\n                    count += 1\n                    self.add_edge(pipeline_id, stage_id, \"has_stage\")\n                    if prev_stage_id:\n                        self.add_edge(prev_stage_id, stage_id, \"next_stage\")\n                    prev_stage_id = stage_id\n\n                    # Agent node for stage actor\n                    if stage_agent and stage_agent not in ('unknown', 'belam-main'):\n                        role_id = f\"agent_role_{stage_agent}\"\n                        if role_id not in self._node_ids:\n                            self.add_node(\"agent_role\", stage_agent, \"\", f\"{subdir}/{filename}\", role_id)\n                        self.add_edge(stage_id, role_id, \"executed_by\")\n\n                # Phase summary nodes (Phase 1, Phase 2, etc.)\n                phase_names_seen = set()\n                for ph_match in _RE_PHASE_SIMPLE.finditer(content):\n                    phase_name = ph_match.group(1).strip()\n                    if phase_name not in phase_names_seen:\n                        phase_names_seen.add(phase_name)\n                        phase_id = self.add_node(\n                            \"pipeline_phase\",\n                            phase_name[:40],\n                            \"\",\n                            f\"{subdir}/{filename}#{phase_name}\",\n                            f\"pipeline_{version}_phase_{len(phase_names_seen)}\"\n                        )\n                        count += 1\n                        self.add_edge(pipeline_id, phase_id, \"has_phase\")\n\n                except_count = 0\n\n        return count\n\n    def parse_archive_tasks(self, archive_dir: str) -> int:"}]}}],"api":"anthropic-messages","provider":"minimax","model":"MiniMax-M2.7","usage":{"input":18625,"output":2361,"cacheRead":10071,"cacheWrite":0,"totalTokens":31057,"cost":{"input":0.0055875,"output":0.0028331999999999997,"cacheRead":0.0006042599999999999,"cacheWrite":0,"total":0.00902496}},"stopReason":"toolUse","timestamp":1777538960066,"responseId":"06424a90b845da17b46ca22bea92faa2"}}
