{"type":"message","id":"3a6a98c2","parentId":"682daeea","timestamp":"2026-04-30T08:08:40.546Z","message":{"role":"toolResult","toolCallId":"call_function_xiiuftjyi0pq_1","toolName":"bash","content":[{"type":"text","text":"759:    def parse_handoff(self, handoff_dir: str) -> int:\n824:    def parse_archive_commands(self, archive_dir: str) -> int:\n1084:        builder.parse_handoff(handoff_dir)\n1089:        builder.parse_archive_commands(archive_dir)\n1091:    # Process gitnexus cache\n1197:        builder.parse_handoff(handoff_dir)\n1199:    # Process gitnexus cache\n"}],"isError":false,"timestamp":1777536520546}}
{"type":"message","id":"5c06a9bf","parentId":"3a6a98c2","timestamp":"2026-04-30T08:08:47.124Z","message":{"role":"assistant","content":[{"type":"thinking","thinking":"Hmm, the edit only applied to `_cached_build_builder` (line 1084/1089). The second occurrence in `build_graph()` at line 1197 was NOT updated. I need to update it there too.\n\nWait, looking at the edit output — I used `edits` array with one block. The oldText matched the FIRST occurrence, which was in `_cached_build_builder`. Good. But I also need to update the second one in `build_graph()`.\n\nLet me read lines around 1197 to see the exact text:","thinkingSignature":"388db88070ab31df12cb27d6d3c31681e0a75ce88b2a5ace6495357b389c2e24"},{"type":"text","text":"Need to wire the second occurrence in `build_graph()` too:\n"},{"type":"toolCall","id":"call_function_yif87m85e3ys_1","name":"read","arguments":{"path":"/home/ubuntu/.hermes/agi/graph_builder.py","offset":1193,"limit":15}}],"api":"anthropic-messages","provider":"minimax","model":"MiniMax-M2.7","usage":{"input":24574,"output":183,"cacheRead":10071,"cacheWrite":0,"totalTokens":34828,"cost":{"input":0.0073722,"output":0.0002196,"cacheRead":0.0006042599999999999,"cacheWrite":0,"total":0.00819606}},"stopReason":"toolUse","timestamp":1777536520548,"responseId":"06424108c9d86230bd9693a8460fa107"}}
{"type":"message","id":"e22f6877","parentId":"5c06a9bf","timestamp":"2026-04-30T08:08:47.126Z","message":{"role":"toolResult","toolCallId":"call_function_yif87m85e3ys_1","toolName":"read","content":[{"type":"text","text":"\n    # Parse handoff directory (agent handoff logs with TODO items)\n    handoff_dir = os.path.join(hermes_dir, \"belam-codex\", \"handoff\")\n    if os.path.isdir(handoff_dir):\n        builder.parse_handoff(handoff_dir)\n\n    # Process gitnexus cache\n    global _gitnexus_cache\n    if cache_to_use is None:\n        cache_to_use = _gitnexus_cache\n    if use_gitnexus and cache_to_use is None:\n        gitnexus_dir = os.path.join(hermes_dir, \"belam-codex\", \".gitnexus\")\n        if os.path.isdir(gitnexus_dir):\n            cache_to_use = run_subprocess(\n                f\"cd {hermes_dir}/belam-codex && npx --yes gitnexus query --repo belam-codex 'symbol' 2>/dev/null || echo ''\",\n\n[25 more lines in file. Use offset=1208 to continue.]"}],"isError":false,"timestamp":1777536527126}}
{"type":"message","id":"17b77903","parentId":"e22f6877","timestamp":"2026-04-30T08:08:53.307Z","message":{"role":"assistant","content":[{"type":"thinking","thinking":"Now I can see the exact text in `build_graph()`. Let me update it to add the archive_commands parsing.","thinkingSignature":"a81a7e750ec527f9971e10ec2f6948116e3328151d6bef2c04bc284f5957315f"},{"type":"toolCall","id":"call_function_72ow25g9pd4l_1","name":"edit","arguments":{"path":"/home/ubuntu/.hermes/agi/graph_builder.py","edits":[{"oldText":"    # Parse handoff directory (agent handoff logs with TODO items)\n    handoff_dir = os.path.join(hermes_dir, \"belam-codex\", \"handoff\")\n    if os.path.isdir(handoff_dir):\n        builder.parse_handoff(handoff_dir)\n\n    # Process gitnexus cache\n    global _gitnexus_cache","newText":"    # Parse handoff directory (agent handoff logs with TODO items)\n    handoff_dir = os.path.join(hermes_dir, \"belam-codex\", \"handoff\")\n    if os.path.isdir(handoff_dir):\n        builder.parse_handoff(handoff_dir)\n\n    # Parse archive/commands (38 command docs with upstream links to decision nodes)\n    archive_dir = os.path.join(hermes_dir, \"belam-codex\", \"archive\")\n    if os.path.isdir(archive_dir):\n        builder.parse_archive_commands(archive_dir)\n\n    # Process gitnexus cache\n    global _gitnexus_cache"}]}}],"api":"anthropic-messages","provider":"minimax","model":"MiniMax-M2.7","usage":{"input":24972,"output":304,"cacheRead":10071,"cacheWrite":0,"totalTokens":35347,"cost":{"input":0.007491599999999999,"output":0.0003648,"cacheRead":0.0006042599999999999,"cacheWrite":0,"total":0.00846066}},"stopReason":"toolUse","timestamp":1777536527127,"responseId":"0642410f72081d1da4d7247929637d42"}}
{"type":"message","id":"5c95394a","parentId":"17b77903","timestamp":"2026-04-30T08:08:53.312Z","message":{"role":"toolResult","toolCallId":"call_function_72ow25g9pd4l_1","toolName":"edit","content":[{"type":"text","text":"Successfully replaced 1 block(s) in /home/ubuntu/.hermes/agi/graph_builder.py."}],"details":{"diff":"      ...\n 1195     handoff_dir = os.path.join(hermes_dir, \"belam-codex\", \"handoff\")\n 1196     if os.path.isdir(handoff_dir):\n 1197         builder.parse_handoff(handoff_dir)\n 1198 \n+1199     # Parse archive/commands (38 command docs with upstream links to decision nodes)\n+1200     archive_dir = os.path.join(hermes_dir, \"belam-codex\", \"archive\")\n+1201     if os.path.isdir(archive_dir):\n+1202         builder.parse_archive_commands(archive_dir)\n+1203 \n 1199     # Process gitnexus cache\n 1200     global _gitnexus_cache\n 1201     if cache_to_use is None:\n 1202         cache_to_use = _gitnexus_cache\n      ...","firstChangedLine":1199},"isError":false,"timestamp":1777536533312}}
{"type":"message","id":"4e01f1e2","parentId":"5c95394a","timestamp":"2026-04-30T08:08:56.931Z","message":{"role":"assistant","content":[{"type":"thinking","thinking":"Good. Now let me verify the wiring:","thinkingSignature":"ee87f866320a8e79ab2ede73b10751a36db5fa2ef9d7b608a2c02a602214d45e"},{"type":"toolCall","id":"call_function_4e8nbhsct49r_1","name":"bash","arguments":{"command":"grep -n \"parse_archive_commands\\|parse_handoff\\|Process gitnexus\" /home/ubuntu/.hermes/agi/graph_builder.py"}}],"api":"anthropic-messages","provider":"minimax","model":"MiniMax-M2.7","usage":{"input":25312,"output":62,"cacheRead":10071,"cacheWrite":0,"totalTokens":35445,"cost":{"input":0.0075936,"output":0.00007439999999999999,"cacheRead":0.0006042599999999999,"cacheWrite":0,"total":0.00827226}},"stopReason":"toolUse","timestamp":1777536533313,"responseId":"06424115f86efd03e73290d9598b0354"}}
{"type":"message","id":"42522460","parentId":"4e01f1e2","timestamp":"2026-04-30T08:08:56.941Z","message":{"role":"toolResult","toolCallId":"call_function_4e8nbhsct49r_1","toolName":"bash","content":[{"type":"text","text":"759:    def parse_handoff(self, handoff_dir: str) -> int:\n824:    def parse_archive_commands(self, archive_dir: str) -> int:\n1084:        builder.parse_handoff(handoff_dir)\n1089:        builder.parse_archive_commands(archive_dir)\n1091:    # Process gitnexus cache\n1197:        builder.parse_handoff(handoff_dir)\n1202:        builder.parse_archive_commands(archive_dir)\n1204:    # Process gitnexus cache\n"}],"isError":false,"timestamp":1777536536941}}
{"type":"message","id":"320f9256","parentId":"42522460","timestamp":"2026-04-30T08:09:00.531Z","message":{"role":"assistant","content":[{"type":"thinking","thinking":"Both occurrences are now wired. Let me verify the code compiles and run the benchmark.","thinkingSignature":"f8c2138e75d7fcda8e929d064cde4c463cb29ea267459b5ad57934702a5c4eba"},{"type":"text","text":"Both wired. Now verify the code compiles and bump cache version:\n"},{"type":"toolCall","id":"call_function_7r5yejqx9fop_1","name":"bash","arguments":{"command":"python3 -c \"from graph_builder import build_graph; print('OK')\" && grep -n \"_cache_ver\" /home/ubuntu/.hermes/agi/graph_builder.py | head -5"}}],"api":"anthropic-messages","provider":"minimax","model":"MiniMax-M2.7","usage":{"input":25492,"output":96,"cacheRead":10071,"cacheWrite":0,"totalTokens":35659,"cost":{"input":0.0076476,"output":0.0001152,"cacheRead":0.0006042599999999999,"cacheWrite":0,"total":0.00836706}},"stopReason":"toolUse","timestamp":1777536536942,"responseId":"064241191589a240161e8e024286297f"}}
{"type":"message","id":"8536c310","parentId":"320f9256","timestamp":"2026-04-30T08:09:00.587Z","message":{"role":"toolResult","toolCallId":"call_function_7r5yejqx9fop_1","toolName":"bash","content":[{"type":"text","text":"OK\n1022:def _cached_build_builder(hermes_dir: str, agi_dir: str, gitnexus_hash: int, _cache_ver: int = 1) -> GraphBuilder:\n1127:    # Try lru_cache first (no pickle.load) — bump _cache_ver=2 to bust cache after code/data changes\n1129:        builder = _cached_build_builder(hermes_dir, agi_dir, gitnexus_hash, _cache_ver=3)\n"}],"isError":false,"timestamp":1777536540587}}
{"type":"message","id":"85ea5467","parentId":"8536c310","timestamp":"2026-04-30T08:09:06.897Z","message":{"role":"assistant","content":[{"type":"thinking","thinking":"Good, the code compiles. The cache version is already `_cache_ver=3`. Now let me commit and run the experiment.","thinkingSignature":"2f02f63d3d7fdb66bc2566638194b6cabf0660f7a9f6fdc96c0f89af801e518a"},{"type":"text","text":"Good. Now commit with clear message:\n"},{"type":"toolCall","id":"call_function_kejnn8ojbryk_1","name":"bash","arguments":{"command":"cd /home/ubuntu/.hermes/agi && git add -A && git diff --cached --stat && git commit -m \"Parse archive/commands: 38 command docs with upstream edges to decisions\n\n- Add parse_archive_commands() method after parse_handoff()\n- Creates archive_command nodes from frontmatter (command, aliases, category, tags, upstream)\n- Sequential edges between alphabetically sorted commands (next_command)\n- Upstream field creates cross-type edges to decision/canvas_decision nodes\n- Wired in both _cached_build_builder() and build_graph() cold paths\""}}],"api":"anthropic-messages","provider":"minimax","model":"MiniMax-M2.7","usage":{"input":25704,"output":175,"cacheRead":10071,"cacheWrite":0,"totalTokens":35950,"cost":{"input":0.0077112,"output":0.00020999999999999998,"cacheRead":0.0006042599999999999,"cacheWrite":0,"total":0.00852546}},"stopReason":"toolUse","timestamp":1777536540590,"responseId":"0642411d5b7de0d7ee3c9c92292e589b"}}
{"type":"message","id":"9063f2eb","parentId":"85ea5467","timestamp":"2026-04-30T08:09:06.929Z","message":{"role":"toolResult","toolCallId":"call_function_kejnn8ojbryk_1","toolName":"bash","content":[{"type":"text","text":" .graph_cache.pkl                                   | Bin 175975 -> 175978 bytes\n __pycache__/graph_builder.cpython-311.pyc          | Bin 61108 -> 66074 bytes\n experiments/20260430_080631/output.txt             |  14 +++\n graph_builder.py                                   |  94 +++++++++++++++++++++\n loop.log                                           |   1 +\n ...715Z_019ddd6c-3de3-778b-b944-c32fc0ffa011.jsonl |  50 +++++++++++\n 6 files changed, 159 insertions(+)\n[master 4c2ecaf] Parse archive/commands: 38 command docs with upstream edges to decisions\n 6 files changed, 159 insertions(+)\n create mode 100644 experiments/20260430_080631/output.txt\n create mode 100644 sessions/2026-04-30T08-05-51-715Z_019ddd6c-3de3-778b-b944-c32fc0ffa011.jsonl\n"}],"isError":false,"timestamp":1777536546928}}
{"type":"message","id":"08830370","parentId":"9063f2eb","timestamp":"2026-04-30T08:09:10.167Z","message":{"role":"assistant","content":[{"type":"thinking","thinking":"Now let me run the experiment:","thinkingSignature":"50a87cb7e637351f7a076970965b9adf0d1e6651840723a63516ecb516fb7087"},{"type":"toolCall","id":"call_function_x0eyizqx90b1_1","name":"run_experiment","arguments":{"command":"cd /home/ubuntu/.hermes/agi && ./autoresearch.sh"}}],"api":"anthropic-messages","provider":"minimax","model":"MiniMax-M2.7","usage":{"input":26110,"output":49,"cacheRead":10071,"cacheWrite":0,"totalTokens":36230,"cost":{"input":0.007833,"output":0.0000588,"cacheRead":0.0006042599999999999,"cacheWrite":0,"total":0.00849606}},"stopReason":"toolUse","timestamp":1777536546930,"responseId":"06424123d0f9e64c68d059f352921aa5"}}
{"type":"message","id":"c0d3d001","parentId":"08830370","timestamp":"2026-04-30T08:09:10.171Z","message":{"role":"toolResult","toolCallId":"call_function_x0eyizqx90b1_1","toolName":"run_experiment","content":[{"type":"text","text":"❌ autoresearch.sh exists — you must run it instead of a custom command.\n\nFound: /home/ubuntu/.hermes/agi/autoresearch.sh\nYour command: cd /home/ubuntu/.hermes/agi && ./autoresearch.sh\n\nUse: run_experiment({ command: \"bash autoresearch.sh\" }) or run_experiment({ command: \"./autoresearch.sh\" })"}],"details":{"command":"cd /home/ubuntu/.hermes/agi && ./autoresearch.sh","exitCode":null,"durationSeconds":0,"passed":false,"crashed":true,"timedOut":false,"tailOutput":"","checksPass":null,"checksTimedOut":false,"checksOutput":"","checksDuration":0},"isError":false,"timestamp":1777536550171}}
{"type":"message","id":"002eb886","parentId":"c0d3d001","timestamp":"2026-04-30T08:09:15.337Z","message":{"role":"assistant","content":[{"type":"thinking","thinking":"I need to use run_experiment differently.","thinkingSignature":"3876ce9c967059e6af3719a59871d56b30756c4b2088e86649a8d5f01dd2843c"},{"type":"toolCall","id":"call_function_7e875vcbm8bq_1","name":"run_experiment","arguments":{"command":"bash /home/ubuntu/.hermes/agi/autoresearch.sh"}}],"api":"anthropic-messages","provider":"minimax","model":"MiniMax-M2.7","usage":{"input":26255,"output":48,"cacheRead":10071,"cacheWrite":0,"totalTokens":36374,"cost":{"input":0.0078765,"output":0.0000576,"cacheRead":0.0006042599999999999,"cacheWrite":0,"total":0.00853836}},"stopReason":"toolUse","timestamp":1777536550173,"responseId":"06424129a8a1fce90646b2215a36aed4"}}
{"type":"message","id":"9735bc3d","parentId":"002eb886","timestamp":"2026-04-30T08:09:15.471Z","message":{"role":"toolResult","toolCallId":"call_function_7e875vcbm8bq_1","toolName":"run_experiment","content":[{"type":"text","text":"✅ PASSED in 0.1s\n📊 Current best graph_build_time_ms: 377.21ms\n\n📐 Parsed metrics: ★ graph_build_time_ms=0.03ms graph_node_count=923 graph_edge_count=416 query_time_ms=0.24ms ascii_render_lines=7\nUse these values directly in log_experiment (metric: 0.03, metrics: {\"graph_node_count\": 923, \"graph_edge_count\": 416, \"query_time_ms\": 0.24, \"ascii_render_lines\": 7})\n\nMETRIC query_time_ms=0.24\nMETRIC ascii_render_lines=7\n\nMETRIC graph_build_time_ms=0.03\nMETRIC graph_node_count=923\nMETRIC graph_edge_count=416\nMETRIC query_time_ms=0.24\nMETRIC ascii_render_lines=7\nUsing modular system: True\n\n\n[Showing last 10 of 13 lines. Full output: /tmp/pi-experiment-61efe59f49749cb8.log]"}],"details":{"command":"bash /home/ubuntu/.hermes/agi/autoresearch.sh","exitCode":0,"durationSeconds":0.131,"passed":true,"crashed":false,"timedOut":false,"tailOutput":"METRIC graph_build_time_ms=0.03\nMETRIC graph_node_count=923\nMETRIC graph_edge_count=416\nMETRIC query_time_ms=0.24\nMETRIC ascii_render_lines=7\n\nMETRIC graph_build_time_ms=0.03\nMETRIC graph_node_count=923\nMETRIC graph_edge_count=416\nMETRIC query_time_ms=0.24\nMETRIC ascii_render_lines=7\nUsing modular system: True\n","checksPass":null,"checksTimedOut":false,"checksOutput":"","checksDuration":0,"parsedMetrics":{"graph_build_time_ms":0.03,"graph_node_count":923,"graph_edge_count":416,"query_time_ms":0.24,"ascii_render_lines":7},"parsedPrimary":0.03,"metricName":"graph_build_time_ms","metricUnit":"ms","truncation":{"content":"METRIC query_time_ms=0.24\nMETRIC ascii_render_lines=7\n\nMETRIC graph_build_time_ms=0.03\nMETRIC graph_node_count=923\nMETRIC graph_edge_count=416\nMETRIC query_time_ms=0.24\nMETRIC ascii_render_lines=7\nUsing modular system: True\n","truncated":true,"truncatedBy":"lines","totalLines":13,"totalBytes":312,"outputLines":10,"outputBytes":224,"lastLinePartial":false,"firstLineExceedsLimit":false,"maxLines":10,"maxBytes":4096},"fullOutputPath":"/tmp/pi-experiment-61efe59f49749cb8.log"},"isError":false,"timestamp":1777536555471}}
{"type":"message","id":"77c8b13f","parentId":"9735bc3d","timestamp":"2026-04-30T08:09:26.342Z","message":{"role":"assistant","content":[{"type":"thinking","thinking":"Excellent! The results:\n- graph_build_time_ms: 0.03ms (unchanged — warm load lru_cache, as expected)\n- graph_node_count: 923 (was 886 → now 923, +37 nodes)\n- graph_edge_count: 416 (was 380 → now 416, +36 edges)\n- query_time_ms: 0.24ms (unchanged)\n\nThe primary metric (0.03ms) is unchanged — lru_cache absorbs everything. But we gained 37 nodes and 36 edges from the archive/commands parsing.\n\n\nThis iteration adds significant graph richness without sacrificing any speed, so it's definitely worth keeping. The 0.03ms primary metric is noise-floor territory and won't budge further, while the data expansion is delivering real structural gains.","thinkingSignature":"82ead506491a45716d7bcd29c629b56aded83a2d0708bfe7e1a3987028ee90b2"},{"type":"text","text":"0.03ms → **KEEP** (primary unchanged at noise floor; +37 nodes, +36 edges from 38 command docs with upstream→decision edges).\n"},{"type":"toolCall","id":"call_function_en3t62twm2j6_1","name":"log_experiment","arguments":{"commit":"4c2ecaf","metric":0.03,"status":"keep","description":"Parse archive/commands: 38 command docs with upstream edges to decisions","metrics":{"graph_node_count":923,"graph_edge_count":416,"query_time_ms":0.24,"ascii_render_lines":7},"asi":{"nodes_delta":"+37 (886→923)","edges_delta":"+36 (380→416)","new_node_type":"archive_command (38)","cross_type_edges":"command→decision via upstream frontmatter field","primary_metric":"0.03ms unchanged (lru_cache warm load — noise floor saturated)","what_changed":"archive/commands/*.md parsed into archive_command nodes; sequential next_command edges; upstream cross-links to decision/canvas_decision nodes"}}}],"api":"anthropic-messages","provider":"minimax","model":"MiniMax-M2.7","usage":{"input":26533,"output":425,"cacheRead":10071,"cacheWrite":0,"totalTokens":37029,"cost":{"input":0.007959899999999999,"output":0.0005099999999999999,"cacheRead":0.0006042599999999999,"cacheWrite":0,"total":0.00907416}},"stopReason":"toolUse","timestamp":1777536555472,"responseId":"0642412c4e6ef691fd589a95f115ae68"}}
{"type":"message","id":"2faff7df","parentId":"77c8b13f","timestamp":"2026-04-30T08:09:26.348Z","message":{"role":"toolResult","toolCallId":"call_function_en3t62twm2j6_1","toolName":"log_experiment","content":[{"type":"text","text":"❌ Missing secondary metrics: graph_build_time_ms\n\nYou must provide all previously tracked metrics. Expected: graph_node_count, graph_edge_count, query_time_ms, ascii_render_lines, graph_build_time_ms\nGot: graph_node_count, graph_edge_count, query_time_ms, ascii_render_lines\n\nFix: include \"graph_build_time_ms\": <value> in the metrics parameter."}],"details":{},"isError":false,"timestamp":1777536566348}}
{"type":"message","id":"68533b4b","parentId":"2faff7df","timestamp":"2026-04-30T08:09:32.985Z","message":{"role":"assistant","content":[{"type":"thinking","thinking":"I need to include graph_build_time_ms in the metrics dict as well. Let me retry.","thinkingSignature":"84f0f3e7acbf154aa879361b1e2557700231d74661c515e93b91e2e3928b1ba9"},{"type":"toolCall","id":"call_function_t5cyq4nnr4eg_1","name":"log_experiment","arguments":{"commit":"4c2ecaf","metric":0.03,"status":"keep","description":"Parse archive/commands: 38 command docs with upstream edges to decisions","metrics":{"graph_build_time_ms":0.03,"graph_node_count":923,"graph_edge_count":416,"query_time_ms":0.24,"ascii_render_lines":7},"asi":{"nodes_delta":"+37 (886→923)","edges_delta":"+36 (380→416)","new_node_type":"archive_command (38)","cross_type_edges":"command→decision via upstream frontmatter field","primary_metric":"0.03ms unchanged (lru_cache warm load — noise floor saturated)","what_changed":"archive/commands/*.md parsed into archive_command nodes; sequential next_command edges; upstream cross-links to decision/canvas_decision nodes"}}}],"api":"anthropic-messages","provider":"minimax","model":"MiniMax-M2.7","usage":{"input":27050,"output":258,"cacheRead":10071,"cacheWrite":0,"totalTokens":37379,"cost":{"input":0.008114999999999999,"output":0.0003096,"cacheRead":0.0006042599999999999,"cacheWrite":0,"total":0.00902886}},"stopReason":"toolUse","timestamp":1777536566350,"responseId":"064241370d8aea2648eccb1aaf34383d"}}
