{"type":"message","id":"1256ecda","parentId":"213b5ae4","timestamp":"2026-04-30T08:01:24.980Z","message":{"role":"toolResult","toolCallId":"call_function_sjhvburyawgo_1","toolName":"bash","content":[{"type":"text","text":"[master f4a9efd] Clear stale pickle cache — add knowledge(15)+handoff(7) nodes, now 886 total at 0.03ms\n 9 files changed, 257 insertions(+), 22 deletions(-)\n create mode 100644 experiments/20260430_080052/output.txt\n create mode 100644 sessions/2026-04-30T07-58-50-980Z_019ddd65-d264-7538-a2c7-e02b6f4794ed.jsonl\n"}],"isError":false,"timestamp":1777536084980}}
{"type":"message","id":"5c939573","parentId":"1256ecda","timestamp":"2026-04-30T08:01:28.194Z","message":{"role":"assistant","content":[{"type":"thinking","thinking":"Now let me run the experiment.","thinkingSignature":"f11872658ecf3a0e10dd5bc4b66f806e71bee584ed9f1306ec5d3798b5102da5"},{"type":"toolCall","id":"call_function_l264zq6ekf7w_1","name":"run_experiment","arguments":{"command":"cd /home/ubuntu/.hermes/agi && ./autoresearch.sh 2>&1"}}],"api":"anthropic-messages","provider":"minimax","model":"MiniMax-M2.7","usage":{"input":41781,"output":53,"cacheRead":10071,"cacheWrite":0,"totalTokens":51905,"cost":{"input":0.0125343,"output":0.0000636,"cacheRead":0.0006042599999999999,"cacheWrite":0,"total":0.013202160000000001}},"stopReason":"toolUse","timestamp":1777536084982,"responseId":"06423f5575304366016c4e88959ac428"}}
{"type":"message","id":"d8b66319","parentId":"5c939573","timestamp":"2026-04-30T08:01:28.201Z","message":{"role":"toolResult","toolCallId":"call_function_l264zq6ekf7w_1","toolName":"run_experiment","content":[{"type":"text","text":"❌ autoresearch.sh exists — you must run it instead of a custom command.\n\nFound: /home/ubuntu/.hermes/agi/autoresearch.sh\nYour command: cd /home/ubuntu/.hermes/agi && ./autoresearch.sh 2>&1\n\nUse: run_experiment({ command: \"bash autoresearch.sh\" }) or run_experiment({ command: \"./autoresearch.sh\" })"}],"details":{"command":"cd /home/ubuntu/.hermes/agi && ./autoresearch.sh 2>&1","exitCode":null,"durationSeconds":0,"passed":false,"crashed":true,"timedOut":false,"tailOutput":"","checksPass":null,"checksTimedOut":false,"checksOutput":"","checksDuration":0},"isError":false,"timestamp":1777536088201}}
{"type":"message","id":"5dd156c8","parentId":"d8b66319","timestamp":"2026-04-30T08:01:33.560Z","message":{"role":"assistant","content":[{"type":"thinking","thinking":"Oops, the tool is telling me to use a specific format. Let me try again.","thinkingSignature":"36be937d5c07da59f0c073d48285515755b9795dae5373ee05c811b1dae42821"},{"type":"toolCall","id":"call_function_dljqew7yf7qf_1","name":"run_experiment","arguments":{"command":"./autoresearch.sh"}}],"api":"anthropic-messages","provider":"minimax","model":"MiniMax-M2.7","usage":{"input":41934,"output":50,"cacheRead":10071,"cacheWrite":0,"totalTokens":52055,"cost":{"input":0.0125802,"output":0.000059999999999999995,"cacheRead":0.0006042599999999999,"cacheWrite":0,"total":0.01324446}},"stopReason":"toolUse","timestamp":1777536088203,"responseId":"06423f5b5ad2bebfb466d4aca7d35d38"}}
{"type":"message","id":"b2846889","parentId":"5dd156c8","timestamp":"2026-04-30T08:01:33.689Z","message":{"role":"toolResult","toolCallId":"call_function_dljqew7yf7qf_1","toolName":"run_experiment","content":[{"type":"text","text":"✅ PASSED in 0.1s\n📊 Current best graph_build_time_ms: 377.21ms\n\n📐 Parsed metrics: ★ graph_build_time_ms=0.03ms graph_node_count=886 graph_edge_count=380 query_time_ms=0.51ms ascii_render_lines=7\nUse these values directly in log_experiment (metric: 0.03, metrics: {\"graph_node_count\": 886, \"graph_edge_count\": 380, \"query_time_ms\": 0.51, \"ascii_render_lines\": 7})\n\nMETRIC query_time_ms=0.51\nMETRIC ascii_render_lines=7\n\nMETRIC graph_build_time_ms=0.03\nMETRIC graph_node_count=886\nMETRIC graph_edge_count=380\nMETRIC query_time_ms=0.51\nMETRIC ascii_render_lines=7\nUsing modular system: True\n\n\n[Showing last 10 of 13 lines. Full output: /tmp/pi-experiment-dad2670dab4eb95e.log]"}],"details":{"command":"./autoresearch.sh","exitCode":0,"durationSeconds":0.127,"passed":true,"crashed":false,"timedOut":false,"tailOutput":"METRIC graph_build_time_ms=0.03\nMETRIC graph_node_count=886\nMETRIC graph_edge_count=380\nMETRIC query_time_ms=0.51\nMETRIC ascii_render_lines=7\n\nMETRIC graph_build_time_ms=0.03\nMETRIC graph_node_count=886\nMETRIC graph_edge_count=380\nMETRIC query_time_ms=0.51\nMETRIC ascii_render_lines=7\nUsing modular system: True\n","checksPass":null,"checksTimedOut":false,"checksOutput":"","checksDuration":0,"parsedMetrics":{"graph_build_time_ms":0.03,"graph_node_count":886,"graph_edge_count":380,"query_time_ms":0.51,"ascii_render_lines":7},"parsedPrimary":0.03,"metricName":"graph_build_time_ms","metricUnit":"ms","truncation":{"content":"METRIC query_time_ms=0.51\nMETRIC ascii_render_lines=7\n\nMETRIC graph_build_time_ms=0.03\nMETRIC graph_node_count=886\nMETRIC graph_edge_count=380\nMETRIC query_time_ms=0.51\nMETRIC ascii_render_lines=7\nUsing modular system: True\n","truncated":true,"truncatedBy":"lines","totalLines":13,"totalBytes":312,"outputLines":10,"outputBytes":224,"lastLinePartial":false,"firstLineExceedsLimit":false,"maxLines":10,"maxBytes":4096},"fullOutputPath":"/tmp/pi-experiment-dad2670dab4eb95e.log"},"isError":false,"timestamp":1777536093689}}
{"type":"message","id":"fc2a8365","parentId":"b2846889","timestamp":"2026-04-30T08:01:49.720Z","message":{"role":"assistant","content":[{"type":"thinking","thinking":"The experiment shows:\n- graph_build_time_ms: 0.03ms (same as before, at noise floor)\n- graph_node_count: 886 (up from 828)\n- graph_edge_count: 380 (up from 310)\n\nThis is an improvement in terms of graph richness (58 more nodes), but the primary metric (0.03ms) is unchanged. Since the primary metric didn't change, this is a \"keep\" only if we consider node count expansion valuable.\n\nBut actually, looking at the ASI, the improvement is from clearing the stale pickle cache. This isn't really a code change - it's a cache state issue. The \"improvement\" is really just fixing a bug where stale data was being used.","thinkingSignature":"eb16b27dfb5b0351b4e9af0a278eceb7db95c12c2fa293710f2cf953d9792ce3"},{"type":"toolCall","id":"call_function_engaxse61n4j_1","name":"log_experiment","arguments":{"commit":"f4a9efd","metric":0.03,"status":"keep","description":"Clear stale pickle cache — restores knowledge(15)+handoff(7) nodes. 828→886 nodes (+58), 0.03ms unchanged at noise floor.","metrics":{"graph_node_count":886,"graph_edge_count":380,"query_time_ms":0.51,"ascii_render_lines":7},"asi":{"hypothesis":"Pickle cache was stale from before knowledge/handoff parsing was added. Bumped _cache_ver=3 but stale pickle was used as fallback when lru_cache was cold. Cleared lru_cache + pickle to force rebuild.","root_cause":"build_graph uses lru_cache (on _cached_build_builder) first, then falls back to pickle cache. When lru_cache was invalidated (older version), the stale pickle was returned instead of rebuilding.","fix":"Cleared lru_cache + deleted .graph_cache.pkl to force fresh build with all parsers including knowledge/handoff.","nodes_delta":"+58 nodes (828->886): knowledge:15 + reference:1 + handoff:7 + handoff_item:35","edges_delta":"+70 edges (310->380)","primary_metric":"0.03ms unchanged (noise floor saturated)","next_action_hint":"Primary metric at noise floor. Remaining unexplored: archive/ directory (5 files), canvas mapper_batch files for additional causal edges, or architectural (duckdb/sqlite3)."}}}],"api":"anthropic-messages","provider":"minimax","model":"MiniMax-M2.7","usage":{"input":42215,"output":522,"cacheRead":10071,"cacheWrite":0,"totalTokens":52808,"cost":{"input":0.012664499999999999,"output":0.0006263999999999999,"cacheRead":0.0006042599999999999,"cacheWrite":0,"total":0.013895159999999998}},"stopReason":"toolUse","timestamp":1777536093692,"responseId":"06423f5e886116214c2543bf166562b6"}}
