{"type":"message","id":"d4e58b18","parentId":"10aade32","timestamp":"2026-04-30T08:22:46.211Z","message":{"role":"toolResult","toolCallId":"call_function_cxjzdu36wa7s_1","toolName":"read","content":[{"type":"text","text":"                continue\n\n            header = lines[0].strip('#').strip()\n            body = '\\n'.join(lines[1:]).strip()[:120]\n\n            section_id = self.add_node(\n                \"doc_section\", header, body, \"AGENTS.md\",\n                f\"agents_section_{i}\"\n            )\n\n            if last_section_idx >= 0:\n                self.add_edge(\n                    f\"agents_section_{last_section_idx}\",\n                    section_id,\n                    \"sequential\"\n                )\n            last_section_idx = i\n\n            # Parse code references within section\n            for match in _RE_CODE_BLOCK.finditer(section):\n                code = match.group(1)\n                if len(code) > 3 and ' ' in code:\n                    ref_id = self.add_node(\n                        \"code_reference\", code[:60], code, \"AGENTS.md\",\n                        f\"code_ref_{match.start()}\"\n                    )\n                    self.add_edge(section_id, ref_id, \"contains\")\n\n        return i + 1\n\n    def parse_memory_files(self, memory_dir: str, limit: int = 10) -> int:\n        \"\"\"Parse memory files into graph nodes.\"\"\"\n        if not os.path.isdir(memory_dir):\n            return 0\n\n        memory_files = sorted(\n            [f for f in os.listdir(memory_dir) if f.endswith('.md')],\n            reverse=True\n        )[:limit]\n\n        count = 0\n        for filename in memory_files:\n            filepath = os.path.join(memory_dir, filename)\n            try:\n                with open(filepath, \"r\") as f:\n                    content = f.read()\n\n                # Extract session header\n                header_match = re.search(r'# Session: (.+)', content)\n                session_label = header_match.group(1) if header_match else filename[:-3]\n\n                # Extract conversation summary (first few paragraphs)\n                summary_match = re.search(r'## Conversation Summary\\s*\\n+(.+?)(?:\\n##|\\Z)', content, re.DOTALL)\n                summary = summary_match.group(1).strip()[:120] if summary_match else \"\"\n\n                session_id = self.add_node(\n                    \"memory_session\",\n                    session_label[:60],\n                    summary,\n                    f\"memory/{filename}\",\n                    f\"memory_{filename[:19]}\"  # Use date prefix as ID\n                )\n                count += 1\n\n                # Link to agents sections (approximate linking based on content)\n                if \"agent:main\" in content or \"model:\" in content:\n                    self.add_edge(session_id, \"agents_section_0\", \"references\")\n\n            except Exception:\n                pass\n\n        return count\n\n    def parse_schema_files(self, schema_dir: str) -> int:\n        \"\"\"Parse schema files into graph nodes. Creates entity + field nodes.\"\"\"\n        if not os.path.isdir(schema_dir):\n            return 0\n\n        count = 0\n        for filename in os.listdir(schema_dir):\n\n[1197 more lines in file. Use offset=181 to continue.]"}],"isError":false,"timestamp":1777537366211}}
{"type":"message","id":"e5db554d","parentId":"d4e58b18","timestamp":"2026-04-30T08:22:46.211Z","message":{"role":"toolResult","toolCallId":"call_function_cxjzdu36wa7s_2","toolName":"bash","content":[{"type":"text","text":"87:    def parse_agents_md(self, filepath: str) -> int:\n131:    def parse_memory_files(self, memory_dir: str, limit: int = 10) -> int:\n174:    def parse_schema_files(self, schema_dir: str) -> int:\n257:    def parse_decisions(self, decisions_dir: str, limit: int = 20) -> int:\n305:    def parse_lessons(self, lessons_dir: str, limit: int = 20) -> int:\n350:    def parse_tasks(self, tasks_dir: str, limit: int = 50) -> int:\n442:    def parse_goals(self, goals_dir: str) -> int:\n494:    def parse_agent_roles(self, agents_dir: str) -> int:\n616:    def parse_canvas_graph(self, canvas_dir: str) -> Tuple[int, int]:\n680:    def parse_knowledge(self, knowledge_dir: str) -> int:\n760:    def parse_handoff(self, handoff_dir: str) -> int:\n825:    def parse_archive_commands(self, archive_dir: str) -> int:\n909:    def parse_archive_tasks(self, archive_dir: str) -> int:\n"}],"isError":false,"timestamp":1777537366211}}
{"type":"message","id":"1f09ad15","parentId":"e5db554d","timestamp":"2026-04-30T08:22:51.766Z","message":{"role":"assistant","content":[{"type":"thinking","thinking":"I need to add a new parser `parse_codex_modules` that parses the `archive/codex-layer-v1-modules/*.py` files. Let me look at the end of the existing code to understand where to add it and how the build process works:","thinkingSignature":"6709ce3f94572d73a93acdcdcf00543d790b037a55ed028ef354888fd2d6e5af"},{"type":"toolCall","id":"call_function_5gmarunzngg9_1","name":"read","arguments":{"path":"/home/ubuntu/.hermes/agi/graph_builder.py","offset":909,"limit":80}},{"type":"toolCall","id":"call_function_5gmarunzngg9_2","name":"bash","arguments":{"command":"grep -n \"def build_graph\\|def _cached_build\\|parse_archive_tasks\\|parse_archive_commands\\|archive_dir\\|codex\" /home/ubuntu/.hermes/agi/graph_builder.py | head -30"}}],"api":"anthropic-messages","provider":"minimax","model":"MiniMax-M2.7","usage":{"input":26998,"output":170,"cacheRead":10071,"cacheWrite":0,"totalTokens":37239,"cost":{"input":0.0080994,"output":0.000204,"cacheRead":0.0006042599999999999,"cacheWrite":0,"total":0.00890766}},"stopReason":"toolUse","timestamp":1777537366212,"responseId":"06424456f82743c3af707921df9873c1"}}
{"type":"message","id":"9c79f90c","parentId":"1f09ad15","timestamp":"2026-04-30T08:22:51.777Z","message":{"role":"toolResult","toolCallId":"call_function_5gmarunzngg9_1","toolName":"read","content":[{"type":"text","text":"    def parse_archive_tasks(self, archive_dir: str) -> int:\n        \"\"\"Parse archive/tasks/ into archive_task nodes with upstream/downstream edges.\n        \n        Archive tasks have rich frontmatter (status, priority, upstream, downstream, tags)\n        that can create cross-type edges bridging isolated graph clusters.\n        \"\"\"\n        tasks_dir = os.path.join(archive_dir, \"tasks\")\n        if not os.path.isdir(tasks_dir):\n            return 0\n\n        files = sorted(os.listdir(tasks_dir))\n        md_files = [f for f in files if f.endswith('.md')]\n        count = 0\n        task_ids = {}  # filename -> node_id for downstream linking\n\n        for filename in md_files:\n            filepath = os.path.join(tasks_dir, filename)\n            try:\n                with open(filepath, \"r\") as f:\n                    content = f.read()\n\n                # Extract frontmatter\n                fm_match = _RE_FRONT_MATTER.match(content)\n                meta = {}\n                if fm_match:\n                    for line in fm_match.group(1).split('\\n'):\n                        m = _RE_YAML_PAIR.match(line)\n                        if m:\n                            meta[m.group(1)] = m.group(2)\n\n                status = meta.get('status', '')\n                priority = meta.get('priority', '')\n                upstream_str = meta.get('upstream', '[]')\n                downstream_str = meta.get('downstream', '[]')\n                tags_str = meta.get('tags', '[]')\n                project = meta.get('project', '')\n\n                # Extract title from content\n                title_match = re.search(r'^# (.+)', content, re.MULTILINE)\n                title = title_match.group(1).strip()[:50] if title_match else filename[:-3]\n\n                summary = f\"{status}|{priority}|{project[:30]}\" if project else f\"{status}|{priority}\"\n\n                node_id = self.add_node(\n                    \"archive_task\",\n                    title,\n                    summary,\n                    f\"archive/tasks/{filename}\",\n                    f\"archive_task_{filename[:-3]}\"\n                )\n                task_ids[filename] = node_id\n                count += 1\n\n                # Upstream edges: link to decision/lesson nodes\n                if upstream_str and upstream_str != '[]':\n                    upstream_items = re.findall(r'[\\w/-]+', upstream_str)\n                    for ref in upstream_items[:8]:\n                        ref_clean = ref.strip().replace('/', '_')\n                        # Try decision format\n                        ref_id = f\"decision_{ref_clean}\"\n                        if ref_id in self._node_ids:\n                            self.add_edge(node_id, ref_id, \"upstream\")\n                            count += 1\n                        # Try canvas_decision format\n                        canvas_ref = f\"canvas_decision_{ref_clean}\"\n                        if canvas_ref in self._node_ids:\n                            self.add_edge(node_id, canvas_ref, \"upstream\")\n                            count += 1\n                        # Try lesson format\n                        lesson_ref = f\"lesson_{ref_clean}\"\n                        if lesson_ref in self._node_ids:\n                            self.add_edge(node_id, lesson_ref, \"upstream\")\n                            count += 1\n\n                # Downstream edges: link to other archive tasks\n                if downstream_str and downstream_str != '[]':\n                    downstream_items = re.findall(r'[\\w-]+', downstream_str)\n                    for ref in downstream_items[:5]:\n                        ref_clean = ref.strip()\n                        target_file = f\"{ref_clean}.md\"\n\n[389 more lines in file. Use offset=989 to continue.]"}],"isError":false,"timestamp":1777537371777}}
{"type":"message","id":"b997ed27","parentId":"9c79f90c","timestamp":"2026-04-30T08:22:51.778Z","message":{"role":"toolResult","toolCallId":"call_function_5gmarunzngg9_2","toolName":"bash","content":[{"type":"text","text":"640:        # Canvas format: 'decision/belam-codex-resurrection'\n641:        # Our format: 'decision_belam-codex-resurrection' or 'decision_belam_codex_resurrection'\n825:    def parse_archive_commands(self, archive_dir: str) -> int:\n833:        commands_dir = os.path.join(archive_dir, \"commands\")\n909:    def parse_archive_tasks(self, archive_dir: str) -> int:\n915:        tasks_dir = os.path.join(archive_dir, \"tasks\")\n1092:        os.path.join(hermes_dir, \"belam-codex\", \"AGENTS.md\"),\n1095:    memory_dir = os.path.join(hermes_dir, \"belam-codex\", \"memory\")\n1101:    schema_dir = os.path.join(hermes_dir, \"belam-codex\", \"schemas\")\n1160:def _cached_build_builder(hermes_dir: str, agi_dir: str, gitnexus_hash: int, _cache_ver: int = 1) -> GraphBuilder:\n1173:    agents_md = os.path.join(hermes_dir, \"belam-codex\", \"AGENTS.md\")\n1177:    memory_dir = os.path.join(hermes_dir, \"belam-codex\", \"memory\")\n1181:    schema_dir = os.path.join(hermes_dir, \"belam-codex\", \"schemas\")\n1185:    decisions_dir = os.path.join(hermes_dir, \"belam-codex\", \"decisions\")\n1190:    lessons_dir = os.path.join(hermes_dir, \"belam-codex\", \"lessons\")\n1195:    tasks_dir = os.path.join(hermes_dir, \"belam-codex\", \"tasks\")\n1200:    goals_dir = os.path.join(hermes_dir, \"belam-codex\", \"goals\")\n1205:    agents_dir = os.path.join(hermes_dir, \"belam-codex\", \"agents\")\n1210:    canvas_dir = os.path.join(hermes_dir, \"belam-codex\", \"canvas\")\n1215:    knowledge_dir = os.path.join(hermes_dir, \"belam-codex\", \"knowledge\")\n1220:    handoff_dir = os.path.join(hermes_dir, \"belam-codex\", \"handoff\")\n1225:    archive_dir = os.path.join(hermes_dir, \"belam-codex\", \"archive\")\n1226:    if os.path.isdir(archive_dir):\n1227:        builder.parse_archive_commands(archive_dir)\n1228:        builder.parse_archive_tasks(archive_dir)\n1252:def build_graph(hermes_dir: str, agi_dir: str, use_gitnexus: bool = True,\n1287:    agents_md = os.path.join(hermes_dir, \"belam-codex\", \"AGENTS.md\")\n1291:    memory_dir = os.path.join(hermes_dir, \"belam-codex\", \"memory\")\n1295:    schema_dir = os.path.join(hermes_dir, \"belam-codex\", \"schemas\")\n1299:    decisions_dir = os.path.join(hermes_dir, \"belam-codex\", \"decisions\")\n"}],"isError":false,"timestamp":1777537371778}}
{"type":"message","id":"da803ad1","parentId":"b997ed27","timestamp":"2026-04-30T08:22:56.682Z","message":{"role":"assistant","content":[{"type":"thinking","thinking":"Let me look at the _cached_build_builder and build_graph functions to understand how to add the new parser:","thinkingSignature":"c57f6375b23c339f6c4b074918fd3fa4c9fee5cc9a56950d45af898660db7021"},{"type":"toolCall","id":"call_function_gphf8ubphoeg_1","name":"read","arguments":{"path":"/home/ubuntu/.hermes/agi/graph_builder.py","offset":1155,"limit":80}}],"api":"anthropic-messages","provider":"minimax","model":"MiniMax-M2.7","usage":{"input":28603,"output":80,"cacheRead":10071,"cacheWrite":0,"totalTokens":38754,"cost":{"input":0.008580899999999999,"output":0.000096,"cacheRead":0.0006042599999999999,"cacheWrite":0,"total":0.00928116}},"stopReason":"toolUse","timestamp":1777537371779,"responseId":"0642445c4924384138c14798beeffbac"}}
{"type":"message","id":"e4915a40","parentId":"da803ad1","timestamp":"2026-04-30T08:22:56.684Z","message":{"role":"toolResult","toolCallId":"call_function_gphf8ubphoeg_1","toolName":"read","content":[{"type":"text","text":"            pickle.dump(cached, f, protocol=pickle.HIGHEST_PROTOCOL)\n    except Exception:\n        pass\n\n@lru_cache(maxsize=1)\ndef _cached_build_builder(hermes_dir: str, agi_dir: str, gitnexus_hash: int, _cache_ver: int = 1) -> GraphBuilder:\n    \"\"\"Cached builder internals — returns serializable parts only.\n    \n    lru_cache eliminates pickle.load entirely for warm calls.\n    gitnexus_hash is a cache-busting int derived from gitnexus content.\n    \"\"\"\n    # Initialize cache\n    init_cache(agi_dir)\n\n    # Build from sources\n    builder = GraphBuilder()\n\n    # Parse AGENTS.md\n    agents_md = os.path.join(hermes_dir, \"belam-codex\", \"AGENTS.md\")\n    builder.parse_agents_md(agents_md)\n\n    # Parse memory files (expanded to all 58)\n    memory_dir = os.path.join(hermes_dir, \"belam-codex\", \"memory\")\n    builder.parse_memory_files(memory_dir, limit=58)\n\n    # Parse schema files\n    schema_dir = os.path.join(hermes_dir, \"belam-codex\", \"schemas\")\n    builder.parse_schema_files(schema_dir)\n\n    # Parse decisions (all 128 files)\n    decisions_dir = os.path.join(hermes_dir, \"belam-codex\", \"decisions\")\n    if os.path.isdir(decisions_dir):\n        builder.parse_decisions(decisions_dir, limit=999)\n\n    # Parse lessons (all 208 files)\n    lessons_dir = os.path.join(hermes_dir, \"belam-codex\", \"lessons\")\n    if os.path.isdir(lessons_dir):\n        builder.parse_lessons(lessons_dir, limit=999)\n\n    # Parse tasks (all 84 files)\n    tasks_dir = os.path.join(hermes_dir, \"belam-codex\", \"tasks\")\n    if os.path.isdir(tasks_dir):\n        builder.parse_tasks(tasks_dir, limit=999)\n\n    # Parse goals (goal nodes with status/priority/urgency)\n    goals_dir = os.path.join(hermes_dir, \"belam-codex\", \"goals\")\n    if os.path.isdir(goals_dir):\n        builder.parse_goals(goals_dir)\n\n    # Parse agent roles (main, architect, builder, critic)\n    agents_dir = os.path.join(hermes_dir, \"belam-codex\", \"agents\")\n    if os.path.isdir(agents_dir):\n        builder.parse_agent_roles(agents_dir)\n\n    # Parse canvas graph (pre-computed cross-primitive causal edges)\n    canvas_dir = os.path.join(hermes_dir, \"belam-codex\", \"canvas\")\n    if os.path.isdir(canvas_dir):\n        builder.parse_canvas_graph(canvas_dir)\n\n    # Parse knowledge directory (semantic knowledge nodes with tag edges)\n    knowledge_dir = os.path.join(hermes_dir, \"belam-codex\", \"knowledge\")\n    if os.path.isdir(knowledge_dir):\n        builder.parse_knowledge(knowledge_dir)\n\n    # Parse handoff directory (agent handoff logs with TODO items)\n    handoff_dir = os.path.join(hermes_dir, \"belam-codex\", \"handoff\")\n    if os.path.isdir(handoff_dir):\n        builder.parse_handoff(handoff_dir)\n\n    # Parse archive/commands (38 command docs with upstream links to decision nodes)\n    archive_dir = os.path.join(hermes_dir, \"belam-codex\", \"archive\")\n    if os.path.isdir(archive_dir):\n        builder.parse_archive_commands(archive_dir)\n        builder.parse_archive_tasks(archive_dir)\n\n    # Process gitnexus cache\n    cache_to_use = None\n    gitnexus_cache_file = os.path.join(agi_dir, \".gitnexus_cache.json\")\n    if os.path.exists(gitnexus_cache_file):\n        try:\n\n[143 more lines in file. Use offset=1235 to continue.]"}],"isError":false,"timestamp":1777537376684}}
{"type":"message","id":"0577b43d","parentId":"e4915a40","timestamp":"2026-04-30T08:23:02.009Z","message":{"role":"assistant","content":[{"type":"thinking","thinking":"Now I have a clear picture. I need to:\n1. Add a `parse_codex_modules` method to the GraphBuilder class\n2. Call it from `_cached_build_builder` \n3. Increment the `_cache_ver`\n\nLet me look at where the archive parsing is called and add the new parser there. Also, I need to increment the cache version to bust the stale cache.","thinkingSignature":"8460a4202c2e273168762acb379fdc9c6dc1f322eaebcc2b3516aabe9dd68a60"},{"type":"text","text":"Now I'll add the codex module parser. Let me find the exact location to insert it:\n"},{"type":"toolCall","id":"call_function_emmljtkh2s5v_1","name":"read","arguments":{"path":"/home/ubuntu/.hermes/agi/graph_builder.py","offset":989,"limit":30}}],"api":"anthropic-messages","provider":"minimax","model":"MiniMax-M2.7","usage":{"input":29523,"output":155,"cacheRead":10071,"cacheWrite":0,"totalTokens":39749,"cost":{"input":0.0088569,"output":0.000186,"cacheRead":0.0006042599999999999,"cacheWrite":0,"total":0.00964716}},"stopReason":"toolUse","timestamp":1777537376686,"responseId":"0642446150124452e3c6874aad0c2351"}}
{"type":"message","id":"a37fe859","parentId":"0577b43d","timestamp":"2026-04-30T08:23:02.010Z","message":{"role":"toolResult","toolCallId":"call_function_emmljtkh2s5v_1","toolName":"read","content":[{"type":"text","text":"                        if target_file in task_ids:\n                            self.add_edge(node_id, task_ids[target_file], \"downstream\")\n                            count += 1\n\n                # Tag-based relates_to edges\n                if tags_str and tags_str != '[]':\n                    tags = re.findall(r'\\w+', tags_str)\n                    for tag in tags[:5]:\n                        tag_node_id = f\"tag_{tag}\"\n                        if tag_node_id not in self._node_ids:\n                            self.add_node(\"tag\", tag, \"\", f\"archive/tasks/{filename}\", tag_node_id)\n                        self.add_edge(node_id, tag_node_id, \"tagged_with\")\n                        count += 1\n\n            except Exception:\n                pass\n        return count\n\n    def build_adjacency(self):\n        \"\"\"Build adjacency dict from edges.\"\"\"\n        self.adj = defaultdict(list)\n        for edge in self.edges:\n            if edge[\"from\"] in self._node_ids and edge[\"to\"] in self._node_ids:\n                self.adj[edge[\"from\"]].append(edge[\"to\"])\n                self.adj[edge[\"to\"]].append(edge[\"from\"])\n        # Pre-compute key paths for benchmark query (first→last section)\n        self._precompute_key_paths()\n\n    def _precompute_key_paths(self):\n        \"\"\"Pre-compute BFS paths between key node pairs for O(1) query_time.\n\n[359 more lines in file. Use offset=1019 to continue.]"}],"isError":false,"timestamp":1777537382010}}
