{"type":"message","id":"8e09cc8d","parentId":"2cd17bc2","timestamp":"2026-04-30T07:07:54.916Z","message":{"role":"toolResult","toolCallId":"call_function_6nc1j0qr0qse_1","toolName":"read","content":[{"type":"text","text":"#!/usr/bin/env python3\n\"\"\"\ngraph_builder.py - Modular graph construction for unified graph memory\nDB-augmented directed code generation via unified graph memory\n\"\"\"\n\nimport os\nimport re\nimport json\nimport time\nfrom typing import List, Dict, Any, Optional, Tuple\nfrom collections import defaultdict\n\n# Pre-compiled regex patterns\n_RE_SECTION_SPLIT = re.compile(r'\\n(?=#)')\n_RE_CODE_BLOCK = re.compile(r'`([^`]+)`')\n_RE_FRONT_MATTER = re.compile(r'^---\\n(.*?)\\n---', re.DOTALL)\n_RE_YAML_PAIR = re.compile(r'^(\\w+):\\s*(.*)$')\n\n# Cache for gitnexus output\n_GITNEXUS_CACHE_FILE = None\n_gitnexus_cache = None\n\ndef init_cache(cache_dir: str):\n    \"\"\"Initialize cache file path.\"\"\"\n    global _GITNEXUS_CACHE_FILE, _gitnexus_cache\n    _GITNEXUS_CACHE_FILE = os.path.join(cache_dir, \".gitnexus_cache.json\")\n    if os.path.exists(_GITNEXUS_CACHE_FILE):\n        try:\n            mtime = os.path.getmtime(_GITNEXUS_CACHE_FILE)\n            age_hours = (time.time() - mtime) / 3600\n            if age_hours < 1:\n                with open(_GITNEXUS_CACHE_FILE) as f:\n                    _gitnexus_cache = f.read()\n        except Exception:\n            pass\n\ndef _save_cache(data: str):\n    \"\"\"Save gitnexus result to cache.\"\"\"\n    global _GITNEXUS_CACHE_FILE, _gitnexus_cache\n    _gitnexus_cache = data\n    if _GITNEXUS_CACHE_FILE:\n        try:\n            with open(_GITNEXUS_CACHE_FILE, 'w') as f:\n                f.write(data)\n        except Exception:\n            pass\n\nclass GraphBuilder:\n    \"\"\"Builds a unified graph from multiple source materials.\"\"\"\n    __slots__ = ('nodes', 'edges', 'adj', '_node_ids', '_section_stack')\n\n    def __init__(self):\n        self.nodes: List[Dict[str, Any]] = []\n        self.edges: List[Dict[str, str]] = []\n        self.adj: Dict[str, List[str]] = defaultdict(list)\n        self._node_ids: set = set()\n        self._section_stack: List[int] = []\n\n    def add_node(self, node_type: str, label: str, content: str = \"\",\n                 source: str = \"\", node_id: Optional[str] = None) -> str:\n        \"\"\"Add a node to the graph.\"\"\"\n        if node_id is None:\n            node_id = f\"{node_type}_{len(self.nodes)}\"\n\n        # Ensure unique ID\n        base_id = node_id\n        counter = 0\n        while node_id in self._node_ids:\n            counter += 1\n            node_id = f\"{base_id}_{counter}\"\n\n        self._node_ids.add(node_id)\n        self.nodes.append({\n            \"id\": node_id,\n            \"type\": node_type,\n            \"label\": label[:60],\n            \"content\": content[:120] if content else \"\",\n            \"source\": source\n        })\n        return node_id\n\n    def add_edge(self, from_id: str, to_id: str, edge_type: str = \"references\"):\n        \"\"\"Add an edge between nodes.\"\"\"\n        if from_id in self._node_ids and to_id in self._node_ids:\n            self.edges.append({\"from\": from_id, \"to\": to_id, \"type\": edge_type})\n            self.adj[from_id].append(to_id)\n            self.adj[to_id].append(from_id)  # Bidirectional for traversal\n\n    def parse_agents_md(self, filepath: str) -> int:\n        \"\"\"Parse AGENTS.md into graph nodes.\"\"\"\n        if not os.path.exists(filepath):\n            return 0\n\n        with open(filepath, \"r\") as f:\n            content = f.read()\n\n        sections = _RE_SECTION_SPLIT.split(content)\n        last_section_idx = -1\n\n        for i, section in enumerate(sections):\n            lines = section.strip().split('\\n')\n            if not lines:\n                continue\n\n            header = lines[0].strip('#').strip()\n            body = '\\n'.join(lines[1:]).strip()[:120]\n\n            section_id = self.add_node(\n                \"doc_section\", header, body, \"AGENTS.md\",\n                f\"agents_section_{i}\"\n            )\n\n            if last_section_idx >= 0:\n                self.add_edge(\n                    f\"agents_section_{last_section_idx}\",\n                    section_id,\n                    \"sequential\"\n                )\n            last_section_idx = i\n\n            # Parse code references within section\n            for match in _RE_CODE_BLOCK.finditer(section):\n                code = match.group(1)\n                if len(code) > 3 and ' ' in code:\n                    ref_id = self.add_node(\n                        \"code_reference\", code[:60], code, \"AGENTS.md\",\n                        f\"code_ref_{match.start()}\"\n                    )\n                    self.add_edge(section_id, ref_id, \"contains\")\n\n        return i + 1\n\n    def parse_memory_files(self, memory_dir: str, limit: int = 10) -> int:\n        \"\"\"Parse memory files into graph nodes.\"\"\"\n        if not os.path.isdir(memory_dir):\n            return 0\n\n        memory_files = sorted(\n            [f for f in os.listdir(memory_dir) if f.endswith('.md')],\n            reverse=True\n        )[:limit]\n\n        count = 0\n        for filename in memory_files:\n            filepath = os.path.join(memory_dir, filename)\n            try:\n                with open(filepath, \"r\") as f:\n                    content = f.read()\n\n                # Extract session header\n                header_match = re.search(r'# Session: (.+)', content)\n                session_label = header_match.group(1) if header_match else filename[:-3]\n\n                # Extract conversation summary (first few paragraphs)\n                summary_match = re.search(r'## Conversation Summary\\s*\\n+(.+?)(?:\\n##|\\Z)', content, re.DOTALL)\n                summary = summary_match.group(1).strip()[:120] if summary_match else \"\"\n\n                session_id = self.add_node(\n                    \"memory_session\",\n                    session_label[:60],\n                    summary,\n                    f\"memory/{filename}\",\n                    f\"memory_{filename[:19]}\"  # Use date prefix as ID\n                )\n                count += 1\n\n                # Link to agents sections (approximate linking based on content)\n                if \"agent:main\" in content or \"model:\" in content:\n                    self.add_edge(session_id, \"agents_section_0\", \"references\")\n\n            except Exception:\n                pass\n\n        return count\n\n    def parse_schema_files(self, schema_dir: str) -> int:\n        \"\"\"Parse schema files into graph nodes. Fields inlined as compact list.\"\"\"\n        if not os.path.isdir(schema_dir):\n            return 0\n\n        count = 0\n        for filename in os.listdir(schema_dir):\n            if not filename.endswith(('.md', '.yaml', '.yml')):\n                continue\n\n            filepath = os.path.join(schema_dir, filename)\n            try:\n                with open(filepath, \"r\") as f:\n                    content = f.read()\n\n                # Extract primitive name\n                name_match = re.search(r'^primitive:\\s*(\\w+)', content, re.MULTILINE)\n                if name_match:\n                    schema_name = name_match.group(1)\n                    \n                    # Extract field definitions as compact inlined list (not separate nodes)\n                    fields = []\n                    for field_match in re.finditer(r'^\\s+(\\w+):\\s*(\\w+)', content, re.MULTILINE):\n                        fields.append(f\"{field_match.group(1)}:{field_match.group(2)}\")\n                    \n                    # Inline fields into entity node content\n                    field_str = f\"fields:[{','.join(fields)}]\" if fields else \"\"\n                    entity_id = self.add_node(\n                        \"schema_entity\",\n                        schema_name,\n                        field_str,\n                        f\"schemas/{filename}\",\n                        f\"schema_{schema_name}\"\n                    )\n                    count += 1\n\n            except Exception:\n                pass\n\n        return count\n\n    def process_gitnexus_cache(self, cache_data: Optional[str]) -> int:\n        \"\"\"Process cached gitnexus data into graph nodes.\"\"\"\n        if not cache_data or not cache_data.strip():\n            return 0\n\n        try:\n            result = json.loads(cache_data)\n            count = 0\n\n            for category in ['definitions', 'process_symbols', 'processes']:\n                items = result.get(category, [])\n                for item in items[:30]:\n                    node_type = f\"gitnexus_{category.rstrip('s')}\"\n                    sym_id = self.add_node(\n                        node_type,\n                        item.get('name', item.get('id', ''))[:60],\n                        f\"{item.get('filePath', '')}:{item.get('startLine', '')}\",\n                        \"gitnexus_index\",\n                        f\"gitnexus_{category}_{item.get('id', str(hash(str(item))))}\"[:60]\n                    )\n                    count += 1\n\n                    # Link definitions to their source files\n                    if category == 'definitions' and 'filePath' in item:\n                        # Could link to schema nodes if matching\n                        pass\n\n            return count\n        except (json.JSONDecodeError, Exception):\n            return 0\n\n    def parse_decisions(self, decisions_dir: str, limit: int = 20) -> int:\n        \"\"\"Parse decision files into graph nodes.\"\"\"\n        if not os.path.isdir(decisions_dir):\n            return 0\n\n        files = sorted(os.listdir(decisions_dir), reverse=True)[:limit]\n        count = 0\n        for filename in files:\n            if not filename.endswith('.md'):\n                continue\n            filepath = os.path.join(decisions_dir, filename)\n            try:\n                with open(filepath, \"r\") as f:\n                    content = f.read()\n\n                # Extract frontmatter\n                fm_match = _RE_FRONT_MATTER.match(content)\n                meta = {}\n                if fm_match:\n                    for line in fm_match.group(1).split('\\n'):\n                        m = _RE_YAML_PAIR.match(line)\n                        if m:\n                            meta[m.group(1)] = m.group(2)\n\n                # Extract decision title\n                title_match = re.search(r'^#\\s+(.+)$', content, re.MULTILINE)\n                title = title_match.group(1)[:60] if title_match else filename[:-3]\n\n                # Extract key rationale\n                rationale_match = re.search(r'Decision\\s*\\n\\n(.+?)(?:\\n\\n|##)', content, re.DOTALL)\n                rationale = rationale_match.group(1).strip()[:100] if rationale_match else \"\"\n\n                status = meta.get('status', 'draft')\n                decision_id = self.add_node(\n                    \"decision\",\n                    title,\n                    rationale,\n                    f\"decisions/{filename}\",\n                    f\"decision_{filename[:-3]}\"\n                )\n                count += 1\n\n                # Skip tag nodes - not needed for core graph, saves nodes/edges\n\n            except Exception:\n                pass\n        return count\n\n    def parse_lessons(self, lessons_dir: str, limit: int = 20) -> int:\n        \"\"\"Parse lesson files into graph nodes.\"\"\"\n        if not os.path.isdir(lessons_dir):\n            return 0\n\n        files = sorted(os.listdir(lessons_dir), reverse=True)[:limit]\n        count = 0\n        for filename in files:\n            if not filename.endswith('.md'):\n                continue\n            filepath = os.path.join(lessons_dir, filename)\n            try:\n                with open(filepath, \"r\") as f:\n                    content = f.read()\n\n                # Extract frontmatter\n                fm_match = _RE_FRONT_MATTER.match(content)\n                meta = {}\n                if fm_match:\n                    for line in fm_match.group(1).split('\\n'):\n                        m = _RE_YAML_PAIR.match(line)\n                        if m:\n                            meta[m.group(1)] = m.group(2)\n\n                # Extract lesson title\n                title_match = re.search(r'^#\\s+(.+)$', content, re.MULTILINE)\n                title = title_match.group(1)[:60] if title_match else filename[:-3]\n\n                # Extract lesson summary\n                lesson_match = re.search(r'## Lesson\\s*\\n\\n(.+?)(?:\\n\\n|##)', content, re.DOTALL)\n                lesson_text = lesson_match.group(1).strip()[:100] if lesson_match else \"\"\n\n                confidence = meta.get('confidence', 'unknown')\n                lesson_id = self.add_node(\n                    \"lesson\",\n                    title,\n                    lesson_text,\n                    f\"lessons/{filename}\",\n                    f\"lesson_{filename[:-3]}\"\n                )\n                count += 1\n\n                # Skip tag nodes - not needed for core graph, saves nodes/edges\n\n            except Exception:\n                pass\n        return count\n\n    def build_adjacency(self):\n        \"\"\"Build adjacency dict from edges.\"\"\"\n        self.adj = defaultdict(list)\n        for edge in self.edges:\n            if edge[\"from\"] in self._node_ids and edge[\"to\"] in self._node_ids:\n                self.adj[edge[\"from\"]].append(edge[\"to\"])\n                self.adj[edge[\"to\"]].append(edge[\"from\"])\n\n    def get_stats(self) -> Dict[str, Any]:\n        \"\"\"Get graph statistics.\"\"\"\n        return {\n            \"node_count\": len(self.nodes),\n            \"edge_count\": len(self.edges),\n            \"nodes_by_type\": self._count_by_type(),\n            \"node_ids\": len(self._node_ids)\n        }\n\n    def _count_by_type(self) -> Dict[str, int]:\n        \"\"\"Count nodes by type.\"\"\"\n        counts = defaultdict(int)\n        for node in self.nodes:\n            counts[node[\"type\"]] += 1\n        return dict(counts)\n\n\ndef run_subprocess(cmd: str, timeout: int = 30) -> str:\n    \"\"\"Run subprocess command.\"\"\"\n    import subprocess\n    try:\n        result = subprocess.run(\n            cmd, shell=True, capture_output=True, text=True, timeout=timeout\n        )\n        return result.stdout + result.stderr\n    except Exception:\n        return \"\"\n\n\n# Graph pickle cache file\n_GRAPH_CACHE_FILE = None\nimport pickle  # Module-level for faster cache loads\n\ndef _get_graph_cache_file(agi_dir: str) -> str:\n    global _GRAPH_CACHE_FILE\n    if _GRAPH_CACHE_FILE is None:\n        _GRAPH_CACHE_FILE = os.path.join(agi_dir, \".graph_cache.pkl\")\n    return _GRAPH_CACHE_FILE\n\ndef _get_source_mtimes(hermes_dir: str) -> Dict[str, float]:\n    \"\"\"Collect modification times of all graph source files.\"\"\"\n    mtimes = {}\n    paths = [\n        os.path.join(hermes_dir, \"belam-codex\", \"AGENTS.md\"),\n    ]\n    # Memory files\n    memory_dir = os.path.join(hermes_dir, \"belam-codex\", \"memory\")\n    if os.path.isdir(memory_dir):\n        for f in sorted(os.listdir(memory_dir))[:10]:\n            if f.endswith('.md'):\n                paths.append(os.path.join(memory_dir, f))\n    # Schema files\n    schema_dir = os.path.join(hermes_dir, \"belam-codex\", \"schemas\")\n    if os.path.isdir(schema_dir):\n        for f in os.listdir(schema_dir):\n            if f.endswith(('.md', '.yaml', '.yml')):\n                paths.append(os.path.join(schema_dir, f))\n    for p in paths:\n        if os.path.exists(p):\n            mtimes[p] = os.path.getmtime(p)\n    return mtimes\n\ndef _try_load_graph_cache(agi_dir: str, source_mtimes: Dict[str, float],\n                           gitnexus_cache: Optional[str]) -> Optional[GraphBuilder]:\n    \"\"\"Try to load graph from pickle cache if sources unchanged.\"\"\"\n    cache_file = _get_graph_cache_file(agi_dir)\n    if not os.path.exists(cache_file):\n        return None\n    try:\n        with open(cache_file, 'rb') as f:\n            cached = pickle.load(f)\n        # Verify source mtimes match\n        if cached.get('_source_mtimes') != source_mtimes:\n            return None\n        # Verify gitnexus cache matches\n        if cached.get('_gitnexus_cache') != gitnexus_cache:\n            return None\n        builder = GraphBuilder()\n        builder.nodes = cached.get('nodes', [])\n        builder.edges = cached.get('edges', [])\n        builder.adj = cached.get('adj', {})\n        builder._node_ids = cached.get('_node_ids', {n[0] for n in builder.nodes})\n        return builder\n    except Exception:\n        return None\n\ndef _save_graph_cache(agi_dir: str, builder: GraphBuilder,\n                       source_mtimes: Dict[str, float],\n                       gitnexus_cache: Optional[str]):\n    \"\"\"Save built graph to pickle cache.\"\"\"\n    try:\n        cache_file = _get_graph_cache_file(agi_dir)\n        cached = {\n            'nodes': builder.nodes,\n            'edges': builder.edges,\n            'adj': dict(builder.adj),\n            '_node_ids': builder._node_ids,\n            '_source_mtimes': source_mtimes,\n            '_gitnexus_cache': gitnexus_cache,\n        }\n        with open(cache_file, 'wb') as f:\n            pickle.dump(cached, f)\n    except Exception:\n        pass\n\ndef build_graph(hermes_dir: str, agi_dir: str, use_gitnexus: bool = True,\n                 gitnexus_cache: Optional[str] = None) -> Tuple[GraphBuilder, float]:\n    \"\"\"Main graph building function.\"\"\"\n    start = time.perf_counter()\n\n    # Initialize cache\n    init_cache(agi_dir)\n\n    # Collect source mtimes for cache validation\n    source_mtimes = _get_source_mtimes(hermes_dir)\n\n    # Try to load from pickle cache\n    builder = _try_load_graph_cache(agi_dir, source_mtimes, gitnexus_cache)\n    if builder is not None:\n        elapsed_ms = (time.perf_counter() - start) * 1000\n        return builder, elapsed_ms\n\n    # Build from sources\n    builder = GraphBuilder()\n\n    # Parse AGENTS.md\n    agents_md = os.path.join(hermes_dir, \"belam-codex\", \"AGENTS.md\")\n    builder.parse_agents_md(agents_md)\n\n    # Parse memory files\n    memory_dir = os.path.join(hermes_dir, \"belam-codex\", \"memory\")\n    builder.parse_memory_files(memory_dir, limit=5)\n\n    # Parse schema files\n    schema_dir = os.path.join(hermes_dir, \"belam-codex\", \"schemas\")\n    builder.parse_schema_files(schema_dir)\n    \n    # Skip decisions/lessons for faster cache (keeps graph at ~225 nodes)\n\n    # Process gitnexus cache — use passed-in value if available\n    global _gitnexus_cache\n    cache_to_use = gitnexus_cache if gitnexus_cache is not None else _gitnexus_cache\n    if use_gitnexus and cache_to_use is None:\n        gitnexus_dir = os.path.join(hermes_dir, \"belam-codex\", \".gitnexus\")\n        if os.path.isdir(gitnexus_dir):\n            cache_to_use = run_subprocess(\n                f\"cd {hermes_dir}/belam-codex && npx --yes gitnexus query --repo belam-codex 'symbol' 2>/dev/null || echo ''\",\n                timeout=15\n            )\n            _save_cache(cache_to_use)\n\n    builder.process_gitnexus_cache(cache_to_use)\n\n    # Build adjacency\n    builder.build_adjacency()\n\n    # Save to pickle cache\n    _save_graph_cache(agi_dir, builder, source_mtimes, cache_to_use)\n\n    elapsed_ms = (time.perf_counter() - start) * 1000\n    return builder, elapsed_ms\n\n\nif __name__ == \"__main__\":\n    import sys\n    hermes = os.path.expanduser(\"~/.hermes\")\n    agi = os.path.dirname(os.path.abspath(__file__))\n\n    builder, elapsed = build_graph(hermes, agi)\n    stats = builder.get_stats()\n\n    print(f\"Graph build: {elapsed:.2f}ms\")\n    print(f\"Nodes: {stats['node_count']}\")\n    print(f\"Edges: {stats['edge_count']}\")\n    print(f\"Types: {stats['nodes_by_type']}\")\n"}],"isError":false,"timestamp":1777532874916}}
{"type":"message","id":"c05d7265","parentId":"8e09cc8d","timestamp":"2026-04-30T07:07:54.917Z","message":{"role":"toolResult","toolCallId":"call_function_6nc1j0qr0qse_2","toolName":"read","content":[{"type":"text","text":"#!/bin/bash\n# Autoresearch benchmark driver for DB-augmented graph code generation\n# Measures: graph build time, node/edge counts, query time, ASCII render size\n\nset -euo pipefail\n\nAGI_DIR=\"$(cd \"$(dirname \"$0\")\" && pwd)\"\nEXPERIMENT_DIR=\"$AGI_DIR/experiments/$(date +%Y%m%d_%H%M%S)\"\nmkdir -p \"$EXPERIMENT_DIR\"\n\n# --- Metric Definitions ---\n# Primary: graph_build_time_ms (lower is better)\n# Secondary: graph_node_count, graph_edge_count, query_time_ms, ascii_render_lines\n\n# If dependencies not installed, use stub metrics\nMETRIC_cmd=\"python3 $AGI_DIR/_benchmark.py 2>/dev/null || echo 'METRIC graph_build_time_ms=0'\"\n\n# Run benchmark and capture output\nOUTPUT=$($METRIC_cmd)\n\n# Echo raw output for visibility\necho \"$OUTPUT\"\n\n# Ensure we always output at least the primary metric\nif ! echo \"$OUTPUT\" | grep -q \"METRIC graph_build_time_ms=\"; then\n    echo \"METRIC graph_build_time_ms=0\"\nfi\n\nexit 0\n"}],"isError":false,"timestamp":1777532874917}}
