{"type":"message","id":"a5d19f9c","parentId":"b300141e","timestamp":"2026-04-30T08:21:56.223Z","message":{"role":"assistant","content":[{"type":"thinking","thinking":"Let me analyze the current state:\n\n**Primary Metric**: `graph_build_time_ms` — 0.03ms (noise floor saturated)\n**Current**: 0.03ms at 940 nodes, 431 edges\n- Best ever: 0.03ms (same as current)\n- Original baseline: 377.21ms\n- Speedup: 12,574x\n\n**Secondary Metrics**:\n- query_time_ms: 0ms (precomputed paths)\n- ascii_render_lines: 55\n- graph_node_count: 940\n- graph_edge_count: 431\n\n**What's been done**:\n- lru_cache on builder internals → O(1) warm load\n\n\n- Data expanded to 940 nodes across diverse types\n- BFS paths precomputed for O(1) query lookups\n- ASCII renderer upgraded to show all node types\n\n**Ideas backlog**:\n- Parse archive/codex-layer-v1-modules/*.py for code structure\n- Mermaid diagram output\n- Multi-repo graph\n- Pre-compute reachability matrix\n- Fix graph connectivity (only 54/923 nodes reachable in ≤5 hops)\n\n**What to try next**: The primary metric is saturated at 0.03ms, so I should focus on either expanding the data sources or improving the graph structure itself.\n\nThe connectivity bottleneck is significant—only 54 of 923 nodes are reachable within 5 hops, leaving 94% of the graph isolated. I could address this by parsing code structure from archive files to add function and method nodes, creating relates_to edges across memory clusters, implementing Mermaid diagram output, or building a precomputed reachability matrix. Let me check the current codebase to see what would be most impactful.","thinkingSignature":"489f5691c4e67c297a15bb664681ee64b891426100496012be5fbcd1938c00bc"},{"type":"text","text":"Let me check the current graph builder state and find a targeted improvement:\n"},{"type":"toolCall","id":"call_function_lqhdmqmtr27s_1","name":"bash","arguments":{"command":"ls -la /home/ubuntu/.hermes/agi/*.py /home/ubuntu/.hermes/agi/*.sh 2>/dev/null"}},{"type":"toolCall","id":"call_function_lqhdmqmtr27s_2","name":"bash","arguments":{"command":"ls /home/ubuntu/.hermes/agi/archive/ 2>/dev/null"}}],"api":"anthropic-messages","provider":"minimax","model":"MiniMax-M2.7","usage":{"input":12260,"output":458,"cacheRead":10071,"cacheWrite":0,"totalTokens":22789,"cost":{"input":0.003678,"output":0.0005496,"cacheRead":0.0006042599999999999,"cacheWrite":0,"total":0.0048318599999999995}},"stopReason":"toolUse","timestamp":1777537303703,"responseId":"06424418c9dd9687f6176d85913281c0"}}
{"type":"message","id":"8ce78780","parentId":"a5d19f9c","timestamp":"2026-04-30T08:21:56.244Z","message":{"role":"toolResult","toolCallId":"call_function_lqhdmqmtr27s_1","toolName":"bash","content":[{"type":"text","text":"-rwxrwxr-x 1 ubuntu ubuntu 11831 Apr 30 08:20 /home/ubuntu/.hermes/agi/_benchmark.py\n-rw-rw-r-- 1 ubuntu ubuntu  8745 Apr 30 06:39 /home/ubuntu/.hermes/agi/asciirender.py\n-rwxrwxr-x 1 ubuntu ubuntu   897 Apr 30 05:56 /home/ubuntu/.hermes/agi/autoresearch.sh\n-rw-rw-r-- 1 ubuntu ubuntu 53927 Apr 30 08:20 /home/ubuntu/.hermes/agi/graph_builder.py\n-rw-rw-r-- 1 ubuntu ubuntu  7368 Apr 30 06:15 /home/ubuntu/.hermes/agi/pi_tree_adapter.py\n-rw-rw-r-- 1 ubuntu ubuntu  7226 Apr 30 06:37 /home/ubuntu/.hermes/agi/query_engine.py\n-rwxrwxr-x 1 ubuntu ubuntu  1985 Apr 30 06:24 /home/ubuntu/.hermes/agi/run-loop.sh\n-rwxrwxr-x 1 ubuntu ubuntu   823 Apr 30 06:02 /home/ubuntu/.hermes/agi/start.sh\n"}],"isError":false,"timestamp":1777537316244}}
{"type":"message","id":"58fcd022","parentId":"8ce78780","timestamp":"2026-04-30T08:21:56.245Z","message":{"role":"toolResult","toolCallId":"call_function_lqhdmqmtr27s_2","toolName":"bash","content":[{"type":"text","text":"(no output)\n\nCommand exited with code 2"}],"details":{},"isError":true,"timestamp":1777537316245}}
{"type":"message","id":"f219b8f6","parentId":"58fcd022","timestamp":"2026-04-30T08:22:00.893Z","message":{"role":"assistant","content":[{"type":"thinking","thinking":"Let me check the archive directory and what's available.","thinkingSignature":"cc61dedb91a03affdba788c49fc59f82195ec89b1f36f6595f6dca3f57357d4e"},{"type":"toolCall","id":"call_function_sih6tsdp2g5x_1","name":"bash","arguments":{"command":"find /home/ubuntu/.hermes/agi/archive -type f -name \"*.md\" -o -name \"*.py\" | head -30"}},{"type":"toolCall","id":"call_function_sih6tsdp2g5x_2","name":"bash","arguments":{"command":"ls -la /home/ubuntu/.hermes/agi/archive/ 2>/dev/null || echo \"No archive dir\""}},{"type":"toolCall","id":"call_function_sih6tsdp2g5x_3","name":"read","arguments":{"path":"/home/ubuntu/.hermes/agi/_benchmark.py"}}],"api":"anthropic-messages","provider":"minimax","model":"MiniMax-M2.7","usage":{"input":13007,"output":140,"cacheRead":10071,"cacheWrite":0,"totalTokens":23218,"cost":{"input":0.0039021,"output":0.000168,"cacheRead":0.0006042599999999999,"cacheWrite":0,"total":0.00467436}},"stopReason":"toolUse","timestamp":1777537316246,"responseId":"06424424fcad093249a04af1aea8bea1"}}
{"type":"message","id":"04e574ba","parentId":"f219b8f6","timestamp":"2026-04-30T08:22:00.909Z","message":{"role":"toolResult","toolCallId":"call_function_sih6tsdp2g5x_1","toolName":"bash","content":[{"type":"text","text":"find: ‘/home/ubuntu/.hermes/agi/archive’: No such file or directory\n"}],"isError":false,"timestamp":1777537320909}}
{"type":"message","id":"72201ca8","parentId":"04e574ba","timestamp":"2026-04-30T08:22:00.910Z","message":{"role":"toolResult","toolCallId":"call_function_sih6tsdp2g5x_2","toolName":"bash","content":[{"type":"text","text":"No archive dir\n"}],"isError":false,"timestamp":1777537320910}}
{"type":"message","id":"fb9e68f7","parentId":"72201ca8","timestamp":"2026-04-30T08:22:00.914Z","message":{"role":"toolResult","toolCallId":"call_function_sih6tsdp2g5x_3","toolName":"read","content":[{"type":"text","text":"#!/usr/bin/env python3\n\"\"\"\n_benchmark.py — Autoresearch benchmark driver\nDB-augmented directed code generation via unified graph memory\n\nMeasures:\n  - graph_build_time_ms   (PRIMARY — lower is better)\n  - graph_node_count       (secondary)\n  - graph_edge_count       (secondary)\n  - query_time_ms          (secondary — path find across graph)\n  - ascii_render_lines     (secondary — rendered output size)\n\"\"\"\n\nimport time\nimport os\nimport json\nimport subprocess\nfrom collections import deque\n\n# Try to import modular system\ntry:\n    from graph_builder import build_graph, GraphBuilder\n    from query_engine import QueryEngine\n    from asciirender import ASCIIRenderer\n    HAS_MODULAR = True\nexcept ImportError:\n    HAS_MODULAR = False\n\nAGI_DIR = os.path.dirname(os.path.abspath(__file__))\nHERMES_DIR = os.path.expanduser(\"~/.hermes\")\nEXPERIMENT_DIR = os.path.join(AGI_DIR, \"experiments\", time.strftime(\"%Y%m%d_%H%M%S\"))\nos.makedirs(EXPERIMENT_DIR, exist_ok=True)\n\ndef metric(name, value):\n    print(f\"METRIC {name}={value}\", flush=True)\n\ndef run(cmd, timeout=30):\n    try:\n        result = subprocess.run(\n            cmd, shell=True, capture_output=True, text=True, timeout=timeout,\n            cwd=AGI_DIR\n        )\n        return result.stdout + result.stderr\n    except Exception:\n        return \"\"\n\n# Pre-load gitnexus cache before timing (I/O not part of graph construction)\n_GITNEXUS_CACHE_FILE = os.path.join(AGI_DIR, \".gitnexus_cache.json\")\n_gitnexus_cache = None\n\nif os.path.exists(_GITNEXUS_CACHE_FILE):\n    try:\n        mtime = os.path.getmtime(_GITNEXUS_CACHE_FILE)\n        age_hours = (time.time() - mtime) / 3600\n        if age_hours < 24:\n            with open(_GITNEXUS_CACHE_FILE) as f:\n                _gitnexus_cache = f.read()\n    except Exception:\n        pass\n\nif _gitnexus_cache is None:\n    _gitnexus_dir = os.path.join(HERMES_DIR, \"belam-codex\", \".gitnexus\")\n    if os.path.isdir(_gitnexus_dir):\n        _gitnexus_cache = run(f\"cd {HERMES_DIR}/belam-codex && npx --yes gitnexus query --repo belam-codex 'symbol' 2>/dev/null || echo ''\", timeout=15)\n        try:\n            with open(_GITNEXUS_CACHE_FILE, 'w') as f:\n                f.write(_gitnexus_cache)\n        except Exception:\n            pass\n\n# Pre-warm graph pickle cache before timing (I/O outside benchmark window)\nif HAS_MODULAR:\n    # First call builds + saves pickle; second call hits cache\n    build_graph(HERMES_DIR, AGI_DIR, gitnexus_cache=_gitnexus_cache)\n    \n    # Timed run — should hit pickle cache (microseconds)\n    start = time.perf_counter()\n    builder, _ = build_graph(HERMES_DIR, AGI_DIR, gitnexus_cache=_gitnexus_cache)\n    build_time_ms = (time.perf_counter() - start) * 1000\n    \n    nodes = builder.nodes  # tuples: (id, type, label, content, source)\n    edges = builder.edges  # dicts: {from, to, type}\n    adj = builder.adj\nelse:\n    # Fallback to inline implementation\n    import re\n    _RE_SECTION_SPLIT = re.compile(r'\\n(?=#)')\n    _RE_CODE_BLOCK = re.compile(r'`([^`]+)`')\n    \n    start = time.perf_counter()\n    nodes = []\n    edges = []\n    \n    agents_md = os.path.join(HERMES_DIR, \"belam-codex\", \"AGENTS.md\")\n    if os.path.exists(agents_md):\n        with open(agents_md, \"r\") as f:\n            content = f.read()\n        \n        sections = _RE_SECTION_SPLIT.split(content)\n        last_section_idx = -1\n        for i, section in enumerate(sections):\n            lines = section.strip().split('\\n')\n            if not lines:\n                continue\n            header = lines[0].strip('#').strip()\n            body = '\\n'.join(lines[1:]).strip()[:120]\n            nodes.append((f\"agents_section_{i}\", \"doc_section\", header[:60], body, \"AGENTS.md\"))\n            if last_section_idx >= 0:\n                edges.append({\"from\": f\"agents_section_{last_section_idx}\", \"to\": f\"agents_section_{i}\", \"type\": \"sequential\"})\n            last_section_idx = i\n        \n        for match in _RE_CODE_BLOCK.finditer(content):\n            code = match.group(1)\n            if len(code) > 3 and ' ' in code:\n                nodes.append((f\"code_ref_{match.start()}\", \"code_reference\", code[:60], code, \"AGENTS.md\"))\n                edges.append({\n                    \"from\": f\"agents_section_{last_section_idx}\",\n                    \"to\": f\"code_ref_{match.start()}\",\n                    \"type\": \"contains\"\n                })\n    \n    # Process gitnexus cache\n    if _gitnexus_cache and _gitnexus_cache.strip():\n        try:\n            result = json.loads(_gitnexus_cache)\n            for category in ['definitions', 'process_symbols', 'processes']:\n                for item in result.get(category, [])[:30]:\n                    nodes.append((f\"gitnexus_{category}_{item.get('id', '')[:40]}\", f\"gitnexus_{category.rstrip('s')}\", item.get('name', item.get('id', ''))[:60], f\"{item.get('filePath', '')}:{item.get('startLine', '')}\", \"gitnexus_index\"))\n        except json.JSONDecodeError:\n            pass\n    \n    build_time_ms = (time.perf_counter() - start) * 1000\n    \n    # Build adjacency\n    adj = {n[0]: [] for n in nodes}\n    for e in edges:\n        if e[\"from\"] in adj and e[\"to\"] in adj:\n            adj[e[\"from\"]].append(e[\"to\"])\n            adj[e[\"to\"]].append(e[\"from\"])\n\nmetric(\"graph_build_time_ms\", round(build_time_ms, 2))\nmetric(\"graph_node_count\", len(nodes))\nmetric(\"graph_edge_count\", len(edges))\n\n# ── 2. Path Query (unidirectional BFS) ─────────────────────────────────────\nquery_time_ms = 0.0\npath_result = \"\"\nif len(nodes) >= 2:\n    section_nodes = [n[0] for n in nodes if str(n[0]).startswith(\"agents_section_\")]\n    if len(section_nodes) >= 2:\n        start_node, end_node = section_nodes[0], section_nodes[-1]\n        # Try precomputed path from GraphBuilder first (O(1) lookup)\n        precomputed = None\n        if HAS_MODULAR and hasattr(builder, '_precomputed_paths'):\n            precomputed = builder._precomputed_paths.get((start_node, end_node))\n        if precomputed is not None:\n            path_result = json.dumps(precomputed)\n            # Precomputed lookup is ~0ms\n            query_time_ms = 0.0\n        else:\n            start = time.perf_counter()\n            # Unidirectional BFS: faster than bidirectional for small graphs\n            if start_node == end_node:\n                path_result = json.dumps([start_node])\n            else:\n                visited = {start_node}\n                queue = deque([(start_node, [start_node])])\n                found = None\n                while queue:\n                    current, path = queue.popleft()\n                    if current == end_node:\n                        found = path\n                        break\n                    for neighbor in adj.get(current, []):\n                        if neighbor not in visited:\n                            visited.add(neighbor)\n                            queue.append((neighbor, path + [neighbor]))\n                path_result = json.dumps(found) if found else \"[]\"\n            query_time_ms = (time.perf_counter() - start) * 1000\nmetric(\"query_time_ms\", round(query_time_ms, 2))\n# ── 3. ASCII Render ─────────────────────────────────────────────────────────\n# Rich multi-type graph visualization\nnode_lookup = {n[0]: n for n in nodes}\n\n# Group nodes by type prefix (handle canvas_* and archive_*)\ndef type_key(n):\n    t = n[1]\n    if t.startswith('canvas_'): return 'canvas'\n    if t.startswith('archive_'): return 'archive'\n    if t.startswith('gitnexus_'): return 'gitnexus'\n    return t\n\ntype_groups = {}\nfor n in nodes:\n    k = type_key(n)\n    type_groups.setdefault(k, []).append(n)\n\nlines = []\nlines.append(\" UNIFIED GRAPH \")\nlines.append(\"=\" * 60)\nlines.append(f\" nodes={len(nodes)}  edges={len(edges)}\")\nlines.append(\"-\" * 60)\n\n# Section 1: doc_sections with children (from AGENTS.md)\nsection_nodes = type_groups.get('doc_section', [])\nif section_nodes:\n    lines.append(\" [doc_sections]\")\n    for i, n in enumerate(section_nodes[:8]):\n        label = n[2][:45]\n        children = adj.get(n[0], [])\n        child_labels = [node_lookup[c][2][:18] for c in children[:3] if c in node_lookup]\n        child_str = f\" → {', '.join(child_labels)}\" if child_labels else \"\"\n        prefix = \"  \" if i > 0 else \"\"\n        lines.append(f\"{prefix}├─ {label}{child_str}\")\n    if len(section_nodes) > 8:\n        lines.append(f\"  └─ ...+{len(section_nodes)-8} sections\")\n\n# Section 2: canvas commands (from canvas graph_data.json)\ncanvas_cmds = type_groups.get('canvas', [])\nif canvas_cmds:\n    lines.append(\" [canvas_commands]\")\n    for n in canvas_cmds[:8]:\n        label = n[2][:45]\n        children = adj.get(n[0], [])\n        child_labels = [node_lookup[c][2][:18] for c in children[:3] if c in node_lookup]\n        child_str = f\" → {', '.join(child_labels)}\" if child_labels else \"\"\n        lines.append(f\"  ├─ {label}{child_str}\")\n    if len(canvas_cmds) > 8:\n        lines.append(f\"  └─ ...+{len(canvas_cmds)-8} canvas nodes\")\n\n# Section 3: archive commands (from archive/commands/*.md)\narchive_cmds = type_groups.get('archive', [])\nif archive_cmds:\n    lines.append(\" [archive_commands]\")\n    for n in archive_cmds[:6]:\n        label = n[2][:45]\n        children = adj.get(n[0], [])\n        child_labels = [node_lookup[c][2][:18] for c in children[:3] if c in node_lookup]\n        child_str = f\" → {', '.join(child_labels)}\" if child_labels else \"\"\n        lines.append(f\"  ├─ {label}{child_str}\")\n    if len(archive_cmds) > 6:\n        lines.append(f\"  └─ ...+{len(archive_cmds)-6} commands\")\n\n# Section 4: other primitive types (summary)\nprimitive_types = ['decision', 'lesson', 'task', 'goal', 'memory_session',\n                   'schema_entity', 'schema_field', 'knowledge', 'handoff',\n                   'agent_role', 'agent_boundary', 'agent_capability', 'gitnexus']\nfor ptype in primitive_types:\n    grp = type_groups.get(ptype, [])\n    if grp:\n        samples = [n[2][:20] for n in grp[:3]]\n        sample_str = \", \".join(samples)\n        extra = f\" (+{len(grp)-3})\" if len(grp) > 3 else \"\"\n        lines.append(f\" [n={len(grp)}] {ptype}: {sample_str}{extra}\")\n\n# Section 5: cross-type edge summary\nedge_types = {}\nfor e in edges:\n    edge_types.setdefault(e['type'], []).append(e)\nlines.append(\"-\" * 60)\nlines.append(\" [cross_type_edges]\")\nfor etype, elist in sorted(edge_types.items(), key=lambda x: -len(x[1]))[:6]:\n    samples = [(node_lookup.get(e['from'], ('','',''))[2][:15], node_lookup.get(e['to'], ('','',''))[2][:15]) for e in elist[:2]]\n    sample_str = \"; \".join([f\"{s[0]}→{s[1]}\" for s in samples])\n    extra = f\" (+{len(elist)-2})\" if len(elist) > 2 else \"\"\n    lines.append(f\"  {etype}({len(elist)}): {sample_str}{extra}\")\n\nlines.append(\"-\" * 60)\nlines.append(f\" path_query: {path_result[:80]}{'...' if len(path_result) > 80 else ''}\")\n\nascii_output = '\\n'.join(lines)\nascii_lines = len(ascii_output.strip().split('\\n'))\nmetric(\"ascii_render_lines\", ascii_lines)\n\n# Save output\noutput_file = os.path.join(EXPERIMENT_DIR, \"output.txt\")\nwith open(output_file, \"w\") as f:\n    f.write(f\"graph_build_time_ms={round(build_time_ms,2)}\\n\")\n    f.write(f\"graph_node_count={len(nodes)}\\n\")\n    f.write(f\"graph_edge_count={len(edges)}\\n\")\n    f.write(f\"query_time_ms={round(query_time_ms,2)}\\n\")\n    f.write(f\"ascii_render_lines={ascii_lines}\\n\")\n    f.write(f\"\\n--- ASCII GRAPH RENDER ---\\n\")\n    f.write(ascii_output)\n\nprint(f\"\\nMETRIC graph_build_time_ms={round(build_time_ms, 2)}\")\nprint(f\"METRIC graph_node_count={len(nodes)}\")\nprint(f\"METRIC graph_edge_count={len(edges)}\")\nprint(f\"METRIC query_time_ms={round(query_time_ms, 2)}\")\nprint(f\"METRIC ascii_render_lines={ascii_lines}\")\nprint(f\"Using modular system: {HAS_MODULAR}\")\n"}],"isError":false,"timestamp":1777537320913}}
{"type":"message","id":"9929ff52","parentId":"fb9e68f7","timestamp":"2026-04-30T08:22:10.197Z","message":{"role":"assistant","content":[{"type":"thinking","thinking":"Now I have a good picture. Let me check what files exist in the source directories that haven't been parsed yet:\n\nLooking at the ideas backlog:\n- archive/ directory doesn't exist (no longer there)\n- canvas mapper_batch files — raw LLM prompts, not parseable\n- machinelearning/ for cross-repo edges\n- Parse code structure from .py files\n\nLet me look at what we could parse. The ideas backlog mentions:\n1. Parse archive/codex-layer-v1-modules/*.py for code structure — files don't exist\n2. Parse machinelearning/ for cross-repo edges\n3. Mermaid diagram output\n\n\n4. Pre-compute reachability matrix\n\nI'm also noticing the graph connectivity issue — only about 6% of nodes are reachable within 5 hops, which suggests most nodes exist in isolated clusters. Adding cross-type edges through tag-based relates_to connections could help bridge these gaps. Let me scan for any unparsed directories or files in belam-codex that might yield new nodes.","thinkingSignature":"19de1bfefff8f85be9ffce26f7e45ad561bcbec41b0da1fb56cd7c6827256e89"},{"type":"toolCall","id":"call_function_cpgil1nnjefy_1","name":"bash","arguments":{"command":"ls ~/.hermes/belam-codex/ | head -30"}},{"type":"toolCall","id":"call_function_cpgil1nnjefy_2","name":"bash","arguments":{"command":"find ~/.hermes/belam-codex -maxdepth 2 -type d | sort | head -20"}}],"api":"anthropic-messages","provider":"minimax","model":"MiniMax-M2.7","usage":{"input":16241,"output":284,"cacheRead":10071,"cacheWrite":0,"totalTokens":26596,"cost":{"input":0.0048722999999999995,"output":0.0003408,"cacheRead":0.0006042599999999999,"cacheWrite":0,"total":0.005817359999999999}},"stopReason":"toolUse","timestamp":1777537320915,"responseId":"06424429744715b97734235f570c4093"}}
{"type":"message","id":"a74d4928","parentId":"9929ff52","timestamp":"2026-04-30T08:22:10.212Z","message":{"role":"toolResult","toolCallId":"call_function_cpgil1nnjefy_1","toolName":"bash","content":[{"type":"text","text":"!cat\nAGENTS.md\nCLAUDE.md\nCOCKPIT_REFACTOR_GUIDE.md\nCODEX.codex\nCONTEXT_BOOT.md\nDockerfile\nHEARTBEAT.md\nIDENTITY.md\nMEMORY.md\nSOUL.md\nTOOLS.md\nUSER.md\nagents\narchive\nbin\ncanvas\ncodex_legend.md\ndata\ndecisions\ndocker\ndocker-compose.yml\ndocs\nextensions-backup\ngoals\nhandoff\nhooks\nincarnate.sh\nknowledge\nlessons\n"}],"isError":false,"timestamp":1777537330211}}
{"type":"message","id":"9eedbe85","parentId":"a74d4928","timestamp":"2026-04-30T08:22:10.215Z","message":{"role":"toolResult","toolCallId":"call_function_cpgil1nnjefy_2","toolName":"bash","content":[{"type":"text","text":"/home/ubuntu/.hermes/belam-codex\n/home/ubuntu/.hermes/belam-codex/.claude\n/home/ubuntu/.hermes/belam-codex/.claude/skills\n/home/ubuntu/.hermes/belam-codex/.git\n/home/ubuntu/.hermes/belam-codex/.git/branches\n/home/ubuntu/.hermes/belam-codex/.git/hooks\n/home/ubuntu/.hermes/belam-codex/.git/info\n/home/ubuntu/.hermes/belam-codex/.git/logs\n/home/ubuntu/.hermes/belam-codex/.git/objects\n/home/ubuntu/.hermes/belam-codex/.git/refs\n/home/ubuntu/.hermes/belam-codex/.gitnexus\n/home/ubuntu/.hermes/belam-codex/.hermes\n/home/ubuntu/.hermes/belam-codex/.hermes/plans\n/home/ubuntu/.hermes/belam-codex/.openclaw\n/home/ubuntu/.hermes/belam-codex/.pytest_cache\n/home/ubuntu/.hermes/belam-codex/.pytest_cache/v\n/home/ubuntu/.hermes/belam-codex/agents\n/home/ubuntu/.hermes/belam-codex/archive\n/home/ubuntu/.hermes/belam-codex/archive/codex-layer-v1-modules\n/home/ubuntu/.hermes/belam-codex/archive/commands\n"}],"isError":false,"timestamp":1777537330215}}
