{"type":"message","id":"805b2f18","parentId":"f84bce07","timestamp":"2026-04-30T09:15:26.792Z","message":{"role":"assistant","content":[{"type":"thinking","thinking":"Now I have a good understanding of the script structure. Let me implement `parse_hooks()` and `parse_scripts()`. I'll add them to the graph_builder.py, then call them from `_cached_build_builder()` and the cold build path, and bump `_cache_ver` from 11 to 12.\n\nFor `parse_hooks()`:\n- Parse the 3 HOOK.md files\n- Extract: name, description, events, requires from frontmatter\n- Create: hook_reference nodes with metadata\n\nFor `parse_scripts()`:\n- Parse ~50 key Python scripts\n- Extract: shebang, docstring title, top-level functions (def, class)\n\n\n- Create: script_reference nodes with function/class as children\n\nI'm being selective with scripts—focusing on the most meaningful ones like belam.sh, launch_pipeline.py, run_experiment.py, and various pipeline automation tools, filtering out test files, temporary backups, and anything with underscore prefixes to keep the graph lean.\n\nI'm expanding that to around 40 total scripts, including codex modules, agent scripts, memory management utilities, and pipeline dispatch tools, then writing targeted parsers that extract just function names and docstring summaries from each script rather than parsing entire files. I'm seeing the rest of the script list and now I need to write the actual parsing code. I'll create a method that identifies scripts by their shebang line or CLI decorators, then extracts their top-level functions and class definitions with docstring summaries.","thinkingSignature":"429e37100c6ffc7bdc4b01cb41fd6ed7b653becc4457d0e3e8a6e9d601e2715c"},{"type":"text","text":"Now I'll add the two new parser methods and wire them up:\n"},{"type":"toolCall","id":"call_function_c13o3sekvvs9_1","name":"edit","arguments":{"path":"/home/ubuntu/.hermes/agi/graph_builder.py","edits":[{"oldText":"    def build_tag_bridges(self, hermes_dir: str) -> int:\n        \"\"\"Bridge isolated clusters via shared tags.","newText":"    def parse_hooks(self, hooks_dir: str) -> int:\n        \"\"\"Parse hermes/belam-codex/hooks/ for hook reference nodes.\n        \n        Each hook has HOOK.md with frontmatter (name, description, events, requires)\n        and a handler.ts TypeScript file. Creates hook_reference nodes with\n        event-based edges to the hook system.\n        \"\"\"\n        if not os.path.isdir(hooks_dir):\n            return 0\n\n        count = 0\n        hook_subdirs = ['memory-extract', 'pipeline-dispatch', 'supermap-boot']\n\n        for subdir in hook_subdirs:\n            hook_md = os.path.join(hooks_dir, subdir, 'HOOK.md')\n            if not os.path.exists(hook_md):\n                continue\n            try:\n                with open(hook_md, 'r') as f:\n                    content = f.read()\n\n                fm_match = _RE_FRONT_MATTER.match(content)\n                meta = {}\n                if fm_match:\n                    for line in fm_match.group(1).split('\\n'):\n                        m = _RE_YAML_PAIR.match(line)\n                        if m:\n                            meta[m.group(1)] = m.group(2)\n\n                hook_name = meta.get('name', subdir)\n                description = meta.get('description', '')\n                events_str = meta.get('metadata.openclaw.events', '[]')\n                requires_str = meta.get('metadata.openclaw.requires.config', '[]')\n\n                # Extract first body paragraph as summary\n                body_match = re.search(r'(?:^---.*?---\\n\\n)(.+?)(?:\\n\\n|##)', content, re.DOTALL)\n                body = body_match.group(1).strip()[:100] if body_match else description[:100]\n\n                node_id = self.add_node(\n                    \"hook_reference\",\n                    hook_name[:50],\n                    body[:80],\n                    f\"hooks/{subdir}/HOOK.md\",\n                    f\"hook_{hook_name.replace('-', '_').replace(' ', '_')}\"\n                )\n                count += 1\n\n                # Event-based edges (what triggers this hook)\n                events = re.findall(r'\\w+(?:/\\w+)*', events_str)\n                for event in events[:3]:\n                    event_id = f\"tag_hook_event_{event.replace('/', '_')}\"\n                    if event_id not in self._node_ids:\n                        self.add_node(\"tag\", event, f\"hook event: {event}\", f\"hooks/{subdir}/HOOK.md\", event_id)\n                        count += 1\n                    self.add_edge(node_id, event_id, \"fires_on\")\n\n            except Exception:\n                pass\n        return count\n\n    def parse_scripts(self, scripts_dir: str) -> int:\n        \"\"\"Parse belam-codex/scripts/ Python CLI tools as script_reference nodes.\n        \n        Selects ~40 key operational scripts (CLI tools, not internal modules).\n        For each script, creates a script_reference node. Top-level def/class names\n        become child nodes (script_function, script_class). Filters out:\n        private (leading _), test files, .pyc, backups, __init__, __pycache__.\n        \"\"\"\n        if not os.path.isdir(scripts_dir):\n            return 0\n\n        _RE_SHEBANG = re.compile(r'^#!.*python', re.IGNORECASE)\n        _RE_CLI_DECORATOR = re.compile(r'@(cli|command|argument|option)\\(', re.MULTILINE)\n        _RE_TOP_DEF = re.compile(r'^def\\s+(\\w+)\\s*\\(', re.MULTILINE)\n        _RE_TOP_CLASS = re.compile(r'^class\\s+(\\w+)\\s*[:(]', re.MULTILINE)\n\n        # Target scripts: CLI tools (not internal modules, not tests, not backups)\n        SKIP_PREFIXES = ('__', '_', 'tests/', 'archived/')\n        SKIP_SUFFIXES = ('.pyc', '.bak', '.backup', '_backup', '.v1_backup', \n                         '.pre_v2_modes_backup')\n        TARGET_SCRIPTS = [\n            'belam.sh', 'belam_extract.sh', 'build_notebook.py', 'cli_registry.py',\n            'codex_codec.py', 'codex_engine.py', 'codex_lm_platform.py',\n            'codex_lm_renderer.py', 'codex_materialize.py', 'codex_mcp_server.py',\n            'codex_ram.py', 'codex_stream.py', 'codex_watch.py',\n            'command_registry.py', 'create_primitive.py', 'dispatch_adapters.py',\n            'export_graph_data.py', 'generate_session_context.py',\n            'handoff_diff.py', 'hermes_orchestrate.py',\n            'launch_analysis_pipeline.py', 'launch_pipeline.py',\n            'log_memory.py', 'map_relationships.py', 'memory_daily_linker.py',\n            'memory_file_update_checkcheck.py', 'memory_monthly_consolidation.py',\n            'memory_session_loader.py', 'memory_weekly_consolidation.py',\n            'migrate_pipeline_frontmatter.py', 'migrate_promotion_fields.py',\n            'migrate_task_schema_v2.py', 'orchestration_engine.py',\n            'parse_session_transcript.py', 'persona_loader.py',\n            'pipeline_automate.py', 'pipeline_autorun.py', 'pipeline_dashboard.py',\n            'pipeline_orchestrate.py', 'pipeline_rewind.py',\n            'pipeline_stall_recovery.py', 'pipeline_update.py', 'pipeline_verify.py',\n            'render_supermap.py', 'run_experiment.py', 'run_memory_extraction.py',\n            'run_pipeline_stage.py', 'runtime_resolution.py', 'setup_analysis_pipeline.py',\n            'setup_backtest_env.sh', 'setup_memory_crons.py', 'setup_pipeline.py',\n            'sync_knowledge_repo.py', 'template_parser.py', 'temporal_overlay.py',\n            'temporal_sync.py', 'transcribe_audio.py', 'trigger_embed.py',\n            'video_thumbnail_generator.py', 'video_tts.py', 'weekly_knowledge_sync.py',\n        ]\n        # Map to actual filenames (some may not exist, that's fine)\n        target_set = set(TARGET_SCRIPTS)\n\n        count = 0\n        skipped_private = 0\n\n        for filename in sorted(os.listdir(scripts_dir)):\n            if filename in SKIP_SUFFIXES:\n                skipped_private += 1\n                continue\n            if any(filename.startswith(p) for p in SKIP_PREFIXES):\n                skipped_private += 1\n                continue\n            if not (filename.endswith('.py') or filename.endswith('.sh')):\n                continue\n            # Only parse target scripts (keep it selective)\n            if filename not in target_set:\n                continue\n\n            filepath = os.path.join(scripts_dir, filename)\n            if not os.path.isfile(filepath):\n                continue\n\n            try:\n                with open(filepath, 'r') as f:\n                    content = f.read(4096)  # Read first 4KB for header parsing\n\n                lines = content.split('\\n')\n                is_cli = False\n\n                # Detect CLI tool: shebang or @cli decorator\n                if lines and (_RE_SHEBANG.match(lines[0]) or 'argparse' in content[:500] or 'click' in content[:500]):\n                    is_cli = True\n                elif _RE_CLI_DECORATOR.search(content[:500]):\n                    is_cli = True\n\n                # Extract docstring title\n                doc_match = re.search(r'\"\"\"\\n?(.+?)\"\"\"', content[:1000], re.DOTALL)\n                title = doc_match.group(1).strip().split('\\n')[0][:80] if doc_match else filename\n\n                # Determine script type\n                if filename.endswith('.sh'):\n                    script_type = 'shell_script'\n                else:\n                    script_type = 'script_reference'\n\n                node_id = self.add_node(\n                    script_type,\n                    title[:50],\n                    f\"cli:{is_cli}\",\n                    f\"scripts/{filename}\",\n                    f\"script_{filename.replace('.', '_')}\"\n                )\n                count += 1\n\n                # Extract top-level defs and classes (fast: first 4KB of each file)\n                for def_match in _RE_TOP_DEF.finditer(content):\n                    fn_name = def_match.group(1)\n                    if fn_name.startswith('_') and fn_name != '__init__':\n                        continue\n                    # Skip dunder methods that aren't __init__\n                    if fn_name.startswith('__'):\n                        continue\n                    fn_id = self.add_node(\n                        \"script_function\",\n                        fn_name[:50],\n                        \"\",\n                        f\"scripts/{filename}\",\n                        f\"fn_{filename[:-3]}_{fn_name}\"\n                    )\n                    self.add_edge(node_id, fn_id, \"defines\")\n                    count += 1\n\n                for cls_match in _RE_TOP_CLASS.finditer(content):\n                    cls_name = cls_match.group(1)\n                    if cls_name.startswith('_'):\n                        continue\n                    # Skip common stdlib wrappers\n                    if cls_name in ('Optional', 'List', 'Dict', 'Any', 'Tuple', \n                                     'Callable', 'Type', 'Union', 'Literal'):\n                        continue\n                    cls_id = self.add_node(\n                        \"script_class\",\n                        cls_name[:50],\n                        \"\",\n                        f\"scripts/{filename}\",\n                        f\"cls_{filename[:-3]}_{cls_name}\"\n                    )\n                    self.add_edge(node_id, cls_id, \"defines\")\n                    count += 1\n\n            except Exception:\n                pass\n        return count\n\n    def build_tag_bridges(self, hermes_dir: str) -> int:\n        \"\"\"Bridge isolated clusters via shared tags."}]}}],"api":"anthropic-messages","provider":"minimax","model":"MiniMax-M2.7","usage":{"input":48912,"output":2687,"cacheRead":10071,"cacheWrite":0,"totalTokens":61670,"cost":{"input":0.0146736,"output":0.0032243999999999997,"cacheRead":0.0006042599999999999,"cacheWrite":0,"total":0.01850226}},"stopReason":"toolUse","timestamp":1777540477688,"responseId":"0642507e1a03f71a3100b0c69ae70c06"}}
