{"type":"message","id":"eaf58e36","parentId":"dea86a9c","timestamp":"2026-04-30T09:10:38.238Z","message":{"role":"assistant","content":[{"type":"thinking","thinking":"No output means the regex isn't matching! Let me check if the regex is correct:","thinkingSignature":"9ae8ff930ded5f41780f2e8c7dce891530d148412ec201080c723a464c967f0e"},{"type":"toolCall","id":"call_function_qygnjfhzt6li_1","name":"bash","arguments":{"command":"cd /home/ubuntu/.hermes/agi && python3 -c \"\ncontent = open('/home/ubuntu/.hermes/belam-codex/templates/builder-first-pipeline.md').read()\n# Find phase headings\nfor i, line in enumerate(content.split('\\n')[:30]):\n    if 'Phase' in line or '###' in line:\n        print(f'{i}: {repr(line)[:60]}')\n\""}}],"api":"anthropic-messages","provider":"minimax","model":"MiniMax-M2.7","usage":{"input":56480,"output":130,"cacheRead":10071,"cacheWrite":0,"totalTokens":66681,"cost":{"input":0.016944,"output":0.000156,"cacheRead":0.0006042599999999999,"cacheWrite":0,"total":0.01770426}},"stopReason":"toolUse","timestamp":1777540232905,"responseId":"06424f89ee250348e083d840c70167fa"}}
{"type":"message","id":"1defb64d","parentId":"eaf58e36","timestamp":"2026-04-30T09:10:38.278Z","message":{"role":"toolResult","toolCallId":"call_function_qygnjfhzt6li_1","toolName":"bash","content":[{"type":"text","text":"5: 'Phase 1: Builder (implement) → Builder (bugfix) → Critic (r\n6: 'Phase 2: Architect (design) → Builder (implement) → Builder\n7: 'Phase 3: Architect (design) → Builder (implement) → Builder\n12: '1. **Kick Phase 2** — `python3 scripts/pipeline_orchestrate\n25: '### Phase 1 — Builder-First Implementation'\n27: '#### `p1_builder_implement`'\n"}],"isError":false,"timestamp":1777540238277}}
{"type":"message","id":"4b74cff9","parentId":"1defb64d","timestamp":"2026-04-30T09:10:45.395Z","message":{"role":"assistant","content":[{"type":"thinking","thinking":"Ah I see! The actual phase headings in the markdown are `### Phase 1 — Builder-First Implementation` not `### Phase 1\\n`. The issue is my regex expects a newline `\\n` at the end, but the content has `—` after the phase number before the newline.Let me fix the regex:","thinkingSignature":"e85a5810b51376bdd9573046e3f392b9e535f39588f9e508cd79b308102ef829"},{"type":"text","text":"Found the bug! The regex expects `\\n` but the content has `—` before the newline. Let me fix:\n"},{"type":"toolCall","id":"call_function_exgi2oqfhcg7_1","name":"bash","arguments":{"command":"cd /home/ubuntu/.hermes/agi && python3 -c \"\nimport re\n# Test the regex\n_RE_PHASE_HDR = re.compile(r'^###\\s+Phase\\s+(\\d+)([^\\n]*)\\n', re.MULTILINE)\ncontent = open('/home/ubuntu/.hermes/belam-codex/templates/builder-first-pipeline.md').read()\nmatches = _RE_PHASE_HDR.findall(content)\nprint(f'Matches: {matches}')\n\n# Fix: remove strict \\n requirement\n_RE_PHASE_HDR_FIXED = re.compile(r'^###\\s+Phase\\s+(\\d+)(.*)$', re.MULTILINE)\nmatches = _RE_PHASE_HDR_FIXED.findall(content)\nprint(f'Fixed matches: {matches}')\n\""}}],"api":"anthropic-messages","provider":"minimax","model":"MiniMax-M2.7","usage":{"input":56733,"output":285,"cacheRead":10071,"cacheWrite":0,"totalTokens":67089,"cost":{"input":0.017019899999999998,"output":0.00034199999999999996,"cacheRead":0.0006042599999999999,"cacheWrite":0,"total":0.017966159999999995}},"stopReason":"toolUse","timestamp":1777540238281,"responseId":"06424f8e584c21acb952228c06d4f08b"}}
{"type":"message","id":"8c5eeeb6","parentId":"4b74cff9","timestamp":"2026-04-30T09:10:45.471Z","message":{"role":"toolResult","toolCallId":"call_function_exgi2oqfhcg7_1","toolName":"bash","content":[{"type":"text","text":"Matches: [('1', ' — Builder-First Implementation'), ('2', ' — Architect-Led Refinement')]\nFixed matches: [('1', ' — Builder-First Implementation'), ('2', ' — Architect-Led Refinement')]\n"}],"isError":false,"timestamp":1777540245471}}
{"type":"message","id":"e8cd4385","parentId":"8c5eeeb6","timestamp":"2026-04-30T09:10:54.443Z","message":{"role":"assistant","content":[{"type":"thinking","thinking":"Interesting - the original regex DID work. So the issue is something else. Let me check more carefully:","thinkingSignature":"b61e33d0529650a0f06c26230f063fb118bac2bc47a36607e8862b2c06391a67"},{"type":"toolCall","id":"call_function_i3jlmfrme25i_1","name":"bash","arguments":{"command":"cd /home/ubuntu/.hermes/agi && python3 -c \"\nimport re\ncontent = open('/home/ubuntu/.hermes/belam-codex/templates/builder-first-pipeline.md').read()\n\n# Test the exact regex from the code\n_RE_PHASE_HDR = re.compile(r'^###\\s+Phase\\s+(\\d+)([^\\n]*)\\n', re.MULTILINE)\n_RE_STAGE_HDR = re.compile(r'^####\\s+\\`([\\w_]+)\\`\\n', re.MULTILINE)\n\nprint('Testing with re.MULTILINE:')\nph_matches = _RE_PHASE_HDR.findall(content)\nprint(f'Phase matches: {ph_matches[:3]}')\n\nst_matches = _RE_STAGE_HDR.findall(content)\nprint(f'Stage matches: {st_matches[:5]}')\n\n# Now test with match() on individual lines\nprint('\\\\nTesting match() on individual lines:')\nlines = content.split('\\n')\nfor i, line in enumerate(lines):\n    if 'Phase 1' in line:\n        print(f'Line {i}: {repr(line)[:60]}')\n        m = _RE_PHASE_HDR.match(line)\n        print(f'  Match result: {m}')\n\""}}],"api":"anthropic-messages","provider":"minimax","model":"MiniMax-M2.7","usage":{"input":57083,"output":313,"cacheRead":10071,"cacheWrite":0,"totalTokens":67467,"cost":{"input":0.0171249,"output":0.00037559999999999997,"cacheRead":0.0006042599999999999,"cacheWrite":0,"total":0.018104759999999998}},"stopReason":"toolUse","timestamp":1777540245474,"responseId":"06424f963f301ac0afb1ed32bfb7e744"}}
{"type":"message","id":"49016795","parentId":"e8cd4385","timestamp":"2026-04-30T09:10:54.481Z","message":{"role":"toolResult","toolCallId":"call_function_i3jlmfrme25i_1","toolName":"bash","content":[{"type":"text","text":"Testing with re.MULTILINE:\nPhase matches: [('1', ' — Builder-First Implementation'), ('2', ' — Architect-Led Refinement')]\nStage matches: ['p1_builder_implement', 'p1_builder_bugfix', 'p1_critic_review', 'p2_architect_design', 'p2_builder_implement']\n\nTesting match() on individual lines:\nLine 5: 'Phase 1: Builder (implement) → Builder (bugfix) → Critic (r\n  Match result: None\nLine 25: '### Phase 1 — Builder-First Implementation'\n  Match result: None\n"}],"isError":false,"timestamp":1777540254481}}
{"type":"message","id":"ce20a3c7","parentId":"49016795","timestamp":"2026-04-30T09:11:01.870Z","message":{"role":"assistant","content":[{"type":"thinking","thinking":"The issue is the `\\n` at the end! The regex `^###\\s+Phase\\s+(\\d+)([^\\n]*)\\n` requires a `\\n` at the very end. But the content `### Phase 1 — Builder-First Implementation\\n` - wait, there IS a `\\n` after `Implementation`. But `re.MULTILINE` makes `^` match at line starts but `$` doesn't automatically match before `\\n`.Let me check:","thinkingSignature":"957d69973ba9bf87c073d69cffafcda84f826fbf7f0b33c2d855368cc51909ee"},{"type":"toolCall","id":"call_function_bnj57sp1gf68_1","name":"bash","arguments":{"command":"cd /home/ubuntu/.hermes/agi && python3 -c \"\nimport re\nline = '### Phase 1 — Builder-First Implementation'\nprint(f'Line ends with newline? {line.endswith(chr(10))}')\n\n# Test regex\n_RE_PHASE_HDR = re.compile(r'^###\\s+Phase\\s+(\\d+)([^\\n]*)\\n', re.MULTILINE)\nm = _RE_PHASE_HDR.match(line)\nprint(f'Match without newline: {m}')\n\nline_with_nl = line + '\\n'\nm = _RE_PHASE_HDR.match(line_with_nl)\nprint(f'Match with newline: {m}')\n\""}}],"api":"anthropic-messages","provider":"minimax","model":"MiniMax-M2.7","usage":{"input":57542,"output":270,"cacheRead":10071,"cacheWrite":0,"totalTokens":67883,"cost":{"input":0.0172626,"output":0.00032399999999999996,"cacheRead":0.0006042599999999999,"cacheWrite":0,"total":0.01819086}},"stopReason":"toolUse","timestamp":1777540254484,"responseId":"06424f9f707c9db75cb7b99a7ec7a012"}}
{"type":"message","id":"12e1f949","parentId":"ce20a3c7","timestamp":"2026-04-30T09:11:01.909Z","message":{"role":"toolResult","toolCallId":"call_function_bnj57sp1gf68_1","toolName":"bash","content":[{"type":"text","text":"Line ends with newline? False\nMatch without newline: None\nMatch with newline: <re.Match object; span=(0, 43), match='### Phase 1 — Builder-First Implementation\\n'>\n"}],"isError":false,"timestamp":1777540261909}}
{"type":"message","id":"81102a56","parentId":"12e1f949","timestamp":"2026-04-30T09:11:10.195Z","message":{"role":"assistant","content":[{"type":"thinking","thinking":"The regex requires a `\\n` at the end, but when I split the content by `\\n`, individual lines don't have trailing newlines. The `re.MULTILINE` flag makes `^` and `$` match at line boundaries, but `$` matches before `\\n`, not including it.Looking at the code again:```python\nfor line_num, line in enumerate(content.split('\\n'), 1):\n    ph_match = _RE_PHASE_HDR.match(line)\n```When using `content.split('\\n')`, the newlines are removed from the lines. So the regex which requires `\\n` at the end will never match.I need to fix the regex in the actual code file. Let me update it:","thinkingSignature":"4680371c240bdf0fd945e21277251b35be31b2c332115e379c649e2e3c14ef60"},{"type":"text","text":"The regex `\\n` at end doesn't match because `split('\\n')` removes the newlines. Let me fix the regex in the file:\n"},{"type":"toolCall","id":"call_function_010gfq8l4ltg_1","name":"read","arguments":{"path":"/home/ubuntu/.hermes/agi/graph_builder.py","offset":1653,"limit":5}}],"api":"anthropic-messages","provider":"minimax","model":"MiniMax-M2.7","usage":{"input":57869,"output":237,"cacheRead":10071,"cacheWrite":0,"totalTokens":68177,"cost":{"input":0.0173607,"output":0.0002844,"cacheRead":0.0006042599999999999,"cacheWrite":0,"total":0.01824936}},"stopReason":"toolUse","timestamp":1777540261913,"responseId":"06424fa601aea002146e079f620bc7d1"}}
{"type":"message","id":"fae3efa0","parentId":"81102a56","timestamp":"2026-04-30T09:11:10.197Z","message":{"role":"toolResult","toolCallId":"call_function_010gfq8l4ltg_1","toolName":"read","content":[{"type":"text","text":"        _RE_YAML_BLOCK = re.compile(r'```yaml\\n(.*?)\\n```', re.DOTALL)\n        _RE_PHASE_HDR = re.compile(r'^###\\s+Phase\\s+(\\d+)([^\\n]*)\\n', re.MULTILINE)\n        _RE_STAGE_HDR = re.compile(r'^####\\s+`([\\w_]+)`\\n', re.MULTILINE)\n        _RE_YAML_KEY = re.compile(r'^(\\s*)([\\w_]+):\\s*(.*)$', re.MULTILINE)\n\n\n[917 more lines in file. Use offset=1658 to continue.]"}],"isError":false,"timestamp":1777540270197}}
{"type":"message","id":"57cb5a09","parentId":"fae3efa0","timestamp":"2026-04-30T09:11:18.669Z","message":{"role":"assistant","content":[{"type":"thinking","thinking":"I need to fix the regexes. Since `split('\\n')` removes newlines, the patterns ending with `\\n` won't match. I'll remove the `\\n` requirement:","thinkingSignature":"44c9cb8262ae47789d7a6f7f857bb9ff1bde03810bc7c9ff1d8fa8b18280b122"},{"type":"toolCall","id":"call_function_gojyc2p83fq0_1","name":"edit","arguments":{"path":"/home/ubuntu/.hermes/agi/graph_builder.py","edits":[{"oldText":"        _RE_YAML_BLOCK = re.compile(r'```yaml\\n(.*?)\\n```', re.DOTALL)\n        _RE_PHASE_HDR = re.compile(r'^###\\s+Phase\\s+(\\d+)([^\\n]*)\\n', re.MULTILINE)\n        _RE_STAGE_HDR = re.compile(r'^####\\s+`([\\w_]+)`\\n', re.MULTILINE)\n        _RE_YAML_KEY = re.compile(r'^(\\s*)([\\w_]+):\\s*(.*)$', re.MULTILINE)","newText":"        _RE_YAML_BLOCK = re.compile(r'```yaml\\n(.*?)\\n```', re.DOTALL)\n        _RE_PHASE_HDR = re.compile(r'^###\\s+Phase\\s+(\\d+)(.*)$', re.MULTILINE)\n        _RE_STAGE_HDR = re.compile(r'^####\\s+`([\\w_]+)`', re.MULTILINE)\n        _RE_YAML_KEY = re.compile(r'^(\\s*)([\\w_]+):\\s*(.*)$', re.MULTILINE)"}]}}],"api":"anthropic-messages","provider":"minimax","model":"MiniMax-M2.7","usage":{"input":58262,"output":351,"cacheRead":10071,"cacheWrite":0,"totalTokens":68684,"cost":{"input":0.0174786,"output":0.0004212,"cacheRead":0.0006042599999999999,"cacheWrite":0,"total":0.01850406}},"stopReason":"toolUse","timestamp":1777540270199,"responseId":"06424fae9e545e4750d9562f55a450fd"}}
{"type":"message","id":"8e7d4c79","parentId":"57cb5a09","timestamp":"2026-04-30T09:11:18.684Z","message":{"role":"toolResult","toolCallId":"call_function_gojyc2p83fq0_1","toolName":"edit","content":[{"type":"text","text":"Successfully replaced 1 block(s) in /home/ubuntu/.hermes/agi/graph_builder.py."}],"details":{"diff":"      ...\n 1650             return 0\n 1651 \n 1652         count = 0\n 1653         _RE_YAML_BLOCK = re.compile(r'```yaml\\n(.*?)\\n```', re.DOTALL)\n-1654         _RE_PHASE_HDR = re.compile(r'^###\\s+Phase\\s+(\\d+)([^\\n]*)\\n', re.MULTILINE)\n-1655         _RE_STAGE_HDR = re.compile(r'^####\\s+`([\\w_]+)`\\n', re.MULTILINE)\n+1654         _RE_PHASE_HDR = re.compile(r'^###\\s+Phase\\s+(\\d+)(.*)$', re.MULTILINE)\n+1655         _RE_STAGE_HDR = re.compile(r'^####\\s+`([\\w_]+)`', re.MULTILINE)\n 1656         _RE_YAML_KEY = re.compile(r'^(\\s*)([\\w_]+):\\s*(.*)$', re.MULTILINE)\n 1657 \n 1658         try:\n 1659             files = sorted(os.listdir(templates_dir))\n      ...","firstChangedLine":1654},"isError":false,"timestamp":1777540278684}}
{"type":"message","id":"f69fd351","parentId":"8e7d4c79","timestamp":"2026-04-30T09:11:23.611Z","message":{"role":"assistant","content":[{"type":"thinking","thinking":"Let me try one more time:","thinkingSignature":"c20c221bbfa5eb40a5f7951eecf53828c9b2d1e678314fc60c1d8354d398cfda"},{"type":"text","text":"Now test:\n"},{"type":"toolCall","id":"call_function_0a2mngqyydmm_1","name":"bash","arguments":{"command":"cd /home/ubuntu/.hermes/agi && rm -f /home/ubuntu/.hermes/agi/.graph_cache.pkl && python3 -c \"\nfrom graph_builder import build_graph\nimport os\nHERMES_DIR = os.path.expanduser('~/.hermes')\nAGI_DIR = '/home/ubuntu/.hermes/agi'\nbuilder, _ = build_graph(HERMES_DIR, AGI_DIR)\n# Check for template_stage nodes\ntemplate_stages = [n for n in builder.nodes if n[1] == 'template_stage']\nprint(f'template_stage nodes: {len(template_stages)}')\nfor ts in template_stages[:5]:\n    print(f'  {ts[0]}: {ts[2][:40]} - {ts[3][:60]}')\n\""}}],"api":"anthropic-messages","provider":"minimax","model":"MiniMax-M2.7","usage":{"input":58649,"output":199,"cacheRead":10071,"cacheWrite":0,"totalTokens":68919,"cost":{"input":0.017594699999999998,"output":0.00023879999999999998,"cacheRead":0.0006042599999999999,"cacheWrite":0,"total":0.018437759999999997}},"stopReason":"toolUse","timestamp":1777540278693,"responseId":"06424fb7c193d330b329b22644e2d327"}}
{"type":"message","id":"f63491b4","parentId":"f69fd351","timestamp":"2026-04-30T09:11:23.812Z","message":{"role":"toolResult","toolCallId":"call_function_0a2mngqyydmm_1","toolName":"bash","content":[{"type":"text","text":"template_stage nodes: 15\n  template_builder-first-pipeline_stage_p1_builder_implement: p1_builder_implement - role:builder|action:implement|session:fresh|cli:claude\n  template_builder-first-pipeline_stage_p1_builder_bugfix: p1_builder_bugfix - role:builder|action:bugfix|session:continue|cli:claude\n  template_builder-first-pipeline_stage_p1_critic_review: p1_critic_review - role:critic|action:review|session:fresh|cli:codex\n  template_builder-first-pipeline_stage_p2_architect_design: p2_architect_design - role:architect|action:design|session:fresh|cli:claude\n  template_builder-first-pipeline_stage_p2_builder_implement: p2_builder_implement - role:builder|action:implement|session:fresh|cli:claude\n"}],"isError":false,"timestamp":1777540283812}}
{"type":"message","id":"3b6e9222","parentId":"f63491b4","timestamp":"2026-04-30T09:11:27.255Z","message":{"role":"assistant","content":[{"type":"thinking","thinking":"Now we have 15 `template_stage` nodes with rich metadata (role, action, session, cli). Let me run the full benchmark:","thinkingSignature":"3830e42743ec54ee9cb40593c017f3c4de11906dcb740def103ba7a4a4061440"},{"type":"text","text":"Now run the full benchmark:\n"},{"type":"toolCall","id":"call_function_dt0106iuevp1_1","name":"run_experiment","arguments":{"command":"./autoresearch.sh","timeout_seconds":120}}],"api":"anthropic-messages","provider":"minimax","model":"MiniMax-M2.7","usage":{"input":59056,"output":77,"cacheRead":10071,"cacheWrite":0,"totalTokens":69204,"cost":{"input":0.017716799999999998,"output":0.0000924,"cacheRead":0.0006042599999999999,"cacheWrite":0,"total":0.018413459999999996}},"stopReason":"toolUse","timestamp":1777540283818,"responseId":"06424fbc5add9602f64b57b5982dfde2"}}
{"type":"message","id":"1e4ae043","parentId":"3b6e9222","timestamp":"2026-04-30T09:11:27.453Z","message":{"role":"toolResult","toolCallId":"call_function_dt0106iuevp1_1","toolName":"run_experiment","content":[{"type":"text","text":"✅ PASSED in 0.2s\n📊 Current best graph_build_time_ms: 377.21ms\n\n📐 Parsed metrics: ★ graph_build_time_ms=0.03ms graph_node_count=1,451 graph_edge_count=1,493 query_time_ms=0ms ascii_render_lines=55\nUse these values directly in log_experiment (metric: 0.03, metrics: {\"graph_node_count\": 1451, \"graph_edge_count\": 1493, \"query_time_ms\": 0, \"ascii_render_lines\": 55})\n\nMETRIC query_time_ms=0.0\nMETRIC ascii_render_lines=55\n\nMETRIC graph_build_time_ms=0.03\nMETRIC graph_node_count=1451\nMETRIC graph_edge_count=1493\nMETRIC query_time_ms=0.0\nMETRIC ascii_render_lines=55\nUsing modular system: True\n\n\n[Showing last 10 of 13 lines. Full output: /tmp/pi-experiment-9c8cc8e36fc70a7e.log]"}],"details":{"command":"./autoresearch.sh","exitCode":0,"durationSeconds":0.196,"passed":true,"crashed":false,"timedOut":false,"tailOutput":"METRIC graph_build_time_ms=0.03\nMETRIC graph_node_count=1451\nMETRIC graph_edge_count=1493\nMETRIC query_time_ms=0.0\nMETRIC ascii_render_lines=55\n\nMETRIC graph_build_time_ms=0.03\nMETRIC graph_node_count=1451\nMETRIC graph_edge_count=1493\nMETRIC query_time_ms=0.0\nMETRIC ascii_render_lines=55\nUsing modular system: True\n","checksPass":null,"checksTimedOut":false,"checksOutput":"","checksDuration":0,"parsedMetrics":{"graph_build_time_ms":0.03,"graph_node_count":1451,"graph_edge_count":1493,"query_time_ms":0,"ascii_render_lines":55},"parsedPrimary":0.03,"metricName":"graph_build_time_ms","metricUnit":"ms","truncation":{"content":"METRIC query_time_ms=0.0\nMETRIC ascii_render_lines=55\n\nMETRIC graph_build_time_ms=0.03\nMETRIC graph_node_count=1451\nMETRIC graph_edge_count=1493\nMETRIC query_time_ms=0.0\nMETRIC ascii_render_lines=55\nUsing modular system: True\n","truncated":true,"truncatedBy":"lines","totalLines":13,"totalBytes":316,"outputLines":10,"outputBytes":226,"lastLinePartial":false,"firstLineExceedsLimit":false,"maxLines":10,"maxBytes":4096},"fullOutputPath":"/tmp/pi-experiment-9c8cc8e36fc70a7e.log"},"isError":false,"timestamp":1777540287453}}
{"type":"message","id":"7040a3f9","parentId":"1e4ae043","timestamp":"2026-04-30T09:11:36.019Z","message":{"role":"assistant","content":[{"type":"thinking","thinking":"Now we have:\n- 1,451 nodes (was 1,430) - +21 nodes\n- 1,493 edges (was 1,461) - +32 edges\n- build_time_ms: 0.03ms (same)This is an improvement in graph richness while maintaining the same primary metric performance. Now let me commit and log the experiment:","thinkingSignature":"dc856edfbf7d59e26c94b40fafbbb3c5d017c2d58f293cb807c047ba07569df3"},{"type":"text","text":"Excellent! Now: 1,451 nodes (+21), 1,493 edges (+32), 0.03ms (same). Commit and log:\n"},{"type":"toolCall","id":"call_function_oncqhs5wwo9t_1","name":"bash","arguments":{"command":"cd /home/ubuntu/.hermes/agi && git add -A && git commit -m \"iter-44: parse_templates creates template_stage nodes with rich YAML metadata\n\n- Fixed regex patterns (removed trailing \\n that didn't match split lines)\n- Pre-parse YAML blocks to extract role/action/session/cli per stage\n- template_stage nodes replace generic reference nodes with rich metadata\n- +21 nodes (15 template_stages + 6 agent_role links), +32 edges\n- Primary metric: 0.03ms (unchanged noise floor)\""}}],"api":"anthropic-messages","provider":"minimax","model":"MiniMax-M2.7","usage":{"input":59371,"output":249,"cacheRead":10071,"cacheWrite":0,"totalTokens":69691,"cost":{"input":0.0178113,"output":0.0002988,"cacheRead":0.0006042599999999999,"cacheWrite":0,"total":0.018714359999999996}},"stopReason":"toolUse","timestamp":1777540287458,"responseId":"06424fbf204d34519211e2224a5c6737"}}
{"type":"message","id":"cea2d60e","parentId":"7040a3f9","timestamp":"2026-04-30T09:11:36.068Z","message":{"role":"toolResult","toolCallId":"call_function_oncqhs5wwo9t_1","toolName":"bash","content":[{"type":"text","text":"[master e220139] iter-44: parse_templates creates template_stage nodes with rich YAML metadata\n 11 files changed, 433 insertions(+), 20 deletions(-)\n create mode 100644 experiments/20260430_090546/output.txt\n create mode 100644 experiments/20260430_090852/output.txt\n create mode 100644 experiments/20260430_090857/output.txt\n create mode 100644 experiments/20260430_091127/output.txt\n create mode 100644 sessions/2026-04-30T09-03-43-683Z_019ddda1-3843-72ee-8fbb-c0d1586a727c.jsonl\n"}],"isError":false,"timestamp":1777540296068}}
