{"type":"message","id":"d479b520","parentId":"ecaa0d6c","timestamp":"2026-04-30T08:24:47.315Z","message":{"role":"assistant","content":[{"type":"thinking","thinking":"Iteration complete. Let me report the result.","thinkingSignature":"3c40c52cc6c0eb2ac548e5163075a01ecec4b655d608e5e5ed60ceaea58c3c28"},{"type":"text","text":"**Iteration 37 (commit 2c4a3fe): KEEP**\n\n- **Primary**: 0.03ms unchanged (noise floor saturated)\n- **Nodes**: 960 (+37) — codex_module:3, codex_class:4, codex_method:~15, codex_function:~8\n- **Edges**: 448 (+17) — defines, implements, imports, implements_pipeline\n- lru_cache absorbs new data at zero cost to warm load time"}],"api":"anthropic-messages","provider":"minimax","model":"MiniMax-M2.7","usage":{"input":36071,"output":112,"cacheRead":10071,"cacheWrite":0,"totalTokens":46254,"cost":{"input":0.010821299999999999,"output":0.0001344,"cacheRead":0.0006042599999999999,"cacheWrite":0,"total":0.01155996}},"stopReason":"stop","timestamp":1777537481925,"responseId":"064244ca92b6fa3219ead2d6ec34c699"}}
{"type":"message","id":"d0639941","parentId":"d479b520","timestamp":"2026-04-30T08:24:47.323Z","message":{"role":"user","content":[{"type":"text","text":"Autoresearch loop ended (likely context limit). Resume the experiment loop — read autoresearch.md and git log for context. Check autoresearch.ideas.md for promising paths to explore. Prune stale/tried ideas. Be careful not to overfit to the benchmarks and do not cheat on the benchmarks."}],"timestamp":1777537487318}}
