{"type":"message","id":"73bcc6c8","parentId":"f1dd64bc","timestamp":"2026-04-30T07:54:47.197Z","message":{"role":"assistant","content":[{"type":"thinking","thinking":"So:\n- Cold build (lru_cache miss): 34.02ms for 828 nodes\n- Warm build (lru_cache hit): 0.0745ms\n\nPreviously, the warm build was 0.03ms for 696 nodes. Now it's 0.0745ms for 828 nodes. That's ~2.5x slower warm load.\n\nThe lru_cache warm load is NOT truly O(1). It still takes measurable time even when it \"hits\" the cache. With more nodes (tuple/list of 828 vs 696), the return value is larger, and Python still needs to allocate new objects when reconstructing from the cached return value.\n \nI'm seeing that the primary metric actually regressed—warm load went from 0.03ms to 0.0745ms. The issue is that even though lru_cache retrieves the cached value instantly, reconstructing a larger tuple (828 elements versus 696) requires allocating more memory and creating new objects, which adds overhead proportional to the return size.\n\nI have two paths forward: either revert to the smaller graph to keep the warm load fast, or accept the regression since the current measurement might be picking up cold build times instead of true warm loads. Looking at the benchmark, it calls build_graph twice—the first pre-warms the cache, and the second is timed—so the 0.07ms measurement should be capturing the actual warm path performance.\n\nBut I'm realizing the pickle fallback in the benchmark might be interfering. When `_cached_build` throws an exception and falls back to pickle, that result gets cached in lru_cache, which means the second call hits the cache instead of rebuilding from scratch. The warm timing should still be fast, but I need to verify whether the pickle fallback is actually faster than a cold build and whether it's contaminating the lru_cache with slower performance characteristics.\n\nLooking at the actual numbers, the 0.07ms timing is suspiciously close to the lru_cache warm hit time (0.0745ms), not a cold pickle load. This suggests the timed measurement is actually capturing the warm path performance, not a cold one. The regression from 0.03ms to 0.07ms is real, but it's coming from the warm cache hit being slower due to larger data structures, not from cold build interference.\n\nComparing across runs: 696 nodes hits the cache in 0.03ms, while 828 nodes takes 0.07ms—a 2.5x slowdown that scales roughly with the data size increase. The pickle file was masking this earlier by providing a faster path. To fix the regression, I need to reduce the return value size, which means either cutting back the lesson count or finding a way to make the data structure itself more compact.\n\nBut stepping back, the real issue is that 0.07ms is already incredibly fast for building a graph with 828 nodes—it's 12,574× faster than the original baseline, and the graph is much richer now. The trade-off is whether sacrificing 0.04ms for a significantly more complete graph is worth it. I'm leaning toward accepting this as a keep since the performance is still excellent and the data richness justifies it, though I'm torn because the primary metric did technically regress.\n\nLet me reconsider what's actually happening here. The lru_cache is supposed to make warm loads constant time regardless of data size, but the 0.03ms to 0.07ms difference suggests it's not truly constant after all. When the cached function returns a larger tuple, the return value lookup is fast, but then reassigning those values to new lists and sets still requires iteration through the entire data structure, which scales with the number of nodes.\n\nI'm weighing a few options: I could cache the reconstructed GraphBuilder object directly instead of just the raw data, but that won't help much since the object still needs to be created. I could reduce the data volume by parsing fewer lessons, though that sacrifices completeness. Or I could just accept that the current approach is fast enough and move on.\n\nActually, I'm realizing the most efficient path is to cache the GraphBuilder object itself rather than rebuilding it from scratch each time. With `lru_cache(maxsize=1)` on a function that returns the builder, subsequent calls would just return the cached object directly—no reconstruction needed, just an O(1) pointer return. That's the cleanest solution. I could restructure `_cached_build` to return the GraphBuilder object directly instead of rebuilding it in `build_graph`. If I add a `_cache_ver=2` parameter to force a cache miss, the first call would populate the cache, and subsequent calls would just return the cached builder object without any reconstruction overhead.\n\nBut there's a problem: the `build_graph` function expects to return both the builder and a timing metric, so caching just the builder won't work with the current interface. I need to think about whether I can cache the full return value or if there's another way to avoid the reconstruction cost.\n\nActually, the real issue is that even with lru_cache, we're still rebuilding the GraphBuilder from the cached tuple on every call—that reconstruction step is where the time is going. So I should cache the entire builder object itself instead, which would eliminate the reconstruction overhead entirely.","thinkingSignature":"7f982e03258ad477471e2c83b274f0ef443cb6616b98a74b72ed1ad91bd60920"},{"type":"text","text":"The warm load went 0.03ms→0.0745ms because rebuilding GraphBuilder from cached tuples scales with node count. Fix: cache the `GraphBuilder` object itself, not just raw tuples.\n"},{"type":"toolCall","id":"call_function_1rutihyircbo_1","name":"edit","arguments":{"path":"/home/ubuntu/.hermes/agi/graph_builder.py","edits":[{"oldText":"    # Try lru_cache first (no pickle.load) — bump _cache_ver=2 to bust cache after code/data changes\n    try:\n        nodes, edges, adj = _cached_build(hermes_dir, agi_dir, gitnexus_hash, _cache_ver=2)\n        # Reconstruct builder from cached parts\n        builder = GraphBuilder()\n        builder.nodes = list(nodes)\n        builder.edges = list(edges)\n        builder.adj = adj\n        builder._node_ids = {n[0] for n in nodes}\n        elapsed_ms = (time.perf_counter() - start) * 1000\n        return builder, elapsed_ms\n    except Exception:\n        pass\n\n    # Fallback: try pickle cache\n    init_cache(agi_dir)\n    cache_to_use = gitnexus_cache\n    builder = _try_load_graph_cache(agi_dir, {}, gitnexus_cache)\n    if builder is not None:\n        elapsed_ms = (time.perf_counter() - start) * 1000\n        return builder, elapsed_ms","newText":"    # Try lru_cache first (no pickle.load) — bump _cache_ver=2 to bust cache after code/data changes\n    try:\n        builder = _cached_build_builder(hermes_dir, agi_dir, gitnexus_hash, _cache_ver=2)\n        elapsed_ms = (time.perf_counter() - start) * 1000\n        return builder, elapsed_ms\n    except Exception:\n        pass\n\n    # Fallback: try pickle cache\n    init_cache(agi_dir)\n    cache_to_use = gitnexus_cache\n    builder = _try_load_graph_cache(agi_dir, {}, gitnexus_cache)\n    if builder is not None:\n        elapsed_ms = (time.perf_counter() - start) * 1000\n        return builder, elapsed_ms"}]}}],"api":"anthropic-messages","provider":"minimax","model":"MiniMax-M2.7","usage":{"input":37919,"output":1568,"cacheRead":10071,"cacheWrite":0,"totalTokens":49558,"cost":{"input":0.011375699999999999,"output":0.0018816,"cacheRead":0.0006042599999999999,"cacheWrite":0,"total":0.01386156}},"stopReason":"toolUse","timestamp":1777535647677,"responseId":"06423da0a5693b0ba4a468366ce41b67"}}
{"type":"message","id":"7e6f8360","parentId":"73bcc6c8","timestamp":"2026-04-30T07:54:47.202Z","message":{"role":"toolResult","toolCallId":"call_function_1rutihyircbo_1","toolName":"edit","content":[{"type":"text","text":"Successfully replaced 1 block(s) in /home/ubuntu/.hermes/agi/graph_builder.py."}],"details":{"diff":"     ...\n 881             pass\n 882 \n 883     # Try lru_cache first (no pickle.load) — bump _cache_ver=2 to bust cache after code/data changes\n 884     try:\n-885         nodes, edges, adj = _cached_build(hermes_dir, agi_dir, gitnexus_hash, _cache_ver=2)\n-886         # Reconstruct builder from cached parts\n-887         builder = GraphBuilder()\n-888         builder.nodes = list(nodes)\n-889         builder.edges = list(edges)\n-890         builder.adj = adj\n-891         builder._node_ids = {n[0] for n in nodes}\n+885         builder = _cached_build_builder(hermes_dir, agi_dir, gitnexus_hash, _cache_ver=2)\n 892         elapsed_ms = (time.perf_counter() - start) * 1000\n 893         return builder, elapsed_ms\n 894     except Exception:\n 895         pass\n     ...","firstChangedLine":885},"isError":false,"timestamp":1777535687202}}
{"type":"message","id":"31312135","parentId":"7e6f8360","timestamp":"2026-04-30T07:55:03.425Z","message":{"role":"assistant","content":[{"type":"thinking","thinking":"Now I need to add the `_cached_build_builder` function. It should return a GraphBuilder object directly.","thinkingSignature":"9054b5960951a77473ac56ae7e91a20c3b03c4e4b6a5ed06cdb77e7a7fccbfc5"},{"type":"text","text":"Now add the builder-caching function:\n"},{"type":"toolCall","id":"call_function_frett1g04x3m_1","name":"edit","arguments":{"path":"/home/ubuntu/.hermes/agi/graph_builder.py","edits":[{"oldText":"@lru_cache(maxsize=1)\ndef _cached_build(hermes_dir: str, agi_dir: str, gitnexus_hash: int, _cache_ver: int = 1) -> Tuple[Tuple, Tuple, Dict]:","newText":"@lru_cache(maxsize=1)\ndef _cached_build_builder(hermes_dir: str, agi_dir: str, gitnexus_hash: int, _cache_ver: int = 1) -> GraphBuilder:"}]}}],"api":"anthropic-messages","provider":"minimax","model":"MiniMax-M2.7","usage":{"input":39523,"output":1058,"cacheRead":10071,"cacheWrite":0,"totalTokens":50652,"cost":{"input":0.0118569,"output":0.0012695999999999999,"cacheRead":0.0006042599999999999,"cacheWrite":0,"total":0.01373076}},"stopReason":"toolUse","timestamp":1777535687203,"responseId":"06423dc7073188a9b9dd3982a0f88bc5"}}
{"type":"message","id":"91d6cc3f","parentId":"31312135","timestamp":"2026-04-30T07:55:03.433Z","message":{"role":"toolResult","toolCallId":"call_function_frett1g04x3m_1","toolName":"edit","content":[{"type":"text","text":"Successfully replaced 1 block(s) in /home/ubuntu/.hermes/agi/graph_builder.py."}],"details":{"diff":"     ...\n 789     except Exception:\n 790         pass\n 791 \n 792 @lru_cache(maxsize=1)\n-793 def _cached_build(hermes_dir: str, agi_dir: str, gitnexus_hash: int, _cache_ver: int = 1) -> Tuple[Tuple, Tuple, Dict]:\n+793 def _cached_build_builder(hermes_dir: str, agi_dir: str, gitnexus_hash: int, _cache_ver: int = 1) -> GraphBuilder:\n 794     \"\"\"Cached builder internals — returns serializable parts only.\n 795     \n 796     lru_cache eliminates pickle.load entirely for warm calls.\n 797     gitnexus_hash is a cache-busting int derived from gitnexus content.\n     ...","firstChangedLine":793},"isError":false,"timestamp":1777535703433}}
{"type":"message","id":"5cc9c28a","parentId":"91d6cc3f","timestamp":"2026-04-30T07:55:08.300Z","message":{"role":"assistant","content":[{"type":"thinking","thinking":"Now I need to update the body of `_cached_build_builder` to return a GraphBuilder instead of tuples. And I need to rename the inner `_cached_build` calls. Wait, I already renamed the function signature. But the body still has the old code that returns tuples. Let me read the file to see the current state.","thinkingSignature":"d7dc5b2be9e87067ebd724bf7bf5a13eac33459ce7971bb446107411cc0f2d92"},{"type":"toolCall","id":"call_function_1pwogzwbmz5g_1","name":"read","arguments":{"path":"/home/ubuntu/.hermes/agi/graph_builder.py","offset":330,"limit":100}}],"api":"anthropic-messages","provider":"minimax","model":"MiniMax-M2.7","usage":{"input":39742,"output":124,"cacheRead":10071,"cacheWrite":0,"totalTokens":49937,"cost":{"input":0.0119226,"output":0.00014879999999999998,"cacheRead":0.0006042599999999999,"cacheWrite":0,"total":0.01267566}},"stopReason":"toolUse","timestamp":1777535703434,"responseId":"06423dd7dc0be855e677b2bd0352efb6"}}
{"type":"message","id":"8da6d6d2","parentId":"5cc9c28a","timestamp":"2026-04-30T07:55:08.302Z","message":{"role":"toolResult","toolCallId":"call_function_1pwogzwbmz5g_1","toolName":"read","content":[{"type":"text","text":"                title = title_match.group(1)[:60] if title_match else filename[:-3]\n\n                # Extract lesson summary\n                lesson_match = re.search(r'## Lesson\\s*\\n\\n(.+?)(?:\\n\\n|##)', content, re.DOTALL)\n                lesson_text = lesson_match.group(1).strip()[:100] if lesson_match else \"\"\n\n                self.add_node(\n                    \"lesson\",\n                    title,\n                    lesson_text,\n                    f\"lessons/{filename}\",\n                    f\"lesson_{filename[:-3]}\"\n                )\n                count += 1\n\n            except Exception:\n                pass\n        return count\n\n    def parse_tasks(self, tasks_dir: str, limit: int = 50) -> int:\n        \"\"\"Parse task files into graph nodes with status/priority edges.\"\"\"\n        if not os.path.isdir(tasks_dir):\n            return 0\n\n        files = sorted(os.listdir(tasks_dir), reverse=True)\n        # Filter to .md files only\n        md_files = [f for f in files if f.endswith('.md')][:limit]\n\n        task_ids = {}  # filename -> node_id for dependency linking\n        count = 0\n\n        for filename in md_files:\n            filepath = os.path.join(tasks_dir, filename)\n            try:\n                with open(filepath, \"r\") as f:\n                    content = f.read()\n\n                # Extract frontmatter\n                fm_match = _RE_FRONT_MATTER.match(content)\n                meta = {}\n                if fm_match:\n                    for line in fm_match.group(1).split('\\n'):\n                        m = _RE_YAML_PAIR.match(line)\n                        if m:\n                            meta[m.group(1)] = m.group(2)\n\n                # Extract task title\n                title_match = re.search(r'^#\\s+(.+)$', content, re.MULTILINE)\n                title = title_match.group(1)[:60] if title_match else filename[:-3]\n\n                # Extract goal summary (first paragraph after frontmatter)\n                goal_match = re.search(r'### Goal\\s*\\n\\n(.+?)(?:\\n\\n|##)', content, re.DOTALL)\n                goal_text = goal_match.group(1).strip()[:100] if goal_match else \"\"\n\n                status = meta.get('status', 'open')\n                priority = meta.get('priority', 'medium')\n                created = meta.get('created', '')\n\n                # Summary label: title + status\n                label = f\"{title[:50]}\"\n                summary = f\"{status}|{priority}|{created[:10]}|{goal_text[:40]}\"\n\n                task_key = filename[:-3]  # strip .md\n                task_id = self.add_node(\n                    \"task\",\n                    label,\n                    summary,\n                    f\"tasks/{filename}\",\n                    f\"task_{task_key[:50]}\"\n                )\n                task_ids[task_key] = task_id\n                count += 1\n\n            except Exception:\n                pass\n\n        # Second pass: add depends_on edges\n        for filename in md_files:\n            filepath = os.path.join(tasks_dir, filename)\n            try:\n                with open(filepath, \"r\") as f:\n                    content = f.read()\n                fm_match = _RE_FRONT_MATTER.match(content)\n                if not fm_match:\n                    continue\n                meta = {}\n                for line in fm_match.group(1).split('\\n'):\n                    m = _RE_YAML_PAIR.match(line)\n                    if m:\n                        meta[m.group(1)] = m.group(2)\n\n                dep_str = meta.get('depends_on', '').strip('[] ')\n                if not dep_str:\n                    continue\n\n                depends = [d.strip().strip(\"'\").strip('\"') for d in dep_str.split(',') if d.strip()]\n                src_key = filename[:-3]\n                src_id = task_ids.get(src_key)\n                if not src_id:\n                    continue\n\n[549 more lines in file. Use offset=430 to continue.]"}],"isError":false,"timestamp":1777535708302}}
{"type":"message","id":"bbc638db","parentId":"8da6d6d2","timestamp":"2026-04-30T07:55:12.160Z","message":{"role":"assistant","content":[{"type":"thinking","thinking":"Let me find the `_cached_build_builder` function and see its current body.","thinkingSignature":"bf2e4e50abadcb3615dc42d9e453a254fe49cdefddad97587052158dbccd6289"},{"type":"toolCall","id":"call_function_zbs5aacuceya_1","name":"read","arguments":{"path":"/home/ubuntu/.hermes/agi/graph_builder.py","offset":530,"limit":100}}],"api":"anthropic-messages","provider":"minimax","model":"MiniMax-M2.7","usage":{"input":40713,"output":73,"cacheRead":10071,"cacheWrite":0,"totalTokens":50857,"cost":{"input":0.0122139,"output":0.0000876,"cacheRead":0.0006042599999999999,"cacheWrite":0,"total":0.01290576}},"stopReason":"toolUse","timestamp":1777535708303,"responseId":"06423ddc5a20be55910cae4cdbbc558a"}}
