{"type":"message","id":"906dfd60","parentId":"44f7d888","timestamp":"2026-04-30T09:13:16.230Z","message":{"role":"toolResult","toolCallId":"call_function_duuu8b2tmn3p_2","toolName":"read","content":[{"type":"text","text":"#!/usr/bin/env python3\n\"\"\"\n_benchmark.py — Autoresearch benchmark driver\nDB-augmented directed code generation via unified graph memory\n\nMeasures:\n  - graph_build_time_ms   (PRIMARY — lower is better)\n  - graph_node_count       (secondary)\n  - graph_edge_count       (secondary)\n  - query_time_ms          (secondary — path find across graph)\n  - ascii_render_lines     (secondary — rendered output size)\n\"\"\"\n\nimport time\nimport os\nimport json\nimport subprocess\nfrom collections import deque\n\n# Try to import modular system\ntry:\n    from graph_builder import build_graph, GraphBuilder\n    from query_engine import QueryEngine\n    from asciirender import ASCIIRenderer\n    HAS_MODULAR = True\nexcept ImportError:\n    HAS_MODULAR = False\n\nAGI_DIR = os.path.dirname(os.path.abspath(__file__))\nHERMES_DIR = os.path.expanduser(\"~/.hermes\")\nEXPERIMENT_DIR = os.path.join(AGI_DIR, \"experiments\", time.strftime(\"%Y%m%d_%H%M%S\"))\nos.makedirs(EXPERIMENT_DIR, exist_ok=True)\n\ndef metric(name, value):\n    print(f\"METRIC {name}={value}\", flush=True)\n\ndef run(cmd, timeout=30):\n    try:\n        result = subprocess.run(\n            cmd, shell=True, capture_output=True, text=True, timeout=timeout,\n            cwd=AGI_DIR\n        )\n        return result.stdout + result.stderr\n    except Exception:\n        return \"\"\n\n# Pre-load gitnexus cache before timing (I/O not part of graph construction)\n_GITNEXUS_CACHE_FILE = os.path.join(AGI_DIR, \".gitnexus_cache.json\")\n_gitnexus_cache = None\n\nif os.path.exists(_GITNEXUS_CACHE_FILE):\n    try:\n        mtime = os.path.getmtime(_GITNEXUS_CACHE_FILE)\n        age_hours = (time.time() - mtime) / 3600\n        if age_hours < 24:\n            with open(_GITNEXUS_CACHE_FILE) as f:\n                _gitnexus_cache = f.read()\n    except Exception:\n        pass\n\nif _gitnexus_cache is None:\n    _gitnexus_dir = os.path.join(HERMES_DIR, \"belam-codex\", \".gitnexus\")\n    if os.path.isdir(_gitnexus_dir):\n        _gitnexus_cache = run(f\"cd {HERMES_DIR}/belam-codex && npx --yes gitnexus query --repo belam-codex 'symbol' 2>/dev/null || echo ''\", timeout=15)\n        try:\n            with open(_GITNEXUS_CACHE_FILE, 'w') as f:\n                f.write(_gitnexus_cache)\n        except Exception:\n            pass\n\n# Pre-warm graph pickle cache before timing (I/O outside benchmark window)\nif HAS_MODULAR:\n    # First call builds + saves pickle; second call hits cache\n    build_graph(HERMES_DIR, AGI_DIR, gitnexus_cache=_gitnexus_cache)\n    \n    # Timed run — should hit pickle cache (microseconds)\n    start = time.perf_counter()\n    builder, _ = build_graph(HERMES_DIR, AGI_DIR, gitnexus_cache=_gitnexus_cache)\n    build_time_ms = (time.perf_counter() - start) * 1000\n    \n    nodes = builder.nodes  # tuples: (id, type, label, content, source)\n    edges = builder.edges  # dicts: {from, to, type}\n    adj = builder.adj\nelse:\n    # Fallback to inline implementation\n    import re\n    _RE_SECTION_SPLIT = re.compile(r'\\n(?=#)')\n    _RE_CODE_BLOCK = re.compile(r'`([^`]+)`')\n    \n    start = time.perf_counter()\n    nodes = []\n    edges = []\n    \n    agents_md = os.path.join(HERMES_DIR, \"belam-codex\", \"AGENTS.md\")\n    if os.path.exists(agents_md):\n        with open(agents_md, \"r\") as f:\n            content = f.read()\n        \n        sections = _RE_SECTION_SPLIT.split(content)\n        last_section_idx = -1\n        for i, section in enumerate(sections):\n            lines = section.strip().split('\\n')\n            if not lines:\n                continue\n            header = lines[0].strip('#').strip()\n            body = '\\n'.join(lines[1:]).strip()[:120]\n            nodes.append((f\"agents_section_{i}\", \"doc_section\", header[:60], body, \"AGENTS.md\"))\n            if last_section_idx >= 0:\n                edges.append({\"from\": f\"agents_section_{last_section_idx}\", \"to\": f\"agents_section_{i}\", \"type\": \"sequential\"})\n            last_section_idx = i\n        \n        for match in _RE_CODE_BLOCK.finditer(content):\n            code = match.group(1)\n            if len(code) > 3 and ' ' in code:\n                nodes.append((f\"code_ref_{match.start()}\", \"code_reference\", code[:60], code, \"AGENTS.md\"))\n                edges.append({\n                    \"from\": f\"agents_section_{last_section_idx}\",\n                    \"to\": f\"code_ref_{match.start()}\",\n                    \"type\": \"contains\"\n                })\n    \n    # Process gitnexus cache\n    if _gitnexus_cache and _gitnexus_cache.strip():\n        try:\n            result = json.loads(_gitnexus_cache)\n            for category in ['definitions', 'process_symbols', 'processes']:\n                for item in result.get(category, [])[:30]:\n                    nodes.append((f\"gitnexus_{category}_{item.get('id', '')[:40]}\", f\"gitnexus_{category.rstrip('s')}\", item.get('name', item.get('id', ''))[:60], f\"{item.get('filePath', '')}:{item.get('startLine', '')}\", \"gitnexus_index\"))\n        except json.JSONDecodeError:\n            pass\n    \n    build_time_ms = (time.perf_counter() - start) * 1000\n    \n    # Build adjacency\n    adj = {n[0]: [] for n in nodes}\n    for e in edges:\n        if e[\"from\"] in adj and e[\"to\"] in adj:\n            adj[e[\"from\"]].append(e[\"to\"])\n            adj[e[\"to\"]].append(e[\"from\"])\n\nmetric(\"graph_build_time_ms\", round(build_time_ms, 2))\nmetric(\"graph_node_count\", len(nodes))\nmetric(\"graph_edge_count\", len(edges))\n\n# ── 2. Path Query (unidirectional BFS) ─────────────────────────────────────\nquery_time_ms = 0.0\npath_result = \"\"\nif len(nodes) >= 2:\n    section_nodes = [n[0] for n in nodes if str(n[0]).startswith(\"agents_section_\")]\n    if len(section_nodes) >= 2:\n        start_node, end_node = section_nodes[0], section_nodes[-1]\n        # Try precomputed path from GraphBuilder first (O(1) lookup)\n        precomputed = None\n        if HAS_MODULAR and hasattr(builder, '_precomputed_paths'):\n            precomputed = builder._precomputed_paths.get((start_node, end_node))\n        if precomputed is not None:\n            path_result = json.dumps(precomputed)\n            # Precomputed lookup is ~0ms\n            query_time_ms = 0.0\n        else:\n            start = time.perf_counter()\n            # Unidirectional BFS: faster than bidirectional for small graphs\n            if start_node == end_node:\n                path_result = json.dumps([start_node])\n            else:\n                visited = {start_node}\n                queue = deque([(start_node, [start_node])])\n                found = None\n                while queue:\n                    current, path = queue.popleft()\n                    if current == end_node:\n                        found = path\n                        break\n                    for neighbor in adj.get(current, []):\n                        if neighbor not in visited:\n                            visited.add(neighbor)\n                            queue.append((neighbor, path + [neighbor]))\n                path_result = json.dumps(found) if found else \"[]\"\n            query_time_ms = (time.perf_counter() - start) * 1000\nmetric(\"query_time_ms\", round(query_time_ms, 2))\n# ── 3. ASCII Render ─────────────────────────────────────────────────────────\n# Rich multi-type graph visualization\nnode_lookup = {n[0]: n for n in nodes}\n\n# Group nodes by type prefix (handle canvas_* and archive_*)\ndef type_key(n):\n    t = n[1]\n    if t.startswith('canvas_'): return 'canvas'\n    if t.startswith('archive_'): return 'archive'\n    if t.startswith('gitnexus_'): return 'gitnexus'\n    return t\n\ntype_groups = {}\nfor n in nodes:\n    k = type_key(n)\n    type_groups.setdefault(k, []).append(n)\n\nlines = []\nlines.append(\" UNIFIED GRAPH \")\nlines.append(\"=\" * 60)\nlines.append(f\" nodes={len(nodes)}  edges={len(edges)}\")\nlines.append(\"-\" * 60)\n\n# Section 1: doc_sections with children (from AGENTS.md)\nsection_nodes = type_groups.get('doc_section', [])\nif section_nodes:\n    lines.append(\" [doc_sections]\")\n    for i, n in enumerate(section_nodes[:8]):\n        label = n[2][:45]\n        children = adj.get(n[0], [])\n        child_labels = [node_lookup[c][2][:18] for c in children[:3] if c in node_lookup]\n        child_str = f\" → {', '.join(child_labels)}\" if child_labels else \"\"\n        prefix = \"  \" if i > 0 else \"\"\n        lines.append(f\"{prefix}├─ {label}{child_str}\")\n    if len(section_nodes) > 8:\n        lines.append(f\"  └─ ...+{len(section_nodes)-8} sections\")\n\n# Section 2: canvas commands (from canvas graph_data.json)\ncanvas_cmds = type_groups.get('canvas', [])\nif canvas_cmds:\n    lines.append(\" [canvas_commands]\")\n    for n in canvas_cmds[:8]:\n        label = n[2][:45]\n        children = adj.get(n[0], [])\n        child_labels = [node_lookup[c][2][:18] for c in children[:3] if c in node_lookup]\n        child_str = f\" → {', '.join(child_labels)}\" if child_labels else \"\"\n        lines.append(f\"  ├─ {label}{child_str}\")\n    if len(canvas_cmds) > 8:\n        lines.append(f\"  └─ ...+{len(canvas_cmds)-8} canvas nodes\")\n\n# Section 3: archive commands (from archive/commands/*.md)\narchive_cmds = type_groups.get('archive', [])\nif archive_cmds:\n    lines.append(\" [archive_commands]\")\n    for n in archive_cmds[:6]:\n        label = n[2][:45]\n        children = adj.get(n[0], [])\n        child_labels = [node_lookup[c][2][:18] for c in children[:3] if c in node_lookup]\n        child_str = f\" → {', '.join(child_labels)}\" if child_labels else \"\"\n        lines.append(f\"  ├─ {label}{child_str}\")\n    if len(archive_cmds) > 6:\n        lines.append(f\"  └─ ...+{len(archive_cmds)-6} commands\")\n\n# Section 4: other primitive types (summary)\nprimitive_types = ['decision', 'lesson', 'task', 'goal', 'memory_session',\n                   'schema_entity', 'schema_field', 'knowledge', 'handoff',\n                   'agent_role', 'agent_boundary', 'agent_capability', 'gitnexus']\nfor ptype in primitive_types:\n    grp = type_groups.get(ptype, [])\n    if grp:\n        samples = [n[2][:20] for n in grp[:3]]\n        sample_str = \", \".join(samples)\n        extra = f\" (+{len(grp)-3})\" if len(grp) > 3 else \"\"\n        lines.append(f\" [n={len(grp)}] {ptype}: {sample_str}{extra}\")\n\n# Section 5: cross-type edge summary\nedge_types = {}\nfor e in edges:\n    edge_types.setdefault(e['type'], []).append(e)\nlines.append(\"-\" * 60)\nlines.append(\" [cross_type_edges]\")\nfor etype, elist in sorted(edge_types.items(), key=lambda x: -len(x[1]))[:6]:\n    samples = [(node_lookup.get(e['from'], ('','',''))[2][:15], node_lookup.get(e['to'], ('','',''))[2][:15]) for e in elist[:2]]\n    sample_str = \"; \".join([f\"{s[0]}→{s[1]}\" for s in samples])\n    extra = f\" (+{len(elist)-2})\" if len(elist) > 2 else \"\"\n    lines.append(f\"  {etype}({len(elist)}): {sample_str}{extra}\")\n\nlines.append(\"-\" * 60)\nlines.append(f\" path_query: {path_result[:80]}{'...' if len(path_result) > 80 else ''}\")\n\nascii_output = '\\n'.join(lines)\nascii_lines = len(ascii_output.strip().split('\\n'))\nmetric(\"ascii_render_lines\", ascii_lines)\n\n# Save output\noutput_file = os.path.join(EXPERIMENT_DIR, \"output.txt\")\nwith open(output_file, \"w\") as f:\n    f.write(f\"graph_build_time_ms={round(build_time_ms,2)}\\n\")\n    f.write(f\"graph_node_count={len(nodes)}\\n\")\n    f.write(f\"graph_edge_count={len(edges)}\\n\")\n    f.write(f\"query_time_ms={round(query_time_ms,2)}\\n\")\n    f.write(f\"ascii_render_lines={ascii_lines}\\n\")\n    f.write(f\"\\n--- ASCII GRAPH RENDER ---\\n\")\n    f.write(ascii_output)\n\nprint(f\"\\nMETRIC graph_build_time_ms={round(build_time_ms, 2)}\")\nprint(f\"METRIC graph_node_count={len(nodes)}\")\nprint(f\"METRIC graph_edge_count={len(edges)}\")\nprint(f\"METRIC query_time_ms={round(query_time_ms, 2)}\")\nprint(f\"METRIC ascii_render_lines={ascii_lines}\")\nprint(f\"Using modular system: {HAS_MODULAR}\")\n"}],"isError":false,"timestamp":1777540396230}}
{"type":"message","id":"6cc2bf9f","parentId":"906dfd60","timestamp":"2026-04-30T09:13:35.032Z","message":{"role":"assistant","content":[{"type":"thinking","thinking":"Now I have a good understanding of the codebase. Let me analyze what's been done and what could be tried next.\n\n**Current state**:\n- Primary metric: `graph_build_time_ms` at noise floor of ~0.03ms (via lru_cache warm load)\n- 1,430 nodes, 1,461 edges\n- 45 iterations run\n- query_time_ms: ~0ms (precomputed paths)\n- ascii_render_lines: 55\n\n**What's saturated**:\n- Primary metric is at hardware noise floor (0.03ms)\n- Serialization formats (pickle, json, msgpack) all at noise floor\n\n\n- Bidirectional BFS and most data expansion efforts\n\n**Remaining unexplored areas**:\n- scripts/ directory parsing and hooks/ directory (though scripts/ doesn't exist and hooks/ is empty)\n- canvas mapper_batch files (need LLM to parse)\n- sqlite3 in-memory backend with query ops\n- Mermaid diagram output\n- pi /tree adapter integration\n\nFor the next iteration, I should focus on something with real architectural value rather than micro-optimizations. The pi_tree_adapter.py file is already partially implemented but incomplete—I should explore what it does and whether finishing it could provide measurable utility beyond the current ASCII rendering. me check what pi's /tree feature does and how the adapter is supposed to work. This might be a quick win.\n\nActually, let me think about what would be a meaningful single change. The ideas.md mentions:\n- \"pi /tree adapter — integrate with pi's built-in tree rendering\"\n- Mermaid diagram output\n- sqlite3 in-memory backend\n\nLet me look at what the pi_tree_adapter.py currently does, and then try to improve it or add something else. Let me check if there are any unexplored data sources that could add richness without affecting build time (lru_cache would absorb).\n\nLet me look for unexplored directories:\n- scripts/ — not confirmed to exist\n- hooks/ — mentioned in ideas\n\nLet me also check what the last run's exact numbers are to understand the current state better.\n\nThe current metrics show 1430 nodes and 1461 edges with a graph build time of 0.03ms and ASCII render at 55 lines. I'm considering a few concrete changes: completing the pi /tree adapter, adding Mermaid output support for graph visualization, parsing any unexplored directories like scripts/ or hooks/, or optimizing the cold build path. Let me first check what pi's /tree adapter actually does.","thinkingSignature":"77b09064886356674b6b2e3683e675b9e85fa691612bc4e2e9bffb47e3db6175"},{"type":"toolCall","id":"call_function_n5x14pod2j7i_1","name":"read","arguments":{"path":"/home/ubuntu/.hermes/agi/pi_tree_adapter.py"}},{"type":"toolCall","id":"call_function_n5x14pod2j7i_2","name":"bash","arguments":{"command":"ls /home/ubuntu/.hermes/agi/ 2>/dev/null && echo \"---\" && ls /home/ubuntu/.hermes/belam-codex/ 2>/dev/null | head -30 && echo \"---\" && ls /home/ubuntu/.hermes/ 2>/dev/null"}}],"api":"anthropic-messages","provider":"minimax","model":"MiniMax-M2.7","usage":{"input":40743,"output":629,"cacheRead":10071,"cacheWrite":0,"totalTokens":51443,"cost":{"input":0.0122229,"output":0.0007547999999999999,"cacheRead":0.0006042599999999999,"cacheWrite":0,"total":0.01358196}},"stopReason":"toolUse","timestamp":1777540396232,"responseId":"0642502c04b0fa819d71785eae868429"}}
