{"type":"message","id":"55be09b6","parentId":"313ce988","timestamp":"2026-04-30T08:22:28.277Z","message":{"role":"toolResult","toolCallId":"call_function_1bn932hbbtjm_1","toolName":"read","content":[{"type":"text","text":"\"\"\"Codex Interceptor — catches raw commands and suggests coordinate equivalents.\n\nPhase C of the Codex Layer. Provides:\n  - 10 static interception rules for common raw→coordinate mappings\n  - LM auto-rules stubbed for v1 (FLAG-4: speculative, design in v2)\n  - Graduated enforcement: advisory → redirect → block\n  - Workspace-prefix check to avoid false positives (Q3)\n  - Advisory mode only for Phase 1\n\nPipeline: build-codex-layer-v1\n\"\"\"\n\nfrom __future__ import annotations\n\nimport re\nfrom dataclasses import dataclass\nfrom pathlib import Path\nfrom typing import Optional, List\n\nfrom codex_output_codec import CodexResult\n\n\n# ── Data model ──────────────────────────────────────────────────────────────\n\n@dataclass\nclass InterceptionRule:\n    \"\"\"Maps a raw command pattern to its coordinate equivalent.\"\"\"\n    pattern: re.Pattern       # regex matching raw command\n    coordinate_template: str  # coordinate equivalent (human-readable suggestion)\n    description: str          # explanation shown to agent\n    source: str               # 'static' | 'lm'\n\n\n# ── Static Rules (top 10 raw→coordinate mappings) ──────────────────────────\n\n# Q3 fix: patterns include workspace-relative paths to avoid false positives\n\nSTATIC_RULES: List[InterceptionRule] = [\n    InterceptionRule(\n        pattern=re.compile(r'\\bcat\\s+(?:\\./)?(?:tasks|decisions|lessons|pipelines|commands|modes|knowledge)/(\\S+)\\.md\\b'),\n        coordinate_template='{ns}{n} — navigate via coordinate',\n        description='Navigate via coordinate instead of cat',\n        source='static',\n    ),\n    InterceptionRule(\n        pattern=re.compile(r'\\bgrep\\b.*\\s+(?:\\./)?(?:tasks|decisions|lessons|pipelines)/'),\n        coordinate_template='--tag {pattern} or --since {d} — use engine filters',\n        description='Use engine filter instead of grep',\n        source='static',\n    ),\n    InterceptionRule(\n        pattern=re.compile(r'\\becho\\s+\"[^\"]*\"\\s*>>\\s*(?:\\./)?(?:tasks|decisions|lessons|pipelines)/(\\S+)\\.md\\b'),\n        coordinate_template='e1{coord} B+ \"{text}\" — append via edit mode',\n        description='Append via edit mode instead of echo >>',\n        source='static',\n    ),\n    InterceptionRule(\n        pattern=re.compile(r'\\bpython3\\s+scripts/codex_engine\\.py\\s+--supermap\\b'),\n        coordinate_template='e0 — orchestration sweep includes supermap',\n        description='Use e0 for full orchestration sweep',\n        source='static',\n    ),\n    InterceptionRule(\n        pattern=re.compile(r'\\bpython3\\s+scripts/pipeline_update\\.py\\s+(\\S+)\\s+show\\b'),\n        coordinate_template='p{n} — navigate to pipeline coordinate',\n        description='Navigate to pipeline coordinate',\n        source='static',\n    ),\n    InterceptionRule(\n        pattern=re.compile(r'\\bpython3\\s+scripts/pipeline_update\\.py\\s+(\\S+)\\s+complete\\b'),\n        coordinate_template='e0p{n} — use orchestrate mode for transitions',\n        description='Use orchestrate mode for pipeline transitions',\n        source='static',\n    ),\n    InterceptionRule(\n        pattern=re.compile(r'\\bRead\\b.*(?:tasks|decisions|lessons|pipelines|commands|modes)/'),\n        coordinate_template='{coord} — use coordinate navigation instead of Read',\n        description='Use coordinate navigation instead of Read tool',\n        source='static',\n    ),\n    InterceptionRule(\n        pattern=re.compile(r'\\bls\\s+(?:\\./)?(?:tasks|decisions|lessons|pipelines|commands|modes)/'),\n        coordinate_template='{ns} — use namespace coordinate for listing',\n        description='Use namespace coordinate for listing',\n        source='static',\n    ),\n    InterceptionRule(\n        pattern=re.compile(r'\\bsed\\b.*\\s+(?:\\./)?(?:tasks|decisions|lessons|pipelines)/(\\S+)\\.md\\b'),\n        coordinate_template='e1{coord} {field} {value} — use edit mode instead of sed',\n        description='Use edit mode instead of sed',\n        source='static',\n    ),\n    InterceptionRule(\n        pattern=re.compile(r'\\bpython3\\s+scripts/log_memory\\.py\\b'),\n        coordinate_template='e2 m \"entry\" — use create mode for memory entries',\n        description='Use create mode for memory entries',\n        source='static',\n    ),\n]\n\n\n# ── Interceptor ─────────────────────────────────────────────────────────────\n\nclass CodexInterceptor:\n    \"\"\"Catches raw commands and suggests/redirects to coordinates.\n\n    Modes:\n      advisory (Phase 1): suggest coordinate, let command through\n      redirect (Phase 2): execute coordinate equivalent instead\n      block (Phase 2+):   block raw command, require coordinate or ! override\n    \"\"\"\n\n    def __init__(self, workspace: Path, mode: str = 'advisory'):\n        self.workspace = workspace\n        self.mode = mode  # 'advisory' | 'redirect' | 'block'\n        self.rules: List[InterceptionRule] = []\n        self._build_rules()\n\n    def _build_rules(self):\n        \"\"\"Build interception rules from static patterns + LM namespace.\"\"\"\n        self.rules.extend(STATIC_RULES)\n\n        # FLAG-4: LM auto-rules stubbed for v1.\n        # LMEntry has no replaces_pattern field — auto-generation requires\n        # schema extension. Static rules cover the top-10 patterns.\n        # Uncomment when LM schema has reverse-pattern support:\n        #\n        # try:\n        #     from codex_lm_renderer import build_lm_tree\n        #     entries = build_lm_tree(self.workspace)\n        #     for entry in entries:\n        #         rule = self._lm_entry_to_rule(entry)\n        #         if rule:\n        #             self.rules.append(rule)\n        # except ImportError:\n        #     pass\n\n    def _lm_entry_to_rule(self, entry) -> Optional[InterceptionRule]:\n        \"\"\"Stub: convert LM entry to interception rule.\n\n        v2 will add replaces_pattern to LMEntry for proper reverse-mapping.\n        \"\"\"\n        return None  # FLAG-4: stubbed for v1\n\n    def check(self, command: str) -> Optional[CodexResult]:\n        \"\"\"Check command against interception rules.\n\n        Returns CodexResult with suggestion/redirect/block, or None for passthrough.\n        \"\"\"\n        # Q3: Only intercept commands that reference workspace-relative paths\n        # (patterns already scoped to workspace dirs in STATIC_RULES)\n        for rule in self.rules:\n            m = rule.pattern.search(command)\n            if m:\n                suggestion = rule.coordinate_template\n                return self._apply_mode(command, suggestion, rule)\n        return None\n\n    def _apply_mode(self, command: str, suggestion: str, rule: InterceptionRule) -> CodexResult:\n        \"\"\"Apply enforcement mode to a matched rule.\"\"\"\n        if self.mode == 'advisory':\n            # Let command through, append suggestion as hint\n            return CodexResult(\n                coord='_hint',\n                source='interceptor',\n                content_type='text',\n                fields={'suggestion': suggestion, 'original': command},\n                raw=command,\n                rendered=f'💡 Coordinate equivalent: {suggestion}',\n            )\n\n        elif self.mode == 'redirect':\n            # Would redirect to coordinate equivalent — not active in v1\n            return CodexResult(\n                coord='_redirect',\n                source='interceptor',\n                content_type='text',\n                fields={'suggestion': suggestion, 'original': command},\n                raw=command,\n                rendered=f'↪ Redirecting to: {suggestion}',\n            )\n\n        elif self.mode == 'block':\n            # Block with instruction — not active in v1\n            return CodexResult(\n                coord='_blocked',\n                source='interceptor',\n                content_type='text',\n                fields={'suggestion': suggestion, 'original': command},\n                raw=command,\n                rendered=f'⛔ Raw command blocked. Use: {suggestion}\\n   Override with: !{command}',\n            )\n\n        return None\n\n\n# ── CLI test entry point ────────────────────────────────────────────────────\n\nif __name__ == '__main__':\n    import sys\n    workspace = Path(sys.argv[1]) if len(sys.argv) > 1 else Path.home() / '.openclaw' / 'workspace'\n    interceptor = CodexInterceptor(workspace)\n\n    if len(sys.argv) > 2:\n        command = ' '.join(sys.argv[2:])\n        result = interceptor.check(command)\n        if result:\n            print(result.rendered)\n        else:\n            print(f'No interception for: {command}')\n    else:\n        print(f'Loaded {len(interceptor.rules)} rules ({sum(1 for r in interceptor.rules if r.source == \"static\")} static)')\n        for r in interceptor.rules:\n            print(f'  [{r.source}] {r.description}')\n"}],"isError":false,"timestamp":1777537348277}}
