{"type":"message","id":"3502bc2e","parentId":"f73e4566","timestamp":"2026-04-30T08:01:56.739Z","message":{"role":"assistant","content":[{"type":"thinking","thinking":"Good. The experiment is complete. Let me summarize:\n\n- Iteration 31: Clear stale pickle cache to restore knowledge/handoff nodes\n- 886 nodes (up from 828), 380 edges (up from 310), 0.03ms unchanged\n- Primary metric noise floor saturated at 0.03ms\n- Keep because node richness improved without metric regression","thinkingSignature":"e8cb547c5a7a608fccbfba9374bd0223e5f8ad58d8b5dd3d4580a98d44be9a0b"},{"type":"text","text":"**Iter 31 (keep):** Cleared stale pickle cache → restored knowledge(15)+handoff(7) nodes. 828→886 nodes (+58), 380 edges (+70). Primary: 0.03ms unchanged (noise floor)."}],"api":"anthropic-messages","provider":"minimax","model":"MiniMax-M2.7","usage":{"input":43093,"output":132,"cacheRead":10071,"cacheWrite":0,"totalTokens":53296,"cost":{"input":0.012927899999999999,"output":0.0001584,"cacheRead":0.0006042599999999999,"cacheWrite":0,"total":0.01369056}},"stopReason":"stop","timestamp":1777536109774,"responseId":"06423f6e85a8922cbfde29f80b0e37e3"}}
{"type":"message","id":"dba092a7","parentId":"3502bc2e","timestamp":"2026-04-30T08:01:56.747Z","message":{"role":"user","content":[{"type":"text","text":"Autoresearch loop ended (likely context limit). Resume the experiment loop — read autoresearch.md and git log for context. Check autoresearch.ideas.md for promising paths to explore. Prune stale/tried ideas. Be careful not to overfit to the benchmarks and do not cheat on the benchmarks."}],"timestamp":1777536116742}}
