{"type":"message","id":"384724bb","parentId":"2d9765b6","timestamp":"2026-04-30T08:56:00.797Z","message":{"role":"assistant","content":[{"type":"thinking","thinking":"OK, let me think about what to try next. The primary metric is noise floor saturated. The remaining ideas from the backlog are:\n1. Parse scripts/ — doesn't exist\n2. Parse hooks/ — empty\n3. Pre-compute reachability matrix — architectural improvement\n4. Mermaid diagram output — visualization\n\nSince these are all marginal improvements at this point, I should think about what small targeted change I can make. Let me look at the current graph_builder.py to understand the architecture better and think about what I can add.\n\nLooking at what's been done:\n- 1,430 nodes, 1,461 edges\n\n\n- Primary metric is noise floor saturated\n\nI'm considering a few options: adding a reachability matrix to pre-compute graph connectivity for instant cross-cluster queries, improving the ASCII renderer, or parsing the config.yaml. But I'm realizing the reachability matrix is actually problematic — it would create a dense O(n²) structure that would completely negate the memory benefits of the sparse adjacency representation, plus it wouldn't even impact the warm load benchmark since everything's cached anyway.\n\nThe config.yaml parsing is more promising since it would extract actual graph nodes from the hermes config without changing the benchmark metrics. Looking at the benchmark structure, it only measures cold build time, so I need to figure out how to expose config.yaml parsing in a way that affects what gets measured.\n\nBut wait—lru_cache warm load is already at noise floor (0.03ms), so no code changes would register as improvements there. I'm essentially at a local optimum where the metric is already saturated. Let me reconsider what's actually worth pursuing based on the ideas backlog. I'm weighing whether to add Mermaid output to the benchmark or parse additional hermes configuration files like processes.json and gateway_state.json, though I need to be careful about not modifying the benchmark itself since that could introduce new noise rather than actual improvements. Looking at the parse_research_projects method more closely to understand what it already covers.","thinkingSignature":"83300cc134e1a90ecf3f5bd69e012efbc90b22c978289b39481195b7b97aea07"},{"type":"toolCall","id":"call_function_o910e3ekcrmu_1","name":"read","arguments":{"path":"/home/ubuntu/.hermes/agi/graph_builder.py","offset":1968,"limit":80}},{"type":"toolCall","id":"call_function_o910e3ekcrmu_2","name":"bash","arguments":{"command":"find /home/ubuntu/.hermes/sandboxes/ -type f 2>/dev/null | head -5; echo \"---\"; find /home/ubuntu/.hermes/plugins/ -maxdepth 2 -type f 2>/dev/null | head -5"}}],"api":"anthropic-messages","provider":"minimax","model":"MiniMax-M2.7","usage":{"input":12290,"output":532,"cacheRead":10071,"cacheWrite":0,"totalTokens":22893,"cost":{"input":0.0036869999999999997,"output":0.0006384,"cacheRead":0.0006042599999999999,"cacheWrite":0,"total":0.00492966}},"stopReason":"toolUse","timestamp":1777539342698,"responseId":"06424c0fb5d53c19370bba50d8a5d536"}}
{"type":"message","id":"2ccb3e08","parentId":"384724bb","timestamp":"2026-04-30T08:56:00.809Z","message":{"role":"toolResult","toolCallId":"call_function_o910e3ekcrmu_1","toolName":"read","content":[{"type":"text","text":"    def build_tag_bridges(self, hermes_dir: str) -> int:\n        \"\"\"Bridge isolated clusters via shared tags.\n\n        Decisions, lessons, and tasks are largely isolated (94% unreachable in 5 hops).\n        Reads frontmatter from source files via hermes_dir, extracts tags,\n        adds relates_to edges between cross-type nodes sharing each tag.\n        Top 20 shared tags, max 5 edges each to prevent edge explosion.\n        \"\"\"\n        tag_map: Dict[str, set] = defaultdict(set)\n        cross_type_prefixes = ('decision_', 'lesson_', 'task_', 'canvas_decision_',\n                               'canvas_lesson_', 'canvas_task_')\n        source_dir_map = {\n            'decisions/': 'decisions',\n            'lessons/': 'lessons',\n            'tasks/': 'tasks',\n        }\n\n        for node in self.nodes:\n            node_id, node_type, label, content, source = node\n            if not any(node_id.startswith(p) for p in cross_type_prefixes):\n                continue\n\n            subdir = None\n            for src_prefix, sub in source_dir_map.items():\n                if source.startswith(src_prefix):\n                    subdir = sub\n                    filename = source[len(src_prefix):]\n                    break\n            if not subdir:\n                continue\n\n            filepath = os.path.join(hermes_dir, 'belam-codex', subdir, filename)\n            if not os.path.exists(filepath):\n                continue\n            try:\n                with open(filepath, 'r') as f:\n                    file_content = f.read()\n            except Exception:\n                continue\n\n            fm_match = _RE_FRONT_MATTER.match(file_content)\n            if not fm_match:\n                continue\n            tags = []\n            for line in fm_match.group(1).split('\\n'):\n                m = _RE_YAML_PAIR.match(line)\n                if m and m.group(1) == 'tags':\n                    raw = m.group(2)\n                    tags = re.findall(r'\\w+', raw)\n                    break\n            for tag in tags:\n                tag_map[tag].add((node_id, node_type))\n\n        count = 0\n        sorted_tags = sorted(tag_map.items(), key=lambda x: -len(x[1]))\n        for tag, node_set in sorted_tags[:20]:\n            if len(node_set) < 2:\n                continue\n            types_present = {nt for _, nt in node_set}\n            if len(types_present) < 2:\n                continue\n            by_type: Dict[str, list] = defaultdict(list)\n            for nid, ntype in node_set:\n                by_type[ntype].append(nid)\n            type_keys = list(by_type.keys())\n            edges_added = 0\n            for i in range(len(type_keys)):\n                for j in range(i + 1, len(type_keys)):\n                    if edges_added >= 5:\n                        break\n                    src = by_type[type_keys[i]][0]\n                    tgt = by_type[type_keys[j]][0]\n                    if src in self._node_ids and tgt in self._node_ids:\n                        self.add_edge(src, tgt, 'relates_to')\n                        count += 1\n                        edges_added += 1\n        return count\n\n\n    def build_adjacency(self):\n\n[434 more lines in file. Use offset=2048 to continue.]"}],"isError":false,"timestamp":1777539360809}}
{"type":"message","id":"6dd01b0c","parentId":"2ccb3e08","timestamp":"2026-04-30T08:56:00.809Z","message":{"role":"toolResult","toolCallId":"call_function_o910e3ekcrmu_2","toolName":"bash","content":[{"type":"text","text":"---\n/home/ubuntu/.hermes/plugins/caveman_default/plugin.yaml\n/home/ubuntu/.hermes/plugins/caveman_default/__init__.py\n/home/ubuntu/.hermes/plugins/openclaw_hooks/plugin.yaml\n/home/ubuntu/.hermes/plugins/openclaw_hooks/__init__.py\n/home/ubuntu/.hermes/plugins/openclaw_hooks/plugin.py\n"}],"isError":false,"timestamp":1777539360809}}
{"type":"message","id":"442110eb","parentId":"6dd01b0c","timestamp":"2026-04-30T08:56:10.361Z","message":{"role":"assistant","content":[{"type":"thinking","thinking":"There's a plugins/ directory with Python files. Let me check what's in there and if it's worth parsing. The plugins might be an interesting new source.\n\nAlso, let me think about what I can realistically do in one iteration that would be a meaningful change.\n\nThe primary metric is noise floor saturated at 0.03ms. The benchmark measures warm load via lru_cache. Any code change to the builder will:\n1. Either invalidate the cache and cause a cold build (slower, but then the next warm run goes back to 0.03ms)\n2. Or stay within warm load at 0.03ms\n\nFor the log_experiment to say \"keep\", I need the metric to improve. \n\nSince the metric is at the noise floor, any change that adds nodes and edges might not register as an improvement. I could try adding node type summary metadata that counts types without increasing the actual graph data, or I could focus on a structural optimization like improving ASCII renderer grouping logic or implementing better path compression. Let me check if there's a parse_skills method I haven't explored yet.","thinkingSignature":"41624a72433e2b6e55d9f02ce319743d90d10cac24a2fa3db2a3443b3749275b"},{"type":"toolCall","id":"call_function_6n6e3x31wlc0_1","name":"bash","arguments":{"command":"ls /home/ubuntu/.hermes/plugins/ && find /home/ubuntu/.hermes/plugins/ -name \"*.py\" | head -5"}},{"type":"toolCall","id":"call_function_6n6e3x31wlc0_2","name":"bash","arguments":{"command":"grep -n \"def parse_\" /home/ubuntu/.hermes/agi/graph_builder.py"}}],"api":"anthropic-messages","provider":"minimax","model":"MiniMax-M2.7","usage":{"input":13606,"output":313,"cacheRead":10071,"cacheWrite":0,"totalTokens":23990,"cost":{"input":0.0040818,"output":0.00037559999999999997,"cacheRead":0.0006042599999999999,"cacheWrite":0,"total":0.00506166}},"stopReason":"toolUse","timestamp":1777539360810,"responseId":"06424c21181206727d9cda47d9bfb573"}}
{"type":"message","id":"9c4a0d27","parentId":"442110eb","timestamp":"2026-04-30T08:56:10.377Z","message":{"role":"toolResult","toolCallId":"call_function_6n6e3x31wlc0_1","toolName":"bash","content":[{"type":"text","text":"caveman_default\nopenclaw_hooks\n/home/ubuntu/.hermes/plugins/caveman_default/__init__.py\n/home/ubuntu/.hermes/plugins/openclaw_hooks/__init__.py\n/home/ubuntu/.hermes/plugins/openclaw_hooks/plugin.py\n"}],"isError":false,"timestamp":1777539370377}}
{"type":"message","id":"38c5bc74","parentId":"9c4a0d27","timestamp":"2026-04-30T08:56:10.378Z","message":{"role":"toolResult","toolCallId":"call_function_6n6e3x31wlc0_2","toolName":"bash","content":[{"type":"text","text":"87:    def parse_agents_md(self, filepath: str) -> int:\n131:    def parse_memory_files(self, memory_dir: str, limit: int = 10) -> int:\n174:    def parse_schema_files(self, schema_dir: str) -> int:\n257:    def parse_decisions(self, decisions_dir: str, limit: int = 20) -> int:\n328:    def parse_lessons(self, lessons_dir: str, limit: int = 20) -> int:\n398:    def parse_tasks(self, tasks_dir: str, limit: int = 50) -> int:\n490:    def parse_goals(self, goals_dir: str) -> int:\n542:    def parse_agent_roles(self, agents_dir: str) -> int:\n664:    def parse_canvas_graph(self, canvas_dir: str) -> Tuple[int, int]:\n728:    def parse_knowledge(self, knowledge_dir: str) -> int:\n789:    def parse_skills(self, skills_dir: str) -> int:\n945:    def parse_handoff(self, handoff_dir: str) -> int:\n1010:    def parse_archive_commands(self, archive_dir: str) -> int:\n1094:    def parse_docs(self, docs_dir: str) -> int:\n1164:    def parse_personas(self, personas_dir: str) -> int:\n1286:    def parse_research_projects(self, hermes_dir: str) -> int:\n1446:    def parse_pipelines(self, pipelines_dir: str) -> int:\n1639:    def parse_templates(self, templates_dir: str) -> int:\n1740:    def parse_archive_tasks(self, archive_dir: str) -> int:\n1838:    def parse_codex_modules(self, archive_dir: str) -> int:\n"}],"isError":false,"timestamp":1777539370378}}
{"type":"message","id":"2147abb7","parentId":"38c5bc74","timestamp":"2026-04-30T08:56:45.215Z","message":{"role":"assistant","content":[{"type":"thinking","thinking":"The primary metric is noise floor saturated. Let me think about what would be a useful targeted change.\n\nLooking at the ideas backlog, the remaining uncharted territory is:\n- Pre-compute reachability matrix — architectural\n- Mermaid diagram output — visualization\n- scripts/ — doesn't exist\n- hooks/ — empty\n\nSince the primary metric is noise floor saturated and I'm limited to one small change, let me think about what would be most valuable:\n\n1. **Pre-compute reachability matrix** — This is mentioned in the ideas as important because only 54/1,430 nodes are reachable in ≤5 hops from section_0. A reachability matrix would enable instant \"what relates to X\" queries. But this is a complex change that might not affect the primary metric (which is about warm load time, not query capability).\n\n\n2. **Mermaid diagram output** — This is a secondary metric improvement. The ASCII renderer produces 55 lines of output. Adding Mermaid output might increase ascii_render_lines but the current renderer is already measuring line count, not format.\n\nActually, I should reconsider — the benchmark times the entire build_graph() call, not just warm load. Even with lru_cache, if the cold build takes longer, that affects the timing. The cache has a version marker though, so any code changes would invalidate it and force a cold rebuild. Let me look at the actual cache implementation to understand how this works.\n\nThe cached_build_builder function uses a version parameter, and since the cache persists across runs, modifying the builder code would increment that version and trigger a fresh build. So when I make a code change and run the benchmark again, it'll perform a cold build that takes longer, then warm runs would be cached from there.\n\nLooking at the benchmark more carefully, the pickle file gets created on first run with my changes, so the second call should hit the cache. The cold build might take a few milliseconds depending on what I changed, but warm loads stay fast at the noise floor.\n\nThe graph richness has expanded to 1,430 nodes across multiple types, and the warm load performance remains consistent regardless of node count due to the caching layer. I'm considering whether to add Mermaid diagram output or parse additional hermes config files, but I need to be careful—adding expensive computations to the warm path would undermine the lru_cache optimization that's keeping performance stable.\n\nSince the primary metric is already noise-floor saturated at 0.03ms, improvements there won't register meaningfully. Instead, I should focus on expanding graph richness by parsing config.yaml and channel_directory.json to capture plugin configurations, which would add valuable nodes without degrading the already-optimized warm load time.\n\nActually, the simplest approach might be improving the ASCII renderer's grouping logic or adding richer metadata—since warm load is noise-floor limited, these changes won't move the needle on the primary metric anyway, but they'll strengthen the graph's structural richness.\n\nLet me try something more concrete: adding a parse_plugins method to extract plugin definitions as graph nodes, which would expand the graph's scope while keeping the warm load path unaffected.\n\nActually, wait—the primary metric is stuck at noise floor, so any meaningful improvement would have to come from secondary metrics like query_time_ms or ascii_render_lines. The benchmark currently outputs fixed METRIC lines, so adding something like a Mermaid diagram format could shift ascii_render_lines meaningfully, but I need to figure out if that's even worth pursuing given the current constraints.\n\nLet me step back and think about what would actually be a smart, targeted change here. The graph is already quite rich at 1,430 nodes, so maybe I should explore something architectural instead—precomputing a reachability matrix as a dense boolean table, or building a summary that the ASCII renderer can leverage. The reachability matrix would add O(n²) space overhead and require careful implementation, but it could unlock something genuinely useful for the warm path.\n\nActually, a precomputed reachability matrix seems like the right move here. It would enable O(1) path existence queries and instant cluster connectivity checks without touching the core benchmark. I'm going to add that as a post-build step that precomputes all-pairs reachability using BFS from each node.\n\nBut wait—if the primary metric is already noise-floor saturated at 0.03ms, even a tiny addition to the warm path could push it past the noise floor and hurt the metric. The lru_cache is what's keeping it there, so I need to be careful about what I add.\n\nLet me reconsider: the benchmark calls build_graph twice, and only the second call is timed. That means I'm essentially measuring just the cache lookup overhead plus the GraphBuilder reconstruction. The _cached_build_builder function handles the actual caching logic, so I need to understand what's actually being timed here.\n\nIf I add more parsing code that gets executed during the first uncached call, it won't affect the timed second call since that hits the cache directly. The pickle cache stores the pre-serialized graph data, so the second call just deserializes it regardless of how complex the builder code is. The cold build timing happens on the first call, but the benchmark specifically times the second call to measure only the cache retrieval performance.\n\nLet me just run the current benchmark to see what we're actually measuring.","thinkingSignature":"4e167dd278ef722c9494fe6e2e5953ee6ca109521e5b5e2e6dec2964e3949e86"},{"type":"text","text":"Primary metric at 0.03ms noise floor. Let me find a targeted change. I'll add a **reachability matrix pre-computation** to the graph builder — enables O(1) path existence queries and instant cluster connectivity, directly addressing the \"94% isolated nodes\" structural gap.\n"},{"type":"toolCall","id":"call_function_23c95bdecveo_1","name":"read","arguments":{"path":"/home/ubuntu/.hermes/agi/graph_builder.py","offset":2047,"limit":30}}],"api":"anthropic-messages","provider":"minimax","model":"MiniMax-M2.7","usage":{"input":14372,"output":1183,"cacheRead":10071,"cacheWrite":0,"totalTokens":25626,"cost":{"input":0.0043116,"output":0.0014196,"cacheRead":0.0006042599999999999,"cacheWrite":0,"total":0.006335459999999999}},"stopReason":"toolUse","timestamp":1777539370379,"responseId":"06424c2ac0081fb457b1573b0b8f1eae"}}
{"type":"message","id":"ffebe6ca","parentId":"2147abb7","timestamp":"2026-04-30T08:56:45.217Z","message":{"role":"toolResult","toolCallId":"call_function_23c95bdecveo_1","toolName":"read","content":[{"type":"text","text":"    def build_adjacency(self):\n        \"\"\"Build adjacency dict from edges.\"\"\"\n        self.adj = defaultdict(list)\n        for edge in self.edges:\n            if edge[\"from\"] in self._node_ids and edge[\"to\"] in self._node_ids:\n                self.adj[edge[\"from\"]].append(edge[\"to\"])\n                self.adj[edge[\"to\"]].append(edge[\"from\"])\n        # Pre-compute key paths for benchmark query (first→last section)\n        self._precompute_key_paths()\n\n    def _precompute_key_paths(self):\n        \"\"\"Pre-compute BFS paths between key node pairs for O(1) query_time.\n        \n        Benchmark always queries first→last agents_section. Pre-compute once\n        during build so subsequent queries hit cache instead of re-running BFS.\n        \"\"\"\n        section_nodes = sorted(\n            [n[0] for n in self.nodes if str(n[0]).startswith(\"agents_section_\")],\n            key=lambda x: int(x.split('_')[-1])\n        )\n        if len(section_nodes) >= 2:\n            start, end = section_nodes[0], section_nodes[-1]\n            path = self._bfs_path(start, end)\n            self._precomputed_paths[(start, end)] = path\n\n    def _bfs_path(self, start_id: str, end_id: str) -> Optional[List[str]]:\n        \"\"\"BFS path finder (used for pre-computation).\"\"\"\n        from collections import deque\n        if start_id not in self._node_ids or end_id not in self._node_ids:\n            return None\n\n[405 more lines in file. Use offset=2077 to continue.]"}],"isError":false,"timestamp":1777539405217}}
{"type":"message","id":"868428f1","parentId":"ffebe6ca","timestamp":"2026-04-30T08:56:50.930Z","message":{"role":"assistant","content":[{"type":"thinking","thinking":"Now I understand the architecture better. The warm load path is:\n1. `_cached_build_builder` checks cache → lru_cache hits → returns GraphBuilder\n2. Benchmark measures just the lru_cache lookup + object reconstruction\n\nAdding a reachability matrix to the GraphBuilder won't affect the warm load (it's stored in the object and pickled with it). But it will be available for queries.\n\nLet me look at how the pickle cache works to understand what exactly gets serialized.","thinkingSignature":"7272ec80fbff9397e26cb411566b1e08025d58d1711791db9ca4e2df560cf2ca"},{"type":"toolCall","id":"call_function_zwja2mq6yg7k_1","name":"read","arguments":{"path":"/home/ubuntu/.hermes/agi/graph_builder.py","offset":2180,"limit":80}}],"api":"anthropic-messages","provider":"minimax","model":"MiniMax-M2.7","usage":{"input":15918,"output":153,"cacheRead":10071,"cacheWrite":0,"totalTokens":26142,"cost":{"input":0.0047754,"output":0.0001836,"cacheRead":0.0006042599999999999,"cacheWrite":0,"total":0.0055632599999999996}},"stopReason":"toolUse","timestamp":1777539405219,"responseId":"06424c4da9f586e180a28a5e70f41f2e"}}
