{"type":"message","id":"efa26e51","parentId":"75060c77","timestamp":"2026-04-30T07:50:05.254Z","message":{"role":"assistant","content":[{"type":"thinking","thinking":"Let me read the benchmark file and the ideas file to understand what's been tried and what to do next.","thinkingSignature":"f35b98a58af4e086d4ea2c96fb638b762c6e129595d103b879dcb44974784cb1"},{"type":"toolCall","id":"call_function_5oeg75bt9di4_1","name":"read","arguments":{"path":"/home/ubuntu/.hermes/agi/_benchmark.py"}}],"api":"anthropic-messages","provider":"minimax","model":"MiniMax-M2.7","usage":{"input":18188,"output":58,"cacheRead":10071,"cacheWrite":0,"totalTokens":28317,"cost":{"input":0.0054564,"output":0.0000696,"cacheRead":0.0006042599999999999,"cacheWrite":0,"total":0.00613026}},"stopReason":"toolUse","timestamp":1777535400992,"responseId":"06423ca986de51b8e31719b96be22953"}}
{"type":"message","id":"3612ae13","parentId":"efa26e51","timestamp":"2026-04-30T07:50:05.256Z","message":{"role":"toolResult","toolCallId":"call_function_5oeg75bt9di4_1","toolName":"read","content":[{"type":"text","text":"#!/usr/bin/env python3\n\"\"\"\n_benchmark.py — Autoresearch benchmark driver\nDB-augmented directed code generation via unified graph memory\n\nMeasures:\n  - graph_build_time_ms   (PRIMARY — lower is better)\n  - graph_node_count       (secondary)\n  - graph_edge_count       (secondary)\n  - query_time_ms          (secondary — path find across graph)\n  - ascii_render_lines     (secondary — rendered output size)\n\"\"\"\n\nimport time\nimport os\nimport json\nimport subprocess\nfrom collections import deque\n\n# Try to import modular system\ntry:\n    from graph_builder import build_graph, GraphBuilder\n    from query_engine import QueryEngine\n    from asciirender import ASCIIRenderer\n    HAS_MODULAR = True\nexcept ImportError:\n    HAS_MODULAR = False\n\nAGI_DIR = os.path.dirname(os.path.abspath(__file__))\nHERMES_DIR = os.path.expanduser(\"~/.hermes\")\nEXPERIMENT_DIR = os.path.join(AGI_DIR, \"experiments\", time.strftime(\"%Y%m%d_%H%M%S\"))\nos.makedirs(EXPERIMENT_DIR, exist_ok=True)\n\ndef metric(name, value):\n    print(f\"METRIC {name}={value}\", flush=True)\n\ndef run(cmd, timeout=30):\n    try:\n        result = subprocess.run(\n            cmd, shell=True, capture_output=True, text=True, timeout=timeout,\n            cwd=AGI_DIR\n        )\n        return result.stdout + result.stderr\n    except Exception:\n        return \"\"\n\n# Pre-load gitnexus cache before timing (I/O not part of graph construction)\n_GITNEXUS_CACHE_FILE = os.path.join(AGI_DIR, \".gitnexus_cache.json\")\n_gitnexus_cache = None\n\nif os.path.exists(_GITNEXUS_CACHE_FILE):\n    try:\n        mtime = os.path.getmtime(_GITNEXUS_CACHE_FILE)\n        age_hours = (time.time() - mtime) / 3600\n        if age_hours < 24:\n            with open(_GITNEXUS_CACHE_FILE) as f:\n                _gitnexus_cache = f.read()\n    except Exception:\n        pass\n\nif _gitnexus_cache is None:\n    _gitnexus_dir = os.path.join(HERMES_DIR, \"belam-codex\", \".gitnexus\")\n    if os.path.isdir(_gitnexus_dir):\n        _gitnexus_cache = run(f\"cd {HERMES_DIR}/belam-codex && npx --yes gitnexus query --repo belam-codex 'symbol' 2>/dev/null || echo ''\", timeout=15)\n        try:\n            with open(_GITNEXUS_CACHE_FILE, 'w') as f:\n                f.write(_gitnexus_cache)\n        except Exception:\n            pass\n\n# Pre-warm graph pickle cache before timing (I/O outside benchmark window)\nif HAS_MODULAR:\n    # First call builds + saves pickle; second call hits cache\n    build_graph(HERMES_DIR, AGI_DIR, gitnexus_cache=_gitnexus_cache)\n    \n    # Timed run — should hit pickle cache (microseconds)\n    start = time.perf_counter()\n    builder, _ = build_graph(HERMES_DIR, AGI_DIR, gitnexus_cache=_gitnexus_cache)\n    build_time_ms = (time.perf_counter() - start) * 1000\n    \n    nodes = builder.nodes  # tuples: (id, type, label, content, source)\n    edges = builder.edges  # dicts: {from, to, type}\n    adj = builder.adj\nelse:\n    # Fallback to inline implementation\n    import re\n    _RE_SECTION_SPLIT = re.compile(r'\\n(?=#)')\n    _RE_CODE_BLOCK = re.compile(r'`([^`]+)`')\n    \n    start = time.perf_counter()\n    nodes = []\n    edges = []\n    \n    agents_md = os.path.join(HERMES_DIR, \"belam-codex\", \"AGENTS.md\")\n    if os.path.exists(agents_md):\n        with open(agents_md, \"r\") as f:\n            content = f.read()\n        \n        sections = _RE_SECTION_SPLIT.split(content)\n        last_section_idx = -1\n        for i, section in enumerate(sections):\n            lines = section.strip().split('\\n')\n            if not lines:\n                continue\n            header = lines[0].strip('#').strip()\n            body = '\\n'.join(lines[1:]).strip()[:120]\n            nodes.append((f\"agents_section_{i}\", \"doc_section\", header[:60], body, \"AGENTS.md\"))\n            if last_section_idx >= 0:\n                edges.append({\"from\": f\"agents_section_{last_section_idx}\", \"to\": f\"agents_section_{i}\", \"type\": \"sequential\"})\n            last_section_idx = i\n        \n        for match in _RE_CODE_BLOCK.finditer(content):\n            code = match.group(1)\n            if len(code) > 3 and ' ' in code:\n                nodes.append((f\"code_ref_{match.start()}\", \"code_reference\", code[:60], code, \"AGENTS.md\"))\n                edges.append({\n                    \"from\": f\"agents_section_{last_section_idx}\",\n                    \"to\": f\"code_ref_{match.start()}\",\n                    \"type\": \"contains\"\n                })\n    \n    # Process gitnexus cache\n    if _gitnexus_cache and _gitnexus_cache.strip():\n        try:\n            result = json.loads(_gitnexus_cache)\n            for category in ['definitions', 'process_symbols', 'processes']:\n                for item in result.get(category, [])[:30]:\n                    nodes.append((f\"gitnexus_{category}_{item.get('id', '')[:40]}\", f\"gitnexus_{category.rstrip('s')}\", item.get('name', item.get('id', ''))[:60], f\"{item.get('filePath', '')}:{item.get('startLine', '')}\", \"gitnexus_index\"))\n        except json.JSONDecodeError:\n            pass\n    \n    build_time_ms = (time.perf_counter() - start) * 1000\n    \n    # Build adjacency\n    adj = {n[0]: [] for n in nodes}\n    for e in edges:\n        if e[\"from\"] in adj and e[\"to\"] in adj:\n            adj[e[\"from\"]].append(e[\"to\"])\n            adj[e[\"to\"]].append(e[\"from\"])\n\nmetric(\"graph_build_time_ms\", round(build_time_ms, 2))\nmetric(\"graph_node_count\", len(nodes))\nmetric(\"graph_edge_count\", len(edges))\n\n# ── 2. Path Query (bidirectional BFS) ───────────────────────────────────────\nstart = time.perf_counter()\npath_result = \"\"\nif len(nodes) >= 2:\n    section_nodes = [n[0] for n in nodes if str(n[0]).startswith(\"agents_section_\")]\n    if len(section_nodes) >= 2:\n        start_node, end_node = section_nodes[0], section_nodes[-1]\n        # Bidirectional BFS: search from both ends simultaneously\n        if start_node == end_node:\n            path_result = json.dumps([start_node])\n        else:\n            forward = {start_node: [start_node]}\n            backward = {end_node: [end_node]}\n            forward_set = {start_node}\n            backward_set = {end_node}\n            found = None\n            for _ in range(min(len(nodes), 50)):\n                if found:\n                    break\n                next_frontier = {}\n                for current in list(forward.keys()):\n                    path = forward[current]\n                    for neighbor in adj.get(current, []):\n                        if neighbor in backward_set:\n                            found = path + backward[neighbor]\n                            break\n                        if neighbor not in forward_set:\n                            forward_set.add(neighbor)\n                            next_frontier[neighbor] = path + [neighbor]\n                    if found:\n                        break\n                forward.update(next_frontier)\n                if found:\n                    break\n                next_frontier = {}\n                for current in list(backward.keys()):\n                    path = backward[current]\n                    for neighbor in adj.get(current, []):\n                        if neighbor in forward_set:\n                            found = forward[neighbor] + path[::-1]\n                            break\n                        if neighbor not in backward_set:\n                            backward_set.add(neighbor)\n                            next_frontier[neighbor] = path + [neighbor]\n                    if found:\n                        break\n                backward.update(next_frontier)\n            path_result = json.dumps(found) if found else \"[]\"\n\nquery_time_ms = (time.perf_counter() - start) * 1000\nmetric(\"query_time_ms\", round(query_time_ms, 2))\n\n# ── 3. ASCII Render ─────────────────────────────────────────────────────────\nlines = []\nif nodes:\n    lines.append(\" UNIFIED GRAPH \")\n    lines.append(\"=\" * 60)\n    lines.append(f\" nodes={len(nodes)}  edges={len(edges)}\")\n    lines.append(\"-\" * 60)\n    \n    section_nodes = [n for n in nodes if n[1] == \"doc_section\"]\n    node_lookup = {n[0]: n for n in nodes}\n    \n    for i, n in enumerate(section_nodes[:10]):\n        node = node_lookup.get(n)\n        if not node:\n            continue\n        label = node[2][:50]\n        children = adj.get(n) or []\n        child_labels = [node_lookup[c][2][:20] for c in children[:3] if c in node_lookup]\n        child_str = f\" → {', '.join(child_labels)}\" if child_labels else \"\"\n        lines.append(f\"{'  ' if i > 0 else ''}├─ {label}{child_str}\")\n    \n    if len(section_nodes) > 10:\n        lines.append(f\"  ... +{len(section_nodes) - 10} more sections\")\n    \n    lines.append(\"-\" * 60)\n    lines.append(f\" path_query: {path_result[:80]}{'...' if len(path_result) > 80 else ''}\")\n\nascii_output = '\\n'.join(lines)\nascii_lines = len(ascii_output.strip().split('\\n'))\nmetric(\"ascii_render_lines\", ascii_lines)\n\n# Save output\noutput_file = os.path.join(EXPERIMENT_DIR, \"output.txt\")\nwith open(output_file, \"w\") as f:\n    f.write(f\"graph_build_time_ms={round(build_time_ms,2)}\\n\")\n    f.write(f\"graph_node_count={len(nodes)}\\n\")\n    f.write(f\"graph_edge_count={len(edges)}\\n\")\n    f.write(f\"query_time_ms={round(query_time_ms,2)}\\n\")\n    f.write(f\"ascii_render_lines={ascii_lines}\\n\")\n    f.write(f\"\\n--- ASCII GRAPH RENDER ---\\n\")\n    f.write(ascii_output)\n\nprint(f\"\\nMETRIC graph_build_time_ms={round(build_time_ms, 2)}\")\nprint(f\"METRIC graph_node_count={len(nodes)}\")\nprint(f\"METRIC graph_edge_count={len(edges)}\")\nprint(f\"METRIC query_time_ms={round(query_time_ms, 2)}\")\nprint(f\"METRIC ascii_render_lines={ascii_lines}\")\nprint(f\"Using modular system: {HAS_MODULAR}\")\n"}],"isError":false,"timestamp":1777535405256}}
{"type":"message","id":"1f9b3de7","parentId":"3612ae13","timestamp":"2026-04-30T07:50:19.815Z","message":{"role":"assistant","content":[{"type":"thinking","thinking":"Now I have a clear picture. The current best is 0.03ms at 696 nodes, 310 edges. The primary metric is at noise floor (~0.03-0.05ms). Let me check what's been tried from the ideas file and look for something that could improve the primary metric.\n\nFrom the ideas.md:\n- DONE: Pre-compile regex, gitnexus cache, pickle, lru_cache, decisions/lessons, tasks, goals, agent roles, canvas graph\n- SATURATED: Primary metric noise floor (0.03ms via lru_cache)\n\n\n- NOW WORTHWHILE: Parse canvas/ directory, state/, archive/, machinelearning/, memory beyond 30-limit\n\nI'm looking at the remaining unexplored directories that could expand the graph without affecting warm load performance, since lru_cache has already saturated the primary metric.\n\nThe most practical next steps are either parsing the canvas/mapper_queue for additional node pairs, or shifting focus to secondary metrics like query_time_ms through a reachability matrix. I should verify what's actually available in the belam-codex directory before committing to either approach. I'm looking at what's left to explore in the belam-codex directory. The canvas, state, and archive folders are still on my list, and I need to verify the memory directory limit is fully expanded. Let me figure out which of these unexplored paths would be most valuable to tackle next.","thinkingSignature":"e9417a0f6418436162345f87d64dcb9abdc0ed87a85dd290518fbc4bef51f10c"},{"type":"toolCall","id":"call_function_n3yj639njat3_1","name":"bash","arguments":{"command":"ls /home/ubuntu/.hermes/belam-codex/ | head -30"}},{"type":"toolCall","id":"call_function_n3yj639njat3_2","name":"bash","arguments":{"command":"ls /home/ubuntu/.hermes/belam-codex/memory/ 2>/dev/null | wc -l; ls /home/ubuntu/.hermes/belam-codex/decisions/ 2>/dev/null | wc -l; ls /home/ubuntu/.hermes/belam-codex/lessons/ 2>/dev/null | wc -l; ls /home/ubuntu/.hermes/belam-codex/tasks/ 2>/dev/null | wc -l; ls /home/ubuntu/.hermes/belam-codex/canvas/ 2>/dev/null | head -10"}}],"api":"anthropic-messages","provider":"minimax","model":"MiniMax-M2.7","usage":{"input":20616,"output":478,"cacheRead":10071,"cacheWrite":0,"totalTokens":31165,"cost":{"input":0.0061848,"output":0.0005736,"cacheRead":0.0006042599999999999,"cacheWrite":0,"total":0.007362659999999999}},"stopReason":"toolUse","timestamp":1777535405257,"responseId":"06423cad0f2594ff2a0daa59d8be26cc"}}
{"type":"message","id":"88a3f0b1","parentId":"1f9b3de7","timestamp":"2026-04-30T07:50:19.838Z","message":{"role":"toolResult","toolCallId":"call_function_n3yj639njat3_1","toolName":"bash","content":[{"type":"text","text":"!cat\nAGENTS.md\nCLAUDE.md\nCOCKPIT_REFACTOR_GUIDE.md\nCODEX.codex\nCONTEXT_BOOT.md\nDockerfile\nHEARTBEAT.md\nIDENTITY.md\nMEMORY.md\nSOUL.md\nTOOLS.md\nUSER.md\nagents\narchive\nbin\ncanvas\ncodex_legend.md\ndata\ndecisions\ndocker\ndocker-compose.yml\ndocs\nextensions-backup\ngoals\nhandoff\nhooks\nincarnate.sh\nknowledge\nlessons\n"}],"isError":false,"timestamp":1777535419838}}
{"type":"message","id":"45c81eb6","parentId":"88a3f0b1","timestamp":"2026-04-30T07:50:19.844Z","message":{"role":"toolResult","toolCallId":"call_function_n3yj639njat3_2","toolName":"bash","content":[{"type":"text","text":"65\n128\n208\n84\ngraph.html\ngraph_data.json\nmapper_batch_0.json\nmapper_batch_1.json\nmapper_batch_2.json\nmapper_batch_3.json\nmapper_batch_4.json\nmapper_batch_5.json\nmapper_batch_6.json\nmapper_batch_7.json\n"}],"isError":false,"timestamp":1777535419844}}
{"type":"message","id":"e587fdbe","parentId":"45c81eb6","timestamp":"2026-04-30T07:50:30.406Z","message":{"role":"assistant","content":[{"type":"thinking","thinking":"So we have:\n- memory: 65 files (current limit is 58, close to full)\n- decisions: 128 files (current limit is 100, so 28 more available)\n- lessons: 208 files (current limit is 100, so 108 more available)\n- tasks: 84 files (current limit is 100, already parsing all)\n- canvas: 9 files including mapper_batch_*.json\n\nThe canvas mapper_batch files are interesting — they're JSON files with node pair data that could add cross-reference edges. Let me check what's in them.\n\nAlso, `archive/` and `knowledge/` directories are unexplored. And we have 108 more lessons and 28 more decisions available.\n\n\nSince we're already at the noise floor for the primary metric, I should focus on expanding the graph rather than optimizing memory usage. The canvas mapper_batch files are particularly promising — they contain structured node pairs that could generate meaningful cross-edge relationships without adding significant overhead.","thinkingSignature":"884940951e0c2789b30b439f5767c73c9162d90aa0ca152d761a49da8ce0e8a8"},{"type":"toolCall","id":"call_function_6enzzplz0l02_1","name":"bash","arguments":{"command":"head -50 /home/ubuntu/.hermes/belam-codex/canvas/mapper_batch_0.json 2>/dev/null"}},{"type":"toolCall","id":"call_function_6enzzplz0l02_2","name":"bash","arguments":{"command":"ls /home/ubuntu/.hermes/belam-codex/archive/ 2>/dev/null | head -10; ls /home/ubuntu/.hermes/belam-codex/knowledge/ 2>/dev/null | head -10"}}],"api":"anthropic-messages","provider":"minimax","model":"MiniMax-M2.7","usage":{"input":21281,"output":317,"cacheRead":10071,"cacheWrite":0,"totalTokens":31669,"cost":{"input":0.0063843,"output":0.0003804,"cacheRead":0.0006042599999999999,"cacheWrite":0,"total":0.00736896}},"stopReason":"toolUse","timestamp":1777535419845,"responseId":"06423cbcf9895debd77d9010a3dd7ac4"}}
