{"type":"message","id":"9fe97d8e","parentId":"b4c9eb55","timestamp":"2026-04-30T08:34:00.454Z","message":{"role":"assistant","content":[{"type":"thinking","thinking":"This second occurrence has slightly different code for gitnexus (includes a `run_subprocess` call with a specific command). Let me find a more unique context to update it:","thinkingSignature":"df11879df0f98000a74cb2b2ab92b9ff3dedf6e39a7602de4fc258b07bbd30e8"},{"type":"toolCall","id":"call_function_0u4xo3jzm37s_1","name":"edit","arguments":{"path":"/home/ubuntu/.hermes/agi/graph_builder.py","edits":[{"oldText":"    if os.path.isdir(handoff_dir):\n        builder.parse_handoff(handoff_dir)\n\n    # Parse archive/commands (38 command docs with upstream links to decision nodes)\n    archive_dir = os.path.join(hermes_dir, \"belam-codex\", \"archive\")\n    if os.path.isdir(archive_dir):\n        builder.parse_archive_commands(archive_dir)\n        builder.parse_archive_tasks(archive_dir)\n        builder.parse_codex_modules(archive_dir)\n\n    # Bridge isolated clusters via shared tags\n    builder.build_tag_bridges(hermes_dir)\n\n    # Process gitnexus cache\n    global _gitnexus_cache\n    if cache_to_use is None:\n        cache_to_use = _gitnexus_cache\n    if use_gitnexus and cache_to_use is None:\n        gitnexus_dir = os.path.join(hermes_dir, \"belam-codex\", \".gitnexus\")\n        if os.path.isdir(gitnexus_dir):\n            cache_to_use = run_subprocess(","newText":"    if os.path.isdir(handoff_dir):\n        builder.parse_handoff(handoff_dir)\n\n    # Parse skills directory (skill ecosystem with category/type nodes + related_skill edges)\n    skills_dir = os.path.join(hermes_dir, \"skills\")\n    if os.path.isdir(skills_dir):\n        builder.parse_skills(skills_dir)\n\n    # Parse archive/commands (38 command docs with upstream links to decision nodes)\n    archive_dir = os.path.join(hermes_dir, \"belam-codex\", \"archive\")\n    if os.path.isdir(archive_dir):\n        builder.parse_archive_commands(archive_dir)\n        builder.parse_archive_tasks(archive_dir)\n        builder.parse_codex_modules(archive_dir)\n\n    # Bridge isolated clusters via shared tags\n    builder.build_tag_bridges(hermes_dir)\n\n    # Process gitnexus cache\n    global _gitnexus_cache\n    if cache_to_use is None:\n        cache_to_use = _gitnexus_cache\n    if use_gitnexus and cache_to_use is None:\n        gitnexus_dir = os.path.join(hermes_dir, \"belam-codex\", \".gitnexus\")\n        if os.path.isdir(gitnexus_dir):\n            cache_to_use = run_subprocess("}]}}],"api":"anthropic-messages","provider":"minimax","model":"MiniMax-M2.7","usage":{"input":37559,"output":609,"cacheRead":10071,"cacheWrite":0,"totalTokens":48239,"cost":{"input":0.0112677,"output":0.0007308,"cacheRead":0.0006042599999999999,"cacheWrite":0,"total":0.012602760000000001}},"stopReason":"toolUse","timestamp":1777538030222,"responseId":"064246ee0a2e659bad2bcc3764940aac"}}
{"type":"message","id":"fe7b842c","parentId":"9fe97d8e","timestamp":"2026-04-30T08:34:00.461Z","message":{"role":"toolResult","toolCallId":"call_function_0u4xo3jzm37s_1","toolName":"edit","content":[{"type":"text","text":"Successfully replaced 1 block(s) in /home/ubuntu/.hermes/agi/graph_builder.py."}],"details":{"diff":"      ...\n 1689     handoff_dir = os.path.join(hermes_dir, \"belam-codex\", \"handoff\")\n 1690     if os.path.isdir(handoff_dir):\n 1691         builder.parse_handoff(handoff_dir)\n 1692 \n+1693     # Parse skills directory (skill ecosystem with category/type nodes + related_skill edges)\n+1694     skills_dir = os.path.join(hermes_dir, \"skills\")\n+1695     if os.path.isdir(skills_dir):\n+1696         builder.parse_skills(skills_dir)\n+1697 \n 1693     # Parse archive/commands (38 command docs with upstream links to decision nodes)\n 1694     archive_dir = os.path.join(hermes_dir, \"belam-codex\", \"archive\")\n 1695     if os.path.isdir(archive_dir):\n 1696         builder.parse_archive_commands(archive_dir)\n      ...","firstChangedLine":1693},"isError":false,"timestamp":1777538040461}}
{"type":"message","id":"7c0b905f","parentId":"fe7b842c","timestamp":"2026-04-30T08:34:06.884Z","message":{"role":"assistant","content":[{"type":"thinking","thinking":"Now let me verify the changes by running a quick test:","thinkingSignature":"5abecffb2de45992d4c86c98a952873545ec53468796f508a0c0f9384ccd85ac"},{"type":"toolCall","id":"call_function_zau7p3t9wvnl_1","name":"bash","arguments":{"command":"cd /home/ubuntu/.hermes/agi && python3 -c \"\nfrom graph_builder import build_graph\nimport os\nhermes = os.path.expanduser('~/.hermes')\nagi = os.path.dirname(os.path.abspath('.'))\nbuilder, t = build_graph(hermes, agi)\n\n# Check for skill nodes\nskill_nodes = [n for n in builder.nodes if n[1] in ('skill', 'skill_type')]\nprint(f'Skill nodes: {len(skill_nodes)}')\nprint(f'Total nodes: {len(builder.nodes)}')\nprint(f'Total edges: {len(builder.edges)}')\n\n# Check some sample skill nodes\nfor n in skill_nodes[:5]:\n    print(f'  {n[1]}: {n[2]}')\n\" 2>&1"}}],"api":"anthropic-messages","provider":"minimax","model":"MiniMax-M2.7","usage":{"input":38204,"output":203,"cacheRead":10071,"cacheWrite":0,"totalTokens":48478,"cost":{"input":0.0114612,"output":0.00024359999999999999,"cacheRead":0.0006042599999999999,"cacheWrite":0,"total":0.01230906}},"stopReason":"toolUse","timestamp":1777538040463,"responseId":"064246f873a3f66f5d0acc61f8e2b633"}}
{"type":"message","id":"412f754d","parentId":"7c0b905f","timestamp":"2026-04-30T08:34:07.038Z","message":{"role":"toolResult","toolCallId":"call_function_zau7p3t9wvnl_1","toolName":"bash","content":[{"type":"text","text":"Skill nodes: 0\nTotal nodes: 960\nTotal edges: 496\n"}],"isError":false,"timestamp":1777538047038}}
{"type":"message","id":"398d3b70","parentId":"412f754d","timestamp":"2026-04-30T08:34:13.685Z","message":{"role":"assistant","content":[{"type":"thinking","thinking":"The skills aren't being parsed. Let me check if the skills directory exists and what the path looks like:","thinkingSignature":"cfcfbd7146c66cb2cbe663738f407a6ea9f51b40e095b6296b5e95375ee684b7"},{"type":"toolCall","id":"call_function_jn88ses5304t_1","name":"bash","arguments":{"command":"ls -la /home/ubuntu/.hermes/skills/ 2>/dev/null | head -5"}},{"type":"toolCall","id":"call_function_jn88ses5304t_2","name":"bash","arguments":{"command":"python3 -c \"\nimport os\nhermes = os.path.expanduser('~/.hermes')\nskills_dir = os.path.join(hermes, 'skills')\nprint(f'Path: {skills_dir}')\nprint(f'Exists: {os.path.isdir(skills_dir)}')\nif os.path.isdir(skills_dir):\n    print(f'Contents: {sorted(os.listdir(skills_dir))[:5]}')\n\""}}],"api":"anthropic-messages","provider":"minimax","model":"MiniMax-M2.7","usage":{"input":38440,"output":171,"cacheRead":10071,"cacheWrite":0,"totalTokens":48682,"cost":{"input":0.011531999999999999,"output":0.0002052,"cacheRead":0.0006042599999999999,"cacheWrite":0,"total":0.01234146}},"stopReason":"toolUse","timestamp":1777538047040,"responseId":"064246ff508c5ee8cff0e63c10fbff95"}}
{"type":"message","id":"846b6c54","parentId":"398d3b70","timestamp":"2026-04-30T08:34:13.699Z","message":{"role":"toolResult","toolCallId":"call_function_jn88ses5304t_1","toolName":"bash","content":[{"type":"text","text":"total 116\ndrwxrwxr-x 28 ubuntu ubuntu 4096 Apr 19 07:56 .\ndrwx------ 22 ubuntu ubuntu 4096 Apr 30 08:32 ..\n-rw-------  1 ubuntu ubuntu 3665 Apr 19 07:56 .bundled_manifest\ndrwxrwxr-x  6 ubuntu ubuntu 4096 Apr 13 08:16 apple\n"}],"isError":false,"timestamp":1777538053699}}
{"type":"message","id":"a349fba9","parentId":"846b6c54","timestamp":"2026-04-30T08:34:13.729Z","message":{"role":"toolResult","toolCallId":"call_function_jn88ses5304t_2","toolName":"bash","content":[{"type":"text","text":"Path: /home/ubuntu/.hermes/skills\nExists: True\nContents: ['.bundled_manifest', 'apple', 'autonomous-ai-agents', 'communication', 'creative']\n"}],"isError":false,"timestamp":1777538053729}}
{"type":"message","id":"ddf016b4","parentId":"a349fba9","timestamp":"2026-04-30T08:34:19.813Z","message":{"role":"assistant","content":[{"type":"thinking","thinking":"The skills directory exists. Let me debug the parse_skills function to see what's happening:","thinkingSignature":"43f65bfcf4ef3c3093e50843957d6031ed5d3fcfa63106b9de526bc60419e716"},{"type":"toolCall","id":"call_function_t34pyl8xda6u_1","name":"bash","arguments":{"command":"python3 -c \"\nimport os\nimport sys\nsys.path.insert(0, '/home/ubuntu/.hermes/agi')\nfrom graph_builder import GraphBuilder\n\nhermes = os.path.expanduser('~/.hermes')\nskills_dir = os.path.join(hermes, 'skills')\n\nbuilder = GraphBuilder()\ncount = builder.parse_skills(skills_dir)\n\nprint(f'Added {count} nodes/edges')\nprint(f'Total nodes: {len(builder.nodes)}')\nprint(f'Total edges: {len(builder.edges)}')\n\nskill_nodes = [n for n in builder.nodes if n[1] in ('skill', 'skill_type')]\nprint(f'Skill nodes: {len(skill_nodes)}')\nfor n in skill_nodes[:10]:\n    print(f'  {n[1]}: {n[2]}')\n\" 2>&1"}}],"api":"anthropic-messages","provider":"minimax","model":"MiniMax-M2.7","usage":{"input":38755,"output":218,"cacheRead":10071,"cacheWrite":0,"totalTokens":49044,"cost":{"input":0.0116265,"output":0.00026159999999999996,"cacheRead":0.0006042599999999999,"cacheWrite":0,"total":0.012492360000000001}},"stopReason":"toolUse","timestamp":1777538053735,"responseId":"0642470642eee0480722de057e93e13e"}}
{"type":"message","id":"ddadd4b7","parentId":"ddf016b4","timestamp":"2026-04-30T08:34:19.871Z","message":{"role":"toolResult","toolCallId":"call_function_t34pyl8xda6u_1","toolName":"bash","content":[{"type":"text","text":"Added 115 nodes/edges\nTotal nodes: 115\nTotal edges: 89\nSkill nodes: 115\n  skill_type: apple\n  skill: apple-notes\n  skill: imessage\n  skill: apple-reminders\n  skill: findmy\n  skill_type: autonomous-ai-agents\n  skill: codex\n  skill: claude-code\n  skill: opencode\n  skill: hermes-agent\n"}],"isError":false,"timestamp":1777538059871}}
{"type":"message","id":"75b9aaf7","parentId":"ddadd4b7","timestamp":"2026-04-30T08:34:25.882Z","message":{"role":"assistant","content":[{"type":"thinking","thinking":"The parse_skills function works when called directly. The issue might be with the lru_cache - it cached the result before I added the skills parsing. Let me check:","thinkingSignature":"14e627fac31cf28551016d1e9151c1d360ec5bc8bf953ce67c91276783952f6b"},{"type":"toolCall","id":"call_function_5bpkj96tsvxi_1","name":"bash","arguments":{"command":"rm -f /home/ubuntu/.hermes/agi/.graph_cache.pkl && cd /home/ubuntu/.hermes/agi && python3 -c \"\nfrom graph_builder import build_graph\nimport os\nhermes = os.path.expanduser('~/.hermes')\nagi = os.path.dirname(os.path.abspath('.'))\nbuilder, t = build_graph(hermes, agi)\n\n# Check for skill nodes\nskill_nodes = [n for n in builder.nodes if n[1] in ('skill', 'skill_type')]\nprint(f'Skill nodes: {len(skill_nodes)}')\nprint(f'Total nodes: {len(builder.nodes)}')\nprint(f'Total edges: {len(builder.edges)}')\n\n# Count by type\ntypes = {}\nfor n in builder.nodes:\n    t = n[1]\n    types[t] = types.get(t, 0) + 1\nprint('Types:', sorted(types.items(), key=lambda x: -x[1])[:15])\n\" 2>&1"}}],"api":"anthropic-messages","provider":"minimax","model":"MiniMax-M2.7","usage":{"input":39080,"output":269,"cacheRead":10071,"cacheWrite":0,"totalTokens":49420,"cost":{"input":0.011724,"output":0.0003228,"cacheRead":0.0006042599999999999,"cacheWrite":0,"total":0.01265106}},"stopReason":"toolUse","timestamp":1777538059875,"responseId":"0642470c794009f7a58567426c12f767"}}
{"type":"message","id":"efc9af91","parentId":"75b9aaf7","timestamp":"2026-04-30T08:34:26.018Z","message":{"role":"toolResult","toolCallId":"call_function_5bpkj96tsvxi_1","toolName":"bash","content":[{"type":"text","text":"Skill nodes: 0\nTotal nodes: 960\nTotal edges: 496\nTypes: [('lesson', 204), ('schema_field', 141), ('decision', 128), ('task', 84), ('memory_session', 58), ('archive_command', 37), ('handoff_item', 35), ('canvas_command', 30), ('code_reference', 27), ('canvas_lesson', 25), ('doc_section', 22), ('canvas_decision', 22), ('gitnexus_definition', 20), ('agent_boundary', 15), ('knowledge', 15)]\n"}],"isError":false,"timestamp":1777538066018}}
{"type":"message","id":"0831e50e","parentId":"efc9af91","timestamp":"2026-04-30T08:34:30.986Z","message":{"role":"assistant","content":[{"type":"thinking","thinking":"Hmm, even after clearing the pickle cache, the skills aren't being added. This is strange. Let me check if the build_graph is using the _cached_build_builder (lru_cache) function which might be cached. The _cache_ver needs to be bumped.","thinkingSignature":"10b172bf529ef7d3d2f1e7a64271f6bad805261caea21b5f36cc2c22183ac372"},{"type":"toolCall","id":"call_function_rxbg3akyyn2o_1","name":"bash","arguments":{"command":"grep -n \"_cache_ver\" /home/ubuntu/.hermes/agi/graph_builder.py"}}],"api":"anthropic-messages","provider":"minimax","model":"MiniMax-M2.7","usage":{"input":39491,"output":97,"cacheRead":10071,"cacheWrite":0,"totalTokens":49659,"cost":{"input":0.0118473,"output":0.0001164,"cacheRead":0.0006042599999999999,"cacheWrite":0,"total":0.01256796}},"stopReason":"toolUse","timestamp":1777538066021,"responseId":"06424712c6fbd223bc33432b448d5b71"}}
{"type":"message","id":"1a598e0d","parentId":"0831e50e","timestamp":"2026-04-30T08:34:30.994Z","message":{"role":"toolResult","toolCallId":"call_function_rxbg3akyyn2o_1","toolName":"bash","content":[{"type":"text","text":"1506:def _cached_build_builder(hermes_dir: str, agi_dir: str, gitnexus_hash: int, _cache_ver: int = 1) -> GraphBuilder:\n1616:    # Try lru_cache first (no pickle.load) — bump _cache_ver to bust cache after code/data changes\n1618:        builder = _cached_build_builder(hermes_dir, agi_dir, gitnexus_hash, _cache_ver=7)\n"}],"isError":false,"timestamp":1777538070994}}
{"type":"message","id":"5bb19b9d","parentId":"1a598e0d","timestamp":"2026-04-30T08:34:36.459Z","message":{"role":"assistant","content":[{"type":"thinking","thinking":"The lru_cache on _cached_build_builder is the issue. The function signature includes `_cache_ver=7` but the function itself uses this parameter in a way that should bust the cache when changed. Let me look at the function:","thinkingSignature":"b29021eac2c6710376631a3955e20c7009ad3c639e7563b9510abadfb56708fb"},{"type":"toolCall","id":"call_function_bb3x6sqap4lr_1","name":"read","arguments":{"path":"/home/ubuntu/.hermes/agi/graph_builder.py","offset":1503,"limit":50}}],"api":"anthropic-messages","provider":"minimax","model":"MiniMax-M2.7","usage":{"input":39700,"output":106,"cacheRead":10071,"cacheWrite":0,"totalTokens":49877,"cost":{"input":0.011909999999999999,"output":0.0001272,"cacheRead":0.0006042599999999999,"cacheWrite":0,"total":0.012641459999999998}},"stopReason":"toolUse","timestamp":1777538070996,"responseId":"06424717938bfc55eaa2622ed2384d9f"}}
{"type":"message","id":"3799cb24","parentId":"5bb19b9d","timestamp":"2026-04-30T08:34:36.462Z","message":{"role":"toolResult","toolCallId":"call_function_bb3x6sqap4lr_1","toolName":"read","content":[{"type":"text","text":"        pass\n\n@lru_cache(maxsize=1)\ndef _cached_build_builder(hermes_dir: str, agi_dir: str, gitnexus_hash: int, _cache_ver: int = 1) -> GraphBuilder:\n    \"\"\"Cached builder internals — returns serializable parts only.\n    \n    lru_cache eliminates pickle.load entirely for warm calls.\n    gitnexus_hash is a cache-busting int derived from gitnexus content.\n    \"\"\"\n    # Initialize cache\n    init_cache(agi_dir)\n\n    # Build from sources\n    builder = GraphBuilder()\n\n    # Parse AGENTS.md\n    agents_md = os.path.join(hermes_dir, \"belam-codex\", \"AGENTS.md\")\n    builder.parse_agents_md(agents_md)\n\n    # Parse memory files (expanded to all 58)\n    memory_dir = os.path.join(hermes_dir, \"belam-codex\", \"memory\")\n    builder.parse_memory_files(memory_dir, limit=58)\n\n    # Parse schema files\n    schema_dir = os.path.join(hermes_dir, \"belam-codex\", \"schemas\")\n    builder.parse_schema_files(schema_dir)\n\n    # Parse decisions (all 128 files)\n    decisions_dir = os.path.join(hermes_dir, \"belam-codex\", \"decisions\")\n    if os.path.isdir(decisions_dir):\n        builder.parse_decisions(decisions_dir, limit=999)\n\n    # Parse lessons (all 208 files)\n    lessons_dir = os.path.join(hermes_dir, \"belam-codex\", \"lessons\")\n    if os.path.isdir(lessons_dir):\n        builder.parse_lessons(lessons_dir, limit=999)\n\n    # Parse tasks (all 84 files)\n    tasks_dir = os.path.join(hermes_dir, \"belam-codex\", \"tasks\")\n    if os.path.isdir(tasks_dir):\n        builder.parse_tasks(tasks_dir, limit=999)\n\n    # Parse goals (goal nodes with status/priority/urgency)\n    goals_dir = os.path.join(hermes_dir, \"belam-codex\", \"goals\")\n    if os.path.isdir(goals_dir):\n        builder.parse_goals(goals_dir)\n\n    # Parse agent roles (main, architect, builder, critic)\n    agents_dir = os.path.join(hermes_dir, \"belam-codex\", \"agents\")\n    if os.path.isdir(agents_dir):\n\n[189 more lines in file. Use offset=1553 to continue.]"}],"isError":false,"timestamp":1777538076461}}
{"type":"message","id":"e0967c44","parentId":"3799cb24","timestamp":"2026-04-30T08:34:42.521Z","message":{"role":"assistant","content":[{"type":"thinking","thinking":"I see the issue. The `_cached_build_builder` has its own copy of the parsing code (including my new parse_skills call). The function is decorated with `@lru_cache(maxsize=1)`, so when the code changes, I need to bump `_cache_ver` in the call at line 1618.\n\nLet me bump `_cache_ver` from 7 to 8 to bust the cache:","thinkingSignature":"433ba75722f872f8f8c213c3139647a40fd4466678021042a8463481578f90af"},{"type":"toolCall","id":"call_function_tsbxce5mkcvw_1","name":"edit","arguments":{"path":"/home/ubuntu/.hermes/agi/graph_builder.py","edits":[{"oldText":"    # Try lru_cache first (no pickle.load) — bump _cache_ver to bust cache after code/data changes\n    try:\n        builder = _cached_build_builder(hermes_dir, agi_dir, gitnexus_hash, _cache_ver=7)","newText":"    # Try lru_cache first (no pickle.load) — bump _cache_ver to bust cache after code/data changes\n    try:\n        builder = _cached_build_builder(hermes_dir, agi_dir, gitnexus_hash, _cache_ver=8)"}]}}],"api":"anthropic-messages","provider":"minimax","model":"MiniMax-M2.7","usage":{"input":40339,"output":252,"cacheRead":10071,"cacheWrite":0,"totalTokens":50662,"cost":{"input":0.0121017,"output":0.0003024,"cacheRead":0.0006042599999999999,"cacheWrite":0,"total":0.01300836}},"stopReason":"toolUse","timestamp":1777538076463,"responseId":"0642471c4dc21bac80c7c40f70d6366a"}}
{"type":"message","id":"e0162558","parentId":"e0967c44","timestamp":"2026-04-30T08:34:42.527Z","message":{"role":"toolResult","toolCallId":"call_function_tsbxce5mkcvw_1","toolName":"edit","content":[{"type":"text","text":"Successfully replaced 1 block(s) in /home/ubuntu/.hermes/agi/graph_builder.py."}],"details":{"diff":"      ...\n 1614             pass\n 1615 \n 1616     # Try lru_cache first (no pickle.load) — bump _cache_ver to bust cache after code/data changes\n 1617     try:\n-1618         builder = _cached_build_builder(hermes_dir, agi_dir, gitnexus_hash, _cache_ver=7)\n+1618         builder = _cached_build_builder(hermes_dir, agi_dir, gitnexus_hash, _cache_ver=8)\n 1619         elapsed_ms = (time.perf_counter() - start) * 1000\n 1620         return builder, elapsed_ms\n 1621     except Exception:\n 1622         pass\n      ...","firstChangedLine":1618},"isError":false,"timestamp":1777538082527}}
{"type":"message","id":"a3983600","parentId":"e0162558","timestamp":"2026-04-30T08:34:47.873Z","message":{"role":"assistant","content":[{"type":"thinking","thinking":"Now let me clear the pickle cache and run the test again:","thinkingSignature":"4dbdc5721b33c812bba72a8fea043cb092cbf3c767799ab9241ba16553d7ac28"},{"type":"toolCall","id":"call_function_r3d7vj7rlqpo_1","name":"bash","arguments":{"command":"rm -f /home/ubuntu/.hermes/agi/.graph_cache.pkl && cd /home/ubuntu/.hermes/agi && python3 -c \"\nfrom graph_builder import build_graph\nimport os\nhermes = os.path.expanduser('~/.hermes')\nagi = os.path.dirname(os.path.abspath('.'))\nbuilder, t = build_graph(hermes, agi)\n\n# Check for skill nodes\nskill_nodes = [n for n in builder.nodes if n[1] in ('skill', 'skill_type')]\nprint(f'Skill nodes: {len(skill_nodes)}')\nprint(f'Total nodes: {len(builder.nodes)}')\nprint(f'Total edges: {len(builder.edges)}')\n\n# Count by type\ntypes = {}\nfor n in builder.nodes:\n    t = n[1]\n    types[t] = types.get(t, 0) + 1\nprint('Types:', sorted(types.items(), key=lambda x: -x[1])[:15])\n\" 2>&1"}}],"api":"anthropic-messages","provider":"minimax","model":"MiniMax-M2.7","usage":{"input":40627,"output":247,"cacheRead":10071,"cacheWrite":0,"totalTokens":50945,"cost":{"input":0.012188099999999999,"output":0.0002964,"cacheRead":0.0006042599999999999,"cacheWrite":0,"total":0.01308876}},"stopReason":"toolUse","timestamp":1777538082529,"responseId":"0642472398f93e0aecb1cd949e818c18"}}
{"type":"message","id":"3809dc05","parentId":"a3983600","timestamp":"2026-04-30T08:34:48.022Z","message":{"role":"toolResult","toolCallId":"call_function_r3d7vj7rlqpo_1","toolName":"bash","content":[{"type":"text","text":"Skill nodes: 0\nTotal nodes: 960\nTotal edges: 496\nTypes: [('lesson', 204), ('schema_field', 141), ('decision', 128), ('task', 84), ('memory_session', 58), ('archive_command', 37), ('handoff_item', 35), ('canvas_command', 30), ('code_reference', 27), ('canvas_lesson', 25), ('doc_section', 22), ('canvas_decision', 22), ('gitnexus_definition', 20), ('agent_boundary', 15), ('knowledge', 15)]\n"}],"isError":false,"timestamp":1777538088022}}
