{"type":"message","id":"ea71f6c5","parentId":"6f1f3685","timestamp":"2026-04-30T08:07:59.343Z","message":{"role":"toolResult","toolCallId":"call_function_jdo8o5v24tyf_1","toolName":"read","content":[{"type":"text","text":"    def parse_handoff(self, handoff_dir: str) -> int:\n        \"\"\"Parse handoff files into graph nodes.\n        \n        Handoff files are TODO/planning documents with controller, timestamp,\n        goals, and investigation notes. Creates handoff nodes with goal edges.\n        \"\"\"\n        if not os.path.isdir(handoff_dir):\n            return 0\n\n        files = sorted(os.listdir(handoff_dir), reverse=True)\n        md_files = [f for f in files if f.endswith('.md')]\n        count = 0\n\n        for filename in md_files:\n            filepath = os.path.join(handoff_dir, filename)\n            try:\n                with open(filepath, \"r\") as f:\n                    content = f.read()\n\n                # Extract frontmatter\n                fm_match = _RE_FRONT_MATTER.match(content)\n                meta = {}\n                if fm_match:\n                    for line in fm_match.group(1).split('\\n'):\n                        m = _RE_YAML_PAIR.match(line)\n                        if m:\n                            meta[m.group(1)] = m.group(2)\n\n                controller = meta.get('controller', '')\n                timestamp = meta.get('timestamp', '')\n                goal_match = re.search(r'## User goal\\s*\\n\\n(.+?)(?:\\n\\n|##)', content, re.DOTALL)\n                goal = goal_match.group(1).strip()[:100] if goal_match else \"\"\n\n                # Extract TODO items\n                todo_items = re.findall(r'(?:^[-*]\\s*(.+)$|TODO:\\s*(.+)$)', content, re.MULTILINE)\n                todos = [t[0] or t[1] for t in todo_items if t[0] or t[1]][:5]\n\n                label = filename[:50]\n                summary = f\"{controller}|{timestamp[:10]}|{goal[:50]}\"\n\n                node_id = self.add_node(\n                    \"handoff\",\n                    label,\n                    summary,\n                    f\"handoff/{filename}\",\n                    f\"handoff_{filename[:40]}\"\n                )\n                count += 1\n\n                # Add TODO items as child nodes\n                for i, todo in enumerate(todos):\n                    todo_id = self.add_node(\n                        \"handoff_item\",\n                        todo[:60],\n                        \"\",\n                        f\"handoff/{filename}\",\n                        f\"handoff_item_{filename[:30]}_{i}\"\n                    )\n                    self.add_edge(node_id, todo_id, \"contains\")\n                    count += 1\n\n            except Exception:\n                pass\n        return count\n\n    def build_adjacency(self):\n        \"\"\"Build adjacency dict from edges.\"\"\"\n        self.adj = defaultdict(list)\n        for edge in self.edges:\n            if edge[\"from\"] in self._node_ids and edge[\"to\"] in self._node_ids:\n\n[315 more lines in file. Use offset=829 to continue.]"}],"isError":false,"timestamp":1777536479343}}
{"type":"message","id":"ff4dc2b8","parentId":"ea71f6c5","timestamp":"2026-04-30T08:08:05.248Z","message":{"role":"assistant","content":[{"type":"thinking","thinking":"Now I can see the full structure. `parse_handoff` ends at line 822 and `build_adjacency` starts at line 824. I need to:\n\n1. Add `parse_archive_commands()` between line 822 (end of parse_handoff) and line 824 (start of build_adjacency)\n2. Wire it into `_cached_build_builder()` and `build_graph()` after `parse_handoff`\n\nLet me also look at the wiring sections to find the right insertion points.","thinkingSignature":"a51bc41752bc88301db93c85af91679de7784b84cb20cfebd1f8fdb44c14e339"},{"type":"toolCall","id":"call_function_qf8cbjkbhbgw_1","name":"read","arguments":{"path":"/home/ubuntu/.hermes/agi/graph_builder.py","offset":993,"limit":20}},{"type":"toolCall","id":"call_function_qf8cbjkbhbgw_2","name":"read","arguments":{"path":"/home/ubuntu/.hermes/agi/graph_builder.py","offset":1100,"limit":20}}],"api":"anthropic-messages","provider":"minimax","model":"MiniMax-M2.7","usage":{"input":22140,"output":208,"cacheRead":10071,"cacheWrite":0,"totalTokens":32419,"cost":{"input":0.0066419999999999995,"output":0.0002496,"cacheRead":0.0006042599999999999,"cacheWrite":0,"total":0.007495859999999999}},"stopReason":"toolUse","timestamp":1777536479343,"responseId":"064240dfe289cefb531405f9a8c97cbe"}}
{"type":"message","id":"76f04e7d","parentId":"ff4dc2b8","timestamp":"2026-04-30T08:08:05.254Z","message":{"role":"toolResult","toolCallId":"call_function_qf8cbjkbhbgw_1","toolName":"read","content":[{"type":"text","text":"    knowledge_dir = os.path.join(hermes_dir, \"belam-codex\", \"knowledge\")\n    if os.path.isdir(knowledge_dir):\n        builder.parse_knowledge(knowledge_dir)\n\n    # Parse handoff directory (agent handoff logs with TODO items)\n    handoff_dir = os.path.join(hermes_dir, \"belam-codex\", \"handoff\")\n    if os.path.isdir(handoff_dir):\n        builder.parse_handoff(handoff_dir)\n\n    # Process gitnexus cache\n    cache_to_use = None\n    gitnexus_cache_file = os.path.join(agi_dir, \".gitnexus_cache.json\")\n    if os.path.exists(gitnexus_cache_file):\n        try:\n            with open(gitnexus_cache_file) as f:\n                cache_to_use = f.read()\n        except Exception:\n            pass\n\n    builder.process_gitnexus_cache(cache_to_use)\n\n[131 more lines in file. Use offset=1013 to continue.]"}],"isError":false,"timestamp":1777536485254}}
{"type":"message","id":"a5fc9d7b","parentId":"76f04e7d","timestamp":"2026-04-30T08:08:05.255Z","message":{"role":"toolResult","toolCallId":"call_function_qf8cbjkbhbgw_2","toolName":"read","content":[{"type":"text","text":"    # Parse knowledge directory (semantic knowledge nodes with tag edges)\n    knowledge_dir = os.path.join(hermes_dir, \"belam-codex\", \"knowledge\")\n    if os.path.isdir(knowledge_dir):\n        builder.parse_knowledge(knowledge_dir)\n\n    # Parse handoff directory (agent handoff logs with TODO items)\n    handoff_dir = os.path.join(hermes_dir, \"belam-codex\", \"handoff\")\n    if os.path.isdir(handoff_dir):\n        builder.parse_handoff(handoff_dir)\n\n    # Process gitnexus cache\n    global _gitnexus_cache\n    if cache_to_use is None:\n        cache_to_use = _gitnexus_cache\n    if use_gitnexus and cache_to_use is None:\n        gitnexus_dir = os.path.join(hermes_dir, \"belam-codex\", \".gitnexus\")\n        if os.path.isdir(gitnexus_dir):\n            cache_to_use = run_subprocess(\n                f\"cd {hermes_dir}/belam-codex && npx --yes gitnexus query --repo belam-codex 'symbol' 2>/dev/null || echo ''\",\n                timeout=15\n\n[24 more lines in file. Use offset=1120 to continue.]"}],"isError":false,"timestamp":1777536485255}}
{"type":"message","id":"af59635d","parentId":"a5fc9d7b","timestamp":"2026-04-30T08:08:28.421Z","message":{"role":"assistant","content":[{"type":"thinking","thinking":"Now I have everything I need. Let me implement the changes:\n\n1. Add `parse_archive_commands()` method after `parse_handoff()` (before `build_adjacency`)\n2. Wire it in `_cached_build_builder()` after `parse_handoff` \n3. Wire it in `build_graph()` after `parse_handoff`\n\nFor the `parse_archive_commands` function:\n- Parse archive/commands/*.md files (38 files)\n- Extract frontmatter: command, aliases, category, tags, upstream, description\n- Create `archive_command` nodes\n- Use `upstream` field to link to decision nodes (via `_find_or_add_reference` or similar)\n\n\n- Add sequential edges between commands in alphabetical order\n\nNow I'll make the edits.","thinkingSignature":"8df0d6b31a52d1269b677808dc07d06e5699d0153284a3d1e9bb197c6cee4489"},{"type":"text","text":"Now I have the full picture. I'll add `parse_archive_commands()` to parse the 38 command docs in `archive/commands/`, creating `archive_command` nodes with `upstream` links to decision nodes:\n"},{"type":"toolCall","id":"call_function_ru1p59hktnn8_1","name":"edit","arguments":{"path":"/home/ubuntu/.hermes/agi/graph_builder.py","edits":[{"oldText":"            except Exception:\n                pass\n        return count\n\n    def build_adjacency(self):","newText":"            except Exception:\n                pass\n        return count\n\n    def parse_archive_commands(self, archive_dir: str) -> int:\n        \"\"\"Parse archived command documentation files.\n        \n        Creates archive_command nodes from archive/commands/*.md with frontmatter\n        metadata (command, aliases, category, tags, upstream). Uses upstream field\n        to create cross-type edges to decision nodes. Adds sequential edges between\n        commands in alphabetical order.\n        \"\"\"\n        commands_dir = os.path.join(archive_dir, \"commands\")\n        if not os.path.isdir(commands_dir):\n            return 0\n\n        files = sorted(os.listdir(commands_dir))\n        md_files = [f for f in files if f.endswith('.md')]\n        count = 0\n        last_cmd_id = None\n\n        for filename in md_files:\n            filepath = os.path.join(commands_dir, filename)\n            try:\n                with open(filepath, \"r\") as f:\n                    content = f.read()\n\n                # Extract frontmatter\n                fm_match = _RE_FRONT_MATTER.match(content)\n                meta = {}\n                if fm_match:\n                    for line in fm_match.group(1).split('\\n'):\n                        m = _RE_YAML_PAIR.match(line)\n                        if m:\n                            meta[m.group(1)] = m.group(2)\n\n                command_name = meta.get('command', filename[:-3])\n                aliases_str = meta.get('aliases', '[]')\n                category = meta.get('category', '')\n                tags_str = meta.get('tags', '[]')\n                upstream_str = meta.get('upstream', '[]')\n\n                # Extract first section body as description\n                desc_match = re.search(r'## [Uu]sage[\\s\\S]*?\\n\\n(.+?)(?:\\n##|```|$)', content)\n                desc = desc_match.group(1).strip()[:100] if desc_match else \"\"\n\n                # Extract code example if present\n                example_match = re.search(r'```[\\w]*\\n(.+?)```', content, re.DOTALL)\n                example = example_match.group(1).strip()[:80] if example_match else \"\"\n\n                label = command_name[:50] if command_name else filename[:-3]\n                summary = f\"{category}|{aliases_str[:40]}|{tags_str[:50]}\"\n\n                cmd_key = filename[:-3]  # strip .md\n                node_id = self.add_node(\n                    \"archive_command\",\n                    label,\n                    summary,\n                    f\"archive/commands/{filename}\",\n                    f\"archive_cmd_{cmd_key[:50]}\"\n                )\n                count += 1\n\n                # Sequential edges between commands\n                if last_cmd_id:\n                    self.add_edge(last_cmd_id, node_id, \"next_command\")\n                last_cmd_id = node_id\n\n                # Upstream edges: link to referenced decision/primitive nodes\n                if upstream_str and upstream_str != '[]':\n                    upstream_items = re.findall(r'[\\w/-]+', upstream_str)\n                    for ref in upstream_items[:5]:\n                        ref_clean = ref.strip().replace('/', '_')\n                        ref_id = f\"decision_{ref_clean}\"\n                        if ref_id in self._node_ids:\n                            self.add_edge(node_id, ref_id, \"upstream\")\n                            count += 1\n                        else:\n                            # Try canvas_decision format\n                            canvas_ref = f\"canvas_decision_{ref_clean}\"\n                            if canvas_ref in self._node_ids:\n                                self.add_edge(node_id, canvas_ref, \"upstream\")\n                                count += 1\n\n            except Exception:\n                pass\n        return count\n\n    def build_adjacency(self):"}]}}],"api":"anthropic-messages","provider":"minimax","model":"MiniMax-M2.7","usage":{"input":22819,"output":1134,"cacheRead":10071,"cacheWrite":0,"totalTokens":34024,"cost":{"input":0.0068457,"output":0.0013608,"cacheRead":0.0006042599999999999,"cacheWrite":0,"total":0.00881076}},"stopReason":"toolUse","timestamp":1777536485256,"responseId":"064240e58dba5c5b47f9c4cb4793f505"}}
{"type":"message","id":"50bcaefa","parentId":"af59635d","timestamp":"2026-04-30T08:08:28.442Z","message":{"role":"toolResult","toolCallId":"call_function_ru1p59hktnn8_1","toolName":"edit","content":[{"type":"text","text":"Successfully replaced 1 block(s) in /home/ubuntu/.hermes/agi/graph_builder.py."}],"details":{"diff":"      ...\n  820             except Exception:\n  821                 pass\n  822         return count\n  823 \n+ 824     def parse_archive_commands(self, archive_dir: str) -> int:\n+ 825         \"\"\"Parse archived command documentation files.\n+ 826         \n+ 827         Creates archive_command nodes from archive/commands/*.md with frontmatter\n+ 828         metadata (command, aliases, category, tags, upstream). Uses upstream field\n+ 829         to create cross-type edges to decision nodes. Adds sequential edges between\n+ 830         commands in alphabetical order.\n+ 831         \"\"\"\n+ 832         commands_dir = os.path.join(archive_dir, \"commands\")\n+ 833         if not os.path.isdir(commands_dir):\n+ 834             return 0\n+ 835 \n+ 836         files = sorted(os.listdir(commands_dir))\n+ 837         md_files = [f for f in files if f.endswith('.md')]\n+ 838         count = 0\n+ 839         last_cmd_id = None\n+ 840 \n+ 841         for filename in md_files:\n+ 842             filepath = os.path.join(commands_dir, filename)\n+ 843             try:\n+ 844                 with open(filepath, \"r\") as f:\n+ 845                     content = f.read()\n+ 846 \n+ 847                 # Extract frontmatter\n+ 848                 fm_match = _RE_FRONT_MATTER.match(content)\n+ 849                 meta = {}\n+ 850                 if fm_match:\n+ 851                     for line in fm_match.group(1).split('\\n'):\n+ 852                         m = _RE_YAML_PAIR.match(line)\n+ 853                         if m:\n+ 854                             meta[m.group(1)] = m.group(2)\n+ 855 \n+ 856                 command_name = meta.get('command', filename[:-3])\n+ 857                 aliases_str = meta.get('aliases', '[]')\n+ 858                 category = meta.get('category', '')\n+ 859                 tags_str = meta.get('tags', '[]')\n+ 860                 upstream_str = meta.get('upstream', '[]')\n+ 861 \n+ 862                 # Extract first section body as description\n+ 863                 desc_match = re.search(r'## [Uu]sage[\\s\\S]*?\\n\\n(.+?)(?:\\n##|```|$)', content)\n+ 864                 desc = desc_match.group(1).strip()[:100] if desc_match else \"\"\n+ 865 \n+ 866                 # Extract code example if present\n+ 867                 example_match = re.search(r'```[\\w]*\\n(.+?)```', content, re.DOTALL)\n+ 868                 example = example_match.group(1).strip()[:80] if example_match else \"\"\n+ 869 \n+ 870                 label = command_name[:50] if command_name else filename[:-3]\n+ 871                 summary = f\"{category}|{aliases_str[:40]}|{tags_str[:50]}\"\n+ 872 \n+ 873                 cmd_key = filename[:-3]  # strip .md\n+ 874                 node_id = self.add_node(\n+ 875                     \"archive_command\",\n+ 876                     label,\n+ 877                     summary,\n+ 878                     f\"archive/commands/{filename}\",\n+ 879                     f\"archive_cmd_{cmd_key[:50]}\"\n+ 880                 )\n+ 881                 count += 1\n+ 882 \n+ 883                 # Sequential edges between commands\n+ 884                 if last_cmd_id:\n+ 885                     self.add_edge(last_cmd_id, node_id, \"next_command\")\n+ 886                 last_cmd_id = node_id\n+ 887 \n+ 888                 # Upstream edges: link to referenced decision/primitive nodes\n+ 889                 if upstream_str and upstream_str != '[]':\n+ 890                     upstream_items = re.findall(r'[\\w/-]+', upstream_str)\n+ 891                     for ref in upstream_items[:5]:\n+ 892                         ref_clean = ref.strip().replace('/', '_')\n+ 893                         ref_id = f\"decision_{ref_clean}\"\n+ 894                         if ref_id in self._node_ids:\n+ 895                             self.add_edge(node_id, ref_id, \"upstream\")\n+ 896                             count += 1\n+ 897                         else:\n+ 898                             # Try canvas_decision format\n+ 899                             canvas_ref = f\"canvas_decision_{ref_clean}\"\n+ 900                             if canvas_ref in self._node_ids:\n+ 901                                 self.add_edge(node_id, canvas_ref, \"upstream\")\n+ 902                                 count += 1\n+ 903 \n+ 904             except Exception:\n+ 905                 pass\n+ 906         return count\n+ 907 \n  824     def build_adjacency(self):\n  825         \"\"\"Build adjacency dict from edges.\"\"\"\n  826         self.adj = defaultdict(list)\n  827         for edge in self.edges:\n      ...","firstChangedLine":824},"isError":false,"timestamp":1777536508442}}
{"type":"message","id":"9632ad68","parentId":"50bcaefa","timestamp":"2026-04-30T08:08:35.188Z","message":{"role":"assistant","content":[{"type":"thinking","thinking":"Now I need to wire it into `_cached_build_builder()` and `build_graph()`.","thinkingSignature":"25fe39bd1d715eca8ebf0d46311dbdae66d2738cc1975ad2ecd70eded835f765"},{"type":"text","text":"Now wire it into both build functions:\n"},{"type":"toolCall","id":"call_function_v23q72idz2pm_1","name":"edit","arguments":{"path":"/home/ubuntu/.hermes/agi/graph_builder.py","edits":[{"oldText":"    # Parse handoff directory (agent handoff logs with TODO items)\n    handoff_dir = os.path.join(hermes_dir, \"belam-codex\", \"handoff\")\n    if os.path.isdir(handoff_dir):\n        builder.parse_handoff(handoff_dir)\n\n    # Process gitnexus cache\n    cache_to_use = None\n    gitnexus_cache_file = os.path.join(agi_dir, \".gitnexus_cache.json\")","newText":"    # Parse handoff directory (agent handoff logs with TODO items)\n    handoff_dir = os.path.join(hermes_dir, \"belam-codex\", \"handoff\")\n    if os.path.isdir(handoff_dir):\n        builder.parse_handoff(handoff_dir)\n\n    # Parse archive/commands (38 command docs with upstream links to decision nodes)\n    archive_dir = os.path.join(hermes_dir, \"belam-codex\", \"archive\")\n    if os.path.isdir(archive_dir):\n        builder.parse_archive_commands(archive_dir)\n\n    # Process gitnexus cache\n    cache_to_use = None\n    gitnexus_cache_file = os.path.join(agi_dir, \".gitnexus_cache.json\")"}]}}],"api":"anthropic-messages","provider":"minimax","model":"MiniMax-M2.7","usage":{"input":23989,"output":350,"cacheRead":10071,"cacheWrite":0,"totalTokens":34410,"cost":{"input":0.0071966999999999995,"output":0.00041999999999999996,"cacheRead":0.0006042599999999999,"cacheWrite":0,"total":0.00822096}},"stopReason":"toolUse","timestamp":1777536508442,"responseId":"064240fcb02166bddbd486834a7c0e0b"}}
{"type":"message","id":"50916d4f","parentId":"9632ad68","timestamp":"2026-04-30T08:08:35.193Z","message":{"role":"toolResult","toolCallId":"call_function_v23q72idz2pm_1","toolName":"edit","content":[{"type":"text","text":"Successfully replaced 1 block(s) in /home/ubuntu/.hermes/agi/graph_builder.py."}],"details":{"diff":"      ...\n 1082     handoff_dir = os.path.join(hermes_dir, \"belam-codex\", \"handoff\")\n 1083     if os.path.isdir(handoff_dir):\n 1084         builder.parse_handoff(handoff_dir)\n 1085 \n+1086     # Parse archive/commands (38 command docs with upstream links to decision nodes)\n+1087     archive_dir = os.path.join(hermes_dir, \"belam-codex\", \"archive\")\n+1088     if os.path.isdir(archive_dir):\n+1089         builder.parse_archive_commands(archive_dir)\n+1090 \n 1086     # Process gitnexus cache\n 1087     cache_to_use = None\n 1088     gitnexus_cache_file = os.path.join(agi_dir, \".gitnexus_cache.json\")\n 1089     if os.path.exists(gitnexus_cache_file):\n      ...","firstChangedLine":1086},"isError":false,"timestamp":1777536515193}}
{"type":"message","id":"682daeea","parentId":"50916d4f","timestamp":"2026-04-30T08:08:40.536Z","message":{"role":"assistant","content":[{"type":"thinking","thinking":"Wait, that replaced the first occurrence (in `_cached_build_builder`). But there's a second one in `build_graph()` too. Let me check if the replacement happened in the right place by verifying:","thinkingSignature":"c18a0c7c379465b0909b21f0f3491d315b5a41fc16ad31f891d0a5a0dccaf6e1"},{"type":"toolCall","id":"call_function_xiiuftjyi0pq_1","name":"bash","arguments":{"command":"grep -n \"parse_archive_commands\\|parse_handoff\\|Process gitnexus\" /home/ubuntu/.hermes/agi/graph_builder.py"}}],"api":"anthropic-messages","provider":"minimax","model":"MiniMax-M2.7","usage":{"input":24375,"output":93,"cacheRead":10071,"cacheWrite":0,"totalTokens":34539,"cost":{"input":0.0073124999999999996,"output":0.00011159999999999999,"cacheRead":0.0006042599999999999,"cacheWrite":0,"total":0.00802836}},"stopReason":"toolUse","timestamp":1777536515195,"responseId":"06424103d0ba64364b6dad8a17e88f32"}}
