{"type":"message","id":"5e3d9406","parentId":"147b08e4","timestamp":"2026-04-30T09:04:06.926Z","message":{"role":"assistant","content":[{"type":"thinking","thinking":"Let me continue reading the graph_builder.py and also check the benchmark file to understand what metrics are being measured.","thinkingSignature":"63dda78ac2b1d52d0cfeb1a83467750a472904008b9e77f0a0d74233f4d4047f"},{"type":"toolCall","id":"call_function_uuz2phdzoao8_1","name":"read","arguments":{"path":"/home/ubuntu/.hermes/agi/graph_builder.py","offset":1280}},{"type":"toolCall","id":"call_function_uuz2phdzoao8_2","name":"read","arguments":{"path":"/home/ubuntu/.hermes/agi/_benchmark.py"}}],"api":"anthropic-messages","provider":"minimax","model":"MiniMax-M2.7","usage":{"input":14760,"output":100,"cacheRead":10071,"cacheWrite":0,"totalTokens":24931,"cost":{"input":0.004428,"output":0.00011999999999999999,"cacheRead":0.0006042599999999999,"cacheWrite":0,"total":0.00515226}},"stopReason":"toolUse","timestamp":1777539839425,"responseId":"06424dff2e4ebc8b48ea0b21ca774412"}}
