{"type":"message","id":"34443243","parentId":"c3e21cc6","timestamp":"2026-04-30T07:08:37.554Z","message":{"role":"toolResult","toolCallId":"call_function_okbuptdl4uil_1","toolName":"read","content":[{"type":"text","text":"#!/usr/bin/env python3\n\"\"\"\nasciirender.py — ASCII art rendering for unified graph memory\nDB-augmented directed code generation via unified graph memory\n\"\"\"\n\nfrom typing import List, Dict, Any, Optional, Tuple\nfrom graph_builder import GraphBuilder\n\n\nclass ASCIIRenderer:\n    \"\"\"Renders graph as ASCII art.\"\"\"\n    \n    MAX_WIDTH = 200\n    MAX_LINES = 200\n    \n    def __init__(self, builder: GraphBuilder):\n        self.builder = builder\n        # Nodes are tuples: (id, type, label, content, source)\n        self._node_lookup = {n[0]: n for n in builder.nodes}\n    \n    def render_summary(self) -> str:\n        \"\"\"Render a summary view of the graph.\"\"\"\n        lines = []\n        lines.append(\" UNIFIED GRAPH \")\n        lines.append(\"=\" * 60)\n        \n        stats = self.builder.get_stats()\n        lines.append(f\" nodes={stats['node_count']}  edges={stats['edge_count']}\")\n        lines.append(\"-\" * 60)\n        \n        # Show nodes by type\n        for node_type, count in sorted(stats['nodes_by_type'].items()):\n            type_label = node_type.replace('_', ' ').title()\n            lines.append(f\" {type_label}: {count}\")\n        \n        return '\\n'.join(lines)\n    \n    def render_tree(self, max_depth: int = 2, root_id: Optional[str] = None) -> str:\n        \"\"\"Render graph as ASCII tree starting from root.\"\"\"\n        if not self.builder.nodes:\n            return \"(empty graph)\"\n        \n        lines = []\n        lines.append(\" GRAPH TREE \")\n        lines.append(\"=\" * 60)\n        \n        # Default root — nodes are tuples (id, type, label, content, source)\n        if root_id is None:\n            section_nodes = [n for n in self.builder.nodes if n[1] == \"doc_section\"]\n            if section_nodes:\n                root_id = section_nodes[0][0]\n            else:\n                root_id = self.builder.nodes[0][0]\n        \n        visited = set()\n        self._render_node_tree(root_id, \"\", True, lines, visited, max_depth, 0)\n        \n        return '\\n'.join(lines)\n    \n    def _render_node_tree(self, node_id: str, prefix: str, is_last: bool,\n                          lines: List[str], visited: set, max_depth: int, current_depth: int):\n        \"\"\"Recursively render a node and its children.\"\"\"\n        if node_id in visited or current_depth > max_depth:\n            return\n        visited.add(node_id)\n        \n        node = self._node_lookup.get(node_id)\n        if not node:\n            return\n        \n        connector = \"└─ \" if is_last else \"├─ \"\n        label = node[2][:50]\n        node_type = node[1][:15]\n        lines.append(f\"{prefix}{connector}[{node_type}] {label}\")\n        \n        # Get children\n        new_prefix = prefix + (\"   \" if is_last else \"│  \")\n        \n        # Find direct children (outgoing edges)\n        children = [e[\"to\"] for e in self.builder.edges \n                   if e[\"from\"] == node_id and e[\"type\"] == \"contains\"]\n        \n        for i, child_id in enumerate(children[:5]):\n            self._render_node_tree(\n                child_id, new_prefix, i == len(children) - 1,\n                lines, visited, max_depth, current_depth + 1\n            )\n    \n    def render_hierarchy(self, max_sections: int = 10) -> str:\n        \"\"\"Render top-level sections with their children.\"\"\"\n        lines = []\n        lines.append(\" GRAPH HIERARCHY \")\n        lines.append(\"=\" * 60)\n        \n        section_nodes = [n for n in self.builder.nodes if n[1] == \"doc_section\"]\n        \n        for i, node in enumerate(section_nodes[:max_sections]):\n            indent = \"  \" if i > 0 else \"\"\n            is_last = i == min(len(section_nodes) - 1, max_sections - 1)\n            \n            label = node[2][:50]\n            \n            # Get children\n            children = [e[\"to\"] for e in self.builder.edges \n                       if e[\"from\"] == node[0] and e[\"type\"] == \"contains\"]\n            \n            child_labels = []\n            for c in children[:3]:\n                cn = self._node_lookup.get(c)\n                if cn:\n                    child_labels.append(cn[2][:20])\n            \n            child_str = f\" → {', '.join(child_labels)}\" if child_labels else \"\"\n            connector = \"└─\" if is_last else \"├─\"\n            \n            lines.append(f\"{indent}{connector} {label}{child_str}\")\n        \n        if len(section_nodes) > max_sections:\n            lines.append(f\"  ... +{len(section_nodes) - max_sections} more sections\")\n        \n        return '\\n'.join(lines)\n    \n    def render_path(self, path: List[str]) -> str:\n        \"\"\"Render a path through the graph.\"\"\"\n        lines = []\n        lines.append(\" PATH \")\n        lines.append(\"=\" * 60)\n        \n        for i, node_id in enumerate(path):\n            node = self._node_lookup.get(node_id)\n            if not node:\n                continue\n            \n            connector = \"→\" if i > 0 else \"●\"\n            label = node[2][:50]\n            lines.append(f\"{connector} {label}\")\n        \n        return '\\n'.join(lines)\n    \n    def render_node_detail(self, node_id: str) -> str:\n        \"\"\"Render detailed view of a single node.\"\"\"\n        node = self._node_lookup.get(node_id)\n        if not node:\n            return f\"Node not found: {node_id}\"\n        \n        lines = []\n        lines.append(f\" NODE: {node[2]} \")\n        lines.append(\"=\" * 60)\n        lines.append(f\" ID:     {node[0]}\")\n        lines.append(f\" Type:   {node[1]}\")\n        lines.append(f\" Source: {node[4]}\")\n        lines.append(\"-\" * 60)\n        lines.append(\" Content:\")\n        lines.append(node[3] or '(none)')\n        lines.append(\"-\" * 60)\n        \n        # Show neighbors\n        neighbors = list(self.builder.adj.get(node_id, []))\n        lines.append(f\" Neighbors ({len(neighbors)}):\")\n        for n in neighbors[:5]:\n            nn = self._node_lookup.get(n)\n            if nn:\n                lines.append(f\"  - {nn[1]}: {nn[2][:40]}\")\n        \n        return '\\n'.join(lines)\n    \n    def render_stats(self) -> str:\n        \"\"\"Render graph statistics.\"\"\"\n        stats = self.builder.get_stats()\n        \n        lines = []\n        lines.append(\" GRAPH STATS \")\n        lines.append(\"=\" * 60)\n        lines.append(f\" Total Nodes:    {stats['node_count']}\")\n        lines.append(f\" Total Edges:    {stats['edge_count']}\")\n        lines.append(f\" Unique IDs:     {stats['node_ids']}\")\n        lines.append(\"-\" * 60)\n        lines.append(\" Nodes by Type:\")\n        \n        for node_type, count in sorted(stats['nodes_by_type'].items(), key=lambda x: -x[1]):\n            type_label = node_type.replace('_', ' ').title()\n            bar = \"█\" * min(count, 40)\n            lines.append(f\" {type_label:20s} {count:4d} {bar}\")\n        \n        return '\\n'.join(lines)\n    \n    def render_full(self, path: Optional[List[str]] = None) -> str:\n        \"\"\"Render full ASCII representation of the graph.\"\"\"\n        sections = []\n        \n        sections.append(self.render_summary())\n        sections.append(\"\")\n        sections.append(self.render_hierarchy())\n        \n        if path:\n            sections.append(\"\")\n            sections.append(self.render_path(path))\n        \n        sections.append(\"\")\n        sections.append(self.render_stats())\n        \n        output = '\\n'.join(sections)\n        \n        # Truncate if too long\n        lines = output.split('\\n')\n        if len(lines) > self.MAX_LINES:\n            lines = lines[:self.MAX_LINES]\n            lines.append(f\"... (truncated, {len(self.builder.nodes)} nodes total)\")\n        \n        return '\\n'.join(lines)\n\n\ndef render_to_string(builder: GraphBuilder, mode: str = \"full\", \n                     path: Optional[List[str]] = None) -> Tuple[str, int]:\n    \"\"\"Render graph to string. Returns (output, line_count).\"\"\"\n    renderer = ASCIIRenderer(builder)\n    \n    if mode == \"summary\":\n        output = renderer.render_summary()\n    elif mode == \"tree\":\n        output = renderer.render_tree()\n    elif mode == \"hierarchy\":\n        output = renderer.render_hierarchy()\n    elif mode == \"stats\":\n        output = renderer.render_stats()\n    elif path:\n        output = renderer.render_path(path)\n    else:\n        output = renderer.render_full(path)\n    \n    line_count = len(output.strip().split('\\n'))\n    return output, line_count\n\n\nif __name__ == \"__main__\":\n    import os\n    import sys\n    sys.path.insert(0, os.path.dirname(os.path.abspath(__file__)))\n    \n    from graph_builder import build_graph\n    \n    hermes = os.path.expanduser(\"~/.hermes\")\n    agi = os.path.dirname(os.path.abspath(__file__))\n    \n    print(\"Building graph...\")\n    builder, build_time = build_graph(hermes, agi)\n    print(f\"Build: {build_time:.2f}ms\")\n    \n    renderer = ASCIIRenderer(builder)\n    print()\n    print(renderer.render_full())\n"}],"isError":false,"timestamp":1777532917554}}
{"type":"message","id":"f244d4fb","parentId":"34443243","timestamp":"2026-04-30T07:08:37.555Z","message":{"role":"toolResult","toolCallId":"call_function_okbuptdl4uil_2","toolName":"read","content":[{"type":"text","text":"#!/usr/bin/env python3\n\"\"\"\nquery_engine.py — Path finding and graph traversal for unified graph memory\nDB-augmented directed code generation via unified graph memory\n\"\"\"\n\nimport json\nimport time\nimport heapq\nfrom typing import List, Dict, Any, Optional, Tuple, Set\nfrom collections import deque\nfrom graph_builder import GraphBuilder\n\n\nclass QueryEngine:\n    \"\"\"Query engine for graph traversal and path finding.\"\"\"\n    \n    def __init__(self, builder: GraphBuilder):\n        self.builder = builder\n        self._cache: Dict[str, Any] = {}\n    \n    def find_path_bfs(self, start_id: str, end_id: str, \n                      max_depth: Optional[int] = None) -> Optional[List[str]]:\n        \"\"\"Find shortest path using BFS.\"\"\"\n        if start_id not in self.builder._node_ids or end_id not in self.builder._node_ids:\n            return None\n        \n        # Dynamic max_depth based on node count if not specified\n        if max_depth is None:\n            max_depth = min(len(self.builder.nodes), 100)\n        \n        visited: Set[str] = {start_id}\n        queue = deque([(start_id, [start_id])])\n        \n        while queue:\n            current, path = queue.popleft()\n            \n            if current == end_id:\n                return path\n            \n            if len(path) >= max_depth:\n                continue\n            \n            for neighbor in self.builder.adj.get(current, []):\n                if neighbor not in visited:\n                    visited.add(neighbor)\n                    queue.append((neighbor, path + [neighbor]))\n        \n        return None\n    \n    def find_path_dijkstra(self, start_id: str, end_id: str,\n                           edge_weights: Optional[Dict[str, float]] = None) -> Tuple[Optional[List[str]], float]:\n        \"\"\"Find shortest path using Dijkstra's algorithm.\"\"\"\n        if start_id not in self.builder._node_ids or end_id not in self.builder._node_ids:\n            return None, float('inf')\n        \n        if edge_weights is None:\n            edge_weights = {}\n        \n        dist: Dict[str, float] = {start_id: 0}\n        prev: Dict[str, Optional[str]] = {start_id: None}\n        visited: Set[str] = set()\n        pq = [(0, start_id)]\n        \n        while pq:\n            current_dist, current = heapq.heappop(pq)\n            \n            if current in visited:\n                continue\n            visited.add(current)\n            \n            if current == end_id:\n                # Reconstruct path\n                path = []\n                node = end_id\n                while node is not None:\n                    path.append(node)\n                    node = prev[node]\n                return list(reversed(path)), dist[end_id]\n            \n            for neighbor in self.builder.adj.get(current, []):\n                if neighbor in visited:\n                    continue\n                \n                edge_key = f\"{current}->{neighbor}\"\n                weight = edge_weights.get(edge_key, 1.0)\n                new_dist = dist[current] + weight\n                \n                if neighbor not in dist or new_dist < dist[neighbor]:\n                    dist[neighbor] = new_dist\n                    prev[neighbor] = current\n                    heapq.heappush(pq, (new_dist, neighbor))\n        \n        return None, float('inf')\n    \n    def find_reachable(self, start_id: str, max_depth: int = 3) -> Set[str]:\n        \"\"\"Find all nodes reachable within max_depth hops.\"\"\"\n        if start_id not in self.builder._node_ids:\n            return set()\n        \n        reachable: Set[str] = {start_id}\n        frontier = {start_id}\n        \n        for _ in range(max_depth):\n            next_frontier = set()\n            for node in frontier:\n                for neighbor in self.builder.adj.get(node, []):\n                    if neighbor not in reachable:\n                        reachable.add(neighbor)\n                        next_frontier.add(neighbor)\n            frontier = next_frontier\n            if not frontier:\n                break\n        \n        return reachable\n    \n    def find_common_neighbors(self, node1: str, node2: str) -> Set[str]:\n        \"\"\"Find nodes reachable from both node1 and node2.\"\"\"\n        neighbors1 = self.find_reachable(node1, max_depth=2)\n        neighbors2 = self.find_reachable(node2, max_depth=2)\n        return neighbors1 & neighbors2 - {node1, node2}\n    \n    def get_subgraph(self, center_id: str, depth: int = 2) -> Dict[str, Any]:\n        \"\"\"Get subgraph centered on a node.\"\"\"\n        reachable = self.find_reachable(center_id, max_depth=depth)\n        \n        subgraph_nodes = [n for n in self.builder.nodes if n[0] in reachable]\n        subgraph_edges = [e for e in self.builder.edges \n                          if e[\"from\"] in reachable and e[\"to\"] in reachable]\n        \n        return {\n            \"nodes\": subgraph_nodes,\n            \"edges\": subgraph_edges,\n            \"center\": center_id,\n            \"node_count\": len(subgraph_nodes),\n            \"edge_count\": len(subgraph_edges)\n        }\n    \n    def query_by_type(self, node_type: str) -> List[Dict[str, Any]]:\n        \"\"\"Get all nodes of a specific type.\"\"\"\n        return [n for n in self.builder.nodes if n[1] == node_type]\n    \n    def query_by_source(self, source: str) -> List[Dict[str, Any]]:\n        \"\"\"Get all nodes from a specific source.\"\"\"\n        return [n for n in self.builder.nodes if source in n[4]]\n    \n    def search_content(self, query: str, limit: int = 10) -> List[Tuple[Dict[str, Any], int]]:\n        \"\"\"Search nodes by content (simple keyword match).\"\"\"\n        query_lower = query.lower()\n        results = []\n        \n        for node in self.builder.nodes:\n            score = 0\n            if query_lower in node[2].lower():\n                score += 2\n            if query_lower in node[3].lower():\n                score += 1\n            if score > 0:\n                results.append((node, score))\n        \n        results.sort(key=lambda x: -x[1])\n        return results[:limit]\n\n\ndef timed_query(engine: QueryEngine, start_id: str, end_id: str) -> Tuple[Optional[List[str]], float]:\n    \"\"\"Execute a query with timing.\"\"\"\n    start = time.perf_counter()\n    path = engine.find_path_bfs(start_id, end_id)\n    elapsed_ms = (time.perf_counter() - start) * 1000\n    return path, elapsed_ms\n\n\nif __name__ == \"__main__\":\n    import os\n    import sys\n    sys.path.insert(0, os.path.dirname(os.path.abspath(__file__)))\n    \n    from graph_builder import build_graph\n    \n    hermes = os.path.expanduser(\"~/.hermes\")\n    agi = os.path.dirname(os.path.abspath(__file__))\n    \n    print(\"Building graph...\")\n    builder, build_time = build_graph(hermes, agi)\n    print(f\"Build: {build_time:.2f}ms, {len(builder.nodes)} nodes, {len(builder.edges)} edges\")\n    \n    engine = QueryEngine(builder)\n    \n    # Find path between first and last section\n    section_nodes = [n for n in builder.nodes if n[0].startswith(\"agents_section_\")]\n    if len(section_nodes) >= 2:\n        path, query_time = timed_query(\n            engine, \n            section_nodes[0][0], \n            section_nodes[-1][0]\n        )\n        print(f\"Path query: {query_time:.2f}ms\")\n        if path:\n            print(f\"Path length: {len(path)} hops\")\n"}],"isError":false,"timestamp":1777532917555}}
