{"type":"message","id":"6c284d4b","parentId":"5c604a53","timestamp":"2026-04-30T07:50:30.424Z","message":{"role":"toolResult","toolCallId":"call_function_6enzzplz0l02_2","toolName":"bash","content":[{"type":"text","text":"codex-layer-v1-modules\ncommands\nembed-primitives.md.archived\nembed_primitives.py.archived\ntasks\nREADME.md\n_index.md\n_tags.md\n_weekly_synthesis.md\nagent-coordination.md\nderivative-specialist.md\nexperiment-methodology.md\nfinancial-encoding.md\ngpu-optimization.md\nml-architecture.md\n"}],"isError":false,"timestamp":1777535430424}}
{"type":"message","id":"683cc010","parentId":"6c284d4b","timestamp":"2026-04-30T07:50:42.886Z","message":{"role":"assistant","content":[{"type":"thinking","thinking":"Now I see the opportunity. The mapper_batch_*.json files contain raw LLM judgment tasks that need to be parsed for actual LINK entries. The current `parse_canvas_graph` only reads `graph_data.json` which has 8 pre-computed causal edges. The mapper_batch files contain raw pairs that haven't been evaluated yet.\n\nLet me check the graph_data.json structure and see how the current edges are defined there. The mapper batches have the full LLM prompts with the LINK/RATIONALE responses embedded. I should parse those responses from the `task` field to extract the actual causal links.\n\nActually wait — looking more carefully at the mapper_batch format, the `task` field contains the full LLM prompt + the expected response format. \n\nThe actual LINK responses should be somewhere in the output, but I'm not finding them in the task field. I need to look more carefully at what's actually in the mapper_batch structure to see where the judgments ended up.","thinkingSignature":"6468ce409fdca5bd560b2fba7616d9c519620d5285552e4a56e8c9c67d42b59f"},{"type":"toolCall","id":"call_function_4t9q1q7kvm0u_1","name":"bash","arguments":{"command":"# Check mapper_batch structure more carefully - look for LINK responses\npython3 -c \"\nimport json\nfor batch_file in ['mapper_batch_0.json', 'mapper_batch_1.json', 'mapper_batch_2.json']:\n    path = f'/home/ubuntu/.hermes/belam-codex/canvas/{batch_file}'\n    try:\n        with open(path) as f:\n            data = json.load(f)\n        print(f'{batch_file}: {len(data)} pairs')\n        if data:\n            # Check if there's a result/response field\n            first = data[0]\n            print(f'  Keys: {list(first.keys())}')\n            # Look for LINK in task field\n            task = first.get('task', '')\n            link_idx = task.rfind('LINK:')\n            print(f'  LINK found in task: {link_idx > 0}')\n    except Exception as e:\n        print(f'{batch_file}: error {e}')\n\" 2>&1 | head -20"}}],"api":"anthropic-messages","provider":"minimax","model":"MiniMax-M2.7","usage":{"input":28026,"output":425,"cacheRead":10071,"cacheWrite":0,"totalTokens":38522,"cost":{"input":0.0084078,"output":0.0005099999999999999,"cacheRead":0.0006042599999999999,"cacheWrite":0,"total":0.00952206}},"stopReason":"toolUse","timestamp":1777535430425,"responseId":"06423cc6ff79fd97004b518e5733abd1"}}
{"type":"message","id":"7d1a7e3a","parentId":"683cc010","timestamp":"2026-04-30T07:50:42.930Z","message":{"role":"toolResult","toolCallId":"call_function_4t9q1q7kvm0u_1","toolName":"bash","content":[{"type":"text","text":"mapper_batch_0.json: 14 pairs\n  Keys: ['key_a', 'key_b', 'score', 'task']\n  LINK found in task: True\nmapper_batch_1.json: 14 pairs\n  Keys: ['key_a', 'key_b', 'score', 'task']\n  LINK found in task: True\nmapper_batch_2.json: 14 pairs\n  Keys: ['key_a', 'key_b', 'score', 'task']\n  LINK found in task: True\n"}],"isError":false,"timestamp":1777535442930}}
{"type":"message","id":"b1bbb3ea","parentId":"7d1a7e3a","timestamp":"2026-04-30T07:50:50.929Z","message":{"role":"assistant","content":[{"type":"thinking","thinking":"So the mapper_batch files contain 14 pairs each × 8 batches = 112 pairs. Each has the `task` field which includes the full LLM prompt with the expected format. But the actual LINK response would be somewhere after the prompt.\n\nLet me check if there's a results file or if the responses are appended to the task field somehow.\n\nActually, looking at the task format, it seems like these are the raw LLM prompts that haven't been answered yet. The `graph_data.json` was already processed and has the computed edges. The mapper_batch files are the batch jobs.\n\nWait, but maybe the responses were appended to the task field after processing? Let me look more carefully.","thinkingSignature":"07822743b3c95f08a3b53d51a8d4019c40cbf586b745832d1bd4f13481d55c7f"},{"type":"toolCall","id":"call_function_dekogy3bmb1j_1","name":"bash","arguments":{"command":"# Check if graph_data.json has the actual LINK responses parsed\npython3 -c \"\nimport json\nwith open('/home/ubuntu/.hermes/belam-codex/canvas/graph_data.json') as f:\n    data = json.load(f)\nprint(f'Nodes: {len(data.get(\\\"nodes\\\", []))}')\nprint(f'Edges: {len(data.get(\\\"edges\\\", []))}')\nif data.get('edges'):\n    print('Sample edge:', data['edges'][0])\n    print('Sample edges:', [e for e in data['edges'][:3]])\n\" 2>&1"}}],"api":"anthropic-messages","provider":"minimax","model":"MiniMax-M2.7","usage":{"input":28571,"output":288,"cacheRead":10071,"cacheWrite":0,"totalTokens":38930,"cost":{"input":0.0085713,"output":0.0003456,"cacheRead":0.0006042599999999999,"cacheWrite":0,"total":0.00952116}},"stopReason":"toolUse","timestamp":1777535442931,"responseId":"06423cd3eed343c6e0233405c52033bb"}}
{"type":"message","id":"b9544cfc","parentId":"b1bbb3ea","timestamp":"2026-04-30T07:50:50.968Z","message":{"role":"toolResult","toolCallId":"call_function_dekogy3bmb1j_1","toolName":"bash","content":[{"type":"text","text":"Nodes: 105\nEdges: 8\nSample edge: {'source': 'decision/belam-codex-resurrection', 'target': 'lesson/always-back-up-workspace-to-github'}\nSample edges: [{'source': 'decision/belam-codex-resurrection', 'target': 'lesson/always-back-up-workspace-to-github'}, {'source': 'decision/indexed-command-interface', 'target': 'lesson/shell-splits-unquoted-list-args'}, {'source': 'decision/clock-cycles-over-tokens', 'target': 'decision/belam-codex-resurrection'}]\n"}],"isError":false,"timestamp":1777535450967}}
{"type":"message","id":"012832ad","parentId":"b9544cfc","timestamp":"2026-04-30T07:51:12.069Z","message":{"role":"assistant","content":[{"type":"thinking","thinking":"So `graph_data.json` already has the parsed edges. The mapper_batch files contain the raw LLM prompts for 112 pairs, but the responses haven't been processed. The 8 edges in graph_data.json are already used by `parse_canvas_graph`.\n\nNow, the remaining mapper_batch files have 112 pairs (8 batches × 14 pairs). If we parse those for LINK responses and create edges, we could add potentially many more causal edges.\n\nBut wait — the graph_data.json already only has 8 edges. The mapper_batch files seem to contain the raw prompts, not processed results. The graph_data.json is the processed output.\n\n\nI could parse the mapper_batch files to extract the LINK responses from the task field, but I need to figure out where the actual responses are stored since the task field only contains the prompt.\n\nLooking at the structure more carefully, the key_a and key_b fields reference the nodes (decisions/ and memories/), and the task field has the LLM prompt asking for a LINK or NONE judgment. Since the responses aren't directly in the file, I need to either run the LLM evaluation myself—which is slow—or find a results file with the completed judgments.\n\nFor this iteration, I'm focusing on expanding the graph without hitting the noise floor. I can remove the decision and lesson limits (currently 100 each) to parse all available files, which would add roughly 36 decisions and 108 lessons. Let me verify these directories actually have enough files to work with.\n\nI'm also considering whether I should target something more interesting instead—maybe parsing the knowledge directory or something with richer semantic connections. But first, let me check what's actually in the canvas mapper_batch files to see if there's something more compelling to work with.","thinkingSignature":"80dcfc8df261e79bafdae5ac9e1b0f432b74ef097883a5de8b4aec3418a4a7f5"},{"type":"text","text":"Primary metric is noise-floor saturated (~0.03ms). I'll expand data sources instead. Parse all remaining decisions (128) and lessons (208) with no limits — currently limited to 100 each.\n"},{"type":"toolCall","id":"call_function_axzrekag9m7z_1","name":"edit","arguments":{"path":"/home/ubuntu/.hermes/agi/graph_builder.py","edits":[{"oldText":"    # Parse decisions (expanded to 100)\n    decisions_dir = os.path.join(hermes_dir, \"belam-codex\", \"decisions\")\n    if os.path.isdir(decisions_dir):\n        builder.parse_decisions(decisions_dir, limit=100)","newText":"    # Parse decisions (all 128 files)\n    decisions_dir = os.path.join(hermes_dir, \"belam-codex\", \"decisions\")\n    if os.path.isdir(decisions_dir):\n        builder.parse_decisions(decisions_dir, limit=999)"},{"oldText":"    # Parse lessons (expanded to 100)\n    lessons_dir = os.path.join(hermes_dir, \"belam-codex\", \"lessons\")\n    if os.path.isdir(lessons_dir):\n        builder.parse_lessons(lessons_dir, limit=100)","newText":"    # Parse lessons (all 208 files)\n    lessons_dir = os.path.join(hermes_dir, \"belam-codex\", \"lessons\")\n    if os.path.isdir(lessons_dir):\n        builder.parse_lessons(lessons_dir, limit=999)"},{"oldText":"    # Parse decisions (expanded to 100)\n    decisions_dir = os.path.join(hermes_dir, \"belam-codex\", \"decisions\")\n    if os.path.isdir(decisions_dir):\n        builder.parse_decisions(decisions_dir, limit=100)\n\n    # Parse lessons (expanded to 100)\n    lessons_dir = os.path.join(hermes_dir, \"belam-codex\", \"lessons\")\n    if os.path.isdir(lessons_dir):\n        builder.parse_lessons(lessons_dir, limit=100)","newText":"    # Parse decisions (all 128 files)\n    decisions_dir = os.path.join(hermes_dir, \"belam-codex\", \"decisions\")\n    if os.path.isdir(decisions_dir):\n        builder.parse_decisions(decisions_dir, limit=999)\n\n    # Parse lessons (all 208 files)\n    lessons_dir = os.path.join(hermes_dir, \"belam-codex\", \"lessons\")\n    if os.path.isdir(lessons_dir):\n        builder.parse_lessons(lessons_dir, limit=999)"}]}}],"api":"anthropic-messages","provider":"minimax","model":"MiniMax-M2.7","usage":{"input":28998,"output":971,"cacheRead":10071,"cacheWrite":0,"totalTokens":40040,"cost":{"input":0.0086994,"output":0.0011652,"cacheRead":0.0006042599999999999,"cacheWrite":0,"total":0.01046886}},"stopReason":"toolUse","timestamp":1777535450968,"responseId":"06423cdb2db3a9b742db5436d662396e"}}
{"type":"message","id":"c687a2e4","parentId":"012832ad","timestamp":"2026-04-30T07:51:12.078Z","message":{"role":"toolResult","toolCallId":"call_function_axzrekag9m7z_1","toolName":"edit","content":[{"type":"text","text":"Found 2 occurrences of edits[0] in /home/ubuntu/.hermes/agi/graph_builder.py. Each oldText must be unique. Please provide more context to make it unique."}],"details":{},"isError":true,"timestamp":1777535472078}}
{"type":"message","id":"9743aacd","parentId":"c687a2e4","timestamp":"2026-04-30T07:51:23.611Z","message":{"role":"assistant","content":[{"type":"thinking","thinking":"The same text appears twice. Let me provide more context to make each unique.","thinkingSignature":"aeaf8db18c5dc4aa07a6aa4f0e650fa8705cc82d63c26edd3f32c02aaa05069f"},{"type":"toolCall","id":"call_function_17sbuihp3pjg_1","name":"edit","arguments":{"path":"/home/ubuntu/.hermes/agi/graph_builder.py","edits":[{"oldText":"@lru_cache(maxsize=1)\ndef _cached_build(hermes_dir: str, agi_dir: str, gitnexus_hash: int) -> Tuple[Tuple, Tuple, Dict]:\n    \"\"\"Cached builder internals — returns serializable parts only.\n    \n    lru_cache eliminates pickle.load entirely for warm calls.\n    gitnexus_hash is a cache-busting int derived from gitnexus content.\n    \"\"\"\n    # Initialize cache\n    init_cache(agi_dir)\n\n    # Build from sources\n    builder = GraphBuilder()\n\n    # Parse AGENTS.md\n    agents_md = os.path.join(hermes_dir, \"belam-codex\", \"AGENTS.md\")\n    builder.parse_agents_md(agents_md)\n\n    # Parse memory files (expanded to all 58)\n    memory_dir = os.path.join(hermes_dir, \"belam-codex\", \"memory\")\n    builder.parse_memory_files(memory_dir, limit=58)\n\n    # Parse schema files\n    schema_dir = os.path.join(hermes_dir, \"belam-codex\", \"schemas\")\n    builder.parse_schema_files(schema_dir)\n\n    # Parse decisions (expanded to 100)\n    decisions_dir = os.path.join(hermes_dir, \"belam-codex\", \"decisions\")\n    if os.path.isdir(decisions_dir):\n        builder.parse_decisions(decisions_dir, limit=100)\n\n    # Parse lessons (expanded to 100)\n    lessons_dir = os.path.join(hermes_dir, \"belam-codex\", \"lessons\")\n    if os.path.isdir(lessons_dir):\n        builder.parse_lessons(lessons_dir, limit=100)","newText":"@lru_cache(maxsize=1)\ndef _cached_build(hermes_dir: str, agi_dir: str, gitnexus_hash: int) -> Tuple[Tuple, Tuple, Dict]:\n    \"\"\"Cached builder internals — returns serializable parts only.\n    \n    lru_cache eliminates pickle.load entirely for warm calls.\n    gitnexus_hash is a cache-busting int derived from gitnexus content.\n    \"\"\"\n    # Initialize cache\n    init_cache(agi_dir)\n\n    # Build from sources\n    builder = GraphBuilder()\n\n    # Parse AGENTS.md\n    agents_md = os.path.join(hermes_dir, \"belam-codex\", \"AGENTS.md\")\n    builder.parse_agents_md(agents_md)\n\n    # Parse memory files (expanded to all 58)\n    memory_dir = os.path.join(hermes_dir, \"belam-codex\", \"memory\")\n    builder.parse_memory_files(memory_dir, limit=58)\n\n    # Parse schema files\n    schema_dir = os.path.join(hermes_dir, \"belam-codex\", \"schemas\")\n    builder.parse_schema_files(schema_dir)\n\n    # Parse decisions (all 128 files)\n    decisions_dir = os.path.join(hermes_dir, \"belam-codex\", \"decisions\")\n    if os.path.isdir(decisions_dir):\n        builder.parse_decisions(decisions_dir, limit=999)\n\n    # Parse lessons (all 208 files)\n    lessons_dir = os.path.join(hermes_dir, \"belam-codex\", \"lessons\")\n    if os.path.isdir(lessons_dir):\n        builder.parse_lessons(lessons_dir, limit=999)"}]}}],"api":"anthropic-messages","provider":"minimax","model":"MiniMax-M2.7","usage":{"input":30023,"output":850,"cacheRead":10071,"cacheWrite":0,"totalTokens":40944,"cost":{"input":0.0090069,"output":0.0010199999999999999,"cacheRead":0.0006042599999999999,"cacheWrite":0,"total":0.01063116}},"stopReason":"toolUse","timestamp":1777535472080,"responseId":"06423cf046707df114188c840863a27e"}}
{"type":"message","id":"3dc9d91a","parentId":"9743aacd","timestamp":"2026-04-30T07:51:23.619Z","message":{"role":"toolResult","toolCallId":"call_function_17sbuihp3pjg_1","toolName":"edit","content":[{"type":"text","text":"Successfully replaced 1 block(s) in /home/ubuntu/.hermes/agi/graph_builder.py."}],"details":{"diff":"     ...\n 813     # Parse schema files\n 814     schema_dir = os.path.join(hermes_dir, \"belam-codex\", \"schemas\")\n 815     builder.parse_schema_files(schema_dir)\n 816 \n-817     # Parse decisions (expanded to 100)\n+817     # Parse decisions (all 128 files)\n 818     decisions_dir = os.path.join(hermes_dir, \"belam-codex\", \"decisions\")\n 819     if os.path.isdir(decisions_dir):\n-820         builder.parse_decisions(decisions_dir, limit=100)\n+820         builder.parse_decisions(decisions_dir, limit=999)\n 821 \n-822     # Parse lessons (expanded to 100)\n+822     # Parse lessons (all 208 files)\n 823     lessons_dir = os.path.join(hermes_dir, \"belam-codex\", \"lessons\")\n 824     if os.path.isdir(lessons_dir):\n-825         builder.parse_lessons(lessons_dir, limit=100)\n+825         builder.parse_lessons(lessons_dir, limit=999)\n 826 \n 827     # Parse tasks (expanded to all 84)\n 828     tasks_dir = os.path.join(hermes_dir, \"belam-codex\", \"tasks\")\n 829     if os.path.isdir(tasks_dir):\n     ...","firstChangedLine":817},"isError":false,"timestamp":1777535483619}}
{"type":"message","id":"b6fe68d8","parentId":"3dc9d91a","timestamp":"2026-04-30T07:51:31.756Z","message":{"role":"assistant","content":[{"type":"thinking","thinking":"Now I need to update the cold build path too, which has the same content.","thinkingSignature":"c3fc60fd6bb420c9a39432ed192c74b724c5cf6b830bce9b6651d0e02c7c0ab5"},{"type":"text","text":"Now update the cold build fallback path too:\n"},{"type":"toolCall","id":"call_function_tkflps4mu96x_1","name":"edit","arguments":{"path":"/home/ubuntu/.hermes/agi/graph_builder.py","edits":[{"oldText":"    # Parse decisions (expanded to 100)\n    decisions_dir = os.path.join(hermes_dir, \"belam-codex\", \"decisions\")\n    if os.path.isdir(decisions_dir):\n        builder.parse_decisions(decisions_dir, limit=100)\n\n    # Parse lessons (expanded to 100)\n    lessons_dir = os.path.join(hermes_dir, \"belam-codex\", \"lessons\")\n    if os.path.isdir(lessons_dir):\n        builder.parse_lessons(lessons_dir, limit=100)\n\n    # Parse tasks (expanded to all 84)\n    tasks_dir = os.path.join(hermes_dir, \"belam-codex\", \"tasks\")\n    if os.path.isdir(tasks_dir):\n        builder.parse_tasks(tasks_dir, limit=100)","newText":"    # Parse decisions (all 128 files)\n    decisions_dir = os.path.join(hermes_dir, \"belam-codex\", \"decisions\")\n    if os.path.isdir(decisions_dir):\n        builder.parse_decisions(decisions_dir, limit=999)\n\n    # Parse lessons (all 208 files)\n    lessons_dir = os.path.join(hermes_dir, \"belam-codex\", \"lessons\")\n    if os.path.isdir(lessons_dir):\n        builder.parse_lessons(lessons_dir, limit=999)\n\n    # Parse tasks (expanded to all 84)\n    tasks_dir = os.path.join(hermes_dir, \"belam-codex\", \"tasks\")\n    if os.path.isdir(tasks_dir):\n        builder.parse_tasks(tasks_dir, limit=999)"}]}}],"api":"anthropic-messages","provider":"minimax","model":"MiniMax-M2.7","usage":{"input":30909,"output":460,"cacheRead":10071,"cacheWrite":0,"totalTokens":41440,"cost":{"input":0.0092727,"output":0.000552,"cacheRead":0.0006042599999999999,"cacheWrite":0,"total":0.010428960000000001}},"stopReason":"toolUse","timestamp":1777535483620,"responseId":"06423cfc124d2cddeded3acb9f56446c"}}
{"type":"message","id":"5771e51a","parentId":"b6fe68d8","timestamp":"2026-04-30T07:51:31.763Z","message":{"role":"toolResult","toolCallId":"call_function_tkflps4mu96x_1","toolName":"edit","content":[{"type":"text","text":"Successfully replaced 1 block(s) in /home/ubuntu/.hermes/agi/graph_builder.py."}],"details":{"diff":"     ...\n 917     # Parse schema files\n 918     schema_dir = os.path.join(hermes_dir, \"belam-codex\", \"schemas\")\n 919     builder.parse_schema_files(schema_dir)\n 920 \n-921     # Parse decisions (expanded to 100)\n+921     # Parse decisions (all 128 files)\n 922     decisions_dir = os.path.join(hermes_dir, \"belam-codex\", \"decisions\")\n 923     if os.path.isdir(decisions_dir):\n-924         builder.parse_decisions(decisions_dir, limit=100)\n+924         builder.parse_decisions(decisions_dir, limit=999)\n 925 \n-926     # Parse lessons (expanded to 100)\n+926     # Parse lessons (all 208 files)\n 927     lessons_dir = os.path.join(hermes_dir, \"belam-codex\", \"lessons\")\n 928     if os.path.isdir(lessons_dir):\n-929         builder.parse_lessons(lessons_dir, limit=100)\n+929         builder.parse_lessons(lessons_dir, limit=999)\n 930 \n 931     # Parse tasks (expanded to all 84)\n 932     tasks_dir = os.path.join(hermes_dir, \"belam-codex\", \"tasks\")\n 933     if os.path.isdir(tasks_dir):\n-934         builder.parse_tasks(tasks_dir, limit=100)\n+934         builder.parse_tasks(tasks_dir, limit=999)\n 935 \n 936     # Parse goals (goal nodes with status/priority/urgency)\n 937     goals_dir = os.path.join(hermes_dir, \"belam-codex\", \"goals\")\n 938     if os.path.isdir(goals_dir):\n     ...","firstChangedLine":921},"isError":false,"timestamp":1777535491763}}
