{"type":"message","id":"82bfeee5","parentId":"fe5feb03","timestamp":"2026-04-30T07:59:07.354Z","message":{"role":"assistant","content":[{"type":"thinking","thinking":"Let me read the current state. The last run was iteration 30 with 0.03ms at 828 nodes. The primary metric is at noise floor (~0.03ms). The ideas.md mentions remaining data sources to parse:\n- knowledge/ directory (15 files)\n- handoff/ directory (9 files) \n- archive/ directory (5 files)\n- canvas mapper_batch files\n\nLet me check what's in these directories and see if there's a quick win.","thinkingSignature":"34b9181e22d0d137c6554bfa36e2f4b4f0f405db33c106bdad62e63473e28cbf"},{"type":"toolCall","id":"call_function_79ffc7820aqd_1","name":"bash","arguments":{"command":"ls -la /home/ubuntu/.hermes/agi/ && echo \"---\" && ls -la /home/ubuntu/.hermes/agi/knowledge/ 2>/dev/null | head -20 && echo \"---\" && ls -la /home/ubuntu/.hermes/agi/handoff/ 2>/dev/null | head -20 && echo \"---\" && ls -la /home/ubuntu/.hermes/agi/archive/ 2>/dev/null | head -20"}},{"type":"toolCall","id":"call_function_79ffc7820aqd_2","name":"read","arguments":{"path":"/home/ubuntu/.hermes/agi/autoresearch.sh"}}],"api":"anthropic-messages","provider":"minimax","model":"MiniMax-M2.7","usage":{"input":10091,"output":253,"cacheRead":10071,"cacheWrite":0,"totalTokens":20415,"cost":{"input":0.0030272999999999997,"output":0.0003036,"cacheRead":0.0006042599999999999,"cacheWrite":0,"total":0.003935159999999999}},"stopReason":"toolUse","timestamp":1777535938702,"responseId":"06423ec34f6f74a18888306b2a79b86c"}}
{"type":"message","id":"e5d7c3e0","parentId":"82bfeee5","timestamp":"2026-04-30T07:59:07.375Z","message":{"role":"toolResult","toolCallId":"call_function_79ffc7820aqd_1","toolName":"bash","content":[{"type":"text","text":"total 352\ndrwxrwxr-x  6 ubuntu ubuntu   4096 Apr 30 07:55 .\ndrwx------ 22 ubuntu ubuntu   4096 Apr 30 07:57 ..\ndrwxrwxr-x  8 ubuntu ubuntu   4096 Apr 30 07:56 .git\n-rw-rw-r--  1 ubuntu ubuntu   4654 Apr 30 07:51 .gitnexus_cache.json\n-rw-rw-r--  1 ubuntu ubuntu 161755 Apr 30 07:55 .graph_cache.pkl\ndrwxrwxr-x  2 ubuntu ubuntu   4096 Apr 30 07:55 __pycache__\n-rwxrwxr-x  1 ubuntu ubuntu   9728 Apr 30 07:41 _benchmark.py\n-rw-rw-r--  1 ubuntu ubuntu   8745 Apr 30 06:39 asciirender.py\n-rw-rw-r--  1 ubuntu ubuntu     26 Apr 30 05:54 autoresearch.config.json\n-rw-rw-r--  1 ubuntu ubuntu   4024 Apr 30 07:57 autoresearch.ideas.md\n-rw-rw-r--  1 ubuntu ubuntu  28096 Apr 30 07:56 autoresearch.jsonl\n-rw-rw-r--  1 ubuntu ubuntu   5103 Apr 30 07:33 autoresearch.md\n-rwxrwxr-x  1 ubuntu ubuntu    897 Apr 30 05:56 autoresearch.sh\ndrwxrwxr-x 68 ubuntu ubuntu   4096 Apr 30 07:55 experiments\n-rw-rw-r--  1 ubuntu ubuntu  43347 Apr 30 07:58 graph_builder.py\n-rw-rw-r--  1 ubuntu ubuntu   4233 Apr 30 07:58 loop.log\n-rw-rw-r--  1 ubuntu ubuntu    587 Apr 30 06:11 pi-agi.log\n-rw-rw-r--  1 ubuntu ubuntu   7368 Apr 30 06:15 pi_tree_adapter.py\n-rw-rw-r--  1 ubuntu ubuntu   7226 Apr 30 06:37 query_engine.py\n-rwxrwxr-x  1 ubuntu ubuntu   1985 Apr 30 06:24 run-loop.sh\n-rw-rw-r--  1 ubuntu ubuntu   2695 Apr 30 06:12 schema.sql\ndrwxrwxr-x  2 ubuntu ubuntu   4096 Apr 30 07:58 sessions\n-rwxrwxr-x  1 ubuntu ubuntu    823 Apr 30 06:02 start.sh\n---\n---\n---\n"}],"isError":false,"timestamp":1777535947375}}
{"type":"message","id":"386d8145","parentId":"e5d7c3e0","timestamp":"2026-04-30T07:59:07.375Z","message":{"role":"toolResult","toolCallId":"call_function_79ffc7820aqd_2","toolName":"read","content":[{"type":"text","text":"#!/bin/bash\n# Autoresearch benchmark driver for DB-augmented graph code generation\n# Measures: graph build time, node/edge counts, query time, ASCII render size\n\nset -euo pipefail\n\nAGI_DIR=\"$(cd \"$(dirname \"$0\")\" && pwd)\"\nEXPERIMENT_DIR=\"$AGI_DIR/experiments/$(date +%Y%m%d_%H%M%S)\"\nmkdir -p \"$EXPERIMENT_DIR\"\n\n# --- Metric Definitions ---\n# Primary: graph_build_time_ms (lower is better)\n# Secondary: graph_node_count, graph_edge_count, query_time_ms, ascii_render_lines\n\n# If dependencies not installed, use stub metrics\nMETRIC_cmd=\"python3 $AGI_DIR/_benchmark.py 2>/dev/null || echo 'METRIC graph_build_time_ms=0'\"\n\n# Run benchmark and capture output\nOUTPUT=$($METRIC_cmd)\n\n# Echo raw output for visibility\necho \"$OUTPUT\"\n\n# Ensure we always output at least the primary metric\nif ! echo \"$OUTPUT\" | grep -q \"METRIC graph_build_time_ms=\"; then\n    echo \"METRIC graph_build_time_ms=0\"\nfi\n\nexit 0\n"}],"isError":false,"timestamp":1777535947375}}
{"type":"message","id":"d11cf166","parentId":"386d8145","timestamp":"2026-04-30T07:59:11.622Z","message":{"role":"assistant","content":[{"type":"thinking","thinking":"The knowledge/, handoff/, archive/ directories don't exist. Let me check what's available in the belam-codex repo mentioned in the ideas.\n\nLet me also look at the current graph_builder.py to see what's already being parsed and what might be a quick improvement.","thinkingSignature":"35689c6c4261412f12e8c49c9d45c660d0f0e838ad45983ebb8c30238ee6ab5c"},{"type":"toolCall","id":"call_function_2jyam3mr4vmy_1","name":"bash","arguments":{"command":"ls /home/ubuntu/.hermes/agi/sessions/ | head -10 && echo \"---\" && ls /home/ubuntu/.hermes/agi/experiments/ | tail -5"}},{"type":"toolCall","id":"call_function_2jyam3mr4vmy_2","name":"read","arguments":{"path":"/home/ubuntu/.hermes/agi/graph_builder.py","limit":100}}],"api":"anthropic-messages","provider":"minimax","model":"MiniMax-M2.7","usage":{"input":11182,"output":159,"cacheRead":10071,"cacheWrite":0,"totalTokens":21412,"cost":{"input":0.0033545999999999997,"output":0.0001908,"cacheRead":0.0006042599999999999,"cacheWrite":0,"total":0.0041496599999999995}},"stopReason":"toolUse","timestamp":1777535947376,"responseId":"06423ecb89ff59b8fd14788691863456"}}
{"type":"message","id":"92ba9b78","parentId":"d11cf166","timestamp":"2026-04-30T07:59:11.634Z","message":{"role":"toolResult","toolCallId":"call_function_2jyam3mr4vmy_1","toolName":"bash","content":[{"type":"text","text":"2026-04-30T06-24-27-474Z_019ddd0f-6751-75bc-a374-6c0fe036e262.jsonl\n2026-04-30T06-28-50-488Z_019ddd13-6ab7-719c-a89c-ee16d5cd9699.jsonl\n2026-04-30T06-34-54-521Z_019ddd18-f8b8-77db-accd-54a3f0429914.jsonl\n2026-04-30T06-43-59-532Z_019ddd21-49ac-7242-a477-d8ed68a68595.jsonl\n2026-04-30T06-49-28-797Z_019ddd26-4fdc-74ea-800f-ea304ca573c2.jsonl\n2026-04-30T06-58-33-848Z_019ddd2e-a0f8-719b-880a-d4195125da4f.jsonl\n2026-04-30T07-07-38-888Z_019ddd36-f207-727a-a724-ee6f7d7c64d2.jsonl\n2026-04-30T07-14-57-886Z_019ddd3d-a4de-771f-89f5-d5f8cca8e332.jsonl\n2026-04-30T07-20-31-138Z_019ddd42-baa2-731c-b9f2-6faf0f5d1c50.jsonl\n2026-04-30T07-26-50-252Z_019ddd48-838c-7349-ac79-f88e03a125bc.jsonl\n---\n20260430_075224\n20260430_075225\n20260430_075233\n20260430_075554\n20260430_075558\n"}],"isError":false,"timestamp":1777535951634}}
{"type":"message","id":"82b74fc8","parentId":"92ba9b78","timestamp":"2026-04-30T07:59:11.634Z","message":{"role":"toolResult","toolCallId":"call_function_2jyam3mr4vmy_2","toolName":"read","content":[{"type":"text","text":"#!/usr/bin/env python3\n\"\"\"\ngraph_builder.py - Modular graph construction for unified graph memory\nDB-augmented directed code generation via unified graph memory\n\"\"\"\n\nimport os\nimport re\nimport json\nimport time\nfrom functools import lru_cache\nfrom typing import List, Dict, Any, Optional, Tuple\nfrom collections import defaultdict\n\n# Pre-compiled regex patterns\n_RE_SECTION_SPLIT = re.compile(r'\\n(?=#)')\n_RE_CODE_BLOCK = re.compile(r'`([^`]+)`')\n_RE_FRONT_MATTER = re.compile(r'^---\\n(.*?)\\n---', re.DOTALL)\n_RE_YAML_PAIR = re.compile(r'^(\\w+):\\s*(.*)$')\n\n# Cache for gitnexus output\n_GITNEXUS_CACHE_FILE = None\n_gitnexus_cache = None\n\ndef init_cache(cache_dir: str):\n    \"\"\"Initialize cache file path.\"\"\"\n    global _GITNEXUS_CACHE_FILE, _gitnexus_cache\n    _GITNEXUS_CACHE_FILE = os.path.join(cache_dir, \".gitnexus_cache.json\")\n    if os.path.exists(_GITNEXUS_CACHE_FILE):\n        try:\n            mtime = os.path.getmtime(_GITNEXUS_CACHE_FILE)\n            age_hours = (time.time() - mtime) / 3600\n            if age_hours < 24:\n                with open(_GITNEXUS_CACHE_FILE) as f:\n                    _gitnexus_cache = f.read()\n        except Exception:\n            pass\n\ndef _save_cache(data: str):\n    \"\"\"Save gitnexus result to cache.\"\"\"\n    global _GITNEXUS_CACHE_FILE, _gitnexus_cache\n    _gitnexus_cache = data\n    if _GITNEXUS_CACHE_FILE:\n        try:\n            with open(_GITNEXUS_CACHE_FILE, 'w') as f:\n                f.write(data)\n        except Exception:\n            pass\n\nclass GraphBuilder:\n    \"\"\"Builds a unified graph from multiple source materials.\"\"\"\n    __slots__ = ('nodes', 'edges', 'adj', '_node_ids', '_section_stack')\n\n    def __init__(self):\n        self.nodes: List[Dict[str, Any]] = []\n        self.edges: List[Dict[str, str]] = []\n        self.adj: Dict[str, List[str]] = defaultdict(list)\n        self._node_ids: set = set()\n        self._section_stack: List[int] = []\n\n    def add_node(self, node_type: str, label: str, content: str = \"\",\n                 source: str = \"\", node_id: Optional[str] = None) -> str:\n        \"\"\"Add a node to the graph as a compact tuple (id, type, label, content, source).\"\"\"\n        if node_id is None:\n            node_id = f\"{node_type}_{len(self.nodes)}\"\n\n        # Ensure unique ID\n        base_id = node_id\n        counter = 0\n        while node_id in self._node_ids:\n            counter += 1\n            node_id = f\"{base_id}_{counter}\"\n\n        self._node_ids.add(node_id)\n        # Store as tuple: smaller pickle, faster load than dict\n        self.nodes.append((node_id, node_type, label[:60], content[:120] if content else \"\", source))\n        return node_id\n\n    def add_edge(self, from_id: str, to_id: str, edge_type: str = \"references\"):\n        \"\"\"Add an edge between nodes.\"\"\"\n        if from_id in self._node_ids and to_id in self._node_ids:\n            self.edges.append({\"from\": from_id, \"to\": to_id, \"type\": edge_type})\n            self.adj[from_id].append(to_id)\n            self.adj[to_id].append(from_id)  # Bidirectional for traversal\n\n    def parse_agents_md(self, filepath: str) -> int:\n        \"\"\"Parse AGENTS.md into graph nodes.\"\"\"\n        if not os.path.exists(filepath):\n            return 0\n\n        with open(filepath, \"r\") as f:\n            content = f.read()\n\n        sections = _RE_SECTION_SPLIT.split(content)\n        last_section_idx = -1\n\n        for i, section in enumerate(sections):\n            lines = section.strip().split('\\n')\n            if not lines:\n                continue\n\n[1043 more lines in file. Use offset=101 to continue.]"}],"isError":false,"timestamp":1777535951634}}
{"type":"message","id":"ba6dbf50","parentId":"82b74fc8","timestamp":"2026-04-30T07:59:17.796Z","message":{"role":"assistant","content":[{"type":"thinking","thinking":"The sessions/ directory contains jsonl files. Let me look at more of the graph_builder to understand what's being parsed and what the remaining opportunities are.","thinkingSignature":"90dc54d4b16998bf17d10e978484208b5febba8bb9a2bcd3a39731b5477ec541"},{"type":"toolCall","id":"call_function_554jsapksrxl_1","name":"read","arguments":{"path":"/home/ubuntu/.hermes/agi/graph_builder.py","offset":100,"limit":150}},{"type":"toolCall","id":"call_function_554jsapksrxl_2","name":"bash","arguments":{"command":"wc -l /home/ubuntu/.hermes/agi/sessions/*.jsonl | tail -5 && head -50 /home/ubuntu/.hermes/agi/sessions/*.jsonl 2>/dev/null | head -100"}}],"api":"anthropic-messages","provider":"minimax","model":"MiniMax-M2.7","usage":{"input":12705,"output":153,"cacheRead":10071,"cacheWrite":0,"totalTokens":22929,"cost":{"input":0.0038115,"output":0.0001836,"cacheRead":0.0006042599999999999,"cacheWrite":0,"total":0.004599359999999999}},"stopReason":"toolUse","timestamp":1777535951635,"responseId":"06423ecfa749075a978a9615dc13cea8"}}
{"type":"message","id":"956db14e","parentId":"ba6dbf50","timestamp":"2026-04-30T07:59:17.806Z","message":{"role":"toolResult","toolCallId":"call_function_554jsapksrxl_1","toolName":"read","content":[{"type":"text","text":"                continue\n\n            header = lines[0].strip('#').strip()\n            body = '\\n'.join(lines[1:]).strip()[:120]\n\n            section_id = self.add_node(\n                \"doc_section\", header, body, \"AGENTS.md\",\n                f\"agents_section_{i}\"\n            )\n\n            if last_section_idx >= 0:\n                self.add_edge(\n                    f\"agents_section_{last_section_idx}\",\n                    section_id,\n                    \"sequential\"\n                )\n            last_section_idx = i\n\n            # Parse code references within section\n            for match in _RE_CODE_BLOCK.finditer(section):\n                code = match.group(1)\n                if len(code) > 3 and ' ' in code:\n                    ref_id = self.add_node(\n                        \"code_reference\", code[:60], code, \"AGENTS.md\",\n                        f\"code_ref_{match.start()}\"\n                    )\n                    self.add_edge(section_id, ref_id, \"contains\")\n\n        return i + 1\n\n    def parse_memory_files(self, memory_dir: str, limit: int = 10) -> int:\n        \"\"\"Parse memory files into graph nodes.\"\"\"\n        if not os.path.isdir(memory_dir):\n            return 0\n\n        memory_files = sorted(\n            [f for f in os.listdir(memory_dir) if f.endswith('.md')],\n            reverse=True\n        )[:limit]\n\n        count = 0\n        for filename in memory_files:\n            filepath = os.path.join(memory_dir, filename)\n            try:\n                with open(filepath, \"r\") as f:\n                    content = f.read()\n\n                # Extract session header\n                header_match = re.search(r'# Session: (.+)', content)\n                session_label = header_match.group(1) if header_match else filename[:-3]\n\n                # Extract conversation summary (first few paragraphs)\n                summary_match = re.search(r'## Conversation Summary\\s*\\n+(.+?)(?:\\n##|\\Z)', content, re.DOTALL)\n                summary = summary_match.group(1).strip()[:120] if summary_match else \"\"\n\n                session_id = self.add_node(\n                    \"memory_session\",\n                    session_label[:60],\n                    summary,\n                    f\"memory/{filename}\",\n                    f\"memory_{filename[:19]}\"  # Use date prefix as ID\n                )\n                count += 1\n\n                # Link to agents sections (approximate linking based on content)\n                if \"agent:main\" in content or \"model:\" in content:\n                    self.add_edge(session_id, \"agents_section_0\", \"references\")\n\n            except Exception:\n                pass\n\n        return count\n\n    def parse_schema_files(self, schema_dir: str) -> int:\n        \"\"\"Parse schema files into graph nodes. Creates entity + field nodes.\"\"\"\n        if not os.path.isdir(schema_dir):\n            return 0\n\n        count = 0\n        for filename in os.listdir(schema_dir):\n            if not filename.endswith(('.md', '.yaml', '.yml')):\n                continue\n\n            filepath = os.path.join(schema_dir, filename)\n            try:\n                with open(filepath, \"r\") as f:\n                    content = f.read()\n\n                # Extract primitive name\n                name_match = re.search(r'^primitive:\\s*(\\w+)', content, re.MULTILINE)\n                if name_match:\n                    schema_name = name_match.group(1)\n                    \n                    # Create entity node with field count summary\n                    field_nodes = []\n                    for field_match in re.finditer(r'^\\s+(\\w+):\\s*(\\w+)', content, re.MULTILINE):\n                        field_nodes.append((field_match.group(1), field_match.group(2)))\n                    \n                    field_count = len(field_nodes)\n                    entity_id = self.add_node(\n                        \"schema_entity\",\n                        schema_name,\n                        f\"{field_count} fields\",\n                        f\"schemas/{filename}\",\n                        f\"schema_{schema_name}\"\n                    )\n                    count += 1\n                    \n                    # Create field nodes (restores ~142 nodes for richer graph)\n                    for fname, ftype in field_nodes:\n                        field_id = self.add_node(\n                            \"schema_field\",\n                            f\"{schema_name}.{fname}\",\n                            ftype,\n                            f\"schemas/{filename}\",\n                            f\"field_{schema_name}_{fname}\"\n                        )\n                        self.add_edge(entity_id, field_id, \"has_field\")\n                        count += 1\n\n            except Exception:\n                pass\n\n        return count\n\n    def process_gitnexus_cache(self, cache_data: Optional[str]) -> int:\n        \"\"\"Process cached gitnexus data into graph nodes.\"\"\"\n        if not cache_data or not cache_data.strip():\n            return 0\n\n        try:\n            result = json.loads(cache_data)\n            count = 0\n\n            for category in ['definitions', 'process_symbols', 'processes']:\n                items = result.get(category, [])\n                for item in items[:30]:\n                    node_type = f\"gitnexus_{category.rstrip('s')}\"\n                    sym_id = self.add_node(\n                        node_type,\n                        item.get('name', item.get('id', ''))[:60],\n                        f\"{item.get('filePath', '')}:{item.get('startLine', '')}\",\n                        \"gitnexus_index\",\n                        f\"gitnexus_{category}_{item.get('id', str(hash(str(item))))}\"[:60]\n                    )\n                    count += 1\n\n                    # Link definitions to their source files\n                    if category == 'definitions' and 'filePath' in item:\n                        # Could link to schema nodes if matching\n\n[894 more lines in file. Use offset=250 to continue.]"}],"isError":false,"timestamp":1777535957806}}
