{"type":"message","id":"a2e04570","parentId":"51c83f19","timestamp":"2026-04-30T08:59:59.627Z","message":{"role":"assistant","content":[{"type":"thinking","thinking":"There's an error. Let me see what it is.","thinkingSignature":"20573c5a32087f23fd86c31a899e00f47caf75314e25dbbc622b65e1c0dde4e8"},{"type":"toolCall","id":"call_function_law4xi7w52k9_1","name":"bash","arguments":{"command":"cd /home/ubuntu/.hermes/agi && python3 -c \"\nimport time, os, sys, traceback\nsys.path.insert(0, '.')\nfrom graph_builder import build_graph, _cached_build_builder, _get_graph_cache_file\n\nhermes = os.path.expanduser('~/.hermes')\nagi = '/home/ubuntu/.hermes/agi'\n\n_cached_build_builder.cache_clear()\ncache_file = _get_graph_cache_file(agi)\nif os.path.exists(cache_file):\n    os.remove(cache_file)\n\ntry:\n    b1, t1 = build_graph(hermes, agi)\n    print(f'OK: {t1:.3f}ms, nodes={len(b1.nodes)}')\nexcept Exception as e:\n    traceback.print_exc()\n\" 2>&1"}}],"api":"anthropic-messages","provider":"minimax","model":"MiniMax-M2.7","usage":{"input":26791,"output":201,"cacheRead":10071,"cacheWrite":0,"totalTokens":37063,"cost":{"input":0.008037299999999999,"output":0.00024119999999999998,"cacheRead":0.0006042599999999999,"cacheWrite":0,"total":0.00888276}},"stopReason":"toolUse","timestamp":1777539594866,"responseId":"06424d0b616a3f5a6e6c04454d125baf"}}
{"type":"message","id":"51d5216f","parentId":"a2e04570","timestamp":"2026-04-30T08:59:59.922Z","message":{"role":"toolResult","toolCallId":"call_function_law4xi7w52k9_1","toolName":"bash","content":[{"type":"text","text":"Traceback (most recent call last):\n  File \"<string>\", line 15, in <module>\n  File \"/home/ubuntu/.hermes/agi/graph_builder.py\", line 2503, in build_graph\n    builder.build_adjacency()\n  File \"/home/ubuntu/.hermes/agi/graph_builder.py\", line 2057, in build_adjacency\n    self._precompute_reachability(hub_count=32)\n  File \"/home/ubuntu/.hermes/agi/graph_builder.py\", line 2088, in _precompute_reachability\n    self.hub_reachable: Dict[str, frozenset] = {}\n    ^^^^^^^^^^^^^^^^^^\nAttributeError: 'GraphBuilder' object has no attribute 'hub_reachable'\n"}],"isError":false,"timestamp":1777539599922}}
{"type":"message","id":"b9f983c8","parentId":"51d5216f","timestamp":"2026-04-30T09:00:05.166Z","message":{"role":"assistant","content":[{"type":"thinking","thinking":"The issue is that `self.hub_reachable: Dict[str, frozenset] = {}` is an annotated assignment, but the attribute hasn't been initialized yet. In Python, you can't use type annotations with attribute assignment on an uninitialized attribute. I need to use a different syntax.\n\nLet me fix this. Instead of using the type annotation in the assignment, I'll use a simple assignment.","thinkingSignature":"88967057b7808cf2fd1caffb2c6a722d7f1056f3380c5efbe6ced712881af691"},{"type":"text","text":"Fix the annotation issue:\n"},{"type":"toolCall","id":"call_function_jcu0kgszy606_1","name":"edit","arguments":{"path":"/home/ubuntu/.hermes/agi/graph_builder.py","edits":[{"oldText":"        self.hub_reachable: Dict[str, frozenset] = {}","newText":"        self.hub_reachable: Dict[str, frozenset] = {}  # type: ignore[assignment]"}]}}],"api":"anthropic-messages","provider":"minimax","model":"MiniMax-M2.7","usage":{"input":27161,"output":183,"cacheRead":10071,"cacheWrite":0,"totalTokens":37415,"cost":{"input":0.008148299999999999,"output":0.0002196,"cacheRead":0.0006042599999999999,"cacheWrite":0,"total":0.00897216}},"stopReason":"toolUse","timestamp":1777539599923,"responseId":"06424d10bd2e2d0276a95db28acfb988"}}
{"type":"message","id":"0b839f24","parentId":"b9f983c8","timestamp":"2026-04-30T09:00:05.174Z","message":{"role":"toolResult","toolCallId":"call_function_jcu0kgszy606_1","toolName":"edit","content":[{"type":"text","text":"Successfully replaced 1 block(s) in /home/ubuntu/.hermes/agi/graph_builder.py."}],"details":{"diff":"      ...\n 2084         for node_id in self._node_ids:\n 2085             degree[node_id] = len(self.adj.get(node_id, []))\n 2086         hubs = sorted(degree.keys(), key=lambda x: -degree[x])[:hub_count]\n 2087 \n-2088         self.hub_reachable: Dict[str, frozenset] = {}\n+2088         self.hub_reachable: Dict[str, frozenset] = {}  # type: ignore[assignment]\n 2089         for hub in hubs:\n 2090             reachable = self._bfs_reachable(hub)\n 2091             self.hub_reachable[hub] = frozenset(reachable)\n 2092 \n      ...","firstChangedLine":2088},"isError":false,"timestamp":1777539605174}}
{"type":"message","id":"445cb8e9","parentId":"0b839f24","timestamp":"2026-04-30T09:00:14.876Z","message":{"role":"assistant","content":[{"type":"thinking","thinking":"Wait, the issue isn't the type annotation syntax, it's that I'm trying to use an annotation with assignment but the attribute doesn't exist yet. In Python, `self.hub_reachable: Dict[str, frozenset] = {}` should work fine. The issue might be that `hub_reachable` is annotated inside a method but the class doesn't have the annotation at class level.\n\nActually, I think the issue is that Python evaluates `self.hub_reachable: Dict[str, frozenset] = {}` as an annotated assignment, and Python 3.x should support this. But the error says `AttributeError: 'GraphBuilder' object has no attribute 'hub_reachable'`.\n \nLooking at the error more carefully, the real problem is that Python 3.6+ evaluates the annotation before the assignment, so when it tries to access `hub_reachable` on `self` to store the value, the attribute doesn't exist yet. I'm realizing the issue might be a Python version compatibility problem with how annotations are evaluated. The cleanest approach is to skip the type hint entirely and just use a regular assignment, which should resolve the `AttributeError` I'm seeing.","thinkingSignature":"de0ea809d4e9d43bd38dce74dfb896ca9b04f78b9cb77cd338716986bcd3f9c8"},{"type":"toolCall","id":"call_function_b4fvr5cfx464_1","name":"edit","arguments":{"path":"/home/ubuntu/.hermes/agi/graph_builder.py","edits":[{"oldText":"        self.hub_reachable: Dict[str, frozenset] = {}  # type: ignore[assignment]","newText":"        self.hub_reachable = {}"}]}}],"api":"anthropic-messages","provider":"minimax","model":"MiniMax-M2.7","usage":{"input":27380,"output":328,"cacheRead":10071,"cacheWrite":0,"totalTokens":37779,"cost":{"input":0.008213999999999999,"output":0.00039359999999999997,"cacheRead":0.0006042599999999999,"cacheWrite":0,"total":0.009211859999999999}},"stopReason":"toolUse","timestamp":1777539605175,"responseId":"06424d1519d8af5e32144dc9178e3344"}}
{"type":"message","id":"0ed360df","parentId":"445cb8e9","timestamp":"2026-04-30T09:00:14.884Z","message":{"role":"toolResult","toolCallId":"call_function_b4fvr5cfx464_1","toolName":"edit","content":[{"type":"text","text":"Successfully replaced 1 block(s) in /home/ubuntu/.hermes/agi/graph_builder.py."}],"details":{"diff":"      ...\n 2084         for node_id in self._node_ids:\n 2085             degree[node_id] = len(self.adj.get(node_id, []))\n 2086         hubs = sorted(degree.keys(), key=lambda x: -degree[x])[:hub_count]\n 2087 \n-2088         self.hub_reachable: Dict[str, frozenset] = {}  # type: ignore[assignment]\n+2088         self.hub_reachable = {}\n 2089         for hub in hubs:\n 2090             reachable = self._bfs_reachable(hub)\n 2091             self.hub_reachable[hub] = frozenset(reachable)\n 2092 \n      ...","firstChangedLine":2088},"isError":false,"timestamp":1777539614884}}
{"type":"message","id":"f044436e","parentId":"0ed360df","timestamp":"2026-04-30T09:00:20.793Z","message":{"role":"assistant","content":[{"type":"thinking","thinking":"Wait, I realize the issue. In the original code, `self.hub_reachable` was set in `_precompute_reachability`. The error was that `self` doesn't have the attribute `hub_reachable` because the class doesn't define it at the class level. But Python allows setting arbitrary attributes on instances, so this should work...\n\nUnless there's a `__slots__` on the class! Let me check.","thinkingSignature":"694670e57cc2e885efa404d1d5a480ad393f6e942037489d2c7c04f3d87789a5"},{"type":"toolCall","id":"call_function_ifq8adxfwfqc_1","name":"bash","arguments":{"command":"grep -n \"__slots__\" /home/ubuntu/.hermes/agi/graph_builder.py | head -5"}}],"api":"anthropic-messages","provider":"minimax","model":"MiniMax-M2.7","usage":{"input":27744,"output":134,"cacheRead":10071,"cacheWrite":0,"totalTokens":37949,"cost":{"input":0.0083232,"output":0.0001608,"cacheRead":0.0006042599999999999,"cacheWrite":0,"total":0.009088259999999999}},"stopReason":"toolUse","timestamp":1777539614886,"responseId":"06424d1fb5b53a86de5f938fa1205c30"}}
{"type":"message","id":"635618dd","parentId":"f044436e","timestamp":"2026-04-30T09:00:20.802Z","message":{"role":"toolResult","toolCallId":"call_function_ifq8adxfwfqc_1","toolName":"bash","content":[{"type":"text","text":"52:    __slots__ = ('nodes', 'edges', 'adj', '_node_ids', '_section_stack', '_precomputed_paths')\n"}],"isError":false,"timestamp":1777539620802}}
{"type":"message","id":"70ae8de9","parentId":"635618dd","timestamp":"2026-04-30T09:00:25.674Z","message":{"role":"assistant","content":[{"type":"thinking","thinking":"There's a `__slots__` definition! That means I can only add attributes that are listed in `__slots__`. I need to add `hub_reachable` to the `__slots__` list.\n\nLet me read the __slots__ definition and add `hub_reachable` to it.","thinkingSignature":"044f88e7b633283a15550afbfb9bfcaaf7bede0e5e6efb8f22dc26e856a7f9d9"},{"type":"text","text":"`__slots__` restricts attributes! Need to add `hub_reachable`:\n"},{"type":"toolCall","id":"call_function_4vgbwkqblnrk_1","name":"read","arguments":{"path":"/home/ubuntu/.hermes/agi/graph_builder.py","offset":50,"limit":10}}],"api":"anthropic-messages","provider":"minimax","model":"MiniMax-M2.7","usage":{"input":27923,"output":135,"cacheRead":10071,"cacheWrite":0,"totalTokens":38129,"cost":{"input":0.0083769,"output":0.00016199999999999998,"cacheRead":0.0006042599999999999,"cacheWrite":0,"total":0.009143160000000001}},"stopReason":"toolUse","timestamp":1777539620804,"responseId":"06424d259d7c6637d302081d0802837e"}}
{"type":"message","id":"e35f9c3c","parentId":"70ae8de9","timestamp":"2026-04-30T09:00:25.677Z","message":{"role":"toolResult","toolCallId":"call_function_4vgbwkqblnrk_1","toolName":"read","content":[{"type":"text","text":"class GraphBuilder:\n    \"\"\"Builds a unified graph from multiple source materials.\"\"\"\n    __slots__ = ('nodes', 'edges', 'adj', '_node_ids', '_section_stack', '_precomputed_paths')\n\n    def __init__(self):\n        self.nodes: List[Dict[str, Any]] = []\n        self.edges: List[Dict[str, str]] = []\n        self.adj: Dict[str, List[str]] = defaultdict(list)\n        self._node_ids: set = set()\n        self._section_stack: List[int] = []\n\n[2463 more lines in file. Use offset=60 to continue.]"}],"isError":false,"timestamp":1777539625677}}
{"type":"message","id":"474801ba","parentId":"e35f9c3c","timestamp":"2026-04-30T09:00:30.698Z","message":{"role":"assistant","content":[{"type":"thinking","thinking":"I need to add `hub_reachable` to `__slots__` and initialize it in `__init__`.","thinkingSignature":"bff22c0bebf94382f6caba763cf597fd9614834762eb00894e4f056eb5903c9e"},{"type":"toolCall","id":"call_function_5teevborg5u4_1","name":"edit","arguments":{"path":"/home/ubuntu/.hermes/agi/graph_builder.py","edits":[{"oldText":"    __slots__ = ('nodes', 'edges', 'adj', '_node_ids', '_section_stack', '_precomputed_paths')","newText":"    __slots__ = ('nodes', 'edges', 'adj', '_node_ids', '_section_stack', '_precomputed_paths', 'hub_reachable')"},{"oldText":"        self._precomputed_paths: Dict[Tuple[str, str], List[str]] = {}\n        self.nodes: List[Dict[str, Any]] = []","newText":"        self._precomputed_paths: Dict[Tuple[str, str], List[str]] = {}\n        self.hub_reachable: Dict[str, frozenset] = {}\n        self.nodes: List[Dict[str, Any]] = []"}]}}],"api":"anthropic-messages","provider":"minimax","model":"MiniMax-M2.7","usage":{"input":28201,"output":240,"cacheRead":10071,"cacheWrite":0,"totalTokens":38512,"cost":{"input":0.0084603,"output":0.000288,"cacheRead":0.0006042599999999999,"cacheWrite":0,"total":0.009352560000000001}},"stopReason":"toolUse","timestamp":1777539625678,"responseId":"06424d2a391ef25c037fba67c6f38ac7"}}
{"type":"message","id":"e02e9a1f","parentId":"474801ba","timestamp":"2026-04-30T09:00:30.704Z","message":{"role":"toolResult","toolCallId":"call_function_5teevborg5u4_1","toolName":"edit","content":[{"type":"text","text":"Could not find edits[1] in /home/ubuntu/.hermes/agi/graph_builder.py. The oldText must match exactly including all whitespace and newlines."}],"details":{},"isError":true,"timestamp":1777539630704}}
{"type":"message","id":"59046b04","parentId":"e02e9a1f","timestamp":"2026-04-30T09:00:33.974Z","message":{"role":"assistant","content":[{"type":"thinking","thinking":"Let me read the exact text around the __init__ method.","thinkingSignature":"270fdd7b20f0b034f30806aff5760a61ff0fe33c18c2e807487a657213fe3cbb"},{"type":"toolCall","id":"call_function_eybifn7ajby0_1","name":"read","arguments":{"path":"/home/ubuntu/.hermes/agi/graph_builder.py","offset":53,"limit":15}}],"api":"anthropic-messages","provider":"minimax","model":"MiniMax-M2.7","usage":{"input":28490,"output":70,"cacheRead":10071,"cacheWrite":0,"totalTokens":38631,"cost":{"input":0.008546999999999999,"output":0.000084,"cacheRead":0.0006042599999999999,"cacheWrite":0,"total":0.00923526}},"stopReason":"toolUse","timestamp":1777539630705,"responseId":"06424d2f4ffefddc5358d3290cdf71fe"}}
{"type":"message","id":"bdefc659","parentId":"59046b04","timestamp":"2026-04-30T09:00:33.976Z","message":{"role":"toolResult","toolCallId":"call_function_eybifn7ajby0_1","toolName":"read","content":[{"type":"text","text":"\n    def __init__(self):\n        self.nodes: List[Dict[str, Any]] = []\n        self.edges: List[Dict[str, str]] = []\n        self.adj: Dict[str, List[str]] = defaultdict(list)\n        self._node_ids: set = set()\n        self._section_stack: List[int] = []\n        self._precomputed_paths: Dict[str, Any] = {}  # (start, end) -> path or None\n\n    def add_node(self, node_type: str, label: str, content: str = \"\",\n                 source: str = \"\", node_id: Optional[str] = None) -> str:\n        \"\"\"Add a node to the graph as a compact tuple (id, type, label, content, source).\"\"\"\n        if node_id is None:\n            node_id = f\"{node_type}_{len(self.nodes)}\"\n\n\n[2455 more lines in file. Use offset=68 to continue.]"}],"isError":false,"timestamp":1777539633976}}
{"type":"message","id":"71346e07","parentId":"bdefc659","timestamp":"2026-04-30T09:00:39.481Z","message":{"role":"assistant","content":[{"type":"thinking","thinking":"Now I see the exact text. Let me make both edits.","thinkingSignature":"350e4ce83ab3e8e951212291ece4b96e1ad5c866bf53897134af3936bf10cccb"},{"type":"toolCall","id":"call_function_kdlwkoi1utr2_1","name":"edit","arguments":{"path":"/home/ubuntu/.hermes/agi/graph_builder.py","edits":[{"oldText":"    __slots__ = ('nodes', 'edges', 'adj', '_node_ids', '_section_stack', '_precomputed_paths')","newText":"    __slots__ = ('nodes', 'edges', 'adj', '_node_ids', '_section_stack', '_precomputed_paths', 'hub_reachable')"},{"oldText":"        self._precomputed_paths: Dict[str, Any] = {}  # (start, end) -> path or None\n\n    def add_node(self, node_type: str, label: str, content: str = \"\",","newText":"        self._precomputed_paths: Dict[str, Any] = {}  # (start, end) -> path or None\n        self.hub_reachable: Dict[str, frozenset] = {}  # hub_id -> frozenset of reachable node ids\n\n    def add_node(self, node_type: str, label: str, content: str = \"\","}]}}],"api":"anthropic-messages","provider":"minimax","model":"MiniMax-M2.7","usage":{"input":28769,"output":269,"cacheRead":10071,"cacheWrite":0,"totalTokens":39109,"cost":{"input":0.0086307,"output":0.0003228,"cacheRead":0.0006042599999999999,"cacheWrite":0,"total":0.00955776}},"stopReason":"toolUse","timestamp":1777539633978,"responseId":"06424d3254675777321b8fb6204d7b89"}}
{"type":"message","id":"60bff00f","parentId":"71346e07","timestamp":"2026-04-30T09:00:39.490Z","message":{"role":"toolResult","toolCallId":"call_function_kdlwkoi1utr2_1","toolName":"edit","content":[{"type":"text","text":"Successfully replaced 2 block(s) in /home/ubuntu/.hermes/agi/graph_builder.py."}],"details":{"diff":"      ...\n   48             pass\n   49 \n   50 class GraphBuilder:\n   51     \"\"\"Builds a unified graph from multiple source materials.\"\"\"\n-  52     __slots__ = ('nodes', 'edges', 'adj', '_node_ids', '_section_stack', '_precomputed_paths')\n+  52     __slots__ = ('nodes', 'edges', 'adj', '_node_ids', '_section_stack', '_precomputed_paths', 'hub_reachable')\n   53 \n   54     def __init__(self):\n   55         self.nodes: List[Dict[str, Any]] = []\n   56         self.edges: List[Dict[str, str]] = []\n   57         self.adj: Dict[str, List[str]] = defaultdict(list)\n   58         self._node_ids: set = set()\n   59         self._section_stack: List[int] = []\n   60         self._precomputed_paths: Dict[str, Any] = {}  # (start, end) -> path or None\n+  61         self.hub_reachable: Dict[str, frozenset] = {}  # hub_id -> frozenset of reachable node ids\n   61 \n   62     def add_node(self, node_type: str, label: str, content: str = \"\",\n   63                  source: str = \"\", node_id: Optional[str] = None) -> str:\n   64         \"\"\"Add a node to the graph as a compact tuple (id, type, label, content, source).\"\"\"\n      ...","firstChangedLine":52},"isError":false,"timestamp":1777539639490}}
{"type":"message","id":"827dd414","parentId":"60bff00f","timestamp":"2026-04-30T09:00:42.227Z","message":{"role":"assistant","content":[{"type":"thinking","thinking":"Now let me test again.","thinkingSignature":"82edefaba493c73e5622cf5f75b3a9e6e539ddb9aae9917ddaf254ff135ddd71"},{"type":"toolCall","id":"call_function_tin0xzvyp5d5_1","name":"bash","arguments":{"command":"cd /home/ubuntu/.hermes/agi && python3 -c \"import graph_builder; print('OK')\" 2>&1"}}],"api":"anthropic-messages","provider":"minimax","model":"MiniMax-M2.7","usage":{"input":29074,"output":60,"cacheRead":10071,"cacheWrite":0,"totalTokens":39205,"cost":{"input":0.0087222,"output":0.000072,"cacheRead":0.0006042599999999999,"cacheWrite":0,"total":0.009398459999999999}},"stopReason":"toolUse","timestamp":1777539639491,"responseId":"06424d37909179d92291de6257edfdbf"}}
{"type":"message","id":"046ba16a","parentId":"827dd414","timestamp":"2026-04-30T09:00:42.294Z","message":{"role":"toolResult","toolCallId":"call_function_tin0xzvyp5d5_1","toolName":"bash","content":[{"type":"text","text":"OK\n"}],"isError":false,"timestamp":1777539642294}}
{"type":"message","id":"dc522632","parentId":"046ba16a","timestamp":"2026-04-30T09:00:50.181Z","message":{"role":"assistant","content":[{"type":"thinking","thinking":"Now let me test the cold vs warm timing again.","thinkingSignature":"6375c0480f983f7c6d5014f4fefa332066e3426680e54dcc8def3ca6017a5d14"},{"type":"toolCall","id":"call_function_nrsmhd7g2hke_1","name":"bash","arguments":{"command":"cd /home/ubuntu/.hermes/agi && python3 -c \"\nimport time, os, sys\nsys.path.insert(0, '.')\nfrom graph_builder import build_graph, _cached_build_builder, _get_graph_cache_file\n\nhermes = os.path.expanduser('~/.hermes')\nagi = '/home/ubuntu/.hermes/agi'\n\n_cached_build_builder.cache_clear()\ncache_file = _get_graph_cache_file(agi)\nif os.path.exists(cache_file):\n    os.remove(cache_file)\n\nprint('=== Cold build (with reachability matrix) ===')\nstart = time.perf_counter()\nb1, t1 = build_graph(hermes, agi)\ncold_total = (time.perf_counter() - start) * 1000\nprint(f'build_graph returned: {t1:.2f}ms, wall: {cold_total:.2f}ms')\nhr = getattr(b1, 'hub_reachable', {})\nprint(f'Nodes: {len(b1.nodes)}, hub_reachable: {len(hr)} hubs')\nif hr:\n    hub = next(iter(hr))\n    print(f'  e.g. hub={hub[:40]}, reachable_count={len(hr[hub])}')\n\nprint()\nprint('=== Warm build ===')\nstart = time.perf_counter()\nb2, t2 = build_graph(hermes, agi)\nwarm_total = (time.perf_counter() - start) * 1000\nprint(f'build_graph returned: {t2:.4f}ms, wall: {warm_total:.4f}ms')\nprint(f'Same builder: {b1 is b2}')\n\" 2>/dev/null"}}],"api":"anthropic-messages","provider":"minimax","model":"MiniMax-M2.7","usage":{"input":29151,"output":380,"cacheRead":10071,"cacheWrite":0,"totalTokens":39602,"cost":{"input":0.0087453,"output":0.00045599999999999997,"cacheRead":0.0006042599999999999,"cacheWrite":0,"total":0.00980556}},"stopReason":"toolUse","timestamp":1777539642296,"responseId":"06424d3a972b61534e5151eb917aa366"}}
{"type":"message","id":"4b9fddb5","parentId":"dc522632","timestamp":"2026-04-30T09:00:50.354Z","message":{"role":"toolResult","toolCallId":"call_function_nrsmhd7g2hke_1","toolName":"bash","content":[{"type":"text","text":"=== Cold build (with reachability matrix) ===\nbuild_graph returned: 126.80ms, wall: 126.81ms\nNodes: 1430, hub_reachable: 32 hubs\n  e.g. hub=agent_role_builder, reachable_count=338\n\n=== Warm build ===\nbuild_graph returned: 0.0236ms, wall: 0.0251ms\nSame builder: True\n"}],"isError":false,"timestamp":1777539650354}}
