{"type":"message","id":"c3ce1bec","parentId":"14f83019","timestamp":"2026-04-30T09:08:52.387Z","message":{"role":"toolResult","toolCallId":"call_function_xeljr2gztbtn_1","toolName":"run_experiment","content":[{"type":"text","text":"✅ PASSED in 0.2s\n📊 Current best graph_build_time_ms: 377.21ms\n\n📐 Parsed metrics: ★ graph_build_time_ms=0.04ms graph_node_count=1,430 graph_edge_count=1,461 query_time_ms=0ms ascii_render_lines=55\nUse these values directly in log_experiment (metric: 0.04, metrics: {\"graph_node_count\": 1430, \"graph_edge_count\": 1461, \"query_time_ms\": 0, \"ascii_render_lines\": 55})\n\nMETRIC query_time_ms=0.0\nMETRIC ascii_render_lines=55\n\nMETRIC graph_build_time_ms=0.04\nMETRIC graph_node_count=1430\nMETRIC graph_edge_count=1461\nMETRIC query_time_ms=0.0\nMETRIC ascii_render_lines=55\nUsing modular system: True\n\n\n[Showing last 10 of 13 lines. Full output: /tmp/pi-experiment-03e4b305340837b5.log]"}],"details":{"command":"./autoresearch.sh","exitCode":0,"durationSeconds":0.219,"passed":true,"crashed":false,"timedOut":false,"tailOutput":"METRIC graph_build_time_ms=0.04\nMETRIC graph_node_count=1430\nMETRIC graph_edge_count=1461\nMETRIC query_time_ms=0.0\nMETRIC ascii_render_lines=55\n\nMETRIC graph_build_time_ms=0.04\nMETRIC graph_node_count=1430\nMETRIC graph_edge_count=1461\nMETRIC query_time_ms=0.0\nMETRIC ascii_render_lines=55\nUsing modular system: True\n","checksPass":null,"checksTimedOut":false,"checksOutput":"","checksDuration":0,"parsedMetrics":{"graph_build_time_ms":0.04,"graph_node_count":1430,"graph_edge_count":1461,"query_time_ms":0,"ascii_render_lines":55},"parsedPrimary":0.04,"metricName":"graph_build_time_ms","metricUnit":"ms","truncation":{"content":"METRIC query_time_ms=0.0\nMETRIC ascii_render_lines=55\n\nMETRIC graph_build_time_ms=0.04\nMETRIC graph_node_count=1430\nMETRIC graph_edge_count=1461\nMETRIC query_time_ms=0.0\nMETRIC ascii_render_lines=55\nUsing modular system: True\n","truncated":true,"truncatedBy":"lines","totalLines":13,"totalBytes":316,"outputLines":10,"outputBytes":226,"lastLinePartial":false,"firstLineExceedsLimit":false,"maxLines":10,"maxBytes":4096},"fullOutputPath":"/tmp/pi-experiment-03e4b305340837b5.log"},"isError":false,"timestamp":1777540132387}}
{"type":"message","id":"4f2c4357","parentId":"c3ce1bec","timestamp":"2026-04-30T09:08:57.196Z","message":{"role":"assistant","content":[{"type":"thinking","thinking":"Hmm, the node count is still 1,430. Let me debug why. Maybe the lru_cache is still returning the old cached result. Let me clear the cache and try again:","thinkingSignature":"05a4360b5092e684d9f10e041bb94d68e2ff1e2b7bf15d9a750a0e252c0cfb4f"},{"type":"text","text":"Cache might still be returning old results. Let me clear it:\n"},{"type":"toolCall","id":"call_function_f3a0x3co82yj_1","name":"bash","arguments":{"command":"rm -f /home/ubuntu/.hermes/agi/.graph_cache.pkl && rm -rf /home/ubuntu/.hermes/agi/__pycache__ && ./autoresearch.sh","timeout_seconds":"120"}}],"api":"anthropic-messages","provider":"minimax","model":"MiniMax-M2.7","usage":{"input":49624,"output":128,"cacheRead":10071,"cacheWrite":0,"totalTokens":59823,"cost":{"input":0.0148872,"output":0.0001536,"cacheRead":0.0006042599999999999,"cacheWrite":0,"total":0.01564506}},"stopReason":"toolUse","timestamp":1777540132390,"responseId":"06424f244efd426c287eeaad47d1be50"}}
{"type":"message","id":"c9d7728a","parentId":"4f2c4357","timestamp":"2026-04-30T09:08:57.415Z","message":{"role":"toolResult","toolCallId":"call_function_f3a0x3co82yj_1","toolName":"bash","content":[{"type":"text","text":"METRIC graph_build_time_ms=0.03\nMETRIC graph_node_count=1430\nMETRIC graph_edge_count=1461\nMETRIC query_time_ms=0.0\nMETRIC ascii_render_lines=55\n\nMETRIC graph_build_time_ms=0.03\nMETRIC graph_node_count=1430\nMETRIC graph_edge_count=1461\nMETRIC query_time_ms=0.0\nMETRIC ascii_render_lines=55\nUsing modular system: True\n"}],"isError":false,"timestamp":1777540137415}}
{"type":"message","id":"0570bdc0","parentId":"c9d7728a","timestamp":"2026-04-30T09:09:13.942Z","message":{"role":"assistant","content":[{"type":"thinking","thinking":"Still 1430 nodes. The issue might be that `parse_templates` isn't being called, or there's another issue. Let me debug by adding some print statements or checking what's happening.\n\nActually wait - the `_cache_ver=11` should invalidate the lru_cache. Let me check if the template files are even being parsed. Let me add a debug print to see what's happening.\n\nActually, I think the issue is that the template stages are being created but they're replacing the `reference` nodes, not adding to them. Let me check the code flow more carefully.\n\nLooking at my edit, I changed:\n```python\nself.add_node(\"reference\", stage_name, f\"phase:{current_phase}\", ...)\n```\n\nto:\n```python\nself.add_node(\"template_stage\", stage_name, summary, ...)\n```\n\nSo I'm replacing `reference` nodes with `template_stage` nodes, not adding more nodes. The total count stays the same because I'm not adding new nodes, just changing the type.\n\nBut wait - the old code also created these nodes and counted them. So the count should be the same, which is why we're seeing 1,430.\n\nThe improvement here is qualitative (richer node types) not quantitative (more nodes). The primary metric is unaffected (still 0.03ms) and secondary metrics are unchanged.\n\nActually, looking more carefully at my change - I'm creating `template_stage` nodes where before we created `reference` nodes. The count is the same because we're creating the same number of nodes, just with a different type.\n\nThe benefit is:\n1. `template_stage` nodes now have richer metadata (role, action, session, cli)\n2. `template_stage` nodes are linked to `agent_role` nodes via `uses_role` edges\n\nBut this doesn't affect node count. The improvement is in graph quality, not quantity.\n\nSince the primary metric is noise-floor saturated and the secondary metrics are unchanged, this experiment would be a \"discard\" based on metrics. \n\nI should verify whether the template_stage nodes are actually getting created with the new metadata and connections. Let me check if the stage metadata is being populated correctly and if the `uses_role` edges are forming properly.","thinkingSignature":"6f733cdd423cde2093beb94a61d1d88b661b161932fc08954d954d85424179d0"},{"type":"text","text":"The node count is unchanged because I replaced `reference` nodes with `template_stage` nodes (same count). Let me verify the change is working:\n"},{"type":"toolCall","id":"call_function_u7fx8u91oa8l_1","name":"bash","arguments":{"command":"cd /home/ubuntu/.hermes/agi && python3 -c \"\nfrom graph_builder import build_graph\nimport os\nHERMES_DIR = os.path.expanduser('~/.hermes')\nAGI_DIR = '/home/ubuntu/.hermes/agi'\nbuilder, _ = build_graph(HERMES_DIR, AGI_DIR)\n# Check for template_stage nodes\ntemplate_stages = [n for n in builder.nodes if n[1] == 'template_stage']\nprint(f'template_stage nodes: {len(template_stages)}')\nfor ts in template_stages[:5]:\n    print(f'  {ts[0]}: {ts[2][:40]} - {ts[3][:60]}')\n\""}}],"api":"anthropic-messages","provider":"minimax","model":"MiniMax-M2.7","usage":{"input":49867,"output":648,"cacheRead":10071,"cacheWrite":0,"totalTokens":60586,"cost":{"input":0.014960099999999999,"output":0.0007775999999999999,"cacheRead":0.0006042599999999999,"cacheWrite":0,"total":0.01634196}},"stopReason":"toolUse","timestamp":1777540137419,"responseId":"06424f29df26d6e8a44d8a8cf009fc29"}}
{"type":"message","id":"30abb583","parentId":"0570bdc0","timestamp":"2026-04-30T09:09:14.121Z","message":{"role":"toolResult","toolCallId":"call_function_u7fx8u91oa8l_1","toolName":"bash","content":[{"type":"text","text":"template_stage nodes: 0\n"}],"isError":false,"timestamp":1777540154121}}
{"type":"message","id":"3bf87288","parentId":"30abb583","timestamp":"2026-04-30T09:09:19.553Z","message":{"role":"assistant","content":[{"type":"thinking","thinking":"No template_stage nodes were created! Let me check why. The parse_templates function might not be finding the templates directory, or there might be an issue with the code.","thinkingSignature":"f4227fda37c7be25b9210a88521f2bec67eb36e71e402f85f518bd2012a74ab3"},{"type":"text","text":"No template_stage nodes - let me debug:\n"},{"type":"toolCall","id":"call_function_2889eow3v0yo_1","name":"bash","arguments":{"command":"cd /home/ubuntu/.hermes/agi && python3 -c \"\nfrom graph_builder import GraphBuilder\nimport os\ntemplates_dir = '/home/ubuntu/.hermes/skills/../belam-codex/templates'\nprint(f'templates_dir exists: {os.path.isdir(templates_dir)}')\n# Try listing\ntry:\n    files = sorted(os.listdir(templates_dir))\n    print(f'Files: {[f for f in files if not f.startswith(\\\".\\\")]}')\nexcept Exception as e:\n    print(f'Error: {e}')\n\""}}],"api":"anthropic-messages","provider":"minimax","model":"MiniMax-M2.7","usage":{"input":50537,"output":185,"cacheRead":10071,"cacheWrite":0,"totalTokens":60793,"cost":{"input":0.015161099999999999,"output":0.000222,"cacheRead":0.0006042599999999999,"cacheWrite":0,"total":0.01598736}},"stopReason":"toolUse","timestamp":1777540154124,"responseId":"06424f3aaa4cc860fe9b426f63d662ae"}}
{"type":"message","id":"ed779c15","parentId":"3bf87288","timestamp":"2026-04-30T09:09:19.600Z","message":{"role":"toolResult","toolCallId":"call_function_2889eow3v0yo_1","toolName":"bash","content":[{"type":"text","text":"templates_dir exists: True\nFiles: ['builder-first-autogate-pipeline.md', 'builder-first-pipeline.md', 'research-packet-body.md', 'research-pipeline.md', 'retired']\n"}],"isError":false,"timestamp":1777540159600}}
{"type":"message","id":"33385df6","parentId":"ed779c15","timestamp":"2026-04-30T09:09:24.965Z","message":{"role":"assistant","content":[{"type":"thinking","thinking":"The templates directory exists and has files. Let me check if parse_templates is being called and what it's doing:","thinkingSignature":"bc5afc0aa3b5ff26d1a60ae474d46d9c977998d8e3d92056f9add240a29f77e9"},{"type":"toolCall","id":"call_function_w5nds2g44yp1_1","name":"bash","arguments":{"command":"cd /home/ubuntu/.hermes/agi && python3 -c \"\nfrom graph_builder import GraphBuilder\nimport os\n\n# Test parse_templates directly\nbuilder = GraphBuilder()\ntemplates_dir = '/home/ubuntu/.hermes/belam-codex/templates'\ncount = builder.parse_templates(templates_dir)\nprint(f'parse_templates returned: {count}')\nprint(f'Nodes: {len(builder.nodes)}')\ntemplate_stages = [n for n in builder.nodes if n[1] == 'template_stage']\nprint(f'template_stage nodes: {len(template_stages)}')\nfor ts in template_stages[:10]:\n    print(f'  {ts[0]}: {ts[2][:40]} - {ts[3][:60]}')\n\""}}],"api":"anthropic-messages","provider":"minimax","model":"MiniMax-M2.7","usage":{"input":50780,"output":206,"cacheRead":10071,"cacheWrite":0,"totalTokens":61057,"cost":{"input":0.015234,"output":0.0002472,"cacheRead":0.0006042599999999999,"cacheWrite":0,"total":0.01608546}},"stopReason":"toolUse","timestamp":1777540159603,"responseId":"06424f40739e156b7558aea815266c6d"}}
{"type":"message","id":"f817c2e8","parentId":"33385df6","timestamp":"2026-04-30T09:09:25.011Z","message":{"role":"toolResult","toolCallId":"call_function_w5nds2g44yp1_1","toolName":"bash","content":[{"type":"text","text":"parse_templates returned: 5\nNodes: 5\ntemplate_stage nodes: 0\n"}],"isError":false,"timestamp":1777540165011}}
{"type":"message","id":"7de3aee1","parentId":"f817c2e8","timestamp":"2026-04-30T09:09:34.644Z","message":{"role":"assistant","content":[{"type":"thinking","thinking":"Interesting! `parse_templates` returns 5 (the template + 4 category nodes) but 0 `template_stage` nodes. Let me trace through to see why stages aren't being created.Looking at the code flow:\n1. Template node is created\n2. Category node is created3. YAML blocks are extracted\n4. Phase/stage headings are parsedThe issue might be that when I look for stage headings (`#### \\`stage_name\\``), the `current_phase` might not be set. Let me trace through:","thinkingSignature":"867ec0360aff24363a23737252fea2b40b038eadeee48b73a2743022859e8be3"},{"type":"toolCall","id":"call_function_svqmxm4058ob_1","name":"bash","arguments":{"command":"cd /home/ubuntu/.hermes/agi && python3 -c \"\nfrom graph_builder import GraphBuilder\nimport os\nimport re\n\ntemplates_dir = '/home/ubuntu/.hermes/belam-codex/templates'\nfiles = sorted(os.listdir(templates_dir))\nfor filename in files:\n    if not filename.endswith('.md') or filename.startswith('.') or filename == 'retired':\n        continue\n    filepath = os.path.join(templates_dir, filename)\n    if not os.path.isfile(filepath):\n        continue\n    with open(filepath, 'r') as f:\n        content = f.read()\n    \n    # Check for stage headings\n    _RE_STAGE_HDR = re.compile(r'^####\\s+\\`([\\w_]+)\\`\\n', re.MULTILINE)\n    stages = _RE_STAGE_HDR.findall(content)\n    print(f'{filename}: {len(stages)} stage headings: {stages}')\n    \n    # Check for phase headings\n    _RE_PHASE_HDR = re.compile(r'^###\\s+Phase\\s+(\\d+)([^\\n]*)\\n', re.MULTILINE)\n    phases = _RE_PHASE_HDR.findall(content)\n    print(f'  phases: {phases}')\n\""}}],"api":"anthropic-messages","provider":"minimax","model":"MiniMax-M2.7","usage":{"input":51021,"output":399,"cacheRead":10071,"cacheWrite":0,"totalTokens":61491,"cost":{"input":0.0153063,"output":0.0004788,"cacheRead":0.0006042599999999999,"cacheWrite":0,"total":0.01638936}},"stopReason":"toolUse","timestamp":1777540165014,"responseId":"06424f4522c8e1ebc9a6e6e75c12d882"}}
{"type":"message","id":"bd52d2a2","parentId":"7de3aee1","timestamp":"2026-04-30T09:09:34.692Z","message":{"role":"toolResult","toolCallId":"call_function_svqmxm4058ob_1","toolName":"bash","content":[{"type":"text","text":"builder-first-autogate-pipeline.md: 0 stage headings: []\n  phases: []\nbuilder-first-pipeline.md: 7 stage headings: ['p1_builder_implement', 'p1_builder_bugfix', 'p1_critic_review', 'p2_architect_design', 'p2_builder_implement', 'p2_builder_bugfix', 'p2_critic_review']\n  phases: [('1', ' — Builder-First Implementation'), ('2', ' — Architect-Led Refinement')]\nresearch-packet-body.md: 0 stage headings: []\n  phases: []\nresearch-pipeline.md: 6 stage headings: ['p1_architect_design', 'p1_critic_design_review', 'p1_builder_implement', 'p1_builder_verify', 'p1_critic_code_review', 'p2_architect_analysis']\n  phases: [('1', ' — Design & Build'), ('2', ' — Local Experiment & Analysis'), ('3', ' — Refinement'), ('4', ' — Iteration')]\n"}],"isError":false,"timestamp":1777540174692}}
{"type":"message","id":"1828dea5","parentId":"bd52d2a2","timestamp":"2026-04-30T09:09:45.466Z","message":{"role":"assistant","content":[{"type":"thinking","thinking":"I see! The phase headings are like `### Phase 1 — ...` and my regex `_RE_PHASE_HDR` looks for `^###\\s+Phase\\s+(\\d+)` which should match. Let me check what's happening in the loop:\n\n1. The phase headings ARE found by regex (e.g., `[('1', ' — Builder-First Implementation')]`)\n2. But in the loop, I'm checking for `stripped.startswith('phase')` which won't match `Phase 1`The issue is my YAML parsing looks for `phase1`, `phase2`, `phase3` but the YAML block has `phase1:`, `phase2:`. And the markdown headings have `Phase 1`, `Phase 2`.Let me check if the YAML parsing is working:","thinkingSignature":"f7e3e69216c29f40b9a7a23c6ef340a46964ba3dcc2f08ed69b90e208d7aece7"},{"type":"toolCall","id":"call_function_fxr6hohkow49_1","name":"bash","arguments":{"command":"cd /home/ubuntu/.hermes/agi && python3 -c \"\nfrom graph_builder import GraphBuilder\nimport os\nimport re\n\n# Manually trace through parse_templates\ntemplates_dir = '/home/ubuntu/.hermes/belam-codex/templates'\nfilepath = os.path.join(templates_dir, 'builder-first-pipeline.md')\nwith open(filepath, 'r') as f:\n    content = f.read()\n\n_RE_YAML_BLOCK = re.compile(r'\\`\\`\\`yaml\\n(.*?)\\n\\`\\`\\`', re.DOTALL)\nyaml_blocks = list(_RE_YAML_BLOCK.finditer(content))\nprint(f'Found {len(yaml_blocks)} YAML blocks')\n\nif yaml_blocks:\n    yaml_content = yaml_blocks[0].group(1)\n    lines = yaml_content.split('\\n')\n    cur_phase = None\n    in_stages = False\n    \n    for i, yline in enumerate(lines):\n        stripped = yline.strip()\n        \n        if stripped.startswith('phase') and ':' in stripped:\n            phase_key = stripped.split(':')[0].strip()\n            if phase_key in ('phase1', 'phase2', 'phase3'):\n                print(f'Found phase: {phase_key} at line {i}')\n                cur_phase = phase_key\n                in_stages = False\n        \n        if stripped.startswith('stages:'):\n            print(f'Stages section started')\n            in_stages = True\n            continue\n        \n        if in_stages and stripped.startswith('- role:'):\n            print(f'Stage found: {stripped} (cur_phase={cur_phase})')\n\""}}],"api":"anthropic-messages","provider":"minimax","model":"MiniMax-M2.7","usage":{"input":51652,"output":520,"cacheRead":10071,"cacheWrite":0,"totalTokens":62243,"cost":{"input":0.0154956,"output":0.000624,"cacheRead":0.0006042599999999999,"cacheWrite":0,"total":0.01672386}},"stopReason":"toolUse","timestamp":1777540174696,"responseId":"06424f4fc1b8168265a54d70fb1f8d02"}}
{"type":"message","id":"ea9482a7","parentId":"1828dea5","timestamp":"2026-04-30T09:09:45.511Z","message":{"role":"toolResult","toolCallId":"call_function_fxr6hohkow49_1","toolName":"bash","content":[{"type":"text","text":"Found 1 YAML blocks\nFound phase: phase1 at line 20\nStages section started\nStage found: - role: builder (cur_phase=phase1)\nStage found: - role: builder (cur_phase=phase1)\nStage found: - role: critic (cur_phase=phase1)\nFound phase: phase2 at line 39\nStages section started\nStage found: - role: architect (cur_phase=phase2)\nStage found: - role: builder (cur_phase=phase2)\nStage found: - role: builder (cur_phase=phase2)\nStage found: - role: critic (cur_phase=phase2)\nFound phase: phase3 at line 63\nStages section started\nStage found: - role: architect (cur_phase=phase3)\nStage found: - role: builder (cur_phase=phase3)\nStage found: - role: builder (cur_phase=phase3)\nStage found: - role: critic (cur_phase=phase3)\n"}],"isError":false,"timestamp":1777540185511}}
{"type":"message","id":"17dd1a55","parentId":"ea9482a7","timestamp":"2026-04-30T09:09:50.153Z","message":{"role":"assistant","content":[{"type":"thinking","thinking":"Good! The YAML parsing is working - it finds phases and stages. Now let me check if the issue is in the actual `parse_templates` function in the file. Let me read the current code:","thinkingSignature":"50a6183602c0dca899b8cfb106b718b3b18f6265e641ef118fc9084439652522"},{"type":"toolCall","id":"call_function_vqv45wg5ddfv_1","name":"read","arguments":{"path":"/home/ubuntu/.hermes/agi/graph_builder.py","offset":1710,"limit":80}}],"api":"anthropic-messages","provider":"minimax","model":"MiniMax-M2.7","usage":{"input":52389,"output":100,"cacheRead":10071,"cacheWrite":0,"totalTokens":62560,"cost":{"input":0.0157167,"output":0.00011999999999999999,"cacheRead":0.0006042599999999999,"cacheWrite":0,"total":0.016440959999999998}},"stopReason":"toolUse","timestamp":1777540185515,"responseId":"06424f5afc97122c53b7c5ad0ec17e15"}}
