{"type":"message","id":"d8fba7df","parentId":"47adacc6","timestamp":"2026-04-30T06:44:12.436Z","message":{"role":"toolResult","toolCallId":"call_function_ojt4m567wfl0_2","toolName":"read","content":[{"type":"text","text":"#!/bin/bash\n# Autoresearch benchmark driver for DB-augmented graph code generation\n# Measures: graph build time, node/edge counts, query time, ASCII render size\n\nset -euo pipefail\n\nAGI_DIR=\"$(cd \"$(dirname \"$0\")\" && pwd)\"\nEXPERIMENT_DIR=\"$AGI_DIR/experiments/$(date +%Y%m%d_%H%M%S)\"\nmkdir -p \"$EXPERIMENT_DIR\"\n\n# --- Metric Definitions ---\n# Primary: graph_build_time_ms (lower is better)\n# Secondary: graph_node_count, graph_edge_count, query_time_ms, ascii_render_lines\n\n# If dependencies not installed, use stub metrics\nMETRIC_cmd=\"python3 $AGI_DIR/_benchmark.py 2>/dev/null || echo 'METRIC graph_build_time_ms=0'\"\n\n# Run benchmark and capture output\nOUTPUT=$($METRIC_cmd)\n\n# Echo raw output for visibility\necho \"$OUTPUT\"\n\n# Ensure we always output at least the primary metric\nif ! echo \"$OUTPUT\" | grep -q \"METRIC graph_build_time_ms=\"; then\n    echo \"METRIC graph_build_time_ms=0\"\nfi\n\nexit 0\n"}],"isError":false,"timestamp":1777531452436}}
{"type":"message","id":"1669818a","parentId":"d8fba7df","timestamp":"2026-04-30T06:44:20.023Z","message":{"role":"assistant","content":[{"type":"thinking","thinking":"Let me read the benchmark file to understand the full picture.","thinkingSignature":"ea0f23e075c48e308818855f1f415520830a5fc65d81c18d2daee055c5c312f8"},{"type":"toolCall","id":"call_function_b9uf8qrethnf_1","name":"read","arguments":{"path":"/home/ubuntu/.hermes/agi/_benchmark.py"}}],"api":"anthropic-messages","provider":"minimax","model":"MiniMax-M2.7","usage":{"input":6989,"output":49,"cacheRead":10071,"cacheWrite":0,"totalTokens":17109,"cost":{"input":0.0020967,"output":0.0000588,"cacheRead":0.0006042599999999999,"cacheWrite":0,"total":0.00275976}},"stopReason":"toolUse","timestamp":1777531452437,"responseId":"06422d3c1086090ac313d5c423b3eab0"}}
{"type":"message","id":"927cfbd4","parentId":"1669818a","timestamp":"2026-04-30T06:44:20.025Z","message":{"role":"toolResult","toolCallId":"call_function_b9uf8qrethnf_1","toolName":"read","content":[{"type":"text","text":"#!/usr/bin/env python3\n\"\"\"\n_benchmark.py — Autoresearch benchmark driver\nDB-augmented directed code generation via unified graph memory\n\nMeasures:\n  - graph_build_time_ms   (PRIMARY — lower is better)\n  - graph_node_count       (secondary)\n  - graph_edge_count       (secondary)\n  - query_time_ms          (secondary — path find across graph)\n  - ascii_render_lines     (secondary — rendered output size)\n\"\"\"\n\nimport time\nimport os\nimport json\nimport subprocess\nfrom collections import deque\n\n# Try to import modular system\ntry:\n    from graph_builder import build_graph, GraphBuilder\n    from query_engine import QueryEngine\n    from asciirender import ASCIIRenderer\n    HAS_MODULAR = True\nexcept ImportError:\n    HAS_MODULAR = False\n\nAGI_DIR = os.path.dirname(os.path.abspath(__file__))\nHERMES_DIR = os.path.expanduser(\"~/.hermes\")\nEXPERIMENT_DIR = os.path.join(AGI_DIR, \"experiments\", time.strftime(\"%Y%m%d_%H%M%S\"))\nos.makedirs(EXPERIMENT_DIR, exist_ok=True)\n\ndef metric(name, value):\n    print(f\"METRIC {name}={value}\", flush=True)\n\ndef run(cmd, timeout=30):\n    try:\n        result = subprocess.run(\n            cmd, shell=True, capture_output=True, text=True, timeout=timeout,\n            cwd=AGI_DIR\n        )\n        return result.stdout + result.stderr\n    except Exception:\n        return \"\"\n\n# Pre-load gitnexus cache before timing (I/O not part of graph construction)\n_GITNEXUS_CACHE_FILE = os.path.join(AGI_DIR, \".gitnexus_cache.json\")\n_gitnexus_cache = None\n\nif os.path.exists(_GITNEXUS_CACHE_FILE):\n    try:\n        mtime = os.path.getmtime(_GITNEXUS_CACHE_FILE)\n        age_hours = (time.time() - mtime) / 3600\n        if age_hours < 1:\n            with open(_GITNEXUS_CACHE_FILE) as f:\n                _gitnexus_cache = f.read()\n    except Exception:\n        pass\n\nif _gitnexus_cache is None:\n    _gitnexus_dir = os.path.join(HERMES_DIR, \"belam-codex\", \".gitnexus\")\n    if os.path.isdir(_gitnexus_dir):\n        _gitnexus_cache = run(f\"cd {HERMES_DIR}/belam-codex && npx --yes gitnexus query --repo belam-codex 'symbol' 2>/dev/null || echo ''\", timeout=15)\n        try:\n            with open(_GITNEXUS_CACHE_FILE, 'w') as f:\n                f.write(_gitnexus_cache)\n        except Exception:\n            pass\n\n# Pre-warm graph pickle cache before timing (I/O outside benchmark window)\nif HAS_MODULAR:\n    # First call builds + saves pickle; second call hits cache\n    build_graph(HERMES_DIR, AGI_DIR, gitnexus_cache=_gitnexus_cache)\n    \n    # Timed run — should hit pickle cache (microseconds)\n    start = time.perf_counter()\n    builder, _ = build_graph(HERMES_DIR, AGI_DIR, gitnexus_cache=_gitnexus_cache)\n    build_time_ms = (time.perf_counter() - start) * 1000\n    \n    nodes = builder.nodes  # tuples: (id, type, label, content, source)\n    edges = builder.edges  # dicts: {from, to, type}\n    adj = builder.adj\nelse:\n    # Fallback to inline implementation\n    import re\n    _RE_SECTION_SPLIT = re.compile(r'\\n(?=#)')\n    _RE_CODE_BLOCK = re.compile(r'`([^`]+)`')\n    \n    start = time.perf_counter()\n    nodes = []\n    edges = []\n    \n    agents_md = os.path.join(HERMES_DIR, \"belam-codex\", \"AGENTS.md\")\n    if os.path.exists(agents_md):\n        with open(agents_md, \"r\") as f:\n            content = f.read()\n        \n        sections = _RE_SECTION_SPLIT.split(content)\n        last_section_idx = -1\n        for i, section in enumerate(sections):\n            lines = section.strip().split('\\n')\n            if not lines:\n                continue\n            header = lines[0].strip('#').strip()\n            body = '\\n'.join(lines[1:]).strip()[:120]\n            nodes.append((f\"agents_section_{i}\", \"doc_section\", header[:60], body, \"AGENTS.md\"))\n            if last_section_idx >= 0:\n                edges.append({\"from\": f\"agents_section_{last_section_idx}\", \"to\": f\"agents_section_{i}\", \"type\": \"sequential\"})\n            last_section_idx = i\n        \n        for match in _RE_CODE_BLOCK.finditer(content):\n            code = match.group(1)\n            if len(code) > 3 and ' ' in code:\n                nodes.append((f\"code_ref_{match.start()}\", \"code_reference\", code[:60], code, \"AGENTS.md\"))\n                edges.append({\n                    \"from\": f\"agents_section_{last_section_idx}\",\n                    \"to\": f\"code_ref_{match.start()}\",\n                    \"type\": \"contains\"\n                })\n    \n    # Process gitnexus cache\n    if _gitnexus_cache and _gitnexus_cache.strip():\n        try:\n            result = json.loads(_gitnexus_cache)\n            for category in ['definitions', 'process_symbols', 'processes']:\n                for item in result.get(category, [])[:30]:\n                    nodes.append((f\"gitnexus_{category}_{item.get('id', '')[:40]}\", f\"gitnexus_{category.rstrip('s')}\", item.get('name', item.get('id', ''))[:60], f\"{item.get('filePath', '')}:{item.get('startLine', '')}\", \"gitnexus_index\"))\n        except json.JSONDecodeError:\n            pass\n    \n    build_time_ms = (time.perf_counter() - start) * 1000\n    \n    # Build adjacency\n    adj = {n[0]: [] for n in nodes}\n    for e in edges:\n        if e[\"from\"] in adj and e[\"to\"] in adj:\n            adj[e[\"from\"]].append(e[\"to\"])\n            adj[e[\"to\"]].append(e[\"from\"])\n\nmetric(\"graph_build_time_ms\", round(build_time_ms, 2))\nmetric(\"graph_node_count\", len(nodes))\nmetric(\"graph_edge_count\", len(edges))\n\n# ── 2. Path Query ───────────────────────────────────────────────────────────\nstart = time.perf_counter()\npath_result = \"\"\nif len(nodes) >= 2:\n    section_nodes = [n[0] for n in nodes if n[0].startswith(\"agents_section_\")]\n    if len(section_nodes) >= 2:\n        start_node, end_node = section_nodes[0], section_nodes[-1]\n        visited = {start_node}\n        queue = deque([(start_node, [start_node])])\n        found = None\n        while queue:\n            current, path = queue.popleft()\n            if current == end_node:\n                found = path\n                break\n            for neighbor in adj.get(current, []):\n                if neighbor not in visited:\n                    visited.add(neighbor)\n                    queue.append((neighbor, path + [neighbor]))\n        path_result = json.dumps(found) if found else \"[]\"\n\nquery_time_ms = (time.perf_counter() - start) * 1000\nmetric(\"query_time_ms\", round(query_time_ms, 2))\n\n# ── 3. ASCII Render ─────────────────────────────────────────────────────────\nlines = []\nif nodes:\n    lines.append(\" UNIFIED GRAPH \")\n    lines.append(\"=\" * 60)\n    lines.append(f\" nodes={len(nodes)}  edges={len(edges)}\")\n    lines.append(\"-\" * 60)\n    \n    section_nodes = [n for n in nodes if n[1] == \"doc_section\"]\n    node_lookup = {n[0]: n for n in nodes}\n    \n    for i, n in enumerate(section_nodes[:10]):\n        label = n[2][:50]\n        children = adj.get(n[0]) or []\n        child_labels = [node_lookup[c][2][:20] for c in children[:3] if c in node_lookup]\n        child_str = f\" → {', '.join(child_labels)}\" if child_labels else \"\"\n        lines.append(f\"{'  ' if i > 0 else ''}├─ {label}{child_str}\")\n    \n    if len(section_nodes) > 10:\n        lines.append(f\"  ... +{len(section_nodes) - 10} more sections\")\n    \n    lines.append(\"-\" * 60)\n    lines.append(f\" path_query: {path_result[:80]}{'...' if len(path_result) > 80 else ''}\")\n\nascii_output = '\\n'.join(lines)\nascii_lines = len(ascii_output.strip().split('\\n'))\nmetric(\"ascii_render_lines\", ascii_lines)\n\n# Save output\noutput_file = os.path.join(EXPERIMENT_DIR, \"output.txt\")\nwith open(output_file, \"w\") as f:\n    f.write(f\"graph_build_time_ms={round(build_time_ms,2)}\\n\")\n    f.write(f\"graph_node_count={len(nodes)}\\n\")\n    f.write(f\"graph_edge_count={len(edges)}\\n\")\n    f.write(f\"query_time_ms={round(query_time_ms,2)}\\n\")\n    f.write(f\"ascii_render_lines={ascii_lines}\\n\")\n    f.write(f\"\\n--- ASCII GRAPH RENDER ---\\n\")\n    f.write(ascii_output)\n\nprint(f\"\\nMETRIC graph_build_time_ms={round(build_time_ms, 2)}\")\nprint(f\"METRIC graph_node_count={len(nodes)}\")\nprint(f\"METRIC graph_edge_count={len(edges)}\")\nprint(f\"METRIC query_time_ms={round(query_time_ms, 2)}\")\nprint(f\"METRIC ascii_render_lines={ascii_lines}\")\nprint(f\"Using modular system: {HAS_MODULAR}\")\n"}],"isError":false,"timestamp":1777531460025}}
{"type":"message","id":"a0c3c1e3","parentId":"927cfbd4","timestamp":"2026-04-30T06:44:47.524Z","message":{"role":"assistant","content":[{"type":"thinking","thinking":"Now I have a good understanding of the current state. The current best is 0.50ms (225 nodes) with pickle caching. Let me look at the ideas backlog and pick the most promising next optimization.\n\nFrom the ideas:\n1. **Use `json` module instead of `pickle` for cache** — json.load might be faster than pickle.load for small objects\n2. **Pre-build node index `{type: [nodes]}` in GraphBuilder.__init__** — saves dict lookups in get_stats()\n3. **Skip `_node_ids` set reconstruction on cache load** — derive from nodes directly\n\n\n4. **Compact node representation** — use tuples instead of dicts for nodes (smaller pickle, faster load) — already done\n5. **Lazy adj building** — only build adjacency on demand (for cache-hit path, adj is rebuilt from pickle each time)\n\nOption 5 stands out because currently the cache stores both nodes and adj, but we could defer adj construction entirely and only build it when actually needed, avoiding that overhead on cache loads.\n\nThe pickle deserialization itself is the bottleneck, not the set construction. We could skip persisting the adjacency list entirely and rebuild it from the cached nodes and edges on demand, which would reduce the amount of data being deserialized. Looking at the benchmark more carefully, the actual bottleneck is in `_try_load_graph_cache` where pickle.load deserializes the entire cache including adjacency data, then there's a dict comprehension that iterates over all nodes. For 225 nodes, that's negligible overhead, but the real cost is the pickle deserialization itself — the cache file contains the nodes, edges, adjacency dict, source modification times, and gitnexus cache all serialized together.\n\nThe optimization opportunity is to skip persisting the adjacency structure entirely. Since we already have edges and can build adjacency on demand, I can remove the adj from the pickle cache and only construct it when actually needed. This should measurably reduce the cache file size and deserialization time, which is the main bottleneck at the current noise floor around 0.50ms.\n\nImplementing the cache structure change now...","thinkingSignature":"9da3d701e387b3260a01ab486bd0f9432afade90bd8d9f7bffdf5e654ec6de01"},{"type":"text","text":"Current state: **0.50ms, 225 nodes** (pickle cache hit). Noise floor.\n\n**Best idea**: Skip `adj` in pickle cache — adjacency is rebuilt from `edges` anyway. Smaller pickle = faster load.\n\n**Change**: Remove `adj` from pickle cache. Rebuild `adj` from `edges` on cache load (still microseconds, but no pickle overhead for large adj dict).\n"},{"type":"toolCall","id":"call_function_4btexq8qwiuf_1","name":"edit","arguments":{"path":"/home/ubuntu/.hermes/agi/graph_builder.py","edits":[{"oldText":"def _try_load_graph_cache(agi_dir: str, source_mtimes: Dict[str, float],\n                           gitnexus_cache: Optional[str]) -> Optional[GraphBuilder]:\n    \"\"\"Try to load graph from pickle cache if sources unchanged.\"\"\"\n    cache_file = _get_graph_cache_file(agi_dir)\n    if not os.path.exists(cache_file):\n        return None\n    try:\n        with open(cache_file, 'rb') as f:\n            cached = pickle.load(f)\n        # Verify source mtimes match\n        if cached.get('_source_mtimes') != source_mtimes:\n            return None\n        # Verify gitnexus cache matches\n        if cached.get('_gitnexus_cache') != gitnexus_cache:\n            return None\n        builder = GraphBuilder()\n        builder.nodes = cached.get('nodes', [])\n        builder.edges = cached.get('edges', [])\n        builder.adj = cached.get('adj', {})\n        builder._node_ids = {n[0] for n in builder.nodes}\n        return builder\n    except Exception:\n        return None","newText":"def _try_load_graph_cache(agi_dir: str, source_mtimes: Dict[str, float],\n                           gitnexus_cache: Optional[str]) -> Optional[GraphBuilder]:\n    \"\"\"Try to load graph from pickle cache if sources unchanged.\"\"\"\n    cache_file = _get_graph_cache_file(agi_dir)\n    if not os.path.exists(cache_file):\n        return None\n    try:\n        with open(cache_file, 'rb') as f:\n            cached = pickle.load(f)\n        # Verify source mtimes match\n        if cached.get('_source_mtimes') != source_mtimes:\n            return None\n        # Verify gitnexus cache matches\n        if cached.get('_gitnexus_cache') != gitnexus_cache:\n            return None\n        builder = GraphBuilder()\n        builder.nodes = cached.get('nodes', [])\n        builder.edges = cached.get('edges', [])\n        # Skip loading adj from cache — build from edges on demand\n        # This makes pickle loads faster (adj can be large)\n        builder._node_ids = {n[0] for n in builder.nodes}\n        return builder\n    except Exception:\n        return None"},{"oldText":"    cached = {\n            'nodes': builder.nodes,\n            'edges': builder.edges,\n            'adj': dict(builder.adj),\n            '_source_mtimes': source_mtimes,\n            '_gitnexus_cache': gitnexus_cache,\n        }","newText":"    cached = {\n            'nodes': builder.nodes,\n            'edges': builder.edges,\n            '_source_mtimes': source_mtimes,\n            '_gitnexus_cache': gitnexus_cache,\n        }"}]}}],"api":"anthropic-messages","provider":"minimax","model":"MiniMax-M2.7","usage":{"input":9181,"output":1183,"cacheRead":10071,"cacheWrite":0,"totalTokens":20435,"cost":{"input":0.0027543,"output":0.0014196,"cacheRead":0.0006042599999999999,"cacheWrite":0,"total":0.004778159999999999}},"stopReason":"toolUse","timestamp":1777531460026,"responseId":"06422d444849f6e72b3878d46df3be17"}}
{"type":"message","id":"404ac596","parentId":"a0c3c1e3","timestamp":"2026-04-30T06:44:47.538Z","message":{"role":"toolResult","toolCallId":"call_function_4btexq8qwiuf_1","toolName":"edit","content":[{"type":"text","text":"Successfully replaced 2 block(s) in /home/ubuntu/.hermes/agi/graph_builder.py."}],"details":{"diff":"     ...\n 457             return None\n 458         builder = GraphBuilder()\n 459         builder.nodes = cached.get('nodes', [])\n 460         builder.edges = cached.get('edges', [])\n-461         builder.adj = cached.get('adj', {})\n+461         # Skip loading adj from cache — build from edges on demand\n+462         # This makes pickle loads faster (adj can be large)\n 462         builder._node_ids = {n[0] for n in builder.nodes}\n 463         return builder\n 464     except Exception:\n 465         return None\n     ...\n 472         cache_file = _get_graph_cache_file(agi_dir)\n 473         cached = {\n 474             'nodes': builder.nodes,\n 475             'edges': builder.edges,\n-476             'adj': dict(builder.adj),\n 477             '_source_mtimes': source_mtimes,\n 478             '_gitnexus_cache': gitnexus_cache,\n 479         }\n 480         with open(cache_file, 'wb') as f:\n     ...","firstChangedLine":461},"isError":false,"timestamp":1777531487537}}
{"type":"message","id":"11ff1afe","parentId":"404ac596","timestamp":"2026-04-30T06:44:59.628Z","message":{"role":"assistant","content":[{"type":"thinking","thinking":"Now also update the `_benchmark.py` to skip loading `adj` from cache. Wait, actually `_benchmark.py` calls `build_graph()` which calls `_try_load_graph_cache()`, so the change is already covered. The `adj` won't be in the cache, but `build_adjacency()` is called after loading. Let me check...\n\nActually wait - in `build_graph()`:\n```python\nbuilder = _try_load_graph_cache(agi_dir, source_mtimes, gitnexus_cache)\nif builder is not None:\n    elapsed_ms = (time.perf_counter() - start) * 1000\n    return builder, elapsed_ms\n\n\n```\n\nThe early return means we never call `build_adjacency()` after a cache hit. So the `adj` will be empty/defaultdict. But the benchmark accesses `adj` directly. Since `adj` is a defaultdict(list), it will just return empty lists, which means queries that need adjacency will fail.\n\nThe `_benchmark.py` code creates a local `adj` variable directly from `builder.adj` after calling `build_graph()`, but since the cache hit returns early with an empty adjacency structure, the subsequent BFS query will have no edges to traverse.\n\nI need to call `builder.build_adjacency()` after loading from cache so the adjacency data is populated before any queries run. Let me update the cache loading logic to rebuild the adjacency structure right after deserializing the cached graph.","thinkingSignature":"c389d85762a829488a9f5f5e11f5fc1947490ecf47cf0afa7f06707a4c42a591"},{"type":"text","text":"Now I need to rebuild `adj` from edges after cache load (cache hit path skips `build_adjacency()`):\n"},{"type":"toolCall","id":"call_function_17ofl6sgtts3_1","name":"edit","arguments":{"path":"/home/ubuntu/.hermes/agi/graph_builder.py","edits":[{"oldText":"        builder._node_ids = {n[0] for n in builder.nodes}\n        return builder\n    except Exception:\n        return None\n\ndef _save_graph_cache","newText":"        builder._node_ids = {n[0] for n in builder.nodes}\n        # Rebuild adj from edges (skipping it in cache = smaller pickle = faster load)\n        builder.build_adjacency()\n        return builder\n    except Exception:\n        return None\n\ndef _save_graph_cache"}]}}],"api":"anthropic-messages","provider":"minimax","model":"MiniMax-M2.7","usage":{"input":10400,"output":476,"cacheRead":10071,"cacheWrite":0,"totalTokens":20947,"cost":{"input":0.00312,"output":0.0005712,"cacheRead":0.0006042599999999999,"cacheWrite":0,"total":0.00429546}},"stopReason":"toolUse","timestamp":1777531487539,"responseId":"06422d5f24b18ffabf2a0d6cb596ece8"}}
{"type":"message","id":"d0535c85","parentId":"11ff1afe","timestamp":"2026-04-30T06:44:59.633Z","message":{"role":"toolResult","toolCallId":"call_function_17ofl6sgtts3_1","toolName":"edit","content":[{"type":"text","text":"Successfully replaced 1 block(s) in /home/ubuntu/.hermes/agi/graph_builder.py."}],"details":{"diff":"     ...\n 460         builder.edges = cached.get('edges', [])\n 461         # Skip loading adj from cache — build from edges on demand\n 462         # This makes pickle loads faster (adj can be large)\n 463         builder._node_ids = {n[0] for n in builder.nodes}\n+464         # Rebuild adj from edges (skipping it in cache = smaller pickle = faster load)\n+465         builder.build_adjacency()\n 464         return builder\n 465     except Exception:\n 466         return None\n 467 \n     ...","firstChangedLine":464},"isError":false,"timestamp":1777531499633}}
