{"type":"message","id":"6b9ad813","parentId":"1fa44f0e","timestamp":"2026-04-30T09:14:28.197Z","message":{"role":"assistant","content":[{"type":"thinking","thinking":"Now I have a clear picture. Let me think about what to do:\n\n1. The `hooks/` directory has 3 hook definitions with metadata (name, description, events, requires). These are TypeScript handlers + markdown metadata.\n2. The `scripts/` directory has 100+ Python CLI tools.\n3. The `pi_tree_adapter.py` has tuple/dict bugs.\n\nFor a targeted, one-change experiment, let me consider:\n\n**Option A**: Fix pi_tree_adapter.py to work with tuple nodes + add a hook for pi integration\n**Option B**: Parse hooks/ directory (3 hooks with metadata) → adds hook_reference nodes\n\n\n**Option C**: Parse scripts/ directory (100+ Python tools) → adds script_reference nodes\n**Option D**: Add Mermaid output to the benchmark\n\nOption C stands out because scripts/ is massive and completely unexplored, lru_cache keeps the warm path at O(1) regardless of data size, and adding 100+ script nodes would meaningfully increase the node count. The challenge is that these Python scripts are complex, so I'd need to parse them carefully to extract function names and class definitions.\n\nI'm thinking about a lightweight approach: extract top-level function and class names using regex patterns, then create script_reference nodes for each one. The script name becomes the reference node's label, while the functions and classes become children. I should be selective though—just grab the public-facing scripts like the CLI entry points rather than trying to parse everything. I'm looking at which scripts are actually meant for command-line use, like belam.sh and docker-build.sh, rather than internal modules that start with underscores.\n\nThe most practical approach is probably to focus on the most relevant scripts—launch_pipeline, run_experiment, and pipeline-related ones—and create reference nodes for them with function names as child nodes. This gives me around 50 scripts to work with. Let me implement a parse_scripts method that handles this selectively and keeps the code clean. I'm tallying up the function and class definitions across these scripts to get a sense of the scope—the CLI tools like analyze_experiment and archive_session_transcript have minimal exports, but the core modules like codex_engine, pipeline_orchestrate, and render_supermap contain substantial implementations with multiple classes and functions that would add significant weight to the reference list. Continuing through the second batch, I'm seeing pipeline_automate and pipeline_dashboard follow the same pattern as their autorun and orchestrate counterparts—each adding another 10-20 items to the total. The batch finishes with sync_knowledge_repo and memory_daily_linker, bringing that second set to around 120 items, which when combined with the first batch's 100 gives me roughly 220 additional nodes to account for.\n\nWith the 1,430 existing nodes, that puts us at about 1,650 total, but the warm load stays at noise floor regardless. So I'm going to implement a targeted script parser that focuses on CLI-facing scripts—those with argparse, click, or CLI-based function definitions—and creates reference nodes for each script, with function and class names as child nodes. I'll also add hook_reference nodes from the hooks directory for good measure, and fix the pi_tree_adapter tuple access bug.\n\nImplementing the script parsing method...","thinkingSignature":"031171c41a8eb86e7fa71e9b16461c01f0ae0735c4379982725bafe6b9a572b2"},{"type":"text","text":"Now I have full context. Let me implement a targeted change. The `scripts/` directory has 100+ Python CLI tools completely unparsed. I'll add `parse_scripts()` to the graph builder — lru_cache will absorb the parsing overhead (warm load stays at noise floor), while enriching the graph with ~150-200 more nodes.\n"},{"type":"toolCall","id":"call_function_mkkfrmaf8191_1","name":"read","arguments":{"path":"/home/ubuntu/.hermes/agi/graph_builder.py","offset":2425}}],"api":"anthropic-messages","provider":"minimax","model":"MiniMax-M2.7","usage":{"input":45721,"output":775,"cacheRead":10071,"cacheWrite":0,"totalTokens":56567,"cost":{"input":0.013716299999999999,"output":0.0009299999999999999,"cacheRead":0.0006042599999999999,"cacheWrite":0,"total":0.01525056}},"stopReason":"toolUse","timestamp":1777540445053,"responseId":"0642505d522398c08e3aafba9315155f"}}
{"type":"message","id":"182457c3","parentId":"6b9ad813","timestamp":"2026-04-30T09:14:28.199Z","message":{"role":"toolResult","toolCallId":"call_function_mkkfrmaf8191_1","toolName":"read","content":[{"type":"text","text":"    if os.path.exists(gitnexus_cache_file):\n        try:\n            gitnexus_hash = os.path.getsize(gitnexus_cache_file)\n        except Exception:\n            pass\n\n    # Try lru_cache first (no pickle.load) — bump _cache_ver to bust cache after code/data changes\n    try:\n        builder = _cached_build_builder(hermes_dir, agi_dir, gitnexus_hash, _cache_ver=11)\n        elapsed_ms = (time.perf_counter() - start) * 1000\n        return builder, elapsed_ms\n    except Exception:\n        pass\n\n    # Fallback: try pickle cache\n    init_cache(agi_dir)\n    cache_to_use = gitnexus_cache\n    builder = _try_load_graph_cache(agi_dir, {}, gitnexus_cache)\n    if builder is not None:\n        elapsed_ms = (time.perf_counter() - start) * 1000\n        return builder, elapsed_ms\n\n    # Cold build path\n    init_cache(agi_dir)\n    builder = GraphBuilder()\n\n    # Parse AGENTS.md\n    agents_md = os.path.join(hermes_dir, \"belam-codex\", \"AGENTS.md\")\n    builder.parse_agents_md(agents_md)\n\n    # Parse memory files (expanded to all 58)\n    memory_dir = os.path.join(hermes_dir, \"belam-codex\", \"memory\")\n    builder.parse_memory_files(memory_dir, limit=58)\n\n    # Parse schema files\n    schema_dir = os.path.join(hermes_dir, \"belam-codex\", \"schemas\")\n    builder.parse_schema_files(schema_dir)\n\n    # Parse decisions (all 128 files)\n    decisions_dir = os.path.join(hermes_dir, \"belam-codex\", \"decisions\")\n    if os.path.isdir(decisions_dir):\n        builder.parse_decisions(decisions_dir, limit=999)\n\n    # Parse lessons (all 208 files)\n    lessons_dir = os.path.join(hermes_dir, \"belam-codex\", \"lessons\")\n    if os.path.isdir(lessons_dir):\n        builder.parse_lessons(lessons_dir, limit=999)\n\n    # Parse tasks (expanded to all 84)\n    tasks_dir = os.path.join(hermes_dir, \"belam-codex\", \"tasks\")\n    if os.path.isdir(tasks_dir):\n        builder.parse_tasks(tasks_dir, limit=999)\n\n    # Parse goals (goal nodes with status/priority/urgency)\n    goals_dir = os.path.join(hermes_dir, \"belam-codex\", \"goals\")\n    if os.path.isdir(goals_dir):\n        builder.parse_goals(goals_dir)\n\n    # Parse agent roles (main, architect, builder, critic)\n    agents_dir = os.path.join(hermes_dir, \"belam-codex\", \"agents\")\n    if os.path.isdir(agents_dir):\n        builder.parse_agent_roles(agents_dir)\n\n    # Parse canvas graph (pre-computed cross-primitive causal edges)\n    canvas_dir = os.path.join(hermes_dir, \"belam-codex\", \"canvas\")\n    if os.path.isdir(canvas_dir):\n        builder.parse_canvas_graph(canvas_dir)\n\n    # Parse knowledge directory (semantic knowledge nodes with tag edges)\n    knowledge_dir = os.path.join(hermes_dir, \"belam-codex\", \"knowledge\")\n    if os.path.isdir(knowledge_dir):\n        builder.parse_knowledge(knowledge_dir)\n\n    # Parse skills directory (skill ecosystem with category/type nodes + related_skill edges)\n    skills_dir = os.path.join(hermes_dir, \"skills\")\n    if os.path.isdir(skills_dir):\n        builder.parse_skills(skills_dir)\n\n    # Parse handoff directory (agent handoff logs with TODO items)\n    handoff_dir = os.path.join(hermes_dir, \"belam-codex\", \"handoff\")\n    if os.path.isdir(handoff_dir):\n        builder.parse_handoff(handoff_dir)\n\n    # Parse archive/commands (38 command docs with upstream links to decision nodes)\n    archive_dir = os.path.join(hermes_dir, \"belam-codex\", \"archive\")\n    if os.path.isdir(archive_dir):\n        builder.parse_archive_commands(archive_dir)\n        builder.parse_archive_tasks(archive_dir)\n        builder.parse_codex_modules(archive_dir)\n\n    # Parse docs/ (operational guides with category and related edges)\n    docs_dir = os.path.join(hermes_dir, \"belam-codex\", \"docs\")\n    if os.path.isdir(docs_dir):\n        builder.parse_docs(docs_dir)\n\n    # Parse personas/ (agent archetype definitions)\n    personas_dir = os.path.join(hermes_dir, \"belam-codex\", \"personas\")\n    if os.path.isdir(personas_dir):\n        builder.parse_personas(personas_dir)\n\n    # Parse research/, projects/, modes/, runbooks/ directories\n    builder.parse_research_projects(hermes_dir)\n\n    # Parse pipelines/ (45+ pipeline specs with stage history, phase tracking)\n    pipelines_dir = os.path.join(hermes_dir, \"belam-codex\", \"pipelines\")\n    if os.path.isdir(pipelines_dir):\n        builder.parse_pipelines(pipelines_dir)\n\n    # Parse templates/ (pipeline stage templates with YAML definitions)\n    templates_dir = os.path.join(hermes_dir, \"belam-codex\", \"templates\")\n    if os.path.isdir(templates_dir):\n        builder.parse_templates(templates_dir)\n\n    # Bridge isolated clusters via shared tags\n    builder.build_tag_bridges(hermes_dir)\n\n    # Process gitnexus cache\n    global _gitnexus_cache\n    if cache_to_use is None:\n        cache_to_use = _gitnexus_cache\n    if use_gitnexus and cache_to_use is None:\n        gitnexus_dir = os.path.join(hermes_dir, \"belam-codex\", \".gitnexus\")\n        if os.path.isdir(gitnexus_dir):\n            cache_to_use = run_subprocess(\n                f\"cd {hermes_dir}/belam-codex && npx --yes gitnexus query --repo belam-codex 'symbol' 2>/dev/null || echo ''\",\n                timeout=15\n            )\n            _save_cache(cache_to_use)\n\n    builder.process_gitnexus_cache(cache_to_use)\n    builder.build_adjacency()\n    _save_graph_cache(agi_dir, builder, cache_to_use)\n\n    elapsed_ms = (time.perf_counter() - start) * 1000\n    return builder, elapsed_ms\n\n\nif __name__ == \"__main__\":\n    import sys\n    hermes = os.path.expanduser(\"~/.hermes\")\n    agi = os.path.dirname(os.path.abspath(__file__))\n\n    builder, elapsed = build_graph(hermes, agi)\n    stats = builder.get_stats()\n\n    print(f\"Graph build: {elapsed:.2f}ms\")\n    print(f\"Nodes: {stats['node_count']}\")\n    print(f\"Edges: {stats['edge_count']}\")\n    print(f\"Types: {stats['nodes_by_type']}\")\n"}],"isError":false,"timestamp":1777540468199}}
{"type":"message","id":"cd5d0af0","parentId":"182457c3","timestamp":"2026-04-30T09:14:37.684Z","message":{"role":"assistant","content":[{"type":"thinking","thinking":"Now I have the full picture. Let me implement the change:\n\n1. Add `parse_hooks()` method to GraphBuilder - parses the 3 hook definitions\n2. Add `parse_scripts()` method to GraphBuilder - parses ~100 Python scripts\n3. Add calls to both in `_cached_build_builder()` and the cold build path\n4. Bump `_cache_ver` from 11 to 12\n\nLet me also look at a few scripts to understand their structure better, so the parser is reasonable.","thinkingSignature":"b3da48c5491baef453d82c4d1a32590c47e238616476cc1b2216b45a213fa54c"},{"type":"text","text":"Now I'll implement the change: parse `hooks/` (3 hook defs) and `scripts/` (100+ Python tools) into the graph. Both are completely unparsed. lru_cache absorbs the parsing overhead.\n"},{"type":"toolCall","id":"call_function_nd8x5ouf4r15_1","name":"read","arguments":{"path":"/home/ubuntu/.hermes/belam-codex/scripts/run_experiment.py","limit":40}},{"type":"toolCall","id":"call_function_nd8x5ouf4r15_2","name":"read","arguments":{"path":"/home/ubuntu/.hermes/belam-codex/scripts/launch_pipeline.py","limit":40}}],"api":"anthropic-messages","provider":"minimax","model":"MiniMax-M2.7","usage":{"input":47995,"output":244,"cacheRead":10071,"cacheWrite":0,"totalTokens":58310,"cost":{"input":0.0143985,"output":0.00029279999999999996,"cacheRead":0.0006042599999999999,"cacheWrite":0,"total":0.01529556}},"stopReason":"toolUse","timestamp":1777540468200,"responseId":"06425074564ffe12606a9462c83a36da"}}
{"type":"message","id":"0bf551ef","parentId":"cd5d0af0","timestamp":"2026-04-30T09:14:37.686Z","message":{"role":"toolResult","toolCallId":"call_function_nd8x5ouf4r15_1","toolName":"read","content":[{"type":"text","text":"#!/usr/bin/env python3\n\"\"\"\nPipeline-aware experiment runner with builder agent supervision.\n\nInstead of mechanically executing notebooks and reactively fixing errors,\nthis spawns a builder agent to supervise the entire experiment lifecycle:\n\n  1. Builder reads the notebook and validates it can run\n  2. Builder creates a standalone runner script from the notebook\n  3. Builder runs experiments, fixing bugs as they occur\n  4. Builder creates lesson/decision primitives for significant findings\n  5. Builder reports completion with results summary\n\nFeatures:\n  - Proactive error handling via supervised builder agent\n  - Automatic primitive creation (lessons, decisions) from findings\n  - Pipeline stage auto-updates (start → running → complete/error)\n  - Checkpoint-and-resume on builder timeout\n  - Fallback to direct execution for simple cases\n\nUsage:\n    python3 scripts/run_experiment.py <version>                    # Supervised run\n    python3 scripts/run_experiment.py <version> --direct           # Skip builder, run directly\n    python3 scripts/run_experiment.py <version> --dry-run          # Quick validation\n    python3 scripts/run_experiment.py <version> --max-retries 3    # Builder resume attempts\n\"\"\"\n\nimport argparse\nimport json\nimport os\nimport subprocess\nimport sys\nimport time\nimport traceback\nfrom datetime import datetime, timezone\nfrom pathlib import Path\n\nWORKSPACE = Path(os.environ.get('WORKSPACE', os.path.expanduser('~/.openclaw/workspace')))\nSCRIPTS = WORKSPACE / 'scripts'\nBUILDS_DIR = WORKSPACE / 'pipeline_builds'\n\n[678 more lines in file. Use offset=41 to continue.]"}],"isError":false,"timestamp":1777540477686}}
{"type":"message","id":"f84bce07","parentId":"0bf551ef","timestamp":"2026-04-30T09:14:37.687Z","message":{"role":"toolResult","toolCallId":"call_function_nd8x5ouf4r15_2","toolName":"read","content":[{"type":"text","text":"#!/usr/bin/env python3\n\"\"\"\nImplementation Pipeline Launcher\n\nCreates a new pipeline instance from the template, sets up the build directory,\nand optionally kicks off the Phase 1 architect agent.\n\nUsage:\n    # Create pipeline with description:\n    python3 scripts/launch_pipeline.py v5 --desc \"Equilibrium streaming with opponent-coded output\"\n    \n    # Create with tags and priority:\n    python3 scripts/launch_pipeline.py v5 --desc \"...\" --priority critical --tags snn,equilibrium,streaming\n    \n    # Create and immediately start Phase 1 architect:\n    python3 scripts/launch_pipeline.py v5 --desc \"...\" --start\n    \n    # List active pipelines:\n    python3 scripts/launch_pipeline.py --list\n    \n    # Archive a completed pipeline:\n    python3 scripts/launch_pipeline.py v3 --archive\n    \n    # Check archival eligibility:\n    python3 scripts/launch_pipeline.py v4 --check-archive\n\"\"\"\n\nimport argparse\nimport json\nimport os\nimport re\nimport sys\nimport importlib.util\nfrom datetime import datetime, timezone\nfrom pathlib import Path\n\nWORKSPACE = Path(os.environ.get('WORKSPACE', os.path.expanduser('~/.openclaw/workspace')))\nPIPELINES_DIR = WORKSPACE / 'pipelines'\nFINANCE_DIR = WORKSPACE / 'machinelearning' / 'snn_applied_finance'\nBUILDS_DIR = FINANCE_DIR / 'research' / 'pipeline_builds'\n\n[691 more lines in file. Use offset=41 to continue.]"}],"isError":false,"timestamp":1777540477687}}
