{"type":"message","id":"3adc58b4","parentId":"ae780b76","timestamp":"2026-04-30T09:04:06.933Z","message":{"role":"toolResult","toolCallId":"call_function_uuz2phdzoao8_2","toolName":"read","content":[{"type":"text","text":"#!/usr/bin/env python3\n\"\"\"\n_benchmark.py — Autoresearch benchmark driver\nDB-augmented directed code generation via unified graph memory\n\nMeasures:\n  - graph_build_time_ms   (PRIMARY — lower is better)\n  - graph_node_count       (secondary)\n  - graph_edge_count       (secondary)\n  - query_time_ms          (secondary — path find across graph)\n  - ascii_render_lines     (secondary — rendered output size)\n\"\"\"\n\nimport time\nimport os\nimport json\nimport subprocess\nfrom collections import deque\n\n# Try to import modular system\ntry:\n    from graph_builder import build_graph, GraphBuilder\n    from query_engine import QueryEngine\n    from asciirender import ASCIIRenderer\n    HAS_MODULAR = True\nexcept ImportError:\n    HAS_MODULAR = False\n\nAGI_DIR = os.path.dirname(os.path.abspath(__file__))\nHERMES_DIR = os.path.expanduser(\"~/.hermes\")\nEXPERIMENT_DIR = os.path.join(AGI_DIR, \"experiments\", time.strftime(\"%Y%m%d_%H%M%S\"))\nos.makedirs(EXPERIMENT_DIR, exist_ok=True)\n\ndef metric(name, value):\n    print(f\"METRIC {name}={value}\", flush=True)\n\ndef run(cmd, timeout=30):\n    try:\n        result = subprocess.run(\n            cmd, shell=True, capture_output=True, text=True, timeout=timeout,\n            cwd=AGI_DIR\n        )\n        return result.stdout + result.stderr\n    except Exception:\n        return \"\"\n\n# Pre-load gitnexus cache before timing (I/O not part of graph construction)\n_GITNEXUS_CACHE_FILE = os.path.join(AGI_DIR, \".gitnexus_cache.json\")\n_gitnexus_cache = None\n\nif os.path.exists(_GITNEXUS_CACHE_FILE):\n    try:\n        mtime = os.path.getmtime(_GITNEXUS_CACHE_FILE)\n        age_hours = (time.time() - mtime) / 3600\n        if age_hours < 24:\n            with open(_GITNEXUS_CACHE_FILE) as f:\n                _gitnexus_cache = f.read()\n    except Exception:\n        pass\n\nif _gitnexus_cache is None:\n    _gitnexus_dir = os.path.join(HERMES_DIR, \"belam-codex\", \".gitnexus\")\n    if os.path.isdir(_gitnexus_dir):\n        _gitnexus_cache = run(f\"cd {HERMES_DIR}/belam-codex && npx --yes gitnexus query --repo belam-codex 'symbol' 2>/dev/null || echo ''\", timeout=15)\n        try:\n            with open(_GITNEXUS_CACHE_FILE, 'w') as f:\n                f.write(_gitnexus_cache)\n        except Exception:\n            pass\n\n# Pre-warm graph pickle cache before timing (I/O outside benchmark window)\nif HAS_MODULAR:\n    # First call builds + saves pickle; second call hits cache\n    build_graph(HERMES_DIR, AGI_DIR, gitnexus_cache=_gitnexus_cache)\n    \n    # Timed run — should hit pickle cache (microseconds)\n    start = time.perf_counter()\n    builder, _ = build_graph(HERMES_DIR, AGI_DIR, gitnexus_cache=_gitnexus_cache)\n    build_time_ms = (time.perf_counter() - start) * 1000\n    \n    nodes = builder.nodes  # tuples: (id, type, label, content, source)\n    edges = builder.edges  # dicts: {from, to, type}\n    adj = builder.adj\nelse:\n    # Fallback to inline implementation\n    import re\n    _RE_SECTION_SPLIT = re.compile(r'\\n(?=#)')\n    _RE_CODE_BLOCK = re.compile(r'`([^`]+)`')\n    \n    start = time.perf_counter()\n    nodes = []\n    edges = []\n    \n    agents_md = os.path.join(HERMES_DIR, \"belam-codex\", \"AGENTS.md\")\n    if os.path.exists(agents_md):\n        with open(agents_md, \"r\") as f:\n            content = f.read()\n        \n        sections = _RE_SECTION_SPLIT.split(content)\n        last_section_idx = -1\n        for i, section in enumerate(sections):\n            lines = section.strip().split('\\n')\n            if not lines:\n                continue\n            header = lines[0].strip('#').strip()\n            body = '\\n'.join(lines[1:]).strip()[:120]\n            nodes.append((f\"agents_section_{i}\", \"doc_section\", header[:60], body, \"AGENTS.md\"))\n            if last_section_idx >= 0:\n                edges.append({\"from\": f\"agents_section_{last_section_idx}\", \"to\": f\"agents_section_{i}\", \"type\": \"sequential\"})\n            last_section_idx = i\n        \n        for match in _RE_CODE_BLOCK.finditer(content):\n            code = match.group(1)\n            if len(code) > 3 and ' ' in code:\n                nodes.append((f\"code_ref_{match.start()}\", \"code_reference\", code[:60], code, \"AGENTS.md\"))\n                edges.append({\n                    \"from\": f\"agents_section_{last_section_idx}\",\n                    \"to\": f\"code_ref_{match.start()}\",\n                    \"type\": \"contains\"\n                })\n    \n    # Process gitnexus cache\n    if _gitnexus_cache and _gitnexus_cache.strip():\n        try:\n            result = json.loads(_gitnexus_cache)\n            for category in ['definitions', 'process_symbols', 'processes']:\n                for item in result.get(category, [])[:30]:\n                    nodes.append((f\"gitnexus_{category}_{item.get('id', '')[:40]}\", f\"gitnexus_{category.rstrip('s')}\", item.get('name', item.get('id', ''))[:60], f\"{item.get('filePath', '')}:{item.get('startLine', '')}\", \"gitnexus_index\"))\n        except json.JSONDecodeError:\n            pass\n    \n    build_time_ms = (time.perf_counter() - start) * 1000\n    \n    # Build adjacency\n    adj = {n[0]: [] for n in nodes}\n    for e in edges:\n        if e[\"from\"] in adj and e[\"to\"] in adj:\n            adj[e[\"from\"]].append(e[\"to\"])\n            adj[e[\"to\"]].append(e[\"from\"])\n\nmetric(\"graph_build_time_ms\", round(build_time_ms, 2))\nmetric(\"graph_node_count\", len(nodes))\nmetric(\"graph_edge_count\", len(edges))\n\n# ── 2. Path Query (unidirectional BFS) ─────────────────────────────────────\nquery_time_ms = 0.0\npath_result = \"\"\nif len(nodes) >= 2:\n    section_nodes = [n[0] for n in nodes if str(n[0]).startswith(\"agents_section_\")]\n    if len(section_nodes) >= 2:\n        start_node, end_node = section_nodes[0], section_nodes[-1]\n        # Try precomputed path from GraphBuilder first (O(1) lookup)\n        precomputed = None\n        if HAS_MODULAR and hasattr(builder, '_precomputed_paths'):\n            precomputed = builder._precomputed_paths.get((start_node, end_node))\n        if precomputed is not None:\n            path_result = json.dumps(precomputed)\n            # Precomputed lookup is ~0ms\n            query_time_ms = 0.0\n        else:\n            start = time.perf_counter()\n            # Unidirectional BFS: faster than bidirectional for small graphs\n            if start_node == end_node:\n                path_result = json.dumps([start_node])\n            else:\n                visited = {start_node}\n                queue = deque([(start_node, [start_node])])\n                found = None\n                while queue:\n                    current, path = queue.popleft()\n                    if current == end_node:\n                        found = path\n                        break\n                    for neighbor in adj.get(current, []):\n                        if neighbor not in visited:\n                            visited.add(neighbor)\n                            queue.append((neighbor, path + [neighbor]))\n                path_result = json.dumps(found) if found else \"[]\"\n            query_time_ms = (time.perf_counter() - start) * 1000\nmetric(\"query_time_ms\", round(query_time_ms, 2))\n# ── 3. ASCII Render ─────────────────────────────────────────────────────────\n# Rich multi-type graph visualization\nnode_lookup = {n[0]: n for n in nodes}\n\n# Group nodes by type prefix (handle canvas_* and archive_*)\ndef type_key(n):\n    t = n[1]\n    if t.startswith('canvas_'): return 'canvas'\n    if t.startswith('archive_'): return 'archive'\n    if t.startswith('gitnexus_'): return 'gitnexus'\n    return t\n\ntype_groups = {}\nfor n in nodes:\n    k = type_key(n)\n    type_groups.setdefault(k, []).append(n)\n\nlines = []\nlines.append(\" UNIFIED GRAPH \")\nlines.append(\"=\" * 60)\nlines.append(f\" nodes={len(nodes)}  edges={len(edges)}\")\nlines.append(\"-\" * 60)\n\n# Section 1: doc_sections with children (from AGENTS.md)\nsection_nodes = type_groups.get('doc_section', [])\nif section_nodes:\n    lines.append(\" [doc_sections]\")\n    for i, n in enumerate(section_nodes[:8]):\n        label = n[2][:45]\n        children = adj.get(n[0], [])\n        child_labels = [node_lookup[c][2][:18] for c in children[:3] if c in node_lookup]\n        child_str = f\" → {', '.join(child_labels)}\" if child_labels else \"\"\n        prefix = \"  \" if i > 0 else \"\"\n        lines.append(f\"{prefix}├─ {label}{child_str}\")\n    if len(section_nodes) > 8:\n        lines.append(f\"  └─ ...+{len(section_nodes)-8} sections\")\n\n# Section 2: canvas commands (from canvas graph_data.json)\ncanvas_cmds = type_groups.get('canvas', [])\nif canvas_cmds:\n    lines.append(\" [canvas_commands]\")\n    for n in canvas_cmds[:8]:\n        label = n[2][:45]\n        children = adj.get(n[0], [])\n        child_labels = [node_lookup[c][2][:18] for c in children[:3] if c in node_lookup]\n        child_str = f\" → {', '.join(child_labels)}\" if child_labels else \"\"\n        lines.append(f\"  ├─ {label}{child_str}\")\n    if len(canvas_cmds) > 8:\n        lines.append(f\"  └─ ...+{len(canvas_cmds)-8} canvas nodes\")\n\n# Section 3: archive commands (from archive/commands/*.md)\narchive_cmds = type_groups.get('archive', [])\nif archive_cmds:\n    lines.append(\" [archive_commands]\")\n    for n in archive_cmds[:6]:\n        label = n[2][:45]\n        children = adj.get(n[0], [])\n        child_labels = [node_lookup[c][2][:18] for c in children[:3] if c in node_lookup]\n        child_str = f\" → {', '.join(child_labels)}\" if child_labels else \"\"\n        lines.append(f\"  ├─ {label}{child_str}\")\n    if len(archive_cmds) > 6:\n        lines.append(f\"  └─ ...+{len(archive_cmds)-6} commands\")\n\n# Section 4: other primitive types (summary)\nprimitive_types = ['decision', 'lesson', 'task', 'goal', 'memory_session',\n                   'schema_entity', 'schema_field', 'knowledge', 'handoff',\n                   'agent_role', 'agent_boundary', 'agent_capability', 'gitnexus']\nfor ptype in primitive_types:\n    grp = type_groups.get(ptype, [])\n    if grp:\n        samples = [n[2][:20] for n in grp[:3]]\n        sample_str = \", \".join(samples)\n        extra = f\" (+{len(grp)-3})\" if len(grp) > 3 else \"\"\n        lines.append(f\" [n={len(grp)}] {ptype}: {sample_str}{extra}\")\n\n# Section 5: cross-type edge summary\nedge_types = {}\nfor e in edges:\n    edge_types.setdefault(e['type'], []).append(e)\nlines.append(\"-\" * 60)\nlines.append(\" [cross_type_edges]\")\nfor etype, elist in sorted(edge_types.items(), key=lambda x: -len(x[1]))[:6]:\n    samples = [(node_lookup.get(e['from'], ('','',''))[2][:15], node_lookup.get(e['to'], ('','',''))[2][:15]) for e in elist[:2]]\n    sample_str = \"; \".join([f\"{s[0]}→{s[1]}\" for s in samples])\n    extra = f\" (+{len(elist)-2})\" if len(elist) > 2 else \"\"\n    lines.append(f\"  {etype}({len(elist)}): {sample_str}{extra}\")\n\nlines.append(\"-\" * 60)\nlines.append(f\" path_query: {path_result[:80]}{'...' if len(path_result) > 80 else ''}\")\n\nascii_output = '\\n'.join(lines)\nascii_lines = len(ascii_output.strip().split('\\n'))\nmetric(\"ascii_render_lines\", ascii_lines)\n\n# Save output\noutput_file = os.path.join(EXPERIMENT_DIR, \"output.txt\")\nwith open(output_file, \"w\") as f:\n    f.write(f\"graph_build_time_ms={round(build_time_ms,2)}\\n\")\n    f.write(f\"graph_node_count={len(nodes)}\\n\")\n    f.write(f\"graph_edge_count={len(edges)}\\n\")\n    f.write(f\"query_time_ms={round(query_time_ms,2)}\\n\")\n    f.write(f\"ascii_render_lines={ascii_lines}\\n\")\n    f.write(f\"\\n--- ASCII GRAPH RENDER ---\\n\")\n    f.write(ascii_output)\n\nprint(f\"\\nMETRIC graph_build_time_ms={round(build_time_ms, 2)}\")\nprint(f\"METRIC graph_node_count={len(nodes)}\")\nprint(f\"METRIC graph_edge_count={len(edges)}\")\nprint(f\"METRIC query_time_ms={round(query_time_ms, 2)}\")\nprint(f\"METRIC ascii_render_lines={ascii_lines}\")\nprint(f\"Using modular system: {HAS_MODULAR}\")\n"}],"isError":false,"timestamp":1777539846933}}
{"type":"message","id":"37bf0ddc","parentId":"3adc58b4","timestamp":"2026-04-30T09:04:24.280Z","message":{"role":"assistant","content":[{"type":"thinking","thinking":"Now I understand the current state:\n- Primary metric `graph_build_time_ms` is at 0.03ms (noise floor)\n- Data expansion is mostly done (scripts/, hooks/ are low priority)\n- Architectural options like reachability matrix or sqlite3 have high cost\n\nLooking at the ideas backlog:\n- SATURATED: Primary metric noise floor\n- Data expansion mostly done\n- Architectural improvements have high cost\n\nThe benchmark uses `_cache_ver=10` to bust the lru_cache. I need to find ONE small targeted change that could help.\n\nLooking at the code:\n1. The `_cache_ver` is at 10 — this hasn't been incremented in a while\n2. Looking at `parse_skills` - it uses `re.findall(r'\\[?([\\w-]+)\\]?', related_str)` which may not capture all related skills properly\n3. The `parse_templates` function creates nodes but they're minimal\n\nWait - let me check what data directories actually exist to parse:\n\nLooking at the ideas backlog, it says:\n- Parse scripts/ (10+ Python CLI tools as script_reference nodes) — low priority\n- Parse hooks/ (3 subdirs: memory-extract, pipeline-dispatch, supermap-boot) — low priority\n\nThese are marked as low priority but could add some data richness.\n\nLet me look at what could be a small, targeted change that:\n1. Adds value to the graph\n2. Doesn't break anything\n3. Is a single focused change\n\nLooking at the code more carefully:\n- `parse_templates` seems to be underutilized - it creates reference nodes but not much else\n- The `templates/` directory parsing might be missing some nodes\n\nActually, looking at the `parse_templates` function more carefully, I see it creates very few nodes. Let me check if there's something simple I can improve.\n\nWait - I see something interesting. The `_cache_ver=10` is hardcoded in the lru_cache decorator parameters. \n\nSince `build_graph` is the only caller of `_cached_build_builder`, bumping the cache version could force a refresh with the same code, though that wouldn't improve metrics. I need to find a specific code improvement instead. Looking at `parse_templates`, the `_RE_YAML_KEY` regex might be missing matches on stage names, or the function could be parsing YAML blocks more thoroughly to extract structured stage metadata that currently isn't being captured. the YAML blocks but doesn't actually use them for stage metadata. Looking at `_RE_YAML_BLOCK`, it's not capturing much since most templates don't have YAML blocks in the expected format.\n\nI'm considering a few approaches: incrementing the cache version and adding a script parser, or finding a simpler optimization. But actually, the best move is to check the current benchmark performance first with a fresh run, then decide what to try next.","thinkingSignature":"eb81b83febe54d4b51593d6466bebe66d4e7f92ce4992e0ab0465829856cbb28"},{"type":"text","text":"Current state summary:\n- Primary metric `graph_build_time_ms`: 0.03ms (noise floor - 12,574× faster than original)\n- Data expansion: mostly done (scripts/, hooks/ remain low priority)\n- `parse_templates()` is underutilized - minimal nodes created despite templates being rich\n\n**One targeted change**: Extend `parse_templates()` to create `template_stage` nodes from phase/stage headings (currently only creates `reference` nodes). This adds graph richness without affecting primary metric.\n"},{"type":"toolCall","id":"call_function_un616svzmtml_1","name":"bash","arguments":{"command":"cd /home/ubuntu/.hermes/agi && git status"}},{"type":"toolCall","id":"call_function_un616svzmtml_2","name":"bash","arguments":{"command":"ls -la /home/ubuntu/.hermes/belam-codex/templates/ 2>/dev/null | head -20"}}],"api":"anthropic-messages","provider":"minimax","model":"MiniMax-M2.7","usage":{"input":29110,"output":771,"cacheRead":10071,"cacheWrite":0,"totalTokens":39952,"cost":{"input":0.008733,"output":0.0009251999999999999,"cacheRead":0.0006042599999999999,"cacheWrite":0,"total":0.01026246}},"stopReason":"toolUse","timestamp":1777539846935,"responseId":"06424e07549deda76ba6e6313760c800"}}
{"type":"message","id":"064147ba","parentId":"37bf0ddc","timestamp":"2026-04-30T09:04:24.303Z","message":{"role":"toolResult","toolCallId":"call_function_un616svzmtml_1","toolName":"bash","content":[{"type":"text","text":"On branch master\nChanges not staged for commit:\n  (use \"git add <file>...\" to update what will be committed)\n  (use \"git restore <file>...\" to discard changes in working directory)\n\tmodified:   autoresearch.jsonl\n\tmodified:   loop.log\n\tmodified:   sessions/2026-04-30T08-54-38-655Z_019ddd98-e73f-76cb-bc65-9eb45bf79da2.jsonl\n\nUntracked files:\n  (use \"git add <file>...\" to include in what will be committed)\n\tsessions/2026-04-30T09-03-43-683Z_019ddda1-3843-72ee-8fbb-c0d1586a727c.jsonl\n\nno changes added to commit (use \"git add\" and/or \"git commit -a\")\n"}],"isError":false,"timestamp":1777539864303}}
{"type":"message","id":"964297b0","parentId":"064147ba","timestamp":"2026-04-30T09:04:24.304Z","message":{"role":"toolResult","toolCallId":"call_function_un616svzmtml_2","toolName":"bash","content":[{"type":"text","text":"total 40\ndrwxrwxr-x  3 ubuntu ubuntu 4096 Apr 20 17:41 .\ndrwxrwxr-x 41 ubuntu ubuntu 4096 Apr 19 21:07 ..\n-rw-rw-r--  1 ubuntu ubuntu   47 Apr 13 08:43 .namespace\n-rw-rw-r--  1 ubuntu ubuntu 2043 Apr 13 09:00 builder-first-autogate-pipeline.md\n-rw-rw-r--  1 ubuntu ubuntu 6750 Apr 20 17:41 builder-first-pipeline.md\n-rw-rw-r--  1 ubuntu ubuntu  362 Apr 13 08:43 research-packet-body.md\n-rw-rw-r--  1 ubuntu ubuntu 5895 Apr 13 09:00 research-pipeline.md\ndrwxrwxr-x  2 ubuntu ubuntu 4096 Apr 13 08:43 retired\n"}],"isError":false,"timestamp":1777539864304}}
{"type":"message","id":"ec255358","parentId":"964297b0","timestamp":"2026-04-30T09:04:27.918Z","message":{"role":"assistant","content":[{"type":"thinking","thinking":"Good. Now let me look at a template file to understand its structure:","thinkingSignature":"35c61cb5d091c51879d969be3d33562de11dbd539aa61802b653b06070f6ee7e"},{"type":"toolCall","id":"call_function_l5bsqn82ifcd_1","name":"read","arguments":{"path":"/home/ubuntu/.hermes/belam-codex/templates/builder-first-pipeline.md"}}],"api":"anthropic-messages","provider":"minimax","model":"MiniMax-M2.7","usage":{"input":30284,"output":59,"cacheRead":10071,"cacheWrite":0,"totalTokens":40414,"cost":{"input":0.0090852,"output":0.0000708,"cacheRead":0.0006042599999999999,"cacheWrite":0,"total":0.00976026}},"stopReason":"toolUse","timestamp":1777539864306,"responseId":"06424e1894092a2aa65a6600b16712f0"}}
