{"type":"message","id":"51ef9cec","parentId":"dcc5674d","timestamp":"2026-04-30T09:07:11.086Z","message":{"role":"toolResult","toolCallId":"call_function_qp53pvrau5el_1","toolName":"edit","content":[{"type":"text","text":"Successfully replaced 1 block(s) in /home/ubuntu/.hermes/agi/graph_builder.py."}],"details":{"diff":"      ...\n 1695             for yb in yaml_blocks:\n 1696                 yaml_content = yb.group(1)\n 1697                 lines = yaml_content.split('\\n')\n 1698                 cur_phase = None\n-1699                 cur_indent = 0\n 1700                 in_stages = False\n-1701                 stage_lines = []  # collect lines for current stage\n 1702                 \n-1703                 for yline in lines:\n-1704                     # Track indentation and content\n-1705                     indent_match = re.match(r'^(\\s*)(.*)', yline)\n-1706                     indent = len(indent_match.group(1)) if indent_match else 0\n-1707                     stripped = indent_match.group(2) if indent_match else ''\n+1701                 for i, yline in enumerate(lines):\n+1702                     stripped = yline.strip()\n 1708                     \n 1709                     # Track phases nested under 'phases:'\n 1710                     if stripped.startswith('phase') and ':' in stripped:\n 1711                         phase_key = stripped.split(':')[0].strip()\n 1712                         if phase_key in ('phase1', 'phase2', 'phase3'):\n 1713                             cur_phase = phase_key\n 1714                             in_stages = False\n-1715                             stage_lines = []\n-1716                             cur_indent = indent\n 1717                     \n 1718                     # Detect stages section\n-1719                     if stripped.startswith('stages:') and indent > cur_indent:\n+1712                     if stripped.startswith('stages:'):\n 1720                         in_stages = True\n 1721                         continue\n 1722                     \n-1723                     # Parse stage definitions (lines starting with '- role:')\n+1716                     # Parse stage definitions: collect multi-line until next '- role:'\n 1724                     if in_stages and stripped.startswith('- role:'):\n-1725                         role = stripped.split('role:')[1].strip().split()[0] if 'role:' in stripped else ''\n-1726                         # Collect rest of this stage's config\n+1718                         role = stripped.split('role:')[1].strip().split()[0]\n+1719                         # Collect continuation lines until next '- role:' or end\n 1727                         stage_lines = [stripped]\n-1728                         stage_indent = indent\n-1729                     elif in_stages and stage_lines and indent > stage_indent:\n-1730                         # Continuation of stage config\n-1731                         stage_lines.append(stripped)\n-1732                     elif in_stages and stage_lines and indent <= stage_indent and stripped:\n-1733                         # New stage or different section - process previous\n+1721                         j = i + 1\n+1722                         while j < len(lines):\n+1723                             next_stripped = lines[j].strip()\n+1724                             if next_stripped.startswith('- role:') or (next_stripped and not next_stripped.startswith(' ') and not next_stripped.startswith('-')):\n+1725                                 break\n+1726                             if next_stripped:\n+1727                                 stage_lines.append(next_stripped)\n+1728                             j += 1\n+1729                         \n 1734                         full_stage = '\\n'.join(stage_lines)\n 1735                         action_match = re.search(r'action:\\s*(\\w+)', full_stage)\n 1736                         session_match = re.search(r'session:\\s*(\\w+)', full_stage)\n 1737                         cli_match = re.search(r'cli:\\s*(\\w+)', full_stage)\n      ...\n 1745                                 'session': session_match.group(1) if session_match else '',\n 1746                                 'cli': cli_match.group(1) if cli_match else '',\n 1747                                 'phase': cur_phase\n 1748                             }\n-1749                         # Reset for new stage\n-1750                         role = stripped.split('role:')[1].strip().split()[0] if '- role:' in stripped else role\n-1751                         stage_lines = [stripped] if '- role:' in stripped else []\n-1752                         stage_indent = indent\n-1753                 \n-1754                 # Process final stage in block\n-1755                 if stage_lines and role and cur_phase:\n-1756                     full_stage = '\\n'.join(stage_lines)\n-1757                     action_match = re.search(r'action:\\s*(\\w+)', full_stage)\n-1758                     session_match = re.search(r'session:\\s*(\\w+)', full_stage)\n-1759                     cli_match = re.search(r'cli:\\s*(\\w+)', full_stage)\n-1760                     action = action_match.group(1) if action_match else ''\n-1761                     stage_key = f\"p{cur_phase[-1]}_{role}_{action}\"\n-1762                     stage_meta[stage_key] = {\n-1763                         'role': role,\n-1764                         'action': action,\n-1765                         'session': session_match.group(1) if session_match else '',\n-1766                         'cli': cli_match.group(1) if cli_match else '',\n-1767                         'phase': cur_phase\n-1768                     }\n 1769 \n 1770             # Extract phase + stage hierarchy from markdown headings\n 1771             current_phase = None\n 1772             current_stage = None\n      ...","firstChangedLine":1699},"isError":false,"timestamp":1777540031086}}
{"type":"message","id":"e700a284","parentId":"51ef9cec","timestamp":"2026-04-30T09:07:20.213Z","message":{"role":"assistant","content":[{"type":"thinking","thinking":"Now let me test the YAML parsing again:","thinkingSignature":"6bd0c7acb20cba9e87d13f94db0d4dcc0bd3b847e0bf798f50f20eab4606670d"},{"type":"toolCall","id":"call_function_ccsfam43aiia_1","name":"bash","arguments":{"command":"cd /home/ubuntu/.hermes/agi && python3 -c \"\nimport re\ncontent = open('/home/ubuntu/.hermes/belam-codex/templates/builder-first-pipeline.md').read()\n_RE_YAML_BLOCK = re.compile(r'\\`\\`\\`yaml\\n(.*?)\\n\\`\\`\\`', re.DOTALL)\nblocks = list(_RE_YAML_BLOCK.finditer(content))\n\nstage_meta = {}\nfor yb in blocks:\n    yaml_content = yb.group(1)\n    lines = yaml_content.split('\\n')\n    cur_phase = None\n    in_stages = False\n    \n    for i, yline in enumerate(lines):\n        stripped = yline.strip()\n        \n        if stripped.startswith('phase') and ':' in stripped:\n            phase_key = stripped.split(':')[0].strip()\n            if phase_key in ('phase1', 'phase2', 'phase3'):\n                cur_phase = phase_key\n                in_stages = False\n        \n        if stripped.startswith('stages:'):\n            in_stages = True\n            continue\n        \n        if in_stages and stripped.startswith('- role:'):\n            role = stripped.split('role:')[1].strip().split()[0]\n            stage_lines = [stripped]\n            j = i + 1\n            while j < len(lines):\n                next_stripped = lines[j].strip()\n                if next_stripped.startswith('- role:') or (next_stripped and not next_stripped.startswith(' ') and not next_stripped.startswith('-')):\n                    break\n                if next_stripped:\n                    stage_lines.append(next_stripped)\n                j += 1\n            \n            full_stage = '\\n'.join(stage_lines)\n            action_match = re.search(r'action:\\s*(\\w+)', full_stage)\n            if role and cur_phase:\n                action = action_match.group(1) if action_match else ''\n                stage_key = f\\\"p{cur_phase[-1]}_{role}_{action}\\\"\n                stage_meta[stage_key] = {'role': role, 'action': action, 'phase': cur_phase}\n\nprint(f'Parsed {len(stage_meta)} stages:')\nfor k, v in sorted(stage_meta.items()):\n    print(f'  {k}: {v}')\n\""}}],"api":"anthropic-messages","provider":"minimax","model":"MiniMax-M2.7","usage":{"input":43174,"output":506,"cacheRead":10071,"cacheWrite":0,"totalTokens":53751,"cost":{"input":0.012952199999999999,"output":0.0006072,"cacheRead":0.0006042599999999999,"cacheWrite":0,"total":0.01416366}},"stopReason":"toolUse","timestamp":1777540031088,"responseId":"06424ebf4e71b1023a8f8a4cb8d48734"}}
{"type":"message","id":"33accc04","parentId":"e700a284","timestamp":"2026-04-30T09:07:20.252Z","message":{"role":"toolResult","toolCallId":"call_function_ccsfam43aiia_1","toolName":"bash","content":[{"type":"text","text":"Parsed 8 stages:\n  p1_builder_: {'role': 'builder', 'action': '', 'phase': 'phase1'}\n  p1_critic_: {'role': 'critic', 'action': '', 'phase': 'phase1'}\n  p2_architect_: {'role': 'architect', 'action': '', 'phase': 'phase2'}\n  p2_builder_: {'role': 'builder', 'action': '', 'phase': 'phase2'}\n  p2_critic_: {'role': 'critic', 'action': '', 'phase': 'phase2'}\n  p3_architect_: {'role': 'architect', 'action': '', 'phase': 'phase3'}\n  p3_builder_: {'role': 'builder', 'action': '', 'phase': 'phase3'}\n  p3_critic_: {'role': 'critic', 'action': '', 'phase': 'phase3'}\n"}],"isError":false,"timestamp":1777540040252}}
{"type":"message","id":"a611fefc","parentId":"33accc04","timestamp":"2026-04-30T09:07:26.762Z","message":{"role":"assistant","content":[{"type":"thinking","thinking":"Good progress! The stages are being detected but `action` is empty. Let me look at why. The issue is that `action:` might not be captured because of how I'm collecting lines. Let me debug further:","thinkingSignature":"e9345882a3ea572acac43771a3444211979914dbca825dfc07d7f6dbd7069b0f"},{"type":"text","text":"Action is empty - let me debug the stage line collection:\n"},{"type":"toolCall","id":"call_function_u7wze49rmj0q_1","name":"bash","arguments":{"command":"cd /home/ubuntu/.hermes/agi && python3 -c \"\ncontent = open('/home/ubuntu/.hermes/belam-codex/templates/builder-first-pipeline.md').read()\n# Find the stages section\nidx = content.find('phase1:')\nif idx > 0:\n    section = content[idx:idx+2000]\n    print('=== YAML section ===')\n    print(section[:800])\n\""}}],"api":"anthropic-messages","provider":"minimax","model":"MiniMax-M2.7","usage":{"input":43885,"output":168,"cacheRead":10071,"cacheWrite":0,"totalTokens":54124,"cost":{"input":0.0131655,"output":0.0002016,"cacheRead":0.0006042599999999999,"cacheWrite":0,"total":0.01397136}},"stopReason":"toolUse","timestamp":1777540040254,"responseId":"06424ec8a77f47757ea789af25d938b2"}}
{"type":"message","id":"8dbf3132","parentId":"a611fefc","timestamp":"2026-04-30T09:07:26.800Z","message":{"role":"toolResult","toolCallId":"call_function_u7wze49rmj0q_1","toolName":"bash","content":[{"type":"text","text":"=== YAML section ===\nphase1:\n    humangate: true\n    stages:\n      - role: builder\n        action: implement\n        session: fresh\n        cli: claude\n        context: [persona-builder, supermap, cockpit, cavekit]\n      - role: builder\n        action: bugfix\n        session: continue\n        cli: claude\n        context: [persona-builder, supermap, cockpit, cavekit]\n      - role: critic\n        action: review\n        session: fresh\n        cli: codex\n        context: [persona-critic, supermap]\n\n  phase2:\n    humangate: true\n    stages:\n      - role: architect\n        action: design\n        session: fresh\n        cli: claude\n        context: [persona-architect, supermap, cockpit, cavekit]\n      - role: builder\n        action: implement\n        session: fresh\n        cli: claude\n        context: [persona-builder\n"}],"isError":false,"timestamp":1777540046800}}
{"type":"message","id":"1b1b49f6","parentId":"8dbf3132","timestamp":"2026-04-30T09:07:36.300Z","message":{"role":"assistant","content":[{"type":"thinking","thinking":"I see - the `action:` line has more indentation than `- role:` (2 spaces vs 4 spaces). My current logic breaks when it sees the next line starting with a space and not `- role:`.\n\nActually looking more carefully, the issue is that my condition `if next_stripped.startswith('- role:') or (next_stripped and not next_stripped.startswith(' ') and not next_stripped.startswith('-'))` is wrong. When I encounter `action: implement` it doesn't start with `- role:` but it also starts with a space, so it gets included.\n\nWait, actually I think the issue is that `action:` lines ARE being collected but then the regex `action:\\s*(\\w+)` is not matching because the content might have extra characters or something.\n\nLet me debug:","thinkingSignature":"540caea3371e29460c733561716c6a09d9e9ecba8cd7723e007c223a516f9af3"},{"type":"toolCall","id":"call_function_9pn7688yewn7_1","name":"bash","arguments":{"command":"cd /home/ubuntu/.hermes/agi && python3 -c \"\nlines = [\n    '      - role: builder',\n    '        action: implement',\n    '        session: fresh',\n    '        cli: claude',\n    '        context: [persona-builder, supermap, cockpit, cavekit]',\n    '      - role: builder'\n]\nrole = lines[0].split('role:')[1].strip().split()[0]\nprint(f'Role: {role}')\nstage_lines = lines[:5]\nfull_stage = '\\n'.join(stage_lines)\nprint('Full stage:')\nprint(full_stage)\nprint()\naction_match = __import__('re').search(r'action:\\s*(\\w+)', full_stage)\nprint(f'Action match: {action_match}')\n\""}}],"api":"anthropic-messages","provider":"minimax","model":"MiniMax-M2.7","usage":{"input":44279,"output":356,"cacheRead":10071,"cacheWrite":0,"totalTokens":54706,"cost":{"input":0.013283699999999999,"output":0.0004272,"cacheRead":0.0006042599999999999,"cacheWrite":0,"total":0.014315159999999999}},"stopReason":"toolUse","timestamp":1777540046803,"responseId":"06424ecfa345f6846865069cb0459699"}}
{"type":"message","id":"e0d486ee","parentId":"1b1b49f6","timestamp":"2026-04-30T09:07:36.339Z","message":{"role":"toolResult","toolCallId":"call_function_9pn7688yewn7_1","toolName":"bash","content":[{"type":"text","text":"Role: builder\nFull stage:\n      - role: builder\n        action: implement\n        session: fresh\n        cli: claude\n        context: [persona-builder, supermap, cockpit, cavekit]\n\nAction match: <re.Match object; span=(30, 47), match='action: implement'>\n"}],"isError":false,"timestamp":1777540056339}}
{"type":"message","id":"f6ec42c4","parentId":"e0d486ee","timestamp":"2026-04-30T09:07:43.115Z","message":{"role":"assistant","content":[{"type":"thinking","thinking":"So the parsing works when I test it directly. The issue must be in my loop condition. Let me check more carefully - the issue might be that I'm breaking too early or not collecting lines correctly. Let me trace through the actual code flow:","thinkingSignature":"dc2733b707d2aa99b40e5e430eb5138cc82462db99e721c6c8068646f5a03a71"},{"type":"toolCall","id":"call_function_s6d4fyda6hta_1","name":"bash","arguments":{"command":"cd /home/ubuntu/.hermes/agi && python3 -c \"\nimport re\ncontent = open('/home/ubuntu/.hermes/belam-codex/templates/builder-first-pipeline.md').read()\n_RE_YAML_BLOCK = re.compile(r'\\`\\`\\`yaml\\n(.*?)\\n\\`\\`\\`', re.DOTALL)\nblocks = list(_RE_YAML_BLOCK.finditer(content))\n\nyaml_content = blocks[0].group(1)\nlines = yaml_content.split('\\n')\n\n# Find where phase1 starts and trace\nfor i, line in enumerate(lines):\n    if 'phase1:' in line:\n        print(f'Line {i}: {repr(line)}')\n        # Print next 15 lines\n        for j in range(i, min(i+15, len(lines))):\n            print(f'  {j}: {repr(lines[j])}')\n        break\n\""}}],"api":"anthropic-messages","provider":"minimax","model":"MiniMax-M2.7","usage":{"input":44716,"output":258,"cacheRead":10071,"cacheWrite":0,"totalTokens":55045,"cost":{"input":0.0134148,"output":0.0003096,"cacheRead":0.0006042599999999999,"cacheWrite":0,"total":0.01432866}},"stopReason":"toolUse","timestamp":1777540056341,"responseId":"06424ed8463c3f686c39dd1aeea486c3"}}
{"type":"message","id":"4b4ed34c","parentId":"f6ec42c4","timestamp":"2026-04-30T09:07:43.154Z","message":{"role":"toolResult","toolCallId":"call_function_s6d4fyda6hta_1","toolName":"bash","content":[{"type":"text","text":"Line 20: '  phase1:'\n  20: '  phase1:'\n  21: '    humangate: true'\n  22: '    stages:'\n  23: '      - role: builder'\n  24: '        action: implement'\n  25: '        session: fresh'\n  26: '        cli: claude'\n  27: '        context: [persona-builder, supermap, cockpit, cavekit]'\n  28: '      - role: builder'\n  29: '        action: bugfix'\n  30: '        session: continue'\n  31: '        cli: claude'\n  32: '        context: [persona-builder, supermap, cockpit, cavekit]'\n  33: '      - role: critic'\n  34: '        action: review'\n"}],"isError":false,"timestamp":1777540063154}}
{"type":"message","id":"7a9957ad","parentId":"4b4ed34c","timestamp":"2026-04-30T09:07:59.211Z","message":{"role":"assistant","content":[{"type":"thinking","thinking":"I see the issue! The line `  phase1:` has 2 leading spaces, so my check `stripped.startswith('phase') and ':' in stripped` should match `phase1:`. But then when I check for `in_stages`, the `stages:` is at indent > 0 so `in_stages` becomes True.\n\nBut then when I look for `- role:` at line 23, my condition might not be matching. Let me trace through more carefully:\n- Line 22: `    stages:` → stripped = `stages:`, matches, so `in_stages = True`\n- Line 23: `      - role: builder` → stripped = `- role: builder`, matches, role = `builder`\n\nNow when I try to collect continuation lines (lines 24-27), the condition `not next_stripped.startswith(' ') and not next_stripped.startswith('-')` is FALSE because `action: implement` DOES start with a space. So it should be included.\n\nLet me test the full flow:","thinkingSignature":"34922f220d3ac474dcebb7b206cb4b8fadfd9fc808edda5d01080290cd92f0cc"},{"type":"toolCall","id":"call_function_0qu1a5pih3a6_1","name":"bash","arguments":{"command":"cd /home/ubuntu/.hermes/agi && python3 -c \"\nimport re\ncontent = open('/home/ubuntu/.hermes/belam-codex/templates/builder-first-pipeline.md').read()\n_RE_YAML_BLOCK = re.compile(r'\\`\\`\\`yaml\\n(.*?)\\n\\`\\`\\`', re.DOTALL)\nblocks = list(_RE_YAML_BLOCK.finditer(content))\n\nyaml_content = blocks[0].group(1)\nlines = yaml_content.split('\\n')\n\ncur_phase = None\nin_stages = False\nstage_meta = {}\n\nfor i, yline in enumerate(lines):\n    stripped = yline.strip()\n    \n    # Track phases\n    if stripped.startswith('phase') and ':' in stripped:\n        phase_key = stripped.split(':')[0].strip()\n        if phase_key in ('phase1', 'phase2', 'phase3'):\n            cur_phase = phase_key\n            in_stages = False\n            print(f'Set cur_phase={cur_phase}')\n    \n    # Detect stages section\n    if stripped.startswith('stages:'):\n        in_stages = True\n        print(f'Stages section started at line {i}')\n        continue\n    \n    # Parse stage definitions\n    if in_stages and stripped.startswith('- role:'):\n        role = stripped.split('role:')[1].strip().split()[0]\n        print(f'Found stage at line {i}: role={role}, cur_phase={cur_phase}')\n        stage_lines = [stripped]\n        j = i + 1\n        while j < len(lines):\n            next_stripped = lines[j].strip()\n            print(f'  Checking line {j}: {repr(next_stripped)[:40]}')\n            if next_stripped.startswith('- role:') or (next_stripped and not next_stripped.startswith(' ') and not next_stripped.startswith('-')):\n                print(f'    Breaking on: {repr(next_stripped)[:40]}')\n                break\n            if next_stripped:\n                stage_lines.append(next_stripped)\n            j += 1\n        \n        full_stage = '\\n'.join(stage_lines)\n        action_match = re.search(r'action:\\s*(\\w+)', full_stage)\n        if role and cur_phase:\n            action = action_match.group(1) if action_match else 'NONE'\n            stage_key = f\\\"p{cur_phase[-1]}_{role}_{action}\\\"\n            stage_meta[stage_key] = {'role': role, 'action': action}\n            print(f'  Added: {stage_key}')\n\nprint(f'\\\\nFinal: {len(stage_meta)} stages')\n\""}}],"api":"anthropic-messages","provider":"minimax","model":"MiniMax-M2.7","usage":{"input":45180,"output":796,"cacheRead":10071,"cacheWrite":0,"totalTokens":56047,"cost":{"input":0.013554,"output":0.0009551999999999999,"cacheRead":0.0006042599999999999,"cacheWrite":0,"total":0.01511346}},"stopReason":"toolUse","timestamp":1777540063158,"responseId":"06424edfcdf5aa4c8f0817ee3635bab8"}}
