{"type":"message","id":"655c26ee","parentId":"65ca3ec6","timestamp":"2026-04-30T07:34:53.121Z","message":{"role":"assistant","content":[{"type":"thinking","thinking":"Now let me add the `parse_tasks` method. I need to:\n1. Add the method to the `GraphBuilder` class\n2. Call it in `_cached_build` and the fallback cold build path\n3. The method will parse the YAML frontmatter of each task file and extract key metadata\n\nLet me look at the current `parse_decisions` method as a template and create a similar `parse_tasks` method.","thinkingSignature":"fbf899e0f0fac2ab736d6450c2734ebb97560364f4c0bdbb09e95d5bbf7ecc82"},{"type":"toolCall","id":"call_function_331z7kodvrw3_1","name":"edit","arguments":{"path":"/home/ubuntu/.hermes/agi/graph_builder.py","edits":[{"oldText":"    def parse_lessons(self, lessons_dir: str, limit: int = 20) -> int:\n        \"\"\"Parse lesson files into graph nodes.\"\"\"\n        if not os.path.isdir(lessons_dir):\n            return 0\n\n        files = sorted(os.listdir(lessons_dir), reverse=True)[:limit]\n        count = 0\n        for filename in files:\n            if not filename.endswith('.md'):\n                continue\n            filepath = os.path.join(lessons_dir, filename)\n            try:\n                with open(filepath, \"r\") as f:\n                    content = f.read()\n\n                # Extract frontmatter\n                fm_match = _RE_FRONT_MATTER.match(content)\n                meta = {}\n                if fm_match:\n                    for line in fm_match.group(1).split('\\n'):\n                        m = _RE_YAML_PAIR.match(line)\n                        if m:\n                            meta[m.group(1)] = m.group(2)\n\n                # Extract lesson title\n                title_match = re.search(r'^#\\s+(.+)$', content, re.MULTILINE)\n                title = title_match.group(1)[:60] if title_match else filename[:-3]\n\n                # Extract lesson summary\n                lesson_match = re.search(r'## Lesson\\s*\\n\\n(.+?)(?:\\n\\n|##)', content, re.DOTALL)\n                lesson_text = lesson_match.group(1).strip()[:100] if lesson_match else \"\"\n\n                confidence = meta.get('confidence', 'unknown')\n                lesson_id = self.add_node(\n                    \"lesson\",\n                    title,\n                    lesson_text,\n                    f\"lessons/{filename}\",\n                    f\"lesson_{filename[:-3]}\"\n                )\n                count += 1\n\n                # Skip tag nodes - not needed for core graph, saves nodes/edges\n\n            except Exception:\n                pass\n        return count","newText":"    def parse_lessons(self, lessons_dir: str, limit: int = 20) -> int:\n        \"\"\"Parse lesson files into graph nodes.\"\"\"\n        if not os.path.isdir(lessons_dir):\n            return 0\n\n        files = sorted(os.listdir(lessons_dir), reverse=True)[:limit]\n        count = 0\n        for filename in files:\n            if not filename.endswith('.md'):\n                continue\n            filepath = os.path.join(lessons_dir, filename)\n            try:\n                with open(filepath, \"r\") as f:\n                    content = f.read()\n\n                # Extract frontmatter\n                fm_match = _RE_FRONT_MATTER.match(content)\n                meta = {}\n                if fm_match:\n                    for line in fm_match.group(1).split('\\n'):\n                        m = _RE_YAML_PAIR.match(line)\n                        if m:\n                            meta[m.group(1)] = m.group(2)\n\n                # Extract lesson title\n                title_match = re.search(r'^#\\s+(.+)$', content, re.MULTILINE)\n                title = title_match.group(1)[:60] if title_match else filename[:-3]\n\n                # Extract lesson summary\n                lesson_match = re.search(r'## Lesson\\s*\\n\\n(.+?)(?:\\n\\n|##)', content, re.DOTALL)\n                lesson_text = lesson_match.group(1).strip()[:100] if lesson_match else \"\"\n\n                self.add_node(\n                    \"lesson\",\n                    title,\n                    lesson_text,\n                    f\"lessons/{filename}\",\n                    f\"lesson_{filename[:-3]}\"\n                )\n                count += 1\n\n            except Exception:\n                pass\n        return count\n\n    def parse_tasks(self, tasks_dir: str, limit: int = 50) -> int:\n        \"\"\"Parse task files into graph nodes with status/priority edges.\"\"\"\n        if not os.path.isdir(tasks_dir):\n            return 0\n\n        files = sorted(os.listdir(tasks_dir), reverse=True)\n        # Filter to .md files only\n        md_files = [f for f in files if f.endswith('.md')][:limit]\n\n        task_ids = {}  # filename -> node_id for dependency linking\n        count = 0\n\n        for filename in md_files:\n            filepath = os.path.join(tasks_dir, filename)\n            try:\n                with open(filepath, \"r\") as f:\n                    content = f.read()\n\n                # Extract frontmatter\n                fm_match = _RE_FRONT_MATTER.match(content)\n                meta = {}\n                if fm_match:\n                    for line in fm_match.group(1).split('\\n'):\n                        m = _RE_YAML_PAIR.match(line)\n                        if m:\n                            meta[m.group(1)] = m.group(2)\n\n                # Extract task title\n                title_match = re.search(r'^#\\s+(.+)$', content, re.MULTILINE)\n                title = title_match.group(1)[:60] if title_match else filename[:-3]\n\n                # Extract goal summary (first paragraph after frontmatter)\n                goal_match = re.search(r'### Goal\\s*\\n\\n(.+?)(?:\\n\\n|##)', content, re.DOTALL)\n                goal_text = goal_match.group(1).strip()[:100] if goal_match else \"\"\n\n                status = meta.get('status', 'open')\n                priority = meta.get('priority', 'medium')\n                created = meta.get('created', '')\n\n                # Summary label: title + status\n                label = f\"{title[:50]}\"\n                summary = f\"{status}|{priority}|{created[:10]}|{goal_text[:40]}\"\n\n                task_key = filename[:-3]  # strip .md\n                task_id = self.add_node(\n                    \"task\",\n                    label,\n                    summary,\n                    f\"tasks/{filename}\",\n                    f\"task_{task_key[:50]}\"\n                )\n                task_ids[task_key] = task_id\n                count += 1\n\n            except Exception:\n                pass\n\n        # Second pass: add depends_on edges\n        for filename in md_files:\n            filepath = os.path.join(tasks_dir, filename)\n            try:\n                with open(filepath, \"r\") as f:\n                    content = f.read()\n                fm_match = _RE_FRONT_MATTER.match(content)\n                if not fm_match:\n                    continue\n                meta = {}\n                for line in fm_match.group(1).split('\\n'):\n                    m = _RE_YAML_PAIR.match(line)\n                    if m:\n                        meta[m.group(1)] = m.group(2)\n\n                dep_str = meta.get('depends_on', '').strip('[] ')\n                if not dep_str:\n                    continue\n\n                depends = [d.strip().strip(\"'\").strip('\"') for d in dep_str.split(',') if d.strip()]\n                src_key = filename[:-3]\n                src_id = task_ids.get(src_key)\n                if not src_id:\n                    continue\n\n                for dep in depends:\n                    dep_id = task_ids.get(dep)\n                    if dep_id:\n                        self.add_edge(src_id, dep_id, \"depends_on\")\n\n            except Exception:\n                pass\n\n        return count"}]}}],"api":"anthropic-messages","provider":"minimax","model":"MiniMax-M2.7","usage":{"input":17965,"output":1834,"cacheRead":10071,"cacheWrite":0,"totalTokens":29870,"cost":{"input":0.005389499999999999,"output":0.0022007999999999997,"cacheRead":0.0006042599999999999,"cacheWrite":0,"total":0.00819456}},"stopReason":"toolUse","timestamp":1777534463346,"responseId":"064238ffdf2eee50d99942adbb0579a0"}}
{"type":"message","id":"ef01ab2c","parentId":"655c26ee","timestamp":"2026-04-30T07:34:53.144Z","message":{"role":"toolResult","toolCallId":"call_function_331z7kodvrw3_1","toolName":"edit","content":[{"type":"text","text":"Successfully replaced 1 block(s) in /home/ubuntu/.hermes/agi/graph_builder.py."}],"details":{"diff":"     ...\n 332                 # Extract lesson summary\n 333                 lesson_match = re.search(r'## Lesson\\s*\\n\\n(.+?)(?:\\n\\n|##)', content, re.DOTALL)\n 334                 lesson_text = lesson_match.group(1).strip()[:100] if lesson_match else \"\"\n 335 \n-336                 confidence = meta.get('confidence', 'unknown')\n-337                 lesson_id = self.add_node(\n+336                 self.add_node(\n 338                     \"lesson\",\n 339                     title,\n 340                     lesson_text,\n 341                     f\"lessons/{filename}\",\n 342                     f\"lesson_{filename[:-3]}\"\n 343                 )\n 344                 count += 1\n 345 \n-346                 # Skip tag nodes - not needed for core graph, saves nodes/edges\n+345             except Exception:\n+346                 pass\n+347         return count\n 347 \n+349     def parse_tasks(self, tasks_dir: str, limit: int = 50) -> int:\n+350         \"\"\"Parse task files into graph nodes with status/priority edges.\"\"\"\n+351         if not os.path.isdir(tasks_dir):\n+352             return 0\n+353 \n+354         files = sorted(os.listdir(tasks_dir), reverse=True)\n+355         # Filter to .md files only\n+356         md_files = [f for f in files if f.endswith('.md')][:limit]\n+357 \n+358         task_ids = {}  # filename -> node_id for dependency linking\n+359         count = 0\n+360 \n+361         for filename in md_files:\n+362             filepath = os.path.join(tasks_dir, filename)\n+363             try:\n+364                 with open(filepath, \"r\") as f:\n+365                     content = f.read()\n+366 \n+367                 # Extract frontmatter\n+368                 fm_match = _RE_FRONT_MATTER.match(content)\n+369                 meta = {}\n+370                 if fm_match:\n+371                     for line in fm_match.group(1).split('\\n'):\n+372                         m = _RE_YAML_PAIR.match(line)\n+373                         if m:\n+374                             meta[m.group(1)] = m.group(2)\n+375 \n+376                 # Extract task title\n+377                 title_match = re.search(r'^#\\s+(.+)$', content, re.MULTILINE)\n+378                 title = title_match.group(1)[:60] if title_match else filename[:-3]\n+379 \n+380                 # Extract goal summary (first paragraph after frontmatter)\n+381                 goal_match = re.search(r'### Goal\\s*\\n\\n(.+?)(?:\\n\\n|##)', content, re.DOTALL)\n+382                 goal_text = goal_match.group(1).strip()[:100] if goal_match else \"\"\n+383 \n+384                 status = meta.get('status', 'open')\n+385                 priority = meta.get('priority', 'medium')\n+386                 created = meta.get('created', '')\n+387 \n+388                 # Summary label: title + status\n+389                 label = f\"{title[:50]}\"\n+390                 summary = f\"{status}|{priority}|{created[:10]}|{goal_text[:40]}\"\n+391 \n+392                 task_key = filename[:-3]  # strip .md\n+393                 task_id = self.add_node(\n+394                     \"task\",\n+395                     label,\n+396                     summary,\n+397                     f\"tasks/{filename}\",\n+398                     f\"task_{task_key[:50]}\"\n+399                 )\n+400                 task_ids[task_key] = task_id\n+401                 count += 1\n+402 \n 348             except Exception:\n 349                 pass\n+405 \n+406         # Second pass: add depends_on edges\n+407         for filename in md_files:\n+408             filepath = os.path.join(tasks_dir, filename)\n+409             try:\n+410                 with open(filepath, \"r\") as f:\n+411                     content = f.read()\n+412                 fm_match = _RE_FRONT_MATTER.match(content)\n+413                 if not fm_match:\n+414                     continue\n+415                 meta = {}\n+416                 for line in fm_match.group(1).split('\\n'):\n+417                     m = _RE_YAML_PAIR.match(line)\n+418                     if m:\n+419                         meta[m.group(1)] = m.group(2)\n+420 \n+421                 dep_str = meta.get('depends_on', '').strip('[] ')\n+422                 if not dep_str:\n+423                     continue\n+424 \n+425                 depends = [d.strip().strip(\"'\").strip('\"') for d in dep_str.split(',') if d.strip()]\n+426                 src_key = filename[:-3]\n+427                 src_id = task_ids.get(src_key)\n+428                 if not src_id:\n+429                     continue\n+430 \n+431                 for dep in depends:\n+432                     dep_id = task_ids.get(dep)\n+433                     if dep_id:\n+434                         self.add_edge(src_id, dep_id, \"depends_on\")\n+435 \n+436             except Exception:\n+437                 pass\n+438 \n 350         return count\n 351 \n 352     def build_adjacency(self):\n 353         \"\"\"Build adjacency dict from edges.\"\"\"\n     ...","firstChangedLine":336},"isError":false,"timestamp":1777534493144}}
{"type":"message","id":"28a222eb","parentId":"ef01ab2c","timestamp":"2026-04-30T07:35:03.402Z","message":{"role":"assistant","content":[{"type":"thinking","thinking":"Now I need to call `parse_tasks` in the `_cached_build` function and in the cold build fallback path. Let me find those sections and add the call.","thinkingSignature":"6963ac180191b750eb1cfc3cb3ee0c48da44f1eb893005af2ea69de7d1533304"},{"type":"text","text":"Now add `parse_tasks` call in `_cached_build` and the cold build fallback:\n"},{"type":"toolCall","id":"call_function_37wj5x7j4wxd_1","name":"edit","arguments":{"path":"/home/ubuntu/.hermes/agi/graph_builder.py","edits":[{"oldText":"    # Parse lessons (limit 10 — only titles/summaries, no tag nodes)\n    lessons_dir = os.path.join(hermes_dir, \"belam-codex\", \"lessons\")\n    if os.path.isdir(lessons_dir):\n        builder.parse_lessons(lessons_dir, limit=10)\n\n    # Process gitnexus cache","newText":"    # Parse lessons (limit 10 — only titles/summaries, no tag nodes)\n    lessons_dir = os.path.join(hermes_dir, \"belam-codex\", \"lessons\")\n    if os.path.isdir(lessons_dir):\n        builder.parse_lessons(lessons_dir, limit=10)\n\n    # Parse tasks (limit 50 — task nodes with status/priority/depends_on edges)\n    tasks_dir = os.path.join(hermes_dir, \"belam-codex\", \"tasks\")\n    if os.path.isdir(tasks_dir):\n        builder.parse_tasks(tasks_dir, limit=50)\n\n    # Process gitnexus cache"},{"oldText":"    # Parse lessons (limit 10 — fallback cold path)\n    lessons_dir = os.path.join(hermes_dir, \"belam-codex\", \"lessons\")\n    if os.path.isdir(lessons_dir):\n        builder.parse_lessons(lessons_dir, limit=10)\n\n    # Process gitnexus cache","newText":"    # Parse lessons (limit 10 — fallback cold path)\n    lessons_dir = os.path.join(hermes_dir, \"belam-codex\", \"lessons\")\n    if os.path.isdir(lessons_dir):\n        builder.parse_lessons(lessons_dir, limit=10)\n\n    # Parse tasks (fallback cold path)\n    tasks_dir = os.path.join(hermes_dir, \"belam-codex\", \"tasks\")\n    if os.path.isdir(tasks_dir):\n        builder.parse_tasks(tasks_dir, limit=50)\n\n    # Process gitnexus cache"}]}}],"api":"anthropic-messages","provider":"minimax","model":"MiniMax-M2.7","usage":{"input":19835,"output":563,"cacheRead":10071,"cacheWrite":0,"totalTokens":30469,"cost":{"input":0.0059505,"output":0.0006755999999999999,"cacheRead":0.0006042599999999999,"cacheWrite":0,"total":0.00723036}},"stopReason":"toolUse","timestamp":1777534493145,"responseId":"0642391df158e70c6c554b42b9f4fee3"}}
{"type":"message","id":"d419c329","parentId":"28a222eb","timestamp":"2026-04-30T07:35:03.407Z","message":{"role":"toolResult","toolCallId":"call_function_37wj5x7j4wxd_1","toolName":"edit","content":[{"type":"text","text":"Successfully replaced 2 block(s) in /home/ubuntu/.hermes/agi/graph_builder.py."}],"details":{"diff":"     ...\n 585     lessons_dir = os.path.join(hermes_dir, \"belam-codex\", \"lessons\")\n 586     if os.path.isdir(lessons_dir):\n 587         builder.parse_lessons(lessons_dir, limit=10)\n 588 \n+589     # Parse tasks (limit 50 — task nodes with status/priority/depends_on edges)\n+590     tasks_dir = os.path.join(hermes_dir, \"belam-codex\", \"tasks\")\n+591     if os.path.isdir(tasks_dir):\n+592         builder.parse_tasks(tasks_dir, limit=50)\n+593 \n 589     # Process gitnexus cache\n 590     cache_to_use = None\n 591     gitnexus_cache_file = os.path.join(agi_dir, \".gitnexus_cache.json\")\n 592     if os.path.exists(gitnexus_cache_file):\n     ...\n 669     lessons_dir = os.path.join(hermes_dir, \"belam-codex\", \"lessons\")\n 670     if os.path.isdir(lessons_dir):\n 671         builder.parse_lessons(lessons_dir, limit=10)\n 672 \n+678     # Parse tasks (fallback cold path)\n+679     tasks_dir = os.path.join(hermes_dir, \"belam-codex\", \"tasks\")\n+680     if os.path.isdir(tasks_dir):\n+681         builder.parse_tasks(tasks_dir, limit=50)\n+682 \n 673     # Process gitnexus cache\n 674     global _gitnexus_cache\n 675     if cache_to_use is None:\n 676         cache_to_use = _gitnexus_cache\n     ...","firstChangedLine":589},"isError":false,"timestamp":1777534503407}}
{"type":"message","id":"2db2460e","parentId":"d419c329","timestamp":"2026-04-30T07:35:14.539Z","message":{"role":"assistant","content":[{"type":"thinking","thinking":"Now I need to clear the lru_cache so the new code is picked up. The `_cached_build` function is decorated with `@lru_cache(maxsize=1)`, so I need to either clear it or bump the cache key.\n\nActually, looking at the code, the `gitnexus_hash` parameter acts as a cache-busting mechanism. Since I'm adding new source data (tasks), the lru_cache will return the same cached result because the hash is the same (it only considers gitnexus cache size).\n\nI need to either:\n1. Manually clear the lru_cache (by deleting the pickle file which invalidates the cache, but actually the lru_cache is separate from pickle)\n\n\n2. Change the cache key somehow\n\nThe real issue is that `lru_cache` ignores the hermes_dir and agi_dir parameters after the first call, so if I modify the code to parse tasks, the cache won't know about the new data sources. Since `gitnexus_hash` is the only thing that changes the cache key, I need to either bump that value or find another way to invalidate it when the underlying code changes. Since we're only adding a new function call with no parameters affecting the cache key, the existing cache will be returned unchanged—we need to manually invalidate it. Let me run the experiment and see what happens.","thinkingSignature":"de769ba812d1d03d0cca480d2e110ec39040cd5e607ecb6f1b3c279fb203efe2"},{"type":"text","text":"Now clear the lru_cache (pickle invalidation) so new code takes effect, then commit:\n"},{"type":"toolCall","id":"call_function_heozeucf0y8z_1","name":"bash","arguments":{"command":"cd /home/ubuntu/.hermes/agi && rm -f .graph_cache.pkl && git add -A && git diff --cached --stat"}}],"api":"anthropic-messages","provider":"minimax","model":"MiniMax-M2.7","usage":{"input":20434,"output":348,"cacheRead":10071,"cacheWrite":0,"totalTokens":30853,"cost":{"input":0.0061302,"output":0.00041759999999999996,"cacheRead":0.0006042599999999999,"cacheWrite":0,"total":0.007152059999999999}},"stopReason":"toolUse","timestamp":1777534503408,"responseId":"0642392797f782afebea1d4c32a30d44"}}
{"type":"message","id":"cb359e31","parentId":"2db2460e","timestamp":"2026-04-30T07:35:14.556Z","message":{"role":"toolResult","toolCallId":"call_function_heozeucf0y8z_1","toolName":"bash","content":[{"type":"text","text":" .graph_cache.pkl                                   | Bin 41728 -> 0 bytes\n graph_builder.py                                   | 105 ++++++++++++++++++++-\n loop.log                                           |   1 +\n ...378Z_019ddd4e-b212-75cb-9084-27cb9f6ac0e8.jsonl |  28 ++++++\n 4 files changed, 131 insertions(+), 3 deletions(-)\n"}],"isError":false,"timestamp":1777534514556}}
