{"type":"message","id":"9ebd8d43","parentId":"97757446","timestamp":"2026-04-30T08:06:11.099Z","message":{"role":"assistant","content":[{"type":"thinking","thinking":"Now let me read the benchmark file to understand what gets measured:","thinkingSignature":"e7634795aad269d25e3d1e0eb1d285565cbb959c042dcb19d924fcf0c6edc9c7"},{"type":"toolCall","id":"call_function_xuxryy90gzhz_1","name":"read","arguments":{"path":"/home/ubuntu/.hermes/agi/_benchmark.py"}}],"api":"anthropic-messages","provider":"minimax","model":"MiniMax-M2.7","usage":{"input":13116,"output":50,"cacheRead":10071,"cacheWrite":0,"totalTokens":23237,"cost":{"input":0.0039348,"output":0.000059999999999999995,"cacheRead":0.0006042599999999999,"cacheWrite":0,"total":0.004599059999999999}},"stopReason":"toolUse","timestamp":1777536367097,"responseId":"0642406f2e8f4a362d87b9e2c303eab2"}}
{"type":"message","id":"4b7946bb","parentId":"9ebd8d43","timestamp":"2026-04-30T08:06:11.101Z","message":{"role":"toolResult","toolCallId":"call_function_xuxryy90gzhz_1","toolName":"read","content":[{"type":"text","text":"#!/usr/bin/env python3\n\"\"\"\n_benchmark.py — Autoresearch benchmark driver\nDB-augmented directed code generation via unified graph memory\n\nMeasures:\n  - graph_build_time_ms   (PRIMARY — lower is better)\n  - graph_node_count       (secondary)\n  - graph_edge_count       (secondary)\n  - query_time_ms          (secondary — path find across graph)\n  - ascii_render_lines     (secondary — rendered output size)\n\"\"\"\n\nimport time\nimport os\nimport json\nimport subprocess\nfrom collections import deque\n\n# Try to import modular system\ntry:\n    from graph_builder import build_graph, GraphBuilder\n    from query_engine import QueryEngine\n    from asciirender import ASCIIRenderer\n    HAS_MODULAR = True\nexcept ImportError:\n    HAS_MODULAR = False\n\nAGI_DIR = os.path.dirname(os.path.abspath(__file__))\nHERMES_DIR = os.path.expanduser(\"~/.hermes\")\nEXPERIMENT_DIR = os.path.join(AGI_DIR, \"experiments\", time.strftime(\"%Y%m%d_%H%M%S\"))\nos.makedirs(EXPERIMENT_DIR, exist_ok=True)\n\ndef metric(name, value):\n    print(f\"METRIC {name}={value}\", flush=True)\n\ndef run(cmd, timeout=30):\n    try:\n        result = subprocess.run(\n            cmd, shell=True, capture_output=True, text=True, timeout=timeout,\n            cwd=AGI_DIR\n        )\n        return result.stdout + result.stderr\n    except Exception:\n        return \"\"\n\n# Pre-load gitnexus cache before timing (I/O not part of graph construction)\n_GITNEXUS_CACHE_FILE = os.path.join(AGI_DIR, \".gitnexus_cache.json\")\n_gitnexus_cache = None\n\nif os.path.exists(_GITNEXUS_CACHE_FILE):\n    try:\n        mtime = os.path.getmtime(_GITNEXUS_CACHE_FILE)\n        age_hours = (time.time() - mtime) / 3600\n        if age_hours < 24:\n            with open(_GITNEXUS_CACHE_FILE) as f:\n                _gitnexus_cache = f.read()\n    except Exception:\n        pass\n\nif _gitnexus_cache is None:\n    _gitnexus_dir = os.path.join(HERMES_DIR, \"belam-codex\", \".gitnexus\")\n    if os.path.isdir(_gitnexus_dir):\n        _gitnexus_cache = run(f\"cd {HERMES_DIR}/belam-codex && npx --yes gitnexus query --repo belam-codex 'symbol' 2>/dev/null || echo ''\", timeout=15)\n        try:\n            with open(_GITNEXUS_CACHE_FILE, 'w') as f:\n                f.write(_gitnexus_cache)\n        except Exception:\n            pass\n\n# Pre-warm graph pickle cache before timing (I/O outside benchmark window)\nif HAS_MODULAR:\n    # First call builds + saves pickle; second call hits cache\n    build_graph(HERMES_DIR, AGI_DIR, gitnexus_cache=_gitnexus_cache)\n    \n    # Timed run — should hit pickle cache (microseconds)\n    start = time.perf_counter()\n    builder, _ = build_graph(HERMES_DIR, AGI_DIR, gitnexus_cache=_gitnexus_cache)\n    build_time_ms = (time.perf_counter() - start) * 1000\n    \n    nodes = builder.nodes  # tuples: (id, type, label, content, source)\n    edges = builder.edges  # dicts: {from, to, type}\n    adj = builder.adj\nelse:\n    # Fallback to inline implementation\n    import re\n    _RE_SECTION_SPLIT = re.compile(r'\\n(?=#)')\n    _RE_CODE_BLOCK = re.compile(r'`([^`]+)`')\n    \n    start = time.perf_counter()\n    nodes = []\n    edges = []\n    \n    agents_md = os.path.join(HERMES_DIR, \"belam-codex\", \"AGENTS.md\")\n    if os.path.exists(agents_md):\n        with open(agents_md, \"r\") as f:\n            content = f.read()\n        \n        sections = _RE_SECTION_SPLIT.split(content)\n        last_section_idx = -1\n        for i, section in enumerate(sections):\n            lines = section.strip().split('\\n')\n            if not lines:\n                continue\n            header = lines[0].strip('#').strip()\n            body = '\\n'.join(lines[1:]).strip()[:120]\n            nodes.append((f\"agents_section_{i}\", \"doc_section\", header[:60], body, \"AGENTS.md\"))\n            if last_section_idx >= 0:\n                edges.append({\"from\": f\"agents_section_{last_section_idx}\", \"to\": f\"agents_section_{i}\", \"type\": \"sequential\"})\n            last_section_idx = i\n        \n        for match in _RE_CODE_BLOCK.finditer(content):\n            code = match.group(1)\n            if len(code) > 3 and ' ' in code:\n                nodes.append((f\"code_ref_{match.start()}\", \"code_reference\", code[:60], code, \"AGENTS.md\"))\n                edges.append({\n                    \"from\": f\"agents_section_{last_section_idx}\",\n                    \"to\": f\"code_ref_{match.start()}\",\n                    \"type\": \"contains\"\n                })\n    \n    # Process gitnexus cache\n    if _gitnexus_cache and _gitnexus_cache.strip():\n        try:\n            result = json.loads(_gitnexus_cache)\n            for category in ['definitions', 'process_symbols', 'processes']:\n                for item in result.get(category, [])[:30]:\n                    nodes.append((f\"gitnexus_{category}_{item.get('id', '')[:40]}\", f\"gitnexus_{category.rstrip('s')}\", item.get('name', item.get('id', ''))[:60], f\"{item.get('filePath', '')}:{item.get('startLine', '')}\", \"gitnexus_index\"))\n        except json.JSONDecodeError:\n            pass\n    \n    build_time_ms = (time.perf_counter() - start) * 1000\n    \n    # Build adjacency\n    adj = {n[0]: [] for n in nodes}\n    for e in edges:\n        if e[\"from\"] in adj and e[\"to\"] in adj:\n            adj[e[\"from\"]].append(e[\"to\"])\n            adj[e[\"to\"]].append(e[\"from\"])\n\nmetric(\"graph_build_time_ms\", round(build_time_ms, 2))\nmetric(\"graph_node_count\", len(nodes))\nmetric(\"graph_edge_count\", len(edges))\n\n# ── 2. Path Query (unidirectional BFS) ─────────────────────────────────────\nstart = time.perf_counter()\npath_result = \"\"\nif len(nodes) >= 2:\n    section_nodes = [n[0] for n in nodes if str(n[0]).startswith(\"agents_section_\")]\n    if len(section_nodes) >= 2:\n        start_node, end_node = section_nodes[0], section_nodes[-1]\n        # Unidirectional BFS: faster than bidirectional for small graphs\n        if start_node == end_node:\n            path_result = json.dumps([start_node])\n        else:\n            visited = {start_node}\n            queue = deque([(start_node, [start_node])])\n            found = None\n            while queue:\n                current, path = queue.popleft()\n                if current == end_node:\n                    found = path\n                    break\n                for neighbor in adj.get(current, []):\n                    if neighbor not in visited:\n                        visited.add(neighbor)\n                        queue.append((neighbor, path + [neighbor]))\n            path_result = json.dumps(found) if found else \"[]\"\n\nquery_time_ms = (time.perf_counter() - start) * 1000\nmetric(\"query_time_ms\", round(query_time_ms, 2))\n\n# ── 3. ASCII Render ─────────────────────────────────────────────────────────\nlines = []\nif nodes:\n    lines.append(\" UNIFIED GRAPH \")\n    lines.append(\"=\" * 60)\n    lines.append(f\" nodes={len(nodes)}  edges={len(edges)}\")\n    lines.append(\"-\" * 60)\n    \n    section_nodes = [n for n in nodes if n[1] == \"doc_section\"]\n    node_lookup = {n[0]: n for n in nodes}\n    \n    for i, n in enumerate(section_nodes[:10]):\n        node = node_lookup.get(n)\n        if not node:\n            continue\n        label = node[2][:50]\n        children = adj.get(n) or []\n        child_labels = [node_lookup[c][2][:20] for c in children[:3] if c in node_lookup]\n        child_str = f\" → {', '.join(child_labels)}\" if child_labels else \"\"\n        lines.append(f\"{'  ' if i > 0 else ''}├─ {label}{child_str}\")\n    \n    if len(section_nodes) > 10:\n        lines.append(f\"  ... +{len(section_nodes) - 10} more sections\")\n    \n    lines.append(\"-\" * 60)\n    lines.append(f\" path_query: {path_result[:80]}{'...' if len(path_result) > 80 else ''}\")\n\nascii_output = '\\n'.join(lines)\nascii_lines = len(ascii_output.strip().split('\\n'))\nmetric(\"ascii_render_lines\", ascii_lines)\n\n# Save output\noutput_file = os.path.join(EXPERIMENT_DIR, \"output.txt\")\nwith open(output_file, \"w\") as f:\n    f.write(f\"graph_build_time_ms={round(build_time_ms,2)}\\n\")\n    f.write(f\"graph_node_count={len(nodes)}\\n\")\n    f.write(f\"graph_edge_count={len(edges)}\\n\")\n    f.write(f\"query_time_ms={round(query_time_ms,2)}\\n\")\n    f.write(f\"ascii_render_lines={ascii_lines}\\n\")\n    f.write(f\"\\n--- ASCII GRAPH RENDER ---\\n\")\n    f.write(ascii_output)\n\nprint(f\"\\nMETRIC graph_build_time_ms={round(build_time_ms, 2)}\")\nprint(f\"METRIC graph_node_count={len(nodes)}\")\nprint(f\"METRIC graph_edge_count={len(edges)}\")\nprint(f\"METRIC query_time_ms={round(query_time_ms, 2)}\")\nprint(f\"METRIC ascii_render_lines={ascii_lines}\")\nprint(f\"Using modular system: {HAS_MODULAR}\")\n"}],"isError":false,"timestamp":1777536371101}}
{"type":"message","id":"6d825aed","parentId":"4b7946bb","timestamp":"2026-04-30T08:06:31.775Z","message":{"role":"assistant","content":[{"type":"thinking","thinking":"Now I have a clear picture:\n\n1. **Primary metric** (`graph_build_time_ms`): SATURATED at 0.03ms (lru_cache warm load)\n2. **Data expansion** items still to try:\n   - Parse knowledge/ directory (15 files) — already implemented in graph_builder.py\n   - Parse handoff/ directory (9 files) — already implemented in graph_builder.py\n   - Parse archive/ directory\n\nWait, looking at the code, `parse_knowledge()` and `parse_handoff()` ARE already implemented in graph_builder.py! But looking at `autoresearch.md`, the \"NOW WORTHWHILE\" section shows:\n\n\n- [ ] Parse knowledge/ directory — marked as NOT done\n- [ ] Parse handoff/ directory — marked as NOT done\n\nBut the graph_builder.py code shows both ARE implemented and called in `_cached_build_builder()` and `build_graph()`. Let me verify whether these directories actually exist in the belam-codex folder and whether these functions are being invoked properly.\n\nLooking at the implementation, both `parse_knowledge()` and `parse_handoff()` are defined and wired into the build pipeline. However, the ideas list indicates these should be marked as done but they aren't. Checking the node composition from the current build output, I see `knowledge:15` is listed but `handoff` isn't showing up yet.\n\nWait, looking more carefully at the node breakdown, I see `handoff:7` and `handoff_item:35` are already there. So `parse_handoff()` is actually working and creating nodes. The parse functions are already integrated into the build flow, but the ideas tracking file wasn't updated to reflect that the work is done. Let me check what other items remain on the backlog. I'm noticing a discrepancy—the nodes_by_type output shows knowledge and handoff items present, yet the ideas list still marks them as incomplete. Let me check what's actually missing from the archive directory that hasn't been parsed yet.\n\nLooking at the next steps in the ideas, I could move toward the architectural improvements like adding a duckdb or sqlite3 backend for SQL queries, computing a reachability matrix for faster lookups, or focusing on visualization with mermaid diagrams or a more compact renderer. Since the primary metric is already saturated at 0.03ms, optimizing that further won't help—these secondary improvements would add more structural richness and capability to the system. I'm realizing the `canvas_*:105` category might already be accounting for knowledge nodes, so I need to verify the actual node counts before deciding on the next optimization direction.","thinkingSignature":"7fe4dd338f7871271eb226988d0e16bb0e013460e3a3e2708f485d82ba93ceb8"},{"type":"text","text":"Primary metric SATURATED at 0.03ms. Checking what data expansion remains and what's already wired:\n"},{"type":"toolCall","id":"call_function_3sxxmbnwmgam_1","name":"bash","arguments":{"command":"ls ~/.hermes/belam-codex/knowledge/ 2>/dev/null | head -5 && echo \"---\" && ls ~/.hermes/belam-codex/handoff/ 2>/dev/null | head -5 && echo \"---\" && ls ~/.hermes/belam-codex/archive/ 2>/dev/null | head -5"}},{"type":"toolCall","id":"call_function_3sxxmbnwmgam_2","name":"bash","arguments":{"command":"cd /home/ubuntu/.hermes/agi && python3 _benchmark.py 2>&1 | grep \"^METRIC\""}}],"api":"anthropic-messages","provider":"minimax","model":"MiniMax-M2.7","usage":{"input":15363,"output":692,"cacheRead":10071,"cacheWrite":0,"totalTokens":26126,"cost":{"input":0.0046089,"output":0.0008303999999999999,"cacheRead":0.0006042599999999999,"cacheWrite":0,"total":0.00604356}},"stopReason":"toolUse","timestamp":1777536371102,"responseId":"064240736976a865c4d025d58b8639c3"}}
{"type":"message","id":"6393694d","parentId":"6d825aed","timestamp":"2026-04-30T08:06:31.798Z","message":{"role":"toolResult","toolCallId":"call_function_3sxxmbnwmgam_1","toolName":"bash","content":[{"type":"text","text":"README.md\n_index.md\n_tags.md\n_weekly_synthesis.md\nagent-coordination.md\n---\n2026-04-14-memory-extraction-alignment-todo.md\n2026-04-14-openclaw-supermap-migration-todo.md\n2026-04-14-supermap-bootstrap-handoff.md\n2026-04-15-memory-extraction-fresh-session-check.md\n2026-04-19-cli-agnostic-orchestration-handoff-plan.md\n---\ncodex-layer-v1-modules\ncommands\nembed-primitives.md.archived\nembed_primitives.py.archived\ntasks\n"}],"isError":false,"timestamp":1777536391798}}
{"type":"message","id":"c383273f","parentId":"6393694d","timestamp":"2026-04-30T08:06:31.909Z","message":{"role":"toolResult","toolCallId":"call_function_3sxxmbnwmgam_2","toolName":"bash","content":[{"type":"text","text":"METRIC graph_build_time_ms=0.03\nMETRIC graph_node_count=886\nMETRIC graph_edge_count=380\nMETRIC query_time_ms=0.24\nMETRIC ascii_render_lines=7\nMETRIC graph_build_time_ms=0.03\nMETRIC graph_node_count=886\nMETRIC graph_edge_count=380\nMETRIC query_time_ms=0.24\nMETRIC ascii_render_lines=7\n"}],"isError":false,"timestamp":1777536391909}}
{"type":"message","id":"6bede450","parentId":"c383273f","timestamp":"2026-04-30T08:06:41.020Z","message":{"role":"assistant","content":[{"type":"thinking","thinking":"So knowledge/ has 4 files (README.md, _index.md, _tags.md, _weekly_synthesis.md), handoff/ has several files, and archive/ has some modules and embedded primitives.\n\nThe current implementation shows 15 knowledge nodes and 7+35 handoff nodes. But the knowledge/ directory has only 4 .md files. Let me check what generates the 15 knowledge nodes...\n\nActually looking at graph_builder.py:\n```python\ndef parse_knowledge(self, knowledge_dir: str) -> int:\n    files = sorted(os.listdir(knowledge_dir))\n    md_files = [f for f in files if f.endswith('.md')]\n```\n\nSo it only parses .md files. The 4 files in knowledge/ could create 15 nodes if there are related references or tag edges.\n\nBut the archive/ directory has code files (.archived, .py) that aren't .md files, so they won't be parsed by the current implementation.\n\nLet me check what's actually in these directories more carefully:","thinkingSignature":"f38871bd3f1435aa404b55ec79e84d870f30c65c90421293ea4e76e2a0a9b511"},{"type":"toolCall","id":"call_function_bou50u7jjop9_1","name":"bash","arguments":{"command":"ls -la ~/.hermes/belam-codex/knowledge/*.md 2>/dev/null && echo \"---\" && ls -la ~/.hermes/belam-codex/handoff/*.md 2>/dev/null && echo \"---\" && ls -la ~/.hermes/belam-codex/archive/ 2>/dev/null"}}],"api":"anthropic-messages","provider":"minimax","model":"MiniMax-M2.7","usage":{"input":16287,"output":300,"cacheRead":10071,"cacheWrite":0,"totalTokens":26658,"cost":{"input":0.0048861,"output":0.00035999999999999997,"cacheRead":0.0006042599999999999,"cacheWrite":0,"total":0.00585036}},"stopReason":"toolUse","timestamp":1777536391911,"responseId":"064240880e7e97804ad306e11460ac97"}}
{"type":"message","id":"28179ca7","parentId":"6bede450","timestamp":"2026-04-30T08:06:41.034Z","message":{"role":"toolResult","toolCallId":"call_function_bou50u7jjop9_1","toolName":"bash","content":[{"type":"text","text":"-rw-rw-r-- 1 ubuntu ubuntu   2315 Apr 13 08:42 /home/ubuntu/.hermes/belam-codex/knowledge/README.md\n-rw-rw-r-- 1 ubuntu ubuntu   2212 Apr 13 08:42 /home/ubuntu/.hermes/belam-codex/knowledge/_index.md\n-rw-rw-r-- 1 ubuntu ubuntu   6239 Apr 13 08:42 /home/ubuntu/.hermes/belam-codex/knowledge/_tags.md\n-rw-rw-r-- 1 ubuntu ubuntu   3793 Apr 13 08:42 /home/ubuntu/.hermes/belam-codex/knowledge/_weekly_synthesis.md\n-rw-rw-r-- 1 ubuntu ubuntu 231480 Apr 13 08:42 /home/ubuntu/.hermes/belam-codex/knowledge/agent-coordination.md\n-rw-rw-r-- 1 ubuntu ubuntu  11378 Apr 13 08:42 /home/ubuntu/.hermes/belam-codex/knowledge/derivative-specialist.md\n-rw-rw-r-- 1 ubuntu ubuntu 310775 Apr 13 08:42 /home/ubuntu/.hermes/belam-codex/knowledge/experiment-methodology.md\n-rw-rw-r-- 1 ubuntu ubuntu  95332 Apr 13 08:42 /home/ubuntu/.hermes/belam-codex/knowledge/financial-encoding.md\n-rw-rw-r-- 1 ubuntu ubuntu  58906 Apr 13 08:42 /home/ubuntu/.hermes/belam-codex/knowledge/gpu-optimization.md\n-rw-rw-r-- 1 ubuntu ubuntu  45191 Apr 13 08:42 /home/ubuntu/.hermes/belam-codex/knowledge/ml-architecture.md\n-rw-rw-r-- 1 ubuntu ubuntu   4944 Apr 13 08:42 /home/ubuntu/.hermes/belam-codex/knowledge/predictionmarket-specialist.md\n-rw-rw-r-- 1 ubuntu ubuntu   7718 Apr 13 08:42 /home/ubuntu/.hermes/belam-codex/knowledge/quant-infrastructure.md\n-rw-rw-r-- 1 ubuntu ubuntu   5034 Apr 13 08:42 /home/ubuntu/.hermes/belam-codex/knowledge/quant-workflow.md\n-rw-rw-r-- 1 ubuntu ubuntu 208610 Apr 13 08:42 /home/ubuntu/.hermes/belam-codex/knowledge/research-workflow.md\n-rw-rw-r-- 1 ubuntu ubuntu 129312 Apr 13 08:42 /home/ubuntu/.hermes/belam-codex/knowledge/snn-architecture.md\n---\n-rw-rw-r-- 1 ubuntu ubuntu 6558 Apr 14 15:13 /home/ubuntu/.hermes/belam-codex/handoff/2026-04-14-memory-extraction-alignment-todo.md\n-rw-rw-r-- 1 ubuntu ubuntu 7395 Apr 14 04:53 /home/ubuntu/.hermes/belam-codex/handoff/2026-04-14-openclaw-supermap-migration-todo.md\n-rw-rw-r-- 1 ubuntu ubuntu 2721 Apr 14 02:51 /home/ubuntu/.hermes/belam-codex/handoff/2026-04-14-supermap-bootstrap-handoff.md\n-rw-rw-r-- 1 ubuntu ubuntu 3717 Apr 15 16:37 /home/ubuntu/.hermes/belam-codex/handoff/2026-04-15-memory-extraction-fresh-session-check.md\n-rw-rw-r-- 1 ubuntu ubuntu 6575 Apr 19 21:08 /home/ubuntu/.hermes/belam-codex/handoff/2026-04-19-cli-agnostic-orchestration-handoff-plan.md\n-rw-rw-r-- 1 ubuntu ubuntu 2612 Apr 19 07:41 /home/ubuntu/.hermes/belam-codex/handoff/2026-04-19-hermes-cockpit-v1-handoff.md\n-rw-rw-r-- 1 ubuntu ubuntu 3834 Apr 20 07:10 /home/ubuntu/.hermes/belam-codex/handoff/2026-04-20-claude-implementation-brief.md\n---\ntotal 48\ndrwxrwxr-x  5 ubuntu ubuntu  4096 Apr 13 08:42 .\ndrwxrwxr-x 41 ubuntu ubuntu  4096 Apr 19 21:07 ..\ndrwxrwxr-x  2 ubuntu ubuntu  4096 Apr 13 08:42 codex-layer-v1-modules\ndrwxrwxr-x  2 ubuntu ubuntu  4096 Apr 13 08:42 commands\n-rw-rw-r--  1 ubuntu ubuntu   548 Apr 13 08:42 embed-primitives.md.archived\n-rw-rw-r--  1 ubuntu ubuntu 22602 Apr 13 08:42 embed_primitives.py.archived\ndrwxrwxr-x  2 ubuntu ubuntu  4096 Apr 13 08:42 tasks\n"}],"isError":false,"timestamp":1777536401034}}
