{"type":"session","version":3,"id":"019ddd82-2388-7658-a46e-5b98fb237f19","timestamp":"2026-04-30T08:29:46.760Z","cwd":"/home/ubuntu/.hermes/agi"}
{"type":"model_change","id":"b250632c","parentId":null,"timestamp":"2026-04-30T08:29:50.792Z","provider":"minimax","modelId":"MiniMax-M2.7"}
{"type":"thinking_level_change","id":"d879022b","parentId":"b250632c","timestamp":"2026-04-30T08:29:50.792Z","thinkingLevel":"medium"}
{"type":"custom","customType":"plannotator","data":{"phase":"idle","planFilePath":"PLAN.md","savedState":null},"id":"1b564a05","parentId":"d879022b","timestamp":"2026-04-30T08:29:50.807Z"}
{"type":"message","id":"e3de2b65","parentId":"1b564a05","timestamp":"2026-04-30T08:29:50.828Z","message":{"role":"user","content":[{"type":"text","text":"Resume the autoresearch loop in ~/.hermes/agi/.\n     Read ~/.hermes/agi/autoresearch.md (current state + what's been tried).\n     Run exactly ONE experiment iteration:\n       1. Make one code change (small, targeted)\n       2. git commit\n       3. run_experiment (./autoresearch.sh)\n       4. log_experiment (keep if improved, discard if not)\n     After log_experiment, stop — do NOT loop again.\n     Report iteration result in one line to stdout."}],"timestamp":1777537790813}}
{"type":"message","id":"3de65f87","parentId":"e3de2b65","timestamp":"2026-04-30T08:29:54.987Z","message":{"role":"assistant","content":[{"type":"thinking","thinking":"Let me start by reading the autoresearch.md file to understand the current state and what's been tried.","thinkingSignature":"3ec30c71e9523c33514cfaa3128e0122f0c1959ef7bf1c6bc0210ebac5c4e207"},{"type":"toolCall","id":"call_function_jhd8qept5ixd_1","name":"read","arguments":{"path":"/home/ubuntu/.hermes/agi/autoresearch.md"}},{"type":"toolCall","id":"call_function_jhd8qept5ixd_2","name":"read","arguments":{"path":"/home/ubuntu/.hermes/agi/autoresearch.ideas.md"}}],"api":"anthropic-messages","provider":"minimax","model":"MiniMax-M2.7","usage":{"input":55,"output":91,"cacheRead":10071,"cacheWrite":113,"totalTokens":10330,"cost":{"input":0.000016499999999999998,"output":0.0001092,"cacheRead":0.0006042599999999999,"cacheWrite":0.000042375,"total":0.0007723349999999999}},"stopReason":"toolUse","timestamp":1777537790841,"responseId":"06424601eebd1578160499ab1154bad0"}}
{"type":"message","id":"222fea1c","parentId":"3de65f87","timestamp":"2026-04-30T08:29:55.013Z","message":{"role":"toolResult","toolCallId":"call_function_jhd8qept5ixd_1","toolName":"read","content":[{"type":"text","text":"# Autoresearch: DB-Augmented Directed Code Generation via Unified Graph Memory\n\n## Objective\n\nInvestigate using relational databases (Postgres-style linking/reference) as the backbone for agent-accessible knowledge graphs. Goal: enable agents to navigate code, memory, tasks, and ideas through a single unified graph interface that is equally readable by humans (ASCII art maps) and machines (structured DB queries).\n\nCore inspiration repos:\n- **GitNexus** (abhigyanpatwari) — graph-based code intelligence\n- **MemPalace** (MemPalace/mempalace) — agent memory graph\n- **llm-wiki-compiler** (atomicmemory) — wiki-to-graph pipeline\n- **LanguageAgentTreeSearch** (lapisrocks) — LATS-style reasoning\n- **SkillZero** (ZJU-REAL) — skill learning from graphs\n- **pi /tree** — pi CLI tree/graph rendering\n\nCore questions to explore:\n1. Can agents perceive ASCII visual graphs as efficiently as humans?\n2. Can we steer agents on CoT/reasoning paths using nothing but graphical-rendered maps?\n3. Can a single graph representation span episodic memories, coding ideas, task state, and world models?\n4. Can the \"soul\" (model) feel seamlessly embodied by the \"memory harness\" (graph)?\n5. The **holographic layer coupling** — how do we bind multiple context layers into a single coherent agent experience?\n\n## Metrics\n- **Primary**: `graph_build_time_ms` (ms, lower is better) — time to generate a graph from source state\n- **Secondary**: `graph_node_count` (nodes), `graph_edge_count` (edges), `query_time_ms` (DB query for path finding), `ascii_render_lines` (output length of rendered graph), `agent_comprehension_score` (manual 1-5 assessment per run in ASI)\n\n## How to Run\n`./autoresearch.sh` — outputs `METRIC name=number` lines.\n\n## Files in Scope\n\nAll files created under `.hermes/agi/`:\n- `schema.sql` — Postgres schema for the unified graph (nodes, edges, types, metadata)\n- `graph_builder.py` — builds graph from source material (codebases, memory files, task state)\n- `asciirender.py` — renders graph as ASCII art for agent/human consumption\n- `query_engine.py` — path finding, traversal, CoT graph-walking\n- `pi_tree_adapter.py` — adapter to feed graph output into pi's /tree feature\n- `experiments/` — subdirectory per experiment run storing inputs/outputs\n- `autoresearch.sh` — benchmark driver\n\n## Off Limits\n\n- Do not modify pi's internal source code\n- Do not touch the GitNexus index directly outside of normal git operations\n- No new system dependencies — use only Python stdlib + psycopg2-binary\n\n## Constraints\n\n- All generated code must be valid Python (no pseudocode in final output)\n- ASCII graph output must be ≤200 lines and ≤200 chars wide\n- DB schema must be Postgres-compatible (duckdb fallback OK for local runs)\n- pi subagent calls must be non-blocking and report results through ASI\n\n## What's Been Tried\n\n### Iteration 1-4: Performance Optimizations\n- **Baseline**: 377.21ms (55 nodes, 54 edges)\n- Pre-compiled regex patterns (minor improvement)\n- Gitnexus availability check (skip npx call if no index)\n- Persistent JSON cache file for gitnexus results\n- Cache loading moved before timing\n- **Result**: 0.37ms (75 nodes) — 1019x faster\n\n### Iteration 5-6: Modular System\n- Created `schema.sql` — Postgres-compatible graph schema\n- Created `graph_builder.py` — modular graph construction\n- Created `query_engine.py` — BFS/Dijkstra path finding\n- Created `asciirender.py` — ASCII art rendering\n- Created `pi_tree_adapter.py` — pi /tree integration\n- **Result**: 2.15ms (225 nodes) — 3x more data, still 175x faster than original\n\n### Node Composition (current — 886 nodes)\n- doc_section: 22, code_reference: 27, memory_session: 58, schema_entity: 10, schema_field: 141\n- decision: 128, lesson: 204, task: 84, goal: 5, agent_role: 4, agent_boundary: 15, agent_capability: 5\n- canvas_*: 105 (lesson:25, decision:22, command:30, task:5, project:5, pipeline:5, skill:3, knowledge:10)\n- knowledge: 15, reference: 1, handoff: 7, handoff_item: 35, gitnexus_definition: 20\n- **Total**: 923 nodes, 416 edges\n- archive_command: 38 (from archive/commands/*.md with upstream→decision cross-links)\n\n### Noise Floor Surmounted (via lru_cache)\n- lru_cache on _cached_build() makes warm load O(1) memory lookup\n- Warm load time now independent of cached data size\n- Previous noise floor ~0.3-0.5ms (pickle.load) bypassed entirely\n- Cold build: ~3.8ms (not measured in benchmark)\n- Shift to: data expansion, query ops, or architectural changes (duckdb)\n\n### Files Created\n- `schema.sql` — Postgres/DuckDB graph schema\n- `graph_builder.py` — Modular graph builder (923 nodes, lru_cache)\n- `query_engine.py` — Path finding engine\n- `asciirender.py` — ASCII renderer\n- `pi_tree_adapter.py` — pi tree integration\n\n### Iteration 1 (this session): Restore graph richness + tuple verification\n- Restored 142 schema_field nodes (was accidentally removed in earlier optimization)\n- Extended gitnexus cache TTL 1hr → 24hr\n- Tuple nodes: 0.50ms→0.45ms at 225 nodes (10% faster, noise floor)\n- **Result**: 0.45ms (225 nodes, 189 edges) — **keep**\n\n### Baseline\n- Original: 377.21ms (55 nodes, 54 edges) — pure Python parsing\n- **Current best**: 0.03ms (923 nodes, 416 edges) — lru_cache warm load, 12,574× faster than original\n- query_time_ms: 0.26ms (unidirectional BFS)\n- ascii_render_lines: 55 (rich multi-type visualization; was 7 before iter 33 renderer improvement)\n- Graph connectivity: only 54/923 nodes reachable in ≤5 hops from section_0 (disconnected clusters — inter-type edges needed)\n"}],"isError":false,"timestamp":1777537795013}}
{"type":"message","id":"5c3f2f42","parentId":"222fea1c","timestamp":"2026-04-30T08:29:55.014Z","message":{"role":"toolResult","toolCallId":"call_function_jhd8qept5ixd_2","toolName":"read","content":[{"type":"text","text":"# Autoresearch Ideas — Pruned 2026-04-30\n\n## DONE — Archived\n- [x] Pre-compile regex patterns — iter 1-4\n- [x] Gitnexus availability check + JSON cache — iter 2-3\n- [x] Pickle-based graph cache with pre-warm — iter 7\n- [x] Tuple nodes (smaller pickle) — iter 9, 15, 16\n- [x] lru_cache on builder internals — iter 21 (MAJOR breakthrough)\n- [x] Add decisions + lessons with lru_cache — iter 22\n- [x] Parse tasks/ directory — iter 23\n- [x] msgpack/json/mmap/pickle protocol micro-optimizations — REGRESSIONs confirmed noise floor\n- [x] GraphBuilder object caching (not raw tuples) — warm load O(1) regardless of node count — iter 30\n- [x] Parse goals/ — iter 24\n- [x] Parse agents/ — iter 28\n- [x] Parse canvas graph_data.json — iter 28\n- [x] Expand decisions (100→128) + lessons (100→204) — iter 30\n- [x] Expand memory (30→58) — iter 27\n\n## SATURATED — Primary metric noise floor\nThe graph_build_time_ms metric is at 0.03ms (lru_cache warm load).\n- 12,574× faster than original 377ms baseline\n- 1005× confidence above noise floor\n- lru_cache on GraphBuilder object → warm load O(1) regardless of node count\n- Further micro-optimizations: NO.\n- Serialization format experiments (pickle/json/msgpack): all REGRESSION or noise floor\n- Data expansion does NOT affect warm load (lru_cache absorbs all)\n\n## NOW WORTHWHILE — Data Expansion (richer graph, same speed)\n- [x] Parse all 84 tasks — DONE iter 25\n- [x] Parse goals/ — DONE iter 24\n- [x] Expand decisions/lessons to full set — DONE iter 30\n- [x] Expand memory to all 58 files — DONE iter 27\n- [x] Parse canvas graph_data.json — DONE iter 28\n- [x] Parse agents/ — DONE iter 28\n- [x] Parse knowledge/ directory (15 files) — DONE iter 28\n- [x] Parse handoff/ directory (7 files) — DONE iter 28\n- [x] Parse archive/commands (38 command docs with upstream→decision edges) — DONE iter 33\n- [ ] Parse canvas mapper_batch files for LINK responses — SKIP (raw LLM prompts, not parseable without LLM)\n\n## Architectural (secondary: query_time_ms, structural richness)\n- [ ] sqlite3 in-memory graph DB — rebuild from lru_cache on startup, SQL path queries\n  - Pro: SQL traversal, reachability queries, complex joins\n  - Con: ~0.1-0.2ms startup overhead per cold start; query gains marginal for small graphs\n  - sqlite3 is stdlib — no new dependency\n  - Risk: HIGH overhead for marginal secondary metric gain\n- [x] Revert bidirectional BFS to unidirectional (query_time_ms 0.51→0.27ms, iter 32)\n- [ ] Pre-compute reachability matrix — O(1) reachability queries (pre-build from adj)\n- [ ] Fix graph connectivity: only 54/923 nodes reachable in ≤5 hops (inter-cluster edges needed)\n  - Approach: tag-based relates_to edges between memory→decisions→lessons→tasks clusters\n\n## Visualization (secondary: ascii_render_lines, utility)\n- [x] Compact ASCII renderer — DONE iter 33 (55 lines, all node types + cross-type edge summary)\n- [ ] Mermaid diagram output — graphviz-free via text\n- [ ] pi /tree adapter — integrate with pi's built-in tree rendering\n\n## Interesting Findings\n- Gitnexus lbug file is NOT SQLite (header \"LBUG(\")\n- lru_cache on GraphBuilder object = true O(1) warm load (0.007ms bare Python, 0.03ms via benchmark)\n- pickle noise floor ~0.3-0.5ms (was the old ceiling before GraphBuilder caching)\n- 142 schema_field nodes accidentally removed then restored\n- gitnexus cache TTL 1hr → 24hr\n- Tuple reconstruction overhead scaled with node count — fixed by caching GraphBuilder directly\n- Bidirectional BFS REGRESSED query_time_ms — unidirectional BFS faster for small graphs\n- Graph connectivity: 54/923 nodes reachable within 5 hops from section_0 (94% of graph is isolated clusters)\n- ascii_render_lines noise floor ~7 lines (expanded to 55 by rendering all node types)\n- canvas mapper_batch files are raw LLM prompts, not parseable results\n- archive_command upstream fields link to decisions (38 commands × avg 1-2 upstream links → +36 edges)\n\n## Deferred (low priority / speculative)\n- Multi-repo graph (belam-codex + machinelearning cross-ref)\n- Embeddings-based semantic search for graph queries\n- LLM-based graph summarization\n- Incremental lru_cache invalidation (watch source files)\n- Parse machinelearning/ for cross-repo graph edges\n- Parse archive/codex-layer-v1-modules/*.py for code structure (function/method nodes)\n\n## Saturated / Not Worthwhile\n- Micro-optimizations to primary metric: 0.03ms is hardware noise floor\n- Serialization format experiments (pickle/json/msgpack): all noise floor or regression\n- sqlite3 backend: high implementation cost, marginal secondary metric gain\n- canvas mapper_batch: raw LLM prompts, not parseable without another LLM\n\n## Current Best (iter 32)\n- 0.03ms (886 nodes, 380 edges) — lru_cache warm load, 12,574× vs original\n- query_time_ms: 0.27ms (unidirectional BFS, 47% faster than bidirectional)\n- Node types: doc_section:22, code_ref:27, memory:58, schema_entity:10, schema_field:141,\n  decision:128, lesson:204, task:84, goal:5, agent_role:4, agent_boundary:15,\n  agent_capability:5, canvas_*:105, knowledge:15, reference:1, handoff:7, handoff_item:35, gitnexus_def:20\n- Original: 377.21ms (55 nodes, 54 edges)\n- Node types: doc_section:22, code_ref:27, memory:58, schema_entity:10, schema_field:141,\n  decision:128, lesson:204, task:84, goal:5, agent_role:4, agent_boundary:15,\n  agent_capability:5, canvas_*:105, gitnexus_def:20\n- Cold build: ~33ms (non-benchmarked path)\n"}],"isError":false,"timestamp":1777537795014}}
{"type":"message","id":"d3127e45","parentId":"5c3f2f42","timestamp":"2026-04-30T08:30:03.050Z","message":{"role":"assistant","content":[{"type":"thinking","thinking":"Let me understand the current state:\n- Primary metric: `graph_build_time_ms` is at noise floor (0.03ms with lru_cache)\n- Current best: 0.03ms (923 nodes, 416 edges)\n- The primary metric is saturated — 12,574× faster than original\n\nLooking at the ideas backlog, the areas worth exploring are:\n1. Data expansion (mostly done)\n2. Architectural improvements (sqlite3, pre-compute reachability)\n3. Fix graph connectivity (only 54/923 nodes reachable)\n4. Visualization improvements\n\nSince the primary metric is saturated, I should focus on secondary metrics or architectural improvements. Let me check what's in the experiments directory and what the current state of the code is.","thinkingSignature":"1e95201c69d3f8b3077edcb98c9b37f27c97b6a1fd6ff44075066effe0110539"},{"type":"text","text":"Let me check the current code state and recent commits:\n"},{"type":"toolCall","id":"call_function_re2ei4tgzijd_1","name":"bash","arguments":{"command":"cd /home/ubuntu/.hermes/agi && git log --oneline -10"}},{"type":"toolCall","id":"call_function_re2ei4tgzijd_2","name":"bash","arguments":{"command":"cd /home/ubuntu/.hermes/agi && ./autoresearch.sh 2>&1 | tail -30"}},{"type":"toolCall","id":"call_function_re2ei4tgzijd_3","name":"read","arguments":{"path":"/home/ubuntu/.hermes/agi/autoresearch.sh"}}],"api":"anthropic-messages","provider":"minimax","model":"MiniMax-M2.7","usage":{"input":3201,"output":279,"cacheRead":10071,"cacheWrite":0,"totalTokens":13551,"cost":{"input":0.0009603,"output":0.0003348,"cacheRead":0.0006042599999999999,"cacheWrite":0,"total":0.00189936}},"stopReason":"toolUse","timestamp":1777537795015,"responseId":"064246033bae02d8cbd0a10a58dcb586"}}
{"type":"message","id":"4e08d85e","parentId":"d3127e45","timestamp":"2026-04-30T08:30:03.073Z","message":{"role":"toolResult","toolCallId":"call_function_re2ei4tgzijd_1","toolName":"bash","content":[{"type":"text","text":"f19900f Tag-based relates_to edges: +48 edges bridging decision↔lesson↔task clusters via shared tags. 170 tags span multiple types. Top 20 tags × max 5 edges each. Graph connectivity should improve significantly. Primary stays at 0.03ms noise floor.\n662191f Fix build_tag_bridges: read tags from source files via hermes_dir\n54e94e9 Tag-based relates_to edges: bridge isolated decision/lesson/task clusters\n2c4a3fe Parse codex-layer-v1-modules/*.py: +37 nodes (3 modules, 4 classes, ~15 public methods), +17 edges (defines/implements/imports). Primary stays at 0.03ms noise floor. lru_cache absorbs new data.\n306c1f9 Parse codex-layer-v1-modules: codex_module/class/method nodes + defines/implements edges\n1ae97e1 Precompute key BFS paths in GraphBuilder: query_time_ms 0.57→~0ms (O(1) precomputed lookup vs BFS). Primary 0.03ms unchanged.\ndcff07c Precompute key BFS paths in GraphBuilder for O(1) query_time_ms\nceaba0d Parse archive/tasks: +17 nodes, +15 edges (5 archive_task + upstream/downstream/tag edges). Primary stays at 0.03ms noise floor.\na107cb2 Parse archive/tasks: add 5 archive_task nodes with upstream/downstream/tag edges\n8b514fe Sync state docs: node count 923, archive_command added, ideas pruned\n"}],"isError":false,"timestamp":1777537803073}}
{"type":"message","id":"bef1b292","parentId":"4e08d85e","timestamp":"2026-04-30T08:30:03.224Z","message":{"role":"toolResult","toolCallId":"call_function_re2ei4tgzijd_2","toolName":"bash","content":[{"type":"text","text":"METRIC graph_build_time_ms=0.04\nMETRIC graph_node_count=960\nMETRIC graph_edge_count=496\nMETRIC query_time_ms=0.0\nMETRIC ascii_render_lines=55\n\nMETRIC graph_build_time_ms=0.04\nMETRIC graph_node_count=960\nMETRIC graph_edge_count=496\nMETRIC query_time_ms=0.0\nMETRIC ascii_render_lines=55\nUsing modular system: True\n"}],"isError":false,"timestamp":1777537803223}}
{"type":"message","id":"c40f3916","parentId":"bef1b292","timestamp":"2026-04-30T08:30:03.224Z","message":{"role":"toolResult","toolCallId":"call_function_re2ei4tgzijd_3","toolName":"read","content":[{"type":"text","text":"#!/bin/bash\n# Autoresearch benchmark driver for DB-augmented graph code generation\n# Measures: graph build time, node/edge counts, query time, ASCII render size\n\nset -euo pipefail\n\nAGI_DIR=\"$(cd \"$(dirname \"$0\")\" && pwd)\"\nEXPERIMENT_DIR=\"$AGI_DIR/experiments/$(date +%Y%m%d_%H%M%S)\"\nmkdir -p \"$EXPERIMENT_DIR\"\n\n# --- Metric Definitions ---\n# Primary: graph_build_time_ms (lower is better)\n# Secondary: graph_node_count, graph_edge_count, query_time_ms, ascii_render_lines\n\n# If dependencies not installed, use stub metrics\nMETRIC_cmd=\"python3 $AGI_DIR/_benchmark.py 2>/dev/null || echo 'METRIC graph_build_time_ms=0'\"\n\n# Run benchmark and capture output\nOUTPUT=$($METRIC_cmd)\n\n# Echo raw output for visibility\necho \"$OUTPUT\"\n\n# Ensure we always output at least the primary metric\nif ! echo \"$OUTPUT\" | grep -q \"METRIC graph_build_time_ms=\"; then\n    echo \"METRIC graph_build_time_ms=0\"\nfi\n\nexit 0\n"}],"isError":false,"timestamp":1777537803224}}
{"type":"message","id":"d45e0df1","parentId":"c40f3916","timestamp":"2026-04-30T08:30:14.359Z","message":{"role":"assistant","content":[{"type":"thinking","thinking":"The current state:\n- Primary metric: 0.04ms (noise floor)\n- 960 nodes, 496 edges\n- query_time_ms: 0.0ms (O(1) precomputed lookup from iter 1ae97e1)\n- ascii_render_lines: 55\n\nLooking at the ideas:\n1. Primary metric is saturated at noise floor\n2. query_time_ms is already O(1) via precomputed BFS paths\n3. Graph connectivity is still an issue (need to check current connectivity)\n\nLet me look at what hasn't been tried that could improve secondary metrics or architectural quality:\n\nFrom the ideas:\n- [x] Precompute reachability matrix — done in iter 1ae97e1 (precomputed key BFS paths → query_time_ms 0.0ms)\n- [x] Fix graph connectivity via tag-based relates_to edges — done in f19900f\n\nThe main remaining items that could have impact:\n1. Mermaid diagram output (visualization)\n2. pi /tree adapter integration\n3. Parse machinelearning/ for cross-repo graph edges\n\nLet me check what's in the experiments directory and what could be a good next step. Since the primary metric is saturated, I should focus on expanding data or improving secondary metrics like connectivity or visualization.\n\nLet me check the current graph_builder.py to see what hasn't been parsed yet.","thinkingSignature":"4ecd0bda17f184676e9aabda408991c9abc6ff723a86e81ca6a4d74dda929592"},{"type":"text","text":"Let me check what's available to parse and the current graph_builder state:\n"},{"type":"toolCall","id":"call_function_vpbx2dtspxot_1","name":"bash","arguments":{"command":"cd /home/ubuntu/.hermes/agi && ls -la graph_builder.py asciirender.py query_engine.py pi_tree_adapter.py 2>/dev/null | head -20"}},{"type":"toolCall","id":"call_function_vpbx2dtspxot_2","name":"bash","arguments":{"command":"cd /home/ubuntu/.hermes/agi && find memory-sync memory-init memory-management memory-search -name \"*.md\" 2>/dev/null | head -20"}},{"type":"toolCall","id":"call_function_vpbx2dtspxot_3","name":"bash","arguments":{"command":"cd /home/ubuntu/.hermes/agi && cat graph_builder.py | head -150"}}],"api":"anthropic-messages","provider":"minimax","model":"MiniMax-M2.7","usage":{"input":4174,"output":449,"cacheRead":10071,"cacheWrite":0,"totalTokens":14694,"cost":{"input":0.0012522,"output":0.0005388,"cacheRead":0.0006042599999999999,"cacheWrite":0,"total":0.0023952599999999998}},"stopReason":"toolUse","timestamp":1777537803225,"responseId":"0642460b4c693057b6daa07329235991"}}
