{"type":"session","version":3,"id":"019ddd92-a2bf-7268-bf49-6c9d60dbc05a","timestamp":"2026-04-30T08:47:47.903Z","cwd":"/home/ubuntu/.hermes/agi"}
{"type":"model_change","id":"04dccacd","parentId":null,"timestamp":"2026-04-30T08:47:51.937Z","provider":"minimax","modelId":"MiniMax-M2.7"}
{"type":"thinking_level_change","id":"38029e7f","parentId":"04dccacd","timestamp":"2026-04-30T08:47:51.938Z","thinkingLevel":"medium"}
{"type":"custom","customType":"plannotator","data":{"phase":"idle","planFilePath":"PLAN.md","savedState":null},"id":"91acfbcd","parentId":"38029e7f","timestamp":"2026-04-30T08:47:51.953Z"}
{"type":"message","id":"757ff1f0","parentId":"91acfbcd","timestamp":"2026-04-30T08:47:51.974Z","message":{"role":"user","content":[{"type":"text","text":"Resume the autoresearch loop in ~/.hermes/agi/.\n     Read ~/.hermes/agi/autoresearch.md (current state + what's been tried).\n     Run exactly ONE experiment iteration:\n       1. Make one code change (small, targeted)\n       2. git commit\n       3. run_experiment (./autoresearch.sh)\n       4. log_experiment (keep if improved, discard if not)\n     After log_experiment, stop — do NOT loop again.\n     Report iteration result in one line to stdout."}],"timestamp":1777538871959}}
{"type":"message","id":"6b0de121","parentId":"757ff1f0","timestamp":"2026-04-30T08:47:57.566Z","message":{"role":"assistant","content":[{"type":"thinking","thinking":"Let me start by reading the autoresearch.md file to understand the current state and what's been tried.","thinkingSignature":"3ec30c71e9523c33514cfaa3128e0122f0c1959ef7bf1c6bc0210ebac5c4e207"},{"type":"toolCall","id":"call_function_kyvwtivrxrnl_1","name":"read","arguments":{"path":"/home/ubuntu/.hermes/agi/autoresearch.md"}},{"type":"toolCall","id":"call_function_kyvwtivrxrnl_2","name":"read","arguments":{"path":"/home/ubuntu/.hermes/agi/autoresearch.ideas.md"}}],"api":"anthropic-messages","provider":"minimax","model":"MiniMax-M2.7","usage":{"input":55,"output":91,"cacheRead":10071,"cacheWrite":113,"totalTokens":10330,"cost":{"input":0.000016499999999999998,"output":0.0001092,"cacheRead":0.0006042599999999999,"cacheWrite":0.000042375,"total":0.0007723349999999999}},"stopReason":"toolUse","timestamp":1777538871987,"responseId":"06424a3a3322e5abe940cd9e68d5eff6"}}
{"type":"message","id":"0cf2c33d","parentId":"6b0de121","timestamp":"2026-04-30T08:47:57.592Z","message":{"role":"toolResult","toolCallId":"call_function_kyvwtivrxrnl_1","toolName":"read","content":[{"type":"text","text":"# Autoresearch: DB-Augmented Directed Code Generation via Unified Graph Memory\n\n## Objective\n\nInvestigate using relational databases (Postgres-style linking/reference) as the backbone for agent-accessible knowledge graphs. Goal: enable agents to navigate code, memory, tasks, and ideas through a single unified graph interface that is equally readable by humans (ASCII art maps) and machines (structured DB queries).\n\nCore inspiration repos:\n- **GitNexus** (abhigyanpatwari) — graph-based code intelligence\n- **MemPalace** (MemPalace/mempalace) — agent memory graph\n- **llm-wiki-compiler** (atomicmemory) — wiki-to-graph pipeline\n- **LanguageAgentTreeSearch** (lapisrocks) — LATS-style reasoning\n- **SkillZero** (ZJU-REAL) — skill learning from graphs\n- **pi /tree** — pi CLI tree/graph rendering\n\nCore questions to explore:\n1. Can agents perceive ASCII visual graphs as efficiently as humans?\n2. Can we steer agents on CoT/reasoning paths using nothing but graphical-rendered maps?\n3. Can a single graph representation span episodic memories, coding ideas, task state, and world models?\n4. Can the \"soul\" (model) feel seamlessly embodied by the \"memory harness\" (graph)?\n5. The **holographic layer coupling** — how do we bind multiple context layers into a single coherent agent experience?\n\n## Metrics\n- **Primary**: `graph_build_time_ms` (ms, lower is better) — time to generate a graph from source state\n- **Secondary**: `graph_node_count` (nodes), `graph_edge_count` (edges), `query_time_ms` (DB query for path finding), `ascii_render_lines` (output length of rendered graph), `agent_comprehension_score` (manual 1-5 assessment per run in ASI)\n\n## How to Run\n`./autoresearch.sh` — outputs `METRIC name=number` lines.\n\n## Files in Scope\n\nAll files created under `.hermes/agi/`:\n- `schema.sql` — Postgres schema for the unified graph (nodes, edges, types, metadata)\n- `graph_builder.py` — builds graph from source material (codebases, memory files, task state)\n- `asciirender.py` — renders graph as ASCII art for agent/human consumption\n- `query_engine.py` — path finding, traversal, CoT graph-walking\n- `pi_tree_adapter.py` — adapter to feed graph output into pi's /tree feature\n- `experiments/` — subdirectory per experiment run storing inputs/outputs\n- `autoresearch.sh` — benchmark driver\n\n## Off Limits\n\n- Do not modify pi's internal source code\n- Do not touch the GitNexus index directly outside of normal git operations\n- No new system dependencies — use only Python stdlib + psycopg2-binary\n\n## Constraints\n\n- All generated code must be valid Python (no pseudocode in final output)\n- ASCII graph output must be ≤200 lines and ≤200 chars wide\n- DB schema must be Postgres-compatible (duckdb fallback OK for local runs)\n- pi subagent calls must be non-blocking and report results through ASI\n\n## What's Been Tried\n\n### Iteration 1-4: Performance Optimizations\n- **Baseline**: 377.21ms (55 nodes, 54 edges)\n- Pre-compiled regex patterns (minor improvement)\n- Gitnexus availability check (skip npx call if no index)\n- Persistent JSON cache file for gitnexus results\n- Cache loading moved before timing\n- **Result**: 0.37ms (75 nodes) — 1019x faster\n\n### Iteration 5-6: Modular System\n- Created `schema.sql` — Postgres-compatible graph schema\n- Created `graph_builder.py` — modular graph construction\n- Created `query_engine.py` — BFS/Dijkstra path finding\n- Created `asciirender.py` — ASCII art rendering\n- Created `pi_tree_adapter.py` — pi /tree integration\n- **Result**: 2.15ms (225 nodes) — 3x more data, still 175x faster than original\n\n### Node Composition (iter 41 — 1,131 nodes, 683 edges)\n- doc_section: 22, code_reference: 27, memory_session: 58, schema_entity: 10, schema_field: 141\n- decision: 128, lesson: 204, task: 84, goal: 5, agent_role: 4, agent_capability: ~20, agent_boundary: ~15\n- canvas_*: 105, knowledge: 15, handoff: 7, handoff_item: 35, reference: 1\n- archive_command: 38, archive_task: ~5, codex_module: 3, codex_class: 4, codex_method: ~15\n- skill: 89, skill_type: 26, gitnexus_definition: 20\n- tag: ~170, category_*: research, project, runbook, mode\n- docs: ~4, personas: ~3, research: 4, projects: 7, modes: 4, runbooks: 1\n- **Total**: 1,131 nodes, 683 edges\n\n### Noise Floor Surmounted (via lru_cache)\n- lru_cache on _cached_build() makes warm load O(1) memory lookup\n- Warm load time now independent of cached data size\n- Previous noise floor ~0.3-0.5ms (pickle.load) bypassed entirely\n- Cold build: ~3.8ms (not measured in benchmark)\n- Shift to: data expansion, query ops, or architectural changes (duckdb)\n\n### Files Created\n- `schema.sql` — Postgres/DuckDB graph schema\n- `graph_builder.py` — Modular graph builder (1,131 nodes, lru_cache)\n- `query_engine.py` — Path finding engine\n- `asciirender.py` — ASCII renderer\n- `pi_tree_adapter.py` — pi tree integration\n\n### Iteration 1 (this session): Restore graph richness + tuple verification\n- Restored 142 schema_field nodes (was accidentally removed in earlier optimization)\n- Extended gitnexus cache TTL 1hr → 24hr\n- Tuple nodes: 0.50ms→0.45ms at 225 nodes (10% faster, noise floor)\n- **Result**: 0.45ms (225 nodes, 189 edges) — **keep**\n\n### Baseline\n- Original: 377.21ms (55 nodes, 54 edges) — pure Python parsing\n- **Current best**: 0.03ms (1,131 nodes, 683 edges) — lru_cache warm load, 12,574× faster than original\n- query_time_ms: 0.26ms (unidirectional BFS)\n- ascii_render_lines: 55 (rich multi-type visualization; was 7 before iter 33 renderer improvement)\n- Graph connectivity: only 54/923 nodes reachable in ≤5 hops from section_0 (disconnected clusters — inter-type edges needed)\n"}],"isError":false,"timestamp":1777538877592}}
{"type":"message","id":"dcaa9288","parentId":"0cf2c33d","timestamp":"2026-04-30T08:47:57.592Z","message":{"role":"toolResult","toolCallId":"call_function_kyvwtivrxrnl_2","toolName":"read","content":[{"type":"text","text":"# Autoresearch Ideas — Pruned 2026-04-30\n\n## DONE — Archived\n- [x] Pre-compile regex patterns — iter 1-4\n- [x] Gitnexus availability check + JSON cache — iter 2-3\n- [x] Pickle-based graph cache with pre-warm — iter 7\n- [x] Tuple nodes (smaller pickle) — iter 9, 15, 16\n- [x] lru_cache on builder internals — iter 21 (MAJOR breakthrough)\n- [x] Add decisions + lessons with lru_cache — iter 22\n- [x] Parse tasks/ directory — iter 23\n- [x] msgpack/json/mmap/pickle protocol micro-optimizations — REGRESSIONs confirmed noise floor\n- [x] GraphBuilder object caching (not raw tuples) — warm load O(1) regardless of node count — iter 30\n- [x] Parse goals/ — iter 24\n- [x] Parse agents/ + agent_capability + agent_boundary — iter 28\n- [x] Parse canvas graph_data.json — iter 28\n- [x] Expand decisions (100→128) + lessons (100→204) — iter 30\n- [x] Expand memory (30→58) — iter 27\n- [x] Parse knowledge/ directory (15 files) — iter 28\n- [x] Parse handoff/ directory (7 files + handoff_items) — iter 28\n- [x] Parse archive/commands (38 command docs with upstream→decision edges) — iter 33\n- [x] Rich ASCII renderer (all node types + cross-type edge summary) — iter 34\n- [x] Precompute key BFS paths in GraphBuilder — iter 36 (query_time_ms → ~0ms)\n- [x] Parse archive/tasks/ — iter 35\n- [x] Parse codex-layer-v1-modules/*.py (codex_module/class/method nodes) — iter 37\n- [x] Tag-based relates_to edges bridging decision↔lesson↔task clusters — iter 38\n- [x] Parse skills/ (26 categories, 89 skills) — iter 39\n- [x] Parse docs/ (operational guides) + personas/ (agent archetypes) — iter 40\n- [x] Parse research/, projects/, modes/, runbooks/ — iter 41\n\n## SATURATED — Primary metric noise floor\nThe graph_build_time_ms metric is at 0.03ms (lru_cache warm load).\n- 12,574× faster than original 377ms baseline\n- lru_cache on GraphBuilder object → warm load O(1) regardless of node count\n- Further micro-optimizations: NO.\n- Serialization format experiments (pickle/json/msgpack): all REGRESSION or noise floor\n- Data expansion does NOT affect warm load (lru_cache absorbs all)\n\n## NOW WORTHWHILE — Data Expansion (richer graph, same speed)\n- [x] Parse all 84 tasks — DONE iter 25\n- [x] Parse goals/ — DONE iter 24\n- [x] Expand decisions/lessons to full set — DONE iter 30\n- [x] Expand memory to all 58 files — DONE iter 27\n- [x] Parse canvas graph_data.json — DONE iter 28\n- [x] Parse agents/ — DONE iter 28\n- [x] Parse knowledge/ directory (15 files) — DONE iter 28\n- [x] Parse handoff/ directory (7 files) — DONE iter 28\n- [x] Parse archive/commands (38 command docs) — DONE iter 33\n- [x] Parse docs/ + personas/ — DONE iter 40\n- [x] Parse research/ + projects/ + modes/ + runbooks/ — DONE iter 41\n- [ ] Parse pipelines/ (40+ research specs and setup guides) — largest unexplored dir\n- [ ] Parse templates/ (4 files) — low priority\n- [ ] Parse canvas mapper_batch files — SKIP (raw LLM prompts, not parseable without LLM)\n\n## Architectural (secondary: query_time_ms, structural richness)\n- [x] Revert bidirectional BFS to unidirectional (query_time_ms 0.51→0.27ms, iter 32)\n- [x] Precompute key BFS paths (query_time_ms → ~0ms) — DONE iter 36\n- [ ] Pre-compute reachability matrix — O(1) reachability queries (pre-build from adj)\n  - Only 54/1,131 nodes reachable in ≤5 hops from section_0 (94% still isolated)\n  - Reachability matrix would enable instant \"what relates to X\" queries\n  - Risk: matrix size grows O(n²) with node count\n- [ ] sqlite3 in-memory graph DB — rebuild from lru_cache on startup, SQL path queries\n  - Pro: SQL traversal, reachability queries, complex joins\n  - Con: ~0.1-0.2ms startup overhead per cold start\n  - Risk: HIGH overhead for marginal secondary metric gain\n\n## Visualization (secondary: ascii_render_lines, utility)\n- [x] Compact ASCII renderer — DONE iter 33 (55 lines, all node types + cross-type edge summary)\n- [ ] Mermaid diagram output — graphviz-free via text\n- [ ] pi /tree adapter — integrate with pi's built-in tree rendering\n\n## Interesting Findings\n- Gitnexus lbug file is NOT SQLite (header \"LBUG(\")\n- lru_cache on GraphBuilder object = true O(1) warm load (0.007ms bare Python, 0.03ms via benchmark)\n- pickle noise floor ~0.3-0.5ms (bypassed by GraphBuilder caching)\n- Tuple reconstruction overhead scaled with node count — fixed by caching GraphBuilder directly\n- Bidirectional BFS REGRESSED query_time_ms — unidirectional BFS faster for small graphs\n- Tag-based relates_to edges (+48) improved connectivity between isolated clusters\n- Precomputed BFS paths eliminated query_time_ms overhead entirely\n- lru_cache warm load is independent of graph size — 1,131 nodes same speed as 55\n- cold build path duplicates _cached_build_builder logic — maintenance risk but doesn't affect warm path\n\n## Deferred (low priority / speculative)\n- Multi-repo graph (belam-codex + machinelearning cross-ref)\n- Embeddings-based semantic search for graph queries\n- LLM-based graph summarization\n- Incremental lru_cache invalidation (watch source files)\n\n## Saturated / Not Worthwhile\n- Micro-optimizations to primary metric: 0.03ms is hardware noise floor\n- Serialization format experiments (pickle/json/msgpack): all noise floor or regression\n- sqlite3 backend: high implementation cost, marginal secondary metric gain\n- canvas mapper_batch: raw LLM prompts, not parseable without another LLM\n\n## Current Best (iter 41)\n- 0.03ms (1,131 nodes, 683 edges) — lru_cache warm load, 12,574× vs original\n- query_time_ms: ~0ms (precomputed BFS paths)\n- ascii_render_lines: 55 (rich multi-type visualization)\n- Node types: doc_section, code_ref, memory_session, schema_entity, schema_field,\n  decision, lesson, task, goal, agent_role, agent_capability, agent_boundary,\n  canvas_*, knowledge, handoff, handoff_item, gitnexus_def, archive_command,\n  archive_task, codex_module, codex_class, codex_method, codex_function,\n  skill, skill_type, reference, tag, category_*\n- Graph connectivity: tag-based relates_to edges improved cross-cluster connectivity\n- Cold build: ~3.8ms (non-benchmarked path)\n"}],"isError":false,"timestamp":1777538877592}}
{"type":"message","id":"079c7879","parentId":"dcaa9288","timestamp":"2026-04-30T08:48:03.854Z","message":{"role":"assistant","content":[{"type":"thinking","thinking":"Now let me check the current state of the code and the experiment files to understand what's available.","thinkingSignature":"c1a36a20d557d57def24c7f2f11803ce145fbdf4486d22f72a1b46812734ec49"},{"type":"text","text":"Good. Current best is 0.03ms (1,131 nodes, 683 edges) with lru_cache warm load. The primary metric is noise-floor saturated. The next unexplored direction is parsing `pipelines/` (40+ research specs). Let me check the current state of `graph_builder.py` and the pipelines directory.\n"},{"type":"toolCall","id":"call_function_fqcataq9izeo_1","name":"bash","arguments":{"command":"ls -la /home/ubuntu/.hermes/agi/ && echo \"---\" && ls /home/ubuntu/.hermes/agi/*.py 2>/dev/null && echo \"---\" && ls /home/ubuntu/.hermes/agi/pipelines/ 2>/dev/null | head -20"}},{"type":"toolCall","id":"call_function_fqcataq9izeo_2","name":"bash","arguments":{"command":"cat /home/ubuntu/.hermes/agi/autoresearch.sh"}}],"api":"anthropic-messages","provider":"minimax","model":"MiniMax-M2.7","usage":{"input":3433,"output":208,"cacheRead":10071,"cacheWrite":0,"totalTokens":13712,"cost":{"input":0.0010299,"output":0.0002496,"cacheRead":0.0006042599999999999,"cacheWrite":0,"total":0.00188376}},"stopReason":"toolUse","timestamp":1777538877593,"responseId":"06424a3d5dcab84ebea9e371ec945264"}}
{"type":"message","id":"07e441b2","parentId":"079c7879","timestamp":"2026-04-30T08:48:03.875Z","message":{"role":"toolResult","toolCallId":"call_function_fqcataq9izeo_1","toolName":"bash","content":[{"type":"text","text":"total 480\ndrwxrwxr-x  6 ubuntu ubuntu   4096 Apr 30 08:36 .\ndrwx------ 22 ubuntu ubuntu   4096 Apr 30 08:47 ..\ndrwxrwxr-x  8 ubuntu ubuntu   4096 Apr 30 08:47 .git\n-rw-rw-r--  1 ubuntu ubuntu   4654 Apr 30 07:51 .gitnexus_cache.json\n-rw-rw-r--  1 ubuntu ubuntu 230646 Apr 30 08:46 .graph_cache.pkl\ndrwxrwxr-x  2 ubuntu ubuntu   4096 Apr 30 08:45 __pycache__\n-rwxrwxr-x  1 ubuntu ubuntu  11831 Apr 30 08:20 _benchmark.py\n-rw-rw-r--  1 ubuntu ubuntu   8745 Apr 30 06:39 asciirender.py\n-rw-rw-r--  1 ubuntu ubuntu     26 Apr 30 05:54 autoresearch.config.json\n-rw-rw-r--  1 ubuntu ubuntu   6141 Apr 30 08:47 autoresearch.ideas.md\n-rw-rw-r--  1 ubuntu ubuntu  40362 Apr 30 08:46 autoresearch.jsonl\n-rw-rw-r--  1 ubuntu ubuntu   5662 Apr 30 08:47 autoresearch.md\n-rwxrwxr-x  1 ubuntu ubuntu    897 Apr 30 05:56 autoresearch.sh\ndrwxrwxr-x 88 ubuntu ubuntu   4096 Apr 30 08:46 experiments\n-rw-rw-r--  1 ubuntu ubuntu  88511 Apr 30 08:45 graph_builder.py\n-rw-rw-r--  1 ubuntu ubuntu   6105 Apr 30 08:47 loop.log\n-rw-rw-r--  1 ubuntu ubuntu    587 Apr 30 06:11 pi-agi.log\n-rw-rw-r--  1 ubuntu ubuntu   7368 Apr 30 06:15 pi_tree_adapter.py\n-rw-rw-r--  1 ubuntu ubuntu   7226 Apr 30 06:37 query_engine.py\n-rwxrwxr-x  1 ubuntu ubuntu   1985 Apr 30 06:24 run-loop.sh\n-rw-rw-r--  1 ubuntu ubuntu   2695 Apr 30 06:12 schema.sql\ndrwxrwxr-x  2 ubuntu ubuntu   4096 Apr 30 08:47 sessions\n-rwxrwxr-x  1 ubuntu ubuntu    823 Apr 30 06:02 start.sh\n---\n/home/ubuntu/.hermes/agi/_benchmark.py\n/home/ubuntu/.hermes/agi/asciirender.py\n/home/ubuntu/.hermes/agi/graph_builder.py\n/home/ubuntu/.hermes/agi/pi_tree_adapter.py\n/home/ubuntu/.hermes/agi/query_engine.py\n---\n"}],"isError":false,"timestamp":1777538883874}}
{"type":"message","id":"f58c9a10","parentId":"07e441b2","timestamp":"2026-04-30T08:48:03.876Z","message":{"role":"toolResult","toolCallId":"call_function_fqcataq9izeo_2","toolName":"bash","content":[{"type":"text","text":"#!/bin/bash\n# Autoresearch benchmark driver for DB-augmented graph code generation\n# Measures: graph build time, node/edge counts, query time, ASCII render size\n\nset -euo pipefail\n\nAGI_DIR=\"$(cd \"$(dirname \"$0\")\" && pwd)\"\nEXPERIMENT_DIR=\"$AGI_DIR/experiments/$(date +%Y%m%d_%H%M%S)\"\nmkdir -p \"$EXPERIMENT_DIR\"\n\n# --- Metric Definitions ---\n# Primary: graph_build_time_ms (lower is better)\n# Secondary: graph_node_count, graph_edge_count, query_time_ms, ascii_render_lines\n\n# If dependencies not installed, use stub metrics\nMETRIC_cmd=\"python3 $AGI_DIR/_benchmark.py 2>/dev/null || echo 'METRIC graph_build_time_ms=0'\"\n\n# Run benchmark and capture output\nOUTPUT=$($METRIC_cmd)\n\n# Echo raw output for visibility\necho \"$OUTPUT\"\n\n# Ensure we always output at least the primary metric\nif ! echo \"$OUTPUT\" | grep -q \"METRIC graph_build_time_ms=\"; then\n    echo \"METRIC graph_build_time_ms=0\"\nfi\n\nexit 0\n"}],"isError":false,"timestamp":1777538883876}}
{"type":"message","id":"9658b044","parentId":"f58c9a10","timestamp":"2026-04-30T08:48:07.149Z","message":{"role":"assistant","content":[{"type":"thinking","thinking":"Let me check the pipelines directory to see what kind of files are there.","thinkingSignature":"60453e161f7dcc935fbd65f003a0d3913d223b3dccb574c43944b9b68a240dd6"},{"type":"toolCall","id":"call_function_7jtjiuqo77fy_1","name":"bash","arguments":{"command":"ls /home/ubuntu/.hermes/agi/pipelines/ | head -30 && echo \"---\" && ls /home/ubuntu/.hermes/agi/pipelines/ | wc -l && echo \"---\" && cat /home/ubuntu/.hermes/agi/pipelines/*.md 2>/dev/null | head -80"}}],"api":"anthropic-messages","provider":"minimax","model":"MiniMax-M2.7","usage":{"input":4543,"output":109,"cacheRead":10071,"cacheWrite":0,"totalTokens":14723,"cost":{"input":0.0013629,"output":0.00013079999999999998,"cacheRead":0.0006042599999999999,"cacheWrite":0,"total":0.00209796}},"stopReason":"toolUse","timestamp":1777538883877,"responseId":"06424a4433147f740571f0fcc77307c8"}}
{"type":"message","id":"8164abb5","parentId":"9658b044","timestamp":"2026-04-30T08:48:07.163Z","message":{"role":"toolResult","toolCallId":"call_function_7jtjiuqo77fy_1","toolName":"bash","content":[{"type":"text","text":"ls: cannot access '/home/ubuntu/.hermes/agi/pipelines/': No such file or directory\n---\nls: cannot access '/home/ubuntu/.hermes/agi/pipelines/': No such file or directory\n0\n---\n"}],"isError":false,"timestamp":1777538887163}}
{"type":"message","id":"046eb5a1","parentId":"8164abb5","timestamp":"2026-04-30T08:48:10.337Z","message":{"role":"assistant","content":[{"type":"thinking","thinking":"The pipelines directory doesn't exist. Let me check what directories are available.","thinkingSignature":"b9480fb386116fa9a29d74a4f2962cbd3587f1c0977ee23446d66aaea1ece9a7"},{"type":"toolCall","id":"call_function_rxv62sclll73_1","name":"bash","arguments":{"command":"ls /home/ubuntu/.hermes/agi/ | sort && echo \"---\" && ls /home/ubuntu/.hermes/agi/templates/ 2>/dev/null | head -10 && echo \"---\" && ls /home/ubuntu/.hermes/agi/research/ 2>/dev/null | head -10"}}],"api":"anthropic-messages","provider":"minimax","model":"MiniMax-M2.7","usage":{"input":4718,"output":106,"cacheRead":10071,"cacheWrite":0,"totalTokens":14895,"cost":{"input":0.0014154,"output":0.0001272,"cacheRead":0.0006042599999999999,"cacheWrite":0,"total":0.00214686}},"stopReason":"toolUse","timestamp":1777538887164,"responseId":"06424a47c53712a9be0d4ef4e83f17e4"}}
