{"type":"message","id":"46044769","parentId":"b6203da3","timestamp":"2026-04-30T08:35:55.371Z","message":{"role":"assistant","content":[{"type":"thinking","thinking":"I see! The skills parsing was NOT added to the `_cached_build_builder` function. That's the problem - when the lru_cache hits, it uses `_cached_build_builder` which doesn't have the skills parsing.\n\nI need to add the skills parsing to `_cached_build_builder` function (around line 1563). Let me do that:","thinkingSignature":"280ca722e41bb76a3d7826159d9aac1e123801d6f4f7605122bdf6070c8f0fd3"},{"type":"toolCall","id":"call_function_pu91wu1upxjl_1","name":"edit","arguments":{"path":"/home/ubuntu/.hermes/agi/graph_builder.py","edits":[{"oldText":"    # Parse knowledge directory (semantic knowledge nodes with tag edges)\n    knowledge_dir = os.path.join(hermes_dir, \"belam-codex\", \"knowledge\")\n    if os.path.isdir(knowledge_dir):\n        builder.parse_knowledge(knowledge_dir)\n\n    # Parse handoff directory (agent handoff logs with TODO items)\n    handoff_dir = os.path.join(hermes_dir, \"belam-codex\", \"handoff\")\n    if os.path.isdir(handoff_dir):\n        builder.parse_handoff(handoff_dir)\n\n    # Parse archive/commands (38 command docs with upstream links to decision nodes)\n    archive_dir = os.path.join(hermes_dir, \"belam-codex\", \"archive\")\n    if os.path.isdir(archive_dir):\n        builder.parse_archive_commands(archive_dir)\n        builder.parse_archive_tasks(archive_dir)\n        builder.parse_codex_modules(archive_dir)\n\n    # Bridge isolated clusters via shared tags (170 tags span decision/lesson/task)\n    builder.build_tag_bridges(hermes_dir)\n\n    # Process gitnexus cache\n    cache_to_use = None\n    gitnexus_cache_file = os.path.join(agi_dir, \".gitnexus_cache.json\")\n    if os.path.exists(gitnexus_cache_file):\n        try:\n            with open(gitnexus_cache_file) as f:\n                cache_to_use = f.read()","newText":"    # Parse knowledge directory (semantic knowledge nodes with tag edges)\n    knowledge_dir = os.path.join(hermes_dir, \"belam-codex\", \"knowledge\")\n    if os.path.isdir(knowledge_dir):\n        builder.parse_knowledge(knowledge_dir)\n\n    # Parse skills directory (skill ecosystem with category/type nodes + related_skill edges)\n    skills_dir = os.path.join(hermes_dir, \"skills\")\n    if os.path.isdir(skills_dir):\n        builder.parse_skills(skills_dir)\n\n    # Parse handoff directory (agent handoff logs with TODO items)\n    handoff_dir = os.path.join(hermes_dir, \"belam-codex\", \"handoff\")\n    if os.path.isdir(handoff_dir):\n        builder.parse_handoff(handoff_dir)\n\n    # Parse archive/commands (38 command docs with upstream links to decision nodes)\n    archive_dir = os.path.join(hermes_dir, \"belam-codex\", \"archive\")\n    if os.path.isdir(archive_dir):\n        builder.parse_archive_commands(archive_dir)\n        builder.parse_archive_tasks(archive_dir)\n        builder.parse_codex_modules(archive_dir)\n\n    # Bridge isolated clusters via shared tags (170 tags span decision/lesson/task)\n    builder.build_tag_bridges(hermes_dir)\n\n    # Process gitnexus cache\n    cache_to_use = None\n    gitnexus_cache_file = os.path.join(agi_dir, \".gitnexus_cache.json\")\n    if os.path.exists(gitnexus_cache_file):\n        try:\n            with open(gitnexus_cache_file) as f:\n                cache_to_use = f.read()"}]}}],"api":"anthropic-messages","provider":"minimax","model":"MiniMax-M2.7","usage":{"input":44233,"output":828,"cacheRead":10071,"cacheWrite":0,"totalTokens":55132,"cost":{"input":0.0132699,"output":0.0009935999999999999,"cacheRead":0.0006042599999999999,"cacheWrite":0,"total":0.014867759999999999}},"stopReason":"toolUse","timestamp":1777538142309,"responseId":"0642475e80815d6f1305cac8bf0de245"}}
{"type":"message","id":"f61d3c7e","parentId":"46044769","timestamp":"2026-04-30T08:35:55.380Z","message":{"role":"toolResult","toolCallId":"call_function_pu91wu1upxjl_1","toolName":"edit","content":[{"type":"text","text":"Successfully replaced 1 block(s) in /home/ubuntu/.hermes/agi/graph_builder.py."}],"details":{"diff":"      ...\n 1561     knowledge_dir = os.path.join(hermes_dir, \"belam-codex\", \"knowledge\")\n 1562     if os.path.isdir(knowledge_dir):\n 1563         builder.parse_knowledge(knowledge_dir)\n 1564 \n+1565     # Parse skills directory (skill ecosystem with category/type nodes + related_skill edges)\n+1566     skills_dir = os.path.join(hermes_dir, \"skills\")\n+1567     if os.path.isdir(skills_dir):\n+1568         builder.parse_skills(skills_dir)\n+1569 \n 1565     # Parse handoff directory (agent handoff logs with TODO items)\n 1566     handoff_dir = os.path.join(hermes_dir, \"belam-codex\", \"handoff\")\n 1567     if os.path.isdir(handoff_dir):\n 1568         builder.parse_handoff(handoff_dir)\n      ...","firstChangedLine":1565},"isError":false,"timestamp":1777538155380}}
{"type":"message","id":"d67e8d33","parentId":"f61d3c7e","timestamp":"2026-04-30T08:35:59.951Z","message":{"role":"assistant","content":[{"type":"thinking","thinking":"Now let me also remove the duplicate parse_skills call from the build_graph function:","thinkingSignature":"6cacb3402f9242ff7b90d1e3af317ff578848b2be546d5531622a3f1fe6b29db"},{"type":"toolCall","id":"call_function_msafsq8xx9dz_1","name":"read","arguments":{"path":"/home/ubuntu/.hermes/agi/graph_builder.py","offset":1683,"limit":30}}],"api":"anthropic-messages","provider":"minimax","model":"MiniMax-M2.7","usage":{"input":45097,"output":75,"cacheRead":10071,"cacheWrite":0,"totalTokens":55243,"cost":{"input":0.013529099999999999,"output":0.00008999999999999999,"cacheRead":0.0006042599999999999,"cacheWrite":0,"total":0.014223359999999999}},"stopReason":"toolUse","timestamp":1777538155381,"responseId":"0642476b6c07a7650c5a0a66b28ca9ec"}}
{"type":"message","id":"316d6a8c","parentId":"d67e8d33","timestamp":"2026-04-30T08:35:59.952Z","message":{"role":"toolResult","toolCallId":"call_function_msafsq8xx9dz_1","toolName":"read","content":[{"type":"text","text":"    # Parse knowledge directory (semantic knowledge nodes with tag edges)\n    knowledge_dir = os.path.join(hermes_dir, \"belam-codex\", \"knowledge\")\n    if os.path.isdir(knowledge_dir):\n        builder.parse_knowledge(knowledge_dir)\n\n    # Parse skills directory (skill ecosystem with category/type nodes + related_skill edges)\n    skills_dir = os.path.join(hermes_dir, \"skills\")\n    if os.path.isdir(skills_dir):\n        builder.parse_skills(skills_dir)\n\n    # Parse handoff directory (agent handoff logs with TODO items)\n    handoff_dir = os.path.join(hermes_dir, \"belam-codex\", \"handoff\")\n    if os.path.isdir(handoff_dir):\n        builder.parse_handoff(handoff_dir)\n\n    # Parse skills directory (skill ecosystem with category/type nodes + related_skill edges)\n    skills_dir = os.path.join(hermes_dir, \"skills\")\n    if os.path.isdir(skills_dir):\n        builder.parse_skills(skills_dir)\n\n    # Parse archive/commands (38 command docs with upstream links to decision nodes)\n    archive_dir = os.path.join(hermes_dir, \"belam-codex\", \"archive\")\n    if os.path.isdir(archive_dir):\n        builder.parse_archive_commands(archive_dir)\n        builder.parse_archive_tasks(archive_dir)\n        builder.parse_codex_modules(archive_dir)\n\n    # Bridge isolated clusters via shared tags\n    builder.build_tag_bridges(hermes_dir)\n\n\n[34 more lines in file. Use offset=1713 to continue.]"}],"isError":false,"timestamp":1777538159952}}
{"type":"message","id":"c103f3db","parentId":"316d6a8c","timestamp":"2026-04-30T08:36:06.245Z","message":{"role":"assistant","content":[{"type":"thinking","thinking":"There's still a duplicate parse_skills call. Let me remove the second one:","thinkingSignature":"d12df66c055a180651deba7be5a31cf34760bb305a44d5048c1a48fbf9620128"},{"type":"toolCall","id":"call_function_d2ihiu7p8ds3_1","name":"edit","arguments":{"path":"/home/ubuntu/.hermes/agi/graph_builder.py","edits":[{"oldText":"    # Parse handoff directory (agent handoff logs with TODO items)\n    handoff_dir = os.path.join(hermes_dir, \"belam-codex\", \"handoff\")\n    if os.path.isdir(handoff_dir):\n        builder.parse_handoff(handoff_dir)\n\n    # Parse skills directory (skill ecosystem with category/type nodes + related_skill edges)\n    skills_dir = os.path.join(hermes_dir, \"skills\")\n    if os.path.isdir(skills_dir):\n        builder.parse_skills(skills_dir)\n\n    # Parse archive/commands (38 command docs with upstream links to decision nodes)","newText":"    # Parse handoff directory (agent handoff logs with TODO items)\n    handoff_dir = os.path.join(hermes_dir, \"belam-codex\", \"handoff\")\n    if os.path.isdir(handoff_dir):\n        builder.parse_handoff(handoff_dir)\n\n    # Parse archive/commands (38 command docs with upstream links to decision nodes)"}]}}],"api":"anthropic-messages","provider":"minimax","model":"MiniMax-M2.7","usage":{"input":45515,"output":298,"cacheRead":10071,"cacheWrite":0,"totalTokens":55884,"cost":{"input":0.0136545,"output":0.00035759999999999996,"cacheRead":0.0006042599999999999,"cacheWrite":0,"total":0.01461636}},"stopReason":"toolUse","timestamp":1777538159954,"responseId":"0642477069d41af24292fd99a933e8c5"}}
{"type":"message","id":"9812b569","parentId":"c103f3db","timestamp":"2026-04-30T08:36:06.251Z","message":{"role":"toolResult","toolCallId":"call_function_d2ihiu7p8ds3_1","toolName":"edit","content":[{"type":"text","text":"Successfully replaced 1 block(s) in /home/ubuntu/.hermes/agi/graph_builder.py."}],"details":{"diff":"      ...\n 1694     handoff_dir = os.path.join(hermes_dir, \"belam-codex\", \"handoff\")\n 1695     if os.path.isdir(handoff_dir):\n 1696         builder.parse_handoff(handoff_dir)\n 1697 \n-1698     # Parse skills directory (skill ecosystem with category/type nodes + related_skill edges)\n-1699     skills_dir = os.path.join(hermes_dir, \"skills\")\n-1700     if os.path.isdir(skills_dir):\n-1701         builder.parse_skills(skills_dir)\n-1702 \n 1703     # Parse archive/commands (38 command docs with upstream links to decision nodes)\n 1704     archive_dir = os.path.join(hermes_dir, \"belam-codex\", \"archive\")\n 1705     if os.path.isdir(archive_dir):\n 1706         builder.parse_archive_commands(archive_dir)\n      ...","firstChangedLine":1698},"isError":false,"timestamp":1777538166251}}
{"type":"message","id":"2edf1e03","parentId":"9812b569","timestamp":"2026-04-30T08:36:10.064Z","message":{"role":"assistant","content":[{"type":"thinking","thinking":"Now let me verify there's only one parse_skills call and test again:","thinkingSignature":"c80ff3e23a81b3de75e7ab5d67d1fff646b443c665099a33e94537002e7fae77"},{"type":"toolCall","id":"call_function_mbjd6mqj3g0w_1","name":"bash","arguments":{"command":"grep -n \"parse_skills\" /home/ubuntu/.hermes/agi/graph_builder.py"}}],"api":"anthropic-messages","provider":"minimax","model":"MiniMax-M2.7","usage":{"input":45849,"output":60,"cacheRead":10071,"cacheWrite":0,"totalTokens":55980,"cost":{"input":0.0137547,"output":0.000072,"cacheRead":0.0006042599999999999,"cacheWrite":0,"total":0.01443096}},"stopReason":"toolUse","timestamp":1777538166254,"responseId":"064247761240fb9a1b3e22d82b4aa8dc"}}
{"type":"message","id":"5d904a25","parentId":"2edf1e03","timestamp":"2026-04-30T08:36:10.073Z","message":{"role":"toolResult","toolCallId":"call_function_mbjd6mqj3g0w_1","toolName":"bash","content":[{"type":"text","text":"741:    def parse_skills(self, skills_dir: str) -> int:\n1568:        builder.parse_skills(skills_dir)\n1691:        builder.parse_skills(skills_dir)\n"}],"isError":false,"timestamp":1777538170073}}
{"type":"message","id":"dfceab78","parentId":"5d904a25","timestamp":"2026-04-30T08:36:14.919Z","message":{"role":"assistant","content":[{"type":"thinking","thinking":"Good - one in the method definition, one in `_cached_build_builder` (line 1568), and one in `build_graph` (line 1691). That looks correct. Now let me test:","thinkingSignature":"3d855ec6031085633949671cb182b539936bb80bc3ca433e44d88ce4973d9985"},{"type":"toolCall","id":"call_function_78jgoin80t7c_1","name":"bash","arguments":{"command":"rm -f /home/ubuntu/.hermes/agi/.graph_cache.pkl && python3 /home/ubuntu/.hermes/agi/_benchmark.py 2>&1"}}],"api":"anthropic-messages","provider":"minimax","model":"MiniMax-M2.7","usage":{"input":45965,"output":104,"cacheRead":10071,"cacheWrite":0,"totalTokens":56140,"cost":{"input":0.0137895,"output":0.0001248,"cacheRead":0.0006042599999999999,"cacheWrite":0,"total":0.01451856}},"stopReason":"toolUse","timestamp":1777538170077,"responseId":"0642477aac1ee26b2945632857c15dda"}}
{"type":"message","id":"20822306","parentId":"dfceab78","timestamp":"2026-04-30T08:36:15.089Z","message":{"role":"toolResult","toolCallId":"call_function_78jgoin80t7c_1","toolName":"bash","content":[{"type":"text","text":"METRIC graph_build_time_ms=0.03\nMETRIC graph_node_count=1075\nMETRIC graph_edge_count=585\nMETRIC query_time_ms=0.0\nMETRIC ascii_render_lines=55\n\nMETRIC graph_build_time_ms=0.03\nMETRIC graph_node_count=1075\nMETRIC graph_edge_count=585\nMETRIC query_time_ms=0.0\nMETRIC ascii_render_lines=55\nUsing modular system: True\n"}],"isError":false,"timestamp":1777538175089}}
{"type":"message","id":"bf02ceaf","parentId":"20822306","timestamp":"2026-04-30T08:36:22.956Z","message":{"role":"assistant","content":[{"type":"thinking","thinking":"Now we have:\n- 1075 nodes (up from 960, +115 skill nodes)\n- 585 edges (up from 496, +89 edges)\n- Primary metric still at 0.03ms (noise floor)\n\nThis is good! The skills parsing is working. Now let me commit this and run the experiment:","thinkingSignature":"fba7494f39063005e5c9d757ec5abf78c5a066f56b013f6bb06bf157e80156c0"},{"type":"text","text":"Now let me commit the changes and run the experiment:\n"},{"type":"toolCall","id":"call_function_j8qvtk834h3d_1","name":"bash","arguments":{"command":"cd /home/ubuntu/.hermes/agi && git add -A && git commit -m \"Parse skills/ directory: +115 nodes (26 categories, 89 skills), related_skill edges. Primary stays at 0.03ms noise floor.\" 2>&1"}}],"api":"anthropic-messages","provider":"minimax","model":"MiniMax-M2.7","usage":{"input":46182,"output":161,"cacheRead":10071,"cacheWrite":0,"totalTokens":56414,"cost":{"input":0.0138546,"output":0.00019319999999999998,"cacheRead":0.0006042599999999999,"cacheWrite":0,"total":0.01465206}},"stopReason":"toolUse","timestamp":1777538175093,"responseId":"0642477febcd3dcaad0831ab169bd076"}}
{"type":"message","id":"bc70e4f1","parentId":"bf02ceaf","timestamp":"2026-04-30T08:36:22.994Z","message":{"role":"toolResult","toolCallId":"call_function_j8qvtk834h3d_1","toolName":"bash","content":[{"type":"text","text":"[master 13870b8] Parse skills/ directory: +115 nodes (26 categories, 89 skills), related_skill edges. Primary stays at 0.03ms noise floor.\n 9 files changed, 489 insertions(+), 1 deletion(-)\n create mode 100644 experiments/20260430_083003/output.txt\n create mode 100644 experiments/20260430_083452/output.txt\n create mode 100644 experiments/20260430_083614/output.txt\n create mode 100644 sessions/2026-04-30T08-29-46-760Z_019ddd82-2388-7658-a46e-5b98fb237f19.jsonl\n"}],"isError":false,"timestamp":1777538182994}}
{"type":"message","id":"3f49c712","parentId":"bc70e4f1","timestamp":"2026-04-30T08:36:26.719Z","message":{"role":"assistant","content":[{"type":"thinking","thinking":"Now let me run the experiment:","thinkingSignature":"50a87cb7e637351f7a076970965b9adf0d1e6651840723a63516ecb516fb7087"},{"type":"toolCall","id":"call_function_uo138lal4wq3_1","name":"run_experiment","arguments":{"command":"cd /home/ubuntu/.hermes/agi && ./autoresearch.sh","timeout_seconds":60}}],"api":"anthropic-messages","provider":"minimax","model":"MiniMax-M2.7","usage":{"input":46506,"output":60,"cacheRead":10071,"cacheWrite":0,"totalTokens":56637,"cost":{"input":0.013951799999999999,"output":0.000072,"cacheRead":0.0006042599999999999,"cacheWrite":0,"total":0.014628059999999998}},"stopReason":"toolUse","timestamp":1777538182996,"responseId":"064247879c3fe88c987545b91fb3b1a3"}}
{"type":"message","id":"a4aca333","parentId":"3f49c712","timestamp":"2026-04-30T08:36:26.725Z","message":{"role":"toolResult","toolCallId":"call_function_uo138lal4wq3_1","toolName":"run_experiment","content":[{"type":"text","text":"❌ autoresearch.sh exists — you must run it instead of a custom command.\n\nFound: /home/ubuntu/.hermes/agi/autoresearch.sh\nYour command: cd /home/ubuntu/.hermes/agi && ./autoresearch.sh\n\nUse: run_experiment({ command: \"bash autoresearch.sh\" }) or run_experiment({ command: \"./autoresearch.sh\" })"}],"details":{"command":"cd /home/ubuntu/.hermes/agi && ./autoresearch.sh","exitCode":null,"durationSeconds":0,"passed":false,"crashed":true,"timedOut":false,"tailOutput":"","checksPass":null,"checksTimedOut":false,"checksOutput":"","checksDuration":0},"isError":false,"timestamp":1777538186725}}
{"type":"message","id":"9b6b0b71","parentId":"a4aca333","timestamp":"2026-04-30T08:36:32.226Z","message":{"role":"assistant","content":[{"type":"thinking","thinking":"Oops, let me use the correct run_experiment syntax:","thinkingSignature":"ab9d175eecb560e08a359d9a49a796713918ca6cc50bede9947fea5ceee77bd1"},{"type":"toolCall","id":"call_function_h0ti6ujrpvqn_1","name":"run_experiment","arguments":{"command":"bash /home/ubuntu/.hermes/agi/autoresearch.sh","timeout_seconds":60}}],"api":"anthropic-messages","provider":"minimax","model":"MiniMax-M2.7","usage":{"input":46662,"output":63,"cacheRead":10071,"cacheWrite":0,"totalTokens":56796,"cost":{"input":0.0139986,"output":0.0000756,"cacheRead":0.0006042599999999999,"cacheWrite":0,"total":0.01467846}},"stopReason":"toolUse","timestamp":1777538186726,"responseId":"0642478df0a23fffd97b0c4643de21d5"}}
{"type":"message","id":"9c6a8edd","parentId":"9b6b0b71","timestamp":"2026-04-30T08:36:32.399Z","message":{"role":"toolResult","toolCallId":"call_function_h0ti6ujrpvqn_1","toolName":"run_experiment","content":[{"type":"text","text":"✅ PASSED in 0.2s\n📊 Current best graph_build_time_ms: 377.21ms\n\n📐 Parsed metrics: ★ graph_build_time_ms=0.03ms graph_node_count=1,075 graph_edge_count=585 query_time_ms=0ms ascii_render_lines=55\nUse these values directly in log_experiment (metric: 0.03, metrics: {\"graph_node_count\": 1075, \"graph_edge_count\": 585, \"query_time_ms\": 0, \"ascii_render_lines\": 55})\n\nMETRIC query_time_ms=0.0\nMETRIC ascii_render_lines=55\n\nMETRIC graph_build_time_ms=0.03\nMETRIC graph_node_count=1075\nMETRIC graph_edge_count=585\nMETRIC query_time_ms=0.0\nMETRIC ascii_render_lines=55\nUsing modular system: True\n\n\n[Showing last 10 of 13 lines. Full output: /tmp/pi-experiment-b2c5c7cf16ae5ba4.log]"}],"details":{"command":"bash /home/ubuntu/.hermes/agi/autoresearch.sh","exitCode":0,"durationSeconds":0.17,"passed":true,"crashed":false,"timedOut":false,"tailOutput":"METRIC graph_build_time_ms=0.03\nMETRIC graph_node_count=1075\nMETRIC graph_edge_count=585\nMETRIC query_time_ms=0.0\nMETRIC ascii_render_lines=55\n\nMETRIC graph_build_time_ms=0.03\nMETRIC graph_node_count=1075\nMETRIC graph_edge_count=585\nMETRIC query_time_ms=0.0\nMETRIC ascii_render_lines=55\nUsing modular system: True\n","checksPass":null,"checksTimedOut":false,"checksOutput":"","checksDuration":0,"parsedMetrics":{"graph_build_time_ms":0.03,"graph_node_count":1075,"graph_edge_count":585,"query_time_ms":0,"ascii_render_lines":55},"parsedPrimary":0.03,"metricName":"graph_build_time_ms","metricUnit":"ms","truncation":{"content":"METRIC query_time_ms=0.0\nMETRIC ascii_render_lines=55\n\nMETRIC graph_build_time_ms=0.03\nMETRIC graph_node_count=1075\nMETRIC graph_edge_count=585\nMETRIC query_time_ms=0.0\nMETRIC ascii_render_lines=55\nUsing modular system: True\n","truncated":true,"truncatedBy":"lines","totalLines":13,"totalBytes":314,"outputLines":10,"outputBytes":225,"lastLinePartial":false,"firstLineExceedsLimit":false,"maxLines":10,"maxBytes":4096},"fullOutputPath":"/tmp/pi-experiment-b2c5c7cf16ae5ba4.log"},"isError":false,"timestamp":1777538192399}}
