{"type":"message","id":"7ad9f858","parentId":"11d53c91","timestamp":"2026-04-30T07:33:44.425Z","message":{"role":"toolResult","toolCallId":"call_function_samp0n7gme1n_3","toolName":"read","content":[{"type":"text","text":"# Autoresearch Ideas\n\n## Tried & Stale (NOT worth revisiting)\n- [x] Pre-compile regex in graph_builder module — done in iter 1-4\n- [x] Module-level pickle import — no effect (noise floor)\n- [x] __slots__ on GraphBuilder — no effect (pickle.load is the bottleneck)\n- [x] Add decisions/lessons parsers (pickle approach) — 2.4x slower at 436 nodes (pickle scales with size)\n- [x] Persistent gitnexus JSON cache — done earlier\n- [x] Pre-warm pickle cache before timing — done, gives 0.50ms\n- [x] json instead of pickle — REGRESSION: 1.67ms vs 0.50ms\n- [x] Pre-build node index — no effect\n- [x] Skip adj from pickle cache — REGRESSION: 1.16ms vs 0.50ms\n- [x] Skip `_node_ids` reconstruction — noise floor\n- [x] Compact node representation (tuples) — 0.50ms→0.45ms at 225 nodes (10% faster). Noise floor ~0.3-0.5ms. DONE.\n- [x] msgpack instead of pickle — REGRESSION: 1.77ms vs 0.45ms. Pickle faster for Python tuples/lists.\n- [x] mmap for pickle load — no improvement: 0.46ms vs 0.45ms baseline. Overhead exceeds syscall savings for 8KB file.\n- [x] lru_cache supersedes all pickle micro-optimizations — warm load is O(1) memory lookup now\n- [x] pickle.HIGHEST_PROTOCOL — no change (already default in Python 3.8+)\n- [x] Skip source_mtimes stat — done; lru_cache makes this irrelevant\n\n## Data Expansion (NOW POSSIBLE with lru_cache)\n- [x] Add decisions (10) + lessons (10) with lru_cache — 0.03ms at 245 nodes (unchanged from 0.04ms at 225) ✓ DONE\n- [ ] Parse tasks/ directory for task state nodes\n- [ ] Parse belam-codex archive/ for archived files\n- [ ] Parse belam-codex canvas/ for canvas state nodes\n- [ ] Expand decisions/lessons beyond 10 limit (potential 300-400 nodes with lru_cache)\n\n## Promising (not tried)\n- [ ] duckdb backend — persistent graph DB, fast SQL queries (useful for complex graph traversals)\n- [ ] Incremental lru_cache invalidation — watch source files, clear cache on change (avoids stale cache)\n\n## Data Source Expansion (secondary metric: node richness, ~225→400+ nodes)\n- [ ] Parse tasks/ directory for task state nodes\n- [ ] Parse state/ directory for runtime state nodes\n- [ ] Parse belam-codex decisions/ for decision nodes (limit to 10)\n- [ ] Parse belam-codex lessons/ for lesson nodes (limit to 10)\n\n## Query Optimizations (secondary metric: query_time_ms)\n- [ ] Bidirectional BFS — faster path finding for disconnected graphs\n- [ ] Pre-compute reachability matrix for common query pairs\n\n## Visualization\n- [ ] Add mermaid diagram output\n- [ ] Compact ASCII renderer (pack more nodes per line)\n\n## Interesting Findings\n- Gitnexus lbug file is NOT SQLite (despite .db-like header \"LBUG(\")\n- npx gitnexus call takes ~1.9s but is cacheable\n- **Noise floor confirmed**: ~0.3-0.5ms for pickle.load at 225 nodes\n- Pickle load time scales linearly with node count (~0.5ms/225 nodes = ~2.2µs/node)\n- 142 schema_field nodes were accidentally removed in earlier optimization; restored\n- gitnexus cache TTL was 1hr (too short); extended to 24hr\n\n## Deferred Ideas\n- Multi-repo graph building (belam-codex + machinelearning cross-ref)\n- Embeddings-based semantic search for graph queries\n- LLM-based graph summarization\n- pi /tree adapter integration for graph viz\n\n## Current Best\n- 0.45ms (225 nodes, 189 edges) — tuple nodes + pickle cache + schema_field nodes restored\n- 0.32ms (84 nodes) — shorter TTL, fewer nodes, NOT comparable\n- Original baseline: 377.21ms (55 nodes, 54 edges) — 838x faster\n"}],"isError":false,"timestamp":1777534424425}}
{"type":"message","id":"f692b439","parentId":"7ad9f858","timestamp":"2026-04-30T07:33:56.028Z","message":{"role":"assistant","content":[{"type":"thinking","thinking":"Now I have a clear picture. Let me understand the current state:\n\n**Current best**: 0.03ms (245 nodes, 189 edges) with lru_cache — the warm load is now O(1) memory lookup and is essentially at the noise floor.\n\n**Ideas backlog** suggests promising paths:\n1. Parse tasks/ directory for task state nodes\n2. Parse belam-codex archive/ for archived files\n3. Expand decisions/lessons beyond 10 limit\n4. duckdb backend for persistent graph DB\n\nLet me check the current code and what's in the directory to find a good targeted change.\n\nKey things from the ideas:\n\n\nThe tasks/ and belam-codex/ directories are the most actionable next steps since the lru_cache already handles performance, but I should examine the actual codebase first to understand the structure before deciding which one to tackle.","thinkingSignature":"daa32278bc3c2f6cbeec7fab55c9cdd8a44e2c32c8a0ec82130275ca211a68e1"},{"type":"toolCall","id":"call_function_ppsjhfcffvt5_1","name":"bash","arguments":{"command":"cd /home/ubuntu/.hermes/agi && ls -la"}},{"type":"toolCall","id":"call_function_ppsjhfcffvt5_2","name":"read","arguments":{"path":"/home/ubuntu/.hermes/agi/autoresearch.sh"}}],"api":"anthropic-messages","provider":"minimax","model":"MiniMax-M2.7","usage":{"input":7625,"output":247,"cacheRead":10071,"cacheWrite":0,"totalTokens":17943,"cost":{"input":0.0022875,"output":0.0002964,"cacheRead":0.0006042599999999999,"cacheWrite":0,"total":0.0031881599999999998}},"stopReason":"toolUse","timestamp":1777534424427,"responseId":"064238d8b57355f67cd1af32c8e1c3f7"}}
{"type":"message","id":"9ff1f29a","parentId":"f692b439","timestamp":"2026-04-30T07:33:56.043Z","message":{"role":"toolResult","toolCallId":"call_function_ppsjhfcffvt5_1","toolName":"bash","content":[{"type":"text","text":"total 204\ndrwxrwxr-x  6 ubuntu ubuntu  4096 Apr 30 07:31 .\ndrwx------ 22 ubuntu ubuntu  4096 Apr 30 07:32 ..\ndrwxrwxr-x  8 ubuntu ubuntu  4096 Apr 30 07:33 .git\n-rw-rw-r--  1 ubuntu ubuntu  4654 Apr 30 07:09 .gitnexus_cache.json\n-rw-rw-r--  1 ubuntu ubuntu 41728 Apr 30 07:31 .graph_cache.pkl\ndrwxrwxr-x  2 ubuntu ubuntu  4096 Apr 30 07:31 __pycache__\n-rwxrwxr-x  1 ubuntu ubuntu  8441 Apr 30 07:12 _benchmark.py\n-rw-rw-r--  1 ubuntu ubuntu  8745 Apr 30 06:39 asciirender.py\n-rw-rw-r--  1 ubuntu ubuntu    26 Apr 30 05:54 autoresearch.config.json\n-rw-rw-r--  1 ubuntu ubuntu  3476 Apr 30 07:32 autoresearch.ideas.md\n-rw-rw-r--  1 ubuntu ubuntu 19043 Apr 30 07:32 autoresearch.jsonl\n-rw-rw-r--  1 ubuntu ubuntu  5103 Apr 30 07:33 autoresearch.md\n-rwxrwxr-x  1 ubuntu ubuntu   897 Apr 30 05:56 autoresearch.sh\ndrwxrwxr-x 57 ubuntu ubuntu  4096 Apr 30 07:31 experiments\n-rw-rw-r--  1 ubuntu ubuntu 22637 Apr 30 07:31 graph_builder.py\n-rw-rw-r--  1 ubuntu ubuntu  2848 Apr 30 07:33 loop.log\n-rw-rw-r--  1 ubuntu ubuntu   587 Apr 30 06:11 pi-agi.log\n-rw-rw-r--  1 ubuntu ubuntu  7368 Apr 30 06:15 pi_tree_adapter.py\n-rw-rw-r--  1 ubuntu ubuntu  7226 Apr 30 06:37 query_engine.py\n-rwxrwxr-x  1 ubuntu ubuntu  1985 Apr 30 06:24 run-loop.sh\n-rw-rw-r--  1 ubuntu ubuntu  2695 Apr 30 06:12 schema.sql\ndrwxrwxr-x  2 ubuntu ubuntu  4096 Apr 30 07:33 sessions\n-rwxrwxr-x  1 ubuntu ubuntu   823 Apr 30 06:02 start.sh\n"}],"isError":false,"timestamp":1777534436043}}
{"type":"message","id":"655f25b8","parentId":"9ff1f29a","timestamp":"2026-04-30T07:33:56.044Z","message":{"role":"toolResult","toolCallId":"call_function_ppsjhfcffvt5_2","toolName":"read","content":[{"type":"text","text":"#!/bin/bash\n# Autoresearch benchmark driver for DB-augmented graph code generation\n# Measures: graph build time, node/edge counts, query time, ASCII render size\n\nset -euo pipefail\n\nAGI_DIR=\"$(cd \"$(dirname \"$0\")\" && pwd)\"\nEXPERIMENT_DIR=\"$AGI_DIR/experiments/$(date +%Y%m%d_%H%M%S)\"\nmkdir -p \"$EXPERIMENT_DIR\"\n\n# --- Metric Definitions ---\n# Primary: graph_build_time_ms (lower is better)\n# Secondary: graph_node_count, graph_edge_count, query_time_ms, ascii_render_lines\n\n# If dependencies not installed, use stub metrics\nMETRIC_cmd=\"python3 $AGI_DIR/_benchmark.py 2>/dev/null || echo 'METRIC graph_build_time_ms=0'\"\n\n# Run benchmark and capture output\nOUTPUT=$($METRIC_cmd)\n\n# Echo raw output for visibility\necho \"$OUTPUT\"\n\n# Ensure we always output at least the primary metric\nif ! echo \"$OUTPUT\" | grep -q \"METRIC graph_build_time_ms=\"; then\n    echo \"METRIC graph_build_time_ms=0\"\nfi\n\nexit 0\n"}],"isError":false,"timestamp":1777534436044}}
{"type":"message","id":"d42366ac","parentId":"655f25b8","timestamp":"2026-04-30T07:33:59.792Z","message":{"role":"assistant","content":[{"type":"thinking","thinking":"Let me look at the graph_builder.py to understand the current structure and what data sources it parses. Then I can make a targeted change.","thinkingSignature":"796b382da55be9bbb63758f9a5ebc4f2c960e6adaeb160f17c6ce8d1475bd787"},{"type":"toolCall","id":"call_function_quswgn2hp4tw_1","name":"read","arguments":{"path":"/home/ubuntu/.hermes/agi/graph_builder.py"}},{"type":"toolCall","id":"call_function_quswgn2hp4tw_2","name":"read","arguments":{"path":"/home/ubuntu/.hermes/agi/_benchmark.py"}}],"api":"anthropic-messages","provider":"minimax","model":"MiniMax-M2.7","usage":{"input":8705,"output":95,"cacheRead":10071,"cacheWrite":0,"totalTokens":18871,"cost":{"input":0.0026114999999999997,"output":0.00011399999999999999,"cacheRead":0.0006042599999999999,"cacheWrite":0,"total":0.0033297599999999993}},"stopReason":"toolUse","timestamp":1777534436045,"responseId":"064238e4fb5a2c2b3ba39927eb035a21"}}
