{"type":"message","id":"7dcf3b3b","parentId":"55be09b6","timestamp":"2026-04-30T08:22:28.278Z","message":{"role":"toolResult","toolCallId":"call_function_1bn932hbbtjm_2","toolName":"read","content":[{"type":"text","text":"\"\"\"Codex Output Codec — transforms command outputs into coordinate-addressed results.\n\nPhase A of the Codex Layer. Provides:\n  - Output recognition pipeline (JSON → table → KV → raw)\n  - Known script parsers for top workspace scripts\n  - Result register with transient coordinates (_, _1, _2, ...)\n  - Dot notation field access (_.status, _.p1)\n\nRegister state persists per-workspace at {workspace}/.codex_runtime/register.json\n(FLAG-1: scoped per-workspace, not HOME, to avoid cross-agent clobber).\n\nPipeline: build-codex-layer-v1\n\"\"\"\n\nfrom __future__ import annotations\n\nimport json\nimport re\nimport time\nfrom collections import deque\nfrom dataclasses import dataclass, field, asdict\nfrom pathlib import Path\nfrom typing import Optional, Dict, List, Any\n\n\n# ── Data model ──────────────────────────────────────────────────────────────\n\n@dataclass\nclass CodexResult:\n    \"\"\"A coordinate-addressed result from any command execution.\"\"\"\n    coord: str = '_'          # transient coord: \"_\" (latest), \"_1\", \"_2\"\n    source: str = ''          # what generated it: \"e0\", \"!git status\", \"t5\"\n    content_type: str = 'text'  # 'table' | 'json' | 'kv' | 'text' | 'codex'\n    fields: Dict[str, Any] = field(default_factory=dict)\n    raw: str = ''             # original output\n    rendered: str = ''        # codex-formatted output\n    timestamp: float = 0.0    # epoch seconds (for TTL — S2)\n\n    def to_dict(self) -> dict:\n        return asdict(self)\n\n    @classmethod\n    def from_dict(cls, d: dict) -> 'CodexResult':\n        return cls(**{k: v for k, v in d.items() if k in cls.__dataclass_fields__})\n\n\n# ── Result Register ─────────────────────────────────────────────────────────\n\nREGISTER_TTL_SECONDS = 300  # 5 minutes — auto-expire stale entries (S2)\n\nclass ResultRegister:\n    \"\"\"Transient coordinate stack for command outputs.\n\n    Persists to {workspace}/.codex_runtime/register.json for cross-process access.\n    \"\"\"\n\n    def __init__(self, workspace: Path, max_history: int = 5):\n        self.workspace = workspace\n        self._stack: deque[CodexResult] = deque(maxlen=max_history)\n        runtime_dir = workspace / '.codex_runtime'\n        runtime_dir.mkdir(exist_ok=True)\n        self._state_file = runtime_dir / 'register.json'\n        self._load()\n\n    def push(self, result: CodexResult) -> str:\n        \"\"\"Push result, return its transient coordinate.\"\"\"\n        result.timestamp = time.time()\n        self._stack.appendleft(result)\n        self._reassign_coords()\n        self._persist()\n        return '_'\n\n    def resolve(self, coord: str) -> Optional[CodexResult]:\n        \"\"\"Resolve _ or _N. Returns None if expired or missing.\"\"\"\n        self._expire_stale()\n        if coord == '_':\n            return self._stack[0] if self._stack else None\n        m = re.match(r'^_(\\d+)$', coord)\n        if m:\n            idx = int(m.group(1))\n            return self._stack[idx] if idx < len(self._stack) else None\n        return None\n\n    def resolve_field(self, coord: str) -> Optional[str]:\n        \"\"\"Resolve _.field or _N.field.\"\"\"\n        parts = coord.split('.', 1)\n        result = self.resolve(parts[0])\n        if result and len(parts) > 1:\n            val = result.fields.get(parts[1])\n            return str(val) if val is not None else None\n        return None\n\n    def show(self) -> str:\n        \"\"\"Render register state for context injection.\"\"\"\n        self._expire_stale()\n        if not self._stack:\n            return ''\n        lines = []\n        for r in self._stack:\n            age = int(time.time() - r.timestamp) if r.timestamp else 0\n            fields_str = ', '.join(f'{k}={v}' for k, v in list(r.fields.items())[:5])\n            lines.append(f'{r.coord}  [{r.content_type}]  src={r.source}  age={age}s  {fields_str}')\n        return '\\n'.join(lines)\n\n    def clear(self):\n        \"\"\"Clear all register entries (S1: --register-clear).\"\"\"\n        self._stack.clear()\n        self._persist()\n\n    def _reassign_coords(self):\n        for i, r in enumerate(self._stack):\n            r.coord = '_' if i == 0 else f'_{i}'\n\n    def _expire_stale(self):\n        now = time.time()\n        while self._stack and (now - self._stack[-1].timestamp > REGISTER_TTL_SECONDS):\n            self._stack.pop()\n        self._reassign_coords()\n\n    def _persist(self):\n        try:\n            data = [r.to_dict() for r in self._stack]\n            self._state_file.write_text(json.dumps(data, default=str), encoding='utf-8')\n        except Exception:\n            pass  # non-critical — register is transient\n\n    def _load(self):\n        try:\n            if self._state_file.exists():\n                data = json.loads(self._state_file.read_text(encoding='utf-8'))\n                for d in data:\n                    self._stack.append(CodexResult.from_dict(d))\n                self._expire_stale()\n        except Exception:\n            pass  # corrupted or missing — start fresh\n\n\n# ── Output Recognition ──────────────────────────────────────────────────────\n\ndef _looks_like_json(text: str) -> bool:\n    stripped = text.strip()\n    return (stripped.startswith('{') and stripped.endswith('}')) or \\\n           (stripped.startswith('[') and stripped.endswith(']'))\n\n\ndef _looks_like_table(text: str) -> bool:\n    \"\"\"Detect aligned columns (2+ spaces between fields) or TSV.\"\"\"\n    lines = [l for l in text.strip().splitlines() if l.strip()]\n    if len(lines) < 2:\n        return False\n    # Check if most lines have consistent column-like spacing\n    multi_space = sum(1 for l in lines if re.search(r'  \\S', l))\n    return multi_space > len(lines) * 0.5\n\n\ndef _looks_like_kv(text: str) -> bool:\n    \"\"\"Detect key: value or key=value patterns.\"\"\"\n    lines = [l for l in text.strip().splitlines() if l.strip()]\n    if len(lines) < 2:\n        return False\n    kv_count = sum(1 for l in lines if re.match(r'^\\s*\\S+\\s*[:=]\\s*\\S', l))\n    return kv_count > len(lines) * 0.5\n\n\n# ── Known Script Parsers ────────────────────────────────────────────────────\n\n_KNOWN_SCRIPTS = [\n    (re.compile(r'codex_engine\\.py\\s+--supermap'), '_parse_supermap'),\n    (re.compile(r'pipeline_update\\.py\\s+(\\S+)\\s+show'), '_parse_pipeline_show'),\n    (re.compile(r'pipeline_orchestrate\\.py'), '_parse_orchestrate'),\n    (re.compile(r'log_memory\\.py'), '_parse_log_memory'),\n    (re.compile(r'codex_engine\\.py\\s+([a-z]\\S*)'), '_parse_coord_nav'),\n]\n\n\ndef _parse_supermap(command: str, stdout: str) -> CodexResult:\n    \"\"\"Parse supermap output into addressable fields.\"\"\"\n    fields: Dict[str, Any] = {}\n    # Extract namespace counts: ╶─ p   pipelines (3)\n    for m in re.finditer(r'╶─\\s+(\\w+)\\s+\\S+\\s+\\((\\d+)\\)', stdout):\n        fields[f'{m.group(1)}_count'] = int(m.group(2))\n    # Extract individual entries: │  ╶─ p1    slug  summary\n    for m in re.finditer(r'╶─\\s+([a-z]+\\d+)\\s+(\\S+)', stdout):\n        fields[m.group(1)] = m.group(2)\n    return CodexResult(\n        source='e0 --supermap', content_type='codex',\n        fields=fields, raw=stdout, rendered=stdout[:500],\n    )\n\n\ndef _parse_pipeline_show(command: str, stdout: str) -> CodexResult:\n    fields: Dict[str, Any] = {}\n    # Status line\n    sm = re.search(r'Status:\\s*(\\S+)', stdout)\n    if sm:\n        fields['status'] = sm.group(1)\n    # Pending action\n    pm = re.search(r'pending_action\\s*→\\s*(\\S+)', stdout)\n    if pm:\n        fields['pending'] = pm.group(1)\n    return CodexResult(\n        source=command, content_type='codex',\n        fields=fields, raw=stdout, rendered=stdout[:500],\n    )\n\n\ndef _parse_orchestrate(command: str, stdout: str) -> CodexResult:\n    fields: Dict[str, Any] = {}\n    rm = re.search(r'Completed:\\s*(\\S+)', stdout)\n    if rm:\n        fields['result'] = rm.group(1)\n    nm = re.search(r'Next:\\s*(\\S+)', stdout)\n    if nm:\n        fields['next_agent'] = nm.group(1)\n    return CodexResult(\n        source=command, content_type='codex',\n        fields=fields, raw=stdout, rendered=stdout[:500],\n    )\n\n\ndef _parse_log_memory(command: str, stdout: str) -> CodexResult:\n    fields: Dict[str, Any] = {}\n    em = re.search(r'Entry:\\s*(\\S+)', stdout)\n    if em:\n        fields['entry'] = em.group(1)\n    dm = re.search(r'Daily:\\s*(\\S+)', stdout)\n    if dm:\n        fields['daily'] = dm.group(1)\n    return CodexResult(\n        source=command, content_type='codex',\n        fields=fields, raw=stdout, rendered=stdout[:300],\n    )\n\n\ndef _parse_coord_nav(command: str, stdout: str) -> CodexResult:\n    \"\"\"Parse coordinate navigation output.\"\"\"\n    fields: Dict[str, Any] = {}\n    # Extract frontmatter key-value pairs\n    for m in re.finditer(r'^(\\w+):\\s+(.+)$', stdout, re.MULTILINE):\n        fields[m.group(1)] = m.group(2).strip()\n    return CodexResult(\n        source=command, content_type='codex',\n        fields=fields, raw=stdout, rendered=stdout[:500],\n    )\n\n\n_PARSER_MAP = {\n    '_parse_supermap': _parse_supermap,\n    '_parse_pipeline_show': _parse_pipeline_show,\n    '_parse_orchestrate': _parse_orchestrate,\n    '_parse_log_memory': _parse_log_memory,\n    '_parse_coord_nav': _parse_coord_nav,\n}\n\n\ndef _is_known_script(command: str):\n    \"\"\"Check if command matches a known script pattern. Returns parser name or None.\"\"\"\n    for pattern, parser_name in _KNOWN_SCRIPTS:\n        if pattern.search(command):\n            return parser_name\n    return None\n\n\n# ── JSON/Table/KV parsers ──────────────────────────────────────────────────\n\ndef _parse_json_output(stdout: str) -> CodexResult:\n    try:\n        data = json.loads(stdout.strip())\n        fields = data if isinstance(data, dict) else {'items': data}\n        rendered = json.dumps(data, indent=2)[:500]\n    except json.JSONDecodeError:\n        fields = {}\n        rendered = stdout[:500]\n    return CodexResult(\n        source='json', content_type='json',\n        fields=fields, raw=stdout, rendered=rendered,\n    )\n\n\ndef _parse_table_output(stdout: str) -> CodexResult:\n    lines = [l for l in stdout.strip().splitlines() if l.strip()]\n    fields: Dict[str, Any] = {'row_count': len(lines)}\n    if lines:\n        fields['header'] = lines[0].strip()\n    return CodexResult(\n        source='table', content_type='table',\n        fields=fields, raw=stdout, rendered=stdout[:500],\n    )\n\n\ndef _parse_kv_output(stdout: str) -> CodexResult:\n    fields: Dict[str, Any] = {}\n    for line in stdout.strip().splitlines():\n        line = line.strip()\n        for sep in [':', '=']:\n            if sep in line:\n                k, _, v = line.partition(sep)\n                k = k.strip().lower().replace(' ', '_')\n                if k:\n                    fields[k] = v.strip()\n                break\n    return CodexResult(\n        source='kv', content_type='kv',\n        fields=fields, raw=stdout, rendered=stdout[:500],\n    )\n\n\n# ── Main entry point ───────────────────────────────────────────────────────\n\ndef output_to_codex(command: str, stdout: str, stderr: str = '', rc: int = 0) -> CodexResult:\n    \"\"\"Recognize output patterns and produce coordinate-addressed result.\"\"\"\n    # 1. Known script parsers (highest priority)\n    parser_name = _is_known_script(command)\n    if parser_name and parser_name in _PARSER_MAP:\n        result = _PARSER_MAP[parser_name](command, stdout)\n        result.source = command\n        return result\n\n    # 2. JSON detection\n    if _looks_like_json(stdout):\n        result = _parse_json_output(stdout)\n        result.source = command\n        return result\n\n    # 3. Tabular detection\n    if _looks_like_table(stdout):\n        result = _parse_table_output(stdout)\n        result.source = command\n        return result\n\n    # 4. Key-value detection\n    if _looks_like_kv(stdout):\n        result = _parse_kv_output(stdout)\n        result.source = command\n        return result\n\n    # 5. Passthrough with coord wrapper\n    return CodexResult(\n        source=command, content_type='text',\n        fields={}, raw=stdout, rendered=stdout[:500],\n    )\n\n\n# ── CLI test entry point ───────────────────────────────────────────────────\n\nif __name__ == '__main__':\n    import sys\n    # Quick test: pipe stdout through the codec\n    test_input = sys.stdin.read() if not sys.stdin.isatty() else '{\"test\": \"value\"}'\n    result = output_to_codex('test', test_input)\n    print(f'content_type: {result.content_type}')\n    print(f'fields: {result.fields}')\n    print(f'rendered: {result.rendered[:200]}')\n"}],"isError":false,"timestamp":1777537348277}}
{"type":"message","id":"3029a138","parentId":"7dcf3b3b","timestamp":"2026-04-30T08:22:42.752Z","message":{"role":"assistant","content":[{"type":"thinking","thinking":"Now I have a good understanding of the codex-layer-v1-modules files. I can parse these for:\n\n1. **codex_module** nodes (3): codex_dispatch, codex_interceptor, codex_output_codec\n2. **codex_class** nodes: CodexDispatcher, CodexInterceptor, ResultRegister, CodexResult\n3. **codex_function** nodes: dispatch, _dispatch_shell, _dispatch_pipe, _dispatch_render, _dispatch_register, _dispatch_coord, check, _build_rules, _apply_mode, push, resolve, resolve_field, show, clear, output_to_codex, etc.\n\n\n4. **codex_import** edges: linking modules and classes together\n\nBeyond the code structure itself, I can also extract comments and docstrings as knowledge nodes, plus cross-references to other node types like archive_command through the \"Pipeline: build-codex-layer-v1\" metadata. I'll add a parser in graph_builder.py to handle this archive/codex-layer-v1-modules directory.\n\nLooking at what's actually parsed in the archive already, I've got the commands and tasks directories, but the codex-layer-v1-modules/*.py files are completely unparsed. I'm planning to extract codex_module nodes (3 files), codex_class nodes (4 classes across those files), and codex_function nodes (roughly 20 methods). The imports between modules will form the cross-type edges that connect the code structure to decisions and lessons.\n\nI'll also capture the Pipeline metadata to link back to related decisions. This gives me a meaningful architectural view of how the codex system is structured—adding maybe 30-40 nodes total. Since lru_cache handles warm loads in about 0.03ms regardless of size, this addition won't impact performance, but it'll enrich the graph with the actual code architecture.","thinkingSignature":"607715ced3344339622db7f5f47cd4b69abac72367a732e28f00966ecb3b1491"},{"type":"text","text":"Now I have a clear target. The `archive/codex-layer-v1-modules/*.py` files are completely unparsed. Parsing them adds code architecture (modules, classes, functions, imports) — enriching graph structural data. Let me implement this:\n"},{"type":"toolCall","id":"call_function_zctraqq1u93w_1","name":"read","arguments":{"path":"/home/ubuntu/.hermes/agi/graph_builder.py","limit":100}}],"api":"anthropic-messages","provider":"minimax","model":"MiniMax-M2.7","usage":{"input":24573,"output":466,"cacheRead":10071,"cacheWrite":0,"totalTokens":35110,"cost":{"input":0.0073719,"output":0.0005591999999999999,"cacheRead":0.0006042599999999999,"cacheWrite":0,"total":0.00853536}},"stopReason":"toolUse","timestamp":1777537348278,"responseId":"064244446e0fda92bd17b01617bef27a"}}
{"type":"message","id":"d3fff99a","parentId":"3029a138","timestamp":"2026-04-30T08:22:42.754Z","message":{"role":"toolResult","toolCallId":"call_function_zctraqq1u93w_1","toolName":"read","content":[{"type":"text","text":"#!/usr/bin/env python3\n\"\"\"\ngraph_builder.py - Modular graph construction for unified graph memory\nDB-augmented directed code generation via unified graph memory\n\"\"\"\n\nimport os\nimport re\nimport json\nimport time\nfrom functools import lru_cache\nfrom typing import List, Dict, Any, Optional, Tuple\nfrom collections import defaultdict\n\n# Pre-compiled regex patterns\n_RE_SECTION_SPLIT = re.compile(r'\\n(?=#)')\n_RE_CODE_BLOCK = re.compile(r'`([^`]+)`')\n_RE_FRONT_MATTER = re.compile(r'^---\\n(.*?)\\n---', re.DOTALL)\n_RE_YAML_PAIR = re.compile(r'^(\\w+):\\s*(.*)$')\n\n# Cache for gitnexus output\n_GITNEXUS_CACHE_FILE = None\n_gitnexus_cache = None\n\ndef init_cache(cache_dir: str):\n    \"\"\"Initialize cache file path.\"\"\"\n    global _GITNEXUS_CACHE_FILE, _gitnexus_cache\n    _GITNEXUS_CACHE_FILE = os.path.join(cache_dir, \".gitnexus_cache.json\")\n    if os.path.exists(_GITNEXUS_CACHE_FILE):\n        try:\n            mtime = os.path.getmtime(_GITNEXUS_CACHE_FILE)\n            age_hours = (time.time() - mtime) / 3600\n            if age_hours < 24:\n                with open(_GITNEXUS_CACHE_FILE) as f:\n                    _gitnexus_cache = f.read()\n        except Exception:\n            pass\n\ndef _save_cache(data: str):\n    \"\"\"Save gitnexus result to cache.\"\"\"\n    global _GITNEXUS_CACHE_FILE, _gitnexus_cache\n    _gitnexus_cache = data\n    if _GITNEXUS_CACHE_FILE:\n        try:\n            with open(_GITNEXUS_CACHE_FILE, 'w') as f:\n                f.write(data)\n        except Exception:\n            pass\n\nclass GraphBuilder:\n    \"\"\"Builds a unified graph from multiple source materials.\"\"\"\n    __slots__ = ('nodes', 'edges', 'adj', '_node_ids', '_section_stack', '_precomputed_paths')\n\n    def __init__(self):\n        self.nodes: List[Dict[str, Any]] = []\n        self.edges: List[Dict[str, str]] = []\n        self.adj: Dict[str, List[str]] = defaultdict(list)\n        self._node_ids: set = set()\n        self._section_stack: List[int] = []\n        self._precomputed_paths: Dict[str, Any] = {}  # (start, end) -> path or None\n\n    def add_node(self, node_type: str, label: str, content: str = \"\",\n                 source: str = \"\", node_id: Optional[str] = None) -> str:\n        \"\"\"Add a node to the graph as a compact tuple (id, type, label, content, source).\"\"\"\n        if node_id is None:\n            node_id = f\"{node_type}_{len(self.nodes)}\"\n\n        # Ensure unique ID\n        base_id = node_id\n        counter = 0\n        while node_id in self._node_ids:\n            counter += 1\n            node_id = f\"{base_id}_{counter}\"\n\n        self._node_ids.add(node_id)\n        # Store as tuple: smaller pickle, faster load than dict\n        self.nodes.append((node_id, node_type, label[:60], content[:120] if content else \"\", source))\n        return node_id\n\n    def add_edge(self, from_id: str, to_id: str, edge_type: str = \"references\"):\n        \"\"\"Add an edge between nodes.\"\"\"\n        if from_id in self._node_ids and to_id in self._node_ids:\n            self.edges.append({\"from\": from_id, \"to\": to_id, \"type\": edge_type})\n            self.adj[from_id].append(to_id)\n            self.adj[to_id].append(from_id)  # Bidirectional for traversal\n\n    def parse_agents_md(self, filepath: str) -> int:\n        \"\"\"Parse AGENTS.md into graph nodes.\"\"\"\n        if not os.path.exists(filepath):\n            return 0\n\n        with open(filepath, \"r\") as f:\n            content = f.read()\n\n        sections = _RE_SECTION_SPLIT.split(content)\n        last_section_idx = -1\n\n        for i, section in enumerate(sections):\n            lines = section.strip().split('\\n')\n            if not lines:\n\n[1277 more lines in file. Use offset=101 to continue.]"}],"isError":false,"timestamp":1777537362754}}
{"type":"message","id":"10aade32","parentId":"d3fff99a","timestamp":"2026-04-30T08:22:46.195Z","message":{"role":"assistant","content":[{"type":"thinking","thinking":"Let me look at more of the graph_builder to understand where to add the new parser:","thinkingSignature":"1f96fe84ec43ee1a99abdd8e52e98050eb9118e73dc7fdeed569bd0d6bc9629a"},{"type":"toolCall","id":"call_function_cxjzdu36wa7s_1","name":"read","arguments":{"path":"/home/ubuntu/.hermes/agi/graph_builder.py","offset":101,"limit":80}},{"type":"toolCall","id":"call_function_cxjzdu36wa7s_2","name":"bash","arguments":{"command":"grep -n \"def parse_\" /home/ubuntu/.hermes/agi/graph_builder.py"}}],"api":"anthropic-messages","provider":"minimax","model":"MiniMax-M2.7","usage":{"input":26000,"output":112,"cacheRead":10071,"cacheWrite":0,"totalTokens":36183,"cost":{"input":0.0078,"output":0.0001344,"cacheRead":0.0006042599999999999,"cacheWrite":0,"total":0.00853866}},"stopReason":"toolUse","timestamp":1777537362755,"responseId":"064244531e88aad07bee0c220df47887"}}
