{"type":"message","id":"43376163","parentId":"a05a9f8f","timestamp":"2026-04-30T08:58:16.086Z","message":{"role":"assistant","content":[{"type":"thinking","thinking":"Now I see it! The `build_graph` function:\n1. Gets gitnexus_hash from file size\n2. Calls `_cached_build_builder(hermes_dir, agi_dir, gitnexus_hash, _cache_ver=10)`\n3. Returns builder, elapsed_ms immediately (no pickle save!)\n\nThe pickle save is in `_cached_build_builder` → let me check:\n\nWait, `_cached_build_builder` has `lru_cache(maxsize=1)`. On the first call, it builds and returns. On the second call, it returns the cached object. The `_save_graph_cache` call must be in the return path or somewhere else.\n \nOh, I think I see it now—`_save_graph_cache` is being called inside `_cached_build_builder` itself, probably at the end of the function after building the graph. That would explain why the timing stays at 0.03ms on the second call even though the cache should be hitting immediately.\n\nActually, let me reconsider. If the pickle write is happening on every call, it should take around 0.3-0.5ms based on the pickle noise floor. But the benchmark is showing 0.03ms, which is ten times faster. So either the pickle write isn't happening on the second call (which contradicts the code), or something else is going on here. Let me look at the `_save_graph_cache` function more carefully to see if there's a condition I'm missing that prevents the write on subsequent calls. The pickle save isn't the culprit since it only happens on the first call when the cache is populated, not on the timed warm call. The 0.03ms measurement is just the overhead of the lru_cache lookup itself—Python function call, dict access, return value—which appears to be the noise floor for this operation.\n\nNow I'm considering what I could actually improve here. The lru_cache overhead is already minimal, and the warm load is noise-floor limited. I could try adding a secondary cache layer for the reconstructed builder object to skip the cache lookup entirely, but that's just replacing one microsecond overhead with another. I think the best move is to add a reachability matrix to the graph builder as a quality-of-life improvement, even though it won't speed up the primary metric.\n\nLet me trace through what actually happens when the benchmark calls `build_graph` twice—there's something I'm missing about how the timing works.","thinkingSignature":"1ca36fb0333d16e9be9858657a6d5aed56d34fefcf8fce88e2372dadd069b58d"},{"type":"toolCall","id":"call_function_5seenptlbxvv_1","name":"bash","arguments":{"command":"cd /home/ubuntu/.hermes/agi && python3 -c \"\nimport time, os, sys\nsys.path.insert(0, '.')\nfrom graph_builder import build_graph, _cached_build_builder, _get_graph_cache_file\n\nhermes = os.path.expanduser('~/.hermes')\nagi = '/home/ubuntu/.hermes/agi'\n\n# Clear lru cache to force cold\n_cached_build_builder.cache_clear()\ncache_file = _get_graph_cache_file(agi)\nif os.path.exists(cache_file):\n    os.remove(cache_file)\n\nprint('=== Cold build ===')\nstart = time.perf_counter()\nb1, t1 = build_graph(hermes, agi)\ncold_total = (time.perf_counter() - start) * 1000\nprint(f'build_graph returned: {t1:.4f}ms, total: {cold_total:.4f}ms')\nprint(f'Nodes: {len(b1.nodes)}, Cache exists: {os.path.exists(cache_file)}')\n\nprint()\nprint('=== Warm build (timed) ===')\nstart = time.perf_counter()\nb2, t2 = build_graph(hermes, agi)\nwarm_total = (time.perf_counter() - start) * 1000\nprint(f'build_graph returned: {t2:.4f}ms, total: {warm_total:.4f}ms')\nprint(f'Same builder: {b1 is b2}')\n\" 2>/dev/null"}}],"api":"anthropic-messages","provider":"minimax","model":"MiniMax-M2.7","usage":{"input":19735,"output":820,"cacheRead":10071,"cacheWrite":0,"totalTokens":30626,"cost":{"input":0.0059204999999999995,"output":0.0009839999999999998,"cacheRead":0.0006042599999999999,"cacheWrite":0,"total":0.007508759999999999}},"stopReason":"toolUse","timestamp":1777539477213,"responseId":"06424c959e4b9f5fc806940c2dbeb2a3"}}
{"type":"message","id":"1d927aa9","parentId":"43376163","timestamp":"2026-04-30T08:58:16.261Z","message":{"role":"toolResult","toolCallId":"call_function_5seenptlbxvv_1","toolName":"bash","content":[{"type":"text","text":"=== Cold build ===\nbuild_graph returned: 125.9513ms, total: 125.9564ms\nNodes: 1430, Cache exists: True\n\n=== Warm build (timed) ===\nbuild_graph returned: 0.0156ms, total: 0.0180ms\nSame builder: True\n"}],"isError":false,"timestamp":1777539496261}}
{"type":"message","id":"3b50974c","parentId":"1d927aa9","timestamp":"2026-04-30T08:58:36.654Z","message":{"role":"assistant","content":[{"type":"thinking","thinking":"Now I have the real numbers:- Cold build: 125.95ms total (includes all parsing + pickle write)- Warm build (timed): 0.0156ms — the benchmark rounds to 0.02ms or 0.03ms\n\nThe benchmark's `start = time.perf_counter(); builder, _ = build_graph(...); build_time_ms = (time.perf_counter() - start) * 1000` measures 0.0156ms, which rounds to 0.02ms or 0.03ms.\n\nNow the question: what can I do that improves this 0.0156ms warm load time?\n\n\nThe lru_cache lookup itself takes about 0.0156ms — there's essentially no Python code executing beyond the cache mechanism. The `build_graph` function does compute a gitnexus_hash on every call by checking if the gitnexus cache file exists and getting its size, which seems like it could be the overhead I'm looking to eliminate.\n\nHowever, this hash computation isn't factored into the `lru_cache` key itself, so it runs on every invocation regardless. Since file existence checks are cached by the OS, the overhead should be negligible, but I'm wondering if there's any way to avoid even that minimal cost. the gitnexus_cache_file check adds ~0.003ms per call, but caching the result would introduce its own overhead. Since the primary metric is already at noise floor (0.015ms warm load), any optimization would be marginal at best. I should focus on something more meaningful instead—adding a reachability matrix to enable instant graph queries, which is the most architecturally valuable change available. Let me check the gitnexus hash computation more carefully to see if there are any other micro-optimizations I'm missing.\n\nActually, I realize the gitnexus hash only matters for cache busting—if it changes, the cache is invalidated and a cold build runs. I could cache the file existence and size checks since they're constant across warm calls, but that's only saving 0.003ms, which is within noise. For a more impactful change, I should add a reachability matrix that enables O(1) reachability queries, then update the benchmark to measure this capability. Though I'm second-guessing myself on the impact of computing the reachability matrix during the warm path.\n\nComputing all-pairs reachability with BFS from each node is expensive—1430 BFS traversals on a graph with 1461 edges would take roughly 64ms on the cold path. That's a 50% slowdown, which would hurt the primary metric. However, I could precompute the reachability matrix during the cold build and cache it alongside the graph, then look it up directly on warm calls. This way the cold path pays the cost once, and the warm path stays fast at around 0.018ms.\n\nBut actually, since warm calls return the same cached object regardless, the lookup itself is just a dictionary access—so the reachability check wouldn't add any meaningful overhead to the warm path anyway.\n\nI'm going to implement the reachability matrix. I'll add it as an optional post-build step that computes pairwise reachability using BFS, storing it in a dictionary so queries can check if one node is reachable from another in constant time. I'll cache the pickle with the matrix and verify the warm path stays unaffected before committing.","thinkingSignature":"e0b72baef59635eeac1c903e71f443faa4bddbc636ad49d5e1f4c5429c445a9e"},{"type":"text","text":"Cold build: 125ms, warm load: 0.015ms (lru_cache + dict lookup). The warm load IS the noise floor. Adding reachability matrix to cold path won't touch warm. Let me implement it — it enables instant graph queries:\n"},{"type":"toolCall","id":"call_function_vdtvwjfl0w2d_1","name":"read","arguments":{"path":"/home/ubuntu/.hermes/agi/graph_builder.py","offset":2047,"limit":30}}],"api":"anthropic-messages","provider":"minimax","model":"MiniMax-M2.7","usage":{"input":20638,"output":791,"cacheRead":10071,"cacheWrite":0,"totalTokens":31500,"cost":{"input":0.0061914,"output":0.0009492,"cacheRead":0.0006042599999999999,"cacheWrite":0,"total":0.007744859999999999}},"stopReason":"toolUse","timestamp":1777539496264,"responseId":"06424ca8676712481e956e2d35f8faa3"}}
{"type":"message","id":"baec298d","parentId":"3b50974c","timestamp":"2026-04-30T08:58:36.657Z","message":{"role":"toolResult","toolCallId":"call_function_vdtvwjfl0w2d_1","toolName":"read","content":[{"type":"text","text":"    def build_adjacency(self):\n        \"\"\"Build adjacency dict from edges.\"\"\"\n        self.adj = defaultdict(list)\n        for edge in self.edges:\n            if edge[\"from\"] in self._node_ids and edge[\"to\"] in self._node_ids:\n                self.adj[edge[\"from\"]].append(edge[\"to\"])\n                self.adj[edge[\"to\"]].append(edge[\"from\"])\n        # Pre-compute key paths for benchmark query (first→last section)\n        self._precompute_key_paths()\n\n    def _precompute_key_paths(self):\n        \"\"\"Pre-compute BFS paths between key node pairs for O(1) query_time.\n        \n        Benchmark always queries first→last agents_section. Pre-compute once\n        during build so subsequent queries hit cache instead of re-running BFS.\n        \"\"\"\n        section_nodes = sorted(\n            [n[0] for n in self.nodes if str(n[0]).startswith(\"agents_section_\")],\n            key=lambda x: int(x.split('_')[-1])\n        )\n        if len(section_nodes) >= 2:\n            start, end = section_nodes[0], section_nodes[-1]\n            path = self._bfs_path(start, end)\n            self._precomputed_paths[(start, end)] = path\n\n    def _bfs_path(self, start_id: str, end_id: str) -> Optional[List[str]]:\n        \"\"\"BFS path finder (used for pre-computation).\"\"\"\n        from collections import deque\n        if start_id not in self._node_ids or end_id not in self._node_ids:\n            return None\n\n[405 more lines in file. Use offset=2077 to continue.]"}],"isError":false,"timestamp":1777539516657}}
{"type":"message","id":"91bdf70c","parentId":"baec298d","timestamp":"2026-04-30T08:58:45.154Z","message":{"role":"assistant","content":[{"type":"thinking","thinking":"Now I have a clear picture. Let me add the reachability matrix as an extension of `_precompute_key_paths`. I'll compute reachability from high-value \"hub\" nodes (those with many connections) and store the result as a frozenset of reachable node IDs per hub node.\n\nThe key insight: computing full all-pairs reachability is expensive (n BFS runs). Instead, I'll compute reachability from nodes with the highest degree (most connected). This gives the most \"bang for the buck\" — 20-30 hub nodes cover most of the graph connectivity.\n\nLet me write the implementation:\n\n```python\ndef _precompute_reachability(self, hub_count: int = 32) -> None:\n\n\n```\n\nComputing reachability from hub nodes...\n\nActually, I'm reconsidering whether this belongs in `_precompute_key_paths` or as a separate method. Since `_precompute_key_paths` is called from `build_adjacency`, I should add it there too, but I want to be careful about not duplicating work or complicating the cold build unnecessarily.\n\nThe benchmark shows warm load at 0.015ms, but cold load is 125ms—adding a few milliseconds to the cold path is negligible. Let me go ahead and implement this.\n```","thinkingSignature":"62fb4a14cd8c87e39e0febd2b91b178dc422a66ec3f8ef17a0a1224c071706ea"},{"type":"toolCall","id":"call_function_3ron51sfyb5x_1","name":"read","arguments":{"path":"/home/ubuntu/.hermes/agi/graph_builder.py","offset":2090,"limit":40}}],"api":"anthropic-messages","provider":"minimax","model":"MiniMax-M2.7","usage":{"input":21792,"output":314,"cacheRead":10071,"cacheWrite":0,"totalTokens":32177,"cost":{"input":0.006537599999999999,"output":0.0003768,"cacheRead":0.0006042599999999999,"cacheWrite":0,"total":0.007518659999999999}},"stopReason":"toolUse","timestamp":1777539516657,"responseId":"06424cbde12ae1725439ed03a6c6f0c4"}}
{"type":"message","id":"b7316223","parentId":"91bdf70c","timestamp":"2026-04-30T08:58:45.157Z","message":{"role":"toolResult","toolCallId":"call_function_3ron51sfyb5x_1","toolName":"read","content":[{"type":"text","text":"        \"\"\"Get graph statistics.\"\"\"\n        return {\n            \"node_count\": len(self.nodes),\n            \"edge_count\": len(self.edges),\n            \"nodes_by_type\": self._count_by_type(),\n            \"node_ids\": len(self._node_ids)\n        }\n\n    def _count_by_type(self) -> Dict[str, int]:\n        \"\"\"Count nodes by type (tuple access: [1] = type).\"\"\"\n        counts = defaultdict(int)\n        for node in self.nodes:\n            counts[node[1]] += 1\n        return dict(counts)\n\n\ndef run_subprocess(cmd: str, timeout: int = 30) -> str:\n    \"\"\"Run subprocess command.\"\"\"\n    import subprocess\n    try:\n        result = subprocess.run(\n            cmd, shell=True, capture_output=True, text=True, timeout=timeout\n        )\n        return result.stdout + result.stderr\n    except Exception:\n        return \"\"\n\n\n# Graph pickle cache file\n_GRAPH_CACHE_FILE = None\nimport pickle  # Module-level for faster cache loads\n\ndef _get_graph_cache_file(agi_dir: str) -> str:\n    global _GRAPH_CACHE_FILE\n    if _GRAPH_CACHE_FILE is None:\n        _GRAPH_CACHE_FILE = os.path.join(agi_dir, \".graph_cache.pkl\")\n    return _GRAPH_CACHE_FILE\n\ndef _get_source_mtimes(hermes_dir: str) -> Dict[str, float]:\n    \"\"\"Collect modification times of all graph source files.\"\"\"\n\n[352 more lines in file. Use offset=2130 to continue.]"}],"isError":false,"timestamp":1777539525157}}
{"type":"message","id":"d008a2cb","parentId":"b7316223","timestamp":"2026-04-30T08:59:06.028Z","message":{"role":"assistant","content":[{"type":"thinking","thinking":"Now I have enough context. Let me make the edit. I'll add the `_precompute_reachability` method to the `GraphBuilder` class and call it from `build_adjacency` alongside `_precompute_key_paths`.\n\nI need to:\n1. Add `_precompute_reachability` method (computes reachability from hub nodes)\n2. Call it from `build_adjacency` after `_precompute_key_paths`\n3. Include `hub_reachable` in the pickle cache\n\nLet me do this carefully.","thinkingSignature":"c6000a1f7e5518cef3905412887d022d1b07b12564e82f7969821b150c99922f"},{"type":"text","text":"Now I'll add the reachability matrix pre-computation. This computes reachability from high-degree hub nodes during cold build, stored for O(1) query:\n"},{"type":"toolCall","id":"call_function_pgdun8cxrjgg_1","name":"edit","arguments":{"path":"/home/ubuntu/.hermes/agi/graph_builder.py","edits":[{"oldText":"    def build_adjacency(self):\n        \"\"\"Build adjacency dict from edges.\"\"\"\n        self.adj = defaultdict(list)\n        for edge in self.edges:\n            if edge[\"from\"] in self._node_ids and edge[\"to\"] in self._node_ids:\n                self.adj[edge[\"from\"]\"].append(edge[\"to\"])\n                self.adj[edge[\"to\"]\"].append(edge[\"from\"])\n        # Pre-compute key paths for benchmark query (first→last section)\n        self._precompute_key_paths()","newText":"    def build_adjacency(self):\n        \"\"\"Build adjacency dict from edges.\"\"\"\n        self.adj = defaultdict(list)\n        for edge in self.edges:\n            if edge[\"from\"] in self._node_ids and edge[\"to\"] in self._node_ids:\n                self.adj[edge[\"from\"]\"].append(edge[\"to\"])\n                self.adj[edge[\"to\"]\"].append(edge[\"from\"])\n        # Pre-compute key paths for benchmark query (first→last section)\n        self._precompute_key_paths()\n        # Pre-compute reachability from hub nodes (cold build only; pickled with graph)\n        self._precompute_reachability(hub_count=32)"},{"oldText":"    def _precompute_key_paths(self):\n        \"\"\"Pre-compute BFS paths between key node pairs for O(1) query_time.\n        \n        Benchmark always queries first→last agents_section. Pre-compute once\n        during build so subsequent queries hit cache instead of re-running BFS.\n        \"\"\"\n        section_nodes = sorted(\n            [n[0] for n in self.nodes if str(n[0]).startswith(\"agents_section_\")],\n            key=lambda x: int(x.split('_')[-1])\n        )\n        if len(section_nodes) >= 2:\n            start, end = section_nodes[0], section_nodes[-1]\n            path = self._bfs_path(start, end)\n            self._precomputed_paths[(start, end)] = path","newText":"    def _precompute_key_paths(self):\n        \"\"\"Pre-compute BFS paths between key node pairs for O(1) query_time.\n        \n        Benchmark always queries first→last agents_section. Pre-compute once\n        during build so subsequent queries hit cache instead of re-running BFS.\n        \"\"\"\n        section_nodes = sorted(\n            [n[0] for n in self.nodes if str(n[0]).startswith(\"agents_section_\")],\n            key=lambda x: int(x.split('_')[-1])\n        )\n        if len(section_nodes) >= 2:\n            start, end = section_nodes[0], section_nodes[-1]\n            path = self._bfs_path(start, end)\n            self._precomputed_paths[(start, end)] = path\n\n    def _precompute_reachability(self, hub_count: int = 32) -> None:\n        \"\"\"Pre-compute reachability from high-degree hub nodes.\n        \n        Enables O(1) reachability queries: 'is node X reachable from hub Y?'\n        Stored as hub_reachable[hub_id] = frozenset(reachable_node_ids).\n        Cold build cost: O(hub_count * (n + m)). Pickled with graph cache.\n        Warm load cost: 0 (just dict lookup).\n        \"\"\"\n        # Find hub nodes: highest degree (most connected)\n        degree = {}\n        for node_id in self._node_ids:\n            degree[node_id] = len(self.adj.get(node_id, []))\n        hubs = sorted(degree.keys(), key=lambda x: -degree[x])[:hub_count]\n\n        self.hub_reachable: Dict[str, frozenset] = {}\n        for hub in hubs:\n            reachable = self._bfs_reachable(hub)\n            self.hub_reachable[hub] = frozenset(reachable)\n\n    def _bfs_reachable(self, start_id: str) -> List[str]:\n        \"\"\"Return list of all nodes reachable from start_id via BFS.\"\"\"\n        from collections import deque\n        if start_id not in self._node_ids:\n            return []\n        visited = {start_id}\n        queue = deque([start_id])\n        while queue:\n            current = queue.popleft()\n            for neighbor in self.adj.get(current, []):\n                if neighbor not in visited:\n                    visited.add(neighbor)\n                    queue.append(neighbor)\n        return list(visited)"}]}}],"api":"anthropic-messages","provider":"minimax","model":"MiniMax-M2.7","usage":{"input":22432,"output":1261,"cacheRead":10071,"cacheWrite":0,"totalTokens":33764,"cost":{"input":0.0067296,"output":0.0015132,"cacheRead":0.0006042599999999999,"cacheWrite":0,"total":0.00884706}},"stopReason":"toolUse","timestamp":1777539525157,"responseId":"06424cc59dbb37e2fccac189cc8478f5"}}
{"type":"message","id":"84de1a81","parentId":"d008a2cb","timestamp":"2026-04-30T08:59:06.042Z","message":{"role":"toolResult","toolCallId":"call_function_pgdun8cxrjgg_1","toolName":"edit","content":[{"type":"text","text":"Could not find edits[0] in /home/ubuntu/.hermes/agi/graph_builder.py. The oldText must match exactly including all whitespace and newlines."}],"details":{},"isError":true,"timestamp":1777539546042}}
{"type":"message","id":"37d75013","parentId":"84de1a81","timestamp":"2026-04-30T08:59:08.728Z","message":{"role":"assistant","content":[{"type":"thinking","thinking":"Let me read the exact text of the build_adjacency method.","thinkingSignature":"b02c430282c68d313e42f9d7ed9010e6fccc80abe571a00d586cd6cbb122dfe7"},{"type":"toolCall","id":"call_function_o422lb9m2dcq_1","name":"read","arguments":{"path":"/home/ubuntu/.hermes/agi/graph_builder.py","offset":2047,"limit":15}}],"api":"anthropic-messages","provider":"minimax","model":"MiniMax-M2.7","usage":{"input":23742,"output":71,"cacheRead":10071,"cacheWrite":0,"totalTokens":33884,"cost":{"input":0.0071226,"output":0.0000852,"cacheRead":0.0006042599999999999,"cacheWrite":0,"total":0.007812059999999999}},"stopReason":"toolUse","timestamp":1777539546043,"responseId":"06424cdac8c171f5e6fa698d30d4a7c8"}}
{"type":"message","id":"d134ec2d","parentId":"37d75013","timestamp":"2026-04-30T08:59:08.734Z","message":{"role":"toolResult","toolCallId":"call_function_o422lb9m2dcq_1","toolName":"read","content":[{"type":"text","text":"    def build_adjacency(self):\n        \"\"\"Build adjacency dict from edges.\"\"\"\n        self.adj = defaultdict(list)\n        for edge in self.edges:\n            if edge[\"from\"] in self._node_ids and edge[\"to\"] in self._node_ids:\n                self.adj[edge[\"from\"]].append(edge[\"to\"])\n                self.adj[edge[\"to\"]].append(edge[\"from\"])\n        # Pre-compute key paths for benchmark query (first→last section)\n        self._precompute_key_paths()\n\n    def _precompute_key_paths(self):\n        \"\"\"Pre-compute BFS paths between key node pairs for O(1) query_time.\n        \n        Benchmark always queries first→last agents_section. Pre-compute once\n        during build so subsequent queries hit cache instead of re-running BFS.\n\n[420 more lines in file. Use offset=2062 to continue.]"}],"isError":false,"timestamp":1777539548734}}
