{"type":"message","id":"36ceafc2","parentId":"9a5e1ee0","timestamp":"2026-04-30T06:29:23.764Z","message":{"role":"toolResult","toolCallId":"call_function_1oh6sxggu0tx_1","toolName":"read","content":[{"type":"text","text":"#!/usr/bin/env python3\n\"\"\"\n_benchmark.py — Autoresearch benchmark driver\nDB-augmented directed code generation via unified graph memory\n\nMeasures:\n  - graph_build_time_ms   (PRIMARY — lower is better)\n  - graph_node_count       (secondary)\n  - graph_edge_count       (secondary)\n  - query_time_ms          (secondary — path find across graph)\n  - ascii_render_lines     (secondary — rendered output size)\n\"\"\"\n\nimport time\nimport os\nimport json\nimport subprocess\nfrom collections import deque\n\n# Try to import modular system\ntry:\n    from graph_builder import build_graph, GraphBuilder\n    from query_engine import QueryEngine\n    from asciirender import ASCIIRenderer\n    HAS_MODULAR = True\nexcept ImportError:\n    HAS_MODULAR = False\n\nAGI_DIR = os.path.dirname(os.path.abspath(__file__))\nHERMES_DIR = os.path.expanduser(\"~/.hermes\")\nEXPERIMENT_DIR = os.path.join(AGI_DIR, \"experiments\", time.strftime(\"%Y%m%d_%H%M%S\"))\nos.makedirs(EXPERIMENT_DIR, exist_ok=True)\n\ndef metric(name, value):\n    print(f\"METRIC {name}={value}\", flush=True)\n\ndef run(cmd, timeout=30):\n    try:\n        result = subprocess.run(\n            cmd, shell=True, capture_output=True, text=True, timeout=timeout,\n            cwd=AGI_DIR\n        )\n        return result.stdout + result.stderr\n    except Exception:\n        return \"\"\n\n# Pre-load gitnexus cache before timing (I/O not part of graph construction)\n_GITNEXUS_CACHE_FILE = os.path.join(AGI_DIR, \".gitnexus_cache.json\")\n_gitnexus_cache = None\n\nif os.path.exists(_GITNEXUS_CACHE_FILE):\n    try:\n        mtime = os.path.getmtime(_GITNEXUS_CACHE_FILE)\n        age_hours = (time.time() - mtime) / 3600\n        if age_hours < 1:\n            with open(_GITNEXUS_CACHE_FILE) as f:\n                _gitnexus_cache = f.read()\n    except Exception:\n        pass\n\nif _gitnexus_cache is None:\n    _gitnexus_dir = os.path.join(HERMES_DIR, \"belam-codex\", \".gitnexus\")\n    if os.path.isdir(_gitnexus_dir):\n        _gitnexus_cache = run(f\"cd {HERMES_DIR}/belam-codex && npx --yes gitnexus query --repo belam-codex 'symbol' 2>/dev/null || echo ''\", timeout=15)\n        try:\n            with open(_GITNEXUS_CACHE_FILE, 'w') as f:\n                f.write(_gitnexus_cache)\n        except Exception:\n            pass\n\n# Pre-warm graph pickle cache before timing (I/O outside benchmark window)\nif HAS_MODULAR:\n    # First call builds + saves pickle; second call hits cache\n    build_graph(HERMES_DIR, AGI_DIR, gitnexus_cache=_gitnexus_cache)\n    \n    # Timed run — should hit pickle cache (microseconds)\n    start = time.perf_counter()\n    builder, _ = build_graph(HERMES_DIR, AGI_DIR, gitnexus_cache=_gitnexus_cache)\n    build_time_ms = (time.perf_counter() - start) * 1000\n    \n    nodes = builder.nodes\n    edges = builder.edges\n    adj = builder.adj\nelse:\n    # Fallback to inline implementation\n    import re\n    _RE_SECTION_SPLIT = re.compile(r'\\n(?=#)')\n    _RE_CODE_BLOCK = re.compile(r'`([^`]+)`')\n    \n    start = time.perf_counter()\n    nodes = []\n    edges = []\n    \n    agents_md = os.path.join(HERMES_DIR, \"belam-codex\", \"AGENTS.md\")\n    if os.path.exists(agents_md):\n        with open(agents_md, \"r\") as f:\n            content = f.read()\n        \n        sections = _RE_SECTION_SPLIT.split(content)\n        last_section_idx = -1\n        for i, section in enumerate(sections):\n            lines = section.strip().split('\\n')\n            if not lines:\n                continue\n            header = lines[0].strip('#').strip()\n            body = '\\n'.join(lines[1:]).strip()[:120]\n            nodes.append({\n                \"id\": f\"agents_section_{i}\",\n                \"type\": \"doc_section\",\n                \"label\": header[:60],\n                \"content\": body,\n                \"source\": \"AGENTS.md\"\n            })\n            if last_section_idx >= 0:\n                edges.append({\"from\": f\"agents_section_{last_section_idx}\", \"to\": f\"agents_section_{i}\", \"type\": \"sequential\"})\n            last_section_idx = i\n        \n        for match in _RE_CODE_BLOCK.finditer(content):\n            code = match.group(1)\n            if len(code) > 3 and ' ' in code:\n                nodes.append({\n                    \"id\": f\"code_ref_{match.start()}\",\n                    \"type\": \"code_reference\",\n                    \"label\": code[:60],\n                    \"content\": code,\n                    \"source\": \"AGENTS.md\"\n                })\n                edges.append({\n                    \"from\": f\"agents_section_{last_section_idx}\",\n                    \"to\": f\"code_ref_{match.start()}\",\n                    \"type\": \"contains\"\n                })\n    \n    # Process gitnexus cache\n    if _gitnexus_cache and _gitnexus_cache.strip():\n        try:\n            result = json.loads(_gitnexus_cache)\n            for category in ['definitions', 'process_symbols', 'processes']:\n                for item in result.get(category, [])[:30]:\n                    nodes.append({\n                        \"id\": f\"gitnexus_{category}_{item.get('id', '')[:40]}\",\n                        \"type\": f\"gitnexus_{category.rstrip('s')}\",\n                        \"label\": item.get('name', item.get('id', ''))[:60],\n                        \"content\": f\"{item.get('filePath', '')}:{item.get('startLine', '')}\",\n                        \"source\": \"gitnexus_index\"\n                    })\n        except json.JSONDecodeError:\n            pass\n    \n    build_time_ms = (time.perf_counter() - start) * 1000\n    \n    # Build adjacency\n    adj = {n[\"id\"]: [] for n in nodes}\n    for e in edges:\n        if e[\"from\"] in adj and e[\"to\"] in adj:\n            adj[e[\"from\"]].append(e[\"to\"])\n            adj[e[\"to\"]].append(e[\"from\"])\n\nmetric(\"graph_build_time_ms\", round(build_time_ms, 2))\nmetric(\"graph_node_count\", len(nodes))\nmetric(\"graph_edge_count\", len(edges))\n\n# ── 2. Path Query ───────────────────────────────────────────────────────────\nstart = time.perf_counter()\npath_result = \"\"\nif len(nodes) >= 2:\n    section_nodes = [n[\"id\"] for n in nodes if n[\"id\"].startswith(\"agents_section_\")]\n    if len(section_nodes) >= 2:\n        start_node, end_node = section_nodes[0], section_nodes[-1]\n        visited = {start_node}\n        queue = deque([(start_node, [start_node])])\n        found = None\n        while queue:\n            current, path = queue.popleft()\n            if current == end_node:\n                found = path\n                break\n            for neighbor in adj.get(current, []):\n                if neighbor not in visited:\n                    visited.add(neighbor)\n                    queue.append((neighbor, path + [neighbor]))\n        path_result = json.dumps(found) if found else \"[]\"\n\nquery_time_ms = (time.perf_counter() - start) * 1000\nmetric(\"query_time_ms\", round(query_time_ms, 2))\n\n# ── 3. ASCII Render ─────────────────────────────────────────────────────────\nlines = []\nif nodes:\n    lines.append(\" UNIFIED GRAPH \")\n    lines.append(\"=\" * 60)\n    lines.append(f\" nodes={len(nodes)}  edges={len(edges)}\")\n    lines.append(\"-\" * 60)\n    \n    section_nodes = [n for n in nodes if n[\"type\"] == \"doc_section\"]\n    node_lookup = {n[\"id\"]: n for n in nodes}\n    \n    for i, n in enumerate(section_nodes[:10]):\n        label = n[\"label\"][:50]\n        children = adj.get(n[\"id\"]) or []\n        child_labels = [node_lookup[c][\"label\"][:20] for c in children[:3] if c in node_lookup]\n        child_str = f\" → {', '.join(child_labels)}\" if child_labels else \"\"\n        lines.append(f\"{'  ' if i > 0 else ''}├─ {label}{child_str}\")\n    \n    if len(section_nodes) > 10:\n        lines.append(f\"  ... +{len(section_nodes) - 10} more sections\")\n    \n    lines.append(\"-\" * 60)\n    lines.append(f\" path_query: {path_result[:80]}{'...' if len(path_result) > 80 else ''}\")\n\nascii_output = '\\n'.join(lines)\nascii_lines = len(ascii_output.strip().split('\\n'))\nmetric(\"ascii_render_lines\", ascii_lines)\n\n# Save output\noutput_file = os.path.join(EXPERIMENT_DIR, \"output.txt\")\nwith open(output_file, \"w\") as f:\n    f.write(f\"graph_build_time_ms={round(build_time_ms,2)}\\n\")\n    f.write(f\"graph_node_count={len(nodes)}\\n\")\n    f.write(f\"graph_edge_count={len(edges)}\\n\")\n    f.write(f\"query_time_ms={round(query_time_ms,2)}\\n\")\n    f.write(f\"ascii_render_lines={ascii_lines}\\n\")\n    f.write(f\"\\n--- ASCII GRAPH RENDER ---\\n\")\n    f.write(ascii_output)\n\nprint(f\"\\nMETRIC graph_build_time_ms={round(build_time_ms, 2)}\")\nprint(f\"METRIC graph_node_count={len(nodes)}\")\nprint(f\"METRIC graph_edge_count={len(edges)}\")\nprint(f\"METRIC query_time_ms={round(query_time_ms, 2)}\")\nprint(f\"METRIC ascii_render_lines={ascii_lines}\")\nprint(f\"Using modular system: {HAS_MODULAR}\")\n"}],"isError":false,"timestamp":1777530563764}}
{"type":"message","id":"2c062ab1","parentId":"36ceafc2","timestamp":"2026-04-30T06:29:53.262Z","message":{"role":"assistant","content":[{"type":"thinking","thinking":"Looking at the code, I see the benchmark script is calling `build_graph` twice:\n1. First call to build + save pickle\n2. Second call (timed) to hit pickle cache\n\nThe timing is already very fast at ~0.49ms. Let me think about what optimization I can do.\n\nLooking at the current flow:\n1. Pre-warm happens: `build_graph(...)` - builds cache\n2. Timed run: `build_graph(...)` - loads from cache\n\nBut wait, there's a subtle issue. In `build_graph`:\n```python\ndef build_graph(hermes_dir: str, agi_dir: str, use_gitnexus: bool = True,\n                 gitnexus_cache: Optional[str] = None) -> Tuple[GraphBuilder, float]:\n    start = time.perf_counter()\n    ...\n    # Try to load from pickle cache\n    builder = _try_load_graph_cache(agi_dir, source_mtimes, gitnexus_cache)\n    if builder is not None:\n        elapsed_ms = (time.perf_counter() - start) * 1000\n        return builder, elapsed_ms  # This includes the pickle load time\n```\n\nWhen we call `build_graph` twice, the second call should hit the pickle cache. The time measured for the second call includes:\n1. `time.perf_counter()` call\n2. `_try_load_graph_cache()` which reads the pickle file\n\nWait, I notice an issue! The `_try_load_graph_cache` does `import pickle` inside the function. This import takes time on every cache hit. We could move the `import pickle` to module level.\n\nActually, let me trace through what happens on the timed run:\n1. `start = time.perf_counter()` \n2. `init_cache(agi_dir)` - no-op if already initialized\n3. `source_mtimes = _get_source_mtimes(hermes_dir)` - reads mtimes of files\n\n\n4. `_try_load_graph_cache(...)` - imports pickle, opens file, loads data\n5. Returns elapsed_ms\n\nThe `import pickle` happens on every timed run, which adds overhead. Moving it to module level would eliminate this repeated import cost.\n\nAdditionally, `_get_source_mtimes` could be cached since the file modification times don't change during the run—it scans the filesystem on each call, which is wasteful when we're just reading from cache.\n\nThere's also redundancy in how `build_adjacency` constructs the adjacency list: it rebuilds the entire structure from scratch each time, iterating through edges and populating the adjacency dictionary, when this could be built once and reused.\n\nIn the timed run, the pickle cache restoration already handles setting up the graph structure properly, but there's a disconnect between what gets cached and what gets restored—the adjacency data is stored and loaded from pickle, yet the method still rebuilds it unnecessarily.\n\nLooking at the actual code path for cache hits, `build_adjacency()` isn't called at all, so the issue doesn't manifest there. The real problem might be in how the experiment iterates. Since the pre-warm call happens outside the timed loop, the second invocation should hit the cache. I should run an experiment to see if there's a measurable difference.\n\nOne thing stands out: `import pickle` is happening inside `_try_load_graph_cache`, which means it runs on every cache access. Moving that import to module level could reduce overhead.\n\nThere's also potential for streamlining `_get_source_mtimes`—instead of iterating through multiple file lists, I could combine them into a single pass through the filesystem, which would cut down on redundant operations.","thinkingSignature":"81357ef30e92b23b8c853053434ed6a3047c667b8214bda7b25b110095f3ebc1"},{"type":"text","text":"Looking at the code, I see `import pickle` inside `_try_load_graph_cache` runs on every cache hit. Moving it to module level should shave off some import overhead.\n\nLet me make one targeted optimization:\n"},{"type":"toolCall","id":"call_function_zstisaccndf0_1","name":"edit","arguments":{"path":"/home/ubuntu/.hermes/agi/graph_builder.py","edits":[{"oldText":"# Graph pickle cache file\n_GRAPH_CACHE_FILE = None","newText":"# Graph pickle cache file\n_GRAPH_CACHE_FILE = None\nimport pickle  # Module-level for faster cache loads"},{"oldText":"def _try_load_graph_cache(agi_dir: str, source_mtimes: Dict[str, float],\n                           gitnexus_cache: Optional[str]) -> Optional[GraphBuilder]:\n    \"\"\"Try to load graph from pickle cache if sources unchanged.\"\"\"\n    cache_file = _get_graph_cache_file(agi_dir)\n    if not os.path.exists(cache_file):\n        return None\n    try:\n        import pickle\n        with open(cache_file, 'rb') as f:\n            cached = pickle.load(f)","newText":"def _try_load_graph_cache(agi_dir: str, source_mtimes: Dict[str, float],\n                           gitnexus_cache: Optional[str]) -> Optional[GraphBuilder]:\n    \"\"\"Try to load graph from pickle cache if sources unchanged.\"\"\"\n    cache_file = _get_graph_cache_file(agi_dir)\n    if not os.path.exists(cache_file):\n        return None\n    try:\n        with open(cache_file, 'rb') as f:\n            cached = pickle.load(f)"},{"oldText":"def _save_graph_cache(agi_dir: str, builder: GraphBuilder,\n                       source_mtimes: Dict[str, float],\n                       gitnexus_cache: Optional[str]):\n    \"\"\"Save built graph to pickle cache.\"\"\"\n    try:\n        import pickle\n        cache_file = _get_graph_cache_file(agi_dir)","newText":"def _save_graph_cache(agi_dir: str, builder: GraphBuilder,\n                       source_mtimes: Dict[str, float],\n                       gitnexus_cache: Optional[str]):\n    \"\"\"Save built graph to pickle cache.\"\"\"\n    try:\n        cache_file = _get_graph_cache_file(agi_dir)"}]}}],"api":"anthropic-messages","provider":"minimax","model":"MiniMax-M2.7","usage":{"input":8505,"output":1261,"cacheRead":10071,"cacheWrite":0,"totalTokens":19837,"cost":{"input":0.0025515,"output":0.0015132,"cacheRead":0.0006042599999999999,"cacheWrite":0,"total":0.00466896}},"stopReason":"toolUse","timestamp":1777530563765,"responseId":"064229c4622a3f9167bd7f1a5910cbd6"}}
{"type":"message","id":"5d57246e","parentId":"2c062ab1","timestamp":"2026-04-30T06:29:53.277Z","message":{"role":"toolResult","toolCallId":"call_function_zstisaccndf0_1","toolName":"edit","content":[{"type":"text","text":"Successfully replaced 3 block(s) in /home/ubuntu/.hermes/agi/graph_builder.py."}],"details":{"diff":"     ...\n 288 \n 289 \n 290 # Graph pickle cache file\n 291 _GRAPH_CACHE_FILE = None\n+292 import pickle  # Module-level for faster cache loads\n 292 \n 293 def _get_graph_cache_file(agi_dir: str) -> str:\n 294     global _GRAPH_CACHE_FILE\n 295     if _GRAPH_CACHE_FILE is None:\n     ...\n 325     cache_file = _get_graph_cache_file(agi_dir)\n 326     if not os.path.exists(cache_file):\n 327         return None\n 328     try:\n-329         import pickle\n 330         with open(cache_file, 'rb') as f:\n 331             cached = pickle.load(f)\n 332         # Verify source mtimes match\n 333         if cached.get('_source_mtimes') != source_mtimes:\n     ...\n 348                        source_mtimes: Dict[str, float],\n 349                        gitnexus_cache: Optional[str]):\n 350     \"\"\"Save built graph to pickle cache.\"\"\"\n 351     try:\n-352         import pickle\n 353         cache_file = _get_graph_cache_file(agi_dir)\n 354         cached = {\n 355             'nodes': builder.nodes,\n 356             'edges': builder.edges,\n     ...","firstChangedLine":292},"isError":false,"timestamp":1777530593277}}
{"type":"message","id":"dbc97958","parentId":"5d57246e","timestamp":"2026-04-30T06:29:56.677Z","message":{"role":"assistant","content":[{"type":"thinking","thinking":"Good, now let me commit this change and run the experiment.","thinkingSignature":"b80b9393f46ec447dc18d2b36c09bfec9407094bfc6cd3d07b622ada5add48ec"},{"type":"toolCall","id":"call_function_pi7mwefq0qqo_1","name":"bash","arguments":{"command":"cd /home/ubuntu/.hermes/agi && git add -A && git commit -m \"Move pickle import to module level — faster cache loads\""}}],"api":"anthropic-messages","provider":"minimax","model":"MiniMax-M2.7","usage":{"input":9802,"output":69,"cacheRead":10071,"cacheWrite":0,"totalTokens":19942,"cost":{"input":0.0029406,"output":0.0000828,"cacheRead":0.0006042599999999999,"cacheWrite":0,"total":0.0036276599999999996}},"stopReason":"toolUse","timestamp":1777530593277,"responseId":"064229e1778e500b8bea96dd8baee433"}}
