{"type":"message","id":"7f37f2ae","parentId":"77112279","timestamp":"2026-04-30T09:13:16.225Z","message":{"role":"assistant","content":[{"type":"thinking","thinking":"Let me continue reading the graph_builder.py and also the benchmark script.","thinkingSignature":"e3b4d0ac24cf95ee1fd0df38b55eb738043eae58b8890b0bed51b16d0bef2c6e"},{"type":"toolCall","id":"call_function_duuu8b2tmn3p_1","name":"read","arguments":{"path":"/home/ubuntu/.hermes/agi/graph_builder.py","offset":1280}},{"type":"toolCall","id":"call_function_duuu8b2tmn3p_2","name":"read","arguments":{"path":"/home/ubuntu/.hermes/agi/_benchmark.py"}}],"api":"anthropic-messages","provider":"minimax","model":"MiniMax-M2.7","usage":{"input":26639,"output":92,"cacheRead":10071,"cacheWrite":0,"totalTokens":36802,"cost":{"input":0.0079917,"output":0.0001104,"cacheRead":0.0006042599999999999,"cacheWrite":0,"total":0.00870636}},"stopReason":"toolUse","timestamp":1777540390206,"responseId":"064250264d72a1696a9fc719281ccb3d"}}
