{"type":"message","id":"392c15d3","parentId":"8be5ab11","timestamp":"2026-04-30T09:06:28.124Z","message":{"role":"toolResult","toolCallId":"call_function_le0lmr73oxco_1","toolName":"edit","content":[{"type":"text","text":"Successfully replaced 1 block(s) in /home/ubuntu/.hermes/agi/graph_builder.py."}],"details":{"diff":"      ...\n 1691             yaml_blocks = list(_RE_YAML_BLOCK.finditer(content))\n 1692             \n 1693             # Pre-parse YAML blocks to build stage -> (role, action, session, cli) map\n 1694             stage_meta = {}  # stage_name -> {role, action, session, cli}\n-1695             current_yaml_path = []  # [phase_name, ...]\n-1696             in_stages = False\n 1697             for yb in yaml_blocks:\n 1698                 yaml_content = yb.group(1)\n 1699                 lines = yaml_content.split('\\n')\n 1700                 cur_phase = None\n+1699                 cur_indent = 0\n+1700                 in_stages = False\n+1701                 stage_lines = []  # collect lines for current stage\n+1702                 \n 1701                 for yline in lines:\n-1702                     # Track current phase\n-1703                     ph_match = re.match(r'^(\\s*)(\\w+):', yline)\n-1704                     if ph_match:\n-1705                         indent = len(ph_match.group(1))\n-1706                         key = ph_match.group(2)\n-1707                         if indent == 0 and key in ('phase1', 'phase2', 'phase3'):\n-1708                             cur_phase = key\n+1704                     # Track indentation and content\n+1705                     indent_match = re.match(r'^(\\s*)(.*)', yline)\n+1706                     indent = len(indent_match.group(1)) if indent_match else 0\n+1707                     stripped = indent_match.group(2) if indent_match else ''\n+1708                     \n+1709                     # Track phases nested under 'phases:'\n+1710                     if stripped.startswith('phase') and ':' in stripped:\n+1711                         phase_key = stripped.split(':')[0].strip()\n+1712                         if phase_key in ('phase1', 'phase2', 'phase3'):\n+1713                             cur_phase = phase_key\n 1709                             in_stages = False\n-1710                         elif cur_phase and indent > 0 and key == 'stages':\n-1711                             in_stages = True\n-1712                         elif in_stages and indent > 0:\n-1713                             # Stage definition line: \"- role: builder\"\n-1714                             stage_def = re.match(r'^(\\s*)- role: (\\w+)', yline)\n-1715                             if stage_def:\n-1716                                 role = stage_def.group(2)\n-1717                                 action_match = re.search(r'action: (\\w+)', yline)\n-1718                                 action = action_match.group(1) if action_match else ''\n-1719                                 # Look ahead for session/cli in following lines\n-1720                                 session_match = re.search(r'session: (\\w+)', yline)\n-1721                                 session = session_match.group(1) if session_match else ''\n-1722                                 cli_match = re.search(r'cli: (\\w+)', yline)\n-1723                                 cli = cli_match.group(1) if cli_match else ''\n-1724                                 # Use role+action as stage key\n-1725                                 stage_key = f\"p{cur_phase[-1]}_{role}_{action}\"  # e.g., p1_builder_implement\n-1726                                 stage_meta[stage_key] = {\n-1727                                     'role': role,\n-1728                                     'action': action,\n-1729                                     'session': session,\n-1730                                     'cli': cli,\n-1731                                     'phase': cur_phase\n-1732                                 }\n+1715                             stage_lines = []\n+1716                             cur_indent = indent\n+1717                     \n+1718                     # Detect stages section\n+1719                     if stripped.startswith('stages:') and indent > cur_indent:\n+1720                         in_stages = True\n+1721                         continue\n+1722                     \n+1723                     # Parse stage definitions (lines starting with '- role:')\n+1724                     if in_stages and stripped.startswith('- role:'):\n+1725                         role = stripped.split('role:')[1].strip().split()[0] if 'role:' in stripped else ''\n+1726                         # Collect rest of this stage's config\n+1727                         stage_lines = [stripped]\n+1728                         stage_indent = indent\n+1729                     elif in_stages and stage_lines and indent > stage_indent:\n+1730                         # Continuation of stage config\n+1731                         stage_lines.append(stripped)\n+1732                     elif in_stages and stage_lines and indent <= stage_indent and stripped:\n+1733                         # New stage or different section - process previous\n+1734                         full_stage = '\\n'.join(stage_lines)\n+1735                         action_match = re.search(r'action:\\s*(\\w+)', full_stage)\n+1736                         session_match = re.search(r'session:\\s*(\\w+)', full_stage)\n+1737                         cli_match = re.search(r'cli:\\s*(\\w+)', full_stage)\n+1738                         \n+1739                         if role and cur_phase:\n+1740                             action = action_match.group(1) if action_match else ''\n+1741                             stage_key = f\"p{cur_phase[-1]}_{role}_{action}\"\n+1742                             stage_meta[stage_key] = {\n+1743                                 'role': role,\n+1744                                 'action': action,\n+1745                                 'session': session_match.group(1) if session_match else '',\n+1746                                 'cli': cli_match.group(1) if cli_match else '',\n+1747                                 'phase': cur_phase\n+1748                             }\n+1749                         # Reset for new stage\n+1750                         role = stripped.split('role:')[1].strip().split()[0] if '- role:' in stripped else role\n+1751                         stage_lines = [stripped] if '- role:' in stripped else []\n+1752                         stage_indent = indent\n+1753                 \n+1754                 # Process final stage in block\n+1755                 if stage_lines and role and cur_phase:\n+1756                     full_stage = '\\n'.join(stage_lines)\n+1757                     action_match = re.search(r'action:\\s*(\\w+)', full_stage)\n+1758                     session_match = re.search(r'session:\\s*(\\w+)', full_stage)\n+1759                     cli_match = re.search(r'cli:\\s*(\\w+)', full_stage)\n+1760                     action = action_match.group(1) if action_match else ''\n+1761                     stage_key = f\"p{cur_phase[-1]}_{role}_{action}\"\n+1762                     stage_meta[stage_key] = {\n+1763                         'role': role,\n+1764                         'action': action,\n+1765                         'session': session_match.group(1) if session_match else '',\n+1766                         'cli': cli_match.group(1) if cli_match else '',\n+1767                         'phase': cur_phase\n+1768                     }\n 1733 \n 1734             # Extract phase + stage hierarchy from markdown headings\n 1735             current_phase = None\n 1736             current_stage = None\n      ...","firstChangedLine":1695},"isError":false,"timestamp":1777539988124}}
{"type":"message","id":"fe95d6e1","parentId":"392c15d3","timestamp":"2026-04-30T09:06:42.272Z","message":{"role":"assistant","content":[{"type":"thinking","thinking":"Wait, looking at the stage names in the markdown, they are:\n- `p1_builder_implement`\n- `p1_builder_bugfix`\n- etc.\n\nBut my stage key generation is `p{cur_phase[-1]}_{role}_{action}` which would produce:\n- `p1_builder_implement` ✓\n- `p1_builder_bugfix` ✓\n- etc.\n\nBut the markdown uses backtick-quoted stage names like `#### \\`p1_builder_implement\\``\n\nThe regex `_RE_STAGE_HDR = re.compile(r'^####\\s+`([\\w_]+)`\\n', re.MULTILINE)` should match this.\n\nLet me verify by testing the YAML parsing first:","thinkingSignature":"3bc9a5ab5e9afb1edeab41d19b8ed9ed06f178f97ff752194f967c58fd09986a"},{"type":"toolCall","id":"call_function_kkszcimpo2yg_1","name":"bash","arguments":{"command":"cd /home/ubuntu/.hermes/agi && python3 -c \"\nimport re\ncontent = open('/home/ubuntu/.hermes/belam-codex/templates/builder-first-pipeline.md').read()\n_RE_YAML_BLOCK = re.compile(r'\\`\\`\\`yaml\\n(.*?)\\n\\`\\`\\`', re.DOTALL)\nblocks = list(_RE_YAML_BLOCK.finditer(content))\n\nstage_meta = {}\nfor yb in blocks:\n    yaml_content = yb.group(1)\n    lines = yaml_content.split('\\n')\n    cur_phase = None\n    cur_indent = 0\n    in_stages = False\n    stage_lines = []\n    role = ''\n    stage_indent = 0\n    \n    for yline in lines:\n        indent_match = re.match(r'^(\\s*)(.*)', yline)\n        indent = len(indent_match.group(1)) if indent_match else 0\n        stripped = indent_match.group(2) if indent_match else ''\n        \n        if stripped.startswith('phase') and ':' in stripped:\n            phase_key = stripped.split(':')[0].strip()\n            if phase_key in ('phase1', 'phase2', 'phase3'):\n                cur_phase = phase_key\n                in_stages = False\n                stage_lines = []\n                cur_indent = indent\n        \n        if stripped.startswith('stages:') and indent > cur_indent:\n            in_stages = True\n            continue\n        \n        if in_stages and stripped.startswith('- role:'):\n            role = stripped.split('role:')[1].strip().split()[0]\n            stage_lines = [stripped]\n            stage_indent = indent\n        elif in_stages and stage_lines and indent > stage_indent:\n            stage_lines.append(stripped)\n        elif in_stages and stage_lines and indent <= stage_indent and stripped:\n            full_stage = '\\n'.join(stage_lines)\n            action_match = re.search(r'action:\\s*(\\w+)', full_stage)\n            if role and cur_phase:\n                action = action_match.group(1) if action_match else ''\n                stage_key = f\\\"p{cur_phase[-1]}_{role}_{action}\\\"\n                stage_meta[stage_key] = {'role': role, 'action': action, 'phase': cur_phase}\n            role = stripped.split('role:')[1].strip().split()[0] if '- role:' in stripped else role\n            stage_lines = [stripped] if '- role:' in stripped else []\n            stage_indent = indent\n    \n    if stage_lines and role and cur_phase:\n        full_stage = '\\n'.join(stage_lines)\n        action_match = re.search(r'action:\\s*(\\w+)', full_stage)\n        action = action_match.group(1) if action_match else ''\n        stage_key = f\\\"p{cur_phase[-1]}_{role}_{action}\\\"\n        stage_meta[stage_key] = {'role': role, 'action': action, 'phase': cur_phase}\n\nprint(f'Parsed {len(stage_meta)} stages:')\nfor k, v in stage_meta.items():\n    print(f'  {k}: {v}')\n\""}}],"api":"anthropic-messages","provider":"minimax","model":"MiniMax-M2.7","usage":{"input":40444,"output":833,"cacheRead":10071,"cacheWrite":0,"totalTokens":51348,"cost":{"input":0.0121332,"output":0.0009996,"cacheRead":0.0006042599999999999,"cacheWrite":0,"total":0.01373706}},"stopReason":"toolUse","timestamp":1777539988126,"responseId":"06424e94d5a7e0f683aec14cd0aeb924"}}
{"type":"message","id":"3ba0207d","parentId":"fe95d6e1","timestamp":"2026-04-30T09:06:42.313Z","message":{"role":"toolResult","toolCallId":"call_function_kkszcimpo2yg_1","toolName":"bash","content":[{"type":"text","text":"Parsed 1 stages:\n  p3_critic_review: {'role': 'critic', 'action': 'review', 'phase': 'phase3'}\n"}],"isError":false,"timestamp":1777540002313}}
{"type":"message","id":"dcc5674d","parentId":"3ba0207d","timestamp":"2026-04-30T09:07:11.077Z","message":{"role":"assistant","content":[{"type":"thinking","thinking":"The issue is my YAML parsing logic isn't correctly handling the multi-line stage definitions. The `- role:` is on one line, but `action:` might be on a subsequent line at the same indent. Let me look at the actual YAML structure more carefully.\n\nLooking at the YAML:\n```yaml\nphases:\n  phase1:\n    humangate: true\n    stages:\n      - role: builder\n        action: implement\n        session: fresh\n        cli: claude\n        context: [persona-builder, supermap, cockpit, cavekit]\n```\n\nThe `role`, `action`, `session`, etc. are all at the same indent level (2 spaces more than `- role:`).\n\nMy current code collects `stage_lines` when it sees `- role:` but then when it sees the next `- role:` it tries to process the previous stage, but the previous stage config lines (`action:`, `session:`, etc.) are not being properly included.\n\nThe issue is that when I see a new `- role:` line, I need to process the previous stage before starting the new one. But I'm checking `indent <= stage_indent` which won't match because all the continuation lines have indent > `- role:` line.\n\nLet me fix this by checking for lines starting with `- role:` which signals a new stage.","thinkingSignature":"4f82849b637838bcbd310c6d3e956d9cf21635a68731134a22bee5de7a48d445"},{"type":"text","text":"The YAML parsing only catches 1 stage because the indentation tracking is off. Let me fix with a simpler approach:\n"},{"type":"toolCall","id":"call_function_qp53pvrau5el_1","name":"edit","arguments":{"path":"/home/ubuntu/.hermes/agi/graph_builder.py","edits":[{"oldText":"            # Pre-parse YAML blocks to build stage -> (role, action, session, cli) map\n            stage_meta = {}  # stage_name -> {role, action, session, cli}\n            for yb in yaml_blocks:\n                yaml_content = yb.group(1)\n                lines = yaml_content.split('\\n')\n                cur_phase = None\n                cur_indent = 0\n                in_stages = False\n                stage_lines = []  # collect lines for current stage\n                \n                for yline in lines:\n                    # Track indentation and content\n                    indent_match = re.match(r'^(\\s*)(.*)', yline)\n                    indent = len(indent_match.group(1)) if indent_match else 0\n                    stripped = indent_match.group(2) if indent_match else ''\n                    \n                    # Track phases nested under 'phases:'\n                    if stripped.startswith('phase') and ':' in stripped:\n                        phase_key = stripped.split(':')[0].strip()\n                        if phase_key in ('phase1', 'phase2', 'phase3'):\n                            cur_phase = phase_key\n                            in_stages = False\n                            stage_lines = []\n                            cur_indent = indent\n                    \n                    # Detect stages section\n                    if stripped.startswith('stages:') and indent > cur_indent:\n                        in_stages = True\n                        continue\n                    \n                    # Parse stage definitions (lines starting with '- role:')\n                    if in_stages and stripped.startswith('- role:'):\n                        role = stripped.split('role:')[1].strip().split()[0] if 'role:' in stripped else ''\n                        # Collect rest of this stage's config\n                        stage_lines = [stripped]\n                        stage_indent = indent\n                    elif in_stages and stage_lines and indent > stage_indent:\n                        # Continuation of stage config\n                        stage_lines.append(stripped)\n                    elif in_stages and stage_lines and indent <= stage_indent and stripped:\n                        # New stage or different section - process previous\n                        full_stage = '\\n'.join(stage_lines)\n                        action_match = re.search(r'action:\\s*(\\w+)', full_stage)\n                        session_match = re.search(r'session:\\s*(\\w+)', full_stage)\n                        cli_match = re.search(r'cli:\\s*(\\w+)', full_stage)\n                        \n                        if role and cur_phase:\n                            action = action_match.group(1) if action_match else ''\n                            stage_key = f\"p{cur_phase[-1]}_{role}_{action}\"\n                            stage_meta[stage_key] = {\n                                'role': role,\n                                'action': action,\n                                'session': session_match.group(1) if session_match else '',\n                                'cli': cli_match.group(1) if cli_match else '',\n                                'phase': cur_phase\n                            }\n                        # Reset for new stage\n                        role = stripped.split('role:')[1].strip().split()[0] if '- role:' in stripped else role\n                        stage_lines = [stripped] if '- role:' in stripped else []\n                        stage_indent = indent\n                \n                # Process final stage in block\n                if stage_lines and role and cur_phase:\n                    full_stage = '\\n'.join(stage_lines)\n                    action_match = re.search(r'action:\\s*(\\w+)', full_stage)\n                    session_match = re.search(r'session:\\s*(\\w+)', full_stage)\n                    cli_match = re.search(r'cli:\\s*(\\w+)', full_stage)\n                    action = action_match.group(1) if action_match else ''\n                    stage_key = f\"p{cur_phase[-1]}_{role}_{action}\"\n                    stage_meta[stage_key] = {\n                        'role': role,\n                        'action': action,\n                        'session': session_match.group(1) if session_match else '',\n                        'cli': cli_match.group(1) if cli_match else '',\n                        'phase': cur_phase\n                    }","newText":"            # Pre-parse YAML blocks to build stage -> (role, action, session, cli) map\n            stage_meta = {}  # stage_name -> {role, action, session, cli}\n            for yb in yaml_blocks:\n                yaml_content = yb.group(1)\n                lines = yaml_content.split('\\n')\n                cur_phase = None\n                in_stages = False\n                \n                for i, yline in enumerate(lines):\n                    stripped = yline.strip()\n                    \n                    # Track phases nested under 'phases:'\n                    if stripped.startswith('phase') and ':' in stripped:\n                        phase_key = stripped.split(':')[0].strip()\n                        if phase_key in ('phase1', 'phase2', 'phase3'):\n                            cur_phase = phase_key\n                            in_stages = False\n                    \n                    # Detect stages section\n                    if stripped.startswith('stages:'):\n                        in_stages = True\n                        continue\n                    \n                    # Parse stage definitions: collect multi-line until next '- role:'\n                    if in_stages and stripped.startswith('- role:'):\n                        role = stripped.split('role:')[1].strip().split()[0]\n                        # Collect continuation lines until next '- role:' or end\n                        stage_lines = [stripped]\n                        j = i + 1\n                        while j < len(lines):\n                            next_stripped = lines[j].strip()\n                            if next_stripped.startswith('- role:') or (next_stripped and not next_stripped.startswith(' ') and not next_stripped.startswith('-')):\n                                break\n                            if next_stripped:\n                                stage_lines.append(next_stripped)\n                            j += 1\n                        \n                        full_stage = '\\n'.join(stage_lines)\n                        action_match = re.search(r'action:\\s*(\\w+)', full_stage)\n                        session_match = re.search(r'session:\\s*(\\w+)', full_stage)\n                        cli_match = re.search(r'cli:\\s*(\\w+)', full_stage)\n                        \n                        if role and cur_phase:\n                            action = action_match.group(1) if action_match else ''\n                            stage_key = f\"p{cur_phase[-1]}_{role}_{action}\"\n                            stage_meta[stage_key] = {\n                                'role': role,\n                                'action': action,\n                                'session': session_match.group(1) if session_match else '',\n                                'cli': cli_match.group(1) if cli_match else '',\n                                'phase': cur_phase\n                            }"}]}}],"api":"anthropic-messages","provider":"minimax","model":"MiniMax-M2.7","usage":{"input":41325,"output":1813,"cacheRead":10071,"cacheWrite":0,"totalTokens":53209,"cost":{"input":0.012397499999999999,"output":0.0021755999999999998,"cacheRead":0.0006042599999999999,"cacheWrite":0,"total":0.015177359999999999}},"stopReason":"toolUse","timestamp":1777540002315,"responseId":"06424ea258eac20e41b8a8cbfe26041d"}}
