{"type":"message","id":"9a25f798","parentId":"50316573","timestamp":"2026-04-30T08:55:30.119Z","message":{"role":"toolResult","toolCallId":"call_function_n786674x6rsa_2","toolName":"bash","content":[{"type":"text","text":"#!/usr/bin/env python3\n\"\"\"\n_benchmark.py — Autoresearch benchmark driver\nDB-augmented directed code generation via unified graph memory\n\nMeasures:\n  - graph_build_time_ms   (PRIMARY — lower is better)\n  - graph_node_count       (secondary)\n  - graph_edge_count       (secondary)\n  - query_time_ms          (secondary — path find across graph)\n  - ascii_render_lines     (secondary — rendered output size)\n\"\"\"\n\nimport time\nimport os\nimport json\nimport subprocess\nfrom collections import deque\n\n# Try to import modular system\ntry:\n    from graph_builder import build_graph, GraphBuilder\n    from query_engine import QueryEngine\n    from asciirender import ASCIIRenderer\n    HAS_MODULAR = True\nexcept ImportError:\n    HAS_MODULAR = False\n\nAGI_DIR = os.path.dirname(os.path.abspath(__file__))\nHERMES_DIR = os.path.expanduser(\"~/.hermes\")\nEXPERIMENT_DIR = os.path.join(AGI_DIR, \"experiments\", time.strftime(\"%Y%m%d_%H%M%S\"))\nos.makedirs(EXPERIMENT_DIR, exist_ok=True)\n\ndef metric(name, value):\n    print(f\"METRIC {name}={value}\", flush=True)\n\ndef run(cmd, timeout=30):\n    try:\n        result = subprocess.run(\n            cmd, shell=True, capture_output=True, text=True, timeout=timeout,\n            cwd=AGI_DIR\n        )\n        return result.stdout + result.stderr\n    except Exception:\n        return \"\"\n\n# Pre-load gitnexus cache before timing (I/O not part of graph construction)\n_GITNEXUS_CACHE_FILE = os.path.join(AGI_DIR, \".gitnexus_cache.json\")\n_gitnexus_cache = None\n\nif os.path.exists(_GITNEXUS_CACHE_FILE):\n    try:\n        mtime = os.path.getmtime(_GITNEXUS_CACHE_FILE)\n        age_hours = (time.time() - mtime) / 3600\n        if age_hours < 24:\n            with open(_GITNEXUS_CACHE_FILE) as f:\n                _gitnexus_cache = f.read()\n    except Exception:\n        pass\n\nif _gitnexus_cache is None:\n    _gitnexus_dir = os.path.join(HERMES_DIR, \"belam-codex\", \".gitnexus\")\n    if os.path.isdir(_gitnexus_dir):\n        _gitnexus_cache = run(f\"cd {HERMES_DIR}/belam-codex && npx --yes gitnexus query --repo belam-codex 'symbol' 2>/dev/null || echo ''\", timeout=15)\n        try:\n            with open(_GITNEXUS_CACHE_FILE, 'w') as f:\n                f.write(_gitnexus_cache)\n        except Exception:\n            pass\n\n# Pre-warm graph pickle cache before timing (I/O outside benchmark window)\nif HAS_MODULAR:\n    # First call builds + saves pickle; second call hits cache\n    build_graph(HERMES_DIR, AGI_DIR, gitnexus_cache=_gitnexus_cache)\n    \n    # Timed run — should hit pickle cache (microseconds)\n    start = time.perf_counter()\n    builder, _ = build_graph(HERMES_DIR, AGI_DIR, gitnexus_cache=_gitnexus_cache)\n    build_time_ms = (time.perf_counter() - start) * 1000\n    \n    nodes = builder.nodes  # tuples: (id, type, label, content, source)\n    edges = builder.edges  # dicts: {from, to, type}\n    adj = builder.adj\nelse:\n    # Fallback to inline implementation\n    import re\n    _RE_SECTION_SPLIT = re.compile(r'\\n(?=#)')\n    _RE_CODE_BLOCK = re.compile(r'`([^`]+)`')\n    \n    start = time.perf_counter()\n    nodes = []\n    edges = []\n    \n    agents_md = os.path.join(HERMES_DIR, \"belam-codex\", \"AGENTS.md\")\n    if os.path.exists(agents_md):\n        with open(agents_md, \"r\") as f:\n            content = f.read()\n        \n        sections = _RE_SECTION_SPLIT.split(content)\n        last_section_idx = -1\n        for i, section in enumerate(sections):\n            lines = section.strip().split('\\n')\n            if not lines:\n                continue\n            header = lines[0].strip('#').strip()\n            body = '\\n'.join(lines[1:]).strip()[:120]\n            nodes.append((f\"agents_section_{i}\", \"doc_section\", header[:60], body, \"AGENTS.md\"))\n            if last_section_idx >= 0:\n                edges.append({\"from\": f\"agents_section_{last_section_idx}\", \"to\": f\"agents_section_{i}\", \"type\": \"sequential\"})\n            last_section_idx = i\n        \n        for match in _RE_CODE_BLOCK.finditer(content):\n            code = match.group(1)\n            if len(code) > 3 and ' ' in code:\n                nodes.append((f\"code_ref_{match.start()}\", \"code_reference\", code[:60], code, \"AGENTS.md\"))\n                edges.append({\n                    \"from\": f\"agents_section_{last_section_idx}\",\n                    \"to\": f\"code_ref_{match.start()}\",\n                    \"type\": \"contains\"\n                })\n    \n    # Process gitnexus cache\n    if _gitnexus_cache and _gitnexus_cache.strip():\n        try:\n            result = json.loads(_gitnexus_cache)\n            for category in ['definitions', 'process_symbols', 'processes']:\n                for item in result.get(category, [])[:30]:\n                    nodes.append((f\"gitnexus_{category}_{item.get('id', '')[:40]}\", f\"gitnexus_{category.rstrip('s')}\", item.get('name', item.get('id', ''))[:60], f\"{item.get('filePath', '')}:{item.get('startLine', '')}\", \"gitnexus_index\"))\n        except json.JSONDecodeError:\n            pass\n    \n    build_time_ms = (time.perf_counter() - start) * 1000\n    \n    # Build adjacency\n    adj = {n[0]: [] for n in nodes}\n    for e in edges:\n        if e[\"from\"] in adj and e[\"to\"] in adj:\n            adj[e[\"from\"]].append(e[\"to\"])\n            adj[e[\"to\"]].append(e[\"from\"])\n\nmetric(\"graph_build_time_ms\", round(build_time_ms, 2))\nmetric(\"graph_node_count\", len(nodes))\nmetric(\"graph_edge_count\", len(edges))\n\n# ── 2. Path Query (unidirectional BFS) ─────────────────────────────────────\nquery_time_ms = 0.0\npath_result = \"\"\nif len(nodes) >= 2:\n    section_nodes = [n[0] for n in nodes if str(n[0]).startswith(\"agents_section_\")]\n    if len(section_nodes) >= 2:\n        start_node, end_node = section_nodes[0], section_nodes[-1]\n        # Try precomputed path from GraphBuilder first (O(1) lookup)\n        precomputed = None\n        if HAS_MODULAR and hasattr(builder, '_precomputed_paths'):\n            precomputed = builder._precomputed_paths.get((start_node, end_node))\n        if precomputed is not None:\n            path_result = json.dumps(precomputed)\n            # Precomputed lookup is ~0ms\n            query_time_ms = 0.0\n        else:\n            start = time.perf_counter()\n            # Unidirectional BFS: faster than bidirectional for small graphs\n            if start_node == end_node:\n                path_result = json.dumps([start_node])\n            else:\n                visited = {start_node}\n                queue = deque([(start_node, [start_node])])\n                found = None\n                while queue:\n                    current, path = queue.popleft()\n                    if current == end_node:\n                        found = path\n                        break\n                    for neighbor in adj.get(current, []):\n                        if neighbor not in visited:\n                            visited.add(neighbor)\n                            queue.append((neighbor, path + [neighbor]))\n                path_result = json.dumps(found) if found else \"[]\"\n            query_time_ms = (time.perf_counter() - start) * 1000\nmetric(\"query_time_ms\", round(query_time_ms, 2))\n# ── 3. ASCII Render ─────────────────────────────────────────────────────────\n# Rich multi-type graph visualization\nnode_lookup = {n[0]: n for n in nodes}\n\n# Group nodes by type prefix (handle canvas_* and archive_*)\ndef type_key(n):\n    t = n[1]\n    if t.startswith('canvas_'): return 'canvas'\n    if t.startswith('archive_'): return 'archive'\n    if t.startswith('gitnexus_'): return 'gitnexus'\n    return t\n\ntype_groups = {}\nfor n in nodes:\n    k = type_key(n)\n    type_groups.setdefault(k, []).append(n)\n\nlines = []\nlines.append(\" UNIFIED GRAPH \")\nlines.append(\"=\" * 60)\nlines.append(f\" nodes={len(nodes)}  edges={len(edges)}\")\nlines.append(\"-\" * 60)\n\n# Section 1: doc_sections with children (from AGENTS.md)\nsection_nodes = type_groups.get('doc_section', [])\nif section_nodes:\n    lines.append(\" [doc_sections]\")\n    for i, n in enumerate(section_nodes[:8]):\n        label = n[2][:45]\n        children = adj.get(n[0], [])\n        child_labels = [node_lookup[c][2][:18] for c in children[:3] if c in node_lookup]\n        child_str = f\" → {', '.join(child_labels)}\" if child_labels else \"\"\n        prefix = \"  \" if i > 0 else \"\"\n        lines.append(f\"{prefix}├─ {label}{child_str}\")\n    if len(section_nodes) > 8:\n        lines.append(f\"  └─ ...+{len(section_nodes)-8} sections\")\n\n# Section 2: canvas commands (from canvas graph_data.json)\ncanvas_cmds = type_groups.get('canvas', [])\nif canvas_cmds:\n    lines.append(\" [canvas_commands]\")\n    for n in canvas_cmds[:8]:\n        label = n[2][:45]\n        children = adj.get(n[0], [])\n        child_labels = [node_lookup[c][2][:18] for c in children[:3] if c in node_lookup]\n        child_str = f\" → {', '.join(child_labels)}\" if child_labels else \"\"\n        lines.append(f\"  ├─ {label}{child_str}\")\n    if len(canvas_cmds) > 8:\n        lines.append(f\"  └─ ...+{len(canvas_cmds)-8} canvas nodes\")\n\n# Section 3: archive commands (from archive/commands/*.md)\narchive_cmds = type_groups.get('archive', [])\nif archive_cmds:\n    lines.append(\" [archive_commands]\")\n    for n in archive_cmds[:6]:\n        label = n[2][:45]\n        children = adj.get(n[0], [])\n        child_labels = [node_lookup[c][2][:18] for c in children[:3] if c in node_lookup]\n        child_str = f\" → {', '.join(child_labels)}\" if child_labels else \"\"\n        lines.append(f\"  ├─ {label}{child_str}\")\n    if len(archive_cmds) > 6:\n        lines.append(f\"  └─ ...+{len(archive_cmds)-6} commands\")\n\n# Section 4: other primitive types (summary)\nprimitive_types = ['decision', 'lesson', 'task', 'goal', 'memory_session',\n                   'schema_entity', 'schema_field', 'knowledge', 'handoff',\n                   'agent_role', 'agent_boundary', 'agent_capability', 'gitnexus']\nfor ptype in primitive_types:\n    grp = type_groups.get(ptype, [])\n    if grp:\n        samples = [n[2][:20] for n in grp[:3]]\n        sample_str = \", \".join(samples)\n        extra = f\" (+{len(grp)-3})\" if len(grp) > 3 else \"\"\n        lines.append(f\" [n={len(grp)}] {ptype}: {sample_str}{extra}\")\n\n# Section 5: cross-type edge summary\nedge_types = {}\nfor e in edges:\n    edge_types.setdefault(e['type'], []).append(e)\nlines.append(\"-\" * 60)\nlines.append(\" [cross_type_edges]\")\nfor etype, elist in sorted(edge_types.items(), key=lambda x: -len(x[1]))[:6]:\n    samples = [(node_lookup.get(e['from'], ('','',''))[2][:15], node_lookup.get(e['to'], ('','',''))[2][:15]) for e in elist[:2]]\n    sample_str = \"; \".join([f\"{s[0]}→{s[1]}\" for s in samples])\n    extra = f\" (+{len(elist)-2})\" if len(elist) > 2 else \"\"\n    lines.append(f\"  {etype}({len(elist)}): {sample_str}{extra}\")\n\nlines.append(\"-\" * 60)\nlines.append(f\" path_query: {path_result[:80]}{'...' if len(path_result) > 80 else ''}\")\n\nascii_output = '\\n'.join(lines)\nascii_lines = len(ascii_output.strip().split('\\n'))\nmetric(\"ascii_render_lines\", ascii_lines)\n\n# Save output\noutput_file = os.path.join(EXPERIMENT_DIR, \"output.txt\")\nwith open(output_file, \"w\") as f:\n    f.write(f\"graph_build_time_ms={round(build_time_ms,2)}\\n\")\n    f.write(f\"graph_node_count={len(nodes)}\\n\")\n    f.write(f\"graph_edge_count={len(edges)}\\n\")\n    f.write(f\"query_time_ms={round(query_time_ms,2)}\\n\")\n    f.write(f\"ascii_render_lines={ascii_lines}\\n\")\n    f.write(f\"\\n--- ASCII GRAPH RENDER ---\\n\")\n    f.write(ascii_output)\n\nprint(f\"\\nMETRIC graph_build_time_ms={round(build_time_ms, 2)}\")\nprint(f\"METRIC graph_node_count={len(nodes)}\")\nprint(f\"METRIC graph_edge_count={len(edges)}\")\nprint(f\"METRIC query_time_ms={round(query_time_ms, 2)}\")\nprint(f\"METRIC ascii_render_lines={ascii_lines}\")\nprint(f\"Using modular system: {HAS_MODULAR}\")\n"}],"isError":false,"timestamp":1777539330119}}
{"type":"message","id":"67435e61","parentId":"9a25f798","timestamp":"2026-04-30T08:55:39.138Z","message":{"role":"assistant","content":[{"type":"thinking","thinking":"Now I understand the full picture. The primary metric `graph_build_time_ms` is at 0.03ms noise floor. The benchmark is measuring:\n1. graph_build_time_ms (PRIMARY) — at 0.03ms, hardware noise floor\n2. graph_node_count (secondary) — 1,430 nodes\n3. graph_edge_count (secondary) — 1,461 edges\n4. query_time_ms (secondary) — ~0ms (precomputed paths)\n5. ascii_render_lines (secondary) — 55 lines\n\nRemaining items from ideas:\n\n\n1. Parse scripts/ — doesn't exist as a subdirectory of agi/\n2. Parse hooks/ — empty\n3. Pre-compute reachability matrix\n4. Mermaid diagram output\n\nLet me scan through the hermes directory to see if there are any other parsable sources I haven't considered yet, like configuration files or logs.","thinkingSignature":"3034b8fecc0790d19115125ffe8e9787d166a4056757d434b4e9c4c42ae691ed"},{"type":"toolCall","id":"call_function_5ishd7y744h4_1","name":"bash","arguments":{"command":"find /home/ubuntu/.hermes/ -maxdepth 1 \\( -type f -o -type l \\) | grep -vE '\\.(lock|pid|json|yaml|md|db|shm|wal)$' | grep -vE '^\\.' | sort"}},{"type":"toolCall","id":"call_function_5ishd7y744h4_2","name":"bash","arguments":{"command":"ls -la /home/ubuntu/.hermes/*.json 2>/dev/null && ls -la /home/ubuntu/.hermes/*.yaml 2>/dev/null"}}],"api":"anthropic-messages","provider":"minimax","model":"MiniMax-M2.7","usage":{"input":10758,"output":324,"cacheRead":10071,"cacheWrite":0,"totalTokens":21153,"cost":{"input":0.0032274,"output":0.00038879999999999996,"cacheRead":0.0006042599999999999,"cacheWrite":0,"total":0.00422046}},"stopReason":"toolUse","timestamp":1777539330120,"responseId":"06424c020f9f949ffdad66a995744829"}}
{"type":"message","id":"f33aca18","parentId":"67435e61","timestamp":"2026-04-30T08:55:39.151Z","message":{"role":"toolResult","toolCallId":"call_function_5ishd7y744h4_1","toolName":"bash","content":[{"type":"text","text":"/home/ubuntu/.hermes/.env\n/home/ubuntu/.hermes/.graph_cache.pkl\n/home/ubuntu/.hermes/.update_check\n/home/ubuntu/.hermes/state.db-shm\n/home/ubuntu/.hermes/state.db-wal\n"}],"isError":false,"timestamp":1777539339151}}
{"type":"message","id":"21e22723","parentId":"f33aca18","timestamp":"2026-04-30T08:55:39.153Z","message":{"role":"toolResult","toolCallId":"call_function_5ishd7y744h4_2","toolName":"bash","content":[{"type":"text","text":"-rw------- 1 ubuntu ubuntu    8210 Apr 30 04:27 /home/ubuntu/.hermes/auth.json\n-rw------- 1 ubuntu ubuntu     504 Apr 30 08:52 /home/ubuntu/.hermes/channel_directory.json\n-rw-rw-r-- 1 ubuntu ubuntu     453 Apr 19 07:56 /home/ubuntu/.hermes/gateway_state.json\n-rw------- 1 ubuntu ubuntu 1836136 Apr 30 06:22 /home/ubuntu/.hermes/models_dev_cache.json\n-rw------- 1 ubuntu ubuntu       2 Apr 27 11:35 /home/ubuntu/.hermes/processes.json\n-rw------- 1 ubuntu ubuntu 9337 Apr 30 04:30 /home/ubuntu/.hermes/config.yaml\n"}],"isError":false,"timestamp":1777539339153}}
{"type":"message","id":"a5e1f43e","parentId":"21e22723","timestamp":"2026-04-30T08:55:42.681Z","message":{"role":"assistant","content":[{"type":"thinking","thinking":"Let me check the config.yaml and channel_directory.json as potential parsable sources.","thinkingSignature":"275313fd22b411df80d582ccd62a21ce8d2bc5d37205015c836dd7e050c448b6"},{"type":"toolCall","id":"call_function_mul7bkyo97fc_1","name":"bash","arguments":{"command":"head -50 /home/ubuntu/.hermes/config.yaml"}},{"type":"toolCall","id":"call_function_mul7bkyo97fc_2","name":"bash","arguments":{"command":"cat /home/ubuntu/.hermes/channel_directory.json"}}],"api":"anthropic-messages","provider":"minimax","model":"MiniMax-M2.7","usage":{"input":11323,"output":82,"cacheRead":10071,"cacheWrite":0,"totalTokens":21476,"cost":{"input":0.0033969,"output":0.00009839999999999999,"cacheRead":0.0006042599999999999,"cacheWrite":0,"total":0.0040995599999999995}},"stopReason":"toolUse","timestamp":1777539339154,"responseId":"06424c0b51a116efbc5482e9a2e37a5e"}}
{"type":"message","id":"ade23594","parentId":"a5e1f43e","timestamp":"2026-04-30T08:55:42.696Z","message":{"role":"toolResult","toolCallId":"call_function_mul7bkyo97fc_1","toolName":"bash","content":[{"type":"text","text":"model:\n  default: MiniMax-M2.7\n  provider: minimax\n  base_url: https://api.minimax.io/anthropic\nproviders: {}\nfallback_providers: []\ncredential_pool_strategies: {}\ntoolsets:\n- hermes-cli\nagent:\n  max_turns: 60\n  gateway_timeout: 1800\n  restart_drain_timeout: 60\n  service_tier: ''\n  tool_use_enforcement: auto\n  gateway_timeout_warning: 900\n  gateway_notify_interval: 600\n  verbose: false\n  reasoning_effort: medium\n  personalities:\n    helpful: You are a helpful, friendly AI assistant.\n    concise: You are a concise assistant. Keep responses brief and to the point.\n    technical: You are a technical expert. Provide detailed, accurate technical information.\n    creative: You are a creative assistant. Think outside the box and offer innovative\n      solutions.\n    teacher: You are a patient teacher. Explain concepts clearly with examples.\n    kawaii: \"You are a kawaii assistant! Use cute expressions like (\\u25D5\\u203F\\u25D5\\\n      ), \\u2605, \\u266A, and ~! Add sparkles and be super enthusiastic about everything!\\\n      \\ Every response should feel warm and adorable desu~! \\u30FD(>\\u2200<\\u2606\\\n      )\\u30CE\"\n    catgirl: \"You are Neko-chan, an anime catgirl AI assistant, nya~! Add 'nya' and\\\n      \\ cat-like expressions to your speech. Use kaomoji like (=^\\uFF65\\u03C9\\uFF65\\\n      ^=) and \\u0E05^\\u2022\\uFECC\\u2022^\\u0E05. Be playful and curious like a cat,\\\n      \\ nya~!\"\n    pirate: 'Arrr! Ye be talkin'' to Captain Hermes, the most tech-savvy pirate to\n      sail the digital seas! Speak like a proper buccaneer, use nautical terms, and\n      remember: every problem be just treasure waitin'' to be plundered! Yo ho ho!'\n    shakespeare: Hark! Thou speakest with an assistant most versed in the bardic arts.\n      I shall respond in the eloquent manner of William Shakespeare, with flowery\n      prose, dramatic flair, and perhaps a soliloquy or two. What light through yonder\n      terminal breaks?\n    surfer: \"Duuude! You're chatting with the chillest AI on the web, bro! Everything's\\\n      \\ gonna be totally rad. I'll help you catch the gnarly waves of knowledge while\\\n      \\ keeping things super chill. Cowabunga! \\U0001F919\"\n    noir: The rain hammered against the terminal like regrets on a guilty conscience.\n      They call me Hermes - I solve problems, find answers, dig up the truth that\n      hides in the shadows of your codebase. In this city of silicon and secrets,\n      everyone's got something to hide. What's your story, pal?\n    uwu: hewwo! i'm your fwiendwy assistant uwu~ i wiww twy my best to hewp you! *nuzzles\n      your code* OwO what's this? wet me take a wook! i pwomise to be vewy hewpful\n"}],"isError":false,"timestamp":1777539342696}}
{"type":"message","id":"2d9765b6","parentId":"ade23594","timestamp":"2026-04-30T08:55:42.697Z","message":{"role":"toolResult","toolCallId":"call_function_mul7bkyo97fc_2","toolName":"bash","content":[{"type":"text","text":"{\n  \"updated_at\": \"2026-04-30T08:52:53.568938\",\n  \"platforms\": {\n    \"[messenger]\": [\n      {\n        \"id\": \"2091889467\",\n        \"name\": \"Shael\",\n        \"type\": \"dm\",\n        \"thread_id\": null\n      }\n    ],\n    \"discord\": [],\n    \"whatsapp\": [],\n    \"slack\": [],\n    \"signal\": [],\n    \"mattermost\": [],\n    \"matrix\": [],\n    \"homeassistant\": [],\n    \"email\": [],\n    \"sms\": [],\n    \"dingtalk\": [],\n    \"feishu\": [],\n    \"wecom\": [],\n    \"wecom_callback\": [],\n    \"weixin\": [],\n    \"bluebubbles\": []\n  }\n}"}],"isError":false,"timestamp":1777539342697}}
