{"type":"message","id":"9cc668b0","parentId":"5acc57d5","timestamp":"2026-04-30T07:50:00.987Z","message":{"role":"assistant","content":[{"type":"thinking","thinking":"Let me read the ideas file and current benchmark to understand what's next.","thinkingSignature":"f594002749ba9e0af5e92bfec7c1ad450d024fc24d5c9b95a3aee60269eabc59"},{"type":"toolCall","id":"call_function_sw476qslx5yk_1","name":"read","arguments":{"path":"/home/ubuntu/.hermes/agi/autoresearch.ideas.md"}},{"type":"toolCall","id":"call_function_sw476qslx5yk_2","name":"read","arguments":{"path":"/home/ubuntu/.hermes/agi/autoresearch.sh"}},{"type":"toolCall","id":"call_function_sw476qslx5yk_3","name":"read","arguments":{"path":"/home/ubuntu/.hermes/agi/graph_builder.py"}}],"api":"anthropic-messages","provider":"minimax","model":"MiniMax-M2.7","usage":{"input":8596,"output":115,"cacheRead":10071,"cacheWrite":0,"totalTokens":18782,"cost":{"input":0.0025788,"output":0.000138,"cacheRead":0.0006042599999999999,"cacheWrite":0,"total":0.00332106}},"stopReason":"toolUse","timestamp":1777535396721,"responseId":"06423ca5e2f46ec959f9b6be96688e08"}}
{"type":"message","id":"f31c6362","parentId":"9cc668b0","timestamp":"2026-04-30T07:50:00.990Z","message":{"role":"toolResult","toolCallId":"call_function_sw476qslx5yk_1","toolName":"read","content":[{"type":"text","text":"# Autoresearch Ideas — Pruned 2026-04-30\n\n## DONE — Archived\n- [x] Pre-compile regex patterns — iter 1-4\n- [x] Gitnexus availability check + JSON cache — iter 2-3\n- [x] Pickle-based graph cache with pre-warm — iter 7\n- [x] Tuple nodes (smaller pickle) — iter 9, 15, 16\n- [x] lru_cache on builder internals — iter 21 (MAJOR breakthrough)\n- [x] Add decisions + lessons with lru_cache — iter 22\n- [x] Parse tasks/ directory — iter 23\n- [x] msgpack/json/mmap/pickle protocol micro-optimizations — REGRESSIONs confirmed noise floor\n\n## SATURATED — Primary metric noise floor\nThe graph_build_time_ms metric is at 0.03ms (lru_cache warm load). This is:\n- 12,574× faster than original 377ms baseline\n- 838× confidence above noise floor\n- lru_cache makes warm load O(1) memory lookup regardless of node count\n- Further micro-optimizations: NO.\n- Serialization format experiments (pickle/json/msgpack): all REGRESSION or noise floor\n\n## NOW WORTHWHILE — Data Expansion (richer graph, same speed)\n- [x] Parse all 84 tasks (remove 50-limit) — DONE iter 25\n- [x] Parse goals/ directory for goal nodes — DONE iter 24\n- [x] Expand decisions/lessons beyond 10-limit — DONE iter 25 (decisions→100, lessons→100)\n- [ ] Parse canvas/ directory for canvas state nodes  \n- [ ] Parse state/ directory for runtime state nodes\n- [ ] Parse archive/ directory for archived files\n- [ ] Parse machinelearning/ for cross-repo graph edges\n- [ ] Parse memory/ beyond 30-limit (up to 58 available)\n\n## Architectural (secondary: query_time_ms, structural richness)\n- [ ] duckdb/sqlite3 backend — persistent graph DB with SQL query engine\n  - NOT for primary metric (warm load stays 0.03ms via lru_cache)\n  - Benefits: SQL traversal, reachability queries, complex joins\n  - Risk: adds dependency (sqlite3 stdlib OK, duckdb requires install)\n  - Approach: sqlite3 in-memory graph DB that rebuilds from lru_cache on startup\n- [ ] Bidirectional BFS in query_engine — faster path finding\n- [ ] Pre-compute reachability matrix — O(1) reachability queries\n\n## Visualization (secondary: ascii_render_lines, utility)\n- [ ] Mermaid diagram output — graphviz-free via text\n- [ ] Compact ASCII renderer — pack more nodes per line\n- [ ] pi /tree adapter — integrate with pi's built-in tree rendering\n\n## Interesting Findings\n- Gitnexus lbug file is NOT SQLite (header \"LBUG(\")\n- lru_cache is the key: warm load O(1), cold build ~3.8ms\n- Noise floor ~0.03-0.05ms for warm load (memory lookup)\n- pickle noise floor ~0.3-0.5ms (was the old ceiling before lru_cache)\n- 142 schema_field nodes accidentally removed then restored\n- gitnexus cache TTL 1hr → 24hr extended\n\n## Deferred (low priority / speculative)\n- Multi-repo graph (belam-codex + machinelearning cross-ref)\n- Embeddings-based semantic search for graph queries\n- LLM-based graph summarization\n- Incremental lru_cache invalidation (watch source files)\n\n## Current Best\n- 0.03ms (295 nodes, 209 edges) — lru_cache warm load, 12,574× vs original\n- Original: 377.21ms (55 nodes, 54 edges)\n- Node types: doc_section, code_ref, memory, schema_entity, schema_field,\n  decision, lesson, gitnexus_definition, task (new)\n"}],"isError":false,"timestamp":1777535400990}}
{"type":"message","id":"abd60d96","parentId":"f31c6362","timestamp":"2026-04-30T07:50:00.991Z","message":{"role":"toolResult","toolCallId":"call_function_sw476qslx5yk_2","toolName":"read","content":[{"type":"text","text":"#!/bin/bash\n# Autoresearch benchmark driver for DB-augmented graph code generation\n# Measures: graph build time, node/edge counts, query time, ASCII render size\n\nset -euo pipefail\n\nAGI_DIR=\"$(cd \"$(dirname \"$0\")\" && pwd)\"\nEXPERIMENT_DIR=\"$AGI_DIR/experiments/$(date +%Y%m%d_%H%M%S)\"\nmkdir -p \"$EXPERIMENT_DIR\"\n\n# --- Metric Definitions ---\n# Primary: graph_build_time_ms (lower is better)\n# Secondary: graph_node_count, graph_edge_count, query_time_ms, ascii_render_lines\n\n# If dependencies not installed, use stub metrics\nMETRIC_cmd=\"python3 $AGI_DIR/_benchmark.py 2>/dev/null || echo 'METRIC graph_build_time_ms=0'\"\n\n# Run benchmark and capture output\nOUTPUT=$($METRIC_cmd)\n\n# Echo raw output for visibility\necho \"$OUTPUT\"\n\n# Ensure we always output at least the primary metric\nif ! echo \"$OUTPUT\" | grep -q \"METRIC graph_build_time_ms=\"; then\n    echo \"METRIC graph_build_time_ms=0\"\nfi\n\nexit 0\n"}],"isError":false,"timestamp":1777535400991}}
