{"type":"message","id":"5504bc84","parentId":"28179ca7","timestamp":"2026-04-30T08:06:54.725Z","message":{"role":"assistant","content":[{"type":"thinking","thinking":"OK so:\n- knowledge/ has 14 .md files (not 15 as counted - maybe only some get parsed)\n- handoff/ has 7 .md files (matches the 7 handoff nodes)\n- archive/ has: codex-layer-v1-modules/ (dir), commands/ (dir), embed-primitives.md.archived, embed_primitives.py.archived, tasks/ (dir)\n\nSo the archive/ directory has Python modules and commands! This is code that could be parsed into code_reference nodes, expanding the graph with actual code structure.\n\nThe canvas knowledge nodes (15) are likely coming from the canvas graph_data.json. \n\nNow looking at what to do next: the primary metric is already saturated, so data expansion is the right path. The archive/ directory contains code that could become code_reference nodes, and while knowledge/ and handoff/ are already implemented, they might not be fully exploited. The real opportunity is extracting actual code structure from the archived Python modules to build richer semantic understanding of the codebase.\n\nI'm also considering whether archive/ could be parsed more deeply—extracting function signatures, class definitions, and imports from the archived code to create a more detailed code knowledge graph. Alternatively, I could add a sqlite3-backed SQL query layer for richer path queries, though that wouldn't directly affect the primary metric. Let me first check if the canvas knowledge nodes are coming from graph_data.json or from knowledge/ parsing directly, since that distinction matters for understanding where the 15 nodes are actually coming from.","thinkingSignature":"8ff21daafc1715b90a2e887410b42cddedb8827ac374088d2db6eceee10ef440"},{"type":"toolCall","id":"call_function_lxdr750xehy0_1","name":"bash","arguments":{"command":"python3 -c \"\nfrom graph_builder import build_graph, GraphBuilder\nhermes = '/home/ubuntu/.hermes'\nagi = '/home/ubuntu/.hermes/agi'\nb, _ = build_graph(hermes, agi)\nstats = b.get_stats()\nprint('Node types:', stats['nodes_by_type'])\nprint('Total:', stats['node_count'])\n\""}}],"api":"anthropic-messages","provider":"minimax","model":"MiniMax-M2.7","usage":{"input":17735,"output":411,"cacheRead":10071,"cacheWrite":0,"totalTokens":28217,"cost":{"input":0.0053205,"output":0.0004932,"cacheRead":0.0006042599999999999,"cacheWrite":0,"total":0.0064179599999999995}},"stopReason":"toolUse","timestamp":1777536401035,"responseId":"06424091a238e11713db21058a0d1085"}}
{"type":"message","id":"7b55a46d","parentId":"5504bc84","timestamp":"2026-04-30T08:06:54.839Z","message":{"role":"toolResult","toolCallId":"call_function_lxdr750xehy0_1","toolName":"bash","content":[{"type":"text","text":"Node types: {'doc_section': 22, 'code_reference': 27, 'memory_session': 58, 'schema_entity': 10, 'schema_field': 141, 'decision': 128, 'lesson': 204, 'task': 84, 'goal': 5, 'agent_role': 4, 'agent_boundary': 15, 'agent_capability': 5, 'canvas_lesson': 25, 'canvas_decision': 22, 'canvas_task': 5, 'canvas_project': 5, 'canvas_pipeline': 5, 'canvas_command': 30, 'canvas_skill': 3, 'canvas_knowledge': 10, 'knowledge': 15, 'reference': 1, 'handoff': 7, 'handoff_item': 35, 'gitnexus_definition': 20}\nTotal: 886\n"}],"isError":false,"timestamp":1777536414839}}
{"type":"message","id":"2d294746","parentId":"7b55a46d","timestamp":"2026-04-30T08:07:19.550Z","message":{"role":"assistant","content":[{"type":"thinking","thinking":"So the node types are:\n- `knowledge: 15` — from parsing knowledge/ directory (14 .md files, but 15 nodes means some files create multiple nodes)\n- `canvas_knowledge: 10` — from canvas graph_data.json\n- `handoff: 7` — from handoff/ directory (7 .md files)\n\nBoth knowledge/ and handoff/ are already fully parsed. The ideas list is just out of date.\n\nWhat CAN still be expanded:\n1. **archive/** — codex-layer-v1-modules/ (Python code), commands/ (scripts), tasks/ (archived tasks)\n2. **machinelearning/** directory (mentioned in Deferred)\n\n\n3. **Re-parse knowledge files** with richer extraction — right now each file just creates one node, but I could extract individual claim sections, code snippets, and external references as separate nodes\n\nLooking at the actual knowledge files, they're substantial (200-300KB for some), so I'm currently only grabbing a small claim section. The richer parsing could pull out multiple knowledge nodes per file.\n\nLet me verify the math: knowledge has 15 nodes and reference has 1, totaling 16. The loop searches for related items in each file and calls `_find_or_add_reference` for each one, so the 15 nodes are likely coming from 14 files each creating a knowledge node plus one reference node.\n\nSo parsing 14 .md files gives 15 total nodes — some files might be skipped or multiple reference nodes get merged. The real issue is that each file only creates one node, but they're substantial files (200-300KB). I should extract claim sections, key insights, and code blocks as separate nodes instead.\n\nFor the archive/, the code directories aren't .md files so they'd be skipped by the current parser. The most impactful approach would be enhancing knowledge/ parsing to create richer nodes with claim sections, code references, and insights from each file, since they're already being processed.\n\nNow I'm checking the archive/ directories — codex-layer-v1-modules/ is likely Python code with classes and functions, while tasks/ contains archived task markdown files. The code structure in codex-layer-v1-modules/ would be valuable for understanding code relationships, but the immediate win is expanding the knowledge nodes since they're already wired up and we have those large files sitting there untapped.","thinkingSignature":"475187cfb615c8a987957dfa610e1f03edc3265aacdf5d668899b8cfd80886c8"},{"type":"text","text":"Knowledge (14 files, some 200KB+) creates only 15 nodes. Expensive parsing for tiny payoff. Better target: **archive/codex-layer-v1-modules/** — Python code that could expand code_reference nodes with actual function/class structure.\n\nLet me check it:\n"},{"type":"toolCall","id":"call_function_yyvik9ie09bc_1","name":"bash","arguments":{"command":"ls ~/.hermes/belam-codex/archive/codex-layer-v1-modules/ && echo \"---\" && ls ~/.hermes/belam-codex/archive/commands/ && echo \"---\" && head -50 ~/.hermes/belam-codex/archive/codex-layer-v1-modules/*.py 2>/dev/null | head -30"}}],"api":"anthropic-messages","provider":"minimax","model":"MiniMax-M2.7","usage":{"input":18345,"output":628,"cacheRead":10071,"cacheWrite":0,"totalTokens":29044,"cost":{"input":0.0055035,"output":0.0007536,"cacheRead":0.0006042599999999999,"cacheWrite":0,"total":0.0068613599999999995}},"stopReason":"toolUse","timestamp":1777536414840,"responseId":"0642409f4d2d553f31cc2cfee8cf24d9"}}
{"type":"message","id":"8cdf4305","parentId":"2d294746","timestamp":"2026-04-30T08:07:19.562Z","message":{"role":"toolResult","toolCallId":"call_function_yyvik9ie09bc_1","toolName":"bash","content":[{"type":"text","text":"codex_dispatch.py\ncodex_interceptor.py\ncodex_output_codec.py\n---\nanalyze-local.md\nanalyze.md\naudit.md\nautorun.md\nbuild.md\ncleanup.md\nconsolidate.md\nconversations.md\ncreate.md\ndecisions.md\ndiffs.md\nedges.md\nedit.md\nextract.md\nhandoffs.md\nhelp.md\nkickoff.md\nknowledge-sync.md\nlessons.md\nlink.md\nlog.md\nnotebooks.md\norchestrate.md\npipeline.md\npipelines.md\nprojects.md\nqueue-revision.md\nreport.md\nrevise.md\nrun.md\nsession.md\nspawn.md\nstatus.md\ntask.md\ntasks.md\ntranscribe.md\nwatch.md\n---\n==> /home/ubuntu/.hermes/belam-codex/archive/codex-layer-v1-modules/codex_dispatch.py <==\n\"\"\"Codex Dispatch — unified dispatch grammar for workspace interaction.\n\nPhase B of the Codex Layer. Routes all input through:\n  - Bare coords    → codex engine      (t5, e1t5, e0)\n  - Prefix .       → render verbs      (.d, .a, .v1)\n  - Prefix !       → shell passthrough (!git status)\n  - Pipe |>        → output chaining   (e0 |> _.p1)\n  - Prefix _       → result register   (_, _1, _.status)\n  - No prefix      → interceptor check (Phase C) then shell fallback\n\nFLAG-2 FIX: Uses |> for pipes (not ' > ') to avoid shell redirect collision.\n             ! prefix checked BEFORE pipe splitting to prevent misrouting.\n\nPipeline: build-codex-layer-v1\n\"\"\"\n\nfrom __future__ import annotations\n\nimport re\nimport subprocess\nfrom pathlib import Path\nfrom typing import Optional\n\nfrom codex_output_codec import CodexResult, ResultRegister, output_to_codex\n\n# Coordinate grammar regex (matches codex coordinate patterns)\nCOORD_RE = re.compile(r'^(md|mw|lm|[a-z])\\d*$', re.IGNORECASE)\n\n# Extended: match e{n}{coord} compounds (e1t6, e0p3) + bare coords (t5, lm3, d1-d5)\n"}],"isError":false,"timestamp":1777536439562}}
{"type":"message","id":"31ba32c1","parentId":"8cdf4305","timestamp":"2026-04-30T08:07:31.767Z","message":{"role":"assistant","content":[{"type":"thinking","thinking":"The archive/codex-layer-v1-modules/ has Python files with actual code structure. And archive/commands/ has 38 .md files (command documentation).\n\nLet me think about what would make the most impact:\n\n1. **Parse archive/codex-layer-v1-modules/*.py** — extract function signatures, classes, imports as code_reference nodes. This expands the code graph.\n\n2. **Parse archive/commands/*.md** — these are command documentation files (38 files!). Could create command nodes similar to the canvas_command nodes.\n\n3. **Richer knowledge parsing** — extract more nodes from the large knowledge files.\n\n\nI'm leaning toward parsing the archive/commands/ directory since it has 38 .md files that could create command nodes and sequential edges between them, matching the pattern of other command implementations. Though I should probably verify what's already in the canvas_command nodes first, since there might be overlap.\n\nLooking at the primary metric, it hasn't budged from 0.03ms since iteration 32, which means the lru_cache is doing its job. Any changes here would only affect node count and edge count, not the actual performance. Still, this is the data expansion phase, so adding those 38 command nodes and their sequential relationships would make the graph more useful overall.\n\nLet me examine the commands directory to see how these files are structured.","thinkingSignature":"15d78af72f5f975c32258f3f6afed14f2b4ac49d5f7fed0459e3983f3c0eeba7"},{"type":"toolCall","id":"call_function_9u8wk30wlzri_1","name":"bash","arguments":{"command":"head -30 ~/.hermes/belam-codex/archive/commands/analyze.md && echo \"===\" && head -20 ~/.hermes/belam-codex/archive/commands/link.md && echo \"===\" && wc -l ~/.hermes/belam-codex/archive/commands/*.md | tail -5"}}],"api":"anthropic-messages","provider":"minimax","model":"MiniMax-M2.7","usage":{"input":19453,"output":363,"cacheRead":10071,"cacheWrite":0,"totalTokens":29887,"cost":{"input":0.0058359,"output":0.00043559999999999996,"cacheRead":0.0006042599999999999,"cacheWrite":0,"total":0.006875759999999999}},"stopReason":"toolUse","timestamp":1777536439563,"responseId":"064240b864f59a0fbd336560d9066eb3"}}
{"type":"message","id":"2b5813de","parentId":"31ba32c1","timestamp":"2026-04-30T08:07:31.779Z","message":{"role":"toolResult","toolCallId":"call_function_9u8wk30wlzri_1","toolName":"bash","content":[{"type":"text","text":"---\nprimitive: command\ncommand: \"R analyze <ver>\"\naliases: [\"R a <ver>\"]\ndescription: \"Run experiment analysis (auto-finds pipeline)\"\ncategory: analysis\ntags: [analysis, experiment, phase2]\nlm_include: true\n---\n\n# R analyze\n\nRuns experiment analysis for a notebook version, automatically finding the associated pipeline. Use after Phase 1 completes to evaluate results before proceeding to Phase 2.\n\n## Usage\n```bash\nR analyze <ver>\n```\n\n## Related\n- `lessons/analysis-phase2-gate-mandatory.md`\n- `commands/pipeline.md`\n===\n---\ntitle: \"R link\"\ncommand: \"R link <expr>...\"\naliases: [\"R ln\"]\ncategory: primitives\ntags: [link, relationships, primitives, graph]\nupstream: [decisions/indexed-command-interface, decisions/primitive-relationship-graph]\n---\n\n# R link\n\nWire upstream/downstream relationships between primitives using the indexed coordinate system.\n\n## Syntax\n\n```\nR link <expr> [<expr> ...]\n```\n\nEach `<expr>` is a relationship expression:\n===\n   22 /home/ubuntu/.hermes/belam-codex/archive/commands/task.md\n   22 /home/ubuntu/.hermes/belam-codex/archive/commands/tasks.md\n   22 /home/ubuntu/.hermes/belam-codex/archive/commands/transcribe.md\n   53 /home/ubuntu/.hermes/belam-codex/archive/commands/watch.md\n 1113 total\n"}],"isError":false,"timestamp":1777536451779}}
{"type":"message","id":"87ab110f","parentId":"2b5813de","timestamp":"2026-04-30T08:07:43.555Z","message":{"role":"assistant","content":[{"type":"thinking","thinking":"The archive/commands/ files are command documentation with frontmatter (primitive, command, aliases, category, tags, etc.) — very similar to schema entities. Each command file could become an `archive_command` node with its frontmatter metadata.\n\n38 files × ~30 lines each = rich command documentation that could enhance the graph.\n\nBut more importantly, looking at the `upstream` field in the link.md frontmatter — these reference other primitives by name (decisions/indexed-command-interface, decisions/primitive-relationship-graph). These could create cross-edge links between command nodes and decision nodes!\n\nLet me also check if there's overlap with canvas_command (30 nodes). The archive/commands/ might have completely different commands than the canvas commands.\n\n\nNow I'm going to implement the archive_commands parser. It needs to extract the frontmatter metadata from each .md file, create archive_command nodes with that data, and use the upstream field to establish edges back to decision nodes. This should add roughly 38 nodes plus edges while keeping the build time flat since it's cached. I could also try a richer knowledge file extraction, but the commands approach seems more straightforward and contained.","thinkingSignature":"1ceb91c806f48f93bb42aa299815663b149268817aa1a3b05778f6b0d1b0d54e"},{"type":"text","text":"**Iteration plan**: Parse `archive/commands/` — 38 command docs with frontmatter (category, tags, upstream references to decision nodes). Creates ~38 new nodes + cross-type edges (command→decisions via `upstream` field).\n"},{"type":"toolCall","id":"call_function_k3djo2u72jol_1","name":"read","arguments":{"path":"/home/ubuntu/.hermes/agi/graph_builder.py","offset":1,"limit":10}}],"api":"anthropic-messages","provider":"minimax","model":"MiniMax-M2.7","usage":{"input":20145,"output":339,"cacheRead":10071,"cacheWrite":0,"totalTokens":30555,"cost":{"input":0.006043499999999999,"output":0.00040679999999999997,"cacheRead":0.0006042599999999999,"cacheWrite":0,"total":0.007054559999999999}},"stopReason":"toolUse","timestamp":1777536451781,"responseId":"064240c45d1781db2c6cc8c53eeee40a"}}
{"type":"message","id":"daf5330f","parentId":"87ab110f","timestamp":"2026-04-30T08:07:43.557Z","message":{"role":"toolResult","toolCallId":"call_function_k3djo2u72jol_1","toolName":"read","content":[{"type":"text","text":"#!/usr/bin/env python3\n\"\"\"\ngraph_builder.py - Modular graph construction for unified graph memory\nDB-augmented directed code generation via unified graph memory\n\"\"\"\n\nimport os\nimport re\nimport json\nimport time\n\n[1133 more lines in file. Use offset=11 to continue.]"}],"isError":false,"timestamp":1777536463557}}
{"type":"message","id":"cef13634","parentId":"daf5330f","timestamp":"2026-04-30T08:07:48.532Z","message":{"role":"assistant","content":[{"type":"thinking","thinking":"I need to find the best place to add the new parser method. Let me add it after `parse_handoff()`. Let me look at the end of the file to find `_cached_build_builder()` and `build_graph()` where I need to wire it up.","thinkingSignature":"ffd1a055fdce8b0d8cf1fd73f43ee1fa64a1b1f2257a9432964eca8887f4336a"},{"type":"text","text":"Now I'll add `parse_archive_commands()` to graph_builder.py. Let me find the right insertion points:\n"},{"type":"toolCall","id":"call_function_c6talgbzbrb1_1","name":"read","arguments":{"path":"/home/ubuntu/.hermes/agi/graph_builder.py","offset":590,"limit":30}}],"api":"anthropic-messages","provider":"minimax","model":"MiniMax-M2.7","usage":{"input":20560,"output":132,"cacheRead":10071,"cacheWrite":0,"totalTokens":30763,"cost":{"input":0.006168,"output":0.0001584,"cacheRead":0.0006042599999999999,"cacheWrite":0,"total":0.00693066}},"stopReason":"toolUse","timestamp":1777536463559,"responseId":"064240cf5a662324dcf87ca99ff2436c"}}
{"type":"message","id":"37620c19","parentId":"cef13634","timestamp":"2026-04-30T08:07:48.534Z","message":{"role":"toolResult","toolCallId":"call_function_c6talgbzbrb1_1","toolName":"read","content":[{"type":"text","text":"                    m = _RE_YAML_PAIR.match(line)\n                    if m:\n                        meta[m.group(1)] = m.group(2)\n\n                agent_id = meta.get('agent_id', filename[:-3])\n                src_id = agent_ids.get(agent_id)\n                if not src_id:\n                    continue\n\n                # Parse communicates_with: [architect, critic, builder]\n                comm_str = meta.get('communicates_with', '').strip('[] ')\n                if not comm_str:\n                    continue\n\n                peers = [c.strip().strip(\"'\").strip('\"') for c in comm_str.split(',') if c.strip()]\n                for peer in peers:\n                    tgt_id = agent_ids.get(peer)\n                    if tgt_id:\n                        self.add_edge(src_id, tgt_id, \"communicates_with\")\n\n            except Exception:\n                pass\n\n        return count\n\n    def parse_canvas_graph(self, canvas_dir: str) -> Tuple[int, int]:\n        \"\"\"Parse canvas graph_data.json with pre-computed cross-primitive edges.\n        \n        Returns (nodes_added, edges_added). Adds 105 nodes (lesson, decision, task,\n        project, pipeline, command, skill, knowledge) and 8 causal edges from\n\n[524 more lines in file. Use offset=620 to continue.]"}],"isError":false,"timestamp":1777536468534}}
{"type":"message","id":"c6236944","parentId":"37620c19","timestamp":"2026-04-30T08:07:52.713Z","message":{"role":"assistant","content":[{"type":"thinking","thinking":"Let me look for where parse_handoff ends and find the build functions to know where to wire up the new parser.","thinkingSignature":"4c7991430cbbf9ae58011c8dc20ae59576cea8913eeed4eb9fcceec015c25f8e"},{"type":"toolCall","id":"call_function_2mk0frlwpnfj_1","name":"bash","arguments":{"command":"grep -n \"def parse_handoff\\|def parse_knowledge\\|def build_adjacency\\|def _cached_build_builder\\|def build_graph\\|parse_handoff\\|parse_knowledge\\|parse_canvas_graph\\|parse_archive\" /home/ubuntu/.hermes/agi/graph_builder.py"}}],"api":"anthropic-messages","provider":"minimax","model":"MiniMax-M2.7","usage":{"input":20972,"output":106,"cacheRead":10071,"cacheWrite":0,"totalTokens":31149,"cost":{"input":0.0062916,"output":0.0001272,"cacheRead":0.0006042599999999999,"cacheWrite":0,"total":0.007023059999999999}},"stopReason":"toolUse","timestamp":1777536468535,"responseId":"064240d4de0ff3436c711654309cc2fa"}}
{"type":"message","id":"11ac0fbf","parentId":"c6236944","timestamp":"2026-04-30T08:07:52.722Z","message":{"role":"toolResult","toolCallId":"call_function_2mk0frlwpnfj_1","toolName":"bash","content":[{"type":"text","text":"615:    def parse_canvas_graph(self, canvas_dir: str) -> Tuple[int, int]:\n679:    def parse_knowledge(self, knowledge_dir: str) -> int:\n759:    def parse_handoff(self, handoff_dir: str) -> int:\n824:    def build_adjacency(self):\n938:def _cached_build_builder(hermes_dir: str, agi_dir: str, gitnexus_hash: int, _cache_ver: int = 1) -> GraphBuilder:\n990:        builder.parse_canvas_graph(canvas_dir)\n995:        builder.parse_knowledge(knowledge_dir)\n1000:        builder.parse_handoff(handoff_dir)\n1024:def build_graph(hermes_dir: str, agi_dir: str, use_gitnexus: bool = True,\n1098:        builder.parse_canvas_graph(canvas_dir)\n1103:        builder.parse_knowledge(knowledge_dir)\n1108:        builder.parse_handoff(handoff_dir)\n"}],"isError":false,"timestamp":1777536472722}}
{"type":"message","id":"6f1f3685","parentId":"11ac0fbf","timestamp":"2026-04-30T08:07:59.340Z","message":{"role":"assistant","content":[{"type":"thinking","thinking":"Now I can see:\n1. `parse_handoff` is at line 759, `build_adjacency` is at line 824\n2. `_cached_build_builder` calls `parse_canvas_graph` (990), `parse_knowledge` (995), `parse_handoff` (1000)\n3. `build_graph` calls them too (1098, 1103, 1108)\n\nI need to:\n1. Add `parse_archive_commands()` method after `parse_handoff()` (before line 824, `build_adjacency`)\n2. Wire it in `_cached_build_builder()` after `parse_handoff` (line ~1000)\n\n\n3. Wire it in `build_graph()` after `parse_handoff` (line ~1108)\n\nLet me find where `parse_handoff` ends so I can insert the new method right after it.","thinkingSignature":"138a47614d9e9e90ce3985f04473df87837f0ba7eeace39cd5417a3a9abc7351"},{"type":"toolCall","id":"call_function_jdo8o5v24tyf_1","name":"read","arguments":{"path":"/home/ubuntu/.hermes/agi/graph_builder.py","offset":759,"limit":70}}],"api":"anthropic-messages","provider":"minimax","model":"MiniMax-M2.7","usage":{"input":21295,"output":235,"cacheRead":10071,"cacheWrite":0,"totalTokens":31601,"cost":{"input":0.0063885,"output":0.00028199999999999997,"cacheRead":0.0006042599999999999,"cacheWrite":0,"total":0.00727476}},"stopReason":"toolUse","timestamp":1777536472723,"responseId":"064240d929270b89ab44f24bcf51c8ce"}}
