{"type":"message","id":"dccf25fc","parentId":"b8bef497","timestamp":"2026-04-30T07:15:07.489Z","message":{"role":"toolResult","toolCallId":"call_function_seuxmcyvzj4n_3","toolName":"read","content":[{"type":"text","text":"{\"type\":\"config\",\"name\":\"DB-augmented directed code generation via unified graph memory\",\"metricName\":\"graph_build_time_ms\",\"metricUnit\":\"ms\",\"bestDirection\":\"lower\"}\n{\"run\":1,\"commit\":\"d4c3b2a\",\"metric\":377.21,\"metrics\":{\"graph_node_count\":55,\"graph_edge_count\":54,\"query_time_ms\":0.14,\"ascii_render_lines\":17},\"status\":\"keep\",\"description\":\"Baseline measurement - graph from AGENTS.md + gitnexus symbols\",\"timestamp\":1777529035625,\"segment\":0,\"confidence\":null,\"iterationTokens\":786,\"asi\":{\"hypothesis\":\"Baseline - no optimizations yet\",\"build_components\":\"regex_split_AGENTS, gitnexus_query_fallback\",\"gitnexus_available\":\"false\"}}\n{\"run\":2,\"commit\":\"a7b2c3d\",\"metric\":0.3,\"metrics\":{\"graph_node_count\":55,\"graph_edge_count\":54,\"query_time_ms\":0.02,\"ascii_render_lines\":17},\"status\":\"keep\",\"description\":\"Skip gitnexus npx call if index not populated - was wasting 367ms for empty result\",\"timestamp\":1777529151628,\"segment\":0,\"confidence\":null,\"iterationTokens\":2427,\"asi\":{\"hypothesis\":\"Skip gitnexus if no index - npx call was 97% of time\",\"root_cause\":\"gitnexus npx call took 367ms but returned empty string\",\"fix\":\"Check .gitnexus dir has content before calling npx\",\"improvement\":\"1257x faster (377ms -> 0.3ms)\"}}\n{\"run\":3,\"commit\":\"b8c9d0e\",\"metric\":0.42,\"metrics\":{\"graph_node_count\":75,\"graph_edge_count\":54,\"query_time_ms\":0.03,\"ascii_render_lines\":17},\"status\":\"keep\",\"description\":\"Persistent gitnexus cache file - 1st run 1900ms cached, subsequent runs 0.42ms with 75 nodes\",\"timestamp\":1777529347409,\"segment\":0,\"confidence\":3140.9166666666665,\"iterationTokens\":312,\"asi\":{\"hypothesis\":\"Persistent cache enables fast builds with rich gitnexus data\",\"improvements\":[\"pre-compiled regex\",\"gitnexus cache check\",\"persistent JSON cache file\"],\"tradeoff\":\"First run always slow (1.9s), subsequent runs fast (0.42ms)\",\"graph_nodes_delta\":\"+20 nodes from gitnexus symbols\",\"improvement_vs_baseline\":\"896x faster (377ms -> 0.42ms)\"}}\n{\"run\":4,\"commit\":\"c1d2e3f\",\"metric\":0.37,\"metrics\":{\"graph_node_count\":75,\"graph_edge_count\":54,\"query_time_ms\":0.05,\"ascii_render_lines\":17},\"status\":\"keep\",\"description\":\"Cache loading moved before timing - final optimized version\",\"timestamp\":1777529479944,\"segment\":0,\"confidence\":6281.83333333333,\"iterationTokens\":313,\"asi\":{\"hypothesis\":\"All optimizations combined: pre-compiled regex, gitnexus availability check, persistent cache, pre-built adj\",\"final_improvement\":\"1019x faster (377ms -> 0.37ms)\",\"optimizations_applied\":[\"pre-compiled regex patterns\",\"gitnexus index check before npx call\",\"persistent JSON cache file\",\"adjacency dict built once and reused\",\"cache loading outside timing window\",\"pre-built node lookup dict for O(1) access\"],\"nodes_delta\":\"+20 nodes vs baseline (75 vs 55)\",\"notes\":\"First run always slower due to gitnexus npx call; cached runs are fast\"}}\n{\"run\":1,\"commit\":\"d5e6f7a\",\"metric\":2.13,\"metrics\":{\"graph_node_count\":225,\"graph_edge_count\":189,\"query_time_ms\":0.1,\"ascii_render_lines\":17},\"status\":\"keep\",\"description\":\"Modular graph system - now parses memory files + schemas, produces 225 nodes in 2.13ms\",\"timestamp\":1777529903185,\"segment\":0,\"confidence\":null,\"iterationTokens\":5091,\"asi\":{\"hypothesis\":\"Use modular graph_builder for richer graph from multiple sources\",\"improvements\":[\"Created graph_builder.py with memory/schema parsing\",\"Created query_engine.py with BFS + Dijkstra\",\"Created asciirender.py for ASCII output\",\"Created pi_tree_adapter.py for pi integration\",\"Created schema.sql for DB schema\"],\"tradeoff\":\"Slightly slower (0.4ms -> 2.1ms) but 3x more nodes\",\"graph_composition\":\"22 sections + 27 refs + 5 memories + 10 schemas + 141 fields + 20 gitnexus\",\"baseline_comparison\":\"Still 177x faster than original 377ms\"}}\n{\"run\":2,\"commit\":\"e8f9a0b\",\"metric\":2.11,\"metrics\":{\"graph_node_count\":225,\"graph_edge_count\":189,\"query_time_ms\":0.1,\"ascii_render_lines\":17},\"status\":\"keep\",\"description\":\"Final stable measurement - modular system averages 2.1ms with 225 nodes\",\"timestamp\":1777529975076,\"segment\":0,\"confidence\":null,\"iterationTokens\":369,\"asi\":{\"hypothesis\":\"Final stable state with modular system\",\"summary\":\"Original 377ms -> 2.1ms (175x faster) with 3x more data\",\"stability\":\"All runs 2.07-2.21ms range\",\"architecture\":\"Modular system: graph_builder + query_engine + asciirender + pi_tree_adapter + schema.sql\"}}\n{\"run\":7,\"commit\":\"b378b4d\",\"metric\":2.14,\"metrics\":{\"graph_node_count\":225,\"graph_edge_count\":189,\"query_time_ms\":0.1,\"ascii_render_lines\":17},\"status\":\"discard\",\"description\":\"Pass pre-loaded gitnexus cache to build_graph — no measurable improvement\",\"timestamp\":1777530355723,\"segment\":0,\"confidence\":223.02366863905326,\"iterationTokens\":369,\"asi\":{\"hypothesis\":\"Eliminate redundant file I/O by passing pre-loaded cache to build_graph\",\"rollback_reason\":\"No improvement - 2.14ms vs 2.11ms baseline, within noise\",\"next_action_hint\":\"init_cache() only sets path string, no file I/O. Real overhead is in parse_memory_files/read() and parse_schema_files/read(). Try caching parsed schema/memory results or use mmap for file reads.\",\"root_cause\":\"Benchmark pre-loads cache before calling build_graph; build_graph's init_cache() only assigns a string — no redundant I/O to eliminate\"}}\n{\"run\":1,\"commit\":\"23ca033\",\"metric\":0.49,\"metrics\":{\"graph_node_count\":225,\"graph_edge_count\":189,\"query_time_ms\":0.1,\"ascii_render_lines\":17},\"status\":\"keep\",\"description\":\"Pickle-based graph cache with pre-warm — 4.3x faster (2.11ms → 0.49ms), same 225 nodes\",\"timestamp\":1777530519353,\"segment\":0,\"confidence\":null,\"iterationTokens\":2645,\"asi\":{\"hypothesis\":\"Pickle-cache the entire parsed graph, pre-warm before timing window\",\"improvement\":\"4.3x faster (2.11ms -> 0.49ms) — pickle load is ~500 microseconds vs 2.1ms for full parse\",\"optimization_details\":[\"graph_builder collects source file mtimes\",\"_try_load_graph_cache() checks mtimes + gitnexus cache match\",\"_save_graph_cache() pickles nodes/edges/adj to .graph_cache.pkl\",\"_benchmark.py pre-warms cache before timing window\"],\"key_insight\":\"Pre-warm (build once, save pickle) before timing ensures timed run always hits cache\",\"nodes_unchanged\":\"225 nodes preserved — no data loss vs modular system\",\"vs_original_baseline\":\"Still 770x faster than original 377ms (377/0.49=769)\"}}\n{\"run\":9,\"commit\":\"d531e25\",\"metric\":0.5,\"metrics\":{\"graph_node_count\":225,\"graph_edge_count\":189,\"query_time_ms\":0.11,\"ascii_render_lines\":17},\"status\":\"discard\",\"description\":\"Move pickle import to module level — ~same performance (0.50ms vs 0.49ms baseline)\",\"timestamp\":1777530608465,\"segment\":0,\"confidence\":1884.5499999999997,\"iterationTokens\":2645,\"asi\":{\"hypothesis\":\"Module-level import saves ~0.01ms per cache hit\",\"result\":\"No measurable improvement — 0.50ms vs 0.49ms baseline, within noise\",\"next_action_hint\":\"Try caching source_mtimes across runs, or incremental graph updates instead of full rebuild\"}}\n{\"run\":1,\"commit\":\"c504fdf\",\"metric\":0.5,\"metrics\":{\"graph_node_count\":225,\"graph_edge_count\":189,\"query_time_ms\":0.1,\"ascii_render_lines\":17},\"status\":\"discard\",\"description\":\"Add __slots__ to GraphBuilder — no measurable improvement (0.50ms vs 0.49ms baseline)\",\"timestamp\":1777530672237,\"segment\":0,\"confidence\":null,\"iterationTokens\":null,\"asi\":{\"hypothesis\":\"__slots__ reduces attribute access overhead\",\"result\":\"No improvement — 0.50ms vs 0.49ms. Most time in pickle.load() not attribute access.\",\"next_action_hint\":\"At 0.5ms we're at noise floor. Consider expanding data scope instead of micro-optimizing.\"}}\n{\"run\":2,\"commit\":\"865e3a9\",\"metric\":1.19,\"metrics\":{\"graph_node_count\":436,\"graph_edge_count\":360,\"query_time_ms\":0.14,\"ascii_render_lines\":17},\"status\":\"discard\",\"description\":\"Add decision+lesson parsers — expanded graph to 436 nodes (+94%) but pickle.load scales with size → 1.19ms (worse)\",\"timestamp\":1777530832088,\"segment\":0,\"confidence\":null,\"iterationTokens\":9306,\"asi\":{\"hypothesis\":\"Adding more data sources increases graph richness without hurting performance\",\"result\":\"Pickle load scales with object size — 436 nodes takes 1.19ms vs 0.50ms for 225 nodes (2.4x slower)\",\"roll_back_reason\":\"Regressed primary metric. Expanded data scope interesting but not an optimization.\",\"next_action_hint\":\"Try msgpack instead of pickle for faster serialization. Or keep graph at 225 nodes and optimize other paths.\"}}\n{\"run\":12,\"commit\":\"6ea8e4a\",\"metric\":1.02,\"metrics\":{\"graph_node_count\":436,\"graph_edge_count\":360,\"query_time_ms\":0.12,\"ascii_render_lines\":17},\"status\":\"discard\",\"description\":\"Nodes as tuples — microbenchmark 1.47x faster but graph grew to 436 nodes vs 225-node baseline, so absolute time worse\",\"timestamp\":1777531327709,\"segment\":0,\"confidence\":919.2926829268292,\"iterationTokens\":1880,\"asi\":{\"hypothesis\":\"Tuples instead of dicts for nodes — smaller pickle, faster load\",\"result\":\"DISREGARD - graph grew to 436 nodes (decisions+lessons cached), 1.02ms vs 0.50ms baseline\",\"microbenchmark\":\"Tuples 0.19ms vs dicts 0.28ms for same 436-node pickle - tuples 1.47x faster\",\"pickle_sizes\":\"Dict 37193 bytes, Tuple 33675 bytes for same 436-node data (9.5% smaller)\",\"rollback_reason\":\"Absolute time worse due to graph size increase, not format. Tuples faster per-pickle but more nodes cached now\",\"next_action_hint\":\"To isolate tuple effect: fix graph at 225 nodes, or test msgpack vs pickle for same workload. Also: microbenchmark says tuples win at same size\"}}\n{\"run\":13,\"commit\":\"f653a2e\",\"metric\":1.16,\"metrics\":{\"graph_node_count\":436,\"graph_edge_count\":360,\"query_time_ms\":0.12,\"ascii_render_lines\":17},\"status\":\"discard\",\"description\":\"Skip adj from pickle cache, rebuild from edges on load — REGRESSION: 1.16ms vs 0.50ms baseline. Adj rebuild overhead exceeds pickle size savings.\",\"timestamp\":1777531540070,\"segment\":0,\"confidence\":628.1833333333332,\"iterationTokens\":1880,\"asi\":{\"rollback_reason\":\"adj rebuild from edges on every cache hit adds more overhead than pickle size savings\",\"hypothesis\":\"skipping adj from pickle cache would reduce load time\",\"result\":\"REGRESSION 2.3x worse\",\"next_action_hint\":\"try json instead of pickle for cache serialization — json.load may be faster than pickle.load for this data size\"}}\n{\"run\":1,\"commit\":\"b166df9\",\"metric\":1.67,\"metrics\":{\"graph_node_count\":436,\"graph_edge_count\":360,\"query_time_ms\":0.13,\"ascii_render_lines\":17},\"status\":\"discard\",\"description\":\"json instead of pickle for graph cache — REGRESSION: 1.67ms vs 0.50ms pickle baseline. List↔tuple conversion + JSON parsing overhead exceeds any I/O savings.\",\"timestamp\":1777531678573,\"segment\":0,\"confidence\":null,\"iterationTokens\":null,\"asi\":{\"rollback_reason\":\"json is slower than pickle for this data — tuple↔list conversion + json parsing dominates\",\"hypothesis\":\"json.load would be faster than pickle.load for this data size\",\"result\":\"REGRESSION 3.3x worse\",\"next_action_hint\":\"stop optimizing serialization — noise floor reached. Consider expanding data SOURCES instead (more nodes = richer graph). Or move to query optimizations (bidirectional BFS).\"}}\n{\"run\":15,\"commit\":\"932918a\",\"metric\":0.32,\"metrics\":{\"graph_node_count\":84,\"graph_edge_count\":48,\"query_time_ms\":0.09,\"ascii_render_lines\":7},\"status\":\"keep\",\"description\":\"tuple nodes: dict→(id,type,label,content,source) — 0.50ms→0.32ms. Pickle smaller. Node count dropped to 84 (gitnexus cache expired, 1hr TTL — needs refresh). asciirender.py and query_engine.py already tuple-ready.\",\"timestamp\":1777533038998,\"segment\":0,\"confidence\":579.8615384615385,\"iterationTokens\":1680,\"asi\":{\"hypothesis\":\"tuple nodes shrink pickle → faster load\",\"result\":\"0.50ms→0.32ms, 36% faster\",\"node_count\":\"84 (was 225, gitnexus cache expired)\",\"pickle_size_before\":\"~8KB dict nodes\",\"pickle_size_after\":\"~3KB tuple nodes\",\"cache_ttl_bug\":\"gitnexus cache expires at 1hr causing node count swings — consider longer TTL or source-mtime-based invalidation\",\"next_action_hint\":\"keep cache at 24hr TTL + refresh gitnexus cache to restore 225 nodes, then re-benchmark tuple nodes at full node count\"}}\n{\"run\":1,\"commit\":\"191be70\",\"metric\":0.45,\"metrics\":{\"graph_node_count\":225,\"graph_edge_count\":189,\"query_time_ms\":0.1,\"ascii_render_lines\":7},\"status\":\"keep\",\"description\":\"restore schema_field nodes (+142) to get 225 nodes; tuple vs dict fair: 0.50ms→0.45ms (10% faster). Noise floor confirmed at ~0.3-0.5ms. Further pickle micro-optimizations unlikely to help.\",\"timestamp\":1777533211869,\"segment\":0,\"confidence\":null,\"iterationTokens\":390,\"asi\":{\"hypothesis\":\"tuple nodes at 225 nodes (fair comparison) vs dict baseline\",\"tuple_0.45ms\":\"225 nodes, current\",\"dict_0.50ms\":\"225 nodes, historical\",\"improvement\":\"10% (50µs)\",\"noise_floor\":\"~0.3-0.5ms — pickle load dominates\",\"node_composition\":\"doc_section:22, code_ref:27, memory:5, schema_entity:10, schema_field:142, gitnexus_def:20, edges:189\",\"cache_ttl\":\"extended gitnexus to 24hr\",\"next_action_hint\":\"noise floor reached — shift focus to secondary metrics (node richness, query ops) or architectural changes (duckdb, incremental updates)\"}}\n"}],"isError":false,"timestamp":1777533307489}}
{"type":"message","id":"16165b63","parentId":"dccf25fc","timestamp":"2026-04-30T07:15:19.088Z","message":{"role":"assistant","content":[{"type":"thinking","thinking":"Now I understand the current state:\n- Best metric: 0.45ms (225 nodes, 189 edges) with tuple nodes\n- Noise floor: ~0.3-0.5ms confirmed\n- Tried: pickle/json/slots/tuples - all hit noise floor\n- Ideas: duckdb backend, incremental updates, data source expansion\n\nLet me check what's in the ideas file and look at the current implementation to find one targeted change.\n\nLooking at the ideas:\n- duckdb backend - architectural change, could help avoid pickle entirely\n- Incremental pickle updates via file watcher\n- Data source expansion (tasks/, state/, decisions/, lessons/)\n\nFor one small targeted change this iteration, let me look at what could give a meaningful improvement without hitting the noise floor. The noise floor is pickle.load at ~0.3-0.5ms. To beat this, I need to either:\n1. Reduce pickle load time (hard at noise floor)\n2. Avoid pickle entirely (duckdb)\n3. Do incremental updates (file watcher delta patching)\n\nLet me look at the current graph_builder.py to see if there's a simple optimization I missed.","thinkingSignature":"5931738672595e284bf679b8772e8322a4bebbea6e88d74e0c73334e7d849665"},{"type":"toolCall","id":"call_function_taliqsjf4zxf_1","name":"read","arguments":{"path":"/home/ubuntu/.hermes/agi/graph_builder.py"}},{"type":"toolCall","id":"call_function_taliqsjf4zxf_2","name":"read","arguments":{"path":"/home/ubuntu/.hermes/agi/_benchmark.py"}}],"api":"anthropic-messages","provider":"minimax","model":"MiniMax-M2.7","usage":{"input":5669,"output":302,"cacheRead":10071,"cacheWrite":0,"totalTokens":16042,"cost":{"input":0.0017006999999999999,"output":0.00036239999999999997,"cacheRead":0.0006042599999999999,"cacheWrite":0,"total":0.0026673599999999997}},"stopReason":"toolUse","timestamp":1777533307490,"responseId":"0642347bd6526cb1b76dde5022f092f6"}}
