{"type":"message","id":"82e8ad27","parentId":"eaf1147f","timestamp":"2026-04-30T09:04:50.584Z","message":{"role":"toolResult","toolCallId":"call_function_sodheult4wl6_1","toolName":"read","content":[{"type":"text","text":"        return count\n\n    def parse_templates(self, templates_dir: str) -> int:\n        \"\"\"Parse templates/ directory into template_stage nodes.\n\n        Templates define pipeline stage patterns with YAML stage definitions.\n        Each template has a type, phases, and named stages per phase.\n\n        Node type: template_stage (extracted stage definitions from YAML blocks)\n        Edges: follows_template → pipeline_stage (if a pipeline uses this template)\n        \"\"\"\n        if not os.path.isdir(templates_dir):\n            return 0\n\n        count = 0\n        _RE_YAML_BLOCK = re.compile(r'```yaml\\n(.*?)\\n```', re.DOTALL)\n        _RE_PHASE_HDR = re.compile(r'^###\\s+Phase\\s+(\\d+)([^\\n]*)\\n', re.MULTILINE)\n        _RE_STAGE_HDR = re.compile(r'^####\\s+`([\\w_]+)`\\n', re.MULTILINE)\n        _RE_YAML_KEY = re.compile(r'^(\\s*)([\\w_]+):\\s*(.*)$', re.MULTILINE)\n\n        try:\n            files = sorted(os.listdir(templates_dir))\n        except Exception:\n            return 0\n\n        for filename in files:\n            if not filename.endswith('.md') or filename.startswith('.') or filename == 'retired':\n                continue\n            filepath = os.path.join(templates_dir, filename)\n            if not os.path.isfile(filepath):\n                continue\n\n            try:\n                with open(filepath, \"r\") as f:\n                    content = f.read()\n            except Exception:\n                continue\n\n            # Template-level info\n            title_match = re.search(r'^#\\s+(.+)$', content, re.MULTILINE)\n            title = title_match.group(1).strip()[:60] if title_match else filename[:-3]\n            tmpl_id = f\"template_{filename[:-3]}\"\n            self.add_node(\"reference\", title[:50], f\"template:{filename}\", f\"templates/{filename}\", tmpl_id)\n            count += 1\n\n            # Category edge\n            cat_id = \"category_template\"\n            if cat_id not in self._node_ids:\n                self.add_node(\"tag\", \"template\", \"\", f\"templates/{filename}\", cat_id)\n                count += 1\n            self.add_edge(tmpl_id, cat_id, \"categorized_as\")\n\n            # Extract YAML blocks (stage definitions)\n            yaml_blocks = list(_RE_YAML_BLOCK.finditer(content))\n\n            # Extract phase + stage hierarchy from markdown headings\n            current_phase = None\n            current_stage = None\n            phase_ids = []\n\n\n[826 more lines in file. Use offset=1698 to continue.]"}],"isError":false,"timestamp":1777539890584}}
{"type":"message","id":"0844f884","parentId":"82e8ad27","timestamp":"2026-04-30T09:05:26.834Z","message":{"role":"assistant","content":[{"type":"thinking","thinking":"Now I understand. The parse_templates function currently:\n1. Creates `reference` nodes for templates\n2. Creates `reference` nodes for phases and stages\n3. Parses YAML blocks but doesn't use the data effectively\n\nThe targeted improvement: \n1. Change `reference` nodes for stages to `template_stage` nodes with richer metadata\n2. Extract role/action from the YAML blocks and include in stage metadata\n3. This adds meaningful nodes instead of generic references\n\nLet me make this targeted change:","thinkingSignature":"087994d3c19fdc82161b0bf6096a4ad6a8d1e054581900d901b34291d758b439"},{"type":"text","text":"\nNow I'll make the targeted change to `parse_templates()` — change stage nodes from generic `reference` to `template_stage` with richer metadata:\n"},{"type":"toolCall","id":"call_function_a9tsupum80pz_1","name":"edit","arguments":{"path":"/home/ubuntu/.hermes/agi/graph_builder.py","edits":[{"oldText":"            # Template-level info\n            title_match = re.search(r'^#\\s+(.+)$', content, re.MULTILINE)\n            title = title_match.group(1).strip()[:60] if title_match else filename[:-3]\n            tmpl_id = f\"template_{filename[:-3]}\"\n            self.add_node(\"reference\", title[:50], f\"template:{filename}\", f\"templates/{filename}\", tmpl_id)\n            count += 1\n\n            # Category edge\n            cat_id = \"category_template\"\n            if cat_id not in self._node_ids:\n                self.add_node(\"tag\", \"template\", \"\", f\"templates/{filename}\", cat_id)\n                count += 1\n            self.add_edge(tmpl_id, cat_id, \"categorized_as\")\n\n            # Extract YAML blocks (stage definitions)\n            yaml_blocks = list(_RE_YAML_BLOCK.finditer(content))\n\n            # Extract phase + stage hierarchy from markdown headings\n            current_phase = None\n            current_stage = None\n            phase_ids = []\n\n            for line_num, line in enumerate(content.split('\\n'), 1):\n                ph_match = _RE_PHASE_HDR.match(line)\n                if ph_match:\n                    phase_num = ph_match.group(1)\n                    phase_suffix = ph_match.group(2).strip()[:40]\n                    phase_id = f\"template_{filename[:-3]}_phase{phase_num}\"\n                    self.add_node(\"reference\", f\"Phase {phase_num} {phase_suffix}\", \"\", f\"templates/{filename}#phase{phase_num}\", phase_id)\n                    count += 1\n                    self.add_edge(tmpl_id, phase_id, \"has_phase\")\n                    if phase_ids:\n                        self.add_edge(phase_ids[-1], phase_id, \"next_phase\")\n                    phase_ids.append(phase_id)\n                    current_phase = phase_id\n                    current_stage = None\n                    continue\n\n                st_match = _RE_STAGE_HDR.match(line)\n                if st_match and current_phase:\n                    stage_name = st_match.group(1)\n                    stage_id = f\"template_{filename[:-3]}_stage_{stage_name}\"\n                    self.add_node(\"reference\", stage_name, f\"phase:{current_phase}\", f\"templates/{filename}#{stage_name}\", stage_id)\n                    count += 1\n                    self.add_edge(current_phase, stage_id, \"has_stage\")\n                    current_stage = stage_id\n\n            # Parse YAML blocks for structured stage metadata\n            for yb in yaml_blocks:\n                yaml_content = yb.group(1)\n                lines = yaml_content.split('\\n')\n                cur_indent = 0\n                for yline in lines:\n                    km = _RE_YAML_KEY.match(yline)\n                    if not km:\n                        continue\n                    indent = len(km.group(1))\n                    key = km.group(2)\n                    val = km.group(3).strip()\n                    if indent == 0 and key in ('type', 'first_agent'):\n                        # Template-level metadata\n                        pass  # Already captured from title/flow","newText":"            # Template-level info\n            title_match = re.search(r'^#\\s+(.+)$', content, re.MULTILINE)\n            title = title_match.group(1).strip()[:60] if title_match else filename[:-3]\n            tmpl_id = f\"template_{filename[:-3]}\"\n            self.add_node(\"reference\", title[:50], f\"template:{filename}\", f\"templates/{filename}\", tmpl_id)\n            count += 1\n\n            # Category edge\n            cat_id = \"category_template\"\n            if cat_id not in self._node_ids:\n                self.add_node(\"tag\", \"template\", \"\", f\"templates/{filename}\", cat_id)\n                count += 1\n            self.add_edge(tmpl_id, cat_id, \"categorized_as\")\n\n            # Extract YAML blocks (stage definitions)\n            yaml_blocks = list(_RE_YAML_BLOCK.finditer(content))\n            \n            # Pre-parse YAML blocks to build stage -> (role, action, session, cli) map\n            stage_meta = {}  # stage_name -> {role, action, session, cli}\n            current_yaml_path = []  # [phase_name, ...]\n            in_stages = False\n            for yb in yaml_blocks:\n                yaml_content = yb.group(1)\n                lines = yaml_content.split('\\n')\n                cur_phase = None\n                for yline in lines:\n                    # Track current phase\n                    ph_match = re.match(r'^(\\s*)(\\w+):', yline)\n                    if ph_match:\n                        indent = len(ph_match.group(1))\n                        key = ph_match.group(2)\n                        if indent == 0 and key in ('phase1', 'phase2', 'phase3'):\n                            cur_phase = key\n                            in_stages = False\n                        elif cur_phase and indent > 0 and key == 'stages':\n                            in_stages = True\n                        elif in_stages and indent > 0:\n                            # Stage definition line: \"- role: builder\"\n                            stage_def = re.match(r'^(\\s*)- role: (\\w+)', yline)\n                            if stage_def:\n                                role = stage_def.group(2)\n                                action_match = re.search(r'action: (\\w+)', yline)\n                                action = action_match.group(1) if action_match else ''\n                                # Look ahead for session/cli in following lines\n                                session_match = re.search(r'session: (\\w+)', yline)\n                                session = session_match.group(1) if session_match else ''\n                                cli_match = re.search(r'cli: (\\w+)', yline)\n                                cli = cli_match.group(1) if cli_match else ''\n                                # Use role+action as stage key\n                                stage_key = f\"p{cur_phase[-1]}_{role}_{action}\"  # e.g., p1_builder_implement\n                                stage_meta[stage_key] = {\n                                    'role': role,\n                                    'action': action,\n                                    'session': session,\n                                    'cli': cli,\n                                    'phase': cur_phase\n                                }\n\n            # Extract phase + stage hierarchy from markdown headings\n            current_phase = None\n            current_stage = None\n            phase_ids = []\n\n            for line_num, line in enumerate(content.split('\\n'), 1):\n                ph_match = _RE_PHASE_HDR.match(line)\n                if ph_match:\n                    phase_num = ph_match.group(1)\n                    phase_suffix = ph_match.group(2).strip()[:40]\n                    phase_id = f\"template_{filename[:-3]}_phase{phase_num}\"\n                    self.add_node(\"reference\", f\"Phase {phase_num} {phase_suffix}\", \"\", f\"templates/{filename}#phase{phase_num}\", phase_id)\n                    count += 1\n                    self.add_edge(tmpl_id, phase_id, \"has_phase\")\n                    if phase_ids:\n                        self.add_edge(phase_ids[-1], phase_id, \"next_phase\")\n                    phase_ids.append(phase_id)\n                    current_phase = phase_id\n                    current_stage = None\n                    continue\n\n                st_match = _RE_STAGE_HDR.match(line)\n                if st_match and current_phase:\n                    stage_name = st_match.group(1)\n                    stage_id = f\"template_{filename[:-3]}_stage_{stage_name}\"\n                    # Rich metadata from YAML: role, action, session, cli\n                    meta = stage_meta.get(stage_name, {})\n                    summary = f\"role:{meta.get('role','')}|action:{meta.get('action','')}|session:{meta.get('session','')}|cli:{meta.get('cli','')}\"\n                    self.add_node(\"template_stage\", stage_name, summary, f\"templates/{filename}#{stage_name}\", stage_id)\n                    count += 1\n                    self.add_edge(current_phase, stage_id, \"has_stage\")\n                    current_stage = stage_id\n                    # Link stage to agent_role if role is known\n                    if meta.get('role'):\n                        role_id = f\"agent_role_{meta['role']}\"\n                        if role_id not in self._node_ids:\n                            self.add_node(\"agent_role\", meta['role'], \"\", f\"templates/{filename}\", role_id)\n                            count += 1\n                        self.add_edge(stage_id, role_id, \"uses_role\")"}]}}],"api":"anthropic-messages","provider":"minimax","model":"MiniMax-M2.7","usage":{"input":35141,"output":2112,"cacheRead":10071,"cacheWrite":0,"totalTokens":47324,"cost":{"input":0.0105423,"output":0.0025344,"cacheRead":0.0006042599999999999,"cacheWrite":0,"total":0.01368096}},"stopReason":"toolUse","timestamp":1777539890585,"responseId":"06424e32bfca3956f47d5e0f8bd55b94"}}
{"type":"message","id":"ed2b14b2","parentId":"0844f884","timestamp":"2026-04-30T09:05:26.860Z","message":{"role":"toolResult","toolCallId":"call_function_a9tsupum80pz_1","toolName":"edit","content":[{"type":"text","text":"Successfully replaced 1 block(s) in /home/ubuntu/.hermes/agi/graph_builder.py."}],"details":{"diff":"      ...\n 1688             self.add_edge(tmpl_id, cat_id, \"categorized_as\")\n 1689 \n 1690             # Extract YAML blocks (stage definitions)\n 1691             yaml_blocks = list(_RE_YAML_BLOCK.finditer(content))\n+1692             \n+1693             # Pre-parse YAML blocks to build stage -> (role, action, session, cli) map\n+1694             stage_meta = {}  # stage_name -> {role, action, session, cli}\n+1695             current_yaml_path = []  # [phase_name, ...]\n+1696             in_stages = False\n+1697             for yb in yaml_blocks:\n+1698                 yaml_content = yb.group(1)\n+1699                 lines = yaml_content.split('\\n')\n+1700                 cur_phase = None\n+1701                 for yline in lines:\n+1702                     # Track current phase\n+1703                     ph_match = re.match(r'^(\\s*)(\\w+):', yline)\n+1704                     if ph_match:\n+1705                         indent = len(ph_match.group(1))\n+1706                         key = ph_match.group(2)\n+1707                         if indent == 0 and key in ('phase1', 'phase2', 'phase3'):\n+1708                             cur_phase = key\n+1709                             in_stages = False\n+1710                         elif cur_phase and indent > 0 and key == 'stages':\n+1711                             in_stages = True\n+1712                         elif in_stages and indent > 0:\n+1713                             # Stage definition line: \"- role: builder\"\n+1714                             stage_def = re.match(r'^(\\s*)- role: (\\w+)', yline)\n+1715                             if stage_def:\n+1716                                 role = stage_def.group(2)\n+1717                                 action_match = re.search(r'action: (\\w+)', yline)\n+1718                                 action = action_match.group(1) if action_match else ''\n+1719                                 # Look ahead for session/cli in following lines\n+1720                                 session_match = re.search(r'session: (\\w+)', yline)\n+1721                                 session = session_match.group(1) if session_match else ''\n+1722                                 cli_match = re.search(r'cli: (\\w+)', yline)\n+1723                                 cli = cli_match.group(1) if cli_match else ''\n+1724                                 # Use role+action as stage key\n+1725                                 stage_key = f\"p{cur_phase[-1]}_{role}_{action}\"  # e.g., p1_builder_implement\n+1726                                 stage_meta[stage_key] = {\n+1727                                     'role': role,\n+1728                                     'action': action,\n+1729                                     'session': session,\n+1730                                     'cli': cli,\n+1731                                     'phase': cur_phase\n+1732                                 }\n 1692 \n 1693             # Extract phase + stage hierarchy from markdown headings\n 1694             current_phase = None\n 1695             current_stage = None\n      ...\n 1714                 st_match = _RE_STAGE_HDR.match(line)\n 1715                 if st_match and current_phase:\n 1716                     stage_name = st_match.group(1)\n 1717                     stage_id = f\"template_{filename[:-3]}_stage_{stage_name}\"\n-1718                     self.add_node(\"reference\", stage_name, f\"phase:{current_phase}\", f\"templates/{filename}#{stage_name}\", stage_id)\n+1759                     # Rich metadata from YAML: role, action, session, cli\n+1760                     meta = stage_meta.get(stage_name, {})\n+1761                     summary = f\"role:{meta.get('role','')}|action:{meta.get('action','')}|session:{meta.get('session','')}|cli:{meta.get('cli','')}\"\n+1762                     self.add_node(\"template_stage\", stage_name, summary, f\"templates/{filename}#{stage_name}\", stage_id)\n 1719                     count += 1\n 1720                     self.add_edge(current_phase, stage_id, \"has_stage\")\n 1721                     current_stage = stage_id\n+1766                     # Link stage to agent_role if role is known\n+1767                     if meta.get('role'):\n+1768                         role_id = f\"agent_role_{meta['role']}\"\n+1769                         if role_id not in self._node_ids:\n+1770                             self.add_node(\"agent_role\", meta['role'], \"\", f\"templates/{filename}\", role_id)\n+1771                             count += 1\n+1772                         self.add_edge(stage_id, role_id, \"uses_role\")\n 1722 \n-1723             # Parse YAML blocks for structured stage metadata\n-1724             for yb in yaml_blocks:\n-1725                 yaml_content = yb.group(1)\n-1726                 lines = yaml_content.split('\\n')\n-1727                 cur_indent = 0\n-1728                 for yline in lines:\n-1729                     km = _RE_YAML_KEY.match(yline)\n-1730                     if not km:\n-1731                         continue\n-1732                     indent = len(km.group(1))\n-1733                     key = km.group(2)\n-1734                     val = km.group(3).strip()\n-1735                     if indent == 0 and key in ('type', 'first_agent'):\n-1736                         # Template-level metadata\n-1737                         pass  # Already captured from title/flow\n-1738 \n 1739         return count\n 1740 \n 1741     def parse_archive_tasks(self, archive_dir: str) -> int:\n 1742         \"\"\"Parse archive/tasks/ into archive_task nodes with upstream/downstream edges.\n      ...","firstChangedLine":1692},"isError":false,"timestamp":1777539926860}}
{"type":"message","id":"8d19ce1e","parentId":"ed2b14b2","timestamp":"2026-04-30T09:05:31.017Z","message":{"role":"assistant","content":[{"type":"thinking","thinking":"Good, now I need to also update the `build_graph` function to bump the cache version. Let me find where `_cache_ver` is set:","thinkingSignature":"57bfc03e7b02dd127d2a27f75d31a56ca3fd31de220db5d6c6479033b482caa3"},{"type":"text","text":"Now bump the cache version to invalidate the lru_cache and pick up the code change:\n"},{"type":"toolCall","id":"call_function_5cu2g3qgp1q8_1","name":"bash","arguments":{"command":"grep -n \"_cache_ver=\" /home/ubuntu/.hermes/agi/graph_builder.py"}}],"api":"anthropic-messages","provider":"minimax","model":"MiniMax-M2.7","usage":{"input":37289,"output":93,"cacheRead":10071,"cacheWrite":0,"totalTokens":47453,"cost":{"input":0.011186699999999999,"output":0.00011159999999999999,"cacheRead":0.0006042599999999999,"cacheWrite":0,"total":0.01190256}},"stopReason":"toolUse","timestamp":1777539926862,"responseId":"06424e5733e29bdfc8bb0c8e3d788b47"}}
{"type":"message","id":"d6b1bda2","parentId":"8d19ce1e","timestamp":"2026-04-30T09:05:31.027Z","message":{"role":"toolResult","toolCallId":"call_function_5cu2g3qgp1q8_1","toolName":"bash","content":[{"type":"text","text":"2417:        builder = _cached_build_builder(hermes_dir, agi_dir, gitnexus_hash, _cache_ver=10)\n"}],"isError":false,"timestamp":1777539931027}}
{"type":"message","id":"daff9b90","parentId":"d6b1bda2","timestamp":"2026-04-30T09:05:34.697Z","message":{"role":"assistant","content":[{"type":"thinking","thinking":"Found it. Now I'll bump the cache version from 10 to 11:","thinkingSignature":"cbabfb67609eefb5171f4d297096647df133d725cababd0d281fab75d9bf48af"},{"type":"toolCall","id":"call_function_m7w3zrnasb09_1","name":"edit","arguments":{"path":"/home/ubuntu/.hermes/agi/graph_builder.py","edits":[{"oldText":"builder = _cached_build_builder(hermes_dir, agi_dir, gitnexus_hash, _cache_ver=10)","newText":"builder = _cached_build_builder(hermes_dir, agi_dir, gitnexus_hash, _cache_ver=11)"}]}}],"api":"anthropic-messages","provider":"minimax","model":"MiniMax-M2.7","usage":{"input":37426,"output":124,"cacheRead":10071,"cacheWrite":0,"totalTokens":47621,"cost":{"input":0.0112278,"output":0.00014879999999999998,"cacheRead":0.0006042599999999999,"cacheWrite":0,"total":0.01198086}},"stopReason":"toolUse","timestamp":1777539931030,"responseId":"06424e5be08e2042924b2d10e795eaa7"}}
