{"type":"message","id":"140035c9","parentId":"3bb91482","timestamp":"2026-04-30T09:01:48.251Z","message":{"role":"assistant","content":[{"type":"thinking","thinking":"Wait, the git log shows a different commit hash (322ba95) vs what I committed (cad2c19). The log_experiment tool must have made an additional commit. That's fine, the experiment was logged successfully.\n\nNow let me report the result to stdout in one line.","thinkingSignature":"bea8906dd8f8897d168a4035df8ab1da1be1752ead2762effd0176a48b2ffa33"},{"type":"text","text":"**Iteration 44 result:** `keep` — 0.03ms (noise floor unchanged); added hub reachability matrix (32 hubs × BFS frozensets → O(1) connectivity queries, +0.85ms cold, 0ms warm)."}],"api":"anthropic-messages","provider":"minimax","model":"MiniMax-M2.7","usage":{"input":32873,"output":115,"cacheRead":10071,"cacheWrite":0,"totalTokens":43059,"cost":{"input":0.0098619,"output":0.000138,"cacheRead":0.0006042599999999999,"cacheWrite":0,"total":0.01060416}},"stopReason":"stop","timestamp":1777539702652,"responseId":"06424d77b052a7d5ab614b28abbf4f13"}}
{"type":"message","id":"585a7d00","parentId":"140035c9","timestamp":"2026-04-30T09:01:48.259Z","message":{"role":"user","content":[{"type":"text","text":"Autoresearch loop ended (likely context limit). Resume the experiment loop — read autoresearch.md and git log for context. Check autoresearch.ideas.md for promising paths to explore. Prune stale/tried ideas. Be careful not to overfit to the benchmarks and do not cheat on the benchmarks."}],"timestamp":1777539708254}}
