{"type":"message","id":"47220ac9","parentId":"197c60b6","timestamp":"2026-04-30T08:09:37.882Z","message":{"role":"assistant","content":[{"type":"thinking","thinking":"The experiment logged successfully. Now I should stop — the user said to run exactly ONE iteration and stop.","thinkingSignature":"7cbfa655658ec8914f1c05d5e362130beb4aa570fcc6d2002bf1ef20e69cfbe8"},{"type":"text","text":"**Iteration 33 result**: `keep` — 0.03ms (unchanged, noise floor saturated); +37 nodes (886→923), +36 edges (380→416) from 38 `archive_command` docs with `upstream` cross-links to decision nodes."}],"api":"anthropic-messages","provider":"minimax","model":"MiniMax-M2.7","usage":{"input":27580,"output":83,"cacheRead":10071,"cacheWrite":0,"totalTokens":37734,"cost":{"input":0.008274,"output":0.0000996,"cacheRead":0.0006042599999999999,"cacheWrite":0,"total":0.00897786}},"stopReason":"stop","timestamp":1777536573031,"responseId":"0642413d5413160168017b98300900ce"}}
{"type":"message","id":"4bc4f5c6","parentId":"47220ac9","timestamp":"2026-04-30T08:09:37.890Z","message":{"role":"user","content":[{"type":"text","text":"Autoresearch loop ended (likely context limit). Resume the experiment loop — read autoresearch.md and git log for context. Check autoresearch.ideas.md for promising paths to explore. Prune stale/tried ideas. Be careful not to overfit to the benchmarks and do not cheat on the benchmarks."}],"timestamp":1777536577885}}
