{"type":"message","id":"870c11c9","parentId":"f51aa093","timestamp":"2026-04-30T08:31:19.009Z","message":{"role":"toolResult","toolCallId":"call_function_r0fhlegauvg4_1","toolName":"read","content":[{"type":"text","text":"#!/usr/bin/env python3\n\"\"\"\npi_tree_adapter.py — Adapter to feed graph output into pi's /tree feature\nDB-augmented directed code generation via unified graph memory\n\"\"\"\n\nimport json\nimport os\nimport sys\nfrom typing import List, Dict, Any, Optional\n\n# Add parent directory for imports\nsys.path.insert(0, os.path.dirname(os.path.abspath(__file__)))\n\nfrom graph_builder import build_graph, GraphBuilder\nfrom asciirender import ASCIIRenderer\n\n\nclass PiTreeAdapter:\n    \"\"\"\n    Adapter to convert graph data into pi's /tree format.\n    \n    pi's /tree feature expects a specific JSON structure:\n    {\n      \"nodes\": [\n        {\"id\": \"...\", \"label\": \"...\", \"children\": [...]}\n      ]\n    }\n    \"\"\"\n    \n    def __init__(self, builder: GraphBuilder):\n        self.builder = builder\n        self._node_lookup = {n[\"id\"]: n for n in builder.nodes}\n    \n    def to_pi_tree(self, root_id: Optional[str] = None, \n                   max_depth: int = 3) -> Dict[str, Any]:\n        \"\"\"Convert graph to pi's tree format.\"\"\"\n        if not self.builder.nodes:\n            return {\"nodes\": [], \"stats\": {}}\n        \n        # Find root(s)\n        if root_id is None:\n            # Use doc_sections as roots\n            section_nodes = [n for n in self.builder.nodes if n[\"type\"] == \"doc_section\"]\n            roots = section_nodes[:3] if section_nodes else [self.builder.nodes[0]]\n        else:\n            roots = [self._node_lookup[root_id]] if root_id in self._node_lookup else []\n        \n        nodes = []\n        visited = set()\n        \n        for root in roots:\n            tree = self._build_tree_recursive(root[\"id\"], visited, max_depth, 0)\n            nodes.append(tree)\n        \n        return {\n            \"nodes\": nodes,\n            \"stats\": {\n                \"total_nodes\": len(self.builder.nodes),\n                \"total_edges\": len(self.builder.edges),\n                \"rendered_nodes\": len(visited)\n            }\n        }\n    \n    def _build_tree_recursive(self, node_id: str, visited: set, \n                              max_depth: int, current_depth: int) -> Dict[str, Any]:\n        \"\"\"Recursively build tree structure.\"\"\"\n        if node_id in visited or current_depth > max_depth:\n            return {\"id\": node_id, \"label\": \"...\", \"collapsed\": True}\n        \n        visited.add(node_id)\n        node = self._node_lookup.get(node_id)\n        \n        if not node:\n            return {\"id\": node_id, \"label\": \"unknown\"}\n        \n        children = []\n        \n        # Get child edges\n        for edge in self.builder.edges:\n            if edge[\"from\"] == node_id and edge[\"type\"] == \"contains\":\n                child = self._build_tree_recursive(\n                    edge[\"to\"], visited, max_depth, current_depth + 1\n                )\n                children.append(child)\n        \n        result = {\n            \"id\": node[\"id\"],\n            \"label\": node[\"label\"][:50],\n            \"type\": node[\"type\"]\n        }\n        \n        if children:\n            result[\"children\"] = children\n        \n        return result\n    \n    def to_pi_search_format(self, query: str) -> Dict[str, Any]:\n        \"\"\"Convert search results to pi format.\"\"\"\n        results = []\n        \n        query_lower = query.lower()\n        for node in self.builder.nodes:\n            score = 0\n            if query_lower in node.get(\"label\", \"\").lower():\n                score += 2\n            if query_lower in node.get(\"content\", \"\").lower():\n                score += 1\n            \n            if score > 0:\n                results.append({\n                    \"id\": node[\"id\"],\n                    \"label\": node[\"label\"],\n                    \"type\": node[\"type\"],\n                    \"source\": node[\"source\"],\n                    \"score\": score\n                })\n        \n        results.sort(key=lambda x: -x[\"score\"])\n        \n        return {\n            \"query\": query,\n            \"results\": results[:20],\n            \"total_matches\": len(results)\n        }\n    \n    def to_pi_path_format(self, path: List[str]) -> Dict[str, Any]:\n        \"\"\"Convert a path to pi's format.\"\"\"\n        nodes = []\n        \n        for node_id in path:\n            node = self._node_lookup.get(node_id)\n            if node:\n                nodes.append({\n                    \"id\": node[\"id\"],\n                    \"label\": node[\"label\"],\n                    \"type\": node[\"type\"],\n                    \"content\": node.get(\"content\", \"\")[:100]\n                })\n        \n        return {\n            \"path\": nodes,\n            \"length\": len(nodes),\n            \"formatted\": self._format_path_ascii(path)\n        }\n    \n    def _format_path_ascii(self, path: List[str]) -> str:\n        \"\"\"Format path as ASCII art.\"\"\"\n        lines = []\n        \n        for i, node_id in enumerate(path):\n            node = self._node_lookup.get(node_id)\n            if not node:\n                continue\n            \n            if i == 0:\n                lines.append(f\"╭─ {node['label'][:50]}\")\n            elif i == len(path) - 1:\n                lines.append(f\"╰─ {node['label'][:50]}\")\n            else:\n                lines.append(f\"├─ {node['label'][:50]}\")\n        \n        return '\\n'.join(lines)\n    \n    def to_pi_subgraph(self, center_id: str, radius: int = 2) -> Dict[str, Any]:\n        \"\"\"Get subgraph around a center node for pi.\"\"\"\n        if center_id not in self._node_lookup:\n            return {\"error\": f\"Node not found: {center_id}\"}\n        \n        # BFS to find reachable nodes\n        reachable = {center_id}\n        frontier = {center_id}\n        \n        for _ in range(radius):\n            next_frontier = set()\n            for node in frontier:\n                for neighbor in self.builder.adj.get(node, []):\n                    if neighbor not in reachable:\n                        reachable.add(neighbor)\n                        next_frontier.add(neighbor)\n            frontier = next_frontier\n        \n        # Build subgraph\n        nodes = [self._node_lookup[n] for n in reachable if n in self._node_lookup]\n        edges = [e for e in self.builder.edges \n                if e[\"from\"] in reachable and e[\"to\"] in reachable]\n        \n        return {\n            \"center\": center_id,\n            \"radius\": radius,\n            \"nodes\": nodes,\n            \"edges\": edges,\n            \"node_count\": len(nodes),\n            \"edge_count\": len(edges)\n        }\n\n\ndef output_for_pi(builder: GraphBuilder, output_path: str):\n    \"\"\"Output graph in pi-compatible format.\"\"\"\n    adapter = PiTreeAdapter(builder)\n    \n    # Main tree\n    tree = adapter.to_pi_tree()\n    \n    # Search format\n    search = adapter.to_pi_search_format(\"agent\")\n    \n    # Stats\n    stats = builder.get_stats()\n    \n    output = {\n        \"tree\": tree,\n        \"search\": search,\n        \"stats\": stats,\n        \"generated_at\": __import__('time').time()\n    }\n    \n    with open(output_path, 'w') as f:\n        json.dump(output, f, indent=2)\n\n\nif __name__ == \"__main__\":\n    hermes = os.path.expanduser(\"~/.hermes\")\n    agi = os.path.dirname(os.path.abspath(__file__))\n    \n    print(\"Building graph...\")\n    builder, build_time = build_graph(hermes, agi)\n    print(f\"Build: {build_time:.2f}ms\")\n    \n    adapter = PiTreeAdapter(builder)\n    \n    # Output pi tree\n    tree = adapter.to_pi_tree()\n    print(f\"\\nPi tree: {len(tree['nodes'])} root nodes\")\n    print(json.dumps(tree, indent=2)[:500])\n"}],"isError":false,"timestamp":1777537879009}}
{"type":"message","id":"96306e09","parentId":"870c11c9","timestamp":"2026-04-30T08:31:26.248Z","message":{"role":"assistant","content":[{"type":"thinking","thinking":"I see the pi_tree_adapter uses `n[\"id\"]` but the nodes are stored as tuples, not dicts. Let me check the node structure:","thinkingSignature":"60b5eec4bc96c601b7ff116e7fb6b65e0db4850fe5c54548e15f51a8ded82cd7"},{"type":"toolCall","id":"call_function_43jnbjkmiy01_1","name":"bash","arguments":{"command":"cd /home/ubuntu/.hermes/agi && python3 -c \"\nfrom graph_builder import build_graph, GraphBuilder\nimport os\nhermes = os.path.expanduser('~/.hermes')\nagi = os.path.dirname(os.path.abspath('.'))\nbuilder, t = build_graph(hermes, agi)\nprint('Node type:', type(builder.nodes[0]))\nprint('First 3 nodes:', builder.nodes[:3])\nprint('Keys:', builder.nodes[0]._fields if hasattr(builder.nodes[0], '_fields') else 'no _fields')\n\""}}],"api":"anthropic-messages","provider":"minimax","model":"MiniMax-M2.7","usage":{"input":16678,"output":173,"cacheRead":10071,"cacheWrite":0,"totalTokens":26922,"cost":{"input":0.0050034,"output":0.00020759999999999998,"cacheRead":0.0006042599999999999,"cacheWrite":0,"total":0.005815259999999999}},"stopReason":"toolUse","timestamp":1777537879010,"responseId":"0642465773314b89cac73ec2e2cab3fd"}}
{"type":"message","id":"e56b9f48","parentId":"96306e09","timestamp":"2026-04-30T08:31:26.379Z","message":{"role":"toolResult","toolCallId":"call_function_43jnbjkmiy01_1","toolName":"bash","content":[{"type":"text","text":"Node type: <class 'tuple'>\nFirst 3 nodes: [('agents_section_0', 'doc_section', 'AGENTS.md - Your Workspace', 'This folder is home. Treat it that way.', 'AGENTS.md'), ('agents_section_1', 'doc_section', 'First Run', 'If `BOOTSTRAP.md` exists, follow it, figure out who you are, then delete it. The seed has served its purpose once the pa', 'AGENTS.md'), ('agents_section_2', 'doc_section', 'Every Session', \"1. Read `SOUL.md` — who you are\\n2. Read `IDENTITY.md` — your specific role\\n3. Read `USER.md` — who you're helping\\n4. Rea\", 'AGENTS.md')]\nKeys: no _fields\n"}],"isError":false,"timestamp":1777537886379}}
{"type":"message","id":"976e4441","parentId":"e56b9f48","timestamp":"2026-04-30T08:31:30.067Z","message":{"role":"assistant","content":[{"type":"thinking","thinking":"I see the issue! The nodes are stored as tuples `('id', 'type', 'label', 'content', 'source')` but `pi_tree_adapter.py` tries to access them as dicts with `n[\"id\"]`, `n[\"type\"]`, etc. This is a bug!\n\nLet me check the `_benchmark.py` to understand how the code currently works:","thinkingSignature":"bc17578f9473ab43ac90ef3899e6ed71da7ff99b7259b6d6a1305d2bc820afa0"},{"type":"toolCall","id":"call_function_ohcqiiul79na_1","name":"read","arguments":{"path":"/home/ubuntu/.hermes/agi/_benchmark.py"}}],"api":"anthropic-messages","provider":"minimax","model":"MiniMax-M2.7","usage":{"input":17036,"output":115,"cacheRead":10071,"cacheWrite":0,"totalTokens":27222,"cost":{"input":0.0051107999999999995,"output":0.000138,"cacheRead":0.0006042599999999999,"cacheWrite":0,"total":0.005853059999999999}},"stopReason":"toolUse","timestamp":1777537886380,"responseId":"0642465e6c746e4aff59a55016a0bf4f"}}
