{"type":"message","id":"fc52473d","parentId":"17dd1a55","timestamp":"2026-04-30T09:09:50.156Z","message":{"role":"toolResult","toolCallId":"call_function_vqv45wg5ddfv_1","toolName":"read","content":[{"type":"text","text":"                    \n                    # Detect stages section\n                    if stripped.startswith('stages:'):\n                        in_stages = True\n                        continue\n                    \n                    # Parse stage definitions: collect multi-line until next '- role:'\n                    if in_stages and stripped.startswith('- role:'):\n                        role = stripped.split('role:')[1].strip().split()[0]\n                        # Collect continuation lines (indented) until next '- role:'\n                        stage_lines = [stripped]\n                        j = i + 1\n                        while j < len(lines):\n                            next_stripped = lines[j].strip()\n                            # Break on next stage definition\n                            if next_stripped.startswith('- role:'):\n                                break\n                            # Break on non-indented content (end of stages)\n                            if next_stripped and not lines[j].startswith(' '):\n                                break\n                            if next_stripped:\n                                stage_lines.append(next_stripped)\n                            j += 1\n                        \n                        full_stage = '\\n'.join(stage_lines)\n                        action_match = re.search(r'action:\\s*(\\w+)', full_stage)\n                        session_match = re.search(r'session:\\s*(\\w+)', full_stage)\n                        cli_match = re.search(r'cli:\\s*(\\w+)', full_stage)\n                        \n                        if role and cur_phase:\n                            action = action_match.group(1) if action_match else ''\n                            stage_key = f\"p{cur_phase[-1]}_{role}_{action}\"\n                            stage_meta[stage_key] = {\n                                'role': role,\n                                'action': action,\n                                'session': session_match.group(1) if session_match else '',\n                                'cli': cli_match.group(1) if cli_match else '',\n                                'phase': cur_phase\n                            }\n\n            # Extract phase + stage hierarchy from markdown headings\n            current_phase = None\n            current_stage = None\n            phase_ids = []\n\n            for line_num, line in enumerate(content.split('\\n'), 1):\n                ph_match = _RE_PHASE_HDR.match(line)\n                if ph_match:\n                    phase_num = ph_match.group(1)\n                    phase_suffix = ph_match.group(2).strip()[:40]\n                    phase_id = f\"template_{filename[:-3]}_phase{phase_num}\"\n                    self.add_node(\"reference\", f\"Phase {phase_num} {phase_suffix}\", \"\", f\"templates/{filename}#phase{phase_num}\", phase_id)\n                    count += 1\n                    self.add_edge(tmpl_id, phase_id, \"has_phase\")\n                    if phase_ids:\n                        self.add_edge(phase_ids[-1], phase_id, \"next_phase\")\n                    phase_ids.append(phase_id)\n                    current_phase = phase_id\n                    current_stage = None\n                    continue\n\n                st_match = _RE_STAGE_HDR.match(line)\n                if st_match and current_phase:\n                    stage_name = st_match.group(1)\n                    stage_id = f\"template_{filename[:-3]}_stage_{stage_name}\"\n                    # Rich metadata from YAML: role, action, session, cli\n                    meta = stage_meta.get(stage_name, {})\n                    summary = f\"role:{meta.get('role','')}|action:{meta.get('action','')}|session:{meta.get('session','')}|cli:{meta.get('cli','')}\"\n                    self.add_node(\"template_stage\", stage_name, summary, f\"templates/{filename}#{stage_name}\", stage_id)\n                    count += 1\n                    self.add_edge(current_phase, stage_id, \"has_stage\")\n                    current_stage = stage_id\n                    # Link stage to agent_role if role is known\n                    if meta.get('role'):\n                        role_id = f\"agent_role_{meta['role']}\"\n                        if role_id not in self._node_ids:\n                            self.add_node(\"agent_role\", meta['role'], \"\", f\"templates/{filename}\", role_id)\n                            count += 1\n                        self.add_edge(stage_id, role_id, \"uses_role\")\n\n\n[785 more lines in file. Use offset=1790 to continue.]"}],"isError":false,"timestamp":1777540190156}}
{"type":"message","id":"554e94f8","parentId":"fc52473d","timestamp":"2026-04-30T09:09:55.755Z","message":{"role":"assistant","content":[{"type":"thinking","thinking":"I see the issue now! The `stage_meta` dictionary is built in one loop (YAML parsing) but the lookup happens in a DIFFERENT loop (markdown heading parsing). The `stage_meta` is local to the YAML parsing block and goes out of scope!Let me check the indentation:","thinkingSignature":"a0539e688946ce1743595f7a42ef27705d9c2c2f36690a56c5c1102e92081607"},{"type":"text","text":"Found the bug! The `stage_meta` dict is scoped inside the YAML parsing loop but accessed outside it. Let me fix the indentation:\n"},{"type":"toolCall","id":"call_function_gqyh0sls9ory_1","name":"read","arguments":{"path":"/home/ubuntu/.hermes/agi/graph_builder.py","offset":1640,"limit":100}}],"api":"anthropic-messages","provider":"minimax","model":"MiniMax-M2.7","usage":{"input":53351,"output":146,"cacheRead":10071,"cacheWrite":0,"totalTokens":63568,"cost":{"input":0.0160053,"output":0.0001752,"cacheRead":0.0006042599999999999,"cacheWrite":0,"total":0.01678476}},"stopReason":"toolUse","timestamp":1777540190158,"responseId":"06424f5e83e8171c8bb986ead6150bd1"}}
{"type":"message","id":"b90268a3","parentId":"554e94f8","timestamp":"2026-04-30T09:09:55.757Z","message":{"role":"toolResult","toolCallId":"call_function_gqyh0sls9ory_1","toolName":"read","content":[{"type":"text","text":"    def parse_templates(self, templates_dir: str) -> int:\n        \"\"\"Parse templates/ directory into template_stage nodes.\n\n        Templates define pipeline stage patterns with YAML stage definitions.\n        Each template has a type, phases, and named stages per phase.\n\n        Node type: template_stage (extracted stage definitions from YAML blocks)\n        Edges: follows_template → pipeline_stage (if a pipeline uses this template)\n        \"\"\"\n        if not os.path.isdir(templates_dir):\n            return 0\n\n        count = 0\n        _RE_YAML_BLOCK = re.compile(r'```yaml\\n(.*?)\\n```', re.DOTALL)\n        _RE_PHASE_HDR = re.compile(r'^###\\s+Phase\\s+(\\d+)([^\\n]*)\\n', re.MULTILINE)\n        _RE_STAGE_HDR = re.compile(r'^####\\s+`([\\w_]+)`\\n', re.MULTILINE)\n        _RE_YAML_KEY = re.compile(r'^(\\s*)([\\w_]+):\\s*(.*)$', re.MULTILINE)\n\n        try:\n            files = sorted(os.listdir(templates_dir))\n        except Exception:\n            return 0\n\n        for filename in files:\n            if not filename.endswith('.md') or filename.startswith('.') or filename == 'retired':\n                continue\n            filepath = os.path.join(templates_dir, filename)\n            if not os.path.isfile(filepath):\n                continue\n\n            try:\n                with open(filepath, \"r\") as f:\n                    content = f.read()\n            except Exception:\n                continue\n\n            # Template-level info\n            title_match = re.search(r'^#\\s+(.+)$', content, re.MULTILINE)\n            title = title_match.group(1).strip()[:60] if title_match else filename[:-3]\n            tmpl_id = f\"template_{filename[:-3]}\"\n            self.add_node(\"reference\", title[:50], f\"template:{filename}\", f\"templates/{filename}\", tmpl_id)\n            count += 1\n\n            # Category edge\n            cat_id = \"category_template\"\n            if cat_id not in self._node_ids:\n                self.add_node(\"tag\", \"template\", \"\", f\"templates/{filename}\", cat_id)\n                count += 1\n            self.add_edge(tmpl_id, cat_id, \"categorized_as\")\n\n            # Extract YAML blocks (stage definitions)\n            yaml_blocks = list(_RE_YAML_BLOCK.finditer(content))\n            \n            # Pre-parse YAML blocks to build stage -> (role, action, session, cli) map\n            stage_meta = {}  # stage_name -> {role, action, session, cli}\n            for yb in yaml_blocks:\n                yaml_content = yb.group(1)\n                lines = yaml_content.split('\\n')\n                cur_phase = None\n                in_stages = False\n                \n                for i, yline in enumerate(lines):\n                    stripped = yline.strip()\n                    \n                    # Track phases nested under 'phases:'\n                    if stripped.startswith('phase') and ':' in stripped:\n                        phase_key = stripped.split(':')[0].strip()\n                        if phase_key in ('phase1', 'phase2', 'phase3'):\n                            cur_phase = phase_key\n                            in_stages = False\n                    \n                    # Detect stages section\n                    if stripped.startswith('stages:'):\n                        in_stages = True\n                        continue\n                    \n                    # Parse stage definitions: collect multi-line until next '- role:'\n                    if in_stages and stripped.startswith('- role:'):\n                        role = stripped.split('role:')[1].strip().split()[0]\n                        # Collect continuation lines (indented) until next '- role:'\n                        stage_lines = [stripped]\n                        j = i + 1\n                        while j < len(lines):\n                            next_stripped = lines[j].strip()\n                            # Break on next stage definition\n                            if next_stripped.startswith('- role:'):\n                                break\n                            # Break on non-indented content (end of stages)\n                            if next_stripped and not lines[j].startswith(' '):\n                                break\n                            if next_stripped:\n                                stage_lines.append(next_stripped)\n                            j += 1\n                        \n                        full_stage = '\\n'.join(stage_lines)\n                        action_match = re.search(r'action:\\s*(\\w+)', full_stage)\n                        session_match = re.search(r'session:\\s*(\\w+)', full_stage)\n                        cli_match = re.search(r'cli:\\s*(\\w+)', full_stage)\n                        \n                        if role and cur_phase:\n\n[835 more lines in file. Use offset=1740 to continue.]"}],"isError":false,"timestamp":1777540195756}}
{"type":"message","id":"d902ae21","parentId":"b90268a3","timestamp":"2026-04-30T09:10:18.274Z","message":{"role":"assistant","content":[{"type":"thinking","thinking":"I see the issue now. Looking at the code:1. `stage_meta = {}` is defined BEFORE the `for yb in yaml_blocks:` loop2. The `stage_meta` dict is populated INSIDE that loop3. Then the markdown parsing loop runs and tries to access `stage_meta`\n\nBut wait, `stage_meta` is defined outside the `for yb` loop, so it should be accessible. Let me look at the full indentation structure more carefully:\n\n```python\nstage_meta = {}  # This is at indent level for the file loop\nfor yb in yaml_blocks:\n    # YAML parsing\n    ...\n    if role and cur_phase:\n        stage_meta[stage_key] = {...}  # This populates stage_meta\n\n# Then later:\nfor line_num, line in enumerate(...):\n    st_match = _RE_STAGE_HDR.match(line)\n    if st_match and current_phase:\n        meta = stage_meta.get(stage_name, {})  # Trying to access it here\n```\n\nSo `stage_meta` should be accessible. Let me check if the YAML parsing is actually populating it. The issue might be that `stage_meta` is being reset or something is wrong with the scoping.\n\nActually wait - I see that `stage_meta` is defined inside the `for filename in files:` loop (the main file loop). So it should be fresh for each file. Let me verify this by checking if `yaml_blocks` is empty for some files.","thinkingSignature":"bf6b177753be8dd1fadeb31359a07c89223a37fd440c3a4e9d1937aaf4cb8f4e"},{"type":"toolCall","id":"call_function_6jm6obpbri8d_1","name":"bash","arguments":{"command":"cd /home/ubuntu/.hermes/agi && python3 -c \"\nfrom graph_builder import GraphBuilder\nimport os\nimport re\n\n# Trace through the actual parse_templates logic\ntemplates_dir = '/home/ubuntu/.hermes/belam-codex/templates'\nfiles = sorted(os.listdir(templates_dir))\n\n_RE_YAML_BLOCK = re.compile(r'\\`\\`\\`yaml\\n(.*?)\\n\\`\\`\\`', re.DOTALL)\n_RE_PHASE_HDR = re.compile(r'^###\\s+Phase\\s+(\\d+)([^\\n]*)\\n', re.MULTILINE)\n_RE_STAGE_HDR = re.compile(r'^####\\s+\\`([\\w_]+)\\`\\n', re.MULTILINE)\n\nfor filename in files:\n    if not filename.endswith('.md') or filename.startswith('.') or filename == 'retired':\n        continue\n    filepath = os.path.join(templates_dir, filename)\n    if not os.path.isfile(filepath):\n        continue\n    with open(filepath, 'r') as f:\n        content = f.read()\n    \n    print(f'\\\\n=== {filename} ===')\n    \n    # YAML parsing\n    yaml_blocks = list(_RE_YAML_BLOCK.finditer(content))\n    stage_meta = {}\n    \n    for yb in yaml_blocks:\n        yaml_content = yb.group(1)\n        lines = yaml_content.split('\\n')\n        cur_phase = None\n        in_stages = False\n        \n        for i, yline in enumerate(lines):\n            stripped = yline.strip()\n            \n            if stripped.startswith('phase') and ':' in stripped:\n                phase_key = stripped.split(':')[0].strip()\n                if phase_key in ('phase1', 'phase2', 'phase3'):\n                    cur_phase = phase_key\n                    in_stages = False\n            \n            if stripped.startswith('stages:'):\n                in_stages = True\n                continue\n            \n            if in_stages and stripped.startswith('- role:'):\n                role = stripped.split('role:')[1].strip().split()[0]\n                stage_lines = [stripped]\n                j = i + 1\n                while j < len(lines):\n                    next_stripped = lines[j].strip()\n                    if next_stripped.startswith('- role:'):\n                        break\n                    if next_stripped and not lines[j].startswith(' '):\n                        break\n                    if next_stripped:\n                        stage_lines.append(next_stripped)\n                    j += 1\n                \n                full_stage = '\\n'.join(stage_lines)\n                action_match = re.search(r'action:\\s*(\\w+)', full_stage)\n                if role and cur_phase:\n                    action = action_match.group(1) if action_match else ''\n                    stage_key = f\\\"p{cur_phase[-1]}_{role}_{action}\\\"\n                    stage_meta[stage_key] = {'role': role, 'action': action}\n    \n    print(f'stage_meta: {stage_meta}')\n    \n    # Markdown parsing\n    current_phase = None\n    stage_nodes_found = 0\n    for line_num, line in enumerate(content.split('\\n'), 1):\n        ph_match = _RE_PHASE_HDR.match(line)\n        if ph_match:\n            current_phase = f'phase_{ph_match.group(1)}'\n            print(f'Found phase: {current_phase}')\n        \n        st_match = _RE_STAGE_HDR.match(line)\n        if st_match and current_phase:\n            stage_name = st_match.group(1)\n            meta = stage_meta.get(stage_name, {})\n            print(f'  Stage: {stage_name} -> meta={meta}')\n            if meta:\n                stage_nodes_found += 1\n    \n    print(f'Total stages with metadata: {stage_nodes_found}')\n\""}}],"api":"anthropic-messages","provider":"minimax","model":"MiniMax-M2.7","usage":{"input":54491,"output":1113,"cacheRead":10071,"cacheWrite":0,"totalTokens":65675,"cost":{"input":0.0163473,"output":0.0013356,"cacheRead":0.0006042599999999999,"cacheWrite":0,"total":0.018287159999999997}},"stopReason":"toolUse","timestamp":1777540195759,"responseId":"06424f64841f6712ac7d526f9ce5a66d"}}
{"type":"message","id":"24d8ac78","parentId":"d902ae21","timestamp":"2026-04-30T09:10:18.322Z","message":{"role":"toolResult","toolCallId":"call_function_6jm6obpbri8d_1","toolName":"bash","content":[{"type":"text","text":"\n=== builder-first-autogate-pipeline.md ===\nstage_meta: {}\nTotal stages with metadata: 0\n\n=== builder-first-pipeline.md ===\nstage_meta: {'p1_builder_implement': {'role': 'builder', 'action': 'implement'}, 'p1_builder_bugfix': {'role': 'builder', 'action': 'bugfix'}, 'p1_critic_review': {'role': 'critic', 'action': 'review'}, 'p2_architect_design': {'role': 'architect', 'action': 'design'}, 'p2_builder_implement': {'role': 'builder', 'action': 'implement'}, 'p2_builder_bugfix': {'role': 'builder', 'action': 'bugfix'}, 'p2_critic_review': {'role': 'critic', 'action': 'review'}, 'p3_architect_design': {'role': 'architect', 'action': 'design'}, 'p3_builder_implement': {'role': 'builder', 'action': 'implement'}, 'p3_builder_bugfix': {'role': 'builder', 'action': 'bugfix'}, 'p3_critic_review': {'role': 'critic', 'action': 'review'}}\nTotal stages with metadata: 0\n\n=== research-packet-body.md ===\nstage_meta: {}\nTotal stages with metadata: 0\n\n=== research-pipeline.md ===\nstage_meta: {}\nTotal stages with metadata: 0\n"}],"isError":false,"timestamp":1777540218322}}
{"type":"message","id":"5c700def","parentId":"24d8ac78","timestamp":"2026-04-30T09:10:24.637Z","message":{"role":"assistant","content":[{"type":"thinking","thinking":"I found it! `builder-first-pipeline.md` has the stage metadata but when I try to look up `stage_name` from markdown (`p1_builder_implement`) in `stage_meta`, it returns empty!Let me check why:","thinkingSignature":"8c87c4395e04362fcee3a0ed4f6c751897649cd7fcdd6cab9f2750153729aba4"},{"type":"toolCall","id":"call_function_d3qxl21kkv3p_1","name":"bash","arguments":{"command":"cd /home/ubuntu/.hermes/agi && python3 -c \"\nstage_meta = {'p1_builder_implement': {'role': 'builder', 'action': 'implement'}}\nstage_name = 'p1_builder_implement'\nprint(f'Looking up: {stage_name}')\nprint(f'In stage_meta: {stage_name in stage_meta}')\nprint(f'stage_meta.get: {stage_meta.get(stage_name, \\\"NOT FOUND\\\")}')\n\""}}],"api":"anthropic-messages","provider":"minimax","model":"MiniMax-M2.7","usage":{"input":55917,"output":167,"cacheRead":10071,"cacheWrite":0,"totalTokens":66155,"cost":{"input":0.016775099999999998,"output":0.0002004,"cacheRead":0.0006042599999999999,"cacheWrite":0,"total":0.017579759999999996}},"stopReason":"toolUse","timestamp":1777540218324,"responseId":"06424f7a6e7df2c319944ffae9805713"}}
{"type":"message","id":"fff08fd1","parentId":"5c700def","timestamp":"2026-04-30T09:10:24.676Z","message":{"role":"toolResult","toolCallId":"call_function_d3qxl21kkv3p_1","toolName":"bash","content":[{"type":"text","text":"Looking up: p1_builder_implement\nIn stage_meta: True\nstage_meta.get: {'role': 'builder', 'action': 'implement'}\n"}],"isError":false,"timestamp":1777540224676}}
{"type":"message","id":"b076242d","parentId":"fff08fd1","timestamp":"2026-04-30T09:10:32.864Z","message":{"role":"assistant","content":[{"type":"thinking","thinking":"So the lookup should work. But my test output shows 0 stages with metadata. Let me check if `current_phase` is being set correctly:","thinkingSignature":"6e5e4a482b013ea328fe3461fc3b2f4b915c19fa8d2e8b6edb399ed482ac92cb"},{"type":"toolCall","id":"call_function_s0murjzm3kh5_1","name":"bash","arguments":{"command":"cd /home/ubuntu/.hermes/agi && python3 -c \"\nimport re\ncontent = open('/home/ubuntu/.hermes/belam-codex/templates/builder-first-pipeline.md').read()\n\n_RE_PHASE_HDR = re.compile(r'^###\\s+Phase\\s+(\\d+)([^\\n]*)\\n', re.MULTILINE)\n_RE_STAGE_HDR = re.compile(r'^####\\s+\\`([\\w_]+)\\`\\n', re.MULTILINE)\n\ncurrent_phase = None\nfor line_num, line in enumerate(content.split('\\n'), 1):\n    ph_match = _RE_PHASE_HDR.match(line)\n    if ph_match:\n        current_phase = f'phase_{ph_match.group(1)}'\n        print(f'Line {line_num}: Found phase: {current_phase} (raw: {repr(line)[:50]})')\n    \n    st_match = _RE_STAGE_HDR.match(line)\n    if st_match and current_phase:\n        stage_name = st_match.group(1)\n        print(f'  Line {line_num}: Found stage: {stage_name} (current_phase={current_phase})')\n    elif st_match:\n        print(f'  Line {line_num}: Found stage but NO phase: {st_match.group(1)}')\n\""}}],"api":"anthropic-messages","provider":"minimax","model":"MiniMax-M2.7","usage":{"input":56131,"output":331,"cacheRead":10071,"cacheWrite":0,"totalTokens":66533,"cost":{"input":0.016839299999999998,"output":0.0003972,"cacheRead":0.0006042599999999999,"cacheWrite":0,"total":0.017840759999999997}},"stopReason":"toolUse","timestamp":1777540224683,"responseId":"06424f81af0fb89dcc80daa947807adc"}}
{"type":"message","id":"dea86a9c","parentId":"b076242d","timestamp":"2026-04-30T09:10:32.901Z","message":{"role":"toolResult","toolCallId":"call_function_s0murjzm3kh5_1","toolName":"bash","content":[{"type":"text","text":"(no output)"}],"isError":false,"timestamp":1777540232901}}
