{"type":"message","id":"0fb4d605","parentId":"868428f1","timestamp":"2026-04-30T08:56:50.933Z","message":{"role":"toolResult","toolCallId":"call_function_zwja2mq6yg7k_1","toolName":"read","content":[{"type":"text","text":"\ndef _save_graph_cache(agi_dir: str, builder: GraphBuilder,\n                       gitnexus_cache: Optional[str]):\n    \"\"\"Save built graph to pickle cache.\"\"\"\n    try:\n        cache_file = _get_graph_cache_file(agi_dir)\n        cached = {\n            'nodes': builder.nodes,\n            'edges': builder.edges,\n            'adj': dict(builder.adj),\n            '_node_ids': builder._node_ids,\n            '_gitnexus_cache': gitnexus_cache,\n            '_precomputed_paths': builder._precomputed_paths,\n        }\n        with open(cache_file, 'wb') as f:\n            pickle.dump(cached, f, protocol=pickle.HIGHEST_PROTOCOL)\n    except Exception:\n        pass\n\n@lru_cache(maxsize=1)\ndef _cached_build_builder(hermes_dir: str, agi_dir: str, gitnexus_hash: int, _cache_ver: int = 1) -> GraphBuilder:\n    \"\"\"Cached builder internals — returns serializable parts only.\n    \n    lru_cache eliminates pickle.load entirely for warm calls.\n    gitnexus_hash is a cache-busting int derived from gitnexus content.\n    \"\"\"\n    # Initialize cache\n    init_cache(agi_dir)\n\n    # Build from sources\n    builder = GraphBuilder()\n\n    # Parse AGENTS.md\n    agents_md = os.path.join(hermes_dir, \"belam-codex\", \"AGENTS.md\")\n    builder.parse_agents_md(agents_md)\n\n    # Parse memory files (expanded to all 58)\n    memory_dir = os.path.join(hermes_dir, \"belam-codex\", \"memory\")\n    builder.parse_memory_files(memory_dir, limit=58)\n\n    # Parse schema files\n    schema_dir = os.path.join(hermes_dir, \"belam-codex\", \"schemas\")\n    builder.parse_schema_files(schema_dir)\n\n    # Parse decisions (all 128 files)\n    decisions_dir = os.path.join(hermes_dir, \"belam-codex\", \"decisions\")\n    if os.path.isdir(decisions_dir):\n        builder.parse_decisions(decisions_dir, limit=999)\n\n    # Parse lessons (all 208 files)\n    lessons_dir = os.path.join(hermes_dir, \"belam-codex\", \"lessons\")\n    if os.path.isdir(lessons_dir):\n        builder.parse_lessons(lessons_dir, limit=999)\n\n    # Parse tasks (all 84 files)\n    tasks_dir = os.path.join(hermes_dir, \"belam-codex\", \"tasks\")\n    if os.path.isdir(tasks_dir):\n        builder.parse_tasks(tasks_dir, limit=999)\n\n    # Parse goals (goal nodes with status/priority/urgency)\n    goals_dir = os.path.join(hermes_dir, \"belam-codex\", \"goals\")\n    if os.path.isdir(goals_dir):\n        builder.parse_goals(goals_dir)\n\n    # Parse agent roles (main, architect, builder, critic)\n    agents_dir = os.path.join(hermes_dir, \"belam-codex\", \"agents\")\n    if os.path.isdir(agents_dir):\n        builder.parse_agent_roles(agents_dir)\n\n    # Parse canvas graph (pre-computed cross-primitive causal edges)\n    canvas_dir = os.path.join(hermes_dir, \"belam-codex\", \"canvas\")\n    if os.path.isdir(canvas_dir):\n        builder.parse_canvas_graph(canvas_dir)\n\n    # Parse knowledge directory (semantic knowledge nodes with tag edges)\n    knowledge_dir = os.path.join(hermes_dir, \"belam-codex\", \"knowledge\")\n    if os.path.isdir(knowledge_dir):\n        builder.parse_knowledge(knowledge_dir)\n\n    # Parse skills directory (skill ecosystem with category/type nodes + related_skill edges)\n\n[222 more lines in file. Use offset=2260 to continue.]"}],"isError":false,"timestamp":1777539410933}}
{"type":"message","id":"4857fde6","parentId":"0fb4d605","timestamp":"2026-04-30T08:57:37.394Z","message":{"role":"assistant","content":[{"type":"thinking","thinking":"Now I understand the full picture. The warm load path is: lru_cache on `_cached_build_builder` returns a `GraphBuilder` object with nodes, edges, adj, etc. The pickle cache stores the raw data for persistence across processes, but the lru_cache is process-local.\n\nWhen I add a reachability matrix, I need to:\n1. Compute it in `build_adjacency` (after adj is built)\n2. Store it as `self.reachable` — a dict mapping node_id → frozenset of reachable node_ids\n3. Include it in `_save_graph_cache`\n4. Include it in the cached builder return (it will be a GraphBuilder attribute)\n\n\n5. The warm load will deserialize this data in about 0.03ms regardless of graph size, but pre-computing the reachability matrix could be expensive since it requires BFS from each node — O(n * (n + m)) for n nodes and m edges, which might take several milliseconds even with optimizations. Adding this to the cold path would slow down the initial build without affecting the warm load performance. The lru_cache stores the GraphBuilder object itself, not the raw tuples, so the benchmark's second call just reconstructs the object from cached attributes—basically a dictionary copy and object instantiation, which stays at 0.03ms regardless of graph size. So the reachability matrix computation won't meaningfully impact warm load performance either way.\n\nThe real question is whether computing this matrix during the cold build adds enough overhead to push the benchmark metric higher, and whether the metric even captures cold build time or just warm cache hits. Let me look at the benchmark code to see how it's actually measuring this. The second call to `build_graph` hits the lru_cache and reconstructs the builder in about 0.03ms regardless of its complexity, while the first call computes and stores the pickle. So adding reachability computation to `build_adjacency` would only slow down the initial cache miss, not the timed measurement.\n\nNow I'm looking at how the pickle cache is actually structured to understand what gets serialized across process boundaries. The cold path runs once per process and takes a few milliseconds, while the warm path stays at 0.03ms regardless of graph size due to caching. Adding the reachability matrix computation would slow down the cold path significantly—potentially 10-30ms for a graph with 1,430 nodes—but wouldn't affect the timed warm runs, so I need to weigh whether this architectural change is worth the trade-off.\n\nI'm reconsidering what would actually improve the primary metric. The warm load is already hitting noise floor at 0.03ms, which represents the cache lookup overhead itself. To meaningfully improve this, I'd need to either reduce that lookup cost—which is just Python dictionary operations and object reconstruction—or move more work into the cold path, but that doesn't help the benchmark since it only measures warm runs. The lru_cache is already saturating at 0.03ms, so adding expensive computations to the cold path won't budge the metric. I'm exploring whether there's a way to modify the benchmark itself to measure something more meaningful, but I'm constrained to only making one targeted code change without touching the benchmark script. The real issue is that my change needs to improve the primary metric to count as \"keep,\" yet everything at this point either doesn't affect warm load or would slow it down instead.\n\nLet me think through what's actually possible: I could modify the benchmark to measure cold build time instead of warm load, which would reward adding richer data and show measurable improvement, but that's cheating. Or I could add a cache at the dictionary-copy level, though that's essentially what lru_cache already does. The warm load path is already hitting bare Python overhead at 0.03ms, so there's almost no room left to optimize without fundamentally changing what we're measuring. I'm realizing the metric won't improve from parsing more data since the warm load stays constant, but skipping the pickle cache entirely and using the cached builder directly might shave off a microsecond or two. Let me trace through the current timing more carefully to see if there's actually any room for improvement. I see the issue now—when `build_graph` returns the same cached builder instance on the second call, the `builder, _` unpacking doesn't actually create a new object, just returns the reference. Let me try a different approach: what if I store additional metadata in the cached builder itself rather than relying on pickle deserialization?\n\nThe `adj` structure gets reconstructed as a plain dict during unpickling, which means the defaultdict behavior is lost and it becomes a regular dict with `.get()` fallback. I'm wondering if there's a way to preserve that or optimize the reconstruction...\n\nActually, adding a reachability matrix to the builder and including it in the pickle cache would let me answer \"is X reachable from Y\" queries instantly without computing them each time. The second benchmark call would just deserialize this precomputed structure along with the builder. This is architecturally useful, but it won't improve the primary metric since warm load is already noise-floor limited. Still, I'm running out of options that would actually move the needle.\n\nLet me reconsider what's possible: I could cache the adjacency dict itself rather than recomputing it on deserialization, but that adds code complexity. Or I could avoid the defaultdict-to-dict conversion entirely. But really, the warm load is already hitting the noise floor at 0.03ms—the bare minimum Python overhead. The primary metric won't improve further. So maybe I should focus on expanding the graph's richness instead: I could parse config.yaml to add hermes plugin nodes and edges, creating a richer world model without affecting warm load time.\n\nThe problem is the benchmark measures warm load, not cold load, so richer data won't change the metric either. The primary metric is fundamentally saturated at 0.03ms. Even though I can't improve it further, I should still make a meaningful architectural change—adding a reachability matrix seems like the best option since it adds real query capability and won't affect the warm load timing anyway.\n\nLet me verify the benchmark won't catch a cold build first, then implement the reachability matrix as a frozenset mapping for O(1) reachability queries.","thinkingSignature":"00492cebec220d71769b68bca4773217f2751799d57eb0b9bce7a15379751715"},{"type":"text","text":"Primary metric noise floor saturated at 0.03ms. Let me check if the benchmark ever triggers cold build:\n"},{"type":"toolCall","id":"call_function_uwd4crk1opvi_1","name":"bash","arguments":{"command":"cd /home/ubuntu/.hermes/agi && python3 -c \"\nimport time\nfrom graph_builder import _cached_build_builder, _get_graph_cache_file\nimport os\nhermes = os.path.expanduser('~/.hermes')\nagi = '/home/ubuntu/.hermes/agi'\n\n# Clear lru_cache to simulate cold\n_cached_build_builder.cache_clear()\nstart = time.perf_counter()\nb = _cached_build_builder(hermes, agi, 0)\ncold_ms = (time.perf_counter() - start) * 1000\n\n# Warm call (from cache)\nstart = time.perf_counter()\nb2 = _cached_build_builder(hermes, agi, 0)\nwarm_ms = (time.perf_counter() - start) * 1000\nprint(f'Cold: {cold_ms:.3f}ms, Warm: {warm_ms:.3f}ms, ratio: {cold_ms/warm_ms:.0f}x')\nprint(f'Cache file: {os.path.exists(_get_graph_cache_file(agi))}')\n\" 2>/dev/null"}}],"api":"anthropic-messages","provider":"minimax","model":"MiniMax-M2.7","usage":{"input":16880,"output":1539,"cacheRead":10071,"cacheWrite":0,"totalTokens":28490,"cost":{"input":0.005064,"output":0.0018468,"cacheRead":0.0006042599999999999,"cacheWrite":0,"total":0.00751506}},"stopReason":"toolUse","timestamp":1777539410934,"responseId":"06424c53498c9a56d3f0c07facea811d"}}
{"type":"message","id":"b6938867","parentId":"4857fde6","timestamp":"2026-04-30T08:57:37.571Z","message":{"role":"toolResult","toolCallId":"call_function_uwd4crk1opvi_1","toolName":"bash","content":[{"type":"text","text":"Cold: 128.318ms, Warm: 0.002ms, ratio: 68251x\nCache file: True\n"}],"isError":false,"timestamp":1777539457571}}
{"type":"message","id":"41be1a16","parentId":"b6938867","timestamp":"2026-04-30T08:57:57.210Z","message":{"role":"assistant","content":[{"type":"thinking","thinking":"Cold: 128ms, Warm: 0.002ms. The benchmark times the warm call at 0.03ms. So any code change I make won't affect the warm load (it stays at ~0.03ms noise floor).\n\nNow I need to make one code change and hope for a \"keep\" status. The problem is:\n1. Adding anything expensive to the cold path won't help the warm benchmark\n2. Adding anything to the warm path could slow it down\n\nWait, but looking at the warm time — it's 0.002ms! That's even faster than the benchmark's 0.03ms measurement. \n\nSo the benchmark overhead itself is eating up the difference. The actual warm lookup takes 0.002ms, and when the benchmark times it, it comes out to 0.03ms because of the overhead in calling `build_graph` and doing the unpacking. But here's the key: the lru_cache stores the GraphBuilder object itself, and what I'm unpacking is the same cached object on the second call.\n\nLooking at the code more carefully, when I do `builder, _ = build_graph(...)` the second time, I'm just getting back the same GraphBuilder instance that was cached, not creating a new one. The `_cached_build_builder` function returns the builder with all its attributes—the nodes list, edges list, adjacency dict, and node_ids set already populated from the first call. When the benchmark unpacks this, it gets that same object with everything already built out. I think what's actually happening is that `_save_graph_cache` is being called to persist the builder state to a pickle file, which would explain why the second call is slower even though it should be cached.\n\nWait, I'm seeing the real issue now — `build_graph` always calls `_save_graph_cache` after building, so on the second invocation when the lru_cache hits, it still writes to disk even though it's pulling from memory. That pickle write operation is probably what's accounting for the time difference between the warm and cold calls. The `builder, _ = build_graph(...)` call on the second iteration unpacks to the cached builder instance, then `nodes = builder.nodes` is just a reference lookup. The real question is whether `build_graph` itself does anything after returning the builder that could affect timing, so I need to trace through what happens after the unpacking to see where the overhead actually is.\n\nLooking at the `build_graph` function, it returns the builder and gitnexus_hash, then conditionally saves the cache to disk if certain conditions are met—the cache file doesn't exist, the hash differs, or the builder's node count exceeds a threshold. On the second warm call, the cache file already exists and the hash matches, so it skips the save operation entirely.\n\nWait, I'm realizing that `gitnexus_hash` is actually a computed value derived from the cache content itself, not just a simple comparison. Let me trace through how it's actually calculated.","thinkingSignature":"1da3f4ae9761edbdbc979be82e6812ee4d675edd209c2efd0cb4105ab3d386a1"},{"type":"toolCall","id":"call_function_qi111oi14f8l_1","name":"read","arguments":{"path":"/home/ubuntu/.hermes/agi/graph_builder.py","offset":2320,"limit":60}}],"api":"anthropic-messages","provider":"minimax","model":"MiniMax-M2.7","usage":{"input":18462,"output":664,"cacheRead":10071,"cacheWrite":0,"totalTokens":29197,"cost":{"input":0.005538599999999999,"output":0.0007968,"cacheRead":0.0006042599999999999,"cacheWrite":0,"total":0.006939659999999999}},"stopReason":"toolUse","timestamp":1777539457572,"responseId":"06424c82dfbda231197b51dcfeb3a374"}}
{"type":"message","id":"a05a9f8f","parentId":"41be1a16","timestamp":"2026-04-30T08:57:57.213Z","message":{"role":"toolResult","toolCallId":"call_function_qi111oi14f8l_1","toolName":"read","content":[{"type":"text","text":"    # Return builder directly — lru_cache on GraphBuilder means warm calls are O(1) object return\n    return builder\n\n\ndef build_graph(hermes_dir: str, agi_dir: str, use_gitnexus: bool = True,\n                 gitnexus_cache: Optional[str] = None) -> Tuple[GraphBuilder, float]:\n    \"\"\"Main graph building function with lru_cache for warm calls.\"\"\"\n    start = time.perf_counter()\n\n    # Get gitnexus hash for cache busting\n    gitnexus_hash = 0\n    gitnexus_cache_file = os.path.join(agi_dir, \".gitnexus_cache.json\")\n    if os.path.exists(gitnexus_cache_file):\n        try:\n            gitnexus_hash = os.path.getsize(gitnexus_cache_file)\n        except Exception:\n            pass\n\n    # Try lru_cache first (no pickle.load) — bump _cache_ver to bust cache after code/data changes\n    try:\n        builder = _cached_build_builder(hermes_dir, agi_dir, gitnexus_hash, _cache_ver=10)\n        elapsed_ms = (time.perf_counter() - start) * 1000\n        return builder, elapsed_ms\n    except Exception:\n        pass\n\n    # Fallback: try pickle cache\n    init_cache(agi_dir)\n    cache_to_use = gitnexus_cache\n    builder = _try_load_graph_cache(agi_dir, {}, gitnexus_cache)\n    if builder is not None:\n        elapsed_ms = (time.perf_counter() - start) * 1000\n        return builder, elapsed_ms\n\n    # Cold build path\n    init_cache(agi_dir)\n    builder = GraphBuilder()\n\n    # Parse AGENTS.md\n    agents_md = os.path.join(hermes_dir, \"belam-codex\", \"AGENTS.md\")\n    builder.parse_agents_md(agents_md)\n\n    # Parse memory files (expanded to all 58)\n    memory_dir = os.path.join(hermes_dir, \"belam-codex\", \"memory\")\n    builder.parse_memory_files(memory_dir, limit=58)\n\n    # Parse schema files\n    schema_dir = os.path.join(hermes_dir, \"belam-codex\", \"schemas\")\n    builder.parse_schema_files(schema_dir)\n\n    # Parse decisions (all 128 files)\n    decisions_dir = os.path.join(hermes_dir, \"belam-codex\", \"decisions\")\n    if os.path.isdir(decisions_dir):\n        builder.parse_decisions(decisions_dir, limit=999)\n\n    # Parse lessons (all 208 files)\n    lessons_dir = os.path.join(hermes_dir, \"belam-codex\", \"lessons\")\n    if os.path.isdir(lessons_dir):\n        builder.parse_lessons(lessons_dir, limit=999)\n\n\n[102 more lines in file. Use offset=2380 to continue.]"}],"isError":false,"timestamp":1777539477213}}
