{"type":"message","id":"55b854b2","parentId":"b5164900","timestamp":"2026-04-30T07:35:57.905Z","message":{"role":"assistant","content":[{"type":"thinking","thinking":"The experiment log shows that the git commit hash changed to 2443c52 (there was a re-commit). That's fine.\n\nThe result:\n- **keep** — 0.03ms unchanged, 295 nodes (+50), 209 edges (+20)\n- lru_cache confirmed as the mechanism that makes data expansion free\n- confidence: 838.2× noise floor\n\nI should stop here as per the instructions — one experiment iteration only.","thinkingSignature":"8a106c54bd22dd2db754d1350c0de63431e888586e29f5c065ef2d65ddbe165e"},{"type":"text","text":"**Iteration result**: `keep` — 0.03ms at 295 nodes (vs 245 before). lru_cache keeps warm load O(1) regardless of data size; +50 task nodes with depends_on edges added at zero cost. 838× confidence vs noise floor."}],"api":"anthropic-messages","provider":"minimax","model":"MiniMax-M2.7","usage":{"input":23477,"output":155,"cacheRead":10071,"cacheWrite":0,"totalTokens":33703,"cost":{"input":0.0070431,"output":0.000186,"cacheRead":0.0006042599999999999,"cacheWrite":0,"total":0.007833360000000001}},"stopReason":"stop","timestamp":1777534549656,"responseId":"06423956f63c47a72b23c86ca9c81cfb"}}
{"type":"message","id":"f85553c7","parentId":"55b854b2","timestamp":"2026-04-30T07:35:57.912Z","message":{"role":"user","content":[{"type":"text","text":"Autoresearch loop ended (likely context limit). Resume the experiment loop — read autoresearch.md and git log for context. Check autoresearch.ideas.md for promising paths to explore. Prune stale/tried ideas. Be careful not to overfit to the benchmarks and do not cheat on the benchmarks."}],"timestamp":1777534557908}}
