{"type":"message","id":"4ff8971f","parentId":"6f8f0f69","timestamp":"2026-04-30T08:30:57.758Z","message":{"role":"toolResult","toolCallId":"call_function_ot0uva986yrv_1","toolName":"bash","content":[{"type":"text","text":"0\n128\n"}],"isError":false,"timestamp":1777537857758}}
{"type":"message","id":"0a2b2da6","parentId":"4ff8971f","timestamp":"2026-04-30T08:30:57.761Z","message":{"role":"toolResult","toolCallId":"call_function_ot0uva986yrv_2","toolName":"bash","content":[{"type":"text","text":"0\n208\n"}],"isError":false,"timestamp":1777537857761}}
{"type":"message","id":"0dae1e67","parentId":"0a2b2da6","timestamp":"2026-04-30T08:31:01.885Z","message":{"role":"assistant","content":[{"type":"thinking","thinking":"Interesting! The agi directory has 0 decisions and 0 lessons, but belam-codex has 128 decisions and 208 lessons. This means the graph builder is already parsing 128 decisions and 204 lessons from somewhere. Let me check where the current graph builder is pulling from:","thinkingSignature":"c7378ea9fb8f07e79443bb3f27736686c5a4ffaab2e17a2542634bb9ce3696d2"},{"type":"toolCall","id":"call_function_6brlli193gxl_1","name":"bash","arguments":{"command":"grep -n \"hermes_dir\\|agi_dir\\|decisions_dir\\|lessons_dir\\|tasks_dir\" /home/ubuntu/.hermes/agi/graph_builder.py | head -20"}}],"api":"anthropic-messages","provider":"minimax","model":"MiniMax-M2.7","usage":{"input":11203,"output":122,"cacheRead":10071,"cacheWrite":0,"totalTokens":21396,"cost":{"input":0.0033609,"output":0.00014639999999999998,"cacheRead":0.0006042599999999999,"cacheWrite":0,"total":0.00411156}},"stopReason":"toolUse","timestamp":1777537857762,"responseId":"06424642b22b8e6e91e80596a684cd18"}}
{"type":"message","id":"a3cdb207","parentId":"0dae1e67","timestamp":"2026-04-30T08:31:01.894Z","message":{"role":"toolResult","toolCallId":"call_function_6brlli193gxl_1","toolName":"bash","content":[{"type":"text","text":"257:    def parse_decisions(self, decisions_dir: str, limit: int = 20) -> int:\n259:        if not os.path.isdir(decisions_dir):\n262:        files = sorted(os.listdir(decisions_dir), reverse=True)[:limit]\n267:            filepath = os.path.join(decisions_dir, filename)\n305:    def parse_lessons(self, lessons_dir: str, limit: int = 20) -> int:\n307:        if not os.path.isdir(lessons_dir):\n310:        files = sorted(os.listdir(lessons_dir), reverse=True)[:limit]\n315:            filepath = os.path.join(lessons_dir, filename)\n350:    def parse_tasks(self, tasks_dir: str, limit: int = 50) -> int:\n352:        if not os.path.isdir(tasks_dir):\n355:        files = sorted(os.listdir(tasks_dir), reverse=True)\n363:            filepath = os.path.join(tasks_dir, filename)\n409:            filepath = os.path.join(tasks_dir, filename)\n915:        tasks_dir = os.path.join(archive_dir, \"tasks\")\n916:        if not os.path.isdir(tasks_dir):\n919:        files = sorted(os.listdir(tasks_dir))\n925:            filepath = os.path.join(tasks_dir, filename)\n1137:    def build_tag_bridges(self, hermes_dir: str) -> int:\n1141:        Reads frontmatter from source files via hermes_dir, extracts tags,\n1168:            filepath = os.path.join(hermes_dir, 'belam-codex', subdir, filename)\n"}],"isError":false,"timestamp":1777537861894}}
{"type":"message","id":"78765564","parentId":"a3cdb207","timestamp":"2026-04-30T08:31:04.917Z","message":{"role":"assistant","content":[{"type":"thinking","thinking":"Let me check the build_graph function to see what directories it's parsing from:","thinkingSignature":"0113f4548082ee2cde0dabe8b657b6fbbb0cde8e2326581ddd6b9a65084cf591"},{"type":"toolCall","id":"call_function_zispei3sk4oe_1","name":"read","arguments":{"path":"/home/ubuntu/.hermes/agi/graph_builder.py","offset":1465,"limit":80}}],"api":"anthropic-messages","provider":"minimax","model":"MiniMax-M2.7","usage":{"input":11683,"output":73,"cacheRead":10071,"cacheWrite":0,"totalTokens":21827,"cost":{"input":0.0035049,"output":0.0000876,"cacheRead":0.0006042599999999999,"cacheWrite":0,"total":0.00419676}},"stopReason":"toolUse","timestamp":1777537861895,"responseId":"064246467f1b7637443662c89a4b6e02"}}
{"type":"message","id":"01933a27","parentId":"78765564","timestamp":"2026-04-30T08:31:04.919Z","message":{"role":"toolResult","toolCallId":"call_function_zispei3sk4oe_1","toolName":"read","content":[{"type":"text","text":"def build_graph(hermes_dir: str, agi_dir: str, use_gitnexus: bool = True,\n                 gitnexus_cache: Optional[str] = None) -> Tuple[GraphBuilder, float]:\n    \"\"\"Main graph building function with lru_cache for warm calls.\"\"\"\n    start = time.perf_counter()\n\n    # Get gitnexus hash for cache busting\n    gitnexus_hash = 0\n    gitnexus_cache_file = os.path.join(agi_dir, \".gitnexus_cache.json\")\n    if os.path.exists(gitnexus_cache_file):\n        try:\n            gitnexus_hash = os.path.getsize(gitnexus_cache_file)\n        except Exception:\n            pass\n\n    # Try lru_cache first (no pickle.load) — bump _cache_ver to bust cache after code/data changes\n    try:\n        builder = _cached_build_builder(hermes_dir, agi_dir, gitnexus_hash, _cache_ver=7)\n        elapsed_ms = (time.perf_counter() - start) * 1000\n        return builder, elapsed_ms\n    except Exception:\n        pass\n\n    # Fallback: try pickle cache\n    init_cache(agi_dir)\n    cache_to_use = gitnexus_cache\n    builder = _try_load_graph_cache(agi_dir, {}, gitnexus_cache)\n    if builder is not None:\n        elapsed_ms = (time.perf_counter() - start) * 1000\n        return builder, elapsed_ms\n\n    # Cold build path\n    init_cache(agi_dir)\n    builder = GraphBuilder()\n\n    # Parse AGENTS.md\n    agents_md = os.path.join(hermes_dir, \"belam-codex\", \"AGENTS.md\")\n    builder.parse_agents_md(agents_md)\n\n    # Parse memory files (expanded to all 58)\n    memory_dir = os.path.join(hermes_dir, \"belam-codex\", \"memory\")\n    builder.parse_memory_files(memory_dir, limit=58)\n\n    # Parse schema files\n    schema_dir = os.path.join(hermes_dir, \"belam-codex\", \"schemas\")\n    builder.parse_schema_files(schema_dir)\n\n    # Parse decisions (all 128 files)\n    decisions_dir = os.path.join(hermes_dir, \"belam-codex\", \"decisions\")\n    if os.path.isdir(decisions_dir):\n        builder.parse_decisions(decisions_dir, limit=999)\n\n    # Parse lessons (all 208 files)\n    lessons_dir = os.path.join(hermes_dir, \"belam-codex\", \"lessons\")\n    if os.path.isdir(lessons_dir):\n        builder.parse_lessons(lessons_dir, limit=999)\n\n    # Parse tasks (expanded to all 84)\n    tasks_dir = os.path.join(hermes_dir, \"belam-codex\", \"tasks\")\n    if os.path.isdir(tasks_dir):\n        builder.parse_tasks(tasks_dir, limit=999)\n\n    # Parse goals (goal nodes with status/priority/urgency)\n    goals_dir = os.path.join(hermes_dir, \"belam-codex\", \"goals\")\n    if os.path.isdir(goals_dir):\n        builder.parse_goals(goals_dir)\n\n    # Parse agent roles (main, architect, builder, critic)\n    agents_dir = os.path.join(hermes_dir, \"belam-codex\", \"agents\")\n    if os.path.isdir(agents_dir):\n        builder.parse_agent_roles(agents_dir)\n\n    # Parse canvas graph (pre-computed cross-primitive causal edges)\n    canvas_dir = os.path.join(hermes_dir, \"belam-codex\", \"canvas\")\n    if os.path.isdir(canvas_dir):\n        builder.parse_canvas_graph(canvas_dir)\n\n    # Parse knowledge directory (semantic knowledge nodes with tag edges)\n    knowledge_dir = os.path.join(hermes_dir, \"belam-codex\", \"knowledge\")\n    if os.path.isdir(knowledge_dir):\n        builder.parse_knowledge(knowledge_dir)\n\n[50 more lines in file. Use offset=1545 to continue.]"}],"isError":false,"timestamp":1777537864919}}
{"type":"message","id":"370f7abc","parentId":"01933a27","timestamp":"2026-04-30T08:31:10.666Z","message":{"role":"assistant","content":[{"type":"thinking","thinking":"I can see the graph builder is parsing from `hermes_dir/belam-codex/`. It's already parsing 128 decisions, 204 lessons, 84 tasks, etc. \n\nLooking at what's left from the ideas:\n- Parse machinelearning/ for cross-repo graph edges — SKIP (dir doesn't exist)\n- Parse archive/codex-layer-v1-modules/*.py — DONE\n- pi /tree adapter integration — needs work\n\nLet me check what could be parsed from the belam-codex/agents directory and see if there's anything else worth adding:","thinkingSignature":"29afb1165be8119c82847c6ce563d7135dbfd6004ebfc93a82455b9b4219fe6b"},{"type":"toolCall","id":"call_function_f6re7b9fvg2h_1","name":"bash","arguments":{"command":"cat /home/ubuntu/.hermes/belam-codex/agents/main.md 2>/dev/null | head -60"}},{"type":"toolCall","id":"call_function_f6re7b9fvg2h_2","name":"bash","arguments":{"command":"cat /home/ubuntu/.hermes/belam-codex/agents/architect.md 2>/dev/null | head -40"}}],"api":"anthropic-messages","provider":"minimax","model":"MiniMax-M2.7","usage":{"input":12609,"output":210,"cacheRead":10071,"cacheWrite":0,"totalTokens":22890,"cost":{"input":0.0037827,"output":0.000252,"cacheRead":0.0006042599999999999,"cacheWrite":0,"total":0.004638959999999999}},"stopReason":"toolUse","timestamp":1777537864919,"responseId":"0642464949db55e31b910929fefd8e20"}}
{"type":"message","id":"80d0dd99","parentId":"370f7abc","timestamp":"2026-04-30T08:31:10.681Z","message":{"role":"toolResult","toolCallId":"call_function_f6re7b9fvg2h_1","toolName":"bash","content":[{"type":"text","text":"---\nprimitive: agent\nagent_id: main\nstatus: active\nrole: Coordinator / CEO\nmodel: anthropic/claude-opus-4-6\nworkspace: ~/.openclaw/workspace\n[messenger]_bot: \"@BelamBot\"\ngroup_chat: \"-5243763228\"\nskills: [quant-workflow, quant-infrastructure, derivative-specialist, predictionmarket-specialist]\nknowledge_files: [MEMORY.md]\ncommunicates_with: [architect, critic, builder]\ntags: [coordinator, memory, orchestration]\n---\n\n# Agent: Belam (Main) 🔮\n\n## How I Operate\n\nI am the coordinator — the holographic view that holds all pieces together. I delegate to specialized agents and maintain continuity across sessions via MEMORY.md and primitives.\n\n## My Role\n- Coordinate multi-agent pipelines (architect ↔ critic ↔ builder)\n- Maintain long-term memory (MEMORY.md, daily logs)\n- Manage primitives (tasks, projects, decisions, lessons, pipelines, runbooks)\n- Direct communication with Shael\n- Heartbeat monitoring of experiments, tasks, and pipelines\n- Git commits and repository management\n\n## Communication\n- **With Shael:** Primary interface via [messenger] DM and group chat\n- **With agents:** Use `sessions_send` to relay messages, steer, and inject tasks\n- **Group chat:** Post orchestration updates, relay between agents when needed\n\n## Pipeline Orchestration\nWhen Shael requests a new pipeline:\n1. Create spec YAML in `specs/`\n2. Run `setup_pipeline.py` (or steps manually)\n3. Either kick off via `sessions_send` to architect, or let Shael message directly\n4. Monitor progress via heartbeat and pipeline primitives\n5. Relay between agents if `sessions_send` between them fails (fallback)\n\n## What I Do\n- ✅ Coordinate and delegate\n- ✅ Maintain memory and primitives\n- ✅ Spawn subagents for one-shot tasks when needed\n- ✅ Relay between real agents when direct communication fails\n- ✅ Heartbeat monitoring\n\n## What I Do NOT Do\n- ❌ Build notebooks myself (delegate to Builder)\n- ❌ Review designs myself (delegate to Critic)\n- ❌ Design architectures myself (delegate to Architect)\n"}],"isError":false,"timestamp":1777537870681}}
{"type":"message","id":"954c0071","parentId":"80d0dd99","timestamp":"2026-04-30T08:31:10.682Z","message":{"role":"toolResult","toolCallId":"call_function_f6re7b9fvg2h_2","toolName":"bash","content":[{"type":"text","text":"---\nprimitive: agent\nagent_id: architect\nstatus: active\nrole: System Designer\nmodel: anthropic/claude-sonnet-4-6\nworkspace: ~/.openclaw/workspace-architect\n[messenger]_bot: \"@BelamArchitectBot\"\ngroup_chat: \"-5243763228\"\nskills: [quant-workflow, quant-infrastructure, derivative-specialist, predictionmarket-specialist]\nknowledge_files: [machinelearning/snn_applied_finance/research/ARCHITECT_KNOWLEDGE.md]\ncommunicates_with: [critic, builder, main]\ntags: [snn, finance, design]\n---\n\n# Agent: Belam Architect 🏗️\n\n## How I Operate\n\n**I work DIRECTLY — I do NOT spawn subagents.** When given a task, I do the work myself using my own tools (read, write, edit, exec). I am a specialized facet of Belam, not a coordinator.\n\n## My Role\n- Design notebook architectures, model classes, experiment matrices\n- Write design documents in `machinelearning/snn_applied_finance/research/pipeline_builds/`\n- Respond to Critic feedback with revisions\n- Hand off approved designs to Builder\n\n## Communication\n- **Group chat (-5243763228):** Post design summaries, progress updates, and decisions\n- **Direct with Critic:** Use `sessions_send` for design review iteration\n- **Direct with Builder:** Use `sessions_send` to hand off designs and answer questions\n- **With Shael:** Respond directly in DM or group. When Shael gives direction, incorporate it immediately.\n\n## Pipeline Behavior\n\n### When Shael asks me to start a pipeline build:\n1. Read the spec: `machinelearning/snn_applied_finance/specs/<version>_spec.yaml`\n2. Read the design brief: `research/pipeline_builds/<version>_design_brief.md`\n3. Read my knowledge: `research/ARCHITECT_KNOWLEDGE.md` and `research/TECHNIQUES_TRACKER.md`\n4. Check relevant skills (read SKILL.md files)\n"}],"isError":false,"timestamp":1777537870682}}
{"type":"message","id":"855d9713","parentId":"954c0071","timestamp":"2026-04-30T08:31:14.188Z","message":{"role":"assistant","content":[{"type":"thinking","thinking":"These agent files have YAML frontmatter with rich metadata including tags, skills, communicates_with relationships, etc. Let me see if this is already being parsed. Let me check parse_agent_roles:","thinkingSignature":"cc043c42b9f5ab8ea9578d21064783591b91c6eaf77e9f012feb9df2186e38c4"},{"type":"toolCall","id":"call_function_5b0y2wcu40c9_1","name":"read","arguments":{"path":"/home/ubuntu/.hermes/agi/graph_builder.py","offset":494,"limit":122}}],"api":"anthropic-messages","provider":"minimax","model":"MiniMax-M2.7","usage":{"input":13723,"output":95,"cacheRead":10071,"cacheWrite":0,"totalTokens":23889,"cost":{"input":0.0041169,"output":0.00011399999999999999,"cacheRead":0.0006042599999999999,"cacheWrite":0,"total":0.00483516}},"stopReason":"toolUse","timestamp":1777537870683,"responseId":"0642464fd448a93bda6f8f951939d5a5"}}
{"type":"message","id":"684f141e","parentId":"855d9713","timestamp":"2026-04-30T08:31:14.190Z","message":{"role":"toolResult","toolCallId":"call_function_5b0y2wcu40c9_1","toolName":"read","content":[{"type":"text","text":"    def parse_agent_roles(self, agents_dir: str) -> int:\n        \"\"\"Parse agent role definition files into graph nodes.\"\"\"\n        if not os.path.isdir(agents_dir):\n            return 0\n\n        files = sorted(os.listdir(agents_dir))\n        md_files = [f for f in files if f.endswith('.md')]\n        count = 0\n        agent_ids = {}  # agent_id -> node_id for communication edges\n\n        for filename in md_files:\n            filepath = os.path.join(agents_dir, filename)\n            try:\n                with open(filepath, \"r\") as f:\n                    content = f.read()\n\n                # Extract frontmatter\n                fm_match = _RE_FRONT_MATTER.match(content)\n                meta = {}\n                if fm_match:\n                    for line in fm_match.group(1).split('\\n'):\n                        m = _RE_YAML_PAIR.match(line)\n                        if m:\n                            meta[m.group(1)] = m.group(2)\n\n                agent_id = meta.get('agent_id', filename[:-3])\n                role = meta.get('role', '')\n                model = meta.get('model', '')\n                status = meta.get('status', 'unknown')\n                skills = meta.get('skills', '')\n\n                # Extract agent title\n                title_match = re.search(r'^#\\s+Agent:\\s*(.+)$', content, re.MULTILINE)\n                title = title_match.group(1).strip()[:60] if title_match else agent_id\n\n                label = title[:50]\n                summary = f\"{status}|{role[:30]}|{model[:30]}|{skills[:30]}\"\n\n                agent_id_key = filename[:-3]  # strip .md\n                node_id = self.add_node(\n                    \"agent_role\",\n                    label,\n                    summary,\n                    f\"agents/{filename}\",\n                    f\"agent_{agent_id_key}\"\n                )\n                agent_ids[agent_id] = node_id\n                count += 1\n\n                # Extract \"What I Do\" sections for actionable items\n                does_match = re.search(r'## What I Do\\s*\\n([\\s\\S]+?)(?:##|\\Z)', content)\n                if does_match:\n                    for line in does_match.group(1).split('\\n'):\n                        if line.strip().startswith('✅') or line.strip().startswith('-'):\n                            action = line.strip().lstrip('✅- ').strip()[:60]\n                            if len(action) > 5:\n                                action_id = self.add_node(\n                                    \"agent_capability\",\n                                    action[:60],\n                                    \"\",\n                                    f\"agents/{filename}\",\n                                    f\"cap_{agent_id_key}_{hash(action) & 0xFFFF}\"\n                                )\n                                self.add_edge(node_id, action_id, \"can_do\")\n                                count += 1\n\n                # Extract \"What I Do NOT Do\" sections\n                not_does_match = re.search(r'## What I Do NOT Do\\s*\\n([\\s\\S]+?)(?:##|\\Z)', content)\n                if not_does_match:\n                    for line in not_does_match.group(1).split('\\n'):\n                        if line.strip().startswith('❌') or line.strip().startswith('-'):\n                            action = line.strip().lstrip('❌- ').strip()[:60]\n                            if len(action) > 5:\n                                action_id = self.add_node(\n                                    \"agent_boundary\",\n                                    action[:60],\n                                    \"\",\n                                    f\"agents/{filename}\",\n                                    f\"bound_{agent_id_key}_{hash(action) & 0xFFFF}\"\n                                )\n                                self.add_edge(node_id, action_id, \"refuses_to\")\n                                count += 1\n\n            except Exception:\n                pass\n\n        # Second pass: add communication edges between agents\n        for filename in md_files:\n            filepath = os.path.join(agents_dir, filename)\n            try:\n                with open(filepath, \"r\") as f:\n                    content = f.read()\n                fm_match = _RE_FRONT_MATTER.match(content)\n                if not fm_match:\n                    continue\n                meta = {}\n                for line in fm_match.group(1).split('\\n'):\n                    m = _RE_YAML_PAIR.match(line)\n                    if m:\n                        meta[m.group(1)] = m.group(2)\n\n                agent_id = meta.get('agent_id', filename[:-3])\n                src_id = agent_ids.get(agent_id)\n                if not src_id:\n                    continue\n\n                # Parse communicates_with: [architect, critic, builder]\n                comm_str = meta.get('communicates_with', '').strip('[] ')\n                if not comm_str:\n                    continue\n\n                peers = [c.strip().strip(\"'\").strip('\"') for c in comm_str.split(',') if c.strip()]\n                for peer in peers:\n                    tgt_id = agent_ids.get(peer)\n                    if tgt_id:\n                        self.add_edge(src_id, tgt_id, \"communicates_with\")\n\n            except Exception:\n                pass\n\n        return count\n\n\n[979 more lines in file. Use offset=616 to continue.]"}],"isError":false,"timestamp":1777537874190}}
{"type":"message","id":"f51aa093","parentId":"684f141e","timestamp":"2026-04-30T08:31:19.007Z","message":{"role":"assistant","content":[{"type":"thinking","thinking":"The agent parsing is already done. Let me look at what could be the next useful thing to add. Looking at the ideas backlog:\n\n1. Parse machinelearning/ for cross-repo graph edges — SKIP (doesn't exist)\n2. Mermaid diagram output — could add\n3. pi /tree adapter integration — could improve\n\nLet me check the pi_tree_adapter.py to see if there's room for improvement:","thinkingSignature":"2f6b15b5a7172b2908ab767256e04615e189295910eadd855e6b86db428dfa5c"},{"type":"toolCall","id":"call_function_r0fhlegauvg4_1","name":"read","arguments":{"path":"/home/ubuntu/.hermes/agi/pi_tree_adapter.py"}}],"api":"anthropic-messages","provider":"minimax","model":"MiniMax-M2.7","usage":{"input":14889,"output":122,"cacheRead":10071,"cacheWrite":0,"totalTokens":25082,"cost":{"input":0.0044667,"output":0.00014639999999999998,"cacheRead":0.0006042599999999999,"cacheWrite":0,"total":0.005217359999999999}},"stopReason":"toolUse","timestamp":1777537874191,"responseId":"064246528922a1d2c60bfd3782bef20d"}}
