{"type":"session","version":3,"id":"019ddd52-ffd6-7058-b89b-4b00833c5b20","timestamp":"2026-04-30T07:38:17.430Z","cwd":"/home/ubuntu/.hermes/agi"}
{"type":"model_change","id":"cc2a5b4f","parentId":null,"timestamp":"2026-04-30T07:38:21.410Z","provider":"minimax","modelId":"MiniMax-M2.7"}
{"type":"thinking_level_change","id":"b66dfd69","parentId":"cc2a5b4f","timestamp":"2026-04-30T07:38:21.410Z","thinkingLevel":"medium"}
{"type":"custom","customType":"plannotator","data":{"phase":"idle","planFilePath":"PLAN.md","savedState":null},"id":"331e0e65","parentId":"b66dfd69","timestamp":"2026-04-30T07:38:21.425Z"}
{"type":"message","id":"6b176b48","parentId":"331e0e65","timestamp":"2026-04-30T07:38:21.446Z","message":{"role":"user","content":[{"type":"text","text":"Resume the autoresearch loop in ~/.hermes/agi/.\n     Read ~/.hermes/agi/autoresearch.md (current state + what's been tried).\n     Run exactly ONE experiment iteration:\n       1. Make one code change (small, targeted)\n       2. git commit\n       3. run_experiment (./autoresearch.sh)\n       4. log_experiment (keep if improved, discard if not)\n     After log_experiment, stop — do NOT loop again.\n     Report iteration result in one line to stdout."}],"timestamp":1777534701431}}
{"type":"message","id":"f4be1efa","parentId":"6b176b48","timestamp":"2026-04-30T07:38:26.195Z","message":{"role":"assistant","content":[{"type":"thinking","thinking":"Let me start by reading the autoresearch.md file to understand the current state and what's been tried.","thinkingSignature":"3ec30c71e9523c33514cfaa3128e0122f0c1959ef7bf1c6bc0210ebac5c4e207"},{"type":"toolCall","id":"call_function_k9c43s6e1zjg_1","name":"read","arguments":{"path":"/home/ubuntu/.hermes/agi/autoresearch.md"}},{"type":"toolCall","id":"call_function_k9c43s6e1zjg_2","name":"read","arguments":{"path":"/home/ubuntu/.hermes/agi/autoresearch.ideas.md"}}],"api":"anthropic-messages","provider":"minimax","model":"MiniMax-M2.7","usage":{"input":55,"output":91,"cacheRead":10184,"cacheWrite":0,"totalTokens":10330,"cost":{"input":0.000016499999999999998,"output":0.0001092,"cacheRead":0.00061104,"cacheWrite":0,"total":0.0007367399999999999}},"stopReason":"toolUse","timestamp":1777534701459,"responseId":"064239eff154c141f3a2e0955cd375ff"}}
{"type":"message","id":"97a87118","parentId":"f4be1efa","timestamp":"2026-04-30T07:38:26.221Z","message":{"role":"toolResult","toolCallId":"call_function_k9c43s6e1zjg_1","toolName":"read","content":[{"type":"text","text":"# Autoresearch: DB-Augmented Directed Code Generation via Unified Graph Memory\n\n## Objective\n\nInvestigate using relational databases (Postgres-style linking/reference) as the backbone for agent-accessible knowledge graphs. Goal: enable agents to navigate code, memory, tasks, and ideas through a single unified graph interface that is equally readable by humans (ASCII art maps) and machines (structured DB queries).\n\nCore inspiration repos:\n- **GitNexus** (abhigyanpatwari) — graph-based code intelligence\n- **MemPalace** (MemPalace/mempalace) — agent memory graph\n- **llm-wiki-compiler** (atomicmemory) — wiki-to-graph pipeline\n- **LanguageAgentTreeSearch** (lapisrocks) — LATS-style reasoning\n- **SkillZero** (ZJU-REAL) — skill learning from graphs\n- **pi /tree** — pi CLI tree/graph rendering\n\nCore questions to explore:\n1. Can agents perceive ASCII visual graphs as efficiently as humans?\n2. Can we steer agents on CoT/reasoning paths using nothing but graphical-rendered maps?\n3. Can a single graph representation span episodic memories, coding ideas, task state, and world models?\n4. Can the \"soul\" (model) feel seamlessly embodied by the \"memory harness\" (graph)?\n5. The **holographic layer coupling** — how do we bind multiple context layers into a single coherent agent experience?\n\n## Metrics\n- **Primary**: `graph_build_time_ms` (ms, lower is better) — time to generate a graph from source state\n- **Secondary**: `graph_node_count` (nodes), `graph_edge_count` (edges), `query_time_ms` (DB query for path finding), `ascii_render_lines` (output length of rendered graph), `agent_comprehension_score` (manual 1-5 assessment per run in ASI)\n\n## How to Run\n`./autoresearch.sh` — outputs `METRIC name=number` lines.\n\n## Files in Scope\n\nAll files created under `.hermes/agi/`:\n- `schema.sql` — Postgres schema for the unified graph (nodes, edges, types, metadata)\n- `graph_builder.py` — builds graph from source material (codebases, memory files, task state)\n- `asciirender.py` — renders graph as ASCII art for agent/human consumption\n- `query_engine.py` — path finding, traversal, CoT graph-walking\n- `pi_tree_adapter.py` — adapter to feed graph output into pi's /tree feature\n- `experiments/` — subdirectory per experiment run storing inputs/outputs\n- `autoresearch.sh` — benchmark driver\n\n## Off Limits\n\n- Do not modify pi's internal source code\n- Do not touch the GitNexus index directly outside of normal git operations\n- No new system dependencies — use only Python stdlib + psycopg2-binary\n\n## Constraints\n\n- All generated code must be valid Python (no pseudocode in final output)\n- ASCII graph output must be ≤200 lines and ≤200 chars wide\n- DB schema must be Postgres-compatible (duckdb fallback OK for local runs)\n- pi subagent calls must be non-blocking and report results through ASI\n\n## What's Been Tried\n\n### Iteration 1-4: Performance Optimizations\n- **Baseline**: 377.21ms (55 nodes, 54 edges)\n- Pre-compiled regex patterns (minor improvement)\n- Gitnexus availability check (skip npx call if no index)\n- Persistent JSON cache file for gitnexus results\n- Cache loading moved before timing\n- **Result**: 0.37ms (75 nodes) — 1019x faster\n\n### Iteration 5-6: Modular System\n- Created `schema.sql` — Postgres-compatible graph schema\n- Created `graph_builder.py` — modular graph construction\n- Created `query_engine.py` — BFS/Dijkstra path finding\n- Created `asciirender.py` — ASCII art rendering\n- Created `pi_tree_adapter.py` — pi /tree integration\n- **Result**: 2.15ms (225 nodes) — 3x more data, still 175x faster than original\n\n### Node Composition (current — 245 nodes)\n- doc_section: 22 (from AGENTS.md)\n- code_reference: 27 (code snippets)\n- memory_session: 5 (episodic memories)\n- schema_entity: 10 (schema definitions)\n- schema_field: 141 (schema fields)\n- decision: 10 (decisions)\n- lesson: 10 (lessons)\n- gitnexus_definition: 20 (code symbols)\n- **Total**: 245 nodes, 189 edges\n\n### Noise Floor Surmounted (via lru_cache)\n- lru_cache on _cached_build() makes warm load O(1) memory lookup\n- Warm load time now independent of cached data size\n- Previous noise floor ~0.3-0.5ms (pickle.load) bypassed entirely\n- Cold build: ~3.8ms (not measured in benchmark)\n- Shift to: data expansion, query ops, or architectural changes (duckdb)\n\n### Files Created\n- `schema.sql` — Postgres/DuckDB graph schema\n- `graph_builder.py` — Modular graph builder (245 nodes, lru_cache)\n- `query_engine.py` — Path finding engine\n- `asciirender.py` — ASCII renderer\n- `pi_tree_adapter.py` — pi tree integration\n\n### Iteration 1 (this session): Restore graph richness + tuple verification\n- Restored 142 schema_field nodes (was accidentally removed in earlier optimization)\n- Extended gitnexus cache TTL 1hr → 24hr\n- Tuple nodes: 0.50ms→0.45ms at 225 nodes (10% faster, noise floor)\n- **Result**: 0.45ms (225 nodes, 189 edges) — **keep**\n\n### Baseline\n- Original: 377.21ms (55 nodes, 54 edges) — pure Python parsing\n- **Current best**: 0.03ms (245 nodes, 189 edges) — lru_cache + decisions/lessons, 12,574× faster than original\n"}],"isError":false,"timestamp":1777534706221}}
{"type":"message","id":"4acc9b7e","parentId":"97a87118","timestamp":"2026-04-30T07:38:26.222Z","message":{"role":"toolResult","toolCallId":"call_function_k9c43s6e1zjg_2","toolName":"read","content":[{"type":"text","text":"# Autoresearch Ideas — Pruned 2026-04-30\n\n## DONE — Archived\n- [x] Pre-compile regex patterns — iter 1-4\n- [x] Gitnexus availability check + JSON cache — iter 2-3\n- [x] Pickle-based graph cache with pre-warm — iter 7\n- [x] Tuple nodes (smaller pickle) — iter 9, 15, 16\n- [x] lru_cache on builder internals — iter 21 (MAJOR breakthrough)\n- [x] Add decisions + lessons with lru_cache — iter 22\n- [x] Parse tasks/ directory — iter 23\n- [x] msgpack/json/mmap/pickle protocol micro-optimizations — REGRESSIONs confirmed noise floor\n\n## SATURATED — Primary metric noise floor\nThe graph_build_time_ms metric is at 0.03ms (lru_cache warm load). This is:\n- 12,574× faster than original 377ms baseline\n- 838× confidence above noise floor\n- lru_cache makes warm load O(1) memory lookup regardless of node count\n- Further micro-optimizations: NO.\n- Serialization format experiments (pickle/json/msgpack): all REGRESSION or noise floor\n\n## NOW WORTHWHILE — Data Expansion (richer graph, same speed)\n- [ ] Parse all 84 tasks (remove 50-limit) — trivial expansion\n- [ ] Parse goals/ directory for goal nodes\n- [ ] Parse canvas/ directory for canvas state nodes  \n- [ ] Expand decisions/lessons beyond 10-limit (potential 300-400 nodes)\n- [ ] Parse state/ directory for runtime state nodes\n- [ ] Parse archive/ directory for archived files\n- [ ] Parse machinelearning/ for cross-repo graph edges\n\n## Architectural (secondary: query_time_ms, structural richness)\n- [ ] duckdb/sqlite3 backend — persistent graph DB with SQL query engine\n  - NOT for primary metric (warm load stays 0.03ms via lru_cache)\n  - Benefits: SQL traversal, reachability queries, complex joins\n  - Risk: adds dependency (sqlite3 stdlib OK, duckdb requires install)\n  - Approach: sqlite3 in-memory graph DB that rebuilds from lru_cache on startup\n- [ ] Bidirectional BFS in query_engine — faster path finding\n- [ ] Pre-compute reachability matrix — O(1) reachability queries\n\n## Visualization (secondary: ascii_render_lines, utility)\n- [ ] Mermaid diagram output — graphviz-free via text\n- [ ] Compact ASCII renderer — pack more nodes per line\n- [ ] pi /tree adapter — integrate with pi's built-in tree rendering\n\n## Interesting Findings\n- Gitnexus lbug file is NOT SQLite (header \"LBUG(\")\n- lru_cache is the key: warm load O(1), cold build ~3.8ms\n- Noise floor ~0.03-0.05ms for warm load (memory lookup)\n- pickle noise floor ~0.3-0.5ms (was the old ceiling before lru_cache)\n- 142 schema_field nodes accidentally removed then restored\n- gitnexus cache TTL 1hr → 24hr extended\n\n## Deferred (low priority / speculative)\n- Multi-repo graph (belam-codex + machinelearning cross-ref)\n- Embeddings-based semantic search for graph queries\n- LLM-based graph summarization\n- Incremental lru_cache invalidation (watch source files)\n\n## Current Best\n- 0.03ms (295 nodes, 209 edges) — lru_cache warm load, 12,574× vs original\n- Original: 377.21ms (55 nodes, 54 edges)\n- Node types: doc_section, code_ref, memory, schema_entity, schema_field,\n  decision, lesson, gitnexus_definition, task (new)\n"}],"isError":false,"timestamp":1777534706222}}
{"type":"message","id":"8a454fbd","parentId":"4acc9b7e","timestamp":"2026-04-30T07:38:32.671Z","message":{"role":"assistant","content":[{"type":"thinking","thinking":"Let me understand the current state:\n- Primary metric: `graph_build_time_ms` (ms, lower is better)\n- Current best: 0.03ms (295 nodes, 209 edges) — lru_cache warm load\n- The metric has hit the noise floor (~0.03ms)\n- The ideas backlog suggests: \"SATURATED — Primary metric noise floor\"\n\nLooking at the ideas backlog, the \"NOW WORTHWHILE\" section suggests:\n- Parse all 84 tasks (remove 50-limit)\n- Parse goals/ directory\n- Parse canvas/ directory\n- Expand decisions/lessons beyond 10-limit\n\nLet me check the current graph_builder.py to see what limits exist and what can be expanded.","thinkingSignature":"e7cafbdc692b28c8242aab283871c847a4553a31d2e3d6a2908908bb58792f43"},{"type":"text","text":"Let me check the current graph_builder.py to find what limits exist:\n"},{"type":"toolCall","id":"call_function_p5x722v3vgyx_1","name":"read","arguments":{"path":"/home/ubuntu/.hermes/agi/graph_builder.py"}},{"type":"toolCall","id":"call_function_p5x722v3vgyx_2","name":"bash","arguments":{"command":"ls -la /home/ubuntu/.hermes/agi/"}}],"api":"anthropic-messages","provider":"minimax","model":"MiniMax-M2.7","usage":{"input":2385,"output":231,"cacheRead":10071,"cacheWrite":0,"totalTokens":12687,"cost":{"input":0.0007155,"output":0.00027719999999999996,"cacheRead":0.0006042599999999999,"cacheWrite":0,"total":0.00159696}},"stopReason":"toolUse","timestamp":1777534706223,"responseId":"064239f2f195029a2e57974ea9295d4c"}}
