{"type":"message","id":"c249872f","parentId":"fd8e5ba6","timestamp":"2026-04-30T08:48:41.946Z","message":{"role":"assistant","content":[{"type":"thinking","thinking":"There are `pipelines/` and `pipeline_builds/` directories in `/home/ubuntu/.hermes/belam-codex/`. Let me check them out!","thinkingSignature":"f3d84ded79503dfdf7330ccab2554c7e6bbf97ad5e58e0b7a25eb4080fe99746"},{"type":"toolCall","id":"call_function_6s2hy86iu15u_1","name":"bash","arguments":{"command":"ls /home/ubuntu/.hermes/belam-codex/pipelines/ | head -20 && echo \"---count:\" && ls /home/ubuntu/.hermes/belam-codex/pipelines/ | wc -l && echo \"---\" && cat /home/ubuntu/.hermes/belam-codex/pipelines/*.md 2>/dev/null | head -60"}},{"type":"toolCall","id":"call_function_6s2hy86iu15u_2","name":"bash","arguments":{"command":"ls /home/ubuntu/.hermes/belam-codex/pipeline_builds/ 2>/dev/null | head -20 && echo \"---\" && ls /home/ubuntu/.hermes/belam-codex/templates/ 2>/dev/null | head -10"}}],"api":"anthropic-messages","provider":"minimax","model":"MiniMax-M2.7","usage":{"input":9586,"output":213,"cacheRead":10071,"cacheWrite":0,"totalTokens":19870,"cost":{"input":0.0028758,"output":0.0002556,"cacheRead":0.0006042599999999999,"cacheWrite":0,"total":0.00373566}},"stopReason":"toolUse","timestamp":1777538916940,"responseId":"06424a6546328aeabcdbe3e69a84ca17"}}
{"type":"message","id":"f543457b","parentId":"c249872f","timestamp":"2026-04-30T08:48:41.959Z","message":{"role":"toolResult","toolCallId":"call_function_6s2hy86iu15u_1","toolName":"bash","content":[{"type":"text","text":"archive\nbuild-codex-layer-v1.md\nbuild-equilibrium-snn.md\ncodex-engine-v2-modes.md\ncodex-engine-v3-legendary-map.md\ncodex-engine-v3.md\ncodex-engine-v4-ram-first-render-runtime-with-native-codex-parsing.md\ncodex-layer-context-injection.md\ncontainer-build-and-test.md\ncontainerize-openclaw-workspace.md\ne0-sweep-subcommand-separation.md\ngit-diff-handoff-context.md\nhandoffs\ninteractive-decision-tree-kfold-visualizer.md\nllm-quant-dydx-adapter-v1.md\nllm-quant-paper-trader-v1.md\nlm-v2-coordinate-native-pipeline-launch-and-workflow-enrichment.md\nlm-v3-platform-and-system-namespace.md\norchestration-engine-v1.md\norchestration-engine-v2-temporal.md\n---count:\n45\n---\n---\nprimitive: pipeline\nstatus: archived\npriority: critical\ntype: research\nversion: build-codex-layer-v1\nspec_file: machinelearning/snn_applied_finance/specs/build-codex-layer-v1_spec.yaml\noutput_notebook: machinelearning/snn_applied_finance/notebooks/snn_crypto_predictor_build-codex-layer-v1.ipynb\nagents: [architect, critic, builder]\nsupersedes: \ntags: [codex-layer, infrastructure]\nproject: codex\nstarted: 2026-03-23\narchived: 2026-03-23\narchived: 2026-03-23\npending_action: phase2_complete\ncurrent_phase: \ndispatch_claimed: false\nlast_updated: 2026-03-23 10:22\nreset: false\n---\n# Implementation Pipeline: BUILD-CODEX-LAYER-V1\n\n## Description\nCodex Layer v1: programmatic coordinate guardrails — interceptor, output-codec, symbolic-dispatch\n\n## Notebook Convention\n**All phases live in a single notebook** (`snn_crypto_predictor_build-codex-layer-v1.ipynb`). Each pipeline phase is a top-level section with its own subsections (experiment matrix, experiments, results, analysis). Shared infrastructure (data, encodings, models, baselines) appears once at the top. Phase 3 iterations append as new top-level sections. Final section is always a cross-phase deep analysis.\n\n## Phase 1: Autonomous Build\n_Architect designs → Critic reviews → Builder implements_\n\n### Stage History\n| Stage | Date | Agent | Notes |\n|-------|------|-------|-------|\n| pipeline_created | 2026-03-23 | belam-main | Pipeline instance created |\n| architect_design | 2026-03-23 | architect | Design complete: 3 new files (~585L total). D1 output codec with result register (_/_N/_.field), D2 symbolic dispatch (bare coords/.prefix/!shell/pipe>), D3 interceptor with 10 static rules + LM auto-rules + graduated enforcement (advisory→redirect→block). Advisory mode only for Phase 1. 4 open questions for critic. |\n| critic_design_review | 2026-03-23 | critic | APPROVED: 0 BLOCKs, 4 FLAGs (2 HIGH, 2 MED). FLAG-1 HIGH: register file globally shared — scope per-workspace. FLAG-2 HIGH: pipe ' > ' collides with shell redirect + dispatch ordering bug. FLAG-3 MED: _ coord carve-out needed. FLAG-4 MED: LM auto-rules speculative, stub for v1. Review at: pipeline_builds/build-codex-layer-v1_critic_design_review.md |\n| builder_implementation | 2026-03-23 | builder | Codex Layer v1 complete: 3 new files (output codec 351L, dispatch 211L, interceptor 214L) + engine +50L + cockpit plugin +8L = 834 lines total. All 4 FLAGs addressed: register per-workspace (FLAG-1), |> pipes with ! prefix priority (FLAG-2), _ carve-out in resolve_coords (FLAG-3), LM auto-rules stubbed (FLAG-4). Advisory mode only for Phase 1. All suggestions incorporated (S1 --register-clear, S2 5min TTL, S3 noted). Commit 2706afcb. |\n| critic_code_review | 2026-03-23 | critic | APPROVED: 0 BLOCKs, 2 FLAGs (1 HIGH, 1 MED). FLAG-1 HIGH: greedy _ substitution in pipe chains mangles underscored identifiers — one-liner fix needed before Phase 2. FLAG-2 MED: _lm_text dead data in resolve_coords (pre-existing LM pattern). All 4 design FLAGs resolved, all 3 suggestions incorporated. 834L clean implementation. Review at: pipeline_builds/build-codex-layer-v1_critic_code_review.md |\n| phase1_complete | 2026-03-23 | architect | Phase 1 COMPLETE. Critic code review APPROVED 0 BLOCKs, 2 FLAGs (1 HIGH, 1 MED). 834L clean implementation across 3 new files (output codec 351L, dispatch 211L, interceptor 214L) + engine +50L + cockpit +8L. All 4 design FLAGs resolved. Outstanding: FLAG-1 greedy _ substitution in pipe chains (one-liner fix for Phase 2), FLAG-2 _lm_text dead data. Ready for Phase 2 human review. |\n\n## Phase 2: Human-in-the-Loop\n_Status: Queued — auto-triggers on Phase 1 completion_\n\n### Stage History\n| Stage | Date | Agent | Notes |\n|-------|------|-------|-------|\n| phase2_architect_design | 2026-03-23 | architect | Phase 2 design: 4 priorities, ~158 lines across 4 files. P1: compound coord fix + FLAG fixes. P2: render engine auto-start + UDS diff injection + anchor reset. P3: conversational agent flow with session tracking, exchange limits (3), diff-based reviews, group chat visibility. P4: autonomous iteration cron every 35min with gate checks. 4 open questions for critic. |\n| phase2_critic_design_review_blocked | 2026-03-23 | critic | BLOCKED: BLOCK-1 CRITICAL: P3 sessions_send not callable from orchestrator — architect must specify mechanism (Option A/B/C). P1/P2/P4 can proceed. 3 FLAGs (1 HIGH socket path, 1 MED _lm_text, 1 LOW iteration cap). Review: pipeline_builds/build-codex-layer-v1_phase2_critic_design_review.md |\n| phase2_architect_revision | 2026-03-23 | architect | BLOCK-1 resolved: Option B (session-ID tracking via CLI) with Option C fallback. Builder fresh, critic resumes. Orchestrator-mediated sequential loop, max 3 exchanges. FLAG-1: workspace-scoped .codex_runtime/ dir for all artifacts. FLAG-2: keep _lm_text, add consumer in render_zoom. FLAG-3: max_total_unreviewed=6 cap. All 4 suggestions accepted. 184 lines across 5 files. |\n| phase2_critic_design_review | 2026-03-23 | critic | APPROVED: 0 BLOCKs, 2 FLAGs (1 MED, 1 LOW). BLOCK-1 resolved: Option B (session-ID tracking via CLI) + Option C fallback. All original FLAGs addressed. NEW FLAG-1 MED: exchange loop needs per-dispatch timeout (300s). NEW FLAG-2 LOW: group chat 1-exchange dedup. Review at: pipeline_builds/build-codex-layer-v1_phase2_critic_design_review_r2.md |\n| phase2_builder_implementation | 2026-03-23 | builder | Phase 2 complete: 360 lines across 7 files. P1: compound coord regex + greedy _ fix + _lm_text consumer + .codex_runtime/ convention. P2: render engine auto-start + UDS diff + anchor reset. P3: exchange loop with session-ID tracking, 300s timeout, diff reviews, group chat dedup. P4: --iterate with 4 gate checks + proposal logging. All FLAGs addressed. Commit d1c14508. |\n| phase2_critic_code_review | 2026-03-23 | critic | APPROVED: 0 BLOCKs, 3 FLAGs (1 MED, 2 LOW). All Phase 1+2 FLAGs resolved. FLAG-1 MED: P4 iteration counter never resets (daily_human_input never set, daily_iteration_count never reset). FLAG-2 LOW: single recv in get_render_diff. FLAG-3 LOW: dir() style. 360L, 7 files, all deliverables D1-D8+S3 verified. Review at: pipeline_builds/build-codex-layer-v1_phase2_critic_code_review.md |\n| phase2_complete | 2026-03-23 | architect | Phase 2 COMPLETE. Critic code review APPROVED 0 BLOCKs, 3 FLAGs (1 MED iteration counter reset, 2 LOW). All Phase 1 FLAGs resolved (greedy _ substitution, _lm_text consumer). All Phase 2 design FLAGs resolved (dispatch timeout, group chat dedup). 360L across 7 files. P1: compound coord regex + .codex_runtime/ convention. P2: render engine auto-start + UDS diff + anchor reset. P3: Option B exchange loop (builder fresh, critic resumes via session-ID, max 3 exchanges). P4: autonomous iteration cron with 5 gate checks. Outstanding: FLAG-1 MED daily_iteration_count never resets and daily_human_input never set — P4 will silently stop after 3 iterations on day 1. Fix in Phase 3 or next pipeline. |\n\n### Feedback\n_(Shael's feedback goes here when Phase 1 is complete and reviewed)_\n\n## Phase 3: Iterative Research (Autonomous or Human-Triggered)\n"}],"isError":false,"timestamp":1777538921959}}
{"type":"message","id":"739f314b","parentId":"f543457b","timestamp":"2026-04-30T08:48:41.960Z","message":{"role":"toolResult","toolCallId":"call_function_6s2hy86iu15u_2","toolName":"bash","content":[{"type":"text","text":"build-codex-layer-v1\nbuild-equilibrium-snn\ncodex-engine-v2-modes\ncodex-engine-v3\ncodex-engine-v3-legendary-map\ncodex-engine-v4-ram-first-render-runtime-with-native-codex-parsing\ncodex-engine-v4-ram-first-render-runtime-with-native-codex-parsing_state.json\ncodex-layer-context-injection\ncontainer-build-and-test_state.json\ncontainerize-openclaw-workspace_state.json\ne0-sweep-subcommand-separation_state.json\ngit-diff-handoff-context_critic_review.md\ngit-diff-handoff-context_state.json\ninteractive-decision-tree-kfold-visualizer_state.json\nlimbic-reward-snn-bio-inspired-reward-neurons-for-equilibrium-network\nlimbic-reward-snn-bio-inspired-reward-neurons-for-equilibrium-network_state.json\nllm-quant-dydx-adapter-v1_state.json\nllm-quant-paper-trader-v1_critic_code_review.md\nllm-quant-paper-trader-v1_state.json\nlm-v2-coordinate-native-pipeline-launch-and-workflow-enrichment\n---\nbuilder-first-autogate-pipeline.md\nbuilder-first-pipeline.md\nresearch-packet-body.md\nresearch-pipeline.md\nretired\n"}],"isError":false,"timestamp":1777538921960}}
{"type":"message","id":"8fd01d56","parentId":"739f314b","timestamp":"2026-04-30T08:48:49.404Z","message":{"role":"assistant","content":[{"type":"thinking","thinking":"Now I have a clear picture. There are 45 pipeline files in `/home/ubuntu/.hermes/belam-codex/pipelines/` and some in `/home/ubuntu/.hermes/belam-codex/pipeline_builds/`. Let me look at a few to understand the format.\n\nThe files are YAML frontmatter + markdown content. Each has:\n- primitive, status, priority, type, version, spec_file, output_notebook, agents, supersedes, tags, project, started, archived, pending_action, current_phase, dispatch_claimed, last_updated, reset\n- Stage history table\n- Phase sections\n\n\n- Some have `_state.json` files with pipeline state\n\nThis gives me a good sense of the structure. I can create a parser for these pipeline files similar to how the research/projects parser works, extracting frontmatter and stage history as structured nodes with edges. Let me check the research/projects parser implementation first to follow the same pattern.","thinkingSignature":"b9ea76f41422dc8533a9cc901cafdd4cccfb3d6f246fee419d9adbf75ca5f4d7"},{"type":"toolCall","id":"call_function_bpzs15a4a0a5_1","name":"read","arguments":{"path":"/home/ubuntu/.hermes/agi/graph_builder.py","offset":1286,"limit":160}}],"api":"anthropic-messages","provider":"minimax","model":"MiniMax-M2.7","usage":{"input":12182,"output":254,"cacheRead":10071,"cacheWrite":0,"totalTokens":22507,"cost":{"input":0.0036546,"output":0.0003048,"cacheRead":0.0006042599999999999,"cacheWrite":0,"total":0.00456366}},"stopReason":"toolUse","timestamp":1777538921960,"responseId":"06424a6a2343bee7c1e427a7dc984eeb"}}
{"type":"message","id":"3041999f","parentId":"8fd01d56","timestamp":"2026-04-30T08:48:49.415Z","message":{"role":"toolResult","toolCallId":"call_function_bpzs15a4a0a5_1","toolName":"read","content":[{"type":"text","text":"    def parse_research_projects(self, hermes_dir: str) -> int:\n        \"\"\"Parse research/, projects/, modes/, runbooks/ directories into knowledge nodes.\n        \n        - research/: technical research documents (containerization, orchestration tooling, etc.)\n        - projects/: project definitions with frontmatter (status, priority, owner, tags)\n        - modes/: orchestration mode definitions (create, edit, extend, orchestrate)\n        - runbooks/: operational how-to guides\n        \n        Each becomes a knowledge node with category edges. Returns total nodes added.\n        \"\"\"\n        count = 0\n        base = os.path.join(hermes_dir, \"belam-codex\")\n\n        # research/ — technical documents (markdown prose, tables, code)\n        research_dir = os.path.join(base, \"research\")\n        if os.path.isdir(research_dir):\n            for filename in sorted(os.listdir(research_dir)):\n                if not filename.endswith('.md'):\n                    continue\n                filepath = os.path.join(research_dir, filename)\n                try:\n                    with open(filepath, \"r\") as f:\n                        content = f.read()\n                    title_match = re.search(r'^#\\s+(.+)$', content, re.MULTILINE)\n                    title = title_match.group(1).strip()[:60] if title_match else filename[:-3]\n                    # Extract first paragraph after metadata block\n                    body_match = re.search(r'(?:\\n\\n)(.+?)(?:\\n\\n|##)', content, re.DOTALL)\n                    body = body_match.group(1).strip()[:100] if body_match else \"\"\n                    node_id = self.add_node(\n                        \"knowledge\",\n                        title[:50],\n                        body,\n                        f\"research/{filename}\",\n                        f\"research_{filename[:-3]}\"\n                    )\n                    # Category edge\n                    cat_id = \"category_research\"\n                    if cat_id not in self._node_ids:\n                        self.add_node(\"tag\", \"research\", \"\", f\"research/{filename}\", cat_id)\n                    self.add_edge(node_id, cat_id, \"categorized_as\")\n                    count += 1\n                except Exception:\n                    pass\n\n        # projects/ — project definitions with frontmatter\n        projects_dir = os.path.join(base, \"projects\")\n        if os.path.isdir(projects_dir):\n            for filename in sorted(os.listdir(projects_dir)):\n                if not filename.endswith('.md'):\n                    continue\n                filepath = os.path.join(projects_dir, filename)\n                try:\n                    with open(filepath, \"r\") as f:\n                        content = f.read()\n                    fm_match = _RE_FRONT_MATTER.match(content)\n                    meta = {}\n                    if fm_match:\n                        for line in fm_match.group(1).split('\\n'):\n                            m = _RE_YAML_PAIR.match(line)\n                            if m:\n                                meta[m.group(1)] = m.group(2)\n                    title_match = re.search(r'^#\\s+(.+)$', content, re.MULTILINE)\n                    title = title_match.group(1).strip()[:60] if title_match else filename[:-3]\n                    status = meta.get('status', '')\n                    priority = meta.get('priority', '')\n                    tags_str = meta.get('tags', '[]')\n                    owner = meta.get('owner', '')\n                    summary = f\"{status}|{priority}|{owner[:20]}|{tags_str[:40]}\"\n                    node_id = self.add_node(\n                        \"knowledge\",\n                        title[:50],\n                        summary,\n                        f\"projects/{filename}\",\n                        f\"project_{filename[:-3]}\"\n                    )\n                    # Tag edges\n                    if tags_str and tags_str != '[]':\n                        tags = re.findall(r'[\\w-]+', tags_str)\n                        for tag in tags[:5]:\n                            tag_id = f\"tag_{tag}\"\n                            if tag_id not in self._node_ids:\n                                self.add_node(\"tag\", tag, \"\", f\"projects/{filename}\", tag_id)\n                            self.add_edge(node_id, tag_id, \"tagged_with\")\n                            count += 1\n                    # Category edge\n                    cat_id = \"category_project\"\n                    if cat_id not in self._node_ids:\n                        self.add_node(\"tag\", \"project\", \"\", f\"projects/{filename}\", cat_id)\n                    self.add_edge(node_id, cat_id, \"categorized_as\")\n                    count += 1\n                except Exception:\n                    pass\n\n        # modes/ — orchestration mode definitions (create, edit, extend, orchestrate)\n        modes_dir = os.path.join(base, \"modes\")\n        if os.path.isdir(modes_dir):\n            for filename in sorted(os.listdir(modes_dir)):\n                if not filename.endswith('.md'):\n                    continue\n                filepath = os.path.join(modes_dir, filename)\n                try:\n                    with open(filepath, \"r\") as f:\n                        content = f.read()\n                    title_match = re.search(r'^#\\s+(.+)$', content, re.MULTILINE)\n                    title = title_match.group(1).strip()[:60] if title_match else filename[:-3]\n                    # Extract first paragraph\n                    body_match = re.search(r'\\n\\n(.+?)(?:\\n\\n|##)', content, re.DOTALL)\n                    body = body_match.group(1).strip()[:100] if body_match else \"\"\n                    mode_type = filename[:-3]  # create, edit, extend, orchestrate\n                    node_id = self.add_node(\n                        \"agent_capability\",\n                        title[:50],\n                        body,\n                        f\"modes/{filename}\",\n                        f\"mode_{mode_type}\"\n                    )\n                    # Sequential edges between modes\n                    if hasattr(self, '_last_mode_id') and self._last_mode_id:\n                        self.add_edge(self._last_mode_id, node_id, \"next_mode\")\n                    self._last_mode_id = node_id\n                    count += 1\n                except Exception:\n                    pass\n\n        # runbooks/ — operational how-to guides\n        runbooks_dir = os.path.join(base, \"runbooks\")\n        if os.path.isdir(runbooks_dir):\n            for filename in sorted(os.listdir(runbooks_dir)):\n                if not filename.endswith('.md'):\n                    continue\n                filepath = os.path.join(runbooks_dir, filename)\n                try:\n                    with open(filepath, \"r\") as f:\n                        content = f.read()\n                    title_match = re.search(r'^#\\s+(.+)$', content, re.MULTILINE)\n                    title = title_match.group(1).strip()[:60] if title_match else filename[:-3]\n                    body_match = re.search(r'\\n\\n(.+?)(?:\\n\\n|##)', content, re.DOTALL)\n                    body = body_match.group(1).strip()[:100] if body_match else \"\"\n                    node_id = self.add_node(\n                        \"knowledge\",\n                        title[:50],\n                        body,\n                        f\"runbooks/{filename}\",\n                        f\"runbook_{filename[:-3]}\"\n                    )\n                    # Category edge\n                    cat_id = \"category_runbook\"\n                    if cat_id not in self._node_ids:\n                        self.add_node(\"tag\", \"runbook\", \"\", f\"runbooks/{filename}\", cat_id)\n                    self.add_edge(node_id, cat_id, \"categorized_as\")\n                    count += 1\n                except Exception:\n                    pass\n\n        # Reset _last_mode_id if it was set\n        if hasattr(self, '_last_mode_id'):\n            delattr(self, '_last_mode_id')\n\n        return count\n\n\n[722 more lines in file. Use offset=1446 to continue.]"}],"isError":false,"timestamp":1777538929415}}
