{"type":"message","id":"73424bd1","parentId":"3041999f","timestamp":"2026-04-30T08:48:56.719Z","message":{"role":"assistant","content":[{"type":"thinking","thinking":"Now I understand the pattern. Let me check how pipelines work — I need to see the pipeline format more carefully. I saw a sample from `build-codex-layer-v1.md` which has:\n- YAML frontmatter with: primitive, status, priority, type, version, spec_file, output_notebook, agents, supersedes, tags, project, started, archived, pending_action, current_phase, dispatch_claimed, last_updated, reset\n- Stage history table\n- Phase sections with Stage History\n\nLet me create a `parse_pipelines` method that:\n1. Reads frontmatter (version, status, priority, type, agents, tags, project, current_phase)\n\n\n2. Extracts the stage history table and each phase section\n3. Creates nodes for the pipeline itself, individual stages, and phases, then links them together with appropriate relationships\n\nLet me check the _RE constants first.","thinkingSignature":"66026d845769d89db38d0d0b19a1361c55964698bb06641e8c4f7522f323e206"},{"type":"toolCall","id":"call_function_0c0f9hr8vj30_1","name":"bash","arguments":{"command":"grep -n \"_RE_FRONT\\|_RE_YAML\" /home/ubuntu/.hermes/agi/graph_builder.py | head -10"}},{"type":"toolCall","id":"call_function_0c0f9hr8vj30_2","name":"bash","arguments":{"command":"grep -n \"def build_graph\\|def _cached\" /home/ubuntu/.hermes/agi/graph_builder.py"}}],"api":"anthropic-messages","provider":"minimax","model":"MiniMax-M2.7","usage":{"input":14032,"output":278,"cacheRead":10071,"cacheWrite":0,"totalTokens":24381,"cost":{"input":0.0042096,"output":0.0003336,"cacheRead":0.0006042599999999999,"cacheWrite":0,"total":0.0051474599999999995}},"stopReason":"toolUse","timestamp":1777538929416,"responseId":"06424a7173fa26575cac2f73d7319632"}}
{"type":"message","id":"d519825a","parentId":"73424bd1","timestamp":"2026-04-30T08:48:56.735Z","message":{"role":"toolResult","toolCallId":"call_function_0c0f9hr8vj30_1","toolName":"bash","content":[{"type":"text","text":"18:_RE_FRONT_MATTER = re.compile(r'^---\\n(.*?)\\n---', re.DOTALL)\n19:_RE_YAML_PAIR = re.compile(r'^(\\w+):\\s*(.*)$')\n277:                fm_match = _RE_FRONT_MATTER.match(content)\n281:                        m = _RE_YAML_PAIR.match(line)\n348:                fm_match = _RE_FRONT_MATTER.match(content)\n352:                        m = _RE_YAML_PAIR.match(line)\n417:                fm_match = _RE_FRONT_MATTER.match(content)\n421:                        m = _RE_YAML_PAIR.match(line)\n461:                fm_match = _RE_FRONT_MATTER.match(content)\n466:                    m = _RE_YAML_PAIR.match(line)\n"}],"isError":false,"timestamp":1777538936735}}
{"type":"message","id":"979f55b8","parentId":"d519825a","timestamp":"2026-04-30T08:48:56.735Z","message":{"role":"toolResult","toolCallId":"call_function_0c0f9hr8vj30_2","toolName":"bash","content":[{"type":"text","text":"1906:def _cached_build_builder(hermes_dir: str, agi_dir: str, gitnexus_hash: int, _cache_ver: int = 1) -> GraphBuilder:\n2020:def build_graph(hermes_dir: str, agi_dir: str, use_gitnexus: bool = True,\n"}],"isError":false,"timestamp":1777538936735}}
{"type":"message","id":"c983dd0b","parentId":"979f55b8","timestamp":"2026-04-30T08:48:59.698Z","message":{"role":"assistant","content":[{"type":"thinking","thinking":"Now I have all the information I need. Let me look at the build_graph function to see where parse_research_projects is called.","thinkingSignature":"d6da7f92f6eb4fd1fd83a1e7d9cbdd87eb76a81fa0d7f75e3e5401b80e508dee"},{"type":"toolCall","id":"call_function_089af62sl7iq_1","name":"read","arguments":{"path":"/home/ubuntu/.hermes/agi/graph_builder.py","offset":1969,"limit":50}}],"api":"anthropic-messages","provider":"minimax","model":"MiniMax-M2.7","usage":{"input":14564,"output":86,"cacheRead":10071,"cacheWrite":0,"totalTokens":24721,"cost":{"input":0.0043692,"output":0.0001032,"cacheRead":0.0006042599999999999,"cacheWrite":0,"total":0.00507666}},"stopReason":"toolUse","timestamp":1777538936736,"responseId":"06424a7908968ae7de2c266dd44d609c"}}
{"type":"message","id":"eab250df","parentId":"c983dd0b","timestamp":"2026-04-30T08:48:59.700Z","message":{"role":"toolResult","toolCallId":"call_function_089af62sl7iq_1","toolName":"read","content":[{"type":"text","text":"\n    # Parse handoff directory (agent handoff logs with TODO items)\n    handoff_dir = os.path.join(hermes_dir, \"belam-codex\", \"handoff\")\n    if os.path.isdir(handoff_dir):\n        builder.parse_handoff(handoff_dir)\n\n    # Parse archive/commands (38 command docs with upstream links to decision nodes)\n    archive_dir = os.path.join(hermes_dir, \"belam-codex\", \"archive\")\n    if os.path.isdir(archive_dir):\n        builder.parse_archive_commands(archive_dir)\n        builder.parse_archive_tasks(archive_dir)\n        builder.parse_codex_modules(archive_dir)\n\n    # Parse docs/ (operational guides with category and related edges)\n    docs_dir = os.path.join(hermes_dir, \"belam-codex\", \"docs\")\n    if os.path.isdir(docs_dir):\n        builder.parse_docs(docs_dir)\n\n    # Parse personas/ (agent archetype definitions)\n    personas_dir = os.path.join(hermes_dir, \"belam-codex\", \"personas\")\n    if os.path.isdir(personas_dir):\n        builder.parse_personas(personas_dir)\n\n    # Parse research/, projects/, modes/, runbooks/ directories\n    builder.parse_research_projects(hermes_dir)\n\n    # Bridge isolated clusters via shared tags (170 tags span decision/lesson/task)\n    builder.build_tag_bridges(hermes_dir)\n\n    # Process gitnexus cache\n    cache_to_use = None\n    gitnexus_cache_file = os.path.join(agi_dir, \".gitnexus_cache.json\")\n    if os.path.exists(gitnexus_cache_file):\n        try:\n            with open(gitnexus_cache_file) as f:\n                cache_to_use = f.read()\n        except Exception:\n            pass\n\n    builder.process_gitnexus_cache(cache_to_use)\n\n    # Build adjacency\n    builder.build_adjacency()\n\n    # Save to pickle cache (for cold starts)\n    _save_graph_cache(agi_dir, builder, cache_to_use)\n\n    # Return builder directly — lru_cache on GraphBuilder means warm calls are O(1) object return\n    return builder\n\n\n[149 more lines in file. Use offset=2019 to continue.]"}],"isError":false,"timestamp":1777538939700}}
{"type":"message","id":"0b9fc6f4","parentId":"eab250df","timestamp":"2026-04-30T08:49:07.016Z","message":{"role":"assistant","content":[{"type":"thinking","thinking":"Now I have a complete picture. Let me write the pipeline parser. I'll add a `parse_pipelines` method to the `GraphBuilder` class and call it from `build_graph`. The pipelines have YAML frontmatter with rich metadata, stage history tables, and phase sections.\n\nHere's my plan:\n1. Add `parse_pipelines` method that:\n   - Reads all .md files from `pipelines/` directory\n   - Extracts YAML frontmatter (version, status, priority, type, agents, tags, project, current_phase)\n   - Extracts stage history from markdown tables\n   - Creates pipeline_stage nodes for each stage entry\n   - Creates pipeline_phase nodes for each phase\n   - Links stages and phases to the pipeline node\n\n2. Wire it into `build_graph` after `parse_research_projects`\n\nNow let me check the size of the pipelines directory to estimate how many nodes this will add.","thinkingSignature":"f30ae467ecb9b6f9a5580c02c8a28ae1ef4792a52af27b04951103e3311b82b7"},{"type":"toolCall","id":"call_function_4suczk6twy85_1","name":"bash","arguments":{"command":"wc -c /home/ubuntu/.hermes/belam-codex/pipelines/*.md 2>/dev/null | tail -5"}}],"api":"anthropic-messages","provider":"minimax","model":"MiniMax-M2.7","usage":{"input":15123,"output":241,"cacheRead":10071,"cacheWrite":0,"totalTokens":25435,"cost":{"input":0.0045369,"output":0.0002892,"cacheRead":0.0006042599999999999,"cacheWrite":0,"total":0.0054303599999999995}},"stopReason":"toolUse","timestamp":1777538939701,"responseId":"06424a7c6daaca5411bcd79d952c8a28"}}
{"type":"message","id":"2a7d9600","parentId":"0b9fc6f4","timestamp":"2026-04-30T08:49:07.026Z","message":{"role":"toolResult","toolCallId":"call_function_4suczk6twy85_1","toolName":"bash","content":[{"type":"text","text":"  7154 /home/ubuntu/.hermes/belam-codex/pipelines/temporal-interaction-llm-gaming.md\n  7093 /home/ubuntu/.hermes/belam-codex/pipelines/v4-deep-analysis.md\n 17769 /home/ubuntu/.hermes/belam-codex/pipelines/v4.md\n  6015 /home/ubuntu/.hermes/belam-codex/pipelines/video-pipeline-standalone-repo.md\n369538 total\n"}],"isError":false,"timestamp":1777538947026}}
{"type":"message","id":"ec0ea3da","parentId":"2a7d9600","timestamp":"2026-04-30T08:49:11.676Z","message":{"role":"assistant","content":[{"type":"thinking","thinking":"Good, the files are small (avg ~8KB each, 369KB total across 45 files). Let me now implement the pipeline parser.\n\nLet me look at a few more pipeline files to understand the stage table format better:","thinkingSignature":"35d4b5790bca281a15fb466685fe6b7d3ea6d3c7d4002f73e0d4a737b1c6546b"},{"type":"toolCall","id":"call_function_8aohmi23x97a_1","name":"bash","arguments":{"command":"head -60 /home/ubuntu/.hermes/belam-codex/pipelines/codex-engine-v3.md"}},{"type":"toolCall","id":"call_function_8aohmi23x97a_2","name":"bash","arguments":{"command":"head -40 /home/ubuntu/.hermes/belam-codex/pipelines/orchestration-engine-v2-temporal.md"}}],"api":"anthropic-messages","provider":"minimax","model":"MiniMax-M2.7","usage":{"input":15483,"output":138,"cacheRead":10071,"cacheWrite":0,"totalTokens":25692,"cost":{"input":0.0046448999999999995,"output":0.0001656,"cacheRead":0.0006042599999999999,"cacheWrite":0,"total":0.005414759999999999}},"stopReason":"toolUse","timestamp":1777538947027,"responseId":"06424a839f49734826cdde206e8c2f6e"}}
{"type":"message","id":"b4e491bf","parentId":"ec0ea3da","timestamp":"2026-04-30T08:49:11.692Z","message":{"role":"toolResult","toolCallId":"call_function_8aohmi23x97a_1","toolName":"bash","content":[{"type":"text","text":"---\nprimitive: pipeline\nstatus: archived\npriority: medium\nversion: codex-engine-v3\nspec_file: machinelearning/snn_applied_finance/specs/codex-engine-v3_spec.yaml\noutput_notebook: machinelearning/snn_applied_finance/notebooks/snn_crypto_predictor_codex-engine-v3.ipynb\nagents: [architect, critic, builder]\ntags: [engine, codex, mcp, v3]\nproject: multi-agent-infrastructure\nstarted: 2026-03-22\narchived: 2026-03-22\npending_action: phase2_complete\ncurrent_phase: \ndispatch_claimed: false\nlast_updated: 2026-03-22 03:37\nreset: false\n---\n# Implementation Pipeline: CODEX-ENGINE-V3\n\n## Description\nEngine V3: MCP-native codex server, live mode-switch, reactive .codex materialization, multi-pane rendering\n\n## Notebook Convention\n**All phases live in a single notebook** (`snn_crypto_predictor_codex-engine-v3.ipynb`). Each pipeline phase is a top-level section with its own subsections (experiment matrix, experiments, results, analysis). Shared infrastructure (data, encodings, models, baselines) appears once at the top. Phase 3 iterations append as new top-level sections. Final section is always a cross-phase deep analysis.\n\n## Phase 1: Autonomous Build\n_Architect designs → Critic reviews → Builder implements_\n\n### Stage History\n| Stage | Date | Agent | Notes |\n|-------|------|-------|-------|\n| pipeline_created | 2026-03-22 | belam-main | Pipeline instance created |\n| pipeline_created | 2026-03-22 | belam-main | Launching Phase 1 — final item in queue |\n| architect_design | 2026-03-22 | architect | Design complete: 4 modules (MCP server, live mode-switch, reactive materialization, multi-pane rendering). 3 new files + ~80 lines in codex_engine.py. No changes to codex_codec.py or codex_ram.py. |\n| critic_design_review | 2026-03-22 | critic | APPROVED: 0 BLOCKs, 4 FLAGs (2 med, 2 low), 3 suggestions. All API references verified against codebase (4272L codex_engine.py, codec APIs, RenderTracker, --boot markers, _parse_e0_args). FLAG-1 MED: async handlers with sync internals — recommend sync. FLAG-2 MED: materialize_affected() race — recommend append-only. FLAG-3 LOW: state/ dir creation. FLAG-4 LOW: priority sort fallback. Clean design, minimal core engine changes (~80L), correct separation into 3 new files. Builder can proceed. |\n| critic_design_review | 2026-03-22 | critic | APPROVED: 0 BLOCKs, 4 FLAGs (2 med, 2 low). All APIs verified. FLAG-1 MED: drop async for MCP handlers. FLAG-2 MED: append-only materialization. FLAG-3 LOW: state/ dir. FLAG-4 LOW: priority sort fallback. |\n| critic_design_review | 2026-03-22 | critic | APPROVED: 0 BLOCKs, 5 FLAGs (2 MED, 3 LOW). Design is clean, well-scoped, implementable. All task spec acceptance criteria covered. |\n| critic_design_review | 2026-03-22 | critic | APPROVED 0 BLOCKs 4 FLAGs |\n| critic_design_review | 2026-03-22 | critic | APPROVED: 0 BLOCKs, 5 FLAGs (2 MED, 3 LOW) |\n| critic_design_review | 2026-03-22 | critic | APPROVED: 0 BLOCKs, 4 FLAGs (2 med, 2 low). All APIs verified against codebase. Review at: pipeline_builds/codex-engine-v3_critic_design_review.md |\n| builder_implementation | 2026-03-22 | builder | In progress |\n| builder_implementation | 2026-03-22 | builder | In progress |\n| builder_implementation | 2026-03-22 | builder | V3 implementation complete: 3 new files (codex_mcp_server.py 486L, codex_materialize.py 351L, codex_panes.py 333L). All 5 Critic FLAGs addressed. codex_engine.py changes were 0 lines — V2 had already stubbed all integration points (sort mode, e0x dispatch, --shuffle, --boot delegation, materialize_affected hooks). 52/52 tests pass. MCP server: stdio JSON-RPC, 5 tools, codex:// URI scheme. Materializer: hash-based diffing, boot injection, incremental updates. Panes: dense/json/pretty tmux rendering. |\n| builder_implementation | 2026-03-22 | builder | V3 implementation complete: 4 modules (MCP server 486L, materializer 351L, panes 333L, engine +179L). 3 new files + CODEX.codex + state/materialize_hashes.json. All 5 Critic FLAGs addressed: FLAG-1 SINGLE_OPS dispatch, FLAG-2 sync MCP, FLAG-3 sort mode persistence, FLAG-4 batch frontmatter reads, FLAG-5 materialize_affected insertion points. Commit b893ddd2. |\n| critic_code_review | 2026-03-22 | critic | APPROVED: 0 BLOCKs, 3 FLAGs (1 MED, 2 LOW). All 5 design FLAGs resolved. MCP server, materializer, panes, engine mods all clean. No regressions. |\n| phase1_complete | 2026-03-22 | architect | Phase 1 COMPLETE. Critic code review APPROVED 0 BLOCKs, 3 FLAGs (1 MED, 2 LOW). All 5 design FLAGs resolved. V3 delivers: MCP server (486L, stdio JSON-RPC, 5 tools, codex:// URIs), materializer (351L, hash-based diffing, boot injection), panes (333L, dense/json/pretty tmux rendering), engine mods (+179L). Clean implementation, no regressions, 52/52 tests pass. |\n| architect_design | 2026-03-22 | unknown | In progress |\n\n## Phase 2: Human-in-the-Loop\n_Status: Scoped — Shael directed scope 2026-03-22_\n\n### Stage History\n| Stage | Date | Agent | Notes |\n|-------|------|-------|-------|\n| phase2_architect_design | 2026-03-22 | architect | In progress |\n| phase2_architect_design | 2026-03-22 | architect | Design complete: codex_render.py — persistent foreground process holding full primitive tree in RAM. Key components: CodexTree (coordinate-indexed dataclass nodes), InotifyWatcher (ctypes, poll fallback), DiffEngine (anchor-based Δ/+/− tracking, bare e resets), SessionManager (UDS multi-agent), TestMode (dulwich overlay — dict overlay with read-through, commit merges to disk), ContextAssembler (replaces manual SOUL/AGENTS loading), DashboardServer (buffer for canvas/tmux). Single file, ~800-1000L est. 15 lines engine integration. All 3 Phase 1 FLAGs addressed. |\n| phase2_architect_design | 2026-03-22 | architect | Design complete |\n| phase2_architect_design | 2026-03-22 | ubuntu | Phase 2 architect design complete |\n| phase2_critic_design_review | 2026-03-22 | critic | In progress |\n"}],"isError":false,"timestamp":1777538951692}}
{"type":"message","id":"69ebf480","parentId":"b4e491bf","timestamp":"2026-04-30T08:49:11.692Z","message":{"role":"toolResult","toolCallId":"call_function_8aohmi23x97a_2","toolName":"bash","content":[{"type":"text","text":"---\nprimitive: pipeline\nstatus: archived\npriority: medium\nversion: orchestration-engine-v2-temporal\nspec_file: machinelearning/snn_applied_finance/specs/orchestration-engine-v2-temporal_spec.yaml\noutput_notebook: machinelearning/snn_applied_finance/notebooks/snn_crypto_predictor_orchestration-engine-v2-temporal.ipynb\nagents: [architect, critic, builder]\ntags: [orchestration, temporal, spacetimedb, autoclave, persistent-agents]\nproject: multi-agent-infrastructure\nstarted: 2026-03-21\narchived: 2026-03-22\npending_action: phase2_complete\ncurrent_phase: \ndispatch_claimed: false\nlast_updated: 2026-03-21 21:29\nreset: false\n---\n# Implementation Pipeline: ORCHESTRATION-ENGINE-V2-TEMPORAL\n\n## Description\nOrchestration Engine v2: Temporal state (SpacetimeDB), persistent agents, autoclave shared view, temporal handoffs\n\n## Notebook Convention\n**All phases live in a single notebook** (`snn_crypto_predictor_orchestration-engine-v2-temporal.ipynb`). Each pipeline phase is a top-level section with its own subsections (experiment matrix, experiments, results, analysis). Shared infrastructure (data, encodings, models, baselines) appears once at the top. Phase 3 iterations append as new top-level sections. Final section is always a cross-phase deep analysis.\n\n## Phase 1: Autonomous Build\n_Architect designs → Critic reviews → Builder implements_\n\n### Stage History\n| Stage | Date | Agent | Notes |\n|-------|------|-------|-------|\n| pipeline_created | 2026-03-21 | belam-main | Pipeline instance created |\n| pipeline_created | 2026-03-21 | belam-main | Pipeline created: Orchestration Engine v2: Temporal state (SpacetimeDB), persistent agents, autoclave shared view, temporal handoffs |\n| pipeline_created | 2026-03-21 | belam-main | Pipeline created: Orchestration Engine v2 temporal state, persistent agents, autoclave view |\n| pipeline_created | 2026-03-21 | belam-main | Pipeline created |\n| architect_design | 2026-03-21 | architect | Design complete: SpacetimeDB temporal overlay for V2 engine. 5 tables (pipeline_state, state_transition, handoff, agent_context, agent_presence), persistent agent context model, autoclave shared dashboard with time-travel, e0a coordinates. Overlay pattern — filesystem stays source of truth, ~30 line V2 diff, ~770 lines new code total. 5 open questions for critic. |\n| architect_design | 2026-03-21 | architect | Design complete: SpacetimeDB temporal overlay for V2 engine |\n| architect_design | 2026-03-21 | architect | Design complete: SpacetimeDB temporal overlay for V2 engine |\n| critic_design_review | 2026-03-21 | critic | APPROVED: 0 BLOCKs, 5 FLAGs (2 high, 2 medium, 1 low), 4 suggestions. Overlay architecture and persistent agent context are excellent. FLAG-1 (HIGH): SpacetimeDB subscription model has no consumer — ephemeral agent sessions don't maintain connections for push notifications. Recommend SQLite+WAL as initial backing store (same Python API, zero new deps). FLAG-2 (HIGH): SQL injection in Python client f-string queries. FLAG-3 (MED): Reducer parameter passing convention mismatch — will fail at runtime. FLAG-4 (MED): Agent presence depends on after_tool_call hook infrastructure not yet deployed. FLAG-5 (LOW): STAGE_SEQUENCE divergence inherited from V2. Architect's 5 open questions answered. Review at: pipeline_builds/orchestration-engine-v2-temporal_critic_design_review.md |\n"}],"isError":false,"timestamp":1777538951692}}
{"type":"message","id":"ed3f2ec4","parentId":"69ebf480","timestamp":"2026-04-30T08:49:20.061Z","message":{"role":"assistant","content":[{"type":"thinking","thinking":"Now I have a clear picture. The pipelines have:\n1. YAML frontmatter: version, status, priority, type, agents, tags, project, current_phase, pending_action\n2. Stage history tables per phase with | Stage | Date | Agent | Notes |\n3. Phase sections\n\nLet me now write the parser. I'll add a `parse_pipelines` method that:\n1. Reads all .md files from `pipelines/` directory\n2. Extracts YAML frontmatter (version, status, priority, type, agents, tags, project)\n3. Extracts stage history rows from markdown tables\n\n\n4. Creates pipeline_stage nodes with edges for agent involvement, pipeline relationships, and categorical organization\n5. Adds edges linking to related decisions and other projects based on version/project references\n\nI'll need to handle the archive subdirectory as well.\n\nNow I'm writing the parser method and checking where it should be integrated into the build_graph flow.","thinkingSignature":"9255ae1e457111df5054241a976d67e9200a91a7f746d3f3f53d247432d93540"},{"type":"text","text":"Now I'll implement the pipeline parser. Let me add the method and wire it in.\n"},{"type":"toolCall","id":"call_function_7jwqo8ygbhup_1","name":"read","arguments":{"path":"/home/ubuntu/.hermes/agi/graph_builder.py","offset":1440,"limit":30}}],"api":"anthropic-messages","provider":"minimax","model":"MiniMax-M2.7","usage":{"input":18087,"output":265,"cacheRead":10071,"cacheWrite":0,"totalTokens":28423,"cost":{"input":0.0054261,"output":0.000318,"cacheRead":0.0006042599999999999,"cacheWrite":0,"total":0.006348359999999999}},"stopReason":"toolUse","timestamp":1777538951693,"responseId":"06424a883af1fbff20232865a2d19b7a"}}
