{"type":"message","id":"ed96afc3","parentId":"ec255358","timestamp":"2026-04-30T09:04:27.921Z","message":{"role":"toolResult","toolCallId":"call_function_l5bsqn82ifcd_1","toolName":"read","content":[{"type":"text","text":"# Builder-First Pipeline Template\n\n## Flow\n\n```\nPhase 1: Builder (implement) → Builder (bugfix) → Critic (review) → [HUMAN GATE]\nPhase 2: Architect (design) → Builder (implement) → Builder (bugfix) → Critic (review) → [HUMAN GATE]\nPhase 3: Architect (design) → Builder (implement) → Builder (bugfix) → Critic (review) → [HUMAN GATE]\n```\n\nAt each human gate (`p1_complete`, `p2_complete`), the pipeline pauses for Shael to review.\nNo auto-transition occurs. From these gates, the architect (or coordinator) can:\n1. **Kick Phase 2** — `python3 scripts/pipeline_orchestrate.py <ver> kickoff --phase 2`\n2. **Declare task done** — `python3 scripts/pipeline_orchestrate.py <ver> complete-task --agent architect --notes \"reason\"`\n   - Archives the pipeline (status: archived)\n   - Marks the parent task as done (status: done)\n   - Notifies [messenger] group\n\n## When to Use\n- Spec is already clear (decision exists, scope is tight)\n- Implementation-heavy, design-light work\n- Infrastructure tasks with well-defined success criteria\n\n## Stage Definitions\n\n### Phase 1 — Builder-First Implementation\n\n#### `p1_builder_implement`\n- Receives: task spec + success criteria + any reference files\n- Produces: working code, committed to repo\n- Handoff: test results + file manifest → next builder\n\n#### `p1_builder_bugfix`\n- Receives: previous builder's code + test results\n- Produces: bug fixes, edge cases, test coverage improvements\n- Handoff: updated test results + fix summary → critic\n\n#### `p1_critic_review`\n- Receives: full implementation + test results + task spec\n- Produces: review document (pass/fail, issues found, suggestions)\n- Handoff: review doc → human gate\n\n### Phase 2 — Architect-Led Refinement\n\n#### `p2_architect_design`\n- Receives: critic review + implementation state\n- Produces: Phase 2 spec with specific changes/improvements\n- Handoff: P2 spec → builder_implement (next phase)\n\n#### `p2_builder_implement`\n- Builder implements Phase 2 design changes\n\n#### `p2_builder_bugfix`\n- Fix bugs and edge cases from Phase 2 implementation\n\n#### `p2_critic_review`\n- Final review of Phase 2 implementation\n\n## Subtask Convention\nBreak the parent task into sequential subtasks named:\n```\n{parent-slug}-s1-{description}\n{parent-slug}-s2-{description}\n{parent-slug}-s3-{description}\n```\n\nEach subtask runs through the full pipeline independently. Later subtasks can depend on earlier ones.\n\n## Stage Transitions\n<!-- machine-readable: parsed by template_parser.py -->\n<!-- Phase-based format: phases define stage sequences, gates, and block routing -->\n```yaml\nschema_version: 1\nfirst_agent: builder\ntype: builder-first\nruntime:\n  platform: hermes\n  dispatch_tool: delegate_task\n  codex_cli_enabled: true\n  roles:\n    architect: { toolsets: [terminal, file, web, skills] }\n    builder: { toolsets: [terminal, file, skills] }\n    critic: { toolsets: [file, terminal] }\n\n# Template-level defaults — merged beneath per-stage runtime fields by\n# runtime_resolution.resolve_stage_runtime. Task overrides still win.\ndefaults:\n  launcher: popen\n  cockpit_mode: shared\n  question_strategy: packet_and_relay\n\nphases:\n  phase1:\n    humangate: true\n    stages:\n      - role: builder\n        action: implement\n        session: fresh\n        cli: claude\n        context: [persona-builder, supermap, cockpit, cavekit]\n      - role: builder\n        action: bugfix\n        session: continue\n        cli: claude\n        context: [persona-builder, supermap, cockpit, cavekit]\n      - role: critic\n        action: review\n        session: fresh\n        cli: codex\n        context: [persona-critic, supermap]\n\n  phase2:\n    humangate: true\n    stages:\n      - role: architect\n        action: design\n        session: fresh\n        cli: claude\n        context: [persona-architect, supermap, cockpit, cavekit]\n      - role: builder\n        action: implement\n        session: fresh\n        cli: claude\n        context: [persona-builder, supermap, cockpit, cavekit]\n      - role: builder\n        action: bugfix\n        session: continue\n        cli: claude\n        context: [persona-builder, supermap, cockpit, cavekit]\n      - role: critic\n        action: review\n        session: fresh\n        cli: codex\n        context: [persona-critic, supermap]\n\n  phase3:\n    humangate: true\n    stages:\n      - role: architect\n        action: design\n        session: fresh\n        cli: claude\n        context: [persona-architect, supermap, cockpit, cavekit]\n      - role: builder\n        action: implement\n        session: fresh\n        cli: claude\n        context: [persona-builder, supermap, cockpit, cavekit]\n      - role: builder\n        action: bugfix\n        session: continue\n        cli: claude\n        context: [persona-builder, supermap, cockpit, cavekit]\n      - role: critic\n        action: review\n        session: fresh\n        cli: codex\n        context: [persona-critic, supermap]\n\nblock_routing:\n  critic:\n    review: { agent: builder, session: continue }\n\n# When critic passes with 0 BLOCKs and 0 FLAGs (any severity),\n# auto-complete the task at p1_complete/p2_complete instead of\n# dispatching architect for review. If any FLAGs remain, the\n# architect gets dispatched as usual to decide on Phase 2.\nauto_complete_on_clean_pass: true\n\ncomplete_task_agent: architect\n```\n\n## Human Gates\n\nBoth `p1_complete` and `p2_complete` are **human gates** — the pipeline pauses for review.\n\n**With `auto_complete_on_clean_pass: true`:** If the critic's verdict is APPROVED with **0 BLOCKs and 0 FLAGs** (all severities), the task auto-completes at the gate — no architect dispatch needed. If any FLAGs remain (even LOW), the architect is dispatched to review and decide on Phase 2 or completion.\n\n### Actions at a Human Gate\n\n| Action | Command | Effect |\n|--------|---------|--------|\n| Kick Phase 2 | `pipeline_orchestrate.py <ver> kickoff --phase 2` | Starts Phase 2 flow |\n| Complete task | `pipeline_orchestrate.py <ver> complete-task --agent architect --notes \"reason\"` | Archives pipeline + marks task done |\n| Manual transition | `pipeline_orchestrate.py <ver> complete <gate_stage> --agent <role> --notes \"...\"` | Advance to specific next stage |\n\n### Architect \"Task is Done\" Path\n\nWhen the architect (at `p1_complete` or `p2_complete`) determines the task is fully satisfied:\n\n```bash\npython3 scripts/pipeline_orchestrate.py <version> complete-task \\\n  --agent architect \\\n  --notes \"Implementation satisfies all requirements. No Phase 2 needed.\"\n```\n\nThis command:\n1. Sets pipeline status to `archived` with archive date and reason\n2. Finds the parent task (from pipeline's `task:` frontmatter field) and sets status to `done`\n3. Writes agent memory for continuity\n4. Sends a [messenger] notification to the pipeline group chat\n"}],"isError":false,"timestamp":1777539867920}}
{"type":"message","id":"37037189","parentId":"ed96afc3","timestamp":"2026-04-30T09:04:36.329Z","message":{"role":"assistant","content":[{"type":"thinking","thinking":"Now I understand the template structure. The templates have:\n1. Phase sections (`### Phase 1 — ...`)\n2. Stage definitions (`#### `p1_builder_implement``)\n3. YAML blocks with structured stage definitions\n\nThe current `parse_templates` function:\n- Creates `reference` nodes for templates\n- Creates `reference` nodes for phases and stages from headings\n- Parses YAML blocks but doesn't use them effectively\n\nA targeted improvement: Make `parse_templates` create `template_stage` nodes instead of `reference` nodes, and add richer metadata from the YAML blocks. This would add meaningful nodes to the graph.\n\nLet me look at the current parse_templates function again and make a targeted change.","thinkingSignature":"0d35333befe01534d2a55663562ae890a8c0dc268a147c15039e0b6efa537cc5"},{"type":"text","text":"Now I'll make a targeted improvement to `parse_templates()`. Currently it creates minimal `reference` nodes, but templates have rich stage definitions that should become `template_stage` nodes:\n"},{"type":"toolCall","id":"call_function_oo5ypfmpcqnu_1","name":"read","arguments":{"path":"/home/ubuntu/.hermes/agi/graph_builder.py","offset":1520,"limit":100}}],"api":"anthropic-messages","provider":"minimax","model":"MiniMax-M2.7","usage":{"input":32036,"output":241,"cacheRead":10071,"cacheWrite":0,"totalTokens":42348,"cost":{"input":0.0096108,"output":0.0002892,"cacheRead":0.0006042599999999999,"cacheWrite":0,"total":0.01050426}},"stopReason":"toolUse","timestamp":1777539867921,"responseId":"06424e1c70baf8f9690bd68b690a44b0"}}
{"type":"message","id":"21795ddf","parentId":"37037189","timestamp":"2026-04-30T09:04:36.332Z","message":{"role":"toolResult","toolCallId":"call_function_oo5ypfmpcqnu_1","toolName":"read","content":[{"type":"text","text":"                priority = meta.get('priority', '')\n                ptype = meta.get('type', '')\n                agents_str = meta.get('agents', '')\n                tags_str = meta.get('tags', '[]')\n                project = meta.get('project', '')\n                pending = meta.get('pending_action', '')\n\n                # Extract title\n                title_match = re.search(r'^#\\s+Implementation Pipeline:\\s*(.+)$', content, re.MULTILINE)\n                title = title_match.group(1).strip()[:60] if title_match else version\n\n                pipeline_id = self.add_node(\n                    \"pipeline\",\n                    title[:50],\n                    f\"{status}|{priority}|{ptype}\",\n                    f\"{subdir}/{filename}\",\n                    f\"pipeline_{version}\"\n                )\n                count += 1\n\n                # Tag edges (from YAML tags)\n                if tags_str and tags_str != '[]':\n                    tags = re.findall(r'[\\w-]+', tags_str)\n                    for tag in tags[:8]:\n                        tag_id = f\"tag_{tag}\"\n                        if tag_id not in self._node_ids:\n                            self.add_node(\"tag\", tag, \"\", f\"{subdir}/{filename}\", tag_id)\n                        self.add_edge(pipeline_id, tag_id, \"tagged_with\")\n                        count += 1\n\n                # Agent edges\n                if agents_str:\n                    agents = re.findall(r'[\\w-]+', agents_str)\n                    for agent in agents[:6]:\n                        role_id = f\"agent_role_{agent}\"\n                        if role_id not in self._node_ids:\n                            self.add_node(\"agent_role\", agent, \"\", f\"{subdir}/{filename}\", role_id)\n                        self.add_edge(pipeline_id, role_id, \"uses_agent\")\n\n                # Status/priority/type category edges\n                for cat_val, cat_prefix in [(status, \"pipeline_status\"), (priority, \"pipeline_priority\"), (ptype, \"pipeline_type\")]:\n                    if cat_val:\n                        cat_id = f\"tag_{cat_prefix}_{cat_val}\"\n                        if cat_id not in self._node_ids:\n                            self.add_node(\"tag\", f\"{cat_prefix}:{cat_val}\", \"\", f\"{subdir}/{filename}\", cat_id)\n                        self.add_edge(pipeline_id, cat_id, \"categorized_as\")\n\n                # Project edge\n                if project:\n                    proj_id = f\"project_{project}\"\n                    if proj_id not in self._node_ids:\n                        self.add_node(\"knowledge\", project, f\"project:{project}\", f\"{subdir}/{filename}\", proj_id)\n                        count += 1\n                    self.add_edge(pipeline_id, proj_id, \"belongs_to_project\")\n\n                # Extract stage history: parse all | Stage | Date | Agent | Notes | table rows\n                all_stages = []\n                # Find phase sections with stage history tables\n                for ph_match in _RE_PHASE_SECTION.finditer(content):\n                    phase_name = ph_match.group(1).strip()\n                    table_block = ph_match.group(2)\n                    for row_match in _RE_STAGE_ROW.finditer(table_block):\n                        stage_name = row_match.group(1).strip()\n                        stage_date = row_match.group(2).strip()\n                        stage_agent = row_match.group(3).strip()\n                        stage_notes = row_match.group(4).strip()[:80]\n                        all_stages.append((stage_name, stage_date, stage_agent, stage_notes))\n\n                # Also extract standalone stage tables (some pipelines put them without phase headers)\n                if not all_stages:\n                    for tbl_match in _RE_STAGE_TABLE.finditer(content):\n                        table_block = tbl_match.group(1)\n                        for row_match in _RE_STAGE_ROW.finditer(table_block):\n                            stage_name = row_match.group(1).strip()\n                            stage_date = row_match.group(2).strip()\n                            stage_agent = row_match.group(3).strip()\n                            stage_notes = row_match.group(4).strip()[:80]\n                            all_stages.append((stage_name, stage_date, stage_agent, stage_notes))\n\n                # Create pipeline_stage nodes\n                prev_stage_id = None\n                for (stage_name, stage_date, stage_agent, stage_notes) in all_stages[:40]:\n                    stage_id = self.add_node(\n                        \"pipeline_stage\",\n                        stage_name[:40],\n                        f\"{stage_date}|{stage_agent}|{stage_notes}\",\n                        f\"{subdir}/{filename}#{stage_name}\",\n                        f\"pipeline_{version}_stage_{stage_name}\"\n                    )\n                    count += 1\n                    self.add_edge(pipeline_id, stage_id, \"has_stage\")\n                    if prev_stage_id:\n                        self.add_edge(prev_stage_id, stage_id, \"next_stage\")\n                    prev_stage_id = stage_id\n\n                    # Agent node for stage actor\n                    if stage_agent and stage_agent not in ('unknown', 'belam-main'):\n                        role_id = f\"agent_role_{stage_agent}\"\n                        if role_id not in self._node_ids:\n                            self.add_node(\"agent_role\", stage_agent, \"\", f\"{subdir}/{filename}\", role_id)\n\n[904 more lines in file. Use offset=1620 to continue.]"}],"isError":false,"timestamp":1777539876332}}
{"type":"message","id":"e72ce52c","parentId":"21795ddf","timestamp":"2026-04-30T09:04:44.636Z","message":{"role":"assistant","content":[{"type":"thinking","thinking":"Now let me find the parse_templates function:","thinkingSignature":"bce688aecd43cf78b8ed03d33579eb9930e400c0d5944b57d7b5345b6a0d1f5e"},{"type":"toolCall","id":"call_function_0mnaf1bzbury_1","name":"read","arguments":{"path":"/home/ubuntu/.hermes/agi/graph_builder.py","offset":1680,"limit":100}}],"api":"anthropic-messages","provider":"minimax","model":"MiniMax-M2.7","usage":{"input":33367,"output":68,"cacheRead":10071,"cacheWrite":0,"totalTokens":43506,"cost":{"input":0.0100101,"output":0.00008159999999999999,"cacheRead":0.0006042599999999999,"cacheWrite":0,"total":0.01069596}},"stopReason":"toolUse","timestamp":1777539876333,"responseId":"06424e28d91bad3fbd58bd4215475c5d"}}
{"type":"message","id":"e8263443","parentId":"e72ce52c","timestamp":"2026-04-30T09:04:44.642Z","message":{"role":"toolResult","toolCallId":"call_function_0mnaf1bzbury_1","toolName":"read","content":[{"type":"text","text":"            self.add_node(\"reference\", title[:50], f\"template:{filename}\", f\"templates/{filename}\", tmpl_id)\n            count += 1\n\n            # Category edge\n            cat_id = \"category_template\"\n            if cat_id not in self._node_ids:\n                self.add_node(\"tag\", \"template\", \"\", f\"templates/{filename}\", cat_id)\n                count += 1\n            self.add_edge(tmpl_id, cat_id, \"categorized_as\")\n\n            # Extract YAML blocks (stage definitions)\n            yaml_blocks = list(_RE_YAML_BLOCK.finditer(content))\n\n            # Extract phase + stage hierarchy from markdown headings\n            current_phase = None\n            current_stage = None\n            phase_ids = []\n\n            for line_num, line in enumerate(content.split('\\n'), 1):\n                ph_match = _RE_PHASE_HDR.match(line)\n                if ph_match:\n                    phase_num = ph_match.group(1)\n                    phase_suffix = ph_match.group(2).strip()[:40]\n                    phase_id = f\"template_{filename[:-3]}_phase{phase_num}\"\n                    self.add_node(\"reference\", f\"Phase {phase_num} {phase_suffix}\", \"\", f\"templates/{filename}#phase{phase_num}\", phase_id)\n                    count += 1\n                    self.add_edge(tmpl_id, phase_id, \"has_phase\")\n                    if phase_ids:\n                        self.add_edge(phase_ids[-1], phase_id, \"next_phase\")\n                    phase_ids.append(phase_id)\n                    current_phase = phase_id\n                    current_stage = None\n                    continue\n\n                st_match = _RE_STAGE_HDR.match(line)\n                if st_match and current_phase:\n                    stage_name = st_match.group(1)\n                    stage_id = f\"template_{filename[:-3]}_stage_{stage_name}\"\n                    self.add_node(\"reference\", stage_name, f\"phase:{current_phase}\", f\"templates/{filename}#{stage_name}\", stage_id)\n                    count += 1\n                    self.add_edge(current_phase, stage_id, \"has_stage\")\n                    current_stage = stage_id\n\n            # Parse YAML blocks for structured stage metadata\n            for yb in yaml_blocks:\n                yaml_content = yb.group(1)\n                lines = yaml_content.split('\\n')\n                cur_indent = 0\n                for yline in lines:\n                    km = _RE_YAML_KEY.match(yline)\n                    if not km:\n                        continue\n                    indent = len(km.group(1))\n                    key = km.group(2)\n                    val = km.group(3).strip()\n                    if indent == 0 and key in ('type', 'first_agent'):\n                        # Template-level metadata\n                        pass  # Already captured from title/flow\n\n        return count\n\n    def parse_archive_tasks(self, archive_dir: str) -> int:\n        \"\"\"Parse archive/tasks/ into archive_task nodes with upstream/downstream edges.\n        \n        Archive tasks have rich frontmatter (status, priority, upstream, downstream, tags)\n        that can create cross-type edges bridging isolated graph clusters.\n        \"\"\"\n        tasks_dir = os.path.join(archive_dir, \"tasks\")\n        if not os.path.isdir(tasks_dir):\n            return 0\n\n        files = sorted(os.listdir(tasks_dir))\n        md_files = [f for f in files if f.endswith('.md')]\n        count = 0\n        task_ids = {}  # filename -> node_id for downstream linking\n\n        for filename in md_files:\n            filepath = os.path.join(tasks_dir, filename)\n            try:\n                with open(filepath, \"r\") as f:\n                    content = f.read()\n\n                # Extract frontmatter\n                fm_match = _RE_FRONT_MATTER.match(content)\n                meta = {}\n                if fm_match:\n                    for line in fm_match.group(1).split('\\n'):\n                        m = _RE_YAML_PAIR.match(line)\n                        if m:\n                            meta[m.group(1)] = m.group(2)\n\n                status = meta.get('status', '')\n                priority = meta.get('priority', '')\n                upstream_str = meta.get('upstream', '[]')\n                downstream_str = meta.get('downstream', '[]')\n                tags_str = meta.get('tags', '[]')\n                project = meta.get('project', '')\n\n                # Extract title from content\n                title_match = re.search(r'^# (.+)', content, re.MULTILINE)\n\n[744 more lines in file. Use offset=1780 to continue.]"}],"isError":false,"timestamp":1777539884642}}
{"type":"message","id":"eaf1147f","parentId":"e8263443","timestamp":"2026-04-30T09:04:50.580Z","message":{"role":"assistant","content":[{"type":"thinking","thinking":"Now I understand the `parse_templates` function better. It currently:\n1. Creates `reference` nodes for template and phases (from heading text)\n2. Creates `reference` nodes for stages (from `#### `stage_name`` headings)\n3. Parses YAML blocks but doesn't use them\n\nThe improvement: Create `template_stage` nodes instead of `reference` nodes for stages, and capture the stage role/action metadata from the YAML blocks. This would add richer data to the graph.\n\nLet me look at the full function to understand what needs to change:","thinkingSignature":"518f1f8495dddcd09cb1ed22db8ff9d7108aeacf708f2d7688db51de0df80a35"},{"type":"toolCall","id":"call_function_sodheult4wl6_1","name":"read","arguments":{"path":"/home/ubuntu/.hermes/agi/graph_builder.py","offset":1638,"limit":60}}],"api":"anthropic-messages","provider":"minimax","model":"MiniMax-M2.7","usage":{"input":34383,"output":172,"cacheRead":10071,"cacheWrite":0,"totalTokens":44626,"cost":{"input":0.0103149,"output":0.0002064,"cacheRead":0.0006042599999999999,"cacheWrite":0,"total":0.011125560000000001}},"stopReason":"toolUse","timestamp":1777539884644,"responseId":"06424e2debc08fec0eeb6066684fcf09"}}
