{"type":"message","id":"28c1c575","parentId":"00dd4ff8","timestamp":"2026-04-30T07:39:09.773Z","message":{"role":"toolResult","toolCallId":"call_function_6dikg9o7u5k0_1","toolName":"read","content":[{"type":"text","text":"        }\n        with open(cache_file, 'wb') as f:\n            pickle.dump(cached, f, protocol=pickle.HIGHEST_PROTOCOL)\n    except Exception:\n        pass\n\n@lru_cache(maxsize=1)\ndef _cached_build(hermes_dir: str, agi_dir: str, gitnexus_hash: int) -> Tuple[Tuple, Tuple, Dict]:\n    \"\"\"Cached builder internals — returns serializable parts only.\n    \n    lru_cache eliminates pickle.load entirely for warm calls.\n    gitnexus_hash is a cache-busting int derived from gitnexus content.\n    \"\"\"\n    # Initialize cache\n    init_cache(agi_dir)\n\n    # Build from sources\n    builder = GraphBuilder()\n\n    # Parse AGENTS.md\n    agents_md = os.path.join(hermes_dir, \"belam-codex\", \"AGENTS.md\")\n    builder.parse_agents_md(agents_md)\n\n    # Parse memory files\n    memory_dir = os.path.join(hermes_dir, \"belam-codex\", \"memory\")\n    builder.parse_memory_files(memory_dir, limit=5)\n\n    # Parse schema files\n    schema_dir = os.path.join(hermes_dir, \"belam-codex\", \"schemas\")\n    builder.parse_schema_files(schema_dir)\n\n    # Parse decisions (limit 10 — only titles/rationale, no tag nodes)\n    decisions_dir = os.path.join(hermes_dir, \"belam-codex\", \"decisions\")\n    if os.path.isdir(decisions_dir):\n        builder.parse_decisions(decisions_dir, limit=10)\n\n    # Parse lessons (limit 10 — only titles/summaries, no tag nodes)\n    lessons_dir = os.path.join(hermes_dir, \"belam-codex\", \"lessons\")\n    if os.path.isdir(lessons_dir):\n        builder.parse_lessons(lessons_dir, limit=10)\n\n    # Parse tasks (limit 50 — task nodes with status/priority/depends_on edges)\n    tasks_dir = os.path.join(hermes_dir, \"belam-codex\", \"tasks\")\n    if os.path.isdir(tasks_dir):\n        builder.parse_tasks(tasks_dir, limit=50)\n\n    # Parse goals (goal nodes with status/priority/urgency)\n    goals_dir = os.path.join(hermes_dir, \"belam-codex\", \"goals\")\n    if os.path.isdir(goals_dir):\n        builder.parse_goals(goals_dir)\n\n    # Process gitnexus cache\n    cache_to_use = None\n    gitnexus_cache_file = os.path.join(agi_dir, \".gitnexus_cache.json\")\n    if os.path.exists(gitnexus_cache_file):\n        try:\n            with open(gitnexus_cache_file) as f:\n                cache_to_use = f.read()\n        except Exception:\n            pass\n\n    builder.process_gitnexus_cache(cache_to_use)\n\n    # Build adjacency\n    builder.build_adjacency()\n\n    # Save to pickle cache (for cold starts)\n    _save_graph_cache(agi_dir, builder, cache_to_use)\n\n    # Return serializable parts as tuples/dicts (cacheable by lru_cache)\n    return builder.nodes, builder.edges, dict(builder.adj)\n\n\ndef build_graph(hermes_dir: str, agi_dir: str, use_gitnexus: bool = True,\n                 gitnexus_cache: Optional[str] = None) -> Tuple[GraphBuilder, float]:\n    \"\"\"Main graph building function with lru_cache for warm calls.\"\"\"\n    start = time.perf_counter()\n\n    # Get gitnexus hash for cache busting\n    gitnexus_hash = 0\n    gitnexus_cache_file = os.path.join(agi_dir, \".gitnexus_cache.json\")\n    if os.path.exists(gitnexus_cache_file):\n        try:\n            gitnexus_hash = os.path.getsize(gitnexus_cache_file)\n        except Exception:\n            pass\n\n    # Try lru_cache first (no pickle.load)\n    try:\n        nodes, edges, adj = _cached_build(hermes_dir, agi_dir, gitnexus_hash)\n        # Reconstruct builder from cached parts\n        builder = GraphBuilder()\n        builder.nodes = list(nodes)\n        builder.edges = list(edges)\n        builder.adj = adj\n        builder._node_ids = {n[0] for n in nodes}\n        elapsed_ms = (time.perf_counter() - start) * 1000\n        return builder, elapsed_ms\n    except Exception:\n        pass\n\n[79 more lines in file. Use offset=700 to continue.]"}],"isError":false,"timestamp":1777534749773}}
{"type":"message","id":"824ef706","parentId":"28c1c575","timestamp":"2026-04-30T07:39:13.599Z","message":{"role":"assistant","content":[{"type":"thinking","thinking":"Now I see the context. The _cached_build function has the limits I need to change. Let me also check the cold build path:","thinkingSignature":"bd7d32ad3839445824dc26bb2852cb82a58ff0db0cc4a305c7de70b74c3c7b63"},{"type":"toolCall","id":"call_function_axgguhe1hz17_1","name":"read","arguments":{"path":"/home/ubuntu/.hermes/agi/graph_builder.py","offset":700,"limit":80}}],"api":"anthropic-messages","provider":"minimax","model":"MiniMax-M2.7","usage":{"input":13821,"output":85,"cacheRead":10071,"cacheWrite":0,"totalTokens":23977,"cost":{"input":0.0041462999999999995,"output":0.000102,"cacheRead":0.0006042599999999999,"cacheWrite":0,"total":0.004852559999999999}},"stopReason":"toolUse","timestamp":1777534749774,"responseId":"06423a1ee86646233f2af30dd19c064d"}}
{"type":"message","id":"4a6c1fbb","parentId":"824ef706","timestamp":"2026-04-30T07:39:13.601Z","message":{"role":"toolResult","toolCallId":"call_function_axgguhe1hz17_1","toolName":"read","content":[{"type":"text","text":"\n    # Fallback: try pickle cache\n    init_cache(agi_dir)\n    cache_to_use = gitnexus_cache\n    builder = _try_load_graph_cache(agi_dir, {}, gitnexus_cache)\n    if builder is not None:\n        elapsed_ms = (time.perf_counter() - start) * 1000\n        return builder, elapsed_ms\n\n    # Cold build path\n    init_cache(agi_dir)\n    builder = GraphBuilder()\n\n    # Parse AGENTS.md\n    agents_md = os.path.join(hermes_dir, \"belam-codex\", \"AGENTS.md\")\n    builder.parse_agents_md(agents_md)\n\n    # Parse memory files\n    memory_dir = os.path.join(hermes_dir, \"belam-codex\", \"memory\")\n    builder.parse_memory_files(memory_dir, limit=5)\n\n    # Parse schema files\n    schema_dir = os.path.join(hermes_dir, \"belam-codex\", \"schemas\")\n    builder.parse_schema_files(schema_dir)\n\n    # Parse decisions (limit 10 — fallback cold path)\n    decisions_dir = os.path.join(hermes_dir, \"belam-codex\", \"decisions\")\n    if os.path.isdir(decisions_dir):\n        builder.parse_decisions(decisions_dir, limit=10)\n\n    # Parse lessons (limit 10 — fallback cold path)\n    lessons_dir = os.path.join(hermes_dir, \"belam-codex\", \"lessons\")\n    if os.path.isdir(lessons_dir):\n        builder.parse_lessons(lessons_dir, limit=10)\n\n    # Parse tasks (fallback cold path)\n    tasks_dir = os.path.join(hermes_dir, \"belam-codex\", \"tasks\")\n    if os.path.isdir(tasks_dir):\n        builder.parse_tasks(tasks_dir, limit=50)\n\n    # Parse goals (fallback cold path)\n    goals_dir = os.path.join(hermes_dir, \"belam-codex\", \"goals\")\n    if os.path.isdir(goals_dir):\n        builder.parse_goals(goals_dir)\n\n    # Process gitnexus cache\n    global _gitnexus_cache\n    if cache_to_use is None:\n        cache_to_use = _gitnexus_cache\n    if use_gitnexus and cache_to_use is None:\n        gitnexus_dir = os.path.join(hermes_dir, \"belam-codex\", \".gitnexus\")\n        if os.path.isdir(gitnexus_dir):\n            cache_to_use = run_subprocess(\n                f\"cd {hermes_dir}/belam-codex && npx --yes gitnexus query --repo belam-codex 'symbol' 2>/dev/null || echo ''\",\n                timeout=15\n            )\n            _save_cache(cache_to_use)\n\n    builder.process_gitnexus_cache(cache_to_use)\n    builder.build_adjacency()\n    _save_graph_cache(agi_dir, builder, cache_to_use)\n\n    elapsed_ms = (time.perf_counter() - start) * 1000\n    return builder, elapsed_ms\n\n\nif __name__ == \"__main__\":\n    import sys\n    hermes = os.path.expanduser(\"~/.hermes\")\n    agi = os.path.dirname(os.path.abspath(__file__))\n\n    builder, elapsed = build_graph(hermes, agi)\n    stats = builder.get_stats()\n\n    print(f\"Graph build: {elapsed:.2f}ms\")\n    print(f\"Nodes: {stats['node_count']}\")\n    print(f\"Edges: {stats['edge_count']}\")\n    print(f\"Types: {stats['nodes_by_type']}\")\n"}],"isError":false,"timestamp":1777534753601}}
{"type":"message","id":"386c8ea8","parentId":"4a6c1fbb","timestamp":"2026-04-30T07:39:38.313Z","message":{"role":"assistant","content":[{"type":"thinking","thinking":"I see there are two places with the limits:1. `_cached_build` function (lines ~620-645)\n2. Cold build path (lines ~700-745)I need to update both. Let me use more specific context to make each edit unique. The key differences are:\n- In _cached_build: has comments like \"limit 10 — only titles/rationale, no tag nodes\"\n- In cold build: has comments like \"limit 10 — fallback cold path\" or \"fallback cold path\" or \"(fallback cold path)\"\n\nLet me make targeted edits with unique context:","thinkingSignature":"4b6c15cd24cb3e457bea327da04698c919d8591e3072006b08603a2acc86c9ef"},{"type":"text","text":"Now I'll edit both locations with unique context:\n"},{"type":"toolCall","id":"call_function_jdxy8db1i65p_1","name":"edit","arguments":{"path":"/home/ubuntu/.hermes/agi/graph_builder.py","edits":[{"oldText":"    # Parse AGENTS.md\n    agents_md = os.path.join(hermes_dir, \"belam-codex\", \"AGENTS.md\")\n    builder.parse_agents_md(agents_md)\n\n    # Parse memory files\n    memory_dir = os.path.join(hermes_dir, \"belam-codex\", \"memory\")\n    builder.parse_memory_files(memory_dir, limit=5)\n\n    # Parse schema files\n    schema_dir = os.path.join(hermes_dir, \"belam-codex\", \"schemas\")\n    builder.parse_schema_files(schema_dir)\n\n    # Parse decisions (limit 10 — only titles/rationale, no tag nodes)\n    decisions_dir = os.path.join(hermes_dir, \"belam-codex\", \"decisions\")\n    if os.path.isdir(decisions_dir):\n        builder.parse_decisions(decisions_dir, limit=10)\n\n    # Parse lessons (limit 10 — only titles/summaries, no tag nodes)\n    lessons_dir = os.path.join(hermes_dir, \"belam-codex\", \"lessons\")\n    if os.path.isdir(lessons_dir):\n        builder.parse_lessons(lessons_dir, limit=10)\n\n    # Parse tasks (limit 50 — task nodes with status/priority/depends_on edges)\n    tasks_dir = os.path.join(hermes_dir, \"belam-codex\", \"tasks\")\n    if os.path.isdir(tasks_dir):\n        builder.parse_tasks(tasks_dir, limit=50)\n\n    # Parse goals (goal nodes with status/priority/urgency)\n    goals_dir = os.path.join(hermes_dir, \"belam-codex\", \"goals\")\n    if os.path.isdir(goals_dir):\n        builder.parse_goals(goals_dir)","newText":"    # Parse AGENTS.md\n    agents_md = os.path.join(hermes_dir, \"belam-codex\", \"AGENTS.md\")\n    builder.parse_agents_md(agents_md)\n\n    # Parse memory files (expanded to 30)\n    memory_dir = os.path.join(hermes_dir, \"belam-codex\", \"memory\")\n    builder.parse_memory_files(memory_dir, limit=30)\n\n    # Parse schema files\n    schema_dir = os.path.join(hermes_dir, \"belam-codex\", \"schemas\")\n    builder.parse_schema_files(schema_dir)\n\n    # Parse decisions (expanded to 100)\n    decisions_dir = os.path.join(hermes_dir, \"belam-codex\", \"decisions\")\n    if os.path.isdir(decisions_dir):\n        builder.parse_decisions(decisions_dir, limit=100)\n\n    # Parse lessons (expanded to 100)\n    lessons_dir = os.path.join(hermes_dir, \"belam-codex\", \"lessons\")\n    if os.path.isdir(lessons_dir):\n        builder.parse_lessons(lessons_dir, limit=100)\n\n    # Parse tasks (expanded to all 84)\n    tasks_dir = os.path.join(hermes_dir, \"belam-codex\", \"tasks\")\n    if os.path.isdir(tasks_dir):\n        builder.parse_tasks(tasks_dir, limit=100)\n\n    # Parse goals (goal nodes with status/priority/urgency)\n    goals_dir = os.path.join(hermes_dir, \"belam-codex\", \"goals\")\n    if os.path.isdir(goals_dir):\n        builder.parse_goals(goals_dir)"},{"oldText":"    # Cold build path\n    init_cache(agi_dir)\n    builder = GraphBuilder()\n\n    # Parse AGENTS.md\n    agents_md = os.path.join(hermes_dir, \"belam-codex\", \"AGENTS.md\")\n    builder.parse_agents_md(agents_md)\n\n    # Parse memory files\n    memory_dir = os.path.join(hermes_dir, \"belam-codex\", \"memory\")\n    builder.parse_memory_files(memory_dir, limit=5)\n\n    # Parse schema files\n    schema_dir = os.path.join(hermes_dir, \"belam-codex\", \"schemas\")\n    builder.parse_schema_files(schema_dir)\n\n    # Parse decisions (limit 10 — fallback cold path)\n    decisions_dir = os.path.join(hermes_dir, \"belam-codex\", \"decisions\")\n    if os.path.isdir(decisions_dir):\n        builder.parse_decisions(decisions_dir, limit=10)\n\n    # Parse lessons (limit 10 — fallback cold path)\n    lessons_dir = os.path.join(hermes_dir, \"belam-codex\", \"lessons\")\n    if os.path.isdir(lessons_dir):\n        builder.parse_lessons(lessons_dir, limit=10)\n\n    # Parse tasks (fallback cold path)\n    tasks_dir = os.path.join(hermes_dir, \"belam-codex\", \"tasks\")\n    if os.path.isdir(tasks_dir):\n        builder.parse_tasks(tasks_dir, limit=50)\n\n    # Parse goals (fallback cold path)\n    goals_dir = os.path.join(hermes_dir, \"belam-codex\", \"goals\")\n    if os.path.isdir(goals_dir):\n        builder.parse_goals(goals_dir)","newText":"    # Cold build path\n    init_cache(agi_dir)\n    builder = GraphBuilder()\n\n    # Parse AGENTS.md\n    agents_md = os.path.join(hermes_dir, \"belam-codex\", \"AGENTS.md\")\n    builder.parse_agents_md(agents_md)\n\n    # Parse memory files (expanded to 30)\n    memory_dir = os.path.join(hermes_dir, \"belam-codex\", \"memory\")\n    builder.parse_memory_files(memory_dir, limit=30)\n\n    # Parse schema files\n    schema_dir = os.path.join(hermes_dir, \"belam-codex\", \"schemas\")\n    builder.parse_schema_files(schema_dir)\n\n    # Parse decisions (expanded to 100)\n    decisions_dir = os.path.join(hermes_dir, \"belam-codex\", \"decisions\")\n    if os.path.isdir(decisions_dir):\n        builder.parse_decisions(decisions_dir, limit=100)\n\n    # Parse lessons (expanded to 100)\n    lessons_dir = os.path.join(hermes_dir, \"belam-codex\", \"lessons\")\n    if os.path.isdir(lessons_dir):\n        builder.parse_lessons(lessons_dir, limit=100)\n\n    # Parse tasks (expanded to all 84)\n    tasks_dir = os.path.join(hermes_dir, \"belam-codex\", \"tasks\")\n    if os.path.isdir(tasks_dir):\n        builder.parse_tasks(tasks_dir, limit=100)\n\n    # Parse goals (goal nodes with status/priority/urgency)\n    goals_dir = os.path.join(hermes_dir, \"belam-codex\", \"goals\")\n    if os.path.isdir(goals_dir):\n        builder.parse_goals(goals_dir)"}]}}],"api":"anthropic-messages","provider":"minimax","model":"MiniMax-M2.7","usage":{"input":14667,"output":1810,"cacheRead":10071,"cacheWrite":0,"totalTokens":26548,"cost":{"input":0.0044001,"output":0.002172,"cacheRead":0.0006042599999999999,"cacheWrite":0,"total":0.007176359999999999}},"stopReason":"toolUse","timestamp":1777534753602,"responseId":"06423a2239953016473116bd17ade55b"}}
{"type":"message","id":"d8fd7b21","parentId":"386c8ea8","timestamp":"2026-04-30T07:39:38.322Z","message":{"role":"toolResult","toolCallId":"call_function_jdxy8db1i65p_1","toolName":"edit","content":[{"type":"text","text":"Successfully replaced 2 block(s) in /home/ubuntu/.hermes/agi/graph_builder.py."}],"details":{"diff":"     ...\n 619     # Parse AGENTS.md\n 620     agents_md = os.path.join(hermes_dir, \"belam-codex\", \"AGENTS.md\")\n 621     builder.parse_agents_md(agents_md)\n 622 \n-623     # Parse memory files\n+623     # Parse memory files (expanded to 30)\n 624     memory_dir = os.path.join(hermes_dir, \"belam-codex\", \"memory\")\n-625     builder.parse_memory_files(memory_dir, limit=5)\n+625     builder.parse_memory_files(memory_dir, limit=30)\n 626 \n 627     # Parse schema files\n 628     schema_dir = os.path.join(hermes_dir, \"belam-codex\", \"schemas\")\n 629     builder.parse_schema_files(schema_dir)\n 630 \n-631     # Parse decisions (limit 10 — only titles/rationale, no tag nodes)\n+631     # Parse decisions (expanded to 100)\n 632     decisions_dir = os.path.join(hermes_dir, \"belam-codex\", \"decisions\")\n 633     if os.path.isdir(decisions_dir):\n-634         builder.parse_decisions(decisions_dir, limit=10)\n+634         builder.parse_decisions(decisions_dir, limit=100)\n 635 \n-636     # Parse lessons (limit 10 — only titles/summaries, no tag nodes)\n+636     # Parse lessons (expanded to 100)\n 637     lessons_dir = os.path.join(hermes_dir, \"belam-codex\", \"lessons\")\n 638     if os.path.isdir(lessons_dir):\n-639         builder.parse_lessons(lessons_dir, limit=10)\n+639         builder.parse_lessons(lessons_dir, limit=100)\n 640 \n-641     # Parse tasks (limit 50 — task nodes with status/priority/depends_on edges)\n+641     # Parse tasks (expanded to all 84)\n 642     tasks_dir = os.path.join(hermes_dir, \"belam-codex\", \"tasks\")\n 643     if os.path.isdir(tasks_dir):\n-644         builder.parse_tasks(tasks_dir, limit=50)\n+644         builder.parse_tasks(tasks_dir, limit=100)\n 645 \n 646     # Parse goals (goal nodes with status/priority/urgency)\n 647     goals_dir = os.path.join(hermes_dir, \"belam-codex\", \"goals\")\n 648     if os.path.isdir(goals_dir):\n     ...\n 713     # Parse AGENTS.md\n 714     agents_md = os.path.join(hermes_dir, \"belam-codex\", \"AGENTS.md\")\n 715     builder.parse_agents_md(agents_md)\n 716 \n-717     # Parse memory files\n+717     # Parse memory files (expanded to 30)\n 718     memory_dir = os.path.join(hermes_dir, \"belam-codex\", \"memory\")\n-719     builder.parse_memory_files(memory_dir, limit=5)\n+719     builder.parse_memory_files(memory_dir, limit=30)\n 720 \n 721     # Parse schema files\n 722     schema_dir = os.path.join(hermes_dir, \"belam-codex\", \"schemas\")\n 723     builder.parse_schema_files(schema_dir)\n 724 \n-725     # Parse decisions (limit 10 — fallback cold path)\n+725     # Parse decisions (expanded to 100)\n 726     decisions_dir = os.path.join(hermes_dir, \"belam-codex\", \"decisions\")\n 727     if os.path.isdir(decisions_dir):\n-728         builder.parse_decisions(decisions_dir, limit=10)\n+728         builder.parse_decisions(decisions_dir, limit=100)\n 729 \n-730     # Parse lessons (limit 10 — fallback cold path)\n+730     # Parse lessons (expanded to 100)\n 731     lessons_dir = os.path.join(hermes_dir, \"belam-codex\", \"lessons\")\n 732     if os.path.isdir(lessons_dir):\n-733         builder.parse_lessons(lessons_dir, limit=10)\n+733         builder.parse_lessons(lessons_dir, limit=100)\n 734 \n-735     # Parse tasks (fallback cold path)\n+735     # Parse tasks (expanded to all 84)\n 736     tasks_dir = os.path.join(hermes_dir, \"belam-codex\", \"tasks\")\n 737     if os.path.isdir(tasks_dir):\n-738         builder.parse_tasks(tasks_dir, limit=50)\n+738         builder.parse_tasks(tasks_dir, limit=100)\n 739 \n-740     # Parse goals (fallback cold path)\n+740     # Parse goals (goal nodes with status/priority/urgency)\n 741     goals_dir = os.path.join(hermes_dir, \"belam-codex\", \"goals\")\n 742     if os.path.isdir(goals_dir):\n 743         builder.parse_goals(goals_dir)\n 744 \n     ...","firstChangedLine":623},"isError":false,"timestamp":1777534778322}}
{"type":"message","id":"ad9c5c16","parentId":"d8fd7b21","timestamp":"2026-04-30T07:39:44.609Z","message":{"role":"assistant","content":[{"type":"thinking","thinking":"Good, edits applied. Now I need to:\n1. git commit\n2. run_experiment (./autoresearch.sh)\n3. log_experiment (keep if improved, discard if not)\n\nSince the primary metric is at noise floor (~0.03ms) and we're expanding data limits, the warm load time should stay at noise floor. The change is \"expand data richness\" so we're not optimizing for primary metric anymore. The \"keep\" criterion should be based on whether the metric changed significantly or if we expanded graph richness without regression.\n\nLet me commit, then run the experiment.","thinkingSignature":"10bfbe315a553d010a34416ce8cfbd4c59efc31ff17656454f66a29a90a729fb"},{"type":"text","text":"Now commit and run experiment:\n"},{"type":"toolCall","id":"call_function_6mlxcvxnripu_1","name":"bash","arguments":{"command":"cd /home/ubuntu/.hermes/agi && git add -A && git commit -m \"Expand data limits: memory 5->30, decisions 10->100, lessons 10->100, tasks 50->100\""}}],"api":"anthropic-messages","provider":"minimax","model":"MiniMax-M2.7","usage":{"input":16513,"output":197,"cacheRead":10071,"cacheWrite":0,"totalTokens":26781,"cost":{"input":0.0049539,"output":0.0002364,"cacheRead":0.0006042599999999999,"cacheWrite":0,"total":0.00579456}},"stopReason":"toolUse","timestamp":1777534778323,"responseId":"06423a3acca78c2a371566e32b1540e3"}}
{"type":"message","id":"64b8531a","parentId":"ad9c5c16","timestamp":"2026-04-30T07:39:44.629Z","message":{"role":"toolResult","toolCallId":"call_function_6mlxcvxnripu_1","toolName":"bash","content":[{"type":"text","text":"[master 421b9a8] Expand data limits: memory 5->30, decisions 10->100, lessons 10->100, tasks 50->100\n 4 files changed, 45 insertions(+), 17 deletions(-)\n create mode 100644 sessions/2026-04-30T07-38-17-430Z_019ddd52-ffd6-7058-b89b-4b00833c5b20.jsonl\n"}],"isError":false,"timestamp":1777534784629}}
{"type":"message","id":"bfca7c15","parentId":"64b8531a","timestamp":"2026-04-30T07:39:47.026Z","message":{"role":"assistant","content":[{"type":"thinking","thinking":"Now run the experiment:","thinkingSignature":"c6c66ed74f55f757f0c4af743297ed018bb25d5d218006c4f4f08f53ce87e190"},{"type":"toolCall","id":"call_function_eaqz91cs6bxy_1","name":"run_experiment","arguments":{"command":"cd /home/ubuntu/.hermes/agi && ./autoresearch.sh","timeout_seconds":120}}],"api":"anthropic-messages","provider":"minimax","model":"MiniMax-M2.7","usage":{"input":16823,"output":58,"cacheRead":10071,"cacheWrite":0,"totalTokens":26952,"cost":{"input":0.0050469,"output":0.0000696,"cacheRead":0.0006042599999999999,"cacheWrite":0,"total":0.00572076}},"stopReason":"toolUse","timestamp":1777534784631,"responseId":"06423a4147c1645ae894cfbb48a6c25b"}}
