{"type":"session","version":3,"id":"019ddd21-49ac-7242-a477-d8ed68a68595","timestamp":"2026-04-30T06:43:59.532Z","cwd":"/home/ubuntu/.hermes/agi"}
{"type":"model_change","id":"d5d3c529","parentId":null,"timestamp":"2026-04-30T06:44:03.665Z","provider":"minimax","modelId":"MiniMax-M2.7"}
{"type":"thinking_level_change","id":"374f436a","parentId":"d5d3c529","timestamp":"2026-04-30T06:44:03.665Z","thinkingLevel":"medium"}
{"type":"custom","customType":"plannotator","data":{"phase":"idle","planFilePath":"PLAN.md","savedState":null},"id":"e6503b20","parentId":"374f436a","timestamp":"2026-04-30T06:44:03.681Z"}
{"type":"message","id":"887bd55c","parentId":"e6503b20","timestamp":"2026-04-30T06:44:03.702Z","message":{"role":"user","content":[{"type":"text","text":"Resume the autoresearch loop in ~/.hermes/agi/.\n     Read ~/.hermes/agi/autoresearch.md (current state + what's been tried).\n     Run exactly ONE experiment iteration:\n       1. Make one code change (small, targeted)\n       2. git commit\n       3. run_experiment (./autoresearch.sh)\n       4. log_experiment (keep if improved, discard if not)\n     After log_experiment, stop — do NOT loop again.\n     Report iteration result in one line to stdout."}],"timestamp":1777531443687}}
{"type":"message","id":"14f21c39","parentId":"887bd55c","timestamp":"2026-04-30T06:44:07.741Z","message":{"role":"assistant","content":[{"type":"thinking","thinking":"Let me start by reading the autoresearch state files to understand what's been tried and what the current situation is.","thinkingSignature":"52dee9b67a5d6bbd2b81facaa7f8fd751707d0793dce176880d2b2372f054e87"},{"type":"toolCall","id":"call_function_1n6e3aez85w2_1","name":"read","arguments":{"path":"/home/ubuntu/.hermes/agi/autoresearch.md"}},{"type":"toolCall","id":"call_function_1n6e3aez85w2_2","name":"read","arguments":{"path":"/home/ubuntu/.hermes/agi/autoresearch.ideas.md"}}],"api":"anthropic-messages","provider":"minimax","model":"MiniMax-M2.7","usage":{"input":55,"output":93,"cacheRead":10071,"cacheWrite":113,"totalTokens":10332,"cost":{"input":0.000016499999999999998,"output":0.00011159999999999999,"cacheRead":0.0006042599999999999,"cacheWrite":0.000042375,"total":0.0007747349999999999}},"stopReason":"toolUse","timestamp":1777531443716,"responseId":"06422d34f808ae8ce82c3f893fdb8474"}}
{"type":"message","id":"f9137a1e","parentId":"14f21c39","timestamp":"2026-04-30T06:44:07.769Z","message":{"role":"toolResult","toolCallId":"call_function_1n6e3aez85w2_1","toolName":"read","content":[{"type":"text","text":"# Autoresearch: DB-Augmented Directed Code Generation via Unified Graph Memory\n\n## Objective\n\nInvestigate using relational databases (Postgres-style linking/reference) as the backbone for agent-accessible knowledge graphs. Goal: enable agents to navigate code, memory, tasks, and ideas through a single unified graph interface that is equally readable by humans (ASCII art maps) and machines (structured DB queries).\n\nCore inspiration repos:\n- **GitNexus** (abhigyanpatwari) — graph-based code intelligence\n- **MemPalace** (MemPalace/mempalace) — agent memory graph\n- **llm-wiki-compiler** (atomicmemory) — wiki-to-graph pipeline\n- **LanguageAgentTreeSearch** (lapisrocks) — LATS-style reasoning\n- **SkillZero** (ZJU-REAL) — skill learning from graphs\n- **pi /tree** — pi CLI tree/graph rendering\n\nCore questions to explore:\n1. Can agents perceive ASCII visual graphs as efficiently as humans?\n2. Can we steer agents on CoT/reasoning paths using nothing but graphical-rendered maps?\n3. Can a single graph representation span episodic memories, coding ideas, task state, and world models?\n4. Can the \"soul\" (model) feel seamlessly embodied by the \"memory harness\" (graph)?\n5. The **holographic layer coupling** — how do we bind multiple context layers into a single coherent agent experience?\n\n## Metrics\n- **Primary**: `graph_build_time_ms` (ms, lower is better) — time to generate a graph from source state\n- **Secondary**: `graph_node_count` (nodes), `graph_edge_count` (edges), `query_time_ms` (DB query for path finding), `ascii_render_lines` (output length of rendered graph), `agent_comprehension_score` (manual 1-5 assessment per run in ASI)\n\n## How to Run\n`./autoresearch.sh` — outputs `METRIC name=number` lines.\n\n## Files in Scope\n\nAll files created under `.hermes/agi/`:\n- `schema.sql` — Postgres schema for the unified graph (nodes, edges, types, metadata)\n- `graph_builder.py` — builds graph from source material (codebases, memory files, task state)\n- `asciirender.py` — renders graph as ASCII art for agent/human consumption\n- `query_engine.py` — path finding, traversal, CoT graph-walking\n- `pi_tree_adapter.py` — adapter to feed graph output into pi's /tree feature\n- `experiments/` — subdirectory per experiment run storing inputs/outputs\n- `autoresearch.sh` — benchmark driver\n\n## Off Limits\n\n- Do not modify pi's internal source code\n- Do not touch the GitNexus index directly outside of normal git operations\n- No new system dependencies — use only Python stdlib + psycopg2-binary\n\n## Constraints\n\n- All generated code must be valid Python (no pseudocode in final output)\n- ASCII graph output must be ≤200 lines and ≤200 chars wide\n- DB schema must be Postgres-compatible (duckdb fallback OK for local runs)\n- pi subagent calls must be non-blocking and report results through ASI\n\n## What's Been Tried\n\n### Iteration 1-4: Performance Optimizations\n- **Baseline**: 377.21ms (55 nodes, 54 edges)\n- Pre-compiled regex patterns (minor improvement)\n- Gitnexus availability check (skip npx call if no index)\n- Persistent JSON cache file for gitnexus results\n- Cache loading moved before timing\n- **Result**: 0.37ms (75 nodes) — 1019x faster\n\n### Iteration 5-6: Modular System\n- Created `schema.sql` — Postgres-compatible graph schema\n- Created `graph_builder.py` — modular graph construction\n- Created `query_engine.py` — BFS/Dijkstra path finding\n- Created `asciirender.py` — ASCII art rendering\n- Created `pi_tree_adapter.py` — pi /tree integration\n- **Result**: 2.15ms (225 nodes) — 3x more data, still 175x faster than original\n\n### Node Composition (current)\n- doc_section: 22 (from AGENTS.md)\n- code_reference: 27 (code snippets)\n- memory_session: 5 (episodic memories)\n- schema_entity: 10 (schema definitions)\n- schema_field: 141 (schema fields)\n- gitnexus_definition: 20 (code symbols)\n\n### Files Created\n- `schema.sql` — Postgres/DuckDB graph schema\n- `graph_builder.py` — Modular graph builder (225 nodes)\n- `query_engine.py` — Path finding engine\n- `asciirender.py` — ASCII renderer\n- `pi_tree_adapter.py` — pi tree integration\n"}],"isError":false,"timestamp":1777531447769}}
{"type":"message","id":"db249cbd","parentId":"f9137a1e","timestamp":"2026-04-30T06:44:07.770Z","message":{"role":"toolResult","toolCallId":"call_function_1n6e3aez85w2_2","toolName":"read","content":[{"type":"text","text":"# Autoresearch Ideas\n\n## Tried & Stale (NOT worth revisiting)\n- [x] Pre-compile regex in graph_builder module — done in iter 1-4\n- [x] Module-level pickle import — no effect (noise floor)\n- [x] __slots__ on GraphBuilder — no effect (pickle.load is the bottleneck)\n- [x] Add decisions/lessons parsers — 2.4x slower at 436 nodes (pickle scales with size)\n- [x] Persistent gitnexus JSON cache — done earlier\n- [x] Pre-warm pickle cache before timing — done, gives 0.50ms\n\n## Promising (not tried)\n- [ ] Use `json` module instead of `pickle` for cache — json.load is faster than pickle.load for small objects? (Test vs pickle at 0.50ms)\n- [ ] Pre-build node index `{type: [nodes]}` in GraphBuilder.__init__ — saves dict lookups in get_stats()\n- [ ] Lazy adj building — only build adjacency on demand (for cache-hit path, adj is rebuilt from pickle each time)\n- [ ] Skip `_node_ids` set reconstruction on cache load — derive from nodes directly in pickle\n- [ ] Compact node representation — use tuples instead of dicts for nodes (smaller pickle, faster load)\n- [ ] Incremental updates via file watcher — update pickle delta instead of full rebuild (would need cache invalidation strategy)\n\n## Data Source Expansion (secondary metric: node richness)\n- [ ] Parse tasks/ directory for task state nodes\n- [ ] Parse state/ directory for runtime state nodes\n- [ ] Parse pi-agi.log for session activity patterns\n\n## Query Optimizations (secondary metric: query_time_ms)\n- [ ] Bidirectional BFS — faster path finding for disconnected graphs\n- [ ] Pre-compute reachability matrix for common query pairs\n\n## Visualization\n- [ ] Add graphviz DOT output\n- [ ] Add mermaid diagram output\n- [ ] Compact ASCII renderer (pack more nodes per line)\n\n## Interesting Findings\n- Gitnexus lbug file is NOT SQLite (despite .db-like header \"LBUG(\")\n- npx gitnexus call takes ~1.9s but is cacheable\n- 0.50ms = noise floor for pickle-based caching with current data (225 nodes)\n- Pickle load time scales linearly with node count (~0.5ms/225 nodes = ~2.2µs per node)\n\n## Deferred Ideas\n- Multi-repo graph building (cross-reference belam-codex + machinelearning)\n- Embeddings-based semantic search for graph queries\n- LLM-based graph summarization\n- duckdb backend for persistent graph storage\n\n## Baseline\n- Original: 377.21ms (55 nodes, 54 edges) — pure Python parsing\n- Best optimized: 0.50ms (225 nodes) — pickle cache hit, 754x faster\n"}],"isError":false,"timestamp":1777531447770}}
{"type":"message","id":"8b026119","parentId":"db249cbd","timestamp":"2026-04-30T06:44:12.434Z","message":{"role":"assistant","content":[{"type":"thinking","thinking":"Now let me read the current state of the code to understand what I should optimize. Let me look at the graph_builder.py and understand the current implementation.","thinkingSignature":"8d0e27bdc7580429f18b1ef5753d21873475ca5e1d5f4d34f0e14613cc83dcb1"},{"type":"toolCall","id":"call_function_ojt4m567wfl0_1","name":"read","arguments":{"path":"/home/ubuntu/.hermes/agi/graph_builder.py"}},{"type":"toolCall","id":"call_function_ojt4m567wfl0_2","name":"read","arguments":{"path":"/home/ubuntu/.hermes/agi/autoresearch.sh"}}],"api":"anthropic-messages","provider":"minimax","model":"MiniMax-M2.7","usage":{"input":1893,"output":99,"cacheRead":10071,"cacheWrite":0,"totalTokens":12063,"cost":{"input":0.0005679,"output":0.0001188,"cacheRead":0.0006042599999999999,"cacheWrite":0,"total":0.0012909599999999999}},"stopReason":"toolUse","timestamp":1777531447771,"responseId":"06422d382c4312e34169f5cf7b800b32"}}
