{"type":"message","id":"db0b0ab4","parentId":"7e65965e","timestamp":"2026-04-30T08:31:51.562Z","message":{"role":"assistant","content":[{"type":"thinking","thinking":"Let me look at the mapper_batch files mentioned in the ideas as they might contain useful relationship data:","thinkingSignature":"a65c423ecdf867b92fef4a1f3acd4936f1382bb9922db425965d5730fe09d20c"},{"type":"toolCall","id":"call_function_qq559qd1myze_1","name":"bash","arguments":{"command":"head -100 /home/ubuntu/.hermes/belam-codex/canvas/mapper_batch_0.json 2>/dev/null"}}],"api":"anthropic-messages","provider":"minimax","model":"MiniMax-M2.7","usage":{"input":21801,"output":73,"cacheRead":10071,"cacheWrite":0,"totalTokens":31945,"cost":{"input":0.0065403,"output":0.0000876,"cacheRead":0.0006042599999999999,"cacheWrite":0,"total":0.00723216}},"stopReason":"toolUse","timestamp":1777537908274,"responseId":"0642467422b0aa56d643d8dce302b506"}}
