{"type":"session","version":3,"id":"019ddd65-d264-7538-a2c7-e02b6f4794ed","timestamp":"2026-04-30T07:58:50.980Z","cwd":"/home/ubuntu/.hermes/agi"}
{"type":"model_change","id":"45ef8797","parentId":null,"timestamp":"2026-04-30T07:58:55.095Z","provider":"minimax","modelId":"MiniMax-M2.7"}
{"type":"thinking_level_change","id":"f95a01a2","parentId":"45ef8797","timestamp":"2026-04-30T07:58:55.095Z","thinkingLevel":"medium"}
{"type":"custom","customType":"plannotator","data":{"phase":"idle","planFilePath":"PLAN.md","savedState":null},"id":"2cb1635d","parentId":"f95a01a2","timestamp":"2026-04-30T07:58:55.110Z"}
{"type":"message","id":"66de8f05","parentId":"2cb1635d","timestamp":"2026-04-30T07:58:55.131Z","message":{"role":"user","content":[{"type":"text","text":"Resume the autoresearch loop in ~/.hermes/agi/.\n     Read ~/.hermes/agi/autoresearch.md (current state + what's been tried).\n     Run exactly ONE experiment iteration:\n       1. Make one code change (small, targeted)\n       2. git commit\n       3. run_experiment (./autoresearch.sh)\n       4. log_experiment (keep if improved, discard if not)\n     After log_experiment, stop — do NOT loop again.\n     Report iteration result in one line to stdout."}],"timestamp":1777535935116}}
{"type":"message","id":"6fb80fff","parentId":"66de8f05","timestamp":"2026-04-30T07:58:58.673Z","message":{"role":"assistant","content":[{"type":"thinking","thinking":"Let me start by reading the autoresearch files to understand the current state and what's been tried.","thinkingSignature":"0d42f5785a30b2f204a4877121a2118ad34afcac567a39be51c95019b1eb29d4"},{"type":"toolCall","id":"call_function_utzdzcnpyx8z_1","name":"read","arguments":{"path":"/home/ubuntu/.hermes/agi/autoresearch.md"}},{"type":"toolCall","id":"call_function_utzdzcnpyx8z_2","name":"read","arguments":{"path":"/home/ubuntu/.hermes/agi/autoresearch.ideas.md"}},{"type":"toolCall","id":"call_function_utzdzcnpyx8z_3","name":"read","arguments":{"path":"/home/ubuntu/.hermes/agi/autoresearch.jsonl"}}],"api":"anthropic-messages","provider":"minimax","model":"MiniMax-M2.7","usage":{"input":55,"output":122,"cacheRead":10071,"cacheWrite":113,"totalTokens":10361,"cost":{"input":0.000016499999999999998,"output":0.00014639999999999998,"cacheRead":0.0006042599999999999,"cacheWrite":0.000042375,"total":0.0008095349999999999}},"stopReason":"toolUse","timestamp":1777535935146,"responseId":"06423ebf9adec5968569d1099c5b9550"}}
{"type":"message","id":"0a5870f7","parentId":"6fb80fff","timestamp":"2026-04-30T07:58:58.700Z","message":{"role":"toolResult","toolCallId":"call_function_utzdzcnpyx8z_1","toolName":"read","content":[{"type":"text","text":"# Autoresearch: DB-Augmented Directed Code Generation via Unified Graph Memory\n\n## Objective\n\nInvestigate using relational databases (Postgres-style linking/reference) as the backbone for agent-accessible knowledge graphs. Goal: enable agents to navigate code, memory, tasks, and ideas through a single unified graph interface that is equally readable by humans (ASCII art maps) and machines (structured DB queries).\n\nCore inspiration repos:\n- **GitNexus** (abhigyanpatwari) — graph-based code intelligence\n- **MemPalace** (MemPalace/mempalace) — agent memory graph\n- **llm-wiki-compiler** (atomicmemory) — wiki-to-graph pipeline\n- **LanguageAgentTreeSearch** (lapisrocks) — LATS-style reasoning\n- **SkillZero** (ZJU-REAL) — skill learning from graphs\n- **pi /tree** — pi CLI tree/graph rendering\n\nCore questions to explore:\n1. Can agents perceive ASCII visual graphs as efficiently as humans?\n2. Can we steer agents on CoT/reasoning paths using nothing but graphical-rendered maps?\n3. Can a single graph representation span episodic memories, coding ideas, task state, and world models?\n4. Can the \"soul\" (model) feel seamlessly embodied by the \"memory harness\" (graph)?\n5. The **holographic layer coupling** — how do we bind multiple context layers into a single coherent agent experience?\n\n## Metrics\n- **Primary**: `graph_build_time_ms` (ms, lower is better) — time to generate a graph from source state\n- **Secondary**: `graph_node_count` (nodes), `graph_edge_count` (edges), `query_time_ms` (DB query for path finding), `ascii_render_lines` (output length of rendered graph), `agent_comprehension_score` (manual 1-5 assessment per run in ASI)\n\n## How to Run\n`./autoresearch.sh` — outputs `METRIC name=number` lines.\n\n## Files in Scope\n\nAll files created under `.hermes/agi/`:\n- `schema.sql` — Postgres schema for the unified graph (nodes, edges, types, metadata)\n- `graph_builder.py` — builds graph from source material (codebases, memory files, task state)\n- `asciirender.py` — renders graph as ASCII art for agent/human consumption\n- `query_engine.py` — path finding, traversal, CoT graph-walking\n- `pi_tree_adapter.py` — adapter to feed graph output into pi's /tree feature\n- `experiments/` — subdirectory per experiment run storing inputs/outputs\n- `autoresearch.sh` — benchmark driver\n\n## Off Limits\n\n- Do not modify pi's internal source code\n- Do not touch the GitNexus index directly outside of normal git operations\n- No new system dependencies — use only Python stdlib + psycopg2-binary\n\n## Constraints\n\n- All generated code must be valid Python (no pseudocode in final output)\n- ASCII graph output must be ≤200 lines and ≤200 chars wide\n- DB schema must be Postgres-compatible (duckdb fallback OK for local runs)\n- pi subagent calls must be non-blocking and report results through ASI\n\n## What's Been Tried\n\n### Iteration 1-4: Performance Optimizations\n- **Baseline**: 377.21ms (55 nodes, 54 edges)\n- Pre-compiled regex patterns (minor improvement)\n- Gitnexus availability check (skip npx call if no index)\n- Persistent JSON cache file for gitnexus results\n- Cache loading moved before timing\n- **Result**: 0.37ms (75 nodes) — 1019x faster\n\n### Iteration 5-6: Modular System\n- Created `schema.sql` — Postgres-compatible graph schema\n- Created `graph_builder.py` — modular graph construction\n- Created `query_engine.py` — BFS/Dijkstra path finding\n- Created `asciirender.py` — ASCII art rendering\n- Created `pi_tree_adapter.py` — pi /tree integration\n- **Result**: 2.15ms (225 nodes) — 3x more data, still 175x faster than original\n\n### Node Composition (current — 245 nodes)\n- doc_section: 22 (from AGENTS.md)\n- code_reference: 27 (code snippets)\n- memory_session: 5 (episodic memories)\n- schema_entity: 10 (schema definitions)\n- schema_field: 141 (schema fields)\n- decision: 10 (decisions)\n- lesson: 10 (lessons)\n- gitnexus_definition: 20 (code symbols)\n- **Total**: 245 nodes, 189 edges\n\n### Noise Floor Surmounted (via lru_cache)\n- lru_cache on _cached_build() makes warm load O(1) memory lookup\n- Warm load time now independent of cached data size\n- Previous noise floor ~0.3-0.5ms (pickle.load) bypassed entirely\n- Cold build: ~3.8ms (not measured in benchmark)\n- Shift to: data expansion, query ops, or architectural changes (duckdb)\n\n### Files Created\n- `schema.sql` — Postgres/DuckDB graph schema\n- `graph_builder.py` — Modular graph builder (245 nodes, lru_cache)\n- `query_engine.py` — Path finding engine\n- `asciirender.py` — ASCII renderer\n- `pi_tree_adapter.py` — pi tree integration\n\n### Iteration 1 (this session): Restore graph richness + tuple verification\n- Restored 142 schema_field nodes (was accidentally removed in earlier optimization)\n- Extended gitnexus cache TTL 1hr → 24hr\n- Tuple nodes: 0.50ms→0.45ms at 225 nodes (10% faster, noise floor)\n- **Result**: 0.45ms (225 nodes, 189 edges) — **keep**\n\n### Baseline\n- Original: 377.21ms (55 nodes, 54 edges) — pure Python parsing\n- **Current best**: 0.03ms (245 nodes, 189 edges) — lru_cache + decisions/lessons, 12,574× faster than original\n"}],"isError":false,"timestamp":1777535938700}}
{"type":"message","id":"0317bf9a","parentId":"0a5870f7","timestamp":"2026-04-30T07:58:58.700Z","message":{"role":"toolResult","toolCallId":"call_function_utzdzcnpyx8z_2","toolName":"read","content":[{"type":"text","text":"# Autoresearch Ideas — Pruned 2026-04-30\n\n## DONE — Archived\n- [x] Pre-compile regex patterns — iter 1-4\n- [x] Gitnexus availability check + JSON cache — iter 2-3\n- [x] Pickle-based graph cache with pre-warm — iter 7\n- [x] Tuple nodes (smaller pickle) — iter 9, 15, 16\n- [x] lru_cache on builder internals — iter 21 (MAJOR breakthrough)\n- [x] Add decisions + lessons with lru_cache — iter 22\n- [x] Parse tasks/ directory — iter 23\n- [x] msgpack/json/mmap/pickle protocol micro-optimizations — REGRESSIONs confirmed noise floor\n- [x] GraphBuilder object caching (not raw tuples) — warm load O(1) regardless of node count — iter 30\n- [x] Parse goals/ — iter 24\n- [x] Parse agents/ — iter 28\n- [x] Parse canvas graph_data.json — iter 28\n- [x] Expand decisions (100→128) + lessons (100→204) — iter 30\n- [x] Expand memory (30→58) — iter 27\n\n## SATURATED — Primary metric noise floor\nThe graph_build_time_ms metric is at 0.03ms (lru_cache warm load).\n- 12,574× faster than original 377ms baseline\n- 1005× confidence above noise floor\n- lru_cache on GraphBuilder object → warm load O(1) regardless of node count\n- Further micro-optimizations: NO.\n- Serialization format experiments (pickle/json/msgpack): all REGRESSION or noise floor\n- Data expansion does NOT affect warm load (lru_cache absorbs all)\n\n## NOW WORTHWHILE — Data Expansion (richer graph, same speed)\n- [x] Parse all 84 tasks — DONE iter 25\n- [x] Parse goals/ — DONE iter 24\n- [x] Expand decisions/lessons to full set — DONE iter 30\n- [x] Expand memory to all 58 files — DONE iter 27\n- [x] Parse canvas graph_data.json — DONE iter 28\n- [x] Parse agents/ — DONE iter 28\n- [ ] Parse knowledge/ directory (15 files — semantic knowledge nodes)\n- [ ] Parse handoff/ directory (9 files — agent handoff logs)\n- [ ] Parse archive/ directory (5 files — archived code/modules)\n- [ ] Parse canvas mapper_batch files for LINK responses (causal edges across primitives)\n\n## Architectural (secondary: query_time_ms, structural richness)\n- [ ] duckdb/sqlite3 backend — persistent graph DB with SQL query engine\n  - NOT for primary metric (warm load stays 0.03ms via lru_cache)\n  - Benefits: SQL traversal, reachability queries, complex joins\n  - sqlite3 is stdlib — no new dependency needed\n  - Approach: sqlite3 in-memory graph DB that rebuilds from lru_cache on startup\n- [ ] Pre-compute reachability matrix — O(1) reachability queries\n- [ ] Optimized path query — reduce iteration count or use pre-built index\n\n## Visualization (secondary: ascii_render_lines, utility)\n- [ ] Mermaid diagram output — graphviz-free via text\n- [ ] Compact ASCII renderer — pack more nodes per line\n- [ ] pi /tree adapter — integrate with pi's built-in tree rendering\n\n## Interesting Findings\n- Gitnexus lbug file is NOT SQLite (header \"LBUG(\")\n- lru_cache on GraphBuilder object = true O(1) warm load (0.007ms bare Python, 0.03ms via benchmark)\n- pickle noise floor ~0.3-0.5ms (was the old ceiling before GraphBuilder caching)\n- 142 schema_field nodes accidentally removed then restored\n- gitnexus cache TTL 1hr → 24hr\n- Tuple reconstruction overhead scaled with node count — fixed by caching GraphBuilder directly\n- Bidirectional BFS REGRESSED query_time_ms — unidirectional BFS faster for small graphs\n\n## Deferred (low priority / speculative)\n- Multi-repo graph (belam-codex + machinelearning cross-ref)\n- Embeddings-based semantic search for graph queries\n- LLM-based graph summarization\n- Incremental lru_cache invalidation (watch source files)\n- Parse machinelearning/ for cross-repo graph edges\n\n## Current Best (iter 30)\n- 0.03ms (828 nodes, 310 edges) — lru_cache warm load, 12,574× vs original\n- Original: 377.21ms (55 nodes, 54 edges)\n- Node types: doc_section:22, code_ref:27, memory:58, schema_entity:10, schema_field:141,\n  decision:128, lesson:204, task:84, goal:5, agent_role:4, agent_boundary:15,\n  agent_capability:5, canvas_*:105, gitnexus_def:20\n- Cold build: ~33ms (non-benchmarked path)\n"}],"isError":false,"timestamp":1777535938700}}
