{"type":"message","id":"aedfd8f5","parentId":"3809dc05","timestamp":"2026-04-30T08:34:52.514Z","message":{"role":"assistant","content":[{"type":"thinking","thinking":"Still not working. Let me check if there's still a cached version in memory. Python's lru_cache persists within the same process. Let me force a fresh Python process:","thinkingSignature":"3510539cea92d2ac3fcefb0bec01bf6ccf8130ac1381be45380b8c5794bb549b"},{"type":"toolCall","id":"call_function_it00ivj4yc0y_1","name":"bash","arguments":{"command":"rm -f /home/ubuntu/.hermes/agi/.graph_cache.pkl && python3 /home/ubuntu/.hermes/agi/_benchmark.py 2>&1"}}],"api":"anthropic-messages","provider":"minimax","model":"MiniMax-M2.7","usage":{"input":41016,"output":96,"cacheRead":10071,"cacheWrite":0,"totalTokens":51183,"cost":{"input":0.0123048,"output":0.0001152,"cacheRead":0.0006042599999999999,"cacheWrite":0,"total":0.01302426}},"stopReason":"toolUse","timestamp":1777538088024,"responseId":"06424728d6e624d60eb81bfc4626d099"}}
{"type":"message","id":"2d146ea9","parentId":"aedfd8f5","timestamp":"2026-04-30T08:34:52.659Z","message":{"role":"toolResult","toolCallId":"call_function_it00ivj4yc0y_1","toolName":"bash","content":[{"type":"text","text":"METRIC graph_build_time_ms=0.03\nMETRIC graph_node_count=960\nMETRIC graph_edge_count=496\nMETRIC query_time_ms=0.0\nMETRIC ascii_render_lines=55\n\nMETRIC graph_build_time_ms=0.03\nMETRIC graph_node_count=960\nMETRIC graph_edge_count=496\nMETRIC query_time_ms=0.0\nMETRIC ascii_render_lines=55\nUsing modular system: True\n"}],"isError":false,"timestamp":1777538092659}}
{"type":"message","id":"12b7069c","parentId":"2d146ea9","timestamp":"2026-04-30T08:34:59.257Z","message":{"role":"assistant","content":[{"type":"thinking","thinking":"The skill nodes still aren't being added. Let me debug more carefully - maybe the skills directory isn't being found:","thinkingSignature":"873abc3c0f302d691f4573a3a21bde83df5bb0062e683d0fb549aa546dc33fc0"},{"type":"toolCall","id":"call_function_y9i1jfx8wnal_1","name":"bash","arguments":{"command":"python3 -c \"\nimport os\nimport sys\nsys.path.insert(0, '/home/ubuntu/.hermes/agi')\n# Force fresh import\nif 'graph_builder' in sys.modules:\n    del sys.modules['graph_builder']\n\n# Now import fresh\nimport importlib\nimport graph_builder\nimportlib.reload(graph_builder)\n\nhermes = os.path.expanduser('~/.hermes')\nagi_dir = '/home/ubuntu/.hermes/agi'\nskills_dir = os.path.join(hermes, 'skills')\nprint(f'skills_dir: {skills_dir}')\nprint(f'Exists: {os.path.isdir(skills_dir)}')\n\n# Create a fresh builder and test parse_skills\nbuilder = graph_builder.GraphBuilder()\ncount = builder.parse_skills(skills_dir)\nprint(f'parse_skills returned: {count}')\nprint(f'Total nodes in builder: {len(builder.nodes)}')\n\" 2>&1"}}],"api":"anthropic-messages","provider":"minimax","model":"MiniMax-M2.7","usage":{"input":41223,"output":236,"cacheRead":10071,"cacheWrite":0,"totalTokens":51530,"cost":{"input":0.0123669,"output":0.0002832,"cacheRead":0.0006042599999999999,"cacheWrite":0,"total":0.013254360000000001}},"stopReason":"toolUse","timestamp":1777538092661,"responseId":"0642472ddc0c799c73a42cd546d73c30"}}
{"type":"message","id":"32c2b2a5","parentId":"12b7069c","timestamp":"2026-04-30T08:34:59.317Z","message":{"role":"toolResult","toolCallId":"call_function_y9i1jfx8wnal_1","toolName":"bash","content":[{"type":"text","text":"skills_dir: /home/ubuntu/.hermes/skills\nExists: True\nparse_skills returned: 115\nTotal nodes in builder: 115\n"}],"isError":false,"timestamp":1777538099317}}
{"type":"message","id":"86b65f4c","parentId":"32c2b2a5","timestamp":"2026-04-30T08:35:09.350Z","message":{"role":"assistant","content":[{"type":"thinking","thinking":"The parse_skills function works. The issue is that the lru_cache on `_cached_build_builder` is still caching the old result. The `@lru_cache` decorator is caching based on the function parameters. Even with `_cache_ver=8`, the function should be rebuilt since 8 != 7.\n\nWait - the issue might be that the lru_cache is persisting across Python invocations because of some other caching mechanism. Let me check if there's another cache being used.\n\nActually, looking at the code flow:\n1. First, it tries `_cached_build_builder` with lru_cache (should miss now with _cache_ver=8)\n2. If that fails/returns cached, it tries `_try_load_graph_cache` (pickle)\n3. If pickle cache exists, it uses that\n\nSo even if lru_cache misses, it might be hitting the pickle cache!\n\nLet me verify:","thinkingSignature":"f0eb976f9c37bcdd5133d878f4d2d76c67a9e0afd096b34762364da5e0c90c7e"},{"type":"toolCall","id":"call_function_5f4osp5y4bln_1","name":"bash","arguments":{"command":"rm -f /home/ubuntu/.hermes/agi/.graph_cache.pkl && python3 -c \"\nimport os\nimport sys\nsys.path.insert(0, '/home/ubuntu/.hermes/agi')\n\n# Clear all graph_builder from sys.modules\nfor key in list(sys.modules.keys()):\n    if 'graph' in key.lower():\n        del sys.modules[key]\n\nfrom graph_builder import build_graph\n\nhermes = os.path.expanduser('~/.hermes')\nagi = os.path.dirname(os.path.abspath('.'))\nbuilder, t = build_graph(hermes, agi)\n\nprint(f'Total nodes: {len(builder.nodes)}')\nskill_nodes = [n for n in builder.nodes if n[1] in ('skill', 'skill_type')]\nprint(f'Skill nodes: {len(skill_nodes)}')\n\" 2>&1"}}],"api":"anthropic-messages","provider":"minimax","model":"MiniMax-M2.7","usage":{"input":41507,"output":383,"cacheRead":10071,"cacheWrite":0,"totalTokens":51961,"cost":{"input":0.012452099999999999,"output":0.0004596,"cacheRead":0.0006042599999999999,"cacheWrite":0,"total":0.013515959999999999}},"stopReason":"toolUse","timestamp":1777538099319,"responseId":"06424733c53b8c9cbd249536d26dde55"}}
{"type":"message","id":"ce0b40a1","parentId":"86b65f4c","timestamp":"2026-04-30T08:35:09.488Z","message":{"role":"toolResult","toolCallId":"call_function_5f4osp5y4bln_1","toolName":"bash","content":[{"type":"text","text":"Total nodes: 960\nSkill nodes: 0\n"}],"isError":false,"timestamp":1777538109488}}
{"type":"message","id":"7b26009f","parentId":"ce0b40a1","timestamp":"2026-04-30T08:35:17.398Z","message":{"role":"assistant","content":[{"type":"thinking","thinking":"This is strange. Let me add some debug output to see what's happening inside the build_graph function:","thinkingSignature":"e044c8b747cedcba949f447d4570c4b474efd96a76ac5fc912fd2878f4016923"},{"type":"toolCall","id":"call_function_490lrjzclh7v_1","name":"bash","arguments":{"command":"python3 -c \"\nimport os\nimport sys\nsys.path.insert(0, '/home/ubuntu/.hermes/agi')\n\n# Clear all graph_builder from sys.modules\nfor key in list(sys.modules.keys()):\n    if 'graph' in key.lower():\n        del sys.modules[key]\n\n# Direct test of parse_skills in the _cached_build_builder context\nhermes = os.path.expanduser('~/.hermes')\nagi = '/home/ubuntu/.hermes/agi'\n\nfrom graph_builder import _cached_build_builder, init_cache\n\ninit_cache(agi)\n\n# Check if skills_dir is being accessed\nskills_dir = os.path.join(hermes, 'skills')\nprint(f'skills_dir: {skills_dir}')\nprint(f'Exists: {os.path.isdir(skills_dir)}')\n\n# Try calling _cached_build_builder directly\nbuilder = _cached_build_builder(hermes, agi, 0, _cache_ver=8)\nprint(f'Total nodes: {len(builder.nodes)}')\nskill_nodes = [n for n in builder.nodes if n[1] in ('skill', 'skill_type')]\nprint(f'Skill nodes: {len(skill_nodes)}')\n\" 2>&1"}}],"api":"anthropic-messages","provider":"minimax","model":"MiniMax-M2.7","usage":{"input":41917,"output":291,"cacheRead":10071,"cacheWrite":0,"totalTokens":52279,"cost":{"input":0.012575099999999999,"output":0.0003492,"cacheRead":0.0006042599999999999,"cacheWrite":0,"total":0.013528559999999999}},"stopReason":"toolUse","timestamp":1777538109490,"responseId":"0642473e2bf03d11cd203b873fabe1eb"}}
{"type":"message","id":"9db900cd","parentId":"7b26009f","timestamp":"2026-04-30T08:35:17.534Z","message":{"role":"toolResult","toolCallId":"call_function_490lrjzclh7v_1","toolName":"bash","content":[{"type":"text","text":"skills_dir: /home/ubuntu/.hermes/skills\nExists: True\nTotal nodes: 960\nSkill nodes: 0\n"}],"isError":false,"timestamp":1777538117534}}
{"type":"message","id":"49047382","parentId":"9db900cd","timestamp":"2026-04-30T08:35:21.875Z","message":{"role":"assistant","content":[{"type":"thinking","thinking":"Still 0 skill nodes. Let me check if the skills parsing code in the _cached_build_builder function actually has the parse_skills call:","thinkingSignature":"3599328731b868b980dbf58521452a374f0006b248ddcb83d4dccad8ca792fd6"},{"type":"toolCall","id":"call_function_k5oodkvk0fox_1","name":"read","arguments":{"path":"/home/ubuntu/.hermes/agi/graph_builder.py","offset":1555,"limit":30}}],"api":"anthropic-messages","provider":"minimax","model":"MiniMax-M2.7","usage":{"input":42252,"output":87,"cacheRead":10071,"cacheWrite":0,"totalTokens":52410,"cost":{"input":0.012675599999999999,"output":0.00010439999999999999,"cacheRead":0.0006042599999999999,"cacheWrite":0,"total":0.013384259999999999}},"stopReason":"toolUse","timestamp":1777538117536,"responseId":"064247468fdfb8beb8b60acb2b8593c3"}}
{"type":"message","id":"596cb14d","parentId":"49047382","timestamp":"2026-04-30T08:35:21.877Z","message":{"role":"toolResult","toolCallId":"call_function_k5oodkvk0fox_1","toolName":"read","content":[{"type":"text","text":"    # Parse canvas graph (pre-computed cross-primitive causal edges)\n    canvas_dir = os.path.join(hermes_dir, \"belam-codex\", \"canvas\")\n    if os.path.isdir(canvas_dir):\n        builder.parse_canvas_graph(canvas_dir)\n\n    # Parse knowledge directory (semantic knowledge nodes with tag edges)\n    knowledge_dir = os.path.join(hermes_dir, \"belam-codex\", \"knowledge\")\n    if os.path.isdir(knowledge_dir):\n        builder.parse_knowledge(knowledge_dir)\n\n    # Parse handoff directory (agent handoff logs with TODO items)\n    handoff_dir = os.path.join(hermes_dir, \"belam-codex\", \"handoff\")\n    if os.path.isdir(handoff_dir):\n        builder.parse_handoff(handoff_dir)\n\n    # Parse archive/commands (38 command docs with upstream links to decision nodes)\n    archive_dir = os.path.join(hermes_dir, \"belam-codex\", \"archive\")\n    if os.path.isdir(archive_dir):\n        builder.parse_archive_commands(archive_dir)\n        builder.parse_archive_tasks(archive_dir)\n        builder.parse_codex_modules(archive_dir)\n\n    # Bridge isolated clusters via shared tags (170 tags span decision/lesson/task)\n    builder.build_tag_bridges(hermes_dir)\n\n    # Process gitnexus cache\n    cache_to_use = None\n    gitnexus_cache_file = os.path.join(agi_dir, \".gitnexus_cache.json\")\n    if os.path.exists(gitnexus_cache_file):\n        try:\n\n[157 more lines in file. Use offset=1585 to continue.]"}],"isError":false,"timestamp":1777538121877}}
{"type":"message","id":"0cb1d2e0","parentId":"596cb14d","timestamp":"2026-04-30T08:35:26.739Z","message":{"role":"assistant","content":[{"type":"thinking","thinking":"I see - the skills parsing code was NOT added to the _cached_build_builder function! Let me check the exact location. The edit I made earlier went to the wrong block - there are TWO blocks (one in _cached_build_builder and one in build_graph), and I edited both to the wrong one. Let me find the exact location of where skills parsing should be added in _cached_build_builder:","thinkingSignature":"221516ccad755bc49f06cc485becc04eae08cb50bfc02f802c744d18f4eb6784"},{"type":"toolCall","id":"call_function_ss4ij6zkn3i5_1","name":"read","arguments":{"path":"/home/ubuntu/.hermes/agi/graph_builder.py","offset":1556,"limit":40}}],"api":"anthropic-messages","provider":"minimax","model":"MiniMax-M2.7","usage":{"input":42687,"output":139,"cacheRead":10071,"cacheWrite":0,"totalTokens":52897,"cost":{"input":0.012806099999999999,"output":0.0001668,"cacheRead":0.0006042599999999999,"cacheWrite":0,"total":0.01357716}},"stopReason":"toolUse","timestamp":1777538121879,"responseId":"0642474ae73be39b69fbb86ad544debd"}}
{"type":"message","id":"1de0499d","parentId":"0cb1d2e0","timestamp":"2026-04-30T08:35:26.741Z","message":{"role":"toolResult","toolCallId":"call_function_ss4ij6zkn3i5_1","toolName":"read","content":[{"type":"text","text":"    canvas_dir = os.path.join(hermes_dir, \"belam-codex\", \"canvas\")\n    if os.path.isdir(canvas_dir):\n        builder.parse_canvas_graph(canvas_dir)\n\n    # Parse knowledge directory (semantic knowledge nodes with tag edges)\n    knowledge_dir = os.path.join(hermes_dir, \"belam-codex\", \"knowledge\")\n    if os.path.isdir(knowledge_dir):\n        builder.parse_knowledge(knowledge_dir)\n\n    # Parse handoff directory (agent handoff logs with TODO items)\n    handoff_dir = os.path.join(hermes_dir, \"belam-codex\", \"handoff\")\n    if os.path.isdir(handoff_dir):\n        builder.parse_handoff(handoff_dir)\n\n    # Parse archive/commands (38 command docs with upstream links to decision nodes)\n    archive_dir = os.path.join(hermes_dir, \"belam-codex\", \"archive\")\n    if os.path.isdir(archive_dir):\n        builder.parse_archive_commands(archive_dir)\n        builder.parse_archive_tasks(archive_dir)\n        builder.parse_codex_modules(archive_dir)\n\n    # Bridge isolated clusters via shared tags (170 tags span decision/lesson/task)\n    builder.build_tag_bridges(hermes_dir)\n\n    # Process gitnexus cache\n    cache_to_use = None\n    gitnexus_cache_file = os.path.join(agi_dir, \".gitnexus_cache.json\")\n    if os.path.exists(gitnexus_cache_file):\n        try:\n            with open(gitnexus_cache_file) as f:\n                cache_to_use = f.read()\n        except Exception:\n            pass\n\n    builder.process_gitnexus_cache(cache_to_use)\n\n    # Build adjacency\n    builder.build_adjacency()\n\n    # Save to pickle cache (for cold starts)\n\n[146 more lines in file. Use offset=1596 to continue.]"}],"isError":false,"timestamp":1777538126741}}
{"type":"message","id":"e6195867","parentId":"1de0499d","timestamp":"2026-04-30T08:35:33.278Z","message":{"role":"assistant","content":[{"type":"thinking","thinking":"I see - the skills parsing was added in the wrong place. The first edit I made was for the `_cached_build_builder` function, and I added it between knowledge and handoff. But looking at the code now, I see that there's no skills parsing in the _cached_build_builder function. Let me re-check what I added:\n\nActually, looking at the earlier debug output, when I called `_cached_build_builder` directly, it still returned 0 skill nodes. That means the skills parsing isn't in the _cached_build_builder function at all.\n\nLet me grep for parse_skills in the file:","thinkingSignature":"7e9a9b3abcc2d11e550cdbf38e779a92fbdcf392af234ca6ed8e8465222cf873"},{"type":"toolCall","id":"call_function_79z056p9uiwt_1","name":"bash","arguments":{"command":"grep -n \"parse_skills\" /home/ubuntu/.hermes/agi/graph_builder.py"}}],"api":"anthropic-messages","provider":"minimax","model":"MiniMax-M2.7","usage":{"input":43219,"output":167,"cacheRead":10071,"cacheWrite":0,"totalTokens":53457,"cost":{"input":0.0129657,"output":0.0002004,"cacheRead":0.0006042599999999999,"cacheWrite":0,"total":0.01377036}},"stopReason":"toolUse","timestamp":1777538126742,"responseId":"0642474fda1d0b6ad8d659dcabd9ee16"}}
{"type":"message","id":"ce3074a8","parentId":"e6195867","timestamp":"2026-04-30T08:35:33.290Z","message":{"role":"toolResult","toolCallId":"call_function_79z056p9uiwt_1","toolName":"bash","content":[{"type":"text","text":"741:    def parse_skills(self, skills_dir: str) -> int:\n1686:        builder.parse_skills(skills_dir)\n1696:        builder.parse_skills(skills_dir)\n"}],"isError":false,"timestamp":1777538133290}}
{"type":"message","id":"4ed88613","parentId":"ce3074a8","timestamp":"2026-04-30T08:35:37.574Z","message":{"role":"assistant","content":[{"type":"thinking","thinking":"So parse_skills is defined at line 741, and called at lines 1686 and 1696. Let me check what's at lines 1680-1700:","thinkingSignature":"e489af1c209ecdbe8267d14dfc6bf78b18107121ba0c2a54c8fafb911a909fa7"},{"type":"toolCall","id":"call_function_tju2u4jo7qy9_1","name":"read","arguments":{"path":"/home/ubuntu/.hermes/agi/graph_builder.py","offset":1675,"limit":25}}],"api":"anthropic-messages","provider":"minimax","model":"MiniMax-M2.7","usage":{"input":43442,"output":94,"cacheRead":10071,"cacheWrite":0,"totalTokens":53607,"cost":{"input":0.0130326,"output":0.00011279999999999999,"cacheRead":0.0006042599999999999,"cacheWrite":0,"total":0.01374966}},"stopReason":"toolUse","timestamp":1777538133292,"responseId":"06424755a55325fb72322d68c2f12a03"}}
{"type":"message","id":"045a196f","parentId":"4ed88613","timestamp":"2026-04-30T08:35:37.576Z","message":{"role":"toolResult","toolCallId":"call_function_tju2u4jo7qy9_1","toolName":"read","content":[{"type":"text","text":"    if os.path.isdir(canvas_dir):\n        builder.parse_canvas_graph(canvas_dir)\n\n    # Parse knowledge directory (semantic knowledge nodes with tag edges)\n    knowledge_dir = os.path.join(hermes_dir, \"belam-codex\", \"knowledge\")\n    if os.path.isdir(knowledge_dir):\n        builder.parse_knowledge(knowledge_dir)\n\n    # Parse skills directory (skill ecosystem with category/type nodes + related_skill edges)\n    skills_dir = os.path.join(hermes_dir, \"skills\")\n    if os.path.isdir(skills_dir):\n        builder.parse_skills(skills_dir)\n\n    # Parse handoff directory (agent handoff logs with TODO items)\n    handoff_dir = os.path.join(hermes_dir, \"belam-codex\", \"handoff\")\n    if os.path.isdir(handoff_dir):\n        builder.parse_handoff(handoff_dir)\n\n    # Parse skills directory (skill ecosystem with category/type nodes + related_skill edges)\n    skills_dir = os.path.join(hermes_dir, \"skills\")\n    if os.path.isdir(skills_dir):\n        builder.parse_skills(skills_dir)\n\n    # Parse archive/commands (38 command docs with upstream links to decision nodes)\n    archive_dir = os.path.join(hermes_dir, \"belam-codex\", \"archive\")\n\n[42 more lines in file. Use offset=1700 to continue.]"}],"isError":false,"timestamp":1777538137576}}
{"type":"message","id":"abb16126","parentId":"045a196f","timestamp":"2026-04-30T08:35:42.305Z","message":{"role":"assistant","content":[{"type":"thinking","thinking":"I see! I accidentally added the skills parsing twice in the `build_graph` function. But the `_cached_build_builder` function (lines 1506-1590 approximately) doesn't have the skills parsing. Let me check that function:","thinkingSignature":"49d19976a72e07381ff769745329a397a7fc112a0539d5fb949922d7cc5e6db2"},{"type":"toolCall","id":"call_function_b3g33opqd8uj_1","name":"read","arguments":{"path":"/home/ubuntu/.hermes/agi/graph_builder.py","offset":1558,"limit":25}}],"api":"anthropic-messages","provider":"minimax","model":"MiniMax-M2.7","usage":{"input":43838,"output":106,"cacheRead":10071,"cacheWrite":0,"totalTokens":54015,"cost":{"input":0.013151399999999999,"output":0.0001272,"cacheRead":0.0006042599999999999,"cacheWrite":0,"total":0.013882859999999999}},"stopReason":"toolUse","timestamp":1777538137577,"responseId":"0642475a777bb160f74181da6b8ae5fe"}}
{"type":"message","id":"b6203da3","parentId":"abb16126","timestamp":"2026-04-30T08:35:42.307Z","message":{"role":"toolResult","toolCallId":"call_function_b3g33opqd8uj_1","toolName":"read","content":[{"type":"text","text":"        builder.parse_canvas_graph(canvas_dir)\n\n    # Parse knowledge directory (semantic knowledge nodes with tag edges)\n    knowledge_dir = os.path.join(hermes_dir, \"belam-codex\", \"knowledge\")\n    if os.path.isdir(knowledge_dir):\n        builder.parse_knowledge(knowledge_dir)\n\n    # Parse handoff directory (agent handoff logs with TODO items)\n    handoff_dir = os.path.join(hermes_dir, \"belam-codex\", \"handoff\")\n    if os.path.isdir(handoff_dir):\n        builder.parse_handoff(handoff_dir)\n\n    # Parse archive/commands (38 command docs with upstream links to decision nodes)\n    archive_dir = os.path.join(hermes_dir, \"belam-codex\", \"archive\")\n    if os.path.isdir(archive_dir):\n        builder.parse_archive_commands(archive_dir)\n        builder.parse_archive_tasks(archive_dir)\n        builder.parse_codex_modules(archive_dir)\n\n    # Bridge isolated clusters via shared tags (170 tags span decision/lesson/task)\n    builder.build_tag_bridges(hermes_dir)\n\n    # Process gitnexus cache\n    cache_to_use = None\n    gitnexus_cache_file = os.path.join(agi_dir, \".gitnexus_cache.json\")\n\n[159 more lines in file. Use offset=1583 to continue.]"}],"isError":false,"timestamp":1777538142307}}
