{"type":"message","id":"b1638563","parentId":"bbc638db","timestamp":"2026-04-30T07:55:12.163Z","message":{"role":"toolResult","toolCallId":"call_function_zbs5aacuceya_1","toolName":"read","content":[{"type":"text","text":"\n                agent_id_key = filename[:-3]  # strip .md\n                node_id = self.add_node(\n                    \"agent_role\",\n                    label,\n                    summary,\n                    f\"agents/{filename}\",\n                    f\"agent_{agent_id_key}\"\n                )\n                agent_ids[agent_id] = node_id\n                count += 1\n\n                # Extract \"What I Do\" sections for actionable items\n                does_match = re.search(r'## What I Do\\s*\\n([\\s\\S]+?)(?:##|\\Z)', content)\n                if does_match:\n                    for line in does_match.group(1).split('\\n'):\n                        if line.strip().startswith('✅') or line.strip().startswith('-'):\n                            action = line.strip().lstrip('✅- ').strip()[:60]\n                            if len(action) > 5:\n                                action_id = self.add_node(\n                                    \"agent_capability\",\n                                    action[:60],\n                                    \"\",\n                                    f\"agents/{filename}\",\n                                    f\"cap_{agent_id_key}_{hash(action) & 0xFFFF}\"\n                                )\n                                self.add_edge(node_id, action_id, \"can_do\")\n                                count += 1\n\n                # Extract \"What I Do NOT Do\" sections\n                not_does_match = re.search(r'## What I Do NOT Do\\s*\\n([\\s\\S]+?)(?:##|\\Z)', content)\n                if not_does_match:\n                    for line in not_does_match.group(1).split('\\n'):\n                        if line.strip().startswith('❌') or line.strip().startswith('-'):\n                            action = line.strip().lstrip('❌- ').strip()[:60]\n                            if len(action) > 5:\n                                action_id = self.add_node(\n                                    \"agent_boundary\",\n                                    action[:60],\n                                    \"\",\n                                    f\"agents/{filename}\",\n                                    f\"bound_{agent_id_key}_{hash(action) & 0xFFFF}\"\n                                )\n                                self.add_edge(node_id, action_id, \"refuses_to\")\n                                count += 1\n\n            except Exception:\n                pass\n\n        # Second pass: add communication edges between agents\n        for filename in md_files:\n            filepath = os.path.join(agents_dir, filename)\n            try:\n                with open(filepath, \"r\") as f:\n                    content = f.read()\n                fm_match = _RE_FRONT_MATTER.match(content)\n                if not fm_match:\n                    continue\n                meta = {}\n                for line in fm_match.group(1).split('\\n'):\n                    m = _RE_YAML_PAIR.match(line)\n                    if m:\n                        meta[m.group(1)] = m.group(2)\n\n                agent_id = meta.get('agent_id', filename[:-3])\n                src_id = agent_ids.get(agent_id)\n                if not src_id:\n                    continue\n\n                # Parse communicates_with: [architect, critic, builder]\n                comm_str = meta.get('communicates_with', '').strip('[] ')\n                if not comm_str:\n                    continue\n\n                peers = [c.strip().strip(\"'\").strip('\"') for c in comm_str.split(',') if c.strip()]\n                for peer in peers:\n                    tgt_id = agent_ids.get(peer)\n                    if tgt_id:\n                        self.add_edge(src_id, tgt_id, \"communicates_with\")\n\n            except Exception:\n                pass\n\n        return count\n\n    def parse_canvas_graph(self, canvas_dir: str) -> Tuple[int, int]:\n        \"\"\"Parse canvas graph_data.json with pre-computed cross-primitive edges.\n        \n        Returns (nodes_added, edges_added). Adds 105 nodes (lesson, decision, task,\n        project, pipeline, command, skill, knowledge) and 8 causal edges from\n        LLM-judged relationship data.\n        \"\"\"\n        graph_file = os.path.join(canvas_dir, \"graph_data.json\")\n        if not os.path.exists(graph_file):\n            return 0, 0\n\n        try:\n            with open(graph_file) as f:\n                data = json.load(f)\n        except Exception:\n\n[349 more lines in file. Use offset=630 to continue.]"}],"isError":false,"timestamp":1777535712163}}
{"type":"message","id":"185fa5ad","parentId":"b1638563","timestamp":"2026-04-30T07:55:17.250Z","message":{"role":"assistant","content":[{"type":"thinking","thinking":"Let me find the `_cached_build_builder` function to see what needs to be updated.","thinkingSignature":"0cfc3b3878f213ff620eca343be567ef360319338979734933f9fc2f965db1e5"},{"type":"toolCall","id":"call_function_nfvn2vhw2hoy_1","name":"bash","arguments":{"command":"grep -n \"_cached_build_builder\\|_cached_build\\|return builder\\|return.*nodes.*edges\\|return.*Tuple\" /home/ubuntu/.hermes/agi/graph_builder.py | head -30"}}],"api":"anthropic-messages","provider":"minimax","model":"MiniMax-M2.7","usage":{"input":41655,"output":83,"cacheRead":10071,"cacheWrite":0,"totalTokens":51809,"cost":{"input":0.012496499999999999,"output":0.0000996,"cacheRead":0.0006042599999999999,"cacheWrite":0,"total":0.01320036}},"stopReason":"toolUse","timestamp":1777535712164,"responseId":"06423de0767f64bd76fba869194dd218"}}
{"type":"message","id":"fa165956","parentId":"185fa5ad","timestamp":"2026-04-30T07:55:17.259Z","message":{"role":"toolResult","toolCallId":"call_function_nfvn2vhw2hoy_1","toolName":"bash","content":[{"type":"text","text":"677:        return nodes_added, edges_added\n771:        return builder\n793:def _cached_build_builder(hermes_dir: str, agi_dir: str, gitnexus_hash: int, _cache_ver: int = 1) -> GraphBuilder:\n866:    return builder.nodes, builder.edges, dict(builder.adj)\n885:        builder = _cached_build_builder(hermes_dir, agi_dir, gitnexus_hash, _cache_ver=2)\n887:        return builder, elapsed_ms\n897:        return builder, elapsed_ms\n963:    return builder, elapsed_ms\n"}],"isError":false,"timestamp":1777535717259}}
{"type":"message","id":"8716d994","parentId":"fa165956","timestamp":"2026-04-30T07:55:21.278Z","message":{"role":"assistant","content":[{"type":"thinking","thinking":"So the `_cached_build_builder` function now has the signature `-> GraphBuilder` but the return statement at line 866 is still returning `(builder.nodes, builder.edges, dict(builder.adj))`. I need to update the body to return the `builder` object directly.\n\nLet me read the full function.","thinkingSignature":"afad361c5e5d0c0abc942429e34dcd9d85ef060a48df3b31f0e188a90d100b17"},{"type":"toolCall","id":"call_function_nunocyxokbri_1","name":"read","arguments":{"path":"/home/ubuntu/.hermes/agi/graph_builder.py","offset":793,"limit":80}}],"api":"anthropic-messages","provider":"minimax","model":"MiniMax-M2.7","usage":{"input":41878,"output":120,"cacheRead":10071,"cacheWrite":0,"totalTokens":52069,"cost":{"input":0.012563399999999999,"output":0.000144,"cacheRead":0.0006042599999999999,"cacheWrite":0,"total":0.01331166}},"stopReason":"toolUse","timestamp":1777535717261,"responseId":"06423de5f9a02dc8e85b0fa8f419c3f1"}}
{"type":"message","id":"03e8b633","parentId":"8716d994","timestamp":"2026-04-30T07:55:21.284Z","message":{"role":"toolResult","toolCallId":"call_function_nunocyxokbri_1","toolName":"read","content":[{"type":"text","text":"def _cached_build_builder(hermes_dir: str, agi_dir: str, gitnexus_hash: int, _cache_ver: int = 1) -> GraphBuilder:\n    \"\"\"Cached builder internals — returns serializable parts only.\n    \n    lru_cache eliminates pickle.load entirely for warm calls.\n    gitnexus_hash is a cache-busting int derived from gitnexus content.\n    \"\"\"\n    # Initialize cache\n    init_cache(agi_dir)\n\n    # Build from sources\n    builder = GraphBuilder()\n\n    # Parse AGENTS.md\n    agents_md = os.path.join(hermes_dir, \"belam-codex\", \"AGENTS.md\")\n    builder.parse_agents_md(agents_md)\n\n    # Parse memory files (expanded to all 58)\n    memory_dir = os.path.join(hermes_dir, \"belam-codex\", \"memory\")\n    builder.parse_memory_files(memory_dir, limit=58)\n\n    # Parse schema files\n    schema_dir = os.path.join(hermes_dir, \"belam-codex\", \"schemas\")\n    builder.parse_schema_files(schema_dir)\n\n    # Parse decisions (all 128 files)\n    decisions_dir = os.path.join(hermes_dir, \"belam-codex\", \"decisions\")\n    if os.path.isdir(decisions_dir):\n        builder.parse_decisions(decisions_dir, limit=999)\n\n    # Parse lessons (all 208 files)\n    lessons_dir = os.path.join(hermes_dir, \"belam-codex\", \"lessons\")\n    if os.path.isdir(lessons_dir):\n        builder.parse_lessons(lessons_dir, limit=999)\n\n    # Parse tasks (expanded to all 84)\n    tasks_dir = os.path.join(hermes_dir, \"belam-codex\", \"tasks\")\n    if os.path.isdir(tasks_dir):\n        builder.parse_tasks(tasks_dir, limit=100)\n\n    # Parse goals (goal nodes with status/priority/urgency)\n    goals_dir = os.path.join(hermes_dir, \"belam-codex\", \"goals\")\n    if os.path.isdir(goals_dir):\n        builder.parse_goals(goals_dir)\n\n    # Parse agent roles (main, architect, builder, critic)\n    agents_dir = os.path.join(hermes_dir, \"belam-codex\", \"agents\")\n    if os.path.isdir(agents_dir):\n        builder.parse_agent_roles(agents_dir)\n\n    # Parse canvas graph (pre-computed cross-primitive causal edges)\n    canvas_dir = os.path.join(hermes_dir, \"belam-codex\", \"canvas\")\n    if os.path.isdir(canvas_dir):\n        builder.parse_canvas_graph(canvas_dir)\n\n    # Process gitnexus cache\n    cache_to_use = None\n    gitnexus_cache_file = os.path.join(agi_dir, \".gitnexus_cache.json\")\n    if os.path.exists(gitnexus_cache_file):\n        try:\n            with open(gitnexus_cache_file) as f:\n                cache_to_use = f.read()\n        except Exception:\n            pass\n\n    builder.process_gitnexus_cache(cache_to_use)\n\n    # Build adjacency\n    builder.build_adjacency()\n\n    # Save to pickle cache (for cold starts)\n    _save_graph_cache(agi_dir, builder, cache_to_use)\n\n    # Return serializable parts as tuples/dicts (cacheable by lru_cache)\n    return builder.nodes, builder.edges, dict(builder.adj)\n\n\ndef build_graph(hermes_dir: str, agi_dir: str, use_gitnexus: bool = True,\n                 gitnexus_cache: Optional[str] = None) -> Tuple[GraphBuilder, float]:\n    \"\"\"Main graph building function with lru_cache for warm calls.\"\"\"\n    start = time.perf_counter()\n\n[106 more lines in file. Use offset=873 to continue.]"}],"isError":false,"timestamp":1777535721284}}
{"type":"message","id":"cb0fcafa","parentId":"03e8b633","timestamp":"2026-04-30T07:55:28.561Z","message":{"role":"assistant","content":[{"type":"thinking","thinking":"I need to change the return statement in `_cached_build_builder` to return `builder` instead of `(builder.nodes, builder.edges, dict(builder.adj))`. The function already has the correct return type annotation `-> GraphBuilder`. But I also need to remove the tasks limit=100 and change it to 999.","thinkingSignature":"03708dc872de8b4e4d0c9acda56e9b200ec53f6f5fde67a83229791fc2a91993"},{"type":"toolCall","id":"call_function_qjcah41kw3rj_1","name":"edit","arguments":{"path":"/home/ubuntu/.hermes/agi/graph_builder.py","edits":[{"oldText":"    # Parse tasks (expanded to all 84)\n    tasks_dir = os.path.join(hermes_dir, \"belam-codex\", \"tasks\")\n    if os.path.isdir(tasks_dir):\n        builder.parse_tasks(tasks_dir, limit=100)","newText":"    # Parse tasks (all 84 files)\n    tasks_dir = os.path.join(hermes_dir, \"belam-codex\", \"tasks\")\n    if os.path.isdir(tasks_dir):\n        builder.parse_tasks(tasks_dir, limit=999)"},{"oldText":"    # Return serializable parts as tuples/dicts (cacheable by lru_cache)\n    return builder.nodes, builder.edges, dict(builder.adj)","newText":"    # Return builder directly — lru_cache on GraphBuilder means warm calls are O(1) object return\n    return builder"}]}}],"api":"anthropic-messages","provider":"minimax","model":"MiniMax-M2.7","usage":{"input":42801,"output":311,"cacheRead":10071,"cacheWrite":0,"totalTokens":53183,"cost":{"input":0.012840299999999999,"output":0.00037319999999999996,"cacheRead":0.0006042599999999999,"cacheWrite":0,"total":0.01381776}},"stopReason":"toolUse","timestamp":1777535721285,"responseId":"06423de96485d5b4d65495123a2acc57"}}
{"type":"message","id":"6848a191","parentId":"cb0fcafa","timestamp":"2026-04-30T07:55:28.566Z","message":{"role":"toolResult","toolCallId":"call_function_qjcah41kw3rj_1","toolName":"edit","content":[{"type":"text","text":"Successfully replaced 2 block(s) in /home/ubuntu/.hermes/agi/graph_builder.py."}],"details":{"diff":"     ...\n 823     lessons_dir = os.path.join(hermes_dir, \"belam-codex\", \"lessons\")\n 824     if os.path.isdir(lessons_dir):\n 825         builder.parse_lessons(lessons_dir, limit=999)\n 826 \n-827     # Parse tasks (expanded to all 84)\n+827     # Parse tasks (all 84 files)\n 828     tasks_dir = os.path.join(hermes_dir, \"belam-codex\", \"tasks\")\n 829     if os.path.isdir(tasks_dir):\n-830         builder.parse_tasks(tasks_dir, limit=100)\n+830         builder.parse_tasks(tasks_dir, limit=999)\n 831 \n 832     # Parse goals (goal nodes with status/priority/urgency)\n 833     goals_dir = os.path.join(hermes_dir, \"belam-codex\", \"goals\")\n 834     if os.path.isdir(goals_dir):\n     ...\n 861 \n 862     # Save to pickle cache (for cold starts)\n 863     _save_graph_cache(agi_dir, builder, cache_to_use)\n 864 \n-865     # Return serializable parts as tuples/dicts (cacheable by lru_cache)\n-866     return builder.nodes, builder.edges, dict(builder.adj)\n+865     # Return builder directly — lru_cache on GraphBuilder means warm calls are O(1) object return\n+866     return builder\n 867 \n 868 \n 869 def build_graph(hermes_dir: str, agi_dir: str, use_gitnexus: bool = True,\n 870                  gitnexus_cache: Optional[str] = None) -> Tuple[GraphBuilder, float]:\n     ...","firstChangedLine":827},"isError":false,"timestamp":1777535728566}}
{"type":"message","id":"619ecb6f","parentId":"6848a191","timestamp":"2026-04-30T07:55:32.760Z","message":{"role":"assistant","content":[{"type":"thinking","thinking":"Now I also need to update the cold build path in `build_graph` since it still expects the tuple return. Let me read the cold build section.","thinkingSignature":"97a6a3d07d1b2f65d425bc37c8a22fc12d49cb50dd2bc8da3fb61932a9d8a8ad"},{"type":"text","text":"Now update the cold build path to match the new return type:\n"},{"type":"toolCall","id":"call_function_ct4vlind5bcp_1","name":"read","arguments":{"path":"/home/ubuntu/.hermes/agi/graph_builder.py","offset":890,"limit":80}}],"api":"anthropic-messages","provider":"minimax","model":"MiniMax-M2.7","usage":{"input":43148,"output":101,"cacheRead":10071,"cacheWrite":0,"totalTokens":53320,"cost":{"input":0.0129444,"output":0.00012119999999999999,"cacheRead":0.0006042599999999999,"cacheWrite":0,"total":0.01366986}},"stopReason":"toolUse","timestamp":1777535728568,"responseId":"06423df14f92c98f89ed6cbce30a8c84"}}
{"type":"message","id":"afab7ef9","parentId":"619ecb6f","timestamp":"2026-04-30T07:55:32.762Z","message":{"role":"toolResult","toolCallId":"call_function_ct4vlind5bcp_1","toolName":"read","content":[{"type":"text","text":"\n    # Fallback: try pickle cache\n    init_cache(agi_dir)\n    cache_to_use = gitnexus_cache\n    builder = _try_load_graph_cache(agi_dir, {}, gitnexus_cache)\n    if builder is not None:\n        elapsed_ms = (time.perf_counter() - start) * 1000\n        return builder, elapsed_ms\n\n    # Cold build path\n    init_cache(agi_dir)\n    builder = GraphBuilder()\n\n    # Parse AGENTS.md\n    agents_md = os.path.join(hermes_dir, \"belam-codex\", \"AGENTS.md\")\n    builder.parse_agents_md(agents_md)\n\n    # Parse memory files (expanded to all 58)\n    memory_dir = os.path.join(hermes_dir, \"belam-codex\", \"memory\")\n    builder.parse_memory_files(memory_dir, limit=58)\n\n    # Parse schema files\n    schema_dir = os.path.join(hermes_dir, \"belam-codex\", \"schemas\")\n    builder.parse_schema_files(schema_dir)\n\n    # Parse decisions (all 128 files)\n    decisions_dir = os.path.join(hermes_dir, \"belam-codex\", \"decisions\")\n    if os.path.isdir(decisions_dir):\n        builder.parse_decisions(decisions_dir, limit=999)\n\n    # Parse lessons (all 208 files)\n    lessons_dir = os.path.join(hermes_dir, \"belam-codex\", \"lessons\")\n    if os.path.isdir(lessons_dir):\n        builder.parse_lessons(lessons_dir, limit=999)\n\n    # Parse tasks (expanded to all 84)\n    tasks_dir = os.path.join(hermes_dir, \"belam-codex\", \"tasks\")\n    if os.path.isdir(tasks_dir):\n        builder.parse_tasks(tasks_dir, limit=999)\n\n    # Parse goals (goal nodes with status/priority/urgency)\n    goals_dir = os.path.join(hermes_dir, \"belam-codex\", \"goals\")\n    if os.path.isdir(goals_dir):\n        builder.parse_goals(goals_dir)\n\n    # Parse agent roles (main, architect, builder, critic)\n    agents_dir = os.path.join(hermes_dir, \"belam-codex\", \"agents\")\n    if os.path.isdir(agents_dir):\n        builder.parse_agent_roles(agents_dir)\n\n    # Parse canvas graph (pre-computed cross-primitive causal edges)\n    canvas_dir = os.path.join(hermes_dir, \"belam-codex\", \"canvas\")\n    if os.path.isdir(canvas_dir):\n        builder.parse_canvas_graph(canvas_dir)\n\n    # Process gitnexus cache\n    global _gitnexus_cache\n    if cache_to_use is None:\n        cache_to_use = _gitnexus_cache\n    if use_gitnexus and cache_to_use is None:\n        gitnexus_dir = os.path.join(hermes_dir, \"belam-codex\", \".gitnexus\")\n        if os.path.isdir(gitnexus_dir):\n            cache_to_use = run_subprocess(\n                f\"cd {hermes_dir}/belam-codex && npx --yes gitnexus query --repo belam-codex 'symbol' 2>/dev/null || echo ''\",\n                timeout=15\n            )\n            _save_cache(cache_to_use)\n\n    builder.process_gitnexus_cache(cache_to_use)\n    builder.build_adjacency()\n    _save_graph_cache(agi_dir, builder, cache_to_use)\n\n    elapsed_ms = (time.perf_counter() - start) * 1000\n    return builder, elapsed_ms\n\n\nif __name__ == \"__main__\":\n    import sys\n    hermes = os.path.expanduser(\"~/.hermes\")\n    agi = os.path.dirname(os.path.abspath(__file__))\n\n[9 more lines in file. Use offset=970 to continue.]"}],"isError":false,"timestamp":1777535732762}}
{"type":"message","id":"02705404","parentId":"afab7ef9","timestamp":"2026-04-30T07:55:42.422Z","message":{"role":"assistant","content":[{"type":"thinking","thinking":"The cold build path already builds the GraphBuilder directly and returns it. The cold build path looks good. The hot path now uses `_cached_build_builder` which returns a GraphBuilder directly. Let me test the changes.","thinkingSignature":"cabd7343d374a6854b8fde11090eb0900f270057748ffd475f4e8bb7d31cc5f0"},{"type":"text","text":"Test the updated caching:\n"},{"type":"toolCall","id":"call_function_c0m0l7h9wxkq_1","name":"bash","arguments":{"command":"rm -f .graph_cache.pkl && python3 -c \"\nimport sys, time\nsys.path.insert(0, '.')\nfrom graph_builder import build_graph, _cached_build_builder\nhermes = '/home/ubuntu/.hermes'\nagi = '/home/ubuntu/.hermes/agi'\n# First call: cold build via lru_cache\nt0 = time.perf_counter()\nb1, ms1 = build_graph(hermes, agi)\ncold = (time.perf_counter() - t0) * 1000\n# Second call: warm via lru_cache  \nt0 = time.perf_counter()\nb2, ms2 = build_graph(hermes, agi)\nwarm = (time.perf_counter() - t0) * 1000\n# Third call: warm via lru_cache\nt0 = time.perf_counter()\nb3, ms3 = build_graph(hermes, agi)\nwarm2 = (time.perf_counter() - t0) * 1000\nstats = b1.get_stats()\nprint(f'Nodes: {stats[\\\"node_count\\\"]}')\nprint(f'Cold: {cold:.2f}ms (timed {ms1:.2f}ms)')\nprint(f'Warm1: {warm:.4f}ms (timed {ms2:.4f}ms)')\nprint(f'Warm2: {warm2:.4f}ms (timed {ms3:.4f}ms)')\n\" 2>&1"}}],"api":"anthropic-messages","provider":"minimax","model":"MiniMax-M2.7","usage":{"input":44061,"output":389,"cacheRead":10071,"cacheWrite":0,"totalTokens":54521,"cost":{"input":0.013218299999999999,"output":0.00046679999999999996,"cacheRead":0.0006042599999999999,"cacheWrite":0,"total":0.01428936}},"stopReason":"toolUse","timestamp":1777535732763,"responseId":"06423df50ccc4d8e1deb6a5327035da8"}}
{"type":"message","id":"32565c4c","parentId":"02705404","timestamp":"2026-04-30T07:55:42.514Z","message":{"role":"toolResult","toolCallId":"call_function_c0m0l7h9wxkq_1","toolName":"bash","content":[{"type":"text","text":"Nodes: 828\nCold: 33.66ms (timed 33.66ms)\nWarm1: 0.0269ms (timed 0.0253ms)\nWarm2: 0.0072ms (timed 0.0057ms)\n"}],"isError":false,"timestamp":1777535742513}}
