{"type":"message","id":"2a432d87","parentId":"5fef9d63","timestamp":"2026-04-30T08:32:44.646Z","message":{"role":"toolResult","toolCallId":"call_function_qpan64d0sg6e_1","toolName":"edit","content":[{"type":"text","text":"Successfully replaced 1 block(s) in /home/ubuntu/.hermes/agi/graph_builder.py."}],"details":{"diff":"      ...\n  737             except Exception:\n  738                 pass\n  739         return count\n  740 \n+ 741     def parse_skills(self, skills_dir: str) -> int:\n+ 742         \"\"\"Parse hermes/skills/ directory into skill nodes with related_skill edges.\n+ 743         \n+ 744         Each skill category becomes a skill_type node.\n+ 745         Each individual skill becomes a skill node with tags and related_skill edges.\n+ 746         \"\"\"\n+ 747         if not os.path.isdir(skills_dir):\n+ 748             return 0\n+ 749 \n+ 750         count = 0\n+ 751         skill_ids = {}  # skill_name -> node_id for related_skill edges\n+ 752         category_ids = {}  # category_name -> node_id\n+ 753 \n+ 754         # First pass: create category and skill nodes\n+ 755         categories = sorted(os.listdir(skills_dir))\n+ 756         for category in categories:\n+ 757             category_path = os.path.join(skills_dir, category)\n+ 758             if not os.path.isdir(category_path):\n+ 759                 continue\n+ 760 \n+ 761             # Create category node\n+ 762             category_id = self.add_node(\n+ 763                 \"skill_type\",\n+ 764                 category,\n+ 765                 f\"category: {category}\",\n+ 766                 f\"skills/{category}\",\n+ 767                 f\"skill_type_{category}\"\n+ 768             )\n+ 769             category_ids[category] = category_id\n+ 770             count += 1\n+ 771 \n+ 772             # Find SKILL.md files (may be in subdirectories)\n+ 773             skill_mds = []\n+ 774             for root, _, files in os.walk(category_path):\n+ 775                 for f in files:\n+ 776                     if f == 'SKILL.md':\n+ 777                         skill_mds.append(os.path.join(root, f))\n+ 778 \n+ 779             for skill_md in skill_mds:\n+ 780                 try:\n+ 781                     with open(skill_md, \"r\") as f:\n+ 782                         content = f.read()\n+ 783 \n+ 784                     # Extract frontmatter\n+ 785                     fm_match = _RE_FRONT_MATTER.match(content)\n+ 786                     meta = {}\n+ 787                     if fm_match:\n+ 788                         for line in fm_match.group(1).split('\\n'):\n+ 789                             m = _RE_YAML_PAIR.match(line)\n+ 790                             if m:\n+ 791                                 meta[m.group(1)] = m.group(2)\n+ 792 \n+ 793                     skill_name = meta.get('name', os.path.basename(os.path.dirname(skill_md)))\n+ 794                     description = meta.get('description', '')[:80]\n+ 795                     tags_str = meta.get('tags', '[]')\n+ 796                     related_str = meta.get('related_skills', meta.get('related', '[]'))\n+ 797                     version = meta.get('version', '1.0.0')\n+ 798 \n+ 799                     # Create skill node\n+ 800                     skill_node_id = self.add_node(\n+ 801                         \"skill\",\n+ 802                         skill_name[:50],\n+ 803                         description,\n+ 804                         f\"skills/{skill_md}\",\n+ 805                         f\"skill_{skill_name.replace('-', '_').replace(' ', '_')}\"\n+ 806                     )\n+ 807                     skill_ids[skill_name] = skill_node_id\n+ 808                     self.add_edge(category_id, skill_node_id, \"belongs_to\")\n+ 809                     count += 1\n+ 810 \n+ 811                     # Parse related_skill references (add to queue for second pass)\n+ 812                     if related_str and related_str != '[]':\n+ 813                         related = re.findall(r'\\[?([\\w-]+)\\]?', related_str)\n+ 814                         for rel in related[:5]:\n+ 815                             rel_clean = rel.strip()\n+ 816                             if rel_clean != skill_name and rel_clean not in skill_ids:\n+ 817                                 # Create stub skill node for related skill\n+ 818                                 stub_id = self.add_node(\n+ 819                                     \"skill\",\n+ 820                                     rel_clean[:50],\n+ 821                                     f\"related_skill (stub)\",\n+ 822                                     f\"skills/{skill_md}\",\n+ 823                                     f\"skill_{rel_clean.replace('-', '_').replace(' ', '_')}\"\n+ 824                                 )\n+ 825                                 skill_ids[rel_clean] = stub_id\n+ 826                                 count += 1\n+ 827 \n+ 828                 except Exception:\n+ 829                     pass\n+ 830 \n+ 831         # Second pass: add related_skill edges between actual skill nodes\n+ 832         edges_added = 0\n+ 833         for category in categories:\n+ 834             category_path = os.path.join(skills_dir, category)\n+ 835             if not os.path.isdir(category_path):\n+ 836                 continue\n+ 837 \n+ 838             for root, _, files in os.walk(category_path):\n+ 839                 for f in files:\n+ 840                     if f != 'SKILL.md':\n+ 841                         continue\n+ 842                     skill_md = os.path.join(root, f)\n+ 843                     try:\n+ 844                         with open(skill_md, \"r\") as fh:\n+ 845                             content = fh.read()\n+ 846 \n+ 847                         fm_match = _RE_FRONT_MATTER.match(content)\n+ 848                         if not fm_match:\n+ 849                             continue\n+ 850                         meta = {}\n+ 851                         for line in fm_match.group(1).split('\\n'):\n+ 852                             m = _RE_YAML_PAIR.match(line)\n+ 853                             if m:\n+ 854                                 meta[m.group(1)] = m.group(2)\n+ 855 \n+ 856                         skill_name = meta.get('name', '')\n+ 857                         src_id = skill_ids.get(skill_name)\n+ 858                         if not src_id:\n+ 859                             continue\n+ 860 \n+ 861                         related_str = meta.get('related_skills', meta.get('related', '[]'))\n+ 862                         if not related_str or related_str == '[]':\n+ 863                             continue\n+ 864 \n+ 865                         related = re.findall(r'\\[?([\\w-]+)\\]?', related_str)\n+ 866                         for rel in related[:5]:\n+ 867                             rel_clean = rel.strip()\n+ 868                             tgt_id = skill_ids.get(rel_clean)\n+ 869                             if tgt_id and tgt_id != src_id:\n+ 870                                 self.add_edge(src_id, tgt_id, \"related_skill\")\n+ 871                                 edges_added += 1\n+ 872 \n+ 873                     except Exception:\n+ 874                         pass\n+ 875 \n+ 876         return count\n+ 877 \n  741     def _find_or_add_reference(self, ref: str, source: str) -> Optional[str]:\n  742         \"\"\"Find existing node by slug-like reference or add a stub reference node.\"\"\"\n  743         # Convert slug to node ID format used in our graph\n  744         candidates = [\n      ...","firstChangedLine":741},"isError":false,"timestamp":1777537964646}}
{"type":"message","id":"7940c8d3","parentId":"2a432d87","timestamp":"2026-04-30T08:32:48.505Z","message":{"role":"assistant","content":[{"type":"thinking","thinking":"Now I need to add the call to parse_skills in the build_graph function. Let me find the right place:","thinkingSignature":"f5d1324840ca5d4d55cd536570f965c8d75218138d2850375e7cd6b84b65f04f"},{"type":"text","text":"Now I need to add the call to `parse_skills` in the `build_graph` function. Let me find the right location:\n"},{"type":"toolCall","id":"call_function_ufs70r14cnxp_1","name":"read","arguments":{"path":"/home/ubuntu/.hermes/agi/graph_builder.py","offset":1590,"limit":50}}],"api":"anthropic-messages","provider":"minimax","model":"MiniMax-M2.7","usage":{"input":31817,"output":110,"cacheRead":10071,"cacheWrite":0,"totalTokens":41998,"cost":{"input":0.009545099999999999,"output":0.00013199999999999998,"cacheRead":0.0006042599999999999,"cacheWrite":0,"total":0.01028136}},"stopReason":"toolUse","timestamp":1777537964647,"responseId":"064246ad2fd88caed946bc516e630fc5"}}
{"type":"message","id":"e092360d","parentId":"7940c8d3","timestamp":"2026-04-30T08:32:48.507Z","message":{"role":"toolResult","toolCallId":"call_function_ufs70r14cnxp_1","toolName":"read","content":[{"type":"text","text":"    builder.process_gitnexus_cache(cache_to_use)\n\n    # Build adjacency\n    builder.build_adjacency()\n\n    # Save to pickle cache (for cold starts)\n    _save_graph_cache(agi_dir, builder, cache_to_use)\n\n    # Return builder directly — lru_cache on GraphBuilder means warm calls are O(1) object return\n    return builder\n\n\ndef build_graph(hermes_dir: str, agi_dir: str, use_gitnexus: bool = True,\n                 gitnexus_cache: Optional[str] = None) -> Tuple[GraphBuilder, float]:\n    \"\"\"Main graph building function with lru_cache for warm calls.\"\"\"\n    start = time.perf_counter()\n\n    # Get gitnexus hash for cache busting\n    gitnexus_hash = 0\n    gitnexus_cache_file = os.path.join(agi_dir, \".gitnexus_cache.json\")\n    if os.path.exists(gitnexus_cache_file):\n        try:\n            gitnexus_hash = os.path.getsize(gitnexus_cache_file)\n        except Exception:\n            pass\n\n    # Try lru_cache first (no pickle.load) — bump _cache_ver to bust cache after code/data changes\n    try:\n        builder = _cached_build_builder(hermes_dir, agi_dir, gitnexus_hash, _cache_ver=7)\n        elapsed_ms = (time.perf_counter() - start) * 1000\n        return builder, elapsed_ms\n    except Exception:\n        pass\n\n    # Fallback: try pickle cache\n    init_cache(agi_dir)\n    cache_to_use = gitnexus_cache\n    builder = _try_load_graph_cache(agi_dir, {}, gitnexus_cache)\n    if builder is not None:\n        elapsed_ms = (time.perf_counter() - start) * 1000\n        return builder, elapsed_ms\n\n    # Cold build path\n    init_cache(agi_dir)\n    builder = GraphBuilder()\n\n    # Parse AGENTS.md\n    agents_md = os.path.join(hermes_dir, \"belam-codex\", \"AGENTS.md\")\n    builder.parse_agents_md(agents_md)\n\n\n[92 more lines in file. Use offset=1640 to continue.]"}],"isError":false,"timestamp":1777537968507}}
{"type":"message","id":"faaa10a2","parentId":"e092360d","timestamp":"2026-04-30T08:32:51.191Z","message":{"role":"assistant","content":[{"type":"thinking","thinking":"I need to find where the other parsers are called. Let me continue reading:","thinkingSignature":"54c86c4758f8001a22871bf65236f2599cb3c2148a38e2fabc50f9baff9e314f"},{"type":"toolCall","id":"call_function_dnniv0xn0ki9_1","name":"read","arguments":{"path":"/home/ubuntu/.hermes/agi/graph_builder.py","offset":1640,"limit":50}}],"api":"anthropic-messages","provider":"minimax","model":"MiniMax-M2.7","usage":{"input":32392,"output":75,"cacheRead":10071,"cacheWrite":0,"totalTokens":42538,"cost":{"input":0.0097176,"output":0.00008999999999999999,"cacheRead":0.0006042599999999999,"cacheWrite":0,"total":0.01041186}},"stopReason":"toolUse","timestamp":1777537968509,"responseId":"064246b0e20b4f3ddc29788f7d70e729"}}
{"type":"message","id":"b1827c07","parentId":"faaa10a2","timestamp":"2026-04-30T08:32:51.193Z","message":{"role":"toolResult","toolCallId":"call_function_dnniv0xn0ki9_1","toolName":"read","content":[{"type":"text","text":"    # Parse memory files (expanded to all 58)\n    memory_dir = os.path.join(hermes_dir, \"belam-codex\", \"memory\")\n    builder.parse_memory_files(memory_dir, limit=58)\n\n    # Parse schema files\n    schema_dir = os.path.join(hermes_dir, \"belam-codex\", \"schemas\")\n    builder.parse_schema_files(schema_dir)\n\n    # Parse decisions (all 128 files)\n    decisions_dir = os.path.join(hermes_dir, \"belam-codex\", \"decisions\")\n    if os.path.isdir(decisions_dir):\n        builder.parse_decisions(decisions_dir, limit=999)\n\n    # Parse lessons (all 208 files)\n    lessons_dir = os.path.join(hermes_dir, \"belam-codex\", \"lessons\")\n    if os.path.isdir(lessons_dir):\n        builder.parse_lessons(lessons_dir, limit=999)\n\n    # Parse tasks (expanded to all 84)\n    tasks_dir = os.path.join(hermes_dir, \"belam-codex\", \"tasks\")\n    if os.path.isdir(tasks_dir):\n        builder.parse_tasks(tasks_dir, limit=999)\n\n    # Parse goals (goal nodes with status/priority/urgency)\n    goals_dir = os.path.join(hermes_dir, \"belam-codex\", \"goals\")\n    if os.path.isdir(goals_dir):\n        builder.parse_goals(goals_dir)\n\n    # Parse agent roles (main, architect, builder, critic)\n    agents_dir = os.path.join(hermes_dir, \"belam-codex\", \"agents\")\n    if os.path.isdir(agents_dir):\n        builder.parse_agent_roles(agents_dir)\n\n    # Parse canvas graph (pre-computed cross-primitive causal edges)\n    canvas_dir = os.path.join(hermes_dir, \"belam-codex\", \"canvas\")\n    if os.path.isdir(canvas_dir):\n        builder.parse_canvas_graph(canvas_dir)\n\n    # Parse knowledge directory (semantic knowledge nodes with tag edges)\n    knowledge_dir = os.path.join(hermes_dir, \"belam-codex\", \"knowledge\")\n    if os.path.isdir(knowledge_dir):\n        builder.parse_knowledge(knowledge_dir)\n\n    # Parse handoff directory (agent handoff logs with TODO items)\n    handoff_dir = os.path.join(hermes_dir, \"belam-codex\", \"handoff\")\n    if os.path.isdir(handoff_dir):\n        builder.parse_handoff(handoff_dir)\n\n    # Parse archive/commands (38 command docs with upstream links to decision nodes)\n    archive_dir = os.path.join(hermes_dir, \"belam-codex\", \"archive\")\n\n[42 more lines in file. Use offset=1690 to continue.]"}],"isError":false,"timestamp":1777537971193}}
{"type":"message","id":"d8f7d0ff","parentId":"b1827c07","timestamp":"2026-04-30T08:32:55.553Z","message":{"role":"assistant","content":[{"type":"thinking","thinking":"Let me continue to find where archive parsing happens and add the skills parsing after knowledge:","thinkingSignature":"565c99b5c554d1c0ca535475c750c506559f49c9a5c0e6e0e2cb4a7729603635"},{"type":"toolCall","id":"call_function_p8wo62wdmt0a_1","name":"read","arguments":{"path":"/home/ubuntu/.hermes/agi/graph_builder.py","offset":1690,"limit":42}}],"api":"anthropic-messages","provider":"minimax","model":"MiniMax-M2.7","usage":{"input":33057,"output":75,"cacheRead":10071,"cacheWrite":0,"totalTokens":43203,"cost":{"input":0.0099171,"output":0.00008999999999999999,"cacheRead":0.0006042599999999999,"cacheWrite":0,"total":0.01061136}},"stopReason":"toolUse","timestamp":1777537971194,"responseId":"064246b3049a1e64637a8f98be077d29"}}
{"type":"message","id":"f1fbee84","parentId":"d8f7d0ff","timestamp":"2026-04-30T08:32:55.556Z","message":{"role":"toolResult","toolCallId":"call_function_p8wo62wdmt0a_1","toolName":"read","content":[{"type":"text","text":"    if os.path.isdir(archive_dir):\n        builder.parse_archive_commands(archive_dir)\n        builder.parse_archive_tasks(archive_dir)\n        builder.parse_codex_modules(archive_dir)\n\n    # Bridge isolated clusters via shared tags\n    builder.build_tag_bridges(hermes_dir)\n\n    # Process gitnexus cache\n    global _gitnexus_cache\n    if cache_to_use is None:\n        cache_to_use = _gitnexus_cache\n    if use_gitnexus and cache_to_use is None:\n        gitnexus_dir = os.path.join(hermes_dir, \"belam-codex\", \".gitnexus\")\n        if os.path.isdir(gitnexus_dir):\n            cache_to_use = run_subprocess(\n                f\"cd {hermes_dir}/belam-codex && npx --yes gitnexus query --repo belam-codex 'symbol' 2>/dev/null || echo ''\",\n                timeout=15\n            )\n            _save_cache(cache_to_use)\n\n    builder.process_gitnexus_cache(cache_to_use)\n    builder.build_adjacency()\n    _save_graph_cache(agi_dir, builder, cache_to_use)\n\n    elapsed_ms = (time.perf_counter() - start) * 1000\n    return builder, elapsed_ms\n\n\nif __name__ == \"__main__\":\n    import sys\n    hermes = os.path.expanduser(\"~/.hermes\")\n    agi = os.path.dirname(os.path.abspath(__file__))\n\n    builder, elapsed = build_graph(hermes, agi)\n    stats = builder.get_stats()\n\n    print(f\"Graph build: {elapsed:.2f}ms\")\n    print(f\"Nodes: {stats['node_count']}\")\n    print(f\"Edges: {stats['edge_count']}\")\n    print(f\"Types: {stats['nodes_by_type']}\")\n"}],"isError":false,"timestamp":1777537975556}}
{"type":"message","id":"1f001610","parentId":"f1fbee84","timestamp":"2026-04-30T08:33:01.002Z","message":{"role":"assistant","content":[{"type":"thinking","thinking":"Now I can add the parse_skills call after knowledge. Let me add it:","thinkingSignature":"21d17b434520846451ee367cb73097bfed0e63bcff47a6c21b3a324ec924c96a"},{"type":"toolCall","id":"call_function_oxuehbx08rjj_1","name":"edit","arguments":{"path":"/home/ubuntu/.hermes/agi/graph_builder.py","edits":[{"oldText":"    # Parse knowledge directory (semantic knowledge nodes with tag edges)\n    knowledge_dir = os.path.join(hermes_dir, \"belam-codex\", \"knowledge\")\n    if os.path.isdir(knowledge_dir):\n        builder.parse_knowledge(knowledge_dir)\n\n    # Parse handoff directory (agent handoff logs with TODO items)","newText":"    # Parse knowledge directory (semantic knowledge nodes with tag edges)\n    knowledge_dir = os.path.join(hermes_dir, \"belam-codex\", \"knowledge\")\n    if os.path.isdir(knowledge_dir):\n        builder.parse_knowledge(knowledge_dir)\n\n    # Parse skills directory (skill ecosystem with category/type nodes + related_skill edges)\n    skills_dir = os.path.join(hermes_dir, \"skills\")\n    if os.path.isdir(skills_dir):\n        builder.parse_skills(skills_dir)\n\n    # Parse handoff directory (agent handoff logs with TODO items)"}]}}],"api":"anthropic-messages","provider":"minimax","model":"MiniMax-M2.7","usage":{"input":33523,"output":289,"cacheRead":10071,"cacheWrite":0,"totalTokens":43883,"cost":{"input":0.010056899999999999,"output":0.00034679999999999997,"cacheRead":0.0006042599999999999,"cacheWrite":0,"total":0.011007959999999999}},"stopReason":"toolUse","timestamp":1777537975557,"responseId":"064246b75296a7c1ffd1f4fa004ddf66"}}
{"type":"message","id":"b92c1f94","parentId":"1f001610","timestamp":"2026-04-30T08:33:01.004Z","message":{"role":"toolResult","toolCallId":"call_function_oxuehbx08rjj_1","toolName":"edit","content":[{"type":"text","text":"Found 2 occurrences of the text in /home/ubuntu/.hermes/agi/graph_builder.py. The text must be unique. Please provide more context to make it unique."}],"details":{},"isError":true,"timestamp":1777537981004}}
{"type":"message","id":"1f6d77fe","parentId":"b92c1f94","timestamp":"2026-04-30T08:33:04.245Z","message":{"role":"assistant","content":[{"type":"thinking","thinking":"There are two occurrences. Let me find the one in the build_graph function specifically:","thinkingSignature":"7315e47baa1f58cfc867a01318a60377a988d917c62ee6cdb36178acbbba8e47"},{"type":"toolCall","id":"call_function_dkhhi0p016ua_1","name":"read","arguments":{"path":"/home/ubuntu/.hermes/agi/graph_builder.py","offset":1675,"limit":10}}],"api":"anthropic-messages","provider":"minimax","model":"MiniMax-M2.7","usage":{"input":33863,"output":75,"cacheRead":10071,"cacheWrite":0,"totalTokens":44009,"cost":{"input":0.0101589,"output":0.00008999999999999999,"cacheRead":0.0006042599999999999,"cacheWrite":0,"total":0.01085316}},"stopReason":"toolUse","timestamp":1777537981006,"responseId":"064246bd3b4cbc150598d0ddb145e061"}}
{"type":"message","id":"f21479ab","parentId":"1f6d77fe","timestamp":"2026-04-30T08:33:04.246Z","message":{"role":"toolResult","toolCallId":"call_function_dkhhi0p016ua_1","toolName":"read","content":[{"type":"text","text":"    if os.path.isdir(canvas_dir):\n        builder.parse_canvas_graph(canvas_dir)\n\n    # Parse knowledge directory (semantic knowledge nodes with tag edges)\n    knowledge_dir = os.path.join(hermes_dir, \"belam-codex\", \"knowledge\")\n    if os.path.isdir(knowledge_dir):\n        builder.parse_knowledge(knowledge_dir)\n\n    # Parse handoff directory (agent handoff logs with TODO items)\n    handoff_dir = os.path.join(hermes_dir, \"belam-codex\", \"handoff\")\n\n[47 more lines in file. Use offset=1685 to continue.]"}],"isError":false,"timestamp":1777537984246}}
