{"type":"message","id":"9b99e485","parentId":"976e4441","timestamp":"2026-04-30T08:31:30.069Z","message":{"role":"toolResult","toolCallId":"call_function_ohcqiiul79na_1","toolName":"read","content":[{"type":"text","text":"#!/usr/bin/env python3\n\"\"\"\n_benchmark.py — Autoresearch benchmark driver\nDB-augmented directed code generation via unified graph memory\n\nMeasures:\n  - graph_build_time_ms   (PRIMARY — lower is better)\n  - graph_node_count       (secondary)\n  - graph_edge_count       (secondary)\n  - query_time_ms          (secondary — path find across graph)\n  - ascii_render_lines     (secondary — rendered output size)\n\"\"\"\n\nimport time\nimport os\nimport json\nimport subprocess\nfrom collections import deque\n\n# Try to import modular system\ntry:\n    from graph_builder import build_graph, GraphBuilder\n    from query_engine import QueryEngine\n    from asciirender import ASCIIRenderer\n    HAS_MODULAR = True\nexcept ImportError:\n    HAS_MODULAR = False\n\nAGI_DIR = os.path.dirname(os.path.abspath(__file__))\nHERMES_DIR = os.path.expanduser(\"~/.hermes\")\nEXPERIMENT_DIR = os.path.join(AGI_DIR, \"experiments\", time.strftime(\"%Y%m%d_%H%M%S\"))\nos.makedirs(EXPERIMENT_DIR, exist_ok=True)\n\ndef metric(name, value):\n    print(f\"METRIC {name}={value}\", flush=True)\n\ndef run(cmd, timeout=30):\n    try:\n        result = subprocess.run(\n            cmd, shell=True, capture_output=True, text=True, timeout=timeout,\n            cwd=AGI_DIR\n        )\n        return result.stdout + result.stderr\n    except Exception:\n        return \"\"\n\n# Pre-load gitnexus cache before timing (I/O not part of graph construction)\n_GITNEXUS_CACHE_FILE = os.path.join(AGI_DIR, \".gitnexus_cache.json\")\n_gitnexus_cache = None\n\nif os.path.exists(_GITNEXUS_CACHE_FILE):\n    try:\n        mtime = os.path.getmtime(_GITNEXUS_CACHE_FILE)\n        age_hours = (time.time() - mtime) / 3600\n        if age_hours < 24:\n            with open(_GITNEXUS_CACHE_FILE) as f:\n                _gitnexus_cache = f.read()\n    except Exception:\n        pass\n\nif _gitnexus_cache is None:\n    _gitnexus_dir = os.path.join(HERMES_DIR, \"belam-codex\", \".gitnexus\")\n    if os.path.isdir(_gitnexus_dir):\n        _gitnexus_cache = run(f\"cd {HERMES_DIR}/belam-codex && npx --yes gitnexus query --repo belam-codex 'symbol' 2>/dev/null || echo ''\", timeout=15)\n        try:\n            with open(_GITNEXUS_CACHE_FILE, 'w') as f:\n                f.write(_gitnexus_cache)\n        except Exception:\n            pass\n\n# Pre-warm graph pickle cache before timing (I/O outside benchmark window)\nif HAS_MODULAR:\n    # First call builds + saves pickle; second call hits cache\n    build_graph(HERMES_DIR, AGI_DIR, gitnexus_cache=_gitnexus_cache)\n    \n    # Timed run — should hit pickle cache (microseconds)\n    start = time.perf_counter()\n    builder, _ = build_graph(HERMES_DIR, AGI_DIR, gitnexus_cache=_gitnexus_cache)\n    build_time_ms = (time.perf_counter() - start) * 1000\n    \n    nodes = builder.nodes  # tuples: (id, type, label, content, source)\n    edges = builder.edges  # dicts: {from, to, type}\n    adj = builder.adj\nelse:\n    # Fallback to inline implementation\n    import re\n    _RE_SECTION_SPLIT = re.compile(r'\\n(?=#)')\n    _RE_CODE_BLOCK = re.compile(r'`([^`]+)`')\n    \n    start = time.perf_counter()\n    nodes = []\n    edges = []\n    \n    agents_md = os.path.join(HERMES_DIR, \"belam-codex\", \"AGENTS.md\")\n    if os.path.exists(agents_md):\n        with open(agents_md, \"r\") as f:\n            content = f.read()\n        \n        sections = _RE_SECTION_SPLIT.split(content)\n        last_section_idx = -1\n        for i, section in enumerate(sections):\n            lines = section.strip().split('\\n')\n            if not lines:\n                continue\n            header = lines[0].strip('#').strip()\n            body = '\\n'.join(lines[1:]).strip()[:120]\n            nodes.append((f\"agents_section_{i}\", \"doc_section\", header[:60], body, \"AGENTS.md\"))\n            if last_section_idx >= 0:\n                edges.append({\"from\": f\"agents_section_{last_section_idx}\", \"to\": f\"agents_section_{i}\", \"type\": \"sequential\"})\n            last_section_idx = i\n        \n        for match in _RE_CODE_BLOCK.finditer(content):\n            code = match.group(1)\n            if len(code) > 3 and ' ' in code:\n                nodes.append((f\"code_ref_{match.start()}\", \"code_reference\", code[:60], code, \"AGENTS.md\"))\n                edges.append({\n                    \"from\": f\"agents_section_{last_section_idx}\",\n                    \"to\": f\"code_ref_{match.start()}\",\n                    \"type\": \"contains\"\n                })\n    \n    # Process gitnexus cache\n    if _gitnexus_cache and _gitnexus_cache.strip():\n        try:\n            result = json.loads(_gitnexus_cache)\n            for category in ['definitions', 'process_symbols', 'processes']:\n                for item in result.get(category, [])[:30]:\n                    nodes.append((f\"gitnexus_{category}_{item.get('id', '')[:40]}\", f\"gitnexus_{category.rstrip('s')}\", item.get('name', item.get('id', ''))[:60], f\"{item.get('filePath', '')}:{item.get('startLine', '')}\", \"gitnexus_index\"))\n        except json.JSONDecodeError:\n            pass\n    \n    build_time_ms = (time.perf_counter() - start) * 1000\n    \n    # Build adjacency\n    adj = {n[0]: [] for n in nodes}\n    for e in edges:\n        if e[\"from\"] in adj and e[\"to\"] in adj:\n            adj[e[\"from\"]].append(e[\"to\"])\n            adj[e[\"to\"]].append(e[\"from\"])\n\nmetric(\"graph_build_time_ms\", round(build_time_ms, 2))\nmetric(\"graph_node_count\", len(nodes))\nmetric(\"graph_edge_count\", len(edges))\n\n# ── 2. Path Query (unidirectional BFS) ─────────────────────────────────────\nquery_time_ms = 0.0\npath_result = \"\"\nif len(nodes) >= 2:\n    section_nodes = [n[0] for n in nodes if str(n[0]).startswith(\"agents_section_\")]\n    if len(section_nodes) >= 2:\n        start_node, end_node = section_nodes[0], section_nodes[-1]\n        # Try precomputed path from GraphBuilder first (O(1) lookup)\n        precomputed = None\n        if HAS_MODULAR and hasattr(builder, '_precomputed_paths'):\n            precomputed = builder._precomputed_paths.get((start_node, end_node))\n        if precomputed is not None:\n            path_result = json.dumps(precomputed)\n            # Precomputed lookup is ~0ms\n            query_time_ms = 0.0\n        else:\n            start = time.perf_counter()\n            # Unidirectional BFS: faster than bidirectional for small graphs\n            if start_node == end_node:\n                path_result = json.dumps([start_node])\n            else:\n                visited = {start_node}\n                queue = deque([(start_node, [start_node])])\n                found = None\n                while queue:\n                    current, path = queue.popleft()\n                    if current == end_node:\n                        found = path\n                        break\n                    for neighbor in adj.get(current, []):\n                        if neighbor not in visited:\n                            visited.add(neighbor)\n                            queue.append((neighbor, path + [neighbor]))\n                path_result = json.dumps(found) if found else \"[]\"\n            query_time_ms = (time.perf_counter() - start) * 1000\nmetric(\"query_time_ms\", round(query_time_ms, 2))\n# ── 3. ASCII Render ─────────────────────────────────────────────────────────\n# Rich multi-type graph visualization\nnode_lookup = {n[0]: n for n in nodes}\n\n# Group nodes by type prefix (handle canvas_* and archive_*)\ndef type_key(n):\n    t = n[1]\n    if t.startswith('canvas_'): return 'canvas'\n    if t.startswith('archive_'): return 'archive'\n    if t.startswith('gitnexus_'): return 'gitnexus'\n    return t\n\ntype_groups = {}\nfor n in nodes:\n    k = type_key(n)\n    type_groups.setdefault(k, []).append(n)\n\nlines = []\nlines.append(\" UNIFIED GRAPH \")\nlines.append(\"=\" * 60)\nlines.append(f\" nodes={len(nodes)}  edges={len(edges)}\")\nlines.append(\"-\" * 60)\n\n# Section 1: doc_sections with children (from AGENTS.md)\nsection_nodes = type_groups.get('doc_section', [])\nif section_nodes:\n    lines.append(\" [doc_sections]\")\n    for i, n in enumerate(section_nodes[:8]):\n        label = n[2][:45]\n        children = adj.get(n[0], [])\n        child_labels = [node_lookup[c][2][:18] for c in children[:3] if c in node_lookup]\n        child_str = f\" → {', '.join(child_labels)}\" if child_labels else \"\"\n        prefix = \"  \" if i > 0 else \"\"\n        lines.append(f\"{prefix}├─ {label}{child_str}\")\n    if len(section_nodes) > 8:\n        lines.append(f\"  └─ ...+{len(section_nodes)-8} sections\")\n\n# Section 2: canvas commands (from canvas graph_data.json)\ncanvas_cmds = type_groups.get('canvas', [])\nif canvas_cmds:\n    lines.append(\" [canvas_commands]\")\n    for n in canvas_cmds[:8]:\n        label = n[2][:45]\n        children = adj.get(n[0], [])\n        child_labels = [node_lookup[c][2][:18] for c in children[:3] if c in node_lookup]\n        child_str = f\" → {', '.join(child_labels)}\" if child_labels else \"\"\n        lines.append(f\"  ├─ {label}{child_str}\")\n    if len(canvas_cmds) > 8:\n        lines.append(f\"  └─ ...+{len(canvas_cmds)-8} canvas nodes\")\n\n# Section 3: archive commands (from archive/commands/*.md)\narchive_cmds = type_groups.get('archive', [])\nif archive_cmds:\n    lines.append(\" [archive_commands]\")\n    for n in archive_cmds[:6]:\n        label = n[2][:45]\n        children = adj.get(n[0], [])\n        child_labels = [node_lookup[c][2][:18] for c in children[:3] if c in node_lookup]\n        child_str = f\" → {', '.join(child_labels)}\" if child_labels else \"\"\n        lines.append(f\"  ├─ {label}{child_str}\")\n    if len(archive_cmds) > 6:\n        lines.append(f\"  └─ ...+{len(archive_cmds)-6} commands\")\n\n# Section 4: other primitive types (summary)\nprimitive_types = ['decision', 'lesson', 'task', 'goal', 'memory_session',\n                   'schema_entity', 'schema_field', 'knowledge', 'handoff',\n                   'agent_role', 'agent_boundary', 'agent_capability', 'gitnexus']\nfor ptype in primitive_types:\n    grp = type_groups.get(ptype, [])\n    if grp:\n        samples = [n[2][:20] for n in grp[:3]]\n        sample_str = \", \".join(samples)\n        extra = f\" (+{len(grp)-3})\" if len(grp) > 3 else \"\"\n        lines.append(f\" [n={len(grp)}] {ptype}: {sample_str}{extra}\")\n\n# Section 5: cross-type edge summary\nedge_types = {}\nfor e in edges:\n    edge_types.setdefault(e['type'], []).append(e)\nlines.append(\"-\" * 60)\nlines.append(\" [cross_type_edges]\")\nfor etype, elist in sorted(edge_types.items(), key=lambda x: -len(x[1]))[:6]:\n    samples = [(node_lookup.get(e['from'], ('','',''))[2][:15], node_lookup.get(e['to'], ('','',''))[2][:15]) for e in elist[:2]]\n    sample_str = \"; \".join([f\"{s[0]}→{s[1]}\" for s in samples])\n    extra = f\" (+{len(elist)-2})\" if len(elist) > 2 else \"\"\n    lines.append(f\"  {etype}({len(elist)}): {sample_str}{extra}\")\n\nlines.append(\"-\" * 60)\nlines.append(f\" path_query: {path_result[:80]}{'...' if len(path_result) > 80 else ''}\")\n\nascii_output = '\\n'.join(lines)\nascii_lines = len(ascii_output.strip().split('\\n'))\nmetric(\"ascii_render_lines\", ascii_lines)\n\n# Save output\noutput_file = os.path.join(EXPERIMENT_DIR, \"output.txt\")\nwith open(output_file, \"w\") as f:\n    f.write(f\"graph_build_time_ms={round(build_time_ms,2)}\\n\")\n    f.write(f\"graph_node_count={len(nodes)}\\n\")\n    f.write(f\"graph_edge_count={len(edges)}\\n\")\n    f.write(f\"query_time_ms={round(query_time_ms,2)}\\n\")\n    f.write(f\"ascii_render_lines={ascii_lines}\\n\")\n    f.write(f\"\\n--- ASCII GRAPH RENDER ---\\n\")\n    f.write(ascii_output)\n\nprint(f\"\\nMETRIC graph_build_time_ms={round(build_time_ms, 2)}\")\nprint(f\"METRIC graph_node_count={len(nodes)}\")\nprint(f\"METRIC graph_edge_count={len(edges)}\")\nprint(f\"METRIC query_time_ms={round(query_time_ms, 2)}\")\nprint(f\"METRIC ascii_render_lines={ascii_lines}\")\nprint(f\"Using modular system: {HAS_MODULAR}\")\n"}],"isError":false,"timestamp":1777537890069}}
{"type":"message","id":"217a4ca7","parentId":"9b99e485","timestamp":"2026-04-30T08:31:40.081Z","message":{"role":"assistant","content":[{"type":"thinking","thinking":"Now I understand the full picture. Looking at the current state:\n\n1. **Primary metric** (graph_build_time_ms): saturated at ~0.04ms (lru_cache warm load, noise floor)\n2. **query_time_ms**: already O(1) via precomputed paths\n3. **ascii_render_lines**: 55 (noise floor reached)\n\nLooking at the ideas backlog and what's been done:\n- The pi_tree_adapter.py has a bug: it tries to access tuple nodes as dicts (`n[\"id\"]` instead of `n[0]`)\n- This adapter is currently broken and needs fixing\n\nLet me focus on **fixing the pi_tree_adapter.py** to work with tuple nodes instead of dicts. This is a targeted, small change that could improve integration with pi's tree feature.\n\nActually wait, let me check if pi_tree_adapter is actually being used anywhere in the benchmark, or if it's just a standalone utility:","thinkingSignature":"ddb4f30aeb8f9296850f3afad300946f961281b5751e7cfd193edebaa46966f2"},{"type":"toolCall","id":"call_function_ld4vhfvzo64o_1","name":"bash","arguments":{"command":"grep -r \"pi_tree_adapter\\|PiTreeAdapter\" /home/ubuntu/.hermes/agi/*.py 2>/dev/null"}}],"api":"anthropic-messages","provider":"minimax","model":"MiniMax-M2.7","usage":{"input":20221,"output":246,"cacheRead":10071,"cacheWrite":0,"totalTokens":30538,"cost":{"input":0.006066299999999999,"output":0.00029519999999999997,"cacheRead":0.0006042599999999999,"cacheWrite":0,"total":0.006965759999999999}},"stopReason":"toolUse","timestamp":1777537890070,"responseId":"06424662134a48aa9cdecadba95964d3"}}
{"type":"message","id":"878a73e9","parentId":"217a4ca7","timestamp":"2026-04-30T08:31:40.090Z","message":{"role":"toolResult","toolCallId":"call_function_ld4vhfvzo64o_1","toolName":"bash","content":[{"type":"text","text":"/home/ubuntu/.hermes/agi/pi_tree_adapter.py:pi_tree_adapter.py — Adapter to feed graph output into pi's /tree feature\n/home/ubuntu/.hermes/agi/pi_tree_adapter.py:class PiTreeAdapter:\n/home/ubuntu/.hermes/agi/pi_tree_adapter.py:    adapter = PiTreeAdapter(builder)\n/home/ubuntu/.hermes/agi/pi_tree_adapter.py:    adapter = PiTreeAdapter(builder)\n"}],"isError":false,"timestamp":1777537900090}}
{"type":"message","id":"fff79128","parentId":"878a73e9","timestamp":"2026-04-30T08:31:44.275Z","message":{"role":"assistant","content":[{"type":"thinking","thinking":"The pi_tree_adapter is a standalone utility that's not integrated into the benchmark. It's also broken due to tuple vs dict access.\n\nSince the primary metric is saturated and this adapter isn't benchmarked, let me look for something that could improve secondary metrics or data richness. Let me check what directories could be parsed:","thinkingSignature":"bc49b289988aedb3e37081f2578bacebe2dfc17efe79f80b6e0f8cdef2fdc985"},{"type":"toolCall","id":"call_function_3otx3a7f9l95_1","name":"bash","arguments":{"command":"ls /home/ubuntu/.hermes/belam-codex/canvas/ 2>/dev/null | head -15"}},{"type":"toolCall","id":"call_function_3otx3a7f9l95_2","name":"bash","arguments":{"command":"cat /home/ubuntu/.hermes/belam-codex/canvas/graph_data.json 2>/dev/null | head -50"}}],"api":"anthropic-messages","provider":"minimax","model":"MiniMax-M2.7","usage":{"input":20576,"output":156,"cacheRead":10071,"cacheWrite":0,"totalTokens":30803,"cost":{"input":0.0061728,"output":0.0001872,"cacheRead":0.0006042599999999999,"cacheWrite":0,"total":0.00696426}},"stopReason":"toolUse","timestamp":1777537900092,"responseId":"0642466c80dc19629cbba732bcd508a6"}}
{"type":"message","id":"2f765821","parentId":"fff79128","timestamp":"2026-04-30T08:31:44.288Z","message":{"role":"toolResult","toolCallId":"call_function_3otx3a7f9l95_1","toolName":"bash","content":[{"type":"text","text":"graph.html\ngraph_data.json\nmapper_batch_0.json\nmapper_batch_1.json\nmapper_batch_2.json\nmapper_batch_3.json\nmapper_batch_4.json\nmapper_batch_5.json\nmapper_batch_6.json\nmapper_batch_7.json\nmapper_batch_8.json\nmapper_queue.json\nrelationship_progress.json\n"}],"isError":false,"timestamp":1777537904288}}
{"type":"message","id":"3155c724","parentId":"2f765821","timestamp":"2026-04-30T08:31:44.290Z","message":{"role":"toolResult","toolCallId":"call_function_3otx3a7f9l95_2","toolName":"bash","content":[{"type":"text","text":"{\n  \"nodes\": [\n    {\n      \"id\": \"lesson/always-back-up-workspace-to-github\",\n      \"type\": \"lesson\",\n      \"title\": \"Always Back Up Workspace to GitHub\",\n      \"tags\": [\n        \"infrastructure\",\n        \"git\",\n        \"backup\",\n        \"redundancy\"\n      ],\n      \"status\": \"high\",\n      \"frontmatter\": {\n        \"primitive\": \"lesson\",\n        \"date\": \"2026-03-20\",\n        \"source\": \"session \\u2014 Shael asked if workspace changes were backed up, they weren't\",\n        \"confidence\": \"high\",\n        \"upstream\": [\n          \"decision/belam-codex-resurrection\"\n        ],\n        \"downstream\": [],\n        \"tags\": [\n          \"infrastructure\",\n          \"git\",\n          \"backup\",\n          \"redundancy\"\n        ]\n      }\n    },\n    {\n      \"id\": \"lesson/analysis-phase2-gate-mandatory\",\n      \"type\": \"lesson\",\n      \"title\": \"Lesson: Analysis Phase 2 is a Mandatory Gate Before New Versions\",\n      \"tags\": [\n        \"pipeline\",\n        \"methodology\",\n        \"analysis\",\n        \"gate\"\n      ],\n      \"status\": \"active\",\n      \"frontmatter\": {\n        \"primitive\": \"lesson\",\n        \"status\": \"active\",\n        \"priority\": \"critical\",\n        \"tags\": [\n          \"pipeline\",\n          \"methodology\",\n          \"analysis\",\n          \"gate\"\n"}],"isError":false,"timestamp":1777537904290}}
{"type":"message","id":"99b24d93","parentId":"3155c724","timestamp":"2026-04-30T08:31:48.267Z","message":{"role":"assistant","content":[{"type":"thinking","thinking":"Looking at the canvas graph_data.json, it already contains cross-references between primitives (lessons, decisions, tasks, etc.). Let me check what's currently being parsed from the canvas:","thinkingSignature":"50048597299679d045817d2b8dcabaeb734ce969c1019622124715c32430c0de"},{"type":"toolCall","id":"call_function_r9g4nex1h757_1","name":"read","arguments":{"path":"/home/ubuntu/.hermes/agi/graph_builder.py","offset":616,"limit":64}}],"api":"anthropic-messages","provider":"minimax","model":"MiniMax-M2.7","usage":{"input":21125,"output":94,"cacheRead":10071,"cacheWrite":0,"totalTokens":31290,"cost":{"input":0.006337499999999999,"output":0.00011279999999999999,"cacheRead":0.0006042599999999999,"cacheWrite":0,"total":0.007054559999999999}},"stopReason":"toolUse","timestamp":1777537904291,"responseId":"064246709f06201341a83b27b196c648"}}
{"type":"message","id":"7e65965e","parentId":"99b24d93","timestamp":"2026-04-30T08:31:48.273Z","message":{"role":"toolResult","toolCallId":"call_function_r9g4nex1h757_1","toolName":"read","content":[{"type":"text","text":"    def parse_canvas_graph(self, canvas_dir: str) -> Tuple[int, int]:\n        \"\"\"Parse canvas graph_data.json with pre-computed cross-primitive edges.\n        \n        Returns (nodes_added, edges_added). Adds 105 nodes (lesson, decision, task,\n        project, pipeline, command, skill, knowledge) and 8 causal edges from\n        LLM-judged relationship data.\n        \"\"\"\n        graph_file = os.path.join(canvas_dir, \"graph_data.json\")\n        if not os.path.exists(graph_file):\n            return 0, 0\n\n        try:\n            with open(graph_file) as f:\n                data = json.load(f)\n        except Exception:\n            return 0, 0\n\n        canvas_nodes = data.get('nodes', [])\n        canvas_edges = data.get('edges', [])\n\n        if not canvas_nodes:\n            return 0, 0\n\n        # Build ID mapping: canvas slug -> our node_id\n        # Canvas format: 'decision/belam-codex-resurrection'\n        # Our format: 'decision_belam-codex-resurrection' or 'decision_belam_codex_resurrection'\n        slug_to_id = {}\n        id_type_map = {}  # canvas_id -> (type_label, node_id)\n\n        nodes_added = 0\n        for cn in canvas_nodes:\n            canvas_id = cn.get('id', '')\n            node_type = cn.get('type', 'primitive')\n            title = cn.get('title', canvas_id)[:60]\n            tags = ','.join(cn.get('tags', [])[:5])[:60]\n            source = f\"canvas/graph_data.json\"\n            # Create our node ID: type_slug format\n            our_id = canvas_id.replace('/', '_')\n            node_id = self.add_node(\n                f\"canvas_{node_type}\",\n                title,\n                tags,\n                source,\n                our_id\n            )\n            slug_to_id[canvas_id] = our_id\n            id_type_map[canvas_id] = (node_type, node_id)\n            nodes_added += 1\n\n        edges_added = 0\n        for ce in canvas_edges:\n            src = ce.get('source', '')\n            tgt = ce.get('target', '')\n            if not src or not tgt:\n                continue\n            # Map canvas IDs to our IDs\n            src_id = slug_to_id.get(src)\n            tgt_id = slug_to_id.get(tgt)\n            if src_id and tgt_id and src_id in self._node_ids and tgt_id in self._node_ids:\n                self.add_edge(src_id, tgt_id, \"causes\")\n                edges_added += 1\n\n        return nodes_added, edges_added\n\n\n[915 more lines in file. Use offset=680 to continue.]"}],"isError":false,"timestamp":1777537908273}}
