{"type":"message","id":"0c3f1576","parentId":"956db14e","timestamp":"2026-04-30T07:59:17.817Z","message":{"role":"toolResult","toolCallId":"call_function_554jsapksrxl_2","toolName":"bash","content":[{"type":"text","text":"{\"type\":\"message\",\"id\":\"377a6c50\",\"parentId\":\"917da531\",\"timestamp\":\"2026-04-30T06:37:00.311Z\",\"message\":{\"role\":\"assistant\",\"content\":[{\"type\":\"thinking\",\"thinking\":\"OK so both `query_engine.py` and `asciirender.py` access nodes as dicts:\\n- `n[\\\"id\\\"]`, `n[\\\"type\\\"]`, `n[\\\"label\\\"]`, `n[\\\"content\\\"]`, `n[\\\"source\\\"]`\\n\\nMy plan:\\n1. Convert nodes to tuples in the cache (graph_builder.py)\\n2. Keep the in-memory representation as tuples\\n3. Update all consumers: `_benchmark.py`, `query_engine.py`, `asciirender.py`\\n\\nBut wait - the benchmark itself creates nodes as dicts in the fallback path, and it accesses them as dicts. \\n\\nThe `build_graph` function returns nodes as tuples from cache, but the benchmark accesses them as dicts and constructs new dicts in the fallback path. The real question is whether the `_try_load_graph_cache` function converts tuples back to dicts when deserializing, which would defeat the purpose of optimizing the cache format. to tuples\\n4. BUT it reconstructs `builder._node_ids` from tuples using `{n[\\\"id\\\"] for n in builder.nodes}` — that won't work since `n[0]` is the id in tuples\\n5. So I need to update the `_node_ids` reconstruction\\n6. The cache will store tuples, which is faster to pickle/unpickle\\n7. BUT: the `nodes` are returned from `build_graph` and the benchmark accesses them as dicts...\\n\\nActually wait, looking at the benchmark code more carefully:\\n```python\\nnodes = builder.nodes  # This is a list of tuples if we convert\\n```\\n\\nThe benchmark then accesses `nodes[0][\\\"id\\\"]` etc. That will fail if nodes are tuples.\\n\\nI could add a property like `builder.nodes_as_dicts` that reconstructs dicts on demand, but that adds overhead. Let me reconsider.\\n\\nActually, looking at the benchmark output — the metrics just count nodes and edges, and only a few specific nodes are accessed by `[\\\"id\\\"]` and `[\\\"type\\\"]` attributes. So I could convert the cache to tuples for faster pickle operations, keep the in-memory nodes as tuples, and then just convert to dicts when the benchmark accesses them. Or even simpler: add a helper method that converts nodes to dicts on the fly for the specific accesses needed.\\n\\nBut wait — the `adj` dictionary keys are node IDs, so that stays the same. The pickle cache stores `builder.adj` which is a dict, so that's fine. The real issue is the `nodes` list. If I store tuples in the pickle, then `builder.nodes` becomes tuples, and any code accessing `builder.nodes[i][\\\"id\\\"]` breaks. I could add a `nodes_as_dicts` property that converts on demand, but then the consumer code would need to be updated to use it.\\n\\nThe simplest fix: keep the pickle cache storing tuples (fast), and add a helper method that reconstructs dicts when needed. Or just update all the consumer code to access tuples instead.\\n\\nBut actually — the best approach is to make nodes plain tuples everywhere, then update all consumers to use index-based access instead of dictionary keys. This means changing `node[\\\"id\\\"]` to `node[0]`, `node[\\\"type\\\"]` to `node[1]`, and so on across `_benchmark.py`, `query_engine.py`, and `asciirender.py`.\\n\\nThis is a larger change but it's the cleanest solution for performance.\",\"thinkingSignature\":\"a2abd1275e933d3d568c61e7901587e2314575f7c76c362e46d7a7f8d22f8b59\"},{\"type\":\"text\",\"text\":\"Nodes are dicts (5 keys each) in the pickle cache. Converting to tuples saves pickle overhead. I'll make this targeted change across all affected files.\\n\"},{\"type\":\"toolCall\",\"id\":\"call_function_3oszsvrukcf6_1\",\"name\":\"edit\",\"arguments\":{\"path\":\"/home/ubuntu/.hermes/agi/graph_builder.py\",\"edits\":[{\"oldText\":\"    def add_node(self, node_type: str, label: str, content: str = \\\"\\\",\\n                 source: str = \\\"\\\", node_id: Optional[str] = None) -> str:\\n        \\\"\\\"\\\"Add a node to the graph.\\\"\\\"\\\"\\n        if node_id is None:\\n            node_id = f\\\"{node_type}_{len(self.nodes)}\\\"\\n\\n        # Ensure unique ID\\n        base_id = node_id\\n        counter = 0\\n        while node_id in self._node_ids:\\n            counter += 1\\n            node_id = f\\\"{base_id}_{counter}\\\"\\n\\n        self._node_ids.add(node_id)\\n        self.nodes.append({\\n            \\\"id\\\": node_id,\\n            \\\"type\\\": node_type,\\n            \\\"label\\\": label[:60],\\n            \\\"content\\\": content[:120] if content else \\\"\\\",\\n            \\\"source\\\": source\\n        })\\n        return node_id\",\"newText\":\"    def add_node(self, node_type: str, label: str, content: str = \\\"\\\",\\n                 source: str = \\\"\\\", node_id: Optional[str] = None) -> str:\\n        \\\"\\\"\\\"Add a node to the graph. Stored as tuple (id, type, label, content, source).\\\"\\\"\\\"\\n        if node_id is None:\\n            node_id = f\\\"{node_type}_{len(self.nodes)}\\\"\\n\\n        # Ensure unique ID\\n        base_id = node_id\\n        counter = 0\\n        while node_id in self._node_ids:\\n            counter += 1\\n            node_id = f\\\"{base_id}_{counter}\\\"\\n\\n        self._node_ids.add(node_id)\\n        # Store as tuple for faster pickle serialization\\n        self.nodes.append((node_id, node_type, label[:60], content[:120] if content else \\\"\\\", source))\\n        return node_id\"},{\"oldText\":\"        builder._node_ids = {n[\\\"id\\\"] for n in builder.nodes}\",\"newText\":\"        builder._node_ids = {n[0] for n in builder.nodes}\"}]}}],\"api\":\"anthropic-messages\",\"provider\":\"minimax\",\"model\":\"MiniMax-M2.7\",\"usage\":{\"input\":17913,\"output\":1249,\"cacheRead\":10071,\"cacheWrite\":0,\"totalTokens\":29233,\"cost\":{\"input\":0.0053739,\"output\":0.0014988,\"cacheRead\":0.0006042599999999999,\"cacheWrite\":0,\"total\":0.0074769599999999995}},\"stopReason\":\"toolUse\",\"timestamp\":1777530986075,\"responseId\":\"06422b6afd59aa8c72141c69fbe6b37e\"}}\n{\"type\":\"message\",\"id\":\"24ca4726\",\"parentId\":\"377a6c50\",\"timestamp\":\"2026-04-30T06:37:00.323Z\",\"message\":{\"role\":\"toolResult\",\"toolCallId\":\"call_function_3oszsvrukcf6_1\",\"toolName\":\"edit\",\"content\":[{\"type\":\"text\",\"text\":\"Successfully replaced 2 block(s) in /home/ubuntu/.hermes/agi/graph_builder.py.\"}],\"details\":{\"diff\":\"     ...\\n  58         self._section_stack: List[int] = []\\n  59 \\n  60     def add_node(self, node_type: str, label: str, content: str = \\\"\\\",\\n  61                  source: str = \\\"\\\", node_id: Optional[str] = None) -> str:\\n- 62         \\\"\\\"\\\"Add a node to the graph.\\\"\\\"\\\"\\n+ 62         \\\"\\\"\\\"Add a node to the graph. Stored as tuple (id, type, label, content, source).\\\"\\\"\\\"\\n  63         if node_id is None:\\n  64             node_id = f\\\"{node_type}_{len(self.nodes)}\\\"\\n  65 \\n  66         # Ensure unique ID\\n     ...\\n  70             counter += 1\\n  71             node_id = f\\\"{base_id}_{counter}\\\"\\n  72 \\n  73         self._node_ids.add(node_id)\\n- 74         self.nodes.append({\\n- 75             \\\"id\\\": node_id,\\n- 76             \\\"type\\\": node_type,\\n- 77             \\\"label\\\": label[:60],\\n- 78             \\\"content\\\": content[:120] if content else \\\"\\\",\\n- 79             \\\"source\\\": source\\n- 80         })\\n+ 74         # Store as tuple for faster pickle serialization\\n+ 75         self.nodes.append((node_id, node_type, label[:60], content[:120] if content else \\\"\\\", source))\\n  81         return node_id\\n  82 \\n  83     def add_edge(self, from_id: str, to_id: str, edge_type: str = \\\"references\\\"):\\n  84         \\\"\\\"\\\"Add an edge between nodes.\\\"\\\"\\\"\\n     ...\\n 463         builder = GraphBuilder()\\n 464         builder.nodes = cached.get('nodes', [])\\n 465         builder.edges = cached.get('edges', [])\\n 466         builder.adj = cached.get('adj', {})\\n-467         builder._node_ids = {n[\\\"id\\\"] for n in builder.nodes}\\n+462         builder._node_ids = {n[0] for n in builder.nodes}\\n 468         return builder\\n 469     except Exception:\\n 470         return None\\n 471 \\n     ...\",\"firstChangedLine\":62},\"isError\":false,\"timestamp\":1777531020323}}\n{\"type\":\"message\",\"id\":\"85020fc7\",\"parentId\":\"24ca4726\",\"timestamp\":\"2026-04-30T06:37:18.928Z\",\"message\":{\"role\":\"assistant\",\"content\":[{\"type\":\"thinking\",\"thinking\":\"Now I need to update the consumers of nodes. Let me update `_benchmark.py` to use tuple indices:\",\"thinkingSignature\":\"262aedc452dae66bcdfacb5f7332dcbcf2fe34cd8030395203c129de05bc73a7\"},{\"type\":\"text\",\"text\":\"Now update the benchmark to use tuple indices for nodes:\\n\"},{\"type\":\"toolCall\",\"id\":\"call_function_oumjqmpj91jv_1\",\"name\":\"edit\",\"arguments\":{\"path\":\"/home/ubuntu/.hermes/agi/_benchmark.py\",\"edits\":[{\"oldText\":\"    nodes = builder.nodes\\n    edges = builder.edges\\n    adj = builder.adj\",\"newText\":\"    nodes = builder.nodes  # tuples: (id, type, label, content, source)\\n    edges = builder.edges  # dicts: {from, to, type}\\n    adj = builder.adj\"},{\"oldText\":\"    section_nodes = [n[\\\"id\\\"] for n in nodes if n[\\\"id\\\"].startswith(\\\"agents_section_\\\")]\",\"newText\":\"    section_nodes = [n[0] for n in nodes if n[0].startswith(\\\"agents_section_\\\")]\"},{\"oldText\":\"    section_nodes = [n for n in nodes if n[\\\"type\\\"] == \\\"doc_section\\\"]\\n    node_lookup = {n[\\\"id\\\"]: n for n in nodes}\",\"newText\":\"    section_nodes = [n for n in nodes if n[1] == \\\"doc_section\\\"]\\n    node_lookup = {n[0]: n for n in nodes}\"},{\"oldText\":\"        child_labels = [node_lookup[c][\\\"label\\\"][:20] for c in children[:3] if c in node_lookup]\",\"newText\":\"        child_labels = [node_lookup[c][2][:20] for c in children[:3] if c in node_lookup]\"},{\"oldText\":\"        nodes.append({\\n            \\\"id\\\": f\\\"agents_section_{i}\\\",\\n            \\\"type\\\": \\\"doc_section\\\",\\n            \\\"label\\\": header[:60],\\n            \\\"content\\\": body,\\n            \\\"source\\\": \\\"AGENTS.md\\\"\\n        })\",\"newText\":\"        nodes.append((\\n            f\\\"agents_section_{i}\\\",\\n            \\\"doc_section\\\",\\n            header[:60],\\n            body,\\n            \\\"AGENTS.md\\\"\\n        ))\"},{\"oldText\":\"        for match in _RE_CODE_BLOCK.finditer(content):\\n            code = match.group(1)\\n            if len(code) > 3 and ' ' in code:\\n                nodes.append({\\n                    \\\"id\\\": f\\\"code_ref_{match.start()}\\\",\\n                    \\\"type\\\": \\\"code_reference\\\",\\n                    \\\"label\\\": code[:60],\\n                    \\\"content\\\": code,\\n                    \\\"source\\\": \\\"AGENTS.md\\\"\\n                })\\n                edges.append({\\n                    \\\"from\\\": f\\\"agents_section_{last_section_idx}\\\",\\n                    \\\"to\\\": f\\\"code_ref_{match.start()}\\\",\\n                    \\\"type\\\": \\\"contains\\\"\\n                })\",\"newText\":\"        for match in _RE_CODE_BLOCK.finditer(content):\\n            code = match.group(1)\\n            if len(code) > 3 and ' ' in code:\\n                nodes.append((\\n                    f\\\"code_ref_{match.start()}\\\",\\n                    \\\"code_reference\\\",\\n                    code[:60],\\n                    code,\\n                    \\\"AGENTS.md\\\"\\n                ))\\n                edges.append({\\n                    \\\"from\\\": f\\\"agents_section_{last_section_idx}\\\",\\n                    \\\"to\\\": f\\\"code_ref_{match.start()}\\\",\\n                    \\\"type\\\": \\\"contains\\\"\\n                })\"},{\"oldText\":\"                for item in result.get(category, [])[:30]:\\n                    nodes.append({\\n                        \\\"id\\\": f\\\"gitnexus_{category}_{item.get('id', '')[:40]}\\\",\\n                        \\\"type\\\": f\\\"gitnexus_{category.rstrip('s')}\\\",\\n                        \\\"label\\\": item.get('name', item.get('id', ''))[:60],\\n                        \\\"content\\\": f\\\"{item.get('filePath', '')}:{item.get('startLine', '')}\\\",\\n                        \\\"source\\\": \\\"gitnexus_index\\\"\\n                    })\",\"newText\":\"                for item in result.get(category, [])[:30]:\\n                    nodes.append((\\n                        f\\\"gitnexus_{category}_{item.get('id', '')[:40]}\\\",\\n                        f\\\"gitnexus_{category.rstrip('s')}\\\",\\n                        item.get('name', item.get('id', ''))[:60],\\n                        f\\\"{item.get('filePath', '')}:{item.get('startLine', '')}\\\",\\n                        \\\"gitnexus_index\\\"\\n                    ))\"},{\"oldText\":\"    # Build adjacency\\n    adj = {n[\\\"id\\\"]: [] for n in nodes}\",\"newText\":\"    # Build adjacency\\n    adj = {n[0]: [] for n in nodes}\"}]}}],\"api\":\"anthropic-messages\",\"provider\":\"minimax\",\"model\":\"MiniMax-M2.7\",\"usage\":{\"input\":19198,\"output\":1067,\"cacheRead\":10071,\"cacheWrite\":0,\"totalTokens\":30336,\"cost\":{\"input\":0.0057594,\"output\":0.0012804,\"cacheRead\":0.0006042599999999999,\"cacheWrite\":0,\"total\":0.007644059999999999}},\"stopReason\":\"toolUse\",\"timestamp\":1777531020325,\"responseId\":\"06422b8c83c4278a8bd89ae92cffc34c\"}}\n{\"type\":\"message\",\"id\":\"b317ddee\",\"parentId\":\"85020fc7\",\"timestamp\":\"2026-04-30T06:37:18.931Z\",\"message\":{\"role\":\"toolResult\",\"toolCallId\":\"call_function_oumjqmpj91jv_1\",\"toolName\":\"edit\",\"content\":[{\"type\":\"text\",\"text\":\"Could not find edits[4] in /home/ubuntu/.hermes/agi/_benchmark.py. The oldText must match exactly including all whitespace and newlines.\"}],\"details\":{},\"isError\":true,\"timestamp\":1777531038931}}\n{\"type\":\"message\",\"id\":\"b594d6ff\",\"parentId\":\"b317ddee\",\"timestamp\":\"2026-04-30T06:37:22.635Z\",\"message\":{\"role\":\"assistant\",\"content\":[{\"type\":\"thinking\",\"thinking\":\"Let me look at the fallback path in the benchmark to find the exact text:\",\"thinkingSignature\":\"1cb91aea7e0918dba75bb6e5eee8eb426bd12bbb82ad1579920127e74fa7ff47\"},{\"type\":\"toolCall\",\"id\":\"call_function_j908u0hhznz2_1\",\"name\":\"read\",\"arguments\":{\"path\":\"/home/ubuntu/.hermes/agi/_benchmark.py\",\"offset\":50,\"limit\":80}}],\"api\":\"anthropic-messages\",\"provider\":\"minimax\",\"model\":\"MiniMax-M2.7\",\"usage\":{\"input\":20314,\"output\":73,\"cacheRead\":10071,\"cacheWrite\":0,\"totalTokens\":30458,\"cost\":{\"input\":0.0060942,\"output\":0.0000876,\"cacheRead\":0.0006042599999999999,\"cacheWrite\":0,\"total\":0.00678606}},\"stopReason\":\"toolUse\",\"timestamp\":1777531038932,\"responseId\":\"06422b9f4aa7ae38e66b5e96375da9d4\"}}\n{\"type\":\"message\",\"id\":\"1455801e\",\"parentId\":\"b594d6ff\",\"timestamp\":\"2026-04-30T06:37:22.640Z\",\"message\":{\"role\":\"toolResult\",\"toolCallId\":\"call_function_j908u0hhznz2_1\",\"toolName\":\"read\",\"content\":[{\"type\":\"text\",\"text\":\"\\nif os.path.exists(_GITNEXUS_CACHE_FILE):\\n    try:\\n        mtime = os.path.getmtime(_GITNEXUS_CACHE_FILE)\\n        age_hours = (time.time() - mtime) / 3600\\n        if age_hours < 1:\\n            with open(_GITNEXUS_CACHE_FILE) as f:\\n                _gitnexus_cache = f.read()\\n    except Exception:\\n        pass\\n\\nif _gitnexus_cache is None:\\n    _gitnexus_dir = os.path.join(HERMES_DIR, \\\"belam-codex\\\", \\\".gitnexus\\\")\\n    if os.path.isdir(_gitnexus_dir):\\n        _gitnexus_cache = run(f\\\"cd {HERMES_DIR}/belam-codex && npx --yes gitnexus query --repo belam-codex 'symbol' 2>/dev/null || echo ''\\\", timeout=15)\\n        try:\\n            with open(_GITNEXUS_CACHE_FILE, 'w') as f:\\n                f.write(_gitnexus_cache)\\n        except Exception:\\n            pass\\n\\n# Pre-warm graph pickle cache before timing (I/O outside benchmark window)\\nif HAS_MODULAR:\\n    # First call builds + saves pickle; second call hits cache\\n    build_graph(HERMES_DIR, AGI_DIR, gitnexus_cache=_gitnexus_cache)\\n    \\n    # Timed run — should hit pickle cache (microseconds)\\n    start = time.perf_counter()\\n    builder, _ = build_graph(HERMES_DIR, AGI_DIR, gitnexus_cache=_gitnexus_cache)\\n    build_time_ms = (time.perf_counter() - start) * 1000\\n    \\n    nodes = builder.nodes\\n    edges = builder.edges\\n    adj = builder.adj\\nelse:\\n    # Fallback to inline implementation\\n    import re\\n    _RE_SECTION_SPLIT = re.compile(r'\\\\n(?=#)')\\n    _RE_CODE_BLOCK = re.compile(r'`([^`]+)`')\\n    \\n    start = time.perf_counter()\\n    nodes = []\\n    edges = []\\n    \\n    agents_md = os.path.join(HERMES_DIR, \\\"belam-codex\\\", \\\"AGENTS.md\\\")\\n    if os.path.exists(agents_md):\\n        with open(agents_md, \\\"r\\\") as f:\\n            content = f.read()\\n        \\n        sections = _RE_SECTION_SPLIT.split(content)\\n        last_section_idx = -1\\n        for i, section in enumerate(sections):\\n            lines = section.strip().split('\\\\n')\\n            if not lines:\\n                continue\\n            header = lines[0].strip('#').strip()\\n            body = '\\\\n'.join(lines[1:]).strip()[:120]\\n            nodes.append({\\n                \\\"id\\\": f\\\"agents_section_{i}\\\",\\n                \\\"type\\\": \\\"doc_section\\\",\\n                \\\"label\\\": header[:60],\\n                \\\"content\\\": body,\\n                \\\"source\\\": \\\"AGENTS.md\\\"\\n            })\\n            if last_section_idx >= 0:\\n                edges.append({\\\"from\\\": f\\\"agents_section_{last_section_idx}\\\", \\\"to\\\": f\\\"agents_section_{i}\\\", \\\"type\\\": \\\"sequential\\\"})\\n            last_section_idx = i\\n        \\n        for match in _RE_CODE_BLOCK.finditer(content):\\n            code = match.group(1)\\n            if len(code) > 3 and ' ' in code:\\n                nodes.append({\\n                    \\\"id\\\": f\\\"code_ref_{match.start()}\\\",\\n                    \\\"type\\\": \\\"code_reference\\\",\\n                    \\\"label\\\": code[:60],\\n                    \\\"content\\\": code,\\n                    \\\"source\\\": \\\"AGENTS.md\\\"\\n                })\\n                edges.append({\\n                    \\\"from\\\": f\\\"agents_section_{last_section_idx}\\\",\\n\\n[103 more lines in file. Use offset=130 to continue.]\"}],\"isError\":false,\"timestamp\":1777531042640}}\n{\"type\":\"message\",\"id\":\"0fa175c2\",\"parentId\":\"1455801e\",\"timestamp\":\"2026-04-30T06:37:29.985Z\",\"message\":{\"role\":\"assistant\",\"content\":[{\"type\":\"thinking\",\"thinking\":\"Now I can see the fallback path. Let me make targeted edits. The edits are:\\n1. Change `nodes = builder.nodes` to include comment about tuples\\n2. Change `section_nodes = [n[\\\"id\\\"] for n in nodes if n[\\\"id\\\"].startswith(\\\"agents_section_\\\")]` \\n3. Change section_nodes filter in ASCII render section\\n4. Change node_lookup dict creation\\n5. Change child_labels access\\n6. Change fallback nodes dict to tuple\\n7. Change fallback code_ref nodes dict to tuple\\n8. Change fallback gitnexus nodes dict to tuple\\n\\n\\n9. Change `adj = {n[\\\"id\\\"]: [] for n in nodes}` to use tuple indexing\\n\\nLet me be precise about each one.\",\"thinkingSignature\":\"37faa772221e92e2430111f51bdeac4acc53fe38d00c447325e51410b44c67ee\"},{\"type\":\"toolCall\",\"id\":\"call_function_x4iw8s7ncosa_1\",\"name\":\"read\",\"arguments\":{\"path\":\"/home/ubuntu/.hermes/agi/_benchmark.py\",\"offset\":130}}],\"api\":\"anthropic-messages\",\"provider\":\"minimax\",\"model\":\"MiniMax-M2.7\",\"usage\":{\"input\":21168,\"output\":197,\"cacheRead\":10071,\"cacheWrite\":0,\"totalTokens\":31436,\"cost\":{\"input\":0.0063504,\"output\":0.0002364,\"cacheRead\":0.0006042599999999999,\"cacheWrite\":0,\"total\":0.00719106}},\"stopReason\":\"toolUse\",\"timestamp\":1777531042640,\"responseId\":\"06422ba32527ff8439f70ce00c1834f8\"}}\n{\"type\":\"message\",\"id\":\"c974fd1e\",\"parentId\":\"0fa175c2\",\"timestamp\":\"2026-04-30T06:37:29.986Z\",\"message\":{\"role\":\"toolResult\",\"toolCallId\":\"call_function_x4iw8s7ncosa_1\",\"toolName\":\"read\",\"content\":[{\"type\":\"text\",\"text\":\"                    \\\"to\\\": f\\\"code_ref_{match.start()}\\\",\\n                    \\\"type\\\": \\\"contains\\\"\\n                })\\n    \\n    # Process gitnexus cache\\n    if _gitnexus_cache and _gitnexus_cache.strip():\\n        try:\\n            result = json.loads(_gitnexus_cache)\\n            for category in ['definitions', 'process_symbols', 'processes']:\\n                for item in result.get(category, [])[:30]:\\n                    nodes.append({\\n                        \\\"id\\\": f\\\"gitnexus_{category}_{item.get('id', '')[:40]}\\\",\\n                        \\\"type\\\": f\\\"gitnexus_{category.rstrip('s')}\\\",\\n                        \\\"label\\\": item.get('name', item.get('id', ''))[:60],\\n                        \\\"content\\\": f\\\"{item.get('filePath', '')}:{item.get('startLine', '')}\\\",\\n                        \\\"source\\\": \\\"gitnexus_index\\\"\\n                    })\\n        except json.JSONDecodeError:\\n            pass\\n    \\n    build_time_ms = (time.perf_counter() - start) * 1000\\n    \\n    # Build adjacency\\n    adj = {n[\\\"id\\\"]: [] for n in nodes}\\n    for e in edges:\\n        if e[\\\"from\\\"] in adj and e[\\\"to\\\"] in adj:\\n            adj[e[\\\"from\\\"]].append(e[\\\"to\\\"])\\n            adj[e[\\\"to\\\"]].append(e[\\\"from\\\"])\\n\