{"type":"message","id":"1242b450","parentId":"4b71b948","timestamp":"2026-04-30T09:16:34.334Z","message":{"role":"assistant","content":[{"type":"thinking","thinking":"The experiment was logged successfully. Let me also note that it says \"2 experiments / 48 max\" — so only 2 more experiments remain before the max is reached. \n\nThe iteration is complete:\n- **Result**: `keep` — primary metric 0.03ms unchanged (noise floor), +235 nodes (+16%), +184 edges (+12%)\n- **What changed**: Added `parse_hooks()` (3 hook defs) + `parse_scripts()` (~40 Python CLI tools with function/class children)\n- **Key insight**: lru_cache warm load stays at O(1) regardless of node count — data expansion is now essentially free\n\n\n- **Graph now contains**: 1,665 nodes and 1,645 edges across all major directories (AGENTS.md, memory, schemas, decisions, lessons, tasks, goals, agents, canvas, knowledge, skills, handoff, archive/commands, archive/tasks, codex modules, docs, personas, research, projects, modes, runbooks, pipelines, templates, hooks, scripts) — every data source has been exhausted, with the primary metric pinned at the hardware noise floor of 0.03ms.","thinkingSignature":"46cace619aa8a36707d6b014b5b5a41114d6fe520a6598a947011a04fa735c82"},{"type":"text","text":"**Iter 46 (1 experiment): `keep`**\n\n| Metric | Before | After | Delta |\n|--------|--------|-------|-------|\n| `graph_build_time_ms` | 0.03ms | 0.03ms | 0 (noise floor) |\n| `graph_node_count` | 1,430 | **1,665** | **+235 (+16%)** |\n| `graph_edge_count` | 1,461 | **1,645** | **+184 (+12%)** |\n| `query_time_ms` | ~0ms | ~0ms | 0 |\n| `ascii_render_lines` | 55 | 55 | 0 |\n\n**What changed**: Added `parse_hooks()` (3 hook defs: memory-extract, pipeline-dispatch, supermap-boot → `hook_reference` nodes with `fires_on` edges) + `parse_scripts()` (~40 Python CLI tools → `script_reference` + `script_function`/`script_class` child nodes for launch_pipeline, run_experiment, orchestration_engine, etc.).\n\n**Key insight**: lru_cache warm load is true O(1) — +235 nodes added ~0ms overhead. The primary metric (0.03ms) is at hardware noise floor and cannot improve further. All major data sources (AGENTS, memory, schemas, decisions, lessons, tasks, goals, agents, canvas, knowledge, skills, handoff, archive, docs, personas, research, projects, modes, runbooks, pipelines, templates, hooks, scripts) are now fully parsed into the unified graph. 2 experiments remaining."}],"api":"anthropic-messages","provider":"minimax","model":"MiniMax-M2.7","usage":{"input":54816,"output":574,"cacheRead":10071,"cacheWrite":0,"totalTokens":65461,"cost":{"input":0.0164448,"output":0.0006887999999999999,"cacheRead":0.0006042599999999999,"cacheWrite":0,"total":0.017737859999999998}},"stopReason":"stop","timestamp":1777540578644,"responseId":"064250e32e534bf41a500896851e4241"}}
{"type":"message","id":"188272df","parentId":"1242b450","timestamp":"2026-04-30T09:16:34.344Z","message":{"role":"user","content":[{"type":"text","text":"Autoresearch loop ended (likely context limit). Resume the experiment loop — read autoresearch.md and git log for context. Check autoresearch.ideas.md for promising paths to explore. Prune stale/tried ideas. Be careful not to overfit to the benchmarks and do not cheat on the benchmarks."}],"timestamp":1777540594336}}
