{"type":"message","id":"13fba159","parentId":"39104efa","timestamp":"2026-04-30T08:51:25.607Z","message":{"role":"assistant","content":[{"type":"thinking","thinking":"Hmm, the git commit hash changed — it auto-committed again with a different hash. That's fine.\n\nNow let me report the iteration result in one line.","thinkingSignature":"e437ddad0b0a84870d8ce32732d21094d9c283e223d6ea09e186237d9a817706"},{"type":"text","text":"**Iter 42 (6870b5a): keep** — Parse pipelines/ (45 specs): +294 nodes (1,131→1,425), +774 edges (683→1,457). Primary 0.03ms noise floor unchanged. New node types: `pipeline`, `pipeline_stage`, `pipeline_phase`. New edge types: `has_stage`, `next_stage`, `executed_by`, `uses_agent`, `belongs_to_project`, `has_phase`."}],"api":"anthropic-messages","provider":"minimax","model":"MiniMax-M2.7","usage":{"input":25744,"output":134,"cacheRead":10071,"cacheWrite":0,"totalTokens":35949,"cost":{"input":0.0077231999999999995,"output":0.0001608,"cacheRead":0.0006042599999999999,"cacheWrite":0,"total":0.00848826}},"stopReason":"stop","timestamp":1777539080630,"responseId":"06424b0996e4895faff4a8a5d2e7f5c2"}}
{"type":"message","id":"dac5987f","parentId":"13fba159","timestamp":"2026-04-30T08:51:25.615Z","message":{"role":"user","content":[{"type":"text","text":"Autoresearch loop ended (likely context limit). Resume the experiment loop — read autoresearch.md and git log for context. Check autoresearch.ideas.md for promising paths to explore. Prune stale/tried ideas. Be careful not to overfit to the benchmarks and do not cheat on the benchmarks."}],"timestamp":1777539085610}}
