{"type":"message","id":"868a394d","parentId":"f21479ab","timestamp":"2026-04-30T08:33:14.250Z","message":{"role":"assistant","content":[{"type":"thinking","thinking":"I need to add more context. Let me be more specific:","thinkingSignature":"ba0333e43a17569953cc8b80a3e37857c36829a0483eb4d50411608f67e97ce9"},{"type":"toolCall","id":"call_function_d8lbltdrjjj5_1","name":"edit","arguments":{"path":"/home/ubuntu/.hermes/agi/graph_builder.py","edits":[{"oldText":"    # Parse canvas graph (pre-computed cross-primitive causal edges)\n    canvas_dir = os.path.join(hermes_dir, \"belam-codex\", \"canvas\")\n    if os.path.isdir(canvas_dir):\n        builder.parse_canvas_graph(canvas_dir)\n\n    # Parse knowledge directory (semantic knowledge nodes with tag edges)\n    knowledge_dir = os.path.join(hermes_dir, \"belam-codex\", \"knowledge\")\n    if os.path.isdir(knowledge_dir):\n        builder.parse_knowledge(knowledge_dir)\n\n    # Parse handoff directory (agent handoff logs with TODO items)\n    handoff_dir = os.path.join(hermes_dir, \"belam-codex\", \"handoff\")\n    if os.path.isdir(handoff_dir):\n        builder.parse_handoff(handoff_dir)","newText":"    # Parse canvas graph (pre-computed cross-primitive causal edges)\n    canvas_dir = os.path.join(hermes_dir, \"belam-codex\", \"canvas\")\n    if os.path.isdir(canvas_dir):\n        builder.parse_canvas_graph(canvas_dir)\n\n    # Parse knowledge directory (semantic knowledge nodes with tag edges)\n    knowledge_dir = os.path.join(hermes_dir, \"belam-codex\", \"knowledge\")\n    if os.path.isdir(knowledge_dir):\n        builder.parse_knowledge(knowledge_dir)\n\n    # Parse skills directory (skill ecosystem with category/type nodes + related_skill edges)\n    skills_dir = os.path.join(hermes_dir, \"skills\")\n    if os.path.isdir(skills_dir):\n        builder.parse_skills(skills_dir)\n\n    # Parse handoff directory (agent handoff logs with TODO items)\n    handoff_dir = os.path.join(hermes_dir, \"belam-codex\", \"handoff\")\n    if os.path.isdir(handoff_dir):\n        builder.parse_handoff(handoff_dir)"}]}}],"api":"anthropic-messages","provider":"minimax","model":"MiniMax-M2.7","usage":{"input":34079,"output":505,"cacheRead":10071,"cacheWrite":0,"totalTokens":44655,"cost":{"input":0.010223699999999999,"output":0.000606,"cacheRead":0.0006042599999999999,"cacheWrite":0,"total":0.01143396}},"stopReason":"toolUse","timestamp":1777537984248,"responseId":"064246c041d157a008af1dc258e26f22"}}
{"type":"message","id":"c3cda6dc","parentId":"868a394d","timestamp":"2026-04-30T08:33:14.252Z","message":{"role":"toolResult","toolCallId":"call_function_d8lbltdrjjj5_1","toolName":"edit","content":[{"type":"text","text":"Found 2 occurrences of the text in /home/ubuntu/.hermes/agi/graph_builder.py. The text must be unique. Please provide more context to make it unique."}],"details":{},"isError":true,"timestamp":1777537994252}}
{"type":"message","id":"2849ad1f","parentId":"c3cda6dc","timestamp":"2026-04-30T08:33:17.450Z","message":{"role":"assistant","content":[{"type":"thinking","thinking":"There are still two occurrences. Let me grep to find them:","thinkingSignature":"d349f11956cb0d0019bb04fb05d920587be293244230bcb185e59d257f191ec8"},{"type":"toolCall","id":"call_function_kdlt5rk9taz4_1","name":"bash","arguments":{"command":"grep -n \"Parse handoff directory\" /home/ubuntu/.hermes/agi/graph_builder.py"}}],"api":"anthropic-messages","provider":"minimax","model":"MiniMax-M2.7","usage":{"input":34635,"output":59,"cacheRead":10071,"cacheWrite":0,"totalTokens":44765,"cost":{"input":0.010390499999999999,"output":0.0000708,"cacheRead":0.0006042599999999999,"cacheWrite":0,"total":0.011065559999999999}},"stopReason":"toolUse","timestamp":1777537994253,"responseId":"064246ca2871fb5ababff6a05d9fdfb5"}}
{"type":"message","id":"b3907ef2","parentId":"2849ad1f","timestamp":"2026-04-30T08:33:17.459Z","message":{"role":"toolResult","toolCallId":"call_function_kdlt5rk9taz4_1","toolName":"bash","content":[{"type":"text","text":"1565:    # Parse handoff directory (agent handoff logs with TODO items)\n1683:    # Parse handoff directory (agent handoff logs with TODO items)\n"}],"isError":false,"timestamp":1777537997459}}
{"type":"message","id":"5cbb6812","parentId":"b3907ef2","timestamp":"2026-04-30T08:33:21.578Z","message":{"role":"assistant","content":[{"type":"thinking","thinking":"I need to use more context. Let me find lines 1680-1690 to understand the full context:","thinkingSignature":"3f15b4f33b7b99baaab63a7f7f39e4d2158d678b304785e18ebfbde9025924f5"},{"type":"toolCall","id":"call_function_9sgdem9or89n_1","name":"read","arguments":{"path":"/home/ubuntu/.hermes/agi/graph_builder.py","offset":1675,"limit":20}}],"api":"anthropic-messages","provider":"minimax","model":"MiniMax-M2.7","usage":{"input":34745,"output":81,"cacheRead":10071,"cacheWrite":0,"totalTokens":44897,"cost":{"input":0.010423499999999999,"output":0.00009719999999999999,"cacheRead":0.0006042599999999999,"cacheWrite":0,"total":0.01112496}},"stopReason":"toolUse","timestamp":1777537997462,"responseId":"064246cd602586ed021f1cd7e24f8c38"}}
{"type":"message","id":"7d77f523","parentId":"5cbb6812","timestamp":"2026-04-30T08:33:21.580Z","message":{"role":"toolResult","toolCallId":"call_function_9sgdem9or89n_1","toolName":"read","content":[{"type":"text","text":"    if os.path.isdir(canvas_dir):\n        builder.parse_canvas_graph(canvas_dir)\n\n    # Parse knowledge directory (semantic knowledge nodes with tag edges)\n    knowledge_dir = os.path.join(hermes_dir, \"belam-codex\", \"knowledge\")\n    if os.path.isdir(knowledge_dir):\n        builder.parse_knowledge(knowledge_dir)\n\n    # Parse handoff directory (agent handoff logs with TODO items)\n    handoff_dir = os.path.join(hermes_dir, \"belam-codex\", \"handoff\")\n    if os.path.isdir(handoff_dir):\n        builder.parse_handoff(handoff_dir)\n\n    # Parse archive/commands (38 command docs with upstream links to decision nodes)\n    archive_dir = os.path.join(hermes_dir, \"belam-codex\", \"archive\")\n    if os.path.isdir(archive_dir):\n        builder.parse_archive_commands(archive_dir)\n        builder.parse_archive_tasks(archive_dir)\n        builder.parse_codex_modules(archive_dir)\n\n\n[37 more lines in file. Use offset=1695 to continue.]"}],"isError":false,"timestamp":1777538001580}}
{"type":"message","id":"1ec444c4","parentId":"7d77f523","timestamp":"2026-04-30T08:33:25.033Z","message":{"role":"assistant","content":[{"type":"thinking","thinking":"I see the issue - there's another occurrence around line 1565. Let me look at that area:","thinkingSignature":"f608fe9b17a7b2affeee04f1ac9c2e75e03b8ffb97d6262b61e0e9aa73227d1d"},{"type":"toolCall","id":"call_function_w28d2rwpyl0i_1","name":"read","arguments":{"path":"/home/ubuntu/.hermes/agi/graph_builder.py","offset":1557,"limit":20}}],"api":"anthropic-messages","provider":"minimax","model":"MiniMax-M2.7","usage":{"input":35062,"output":79,"cacheRead":10071,"cacheWrite":0,"totalTokens":45212,"cost":{"input":0.0105186,"output":0.0000948,"cacheRead":0.0006042599999999999,"cacheWrite":0,"total":0.01121766}},"stopReason":"toolUse","timestamp":1777538001581,"responseId":"064246d1aabef5e518fa2274d244c61f"}}
{"type":"message","id":"1d55c192","parentId":"1ec444c4","timestamp":"2026-04-30T08:33:25.035Z","message":{"role":"toolResult","toolCallId":"call_function_w28d2rwpyl0i_1","toolName":"read","content":[{"type":"text","text":"    if os.path.isdir(canvas_dir):\n        builder.parse_canvas_graph(canvas_dir)\n\n    # Parse knowledge directory (semantic knowledge nodes with tag edges)\n    knowledge_dir = os.path.join(hermes_dir, \"belam-codex\", \"knowledge\")\n    if os.path.isdir(knowledge_dir):\n        builder.parse_knowledge(knowledge_dir)\n\n    # Parse handoff directory (agent handoff logs with TODO items)\n    handoff_dir = os.path.join(hermes_dir, \"belam-codex\", \"handoff\")\n    if os.path.isdir(handoff_dir):\n        builder.parse_handoff(handoff_dir)\n\n    # Parse archive/commands (38 command docs with upstream links to decision nodes)\n    archive_dir = os.path.join(hermes_dir, \"belam-codex\", \"archive\")\n    if os.path.isdir(archive_dir):\n        builder.parse_archive_commands(archive_dir)\n        builder.parse_archive_tasks(archive_dir)\n        builder.parse_codex_modules(archive_dir)\n\n\n[155 more lines in file. Use offset=1577 to continue.]"}],"isError":false,"timestamp":1777538005035}}
{"type":"message","id":"6c574603","parentId":"1d55c192","timestamp":"2026-04-30T08:33:29.045Z","message":{"role":"assistant","content":[{"type":"thinking","thinking":"There are two identical blocks in the code. Looking at line 1530 and around, there seems to be a `_cached_build_builder` function that has the same content as the regular build_graph. Let me check:","thinkingSignature":"1a20a2985a74662f88bfb9e71415df2b841ead2ed3c8fb45d780b903f7260445"},{"type":"toolCall","id":"call_function_t0eq79d33qcb_1","name":"read","arguments":{"path":"/home/ubuntu/.hermes/agi/graph_builder.py","offset":1510,"limit":60}}],"api":"anthropic-messages","provider":"minimax","model":"MiniMax-M2.7","usage":{"input":35377,"output":102,"cacheRead":10071,"cacheWrite":0,"totalTokens":45550,"cost":{"input":0.0106131,"output":0.0001224,"cacheRead":0.0006042599999999999,"cacheWrite":0,"total":0.01133976}},"stopReason":"toolUse","timestamp":1777538005036,"responseId":"064246d5dd3ee929aae285bb026aaaa0"}}
{"type":"message","id":"88c7c352","parentId":"6c574603","timestamp":"2026-04-30T08:33:29.048Z","message":{"role":"toolResult","toolCallId":"call_function_t0eq79d33qcb_1","toolName":"read","content":[{"type":"text","text":"    gitnexus_hash is a cache-busting int derived from gitnexus content.\n    \"\"\"\n    # Initialize cache\n    init_cache(agi_dir)\n\n    # Build from sources\n    builder = GraphBuilder()\n\n    # Parse AGENTS.md\n    agents_md = os.path.join(hermes_dir, \"belam-codex\", \"AGENTS.md\")\n    builder.parse_agents_md(agents_md)\n\n    # Parse memory files (expanded to all 58)\n    memory_dir = os.path.join(hermes_dir, \"belam-codex\", \"memory\")\n    builder.parse_memory_files(memory_dir, limit=58)\n\n    # Parse schema files\n    schema_dir = os.path.join(hermes_dir, \"belam-codex\", \"schemas\")\n    builder.parse_schema_files(schema_dir)\n\n    # Parse decisions (all 128 files)\n    decisions_dir = os.path.join(hermes_dir, \"belam-codex\", \"decisions\")\n    if os.path.isdir(decisions_dir):\n        builder.parse_decisions(decisions_dir, limit=999)\n\n    # Parse lessons (all 208 files)\n    lessons_dir = os.path.join(hermes_dir, \"belam-codex\", \"lessons\")\n    if os.path.isdir(lessons_dir):\n        builder.parse_lessons(lessons_dir, limit=999)\n\n    # Parse tasks (all 84 files)\n    tasks_dir = os.path.join(hermes_dir, \"belam-codex\", \"tasks\")\n    if os.path.isdir(tasks_dir):\n        builder.parse_tasks(tasks_dir, limit=999)\n\n    # Parse goals (goal nodes with status/priority/urgency)\n    goals_dir = os.path.join(hermes_dir, \"belam-codex\", \"goals\")\n    if os.path.isdir(goals_dir):\n        builder.parse_goals(goals_dir)\n\n    # Parse agent roles (main, architect, builder, critic)\n    agents_dir = os.path.join(hermes_dir, \"belam-codex\", \"agents\")\n    if os.path.isdir(agents_dir):\n        builder.parse_agent_roles(agents_dir)\n\n    # Parse canvas graph (pre-computed cross-primitive causal edges)\n    canvas_dir = os.path.join(hermes_dir, \"belam-codex\", \"canvas\")\n    if os.path.isdir(canvas_dir):\n        builder.parse_canvas_graph(canvas_dir)\n\n    # Parse knowledge directory (semantic knowledge nodes with tag edges)\n    knowledge_dir = os.path.join(hermes_dir, \"belam-codex\", \"knowledge\")\n    if os.path.isdir(knowledge_dir):\n        builder.parse_knowledge(knowledge_dir)\n\n    # Parse handoff directory (agent handoff logs with TODO items)\n    handoff_dir = os.path.join(hermes_dir, \"belam-codex\", \"handoff\")\n    if os.path.isdir(handoff_dir):\n        builder.parse_handoff(handoff_dir)\n\n\n[162 more lines in file. Use offset=1570 to continue.]"}],"isError":false,"timestamp":1777538009048}}
{"type":"message","id":"8a97ba7e","parentId":"88c7c352","timestamp":"2026-04-30T08:33:33.429Z","message":{"role":"assistant","content":[{"type":"thinking","thinking":"I see - there's `_cached_build_builder` which has a copy of the same parsing logic. I need to add the skills parsing to BOTH places. Let me find the line numbers more precisely:","thinkingSignature":"0e9d1dd49068ddb3fe64d0a6177132dd08a917c32f504f0b315fc0674cdc9248"},{"type":"toolCall","id":"call_function_r5kdm8miequ7_1","name":"bash","arguments":{"command":"grep -n \"Parse handoff directory\\|Parse archive/commands\" /home/ubuntu/.hermes/agi/graph_builder.py"}}],"api":"anthropic-messages","provider":"minimax","model":"MiniMax-M2.7","usage":{"input":36112,"output":91,"cacheRead":10071,"cacheWrite":0,"totalTokens":46274,"cost":{"input":0.010833599999999999,"output":0.0001092,"cacheRead":0.0006042599999999999,"cacheWrite":0,"total":0.01154706}},"stopReason":"toolUse","timestamp":1777538009049,"responseId":"064246d998565ef6b2d28fcb3f730039"}}
{"type":"message","id":"14e54f3e","parentId":"8a97ba7e","timestamp":"2026-04-30T08:33:33.440Z","message":{"role":"toolResult","toolCallId":"call_function_r5kdm8miequ7_1","toolName":"bash","content":[{"type":"text","text":"1565:    # Parse handoff directory (agent handoff logs with TODO items)\n1570:    # Parse archive/commands (38 command docs with upstream links to decision nodes)\n1683:    # Parse handoff directory (agent handoff logs with TODO items)\n1688:    # Parse archive/commands (38 command docs with upstream links to decision nodes)\n"}],"isError":false,"timestamp":1777538013440}}
{"type":"message","id":"e1412a0a","parentId":"14e54f3e","timestamp":"2026-04-30T08:33:46.575Z","message":{"role":"assistant","content":[{"type":"thinking","thinking":"So there are two copies - one at 1565 (in _cached_build_builder) and one at 1683 (in build_graph). I need to update both. Let me read both contexts and make targeted edits:","thinkingSignature":"a1e77554abf1bc71b7f69ada96b09548b3ec359edf591add5efad1c9a2261ea7"},{"type":"toolCall","id":"call_function_3dm2phrphl9p_1","name":"edit","arguments":{"path":"/home/ubuntu/.hermes/agi/graph_builder.py","edits":[{"oldText":"    # Parse knowledge directory (semantic knowledge nodes with tag edges)\n    knowledge_dir = os.path.join(hermes_dir, \"belam-codex\", \"knowledge\")\n    if os.path.isdir(knowledge_dir):\n        builder.parse_knowledge(knowledge_dir)\n\n    # Parse handoff directory (agent handoff logs with TODO items)\n    handoff_dir = os.path.join(hermes_dir, \"belam-codex\", \"handoff\")\n    if os.path.isdir(handoff_dir):\n        builder.parse_handoff(handoff_dir)\n\n    # Parse archive/commands (38 command docs with upstream links to decision nodes)\n    archive_dir = os.path.join(hermes_dir, \"belam-codex\", \"archive\")\n    if os.path.isdir(archive_dir):\n        builder.parse_archive_commands(archive_dir)\n        builder.parse_archive_tasks(archive_dir)\n        builder.parse_codex_modules(archive_dir)\n\n    # Bridge isolated clusters via shared tags\n    builder.build_tag_bridges(hermes_dir)\n\n    # Process gitnexus cache\n    global _gitnexus_cache\n    if cache_to_use is None:\n        cache_to_use = _gitnexus_cache\n    if use_gitnexus and cache_to_use is None:\n        gitnexus_dir = os.path.join(hermes_dir, \"belam-codex\", \".gitnexus\")\n        if os.path.isdir(gitnexus_dir):\n            cache_to_use = run_subprocess(","newText":"    # Parse knowledge directory (semantic knowledge nodes with tag edges)\n    knowledge_dir = os.path.join(hermes_dir, \"belam-codex\", \"knowledge\")\n    if os.path.isdir(knowledge_dir):\n        builder.parse_knowledge(knowledge_dir)\n\n    # Parse skills directory (skill ecosystem with category/type nodes + related_skill edges)\n    skills_dir = os.path.join(hermes_dir, \"skills\")\n    if os.path.isdir(skills_dir):\n        builder.parse_skills(skills_dir)\n\n    # Parse handoff directory (agent handoff logs with TODO items)\n    handoff_dir = os.path.join(hermes_dir, \"belam-codex\", \"handoff\")\n    if os.path.isdir(handoff_dir):\n        builder.parse_handoff(handoff_dir)\n\n    # Parse archive/commands (38 command docs with upstream links to decision nodes)\n    archive_dir = os.path.join(hermes_dir, \"belam-codex\", \"archive\")\n    if os.path.isdir(archive_dir):\n        builder.parse_archive_commands(archive_dir)\n        builder.parse_archive_tasks(archive_dir)\n        builder.parse_codex_modules(archive_dir)\n\n    # Bridge isolated clusters via shared tags\n    builder.build_tag_bridges(hermes_dir)\n\n    # Process gitnexus cache\n    global _gitnexus_cache\n    if cache_to_use is None:\n        cache_to_use = _gitnexus_cache\n    if use_gitnexus and cache_to_use is None:\n        gitnexus_dir = os.path.join(hermes_dir, \"belam-codex\", \".gitnexus\")\n        if os.path.isdir(gitnexus_dir):\n            cache_to_use = run_subprocess("}]}}],"api":"anthropic-messages","provider":"minimax","model":"MiniMax-M2.7","usage":{"input":36294,"output":827,"cacheRead":10071,"cacheWrite":0,"totalTokens":47192,"cost":{"input":0.010888199999999999,"output":0.0009924,"cacheRead":0.0006042599999999999,"cacheWrite":0,"total":0.012484859999999999}},"stopReason":"toolUse","timestamp":1777538013443,"responseId":"064246ddb61ec9c0243b9999b9b0ef9d"}}
{"type":"message","id":"e5fbf90d","parentId":"e1412a0a","timestamp":"2026-04-30T08:33:46.582Z","message":{"role":"toolResult","toolCallId":"call_function_3dm2phrphl9p_1","toolName":"edit","content":[{"type":"text","text":"Successfully replaced 1 block(s) in /home/ubuntu/.hermes/agi/graph_builder.py."}],"details":{"diff":"      ...\n 1679     knowledge_dir = os.path.join(hermes_dir, \"belam-codex\", \"knowledge\")\n 1680     if os.path.isdir(knowledge_dir):\n 1681         builder.parse_knowledge(knowledge_dir)\n 1682 \n+1683     # Parse skills directory (skill ecosystem with category/type nodes + related_skill edges)\n+1684     skills_dir = os.path.join(hermes_dir, \"skills\")\n+1685     if os.path.isdir(skills_dir):\n+1686         builder.parse_skills(skills_dir)\n+1687 \n 1683     # Parse handoff directory (agent handoff logs with TODO items)\n 1684     handoff_dir = os.path.join(hermes_dir, \"belam-codex\", \"handoff\")\n 1685     if os.path.isdir(handoff_dir):\n 1686         builder.parse_handoff(handoff_dir)\n      ...","firstChangedLine":1683},"isError":false,"timestamp":1777538026582}}
{"type":"message","id":"2eb4c60f","parentId":"e5fbf90d","timestamp":"2026-04-30T08:33:50.218Z","message":{"role":"assistant","content":[{"type":"thinking","thinking":"Now I need to update the second occurrence in the `build_graph` function. Let me find the exact context:","thinkingSignature":"a46f3644aba85eeff0bbed1452d0aa18410d150b5c1b028c99ff234c4e169467"},{"type":"toolCall","id":"call_function_xp4ko6dnvudh_1","name":"read","arguments":{"path":"/home/ubuntu/.hermes/agi/graph_builder.py","offset":1690,"limit":30}}],"api":"anthropic-messages","provider":"minimax","model":"MiniMax-M2.7","usage":{"input":37157,"output":81,"cacheRead":10071,"cacheWrite":0,"totalTokens":47309,"cost":{"input":0.0111471,"output":0.00009719999999999999,"cacheRead":0.0006042599999999999,"cacheWrite":0,"total":0.011848560000000001}},"stopReason":"toolUse","timestamp":1777538026583,"responseId":"064246ea8212017c996a97fdd1dce6b1"}}
{"type":"message","id":"b4c9eb55","parentId":"2eb4c60f","timestamp":"2026-04-30T08:33:50.220Z","message":{"role":"toolResult","toolCallId":"call_function_xp4ko6dnvudh_1","toolName":"read","content":[{"type":"text","text":"    if os.path.isdir(handoff_dir):\n        builder.parse_handoff(handoff_dir)\n\n    # Parse archive/commands (38 command docs with upstream links to decision nodes)\n    archive_dir = os.path.join(hermes_dir, \"belam-codex\", \"archive\")\n    if os.path.isdir(archive_dir):\n        builder.parse_archive_commands(archive_dir)\n        builder.parse_archive_tasks(archive_dir)\n        builder.parse_codex_modules(archive_dir)\n\n    # Bridge isolated clusters via shared tags\n    builder.build_tag_bridges(hermes_dir)\n\n    # Process gitnexus cache\n    global _gitnexus_cache\n    if cache_to_use is None:\n        cache_to_use = _gitnexus_cache\n    if use_gitnexus and cache_to_use is None:\n        gitnexus_dir = os.path.join(hermes_dir, \"belam-codex\", \".gitnexus\")\n        if os.path.isdir(gitnexus_dir):\n            cache_to_use = run_subprocess(\n                f\"cd {hermes_dir}/belam-codex && npx --yes gitnexus query --repo belam-codex 'symbol' 2>/dev/null || echo ''\",\n                timeout=15\n            )\n            _save_cache(cache_to_use)\n\n    builder.process_gitnexus_cache(cache_to_use)\n    builder.build_adjacency()\n    _save_graph_cache(agi_dir, builder, cache_to_use)\n\n\n[17 more lines in file. Use offset=1720 to continue.]"}],"isError":false,"timestamp":1777538030220}}
