{"type":"message","id":"d09df7f5","parentId":"d45e0df1","timestamp":"2026-04-30T08:30:14.386Z","message":{"role":"toolResult","toolCallId":"call_function_vpbx2dtspxot_1","toolName":"bash","content":[{"type":"text","text":"-rw-rw-r-- 1 ubuntu ubuntu  8745 Apr 30 06:39 asciirender.py\n-rw-rw-r-- 1 ubuntu ubuntu 63155 Apr 30 08:29 graph_builder.py\n-rw-rw-r-- 1 ubuntu ubuntu  7368 Apr 30 06:15 pi_tree_adapter.py\n-rw-rw-r-- 1 ubuntu ubuntu  7226 Apr 30 06:37 query_engine.py\n"}],"isError":false,"timestamp":1777537814386}}
{"type":"message","id":"b4d0b354","parentId":"d09df7f5","timestamp":"2026-04-30T08:30:14.387Z","message":{"role":"toolResult","toolCallId":"call_function_vpbx2dtspxot_2","toolName":"bash","content":[{"type":"text","text":"(no output)"}],"isError":false,"timestamp":1777537814387}}
{"type":"message","id":"b070fa08","parentId":"b4d0b354","timestamp":"2026-04-30T08:30:14.388Z","message":{"role":"toolResult","toolCallId":"call_function_vpbx2dtspxot_3","toolName":"bash","content":[{"type":"text","text":"#!/usr/bin/env python3\n\"\"\"\ngraph_builder.py - Modular graph construction for unified graph memory\nDB-augmented directed code generation via unified graph memory\n\"\"\"\n\nimport os\nimport re\nimport json\nimport time\nfrom functools import lru_cache\nfrom typing import List, Dict, Any, Optional, Tuple\nfrom collections import defaultdict\n\n# Pre-compiled regex patterns\n_RE_SECTION_SPLIT = re.compile(r'\\n(?=#)')\n_RE_CODE_BLOCK = re.compile(r'`([^`]+)`')\n_RE_FRONT_MATTER = re.compile(r'^---\\n(.*?)\\n---', re.DOTALL)\n_RE_YAML_PAIR = re.compile(r'^(\\w+):\\s*(.*)$')\n\n# Cache for gitnexus output\n_GITNEXUS_CACHE_FILE = None\n_gitnexus_cache = None\n\ndef init_cache(cache_dir: str):\n    \"\"\"Initialize cache file path.\"\"\"\n    global _GITNEXUS_CACHE_FILE, _gitnexus_cache\n    _GITNEXUS_CACHE_FILE = os.path.join(cache_dir, \".gitnexus_cache.json\")\n    if os.path.exists(_GITNEXUS_CACHE_FILE):\n        try:\n            mtime = os.path.getmtime(_GITNEXUS_CACHE_FILE)\n            age_hours = (time.time() - mtime) / 3600\n            if age_hours < 24:\n                with open(_GITNEXUS_CACHE_FILE) as f:\n                    _gitnexus_cache = f.read()\n        except Exception:\n            pass\n\ndef _save_cache(data: str):\n    \"\"\"Save gitnexus result to cache.\"\"\"\n    global _GITNEXUS_CACHE_FILE, _gitnexus_cache\n    _gitnexus_cache = data\n    if _GITNEXUS_CACHE_FILE:\n        try:\n            with open(_GITNEXUS_CACHE_FILE, 'w') as f:\n                f.write(data)\n        except Exception:\n            pass\n\nclass GraphBuilder:\n    \"\"\"Builds a unified graph from multiple source materials.\"\"\"\n    __slots__ = ('nodes', 'edges', 'adj', '_node_ids', '_section_stack', '_precomputed_paths')\n\n    def __init__(self):\n        self.nodes: List[Dict[str, Any]] = []\n        self.edges: List[Dict[str, str]] = []\n        self.adj: Dict[str, List[str]] = defaultdict(list)\n        self._node_ids: set = set()\n        self._section_stack: List[int] = []\n        self._precomputed_paths: Dict[str, Any] = {}  # (start, end) -> path or None\n\n    def add_node(self, node_type: str, label: str, content: str = \"\",\n                 source: str = \"\", node_id: Optional[str] = None) -> str:\n        \"\"\"Add a node to the graph as a compact tuple (id, type, label, content, source).\"\"\"\n        if node_id is None:\n            node_id = f\"{node_type}_{len(self.nodes)}\"\n\n        # Ensure unique ID\n        base_id = node_id\n        counter = 0\n        while node_id in self._node_ids:\n            counter += 1\n            node_id = f\"{base_id}_{counter}\"\n\n        self._node_ids.add(node_id)\n        # Store as tuple: smaller pickle, faster load than dict\n        self.nodes.append((node_id, node_type, label[:60], content[:120] if content else \"\", source))\n        return node_id\n\n    def add_edge(self, from_id: str, to_id: str, edge_type: str = \"references\"):\n        \"\"\"Add an edge between nodes.\"\"\"\n        if from_id in self._node_ids and to_id in self._node_ids:\n            self.edges.append({\"from\": from_id, \"to\": to_id, \"type\": edge_type})\n            self.adj[from_id].append(to_id)\n            self.adj[to_id].append(from_id)  # Bidirectional for traversal\n\n    def parse_agents_md(self, filepath: str) -> int:\n        \"\"\"Parse AGENTS.md into graph nodes.\"\"\"\n        if not os.path.exists(filepath):\n            return 0\n\n        with open(filepath, \"r\") as f:\n            content = f.read()\n\n        sections = _RE_SECTION_SPLIT.split(content)\n        last_section_idx = -1\n\n        for i, section in enumerate(sections):\n            lines = section.strip().split('\\n')\n            if not lines:\n                continue\n\n            header = lines[0].strip('#').strip()\n            body = '\\n'.join(lines[1:]).strip()[:120]\n\n            section_id = self.add_node(\n                \"doc_section\", header, body, \"AGENTS.md\",\n                f\"agents_section_{i}\"\n            )\n\n            if last_section_idx >= 0:\n                self.add_edge(\n                    f\"agents_section_{last_section_idx}\",\n                    section_id,\n                    \"sequential\"\n                )\n            last_section_idx = i\n\n            # Parse code references within section\n            for match in _RE_CODE_BLOCK.finditer(section):\n                code = match.group(1)\n                if len(code) > 3 and ' ' in code:\n                    ref_id = self.add_node(\n                        \"code_reference\", code[:60], code, \"AGENTS.md\",\n                        f\"code_ref_{match.start()}\"\n                    )\n                    self.add_edge(section_id, ref_id, \"contains\")\n\n        return i + 1\n\n    def parse_memory_files(self, memory_dir: str, limit: int = 10) -> int:\n        \"\"\"Parse memory files into graph nodes.\"\"\"\n        if not os.path.isdir(memory_dir):\n            return 0\n\n        memory_files = sorted(\n            [f for f in os.listdir(memory_dir) if f.endswith('.md')],\n            reverse=True\n        )[:limit]\n\n        count = 0\n        for filename in memory_files:\n            filepath = os.path.join(memory_dir, filename)\n            try:\n                with open(filepath, \"r\") as f:\n                    content = f.read()\n\n                # Extract session header\n                header_match = re.search(r'# Session: (.+)', content)\n                session_label = header_match.group(1) if header_match else filename[:-3]\n"}],"isError":false,"timestamp":1777537814388}}
{"type":"message","id":"fdd99d58","parentId":"b070fa08","timestamp":"2026-04-30T08:30:19.583Z","message":{"role":"assistant","content":[{"type":"thinking","thinking":"Let me continue reading the graph_builder to see what parsers exist and what hasn't been done yet.","thinkingSignature":"32f74dc52de5903f7ea29e076cc7c3e9282f58032bf6681aba93496f9333ccd6"},{"type":"toolCall","id":"call_function_8gzev99ec2qv_1","name":"bash","arguments":{"command":"cd /home/ubuntu/.hermes/agi && grep -n \"def parse_\\|def build_\\|lru_cache\" graph_builder.py | head -40"}},{"type":"toolCall","id":"call_function_8gzev99ec2qv_2","name":"bash","arguments":{"command":"cd /home/ubuntu/.hermes/agi && ls memory/ 2>/dev/null | wc -l && ls archive/ 2>/dev/null | head -10"}}],"api":"anthropic-messages","provider":"minimax","model":"MiniMax-M2.7","usage":{"input":6042,"output":133,"cacheRead":10071,"cacheWrite":0,"totalTokens":16246,"cost":{"input":0.0018126,"output":0.0001596,"cacheRead":0.0006042599999999999,"cacheWrite":0,"total":0.00257646}},"stopReason":"toolUse","timestamp":1777537814389,"responseId":"0642461633bd1206ee725aa416aa4eea"}}
{"type":"message","id":"cf19f5ab","parentId":"fdd99d58","timestamp":"2026-04-30T08:30:19.599Z","message":{"role":"toolResult","toolCallId":"call_function_8gzev99ec2qv_1","toolName":"bash","content":[{"type":"text","text":"11:from functools import lru_cache\n87:    def parse_agents_md(self, filepath: str) -> int:\n131:    def parse_memory_files(self, memory_dir: str, limit: int = 10) -> int:\n174:    def parse_schema_files(self, schema_dir: str) -> int:\n257:    def parse_decisions(self, decisions_dir: str, limit: int = 20) -> int:\n305:    def parse_lessons(self, lessons_dir: str, limit: int = 20) -> int:\n350:    def parse_tasks(self, tasks_dir: str, limit: int = 50) -> int:\n442:    def parse_goals(self, goals_dir: str) -> int:\n494:    def parse_agent_roles(self, agents_dir: str) -> int:\n616:    def parse_canvas_graph(self, canvas_dir: str) -> Tuple[int, int]:\n680:    def parse_knowledge(self, knowledge_dir: str) -> int:\n760:    def parse_handoff(self, handoff_dir: str) -> int:\n825:    def parse_archive_commands(self, archive_dir: str) -> int:\n909:    def parse_archive_tasks(self, archive_dir: str) -> int:\n1007:    def parse_codex_modules(self, archive_dir: str) -> int:\n1137:    def build_tag_bridges(self, hermes_dir: str) -> int:\n1216:    def build_adjacency(self):\n1368:@lru_cache(maxsize=1)\n1372:    lru_cache eliminates pickle.load entirely for warm calls.\n1461:    # Return builder directly — lru_cache on GraphBuilder means warm calls are O(1) object return\n1465:def build_graph(hermes_dir: str, agi_dir: str, use_gitnexus: bool = True,\n1467:    \"\"\"Main graph building function with lru_cache for warm calls.\"\"\"\n1479:    # Try lru_cache first (no pickle.load) — bump _cache_ver to bust cache after code/data changes\n"}],"isError":false,"timestamp":1777537819598}}
{"type":"message","id":"52978a84","parentId":"cf19f5ab","timestamp":"2026-04-30T08:30:19.601Z","message":{"role":"toolResult","toolCallId":"call_function_8gzev99ec2qv_2","toolName":"bash","content":[{"type":"text","text":"0\n"}],"isError":false,"timestamp":1777537819601}}
{"type":"message","id":"4d929c29","parentId":"52978a84","timestamp":"2026-04-30T08:30:25.714Z","message":{"role":"assistant","content":[{"type":"thinking","thinking":"Looking at the code, there's a lot already done. The primary metric is saturated at 0.03-0.04ms. Let me check what could still add value:\n\nFrom the ideas:\n1. ✓ Parse machinelearning/ for cross-repo graph edges\n2. ✓ Parse codex-layer-v1-modules/*.py — done in iter 2c4a3fe\n3. Mermaid diagram output\n4. pi /tree adapter integration\n\nLet me check if there's a machinelearning directory or other sources to parse. Also, let me check the git status to see what files have been changed.","thinkingSignature":"5b1d4cf289102db052e31a1650b3ec9f412112fcfdd72f492846039024d7964b"},{"type":"toolCall","id":"call_function_20hzhsrobzy2_1","name":"bash","arguments":{"command":"cd /home/ubuntu/.hermes/agi && git status --short"}},{"type":"toolCall","id":"call_function_20hzhsrobzy2_2","name":"bash","arguments":{"command":"find /home/ubuntu/.hermes -name \"*.py\" -path \"*/skills/*\" 2>/dev/null | head -20"}},{"type":"toolCall","id":"call_function_20hzhsrobzy2_3","name":"bash","arguments":{"command":"ls -la /home/ubuntu/.hermes/agi/archive/ 2>/dev/null"}}],"api":"anthropic-messages","provider":"minimax","model":"MiniMax-M2.7","usage":{"input":6630,"output":250,"cacheRead":10071,"cacheWrite":0,"totalTokens":16951,"cost":{"input":0.001989,"output":0.0003,"cacheRead":0.0006042599999999999,"cacheWrite":0,"total":0.00289326}},"stopReason":"toolUse","timestamp":1777537819602,"responseId":"0642461b46c3f3f8eec63e358bbe535d"}}
{"type":"message","id":"c4ba32a4","parentId":"4d929c29","timestamp":"2026-04-30T08:30:25.737Z","message":{"role":"toolResult","toolCallId":"call_function_20hzhsrobzy2_1","toolName":"bash","content":[{"type":"text","text":" M .graph_cache.pkl\n M autoresearch.jsonl\n M loop.log\n?? experiments/20260430_083003/\n?? sessions/2026-04-30T08-29-46-760Z_019ddd82-2388-7658-a46e-5b98fb237f19.jsonl\n"}],"isError":false,"timestamp":1777537825737}}
{"type":"message","id":"6c55a6cd","parentId":"c4ba32a4","timestamp":"2026-04-30T08:30:25.896Z","message":{"role":"toolResult","toolCallId":"call_function_20hzhsrobzy2_2","toolName":"bash","content":[{"type":"text","text":"/home/ubuntu/.hermes/skills/mlops/training/grpo-rl-training/templates/basic_grpo_training.py\n/home/ubuntu/.hermes/skills/research/polymarket/scripts/polymarket.py\n/home/ubuntu/.hermes/skills/research/arxiv/scripts/search_arxiv.py\n/home/ubuntu/.hermes/skills/media/youtube-content/scripts/fetch_transcript.py\n/home/ubuntu/.hermes/skills/productivity/google-workspace/scripts/google_api.py\n/home/ubuntu/.hermes/skills/productivity/google-workspace/scripts/setup.py\n/home/ubuntu/.hermes/skills/productivity/google-workspace/scripts/gws_bridge.py\n/home/ubuntu/.hermes/skills/productivity/powerpoint/scripts/add_slide.py\n/home/ubuntu/.hermes/skills/productivity/powerpoint/scripts/__init__.py\n/home/ubuntu/.hermes/skills/productivity/powerpoint/scripts/clean.py\n/home/ubuntu/.hermes/skills/productivity/powerpoint/scripts/office/pack.py\n/home/ubuntu/.hermes/skills/productivity/powerpoint/scripts/office/helpers/merge_runs.py\n/home/ubuntu/.hermes/skills/productivity/powerpoint/scripts/office/helpers/simplify_redlines.py\n/home/ubuntu/.hermes/skills/productivity/powerpoint/scripts/office/helpers/__init__.py\n/home/ubuntu/.hermes/skills/productivity/ocr-and-documents/scripts/extract_marker.py\n/home/ubuntu/.hermes/skills/productivity/ocr-and-documents/scripts/extract_pymupdf.py\n/home/ubuntu/.hermes/skills/red-teaming/godmode/scripts/godmode_race.py\n/home/ubuntu/.hermes/skills/red-teaming/godmode/scripts/auto_jailbreak.py\n/home/ubuntu/.hermes/skills/red-teaming/godmode/scripts/load_godmode.py\n/home/ubuntu/.hermes/skills/red-teaming/godmode/scripts/parseltongue.py\n"}],"isError":false,"timestamp":1777537825896}}
{"type":"message","id":"831e5ffc","parentId":"6c55a6cd","timestamp":"2026-04-30T08:30:25.896Z","message":{"role":"toolResult","toolCallId":"call_function_20hzhsrobzy2_3","toolName":"bash","content":[{"type":"text","text":"(no output)\n\nCommand exited with code 2"}],"details":{},"isError":true,"timestamp":1777537825896}}
{"type":"message","id":"d3a8503a","parentId":"831e5ffc","timestamp":"2026-04-30T08:30:29.539Z","message":{"role":"assistant","content":[{"type":"thinking","thinking":"Let me check the skills directory structure and what might be worth parsing:","thinkingSignature":"2265722d666192bc58c37d0ecb32ee6c222f05152437397429cc665d2a2d0884"},{"type":"toolCall","id":"call_function_mhoezopsx8hz_1","name":"bash","arguments":{"command":"ls /home/ubuntu/.hermes/skills/ 2>/dev/null | head -20"}},{"type":"toolCall","id":"call_function_mhoezopsx8hz_2","name":"bash","arguments":{"command":"ls /home/ubuntu/.hermes/agi/archive/codex-layer-v1-modules/ 2>/dev/null | head -10"}},{"type":"toolCall","id":"call_function_mhoezopsx8hz_3","name":"read","arguments":{"path":"/home/ubuntu/.hermes/agi/graph_builder.py","offset":1007,"limit":130}}],"api":"anthropic-messages","provider":"minimax","model":"MiniMax-M2.7","usage":{"input":7386,"output":155,"cacheRead":10071,"cacheWrite":0,"totalTokens":17612,"cost":{"input":0.0022158,"output":0.000186,"cacheRead":0.0006042599999999999,"cacheWrite":0,"total":0.0030060599999999996}},"stopReason":"toolUse","timestamp":1777537825897,"responseId":"064246228a3f1f5ce0f5113ce050157c"}}
{"type":"message","id":"57428a9d","parentId":"d3a8503a","timestamp":"2026-04-30T08:30:29.553Z","message":{"role":"toolResult","toolCallId":"call_function_mhoezopsx8hz_1","toolName":"bash","content":[{"type":"text","text":"apple\nautonomous-ai-agents\ncommunication\ncreative\ndata-science\ndevops\ndiagramming\ndogfood\ndomain\nemail\nfeeds\ngaming\ngifs\ngithub\ninference-sh\nleisure\nmcp\nmedia\nmlops\nnote-taking\n"}],"isError":false,"timestamp":1777537829553}}
{"type":"message","id":"b07b2929","parentId":"57428a9d","timestamp":"2026-04-30T08:30:29.554Z","message":{"role":"toolResult","toolCallId":"call_function_mhoezopsx8hz_2","toolName":"bash","content":[{"type":"text","text":"(no output)"}],"isError":false,"timestamp":1777537829554}}
