{"type":"message","id":"5a6543ed","parentId":"cd935eaa","timestamp":"2026-04-30T07:38:32.688Z","message":{"role":"toolResult","toolCallId":"call_function_p5x722v3vgyx_2","toolName":"bash","content":[{"type":"text","text":"total 220\ndrwxrwxr-x  6 ubuntu ubuntu  4096 Apr 30 07:37 .\ndrwx------ 22 ubuntu ubuntu  4096 Apr 30 07:37 ..\ndrwxrwxr-x  8 ubuntu ubuntu  4096 Apr 30 07:38 .git\n-rw-rw-r--  1 ubuntu ubuntu  4654 Apr 30 07:09 .gitnexus_cache.json\n-rw-rw-r--  1 ubuntu ubuntu 52061 Apr 30 07:37 .graph_cache.pkl\ndrwxrwxr-x  2 ubuntu ubuntu  4096 Apr 30 07:37 __pycache__\n-rwxrwxr-x  1 ubuntu ubuntu  8441 Apr 30 07:12 _benchmark.py\n-rw-rw-r--  1 ubuntu ubuntu  8745 Apr 30 06:39 asciirender.py\n-rw-rw-r--  1 ubuntu ubuntu    26 Apr 30 05:54 autoresearch.config.json\n-rw-rw-r--  1 ubuntu ubuntu  3083 Apr 30 07:37 autoresearch.ideas.md\n-rw-rw-r--  1 ubuntu ubuntu 21416 Apr 30 07:38 autoresearch.jsonl\n-rw-rw-r--  1 ubuntu ubuntu  5103 Apr 30 07:33 autoresearch.md\n-rwxrwxr-x  1 ubuntu ubuntu   897 Apr 30 05:56 autoresearch.sh\ndrwxrwxr-x 59 ubuntu ubuntu  4096 Apr 30 07:37 experiments\n-rw-rw-r--  1 ubuntu ubuntu 28589 Apr 30 07:37 graph_builder.py\n-rw-rw-r--  1 ubuntu ubuntu  3123 Apr 30 07:38 loop.log\n-rw-rw-r--  1 ubuntu ubuntu   587 Apr 30 06:11 pi-agi.log\n-rw-rw-r--  1 ubuntu ubuntu  7368 Apr 30 06:15 pi_tree_adapter.py\n-rw-rw-r--  1 ubuntu ubuntu  7226 Apr 30 06:37 query_engine.py\n-rwxrwxr-x  1 ubuntu ubuntu  1985 Apr 30 06:24 run-loop.sh\n-rw-rw-r--  1 ubuntu ubuntu  2695 Apr 30 06:12 schema.sql\ndrwxrwxr-x  2 ubuntu ubuntu  4096 Apr 30 07:38 sessions\n-rwxrwxr-x  1 ubuntu ubuntu   823 Apr 30 06:02 start.sh\n"}],"isError":false,"timestamp":1777534712688}}
{"type":"message","id":"b223abf9","parentId":"5a6543ed","timestamp":"2026-04-30T07:38:43.159Z","message":{"role":"assistant","content":[{"type":"thinking","thinking":"Looking at the current state:\n1. Primary metric is noise-floor saturated at ~0.03ms (lru_cache warm load)\n2. The ideas backlog says to expand data richness since metric is saturated\n3. Looking at the code, I see several limits:\n   - `parse_memory_files(memory_dir, limit=5)` - could increase\n   - `parse_decisions(decisions_dir, limit=10)` - could increase to more\n   - `parse_lessons(lessons_dir, limit=10)` - could increase to more\n   - `parse_tasks(tasks_dir, limit=50)` - could increase to all 84 tasks\n\nThe \"NOW WORTHWHILE\" section says:\n- Parse all 84 tasks (remove 50-limit) — trivial expansion\n- Expand decisions/lessons beyond 10-limit (potential 300-400 nodes)\n\nLet me pick one small, targeted change. Since the metric is saturated (noise floor), I should focus on expanding the graph data while keeping the same fast load time.\n\nI'll increase:\n1. `parse_tasks(tasks_dir, limit=50)` → remove limit or increase to 100\n2. `parse_decisions/decisions_dir, limit=10)` → increase to 50\n3. `parse_lessons(lessons_dir, limit=10)` → increase to 50\n\nLet me check how many tasks, decisions, and lessons actually exist:","thinkingSignature":"ec00910130219aab045bc09927642971a7a84a0fd57f84b3a09dcea0a9720507"},{"type":"text","text":"Let me check how many files exist in the parsable directories:\n"},{"type":"toolCall","id":"call_function_6hmiemmelh8y_1","name":"bash","arguments":{"command":"echo \"tasks:\" && ls ~/.hermes/belam-codex/tasks/*.md 2>/dev/null | wc -l; echo \"decisions:\" && ls ~/.hermes/belam-codex/decisions/*.md 2>/dev/null | wc -l; echo \"lessons:\" && ls ~/.hermes/belam-codex/lessons/*.md 2>/dev/null | wc -l; echo \"memory:\" && ls ~/.hermes/belam-codex/memory/*.md 2>/dev/null | wc -l"}}],"api":"anthropic-messages","provider":"minimax","model":"MiniMax-M2.7","usage":{"input":9767,"output":446,"cacheRead":10071,"cacheWrite":0,"totalTokens":20284,"cost":{"input":0.0029300999999999997,"output":0.0005352,"cacheRead":0.0006042599999999999,"cacheWrite":0,"total":0.00406956}},"stopReason":"toolUse","timestamp":1777534712689,"responseId":"064239f8a0fb4bc12c1c4158b26c4a6d"}}
{"type":"message","id":"28bb7448","parentId":"b223abf9","timestamp":"2026-04-30T07:38:43.177Z","message":{"role":"toolResult","toolCallId":"call_function_6hmiemmelh8y_1","toolName":"bash","content":[{"type":"text","text":"tasks:\n84\ndecisions:\n128\nlessons:\n204\nmemory:\n58\n"}],"isError":false,"timestamp":1777534723177}}
{"type":"message","id":"53dd0e39","parentId":"28bb7448","timestamp":"2026-04-30T07:38:59.139Z","message":{"role":"assistant","content":[{"type":"thinking","thinking":"Good data:\n- 84 tasks (currently limited to 50)\n- 128 decisions (currently limited to 10)\n- 204 lessons (currently limited to 10)\n- 58 memory files (currently limited to 5)\n\nSince the primary metric is at noise floor (~0.03ms), expanding the data should have minimal impact on the load time. Let me make a targeted change to expand the limits significantly:\n\n1. `parse_tasks(limit=50)` → `parse_tasks(limit=100)` or remove limit\n2. `parse_decisions(limit=10)` → `parse_decisions(limit=100)`\n3. `parse_lessons(limit=10)` → `parse_lessons(limit=100)`\n4. `parse_memory_files(limit=5)` → `parse_memory_files(limit=30)`\n\nThis should increase node count significantly while keeping the warm load time at noise floor.\n\nLet me make one targeted change - I'll increase all limits to expand the graph richness without changing the core architecture.","thinkingSignature":"8db37df5eaff562a1713107ab53bcf5942b218dde5a5fa9dd75a61e002e96155"},{"type":"text","text":"Primary metric is at noise floor (0.03ms). Expanding data limits — no limit changes will affect warm load (lru_cache). Let me make one targeted change:\n"},{"type":"toolCall","id":"call_function_voqqykd18yb6_1","name":"edit","arguments":{"path":"/home/ubuntu/.hermes/agi/graph_builder.py","edits":[{"oldText":"    # Parse memory files\n    memory_dir = os.path.join(hermes_dir, \"belam-codex\", \"memory\")\n    builder.parse_memory_files(memory_dir, limit=5)","newText":"    # Parse memory files (expanded)\n    memory_dir = os.path.join(hermes_dir, \"belam-codex\", \"memory\")\n    builder.parse_memory_files(memory_dir, limit=30)"},{"oldText":"    # Parse decisions (limit 10 — only titles/rationale, no tag nodes)\n    decisions_dir = os.path.join(hermes_dir, \"belam-codex\", \"decisions\")\n    if os.path.isdir(decisions_dir):\n        builder.parse_decisions(decisions_dir, limit=10)","newText":"    # Parse decisions (expanded to 100)\n    decisions_dir = os.path.join(hermes_dir, \"belam-codex\", \"decisions\")\n    if os.path.isdir(decisions_dir):\n        builder.parse_decisions(decisions_dir, limit=100)"},{"oldText":"    # Parse lessons (limit 10 — only titles/summaries, no tag nodes)\n    lessons_dir = os.path.join(hermes_dir, \"belam-codex\", \"lessons\")\n    if os.path.isdir(lessons_dir):\n        builder.parse_lessons(lessons_dir, limit=10)","newText":"    # Parse lessons (expanded to 100)\n    lessons_dir = os.path.join(hermes_dir, \"belam-codex\", \"lessons\")\n    if os.path.isdir(lessons_dir):\n        builder.parse_lessons(lessons_dir, limit=100)"},{"oldText":"    # Parse tasks (limit 50 — task nodes with status/priority/depends_on edges)\n    tasks_dir = os.path.join(hermes_dir, \"belam-codex\", \"tasks\")\n    if os.path.isdir(tasks_dir):\n        builder.parse_tasks(tasks_dir, limit=50)","newText":"    # Parse tasks (expanded to all 84)\n    tasks_dir = os.path.join(hermes_dir, \"belam-codex\", \"tasks\")\n    if os.path.isdir(tasks_dir):\n        builder.parse_tasks(tasks_dir, limit=100)"}]}}],"api":"anthropic-messages","provider":"minimax","model":"MiniMax-M2.7","usage":{"input":10246,"output":820,"cacheRead":10071,"cacheWrite":0,"totalTokens":21137,"cost":{"input":0.0030738,"output":0.0009839999999999998,"cacheRead":0.0006042599999999999,"cacheWrite":0,"total":0.004662059999999999}},"stopReason":"toolUse","timestamp":1777534723179,"responseId":"06423a03d3da714bf6974ca99021ec58"}}
{"type":"message","id":"73aad231","parentId":"53dd0e39","timestamp":"2026-04-30T07:38:59.149Z","message":{"role":"toolResult","toolCallId":"call_function_voqqykd18yb6_1","toolName":"edit","content":[{"type":"text","text":"Found 2 occurrences of edits[0] in /home/ubuntu/.hermes/agi/graph_builder.py. Each oldText must be unique. Please provide more context to make it unique."}],"details":{},"isError":true,"timestamp":1777534739149}}
{"type":"message","id":"2c7042f2","parentId":"73aad231","timestamp":"2026-04-30T07:39:03.065Z","message":{"role":"assistant","content":[{"type":"thinking","thinking":"There are two occurrences of parse_memory_files. Let me look at the file more carefully to get unique context for each.","thinkingSignature":"043131a495cd22ad6bf802b50c56692d757b48e2ea2d88d16b0d19e805dbd1ac"},{"type":"toolCall","id":"call_function_8uz6lesqjpi4_1","name":"read","arguments":{"path":"/home/ubuntu/.hermes/agi/graph_builder.py","offset":390,"limit":80}}],"api":"anthropic-messages","provider":"minimax","model":"MiniMax-M2.7","usage":{"input":11120,"output":81,"cacheRead":10071,"cacheWrite":0,"totalTokens":21272,"cost":{"input":0.003336,"output":0.00009719999999999999,"cacheRead":0.0006042599999999999,"cacheWrite":0,"total":0.00403746}},"stopReason":"toolUse","timestamp":1777534739150,"responseId":"06423a13e74a333875212ec4d54a5222"}}
{"type":"message","id":"3ddb1319","parentId":"2c7042f2","timestamp":"2026-04-30T07:39:03.068Z","message":{"role":"toolResult","toolCallId":"call_function_8uz6lesqjpi4_1","toolName":"read","content":[{"type":"text","text":"                summary = f\"{status}|{priority}|{created[:10]}|{goal_text[:40]}\"\n\n                task_key = filename[:-3]  # strip .md\n                task_id = self.add_node(\n                    \"task\",\n                    label,\n                    summary,\n                    f\"tasks/{filename}\",\n                    f\"task_{task_key[:50]}\"\n                )\n                task_ids[task_key] = task_id\n                count += 1\n\n            except Exception:\n                pass\n\n        # Second pass: add depends_on edges\n        for filename in md_files:\n            filepath = os.path.join(tasks_dir, filename)\n            try:\n                with open(filepath, \"r\") as f:\n                    content = f.read()\n                fm_match = _RE_FRONT_MATTER.match(content)\n                if not fm_match:\n                    continue\n                meta = {}\n                for line in fm_match.group(1).split('\\n'):\n                    m = _RE_YAML_PAIR.match(line)\n                    if m:\n                        meta[m.group(1)] = m.group(2)\n\n                dep_str = meta.get('depends_on', '').strip('[] ')\n                if not dep_str:\n                    continue\n\n                depends = [d.strip().strip(\"'\").strip('\"') for d in dep_str.split(',') if d.strip()]\n                src_key = filename[:-3]\n                src_id = task_ids.get(src_key)\n                if not src_id:\n                    continue\n\n                for dep in depends:\n                    dep_id = task_ids.get(dep)\n                    if dep_id:\n                        self.add_edge(src_id, dep_id, \"depends_on\")\n\n            except Exception:\n                pass\n\n        return count\n\n    def parse_goals(self, goals_dir: str) -> int:\n        \"\"\"Parse goal files into graph nodes with status/urgency metadata.\"\"\"\n        if not os.path.isdir(goals_dir):\n            return 0\n\n        files = sorted(os.listdir(goals_dir))\n        md_files = [f for f in files if f.endswith('.md')]\n        count = 0\n\n        for filename in md_files:\n            filepath = os.path.join(goals_dir, filename)\n            try:\n                with open(filepath, \"r\") as f:\n                    content = f.read()\n\n                # Extract frontmatter\n                fm_match = _RE_FRONT_MATTER.match(content)\n                meta = {}\n                if fm_match:\n                    for line in fm_match.group(1).split('\\n'):\n                        m = _RE_YAML_PAIR.match(line)\n                        if m:\n                            meta[m.group(1)] = m.group(2)\n\n                # Extract goal title\n                title_match = re.search(r'^#\\s+(.+)$', content, re.MULTILINE)\n                title = title_match.group(1)[:60] if title_match else filename[:-3]\n\n                # Extract \"Why Critical\" or first section for context\n\n[309 more lines in file. Use offset=470 to continue.]"}],"isError":false,"timestamp":1777534743068}}
{"type":"message","id":"95ef2a55","parentId":"3ddb1319","timestamp":"2026-04-30T07:39:06.279Z","message":{"role":"assistant","content":[{"type":"thinking","thinking":"Let me see the full _cached_build function to get unique context for each occurrence.","thinkingSignature":"6a0033b722f02d26e55893f5e0af51d5b9c092a138b01e4c74c14ddaee21878b"},{"type":"toolCall","id":"call_function_wg39zm9x1ymm_1","name":"read","arguments":{"path":"/home/ubuntu/.hermes/agi/graph_builder.py","offset":500,"limit":100}}],"api":"anthropic-messages","provider":"minimax","model":"MiniMax-M2.7","usage":{"input":11826,"output":74,"cacheRead":10071,"cacheWrite":0,"totalTokens":21971,"cost":{"input":0.0035478,"output":0.00008879999999999999,"cacheRead":0.0006042599999999999,"cacheWrite":0,"total":0.00424086}},"stopReason":"toolUse","timestamp":1777534743069,"responseId":"06423a17c91fb8c4954ff8e1bfb8b598"}}
{"type":"message","id":"ab79d4f5","parentId":"95ef2a55","timestamp":"2026-04-30T07:39:06.282Z","message":{"role":"toolResult","toolCallId":"call_function_wg39zm9x1ymm_1","toolName":"read","content":[{"type":"text","text":"\n    def get_stats(self) -> Dict[str, Any]:\n        \"\"\"Get graph statistics.\"\"\"\n        return {\n            \"node_count\": len(self.nodes),\n            \"edge_count\": len(self.edges),\n            \"nodes_by_type\": self._count_by_type(),\n            \"node_ids\": len(self._node_ids)\n        }\n\n    def _count_by_type(self) -> Dict[str, int]:\n        \"\"\"Count nodes by type (tuple access: [1] = type).\"\"\"\n        counts = defaultdict(int)\n        for node in self.nodes:\n            counts[node[1]] += 1\n        return dict(counts)\n\n\ndef run_subprocess(cmd: str, timeout: int = 30) -> str:\n    \"\"\"Run subprocess command.\"\"\"\n    import subprocess\n    try:\n        result = subprocess.run(\n            cmd, shell=True, capture_output=True, text=True, timeout=timeout\n        )\n        return result.stdout + result.stderr\n    except Exception:\n        return \"\"\n\n\n# Graph pickle cache file\n_GRAPH_CACHE_FILE = None\nimport pickle  # Module-level for faster cache loads\n\ndef _get_graph_cache_file(agi_dir: str) -> str:\n    global _GRAPH_CACHE_FILE\n    if _GRAPH_CACHE_FILE is None:\n        _GRAPH_CACHE_FILE = os.path.join(agi_dir, \".graph_cache.pkl\")\n    return _GRAPH_CACHE_FILE\n\ndef _get_source_mtimes(hermes_dir: str) -> Dict[str, float]:\n    \"\"\"Collect modification times of all graph source files.\"\"\"\n    mtimes = {}\n    paths = [\n        os.path.join(hermes_dir, \"belam-codex\", \"AGENTS.md\"),\n    ]\n    # Memory files\n    memory_dir = os.path.join(hermes_dir, \"belam-codex\", \"memory\")\n    if os.path.isdir(memory_dir):\n        for f in sorted(os.listdir(memory_dir))[:10]:\n            if f.endswith('.md'):\n                paths.append(os.path.join(memory_dir, f))\n    # Schema files\n    schema_dir = os.path.join(hermes_dir, \"belam-codex\", \"schemas\")\n    if os.path.isdir(schema_dir):\n        for f in os.listdir(schema_dir):\n            if f.endswith(('.md', '.yaml', '.yml')):\n                paths.append(os.path.join(schema_dir, f))\n    for p in paths:\n        if os.path.exists(p):\n            mtimes[p] = os.path.getmtime(p)\n    return mtimes\n\ndef _try_load_graph_cache(agi_dir: str, source_mtimes: Dict[str, float],\n                           gitnexus_cache: Optional[str]) -> Optional[GraphBuilder]:\n    \"\"\"Try to load graph from pickle cache if sources unchanged.\n    \n    Optimization: skip stat-ing source files. Trust pickle file's mtime as proxy.\n    If pickle exists and is readable, sources haven't changed.\n    \"\"\"\n    cache_file = _get_graph_cache_file(agi_dir)\n    if not os.path.exists(cache_file):\n        return None\n    try:\n        with open(cache_file, 'rb') as f:\n            cached = pickle.load(f)\n        # Fast path: skip source_mtimes/gitnexus validation.\n        # Pickle file's mtime is a reliable enough proxy.\n        # (If sources change, pickle is rebuilt. If only content changes\n        # without touching source files, the caller must invalidate.)\n        builder = GraphBuilder()\n        builder.nodes = cached.get('nodes', [])\n        builder.edges = cached.get('edges', [])\n        builder.adj = cached.get('adj', {})\n        builder._node_ids = cached.get('_node_ids', {n[0] for n in builder.nodes})\n        return builder\n    except Exception:\n        return None\n\ndef _save_graph_cache(agi_dir: str, builder: GraphBuilder,\n                       gitnexus_cache: Optional[str]):\n    \"\"\"Save built graph to pickle cache.\"\"\"\n    try:\n        cache_file = _get_graph_cache_file(agi_dir)\n        cached = {\n            'nodes': builder.nodes,\n            'edges': builder.edges,\n            'adj': dict(builder.adj),\n            '_node_ids': builder._node_ids,\n            '_gitnexus_cache': gitnexus_cache,\n\n[179 more lines in file. Use offset=600 to continue.]"}],"isError":false,"timestamp":1777534746282}}
{"type":"message","id":"00dd4ff8","parentId":"ab79d4f5","timestamp":"2026-04-30T07:39:09.771Z","message":{"role":"assistant","content":[{"type":"thinking","thinking":"Let me see the _cached_build function and the cold build path to get unique context.","thinkingSignature":"b3b75358ed023410ae916f4e31613d46ceb83d558f71ce9b412f289ade95dda7"},{"type":"toolCall","id":"call_function_6dikg9o7u5k0_1","name":"read","arguments":{"path":"/home/ubuntu/.hermes/agi/graph_builder.py","offset":600,"limit":100}}],"api":"anthropic-messages","provider":"minimax","model":"MiniMax-M2.7","usage":{"input":12792,"output":75,"cacheRead":10071,"cacheWrite":0,"totalTokens":22938,"cost":{"input":0.0038376,"output":0.00008999999999999999,"cacheRead":0.0006042599999999999,"cacheWrite":0,"total":0.0045318599999999995}},"stopReason":"toolUse","timestamp":1777534746283,"responseId":"06423a1a0c62f098f559187db3eb5eee"}}
