{"type":"session","version":3,"id":"019ddd13-6ab7-719c-a89c-ee16d5cd9699","timestamp":"2026-04-30T06:28:50.488Z","cwd":"/home/ubuntu/.hermes/agi"}
{"type":"model_change","id":"e3630c13","parentId":null,"timestamp":"2026-04-30T06:28:54.574Z","provider":"minimax","modelId":"MiniMax-M2.7"}
{"type":"thinking_level_change","id":"8079f24e","parentId":"e3630c13","timestamp":"2026-04-30T06:28:54.575Z","thinkingLevel":"medium"}
{"type":"custom","customType":"plannotator","data":{"phase":"idle","planFilePath":"PLAN.md","savedState":null},"id":"99fcdc81","parentId":"8079f24e","timestamp":"2026-04-30T06:28:54.590Z"}
{"type":"message","id":"b712497e","parentId":"99fcdc81","timestamp":"2026-04-30T06:28:54.610Z","message":{"role":"user","content":[{"type":"text","text":"Resume the autoresearch loop in ~/.hermes/agi/.\n     Read ~/.hermes/agi/autoresearch.md (current state + what's been tried).\n     Run exactly ONE experiment iteration:\n       1. Make one code change (small, targeted)\n       2. git commit\n       3. run_experiment (./autoresearch.sh)\n       4. log_experiment (keep if improved, discard if not)\n     After log_experiment, stop — do NOT loop again.\n     Report iteration result in one line to stdout."}],"timestamp":1777530534595}}
{"type":"message","id":"3ca2e3d0","parentId":"b712497e","timestamp":"2026-04-30T06:28:58.745Z","message":{"role":"assistant","content":[{"type":"thinking","thinking":"The user wants me to resume an autoresearch loop. Let me first read the autoresearch.md file to understand the current state and what's been tried.","thinkingSignature":"09a46c311447a5d04c4e55899f3d0878c61c260ef9af203b751e652f32f3c9af"},{"type":"toolCall","id":"call_function_hiozldbfti5r_1","name":"read","arguments":{"path":"/home/ubuntu/.hermes/agi/autoresearch.md"}}],"api":"anthropic-messages","provider":"minimax","model":"MiniMax-M2.7","usage":{"input":55,"output":68,"cacheRead":10184,"cacheWrite":0,"totalTokens":10307,"cost":{"input":0.000016499999999999998,"output":0.00008159999999999999,"cacheRead":0.00061104,"cacheWrite":0,"total":0.0007091399999999999}},"stopReason":"toolUse","timestamp":1777530534624,"responseId":"064229a73abccfbd626ad2e1285a78ed"}}
{"type":"message","id":"ea8d064a","parentId":"3ca2e3d0","timestamp":"2026-04-30T06:28:58.771Z","message":{"role":"toolResult","toolCallId":"call_function_hiozldbfti5r_1","toolName":"read","content":[{"type":"text","text":"# Autoresearch: DB-Augmented Directed Code Generation via Unified Graph Memory\n\n## Objective\n\nInvestigate using relational databases (Postgres-style linking/reference) as the backbone for agent-accessible knowledge graphs. Goal: enable agents to navigate code, memory, tasks, and ideas through a single unified graph interface that is equally readable by humans (ASCII art maps) and machines (structured DB queries).\n\nCore inspiration repos:\n- **GitNexus** (abhigyanpatwari) — graph-based code intelligence\n- **MemPalace** (MemPalace/mempalace) — agent memory graph\n- **llm-wiki-compiler** (atomicmemory) — wiki-to-graph pipeline\n- **LanguageAgentTreeSearch** (lapisrocks) — LATS-style reasoning\n- **SkillZero** (ZJU-REAL) — skill learning from graphs\n- **pi /tree** — pi CLI tree/graph rendering\n\nCore questions to explore:\n1. Can agents perceive ASCII visual graphs as efficiently as humans?\n2. Can we steer agents on CoT/reasoning paths using nothing but graphical-rendered maps?\n3. Can a single graph representation span episodic memories, coding ideas, task state, and world models?\n4. Can the \"soul\" (model) feel seamlessly embodied by the \"memory harness\" (graph)?\n5. The **holographic layer coupling** — how do we bind multiple context layers into a single coherent agent experience?\n\n## Metrics\n- **Primary**: `graph_build_time_ms` (ms, lower is better) — time to generate a graph from source state\n- **Secondary**: `graph_node_count` (nodes), `graph_edge_count` (edges), `query_time_ms` (DB query for path finding), `ascii_render_lines` (output length of rendered graph), `agent_comprehension_score` (manual 1-5 assessment per run in ASI)\n\n## How to Run\n`./autoresearch.sh` — outputs `METRIC name=number` lines.\n\n## Files in Scope\n\nAll files created under `.hermes/agi/`:\n- `schema.sql` — Postgres schema for the unified graph (nodes, edges, types, metadata)\n- `graph_builder.py` — builds graph from source material (codebases, memory files, task state)\n- `asciirender.py` — renders graph as ASCII art for agent/human consumption\n- `query_engine.py` — path finding, traversal, CoT graph-walking\n- `pi_tree_adapter.py` — adapter to feed graph output into pi's /tree feature\n- `experiments/` — subdirectory per experiment run storing inputs/outputs\n- `autoresearch.sh` — benchmark driver\n\n## Off Limits\n\n- Do not modify pi's internal source code\n- Do not touch the GitNexus index directly outside of normal git operations\n- No new system dependencies — use only Python stdlib + psycopg2-binary\n\n## Constraints\n\n- All generated code must be valid Python (no pseudocode in final output)\n- ASCII graph output must be ≤200 lines and ≤200 chars wide\n- DB schema must be Postgres-compatible (duckdb fallback OK for local runs)\n- pi subagent calls must be non-blocking and report results through ASI\n\n## What's Been Tried\n\n### Iteration 1-4: Performance Optimizations\n- **Baseline**: 377.21ms (55 nodes, 54 edges)\n- Pre-compiled regex patterns (minor improvement)\n- Gitnexus availability check (skip npx call if no index)\n- Persistent JSON cache file for gitnexus results\n- Cache loading moved before timing\n- **Result**: 0.37ms (75 nodes) — 1019x faster\n\n### Iteration 5-6: Modular System\n- Created `schema.sql` — Postgres-compatible graph schema\n- Created `graph_builder.py` — modular graph construction\n- Created `query_engine.py` — BFS/Dijkstra path finding\n- Created `asciirender.py` — ASCII art rendering\n- Created `pi_tree_adapter.py` — pi /tree integration\n- **Result**: 2.15ms (225 nodes) — 3x more data, still 175x faster than original\n\n### Node Composition (current)\n- doc_section: 22 (from AGENTS.md)\n- code_reference: 27 (code snippets)\n- memory_session: 5 (episodic memories)\n- schema_entity: 10 (schema definitions)\n- schema_field: 141 (schema fields)\n- gitnexus_definition: 20 (code symbols)\n\n### Files Created\n- `schema.sql` — Postgres/DuckDB graph schema\n- `graph_builder.py` — Modular graph builder (225 nodes)\n- `query_engine.py` — Path finding engine\n- `asciirender.py` — ASCII renderer\n- `pi_tree_adapter.py` — pi tree integration\n"}],"isError":false,"timestamp":1777530538771}}
{"type":"message","id":"2162953c","parentId":"ea8d064a","timestamp":"2026-04-30T06:29:04.209Z","message":{"role":"assistant","content":[{"type":"thinking","thinking":"Let me understand the current state:\n- The project is building a DB-augmented knowledge graph system\n- Current best performance: 0.37ms (75 nodes) after iteration 4\n- Iteration 5-6 created modular system: 2.15ms (225 nodes) — 3x more data but still 175x faster than original\n- The original baseline was 377.21ms\n\nNow let me check the ideas file to see what was planned for next:","thinkingSignature":"e969484465dda190a7ffada2d1cf1ca81bd7e2310c3074080ff614ac823b742e"},{"type":"toolCall","id":"call_function_9n547nqcdijf_1","name":"read","arguments":{"path":"/home/ubuntu/.hermes/agi/autoresearch.ideas.md"}},{"type":"toolCall","id":"call_function_9n547nqcdijf_2","name":"bash","arguments":{"command":"cd /home/ubuntu/.hermes/agi && git log --oneline -5"}}],"api":"anthropic-messages","provider":"minimax","model":"MiniMax-M2.7","usage":{"input":1256,"output":176,"cacheRead":10071,"cacheWrite":0,"totalTokens":11503,"cost":{"input":0.0003768,"output":0.00021119999999999998,"cacheRead":0.0006042599999999999,"cacheWrite":0,"total":0.0011922599999999999}},"stopReason":"toolUse","timestamp":1777530538772,"responseId":"064229abf3cceb39b7b214c7acb69ceb"}}
{"type":"message","id":"e279b58d","parentId":"2162953c","timestamp":"2026-04-30T06:29:04.224Z","message":{"role":"toolResult","toolCallId":"call_function_9n547nqcdijf_1","toolName":"read","content":[{"type":"text","text":"# Autoresearch Ideas\n\n## Potential Future Optimizations\n\n### Low-hanging fruit\n- [ ] Pre-compile regex in graph_builder module (currently re-compiled on each import)\n- [ ] Cache schema file parsing results\n- [ ] Use memory-mapped file for large caches\n\n### Data Source Expansion\n- [ ] Parse decisions/ directory for decision nodes\n- [ ] Parse lessons/ directory for learning nodes\n- [ ] Parse tasks/ directory for task state nodes\n- [ ] Parse .hermes/agi/pi-agi.log for session data\n\n### Query Optimizations\n- [ ] Implement bidirectional BFS for faster path finding\n- [ ] Pre-build node index by type for O(1) lookups\n- [ ] Cache query results for repeated queries\n\n### Visualization\n- [ ] Add graphviz DOT output\n- [ ] Add mermaid diagram output\n- [ ] Add interactive HTML viewer\n\n### DB Integration\n- [ ] Implement duckdb backend for persistent graph storage\n- [ ] Add full-text search using Postgres/duckdb FTS\n- [ ] Implement incremental updates (not full rebuild)\n\n### Interesting Findings\n- Gitnexus lbug file is NOT SQLite (despite .db-like header \"LBUG(\")\n- npx gitnexus call takes ~1.9s but is cacheable\n- Module-level caching works well for repeated runs\n\n### Deferred Ideas\n- Multi-repo graph building (cross-reference belam-codex + machinelearning)\n- Embeddings-based semantic search for graph queries\n- LLM-based graph summarization\n"}],"isError":false,"timestamp":1777530544223}}
{"type":"message","id":"21bf2652","parentId":"e279b58d","timestamp":"2026-04-30T06:29:04.224Z","message":{"role":"toolResult","toolCallId":"call_function_9n547nqcdijf_2","toolName":"bash","content":[{"type":"text","text":"23ca033 Pickle-based graph cache with pre-warm — 4.3x faster (2.11ms → 0.49ms), same 225 nodes\n8cb0744 Pre-warm graph pickle cache before timing — timed run hits cache instantly\n9d4b149 Pickle-based graph cache with source mtime validation — skip all file reads when cache is fresh\nb378b4d Pass pre-loaded gitnexus cache to build_graph — eliminate redundant file I/O\n"}],"isError":false,"timestamp":1777530544224}}
{"type":"message","id":"ed6fb366","parentId":"21bf2652","timestamp":"2026-04-30T06:29:07.061Z","message":{"role":"assistant","content":[{"type":"thinking","thinking":"Now let me check the current state of the code and what optimization I can do. Let me look at the graph_builder.py and see what else can be optimized.","thinkingSignature":"52d1efd7f66f65684e55515be57c8932773c2c2ddecac356b75dd46cc5cf50c3"},{"type":"toolCall","id":"call_function_07mtwz0el5b7_1","name":"read","arguments":{"path":"/home/ubuntu/.hermes/agi/graph_builder.py"}}],"api":"anthropic-messages","provider":"minimax","model":"MiniMax-M2.7","usage":{"input":1868,"output":70,"cacheRead":10071,"cacheWrite":0,"totalTokens":12009,"cost":{"input":0.0005604,"output":0.000084,"cacheRead":0.0006042599999999999,"cacheWrite":0,"total":0.00124866}},"stopReason":"toolUse","timestamp":1777530544225,"responseId":"064229b00efa289c32cd37d5db3f7635"}}
