{"type":"message","id":"8e9c381b","parentId":"d9019704","timestamp":"2026-04-30T07:16:34.003Z","message":{"role":"assistant","content":[{"type":"thinking","thinking":"Now I can see the file structure. Let me add the msgpack result to the Tried & Stale section.","thinkingSignature":"d45c37f631d280374dda26ab1edafc280426209d31f26e09e8816641414e16fb"},{"type":"toolCall","id":"call_function_oic4avvi59my_1","name":"edit","arguments":{"path":"/home/ubuntu/.hermes/agi/autoresearch.ideas.md","edits":[{"oldText":"- [x] Compact node representation (tuples) — 0.50ms→0.45ms at 225 nodes (10% faster). Noise floor ~0.3-0.5ms. DONE.","newText":"- [x] Compact node representation (tuples) — 0.50ms→0.45ms at 225 nodes (10% faster). Noise floor ~0.3-0.5ms. DONE.\n- [x] msgpack instead of pickle — REGRESSION: 1.77ms vs 0.45ms. Pickle faster for Python tuples/lists."}]}}],"api":"anthropic-messages","provider":"minimax","model":"MiniMax-M2.7","usage":{"input":16688,"output":208,"cacheRead":10071,"cacheWrite":0,"totalTokens":26967,"cost":{"input":0.005006399999999999,"output":0.0002496,"cacheRead":0.0006042599999999999,"cacheWrite":0,"total":0.005860259999999999}},"stopReason":"toolUse","timestamp":1777533389073,"responseId":"064234cd27f7a931ce7d3b3ab58cf6c1"}}
{"type":"message","id":"e1ae4f3d","parentId":"8e9c381b","timestamp":"2026-04-30T07:16:34.005Z","message":{"role":"toolResult","toolCallId":"call_function_oic4avvi59my_1","toolName":"edit","content":[{"type":"text","text":"Successfully replaced 1 block(s) in /home/ubuntu/.hermes/agi/autoresearch.ideas.md."}],"details":{"diff":"    ...\n 11 - [x] Pre-build node index — no effect\n 12 - [x] Skip adj from pickle cache — REGRESSION: 1.16ms vs 0.50ms\n 13 - [x] Skip `_node_ids` reconstruction — noise floor\n 14 - [x] Compact node representation (tuples) — 0.50ms→0.45ms at 225 nodes (10% faster). Noise floor ~0.3-0.5ms. DONE.\n+15 - [x] msgpack instead of pickle — REGRESSION: 1.77ms vs 0.45ms. Pickle faster for Python tuples/lists.\n 15 \n 16 ## Promising (not tried)\n 17 - [ ] Incremental pickle updates via file watcher — delta patching vs full rebuild\n 18 - [ ] duckdb backend — persistent graph DB, fast SQL queries, avoids pickle entirely\n    ...","firstChangedLine":15},"isError":false,"timestamp":1777533394005}}
{"type":"message","id":"2dad5c01","parentId":"e1ae4f3d","timestamp":"2026-04-30T07:16:37.053Z","message":{"role":"assistant","content":[{"type":"thinking","thinking":"Done. Let me commit the ideas update and provide the summary.","thinkingSignature":"263e1606ff5b2802c9fff7478dc546bb466c7b9e7c6012e3f11bd565e7859b50"},{"type":"toolCall","id":"call_function_dh3l67i194cn_1","name":"bash","arguments":{"command":"cd /home/ubuntu/.hermes/agi && git add -A && git commit -m \"autoresearch: update ideas - msgpack tried, stale\""}}],"api":"anthropic-messages","provider":"minimax","model":"MiniMax-M2.7","usage":{"input":16935,"output":71,"cacheRead":10071,"cacheWrite":0,"totalTokens":27077,"cost":{"input":0.0050805,"output":0.0000852,"cacheRead":0.0006042599999999999,"cacheWrite":0,"total":0.005769959999999999}},"stopReason":"toolUse","timestamp":1777533394006,"responseId":"064234d2ed3cc79c12ee28f6f3638d60"}}
{"type":"message","id":"6f8c96fb","parentId":"2dad5c01","timestamp":"2026-04-30T07:16:37.074Z","message":{"role":"toolResult","toolCallId":"call_function_dh3l67i194cn_1","toolName":"bash","content":[{"type":"text","text":"[master 0462228] autoresearch: update ideas - msgpack tried, stale\n 3 files changed, 10 insertions(+)\n"}],"isError":false,"timestamp":1777533397073}}
{"type":"message","id":"338973f5","parentId":"6f8c96fb","timestamp":"2026-04-30T07:16:41.181Z","message":{"role":"assistant","content":[{"type":"thinking","thinking":"Iteration complete. Let me provide the summary in one line.","thinkingSignature":"ff9d2ab3771ca3ae15ca96087991d162c9988c80685db96642b205908cb40042"},{"type":"text","text":"**Iteration #17 result**: ❌ **discard** — msgpack (1.77ms) is 3.9x slower than pickle (0.45ms) for Python tuple/list structures. Noise floor reached at ~0.5ms. Next: duckdb backend to bypass pickle entirely."}],"api":"anthropic-messages","provider":"minimax","model":"MiniMax-M2.7","usage":{"input":17049,"output":78,"cacheRead":10071,"cacheWrite":0,"totalTokens":27198,"cost":{"input":0.0051147,"output":0.0000936,"cacheRead":0.0006042599999999999,"cacheWrite":0,"total":0.00581256}},"stopReason":"stop","timestamp":1777533397075,"responseId":"064234d56faa5cd73c7a95161e7c268f"}}
{"type":"message","id":"0e0fc832","parentId":"338973f5","timestamp":"2026-04-30T07:16:41.188Z","message":{"role":"user","content":[{"type":"text","text":"Autoresearch loop ended (likely context limit). Resume the experiment loop — read autoresearch.md and git log for context. Check autoresearch.ideas.md for promising paths to explore. Prune stale/tried ideas. Be careful not to overfit to the benchmarks and do not cheat on the benchmarks."}],"timestamp":1777533401184}}
