{"type":"message","id":"8faa19e6","parentId":"36d48984","timestamp":"2026-04-30T08:55:06.531Z","message":{"role":"assistant","content":[{"type":"thinking","thinking":"So `scripts/` and `hooks/` don't exist. Let me check what directories do exist that haven't been parsed yet.","thinkingSignature":"f193f2bb18aed7b869d42b5584d13530cbdf7745a01649ae64fb4a71c9a02f5f"},{"type":"toolCall","id":"call_function_nyq5stsuw76h_1","name":"bash","arguments":{"command":"cd /home/ubuntu/.hermes/agi && ls -d */ 2>/dev/null | grep -v experiments | grep -v __pycache__ | grep -v sessions"}},{"type":"toolCall","id":"call_function_nyq5stsuw76h_2","name":"bash","arguments":{"command":"cd /home/ubuntu/.hermes/agi && grep -n \"def.*parse\\|def.*build\\|def.*_parse\\|# ===\" graph_builder.py | head -40"}}],"api":"anthropic-messages","provider":"minimax","model":"MiniMax-M2.7","usage":{"input":4792,"output":143,"cacheRead":10071,"cacheWrite":0,"totalTokens":15006,"cost":{"input":0.0014376,"output":0.0001716,"cacheRead":0.0006042599999999999,"cacheWrite":0,"total":0.00221346}},"stopReason":"toolUse","timestamp":1777539301690,"responseId":"06424be61bd1687409946abdc6dfce96"}}
{"type":"message","id":"1937cb56","parentId":"8faa19e6","timestamp":"2026-04-30T08:55:06.547Z","message":{"role":"toolResult","toolCallId":"call_function_nyq5stsuw76h_1","toolName":"bash","content":[{"type":"text","text":"(no output)\n\nCommand exited with code 1"}],"details":{},"isError":true,"timestamp":1777539306547}}
{"type":"message","id":"9dd8d373","parentId":"1937cb56","timestamp":"2026-04-30T08:55:06.548Z","message":{"role":"toolResult","toolCallId":"call_function_nyq5stsuw76h_2","toolName":"bash","content":[{"type":"text","text":"87:    def parse_agents_md(self, filepath: str) -> int:\n131:    def parse_memory_files(self, memory_dir: str, limit: int = 10) -> int:\n174:    def parse_schema_files(self, schema_dir: str) -> int:\n257:    def parse_decisions(self, decisions_dir: str, limit: int = 20) -> int:\n328:    def parse_lessons(self, lessons_dir: str, limit: int = 20) -> int:\n398:    def parse_tasks(self, tasks_dir: str, limit: int = 50) -> int:\n490:    def parse_goals(self, goals_dir: str) -> int:\n542:    def parse_agent_roles(self, agents_dir: str) -> int:\n664:    def parse_canvas_graph(self, canvas_dir: str) -> Tuple[int, int]:\n728:    def parse_knowledge(self, knowledge_dir: str) -> int:\n789:    def parse_skills(self, skills_dir: str) -> int:\n945:    def parse_handoff(self, handoff_dir: str) -> int:\n1010:    def parse_archive_commands(self, archive_dir: str) -> int:\n1094:    def parse_docs(self, docs_dir: str) -> int:\n1164:    def parse_personas(self, personas_dir: str) -> int:\n1286:    def parse_research_projects(self, hermes_dir: str) -> int:\n1446:    def parse_pipelines(self, pipelines_dir: str) -> int:\n1639:    def parse_templates(self, templates_dir: str) -> int:\n1740:    def parse_archive_tasks(self, archive_dir: str) -> int:\n1838:    def parse_codex_modules(self, archive_dir: str) -> int:\n1968:    def build_tag_bridges(self, hermes_dir: str) -> int:\n2047:    def build_adjacency(self):\n2181:def _save_graph_cache(agi_dir: str, builder: GraphBuilder,\n2200:def _cached_build_builder(hermes_dir: str, agi_dir: str, gitnexus_hash: int, _cache_ver: int = 1) -> GraphBuilder:\n2324:def build_graph(hermes_dir: str, agi_dir: str, use_gitnexus: bool = True,\n"}],"isError":false,"timestamp":1777539306548}}
{"type":"message","id":"b9e4b3c8","parentId":"9dd8d373","timestamp":"2026-04-30T08:55:13.758Z","message":{"role":"assistant","content":[{"type":"thinking","thinking":"The primary metric is already at 0.03ms noise floor. Let me think about what I can do.\n\nThe ideas backlog shows remaining items:\n- Parse scripts/ (doesn't exist)\n- Parse hooks/ (doesn't exist)\n- Pre-compute reachability matrix\n- Mermaid diagram output\n- pi /tree adapter integration\n\nSince the primary metric is noise-floor saturated, let me look at what's left to parse or improve. Let me check the current graph_builder.py to understand the full picture.\n\nThe most promising things to try:\n1. Pre-compute reachability matrix — enables instant \"what relates to X\" queries, helps connectivity\n\n\n2. Improve the ASCII renderer or add Mermaid output for better visualization\n3. Try pi /tree adapter integration to leverage existing tree rendering capabilities\n\nLet me check what experiments already exist to avoid duplicating work.","thinkingSignature":"f992d9df6f3adfb219d10dea6a0645197d26fbd5b9af817443b696908e9f250e"},{"type":"toolCall","id":"call_function_lz4tv4cqbx2n_1","name":"bash","arguments":{"command":"ls /home/ubuntu/.hermes/agi/experiments/ | sort -V | tail -10"}},{"type":"toolCall","id":"call_function_lz4tv4cqbx2n_2","name":"bash","arguments":{"command":"cat /home/ubuntu/.hermes/agi/autoresearch.jsonl | wc -l && echo \"---last 3 entries---\" && tail -3 /home/ubuntu/.hermes/agi/autoresearch.jsonl"}}],"api":"anthropic-messages","provider":"minimax","model":"MiniMax-M2.7","usage":{"input":5462,"output":285,"cacheRead":10071,"cacheWrite":0,"totalTokens":15818,"cost":{"input":0.0016385999999999998,"output":0.00034199999999999996,"cacheRead":0.0006042599999999999,"cacheWrite":0,"total":0.0025848599999999996}},"stopReason":"toolUse","timestamp":1777539306549,"responseId":"06424bea35182fb378c3a09316758f63"}}
{"type":"message","id":"edfe37a5","parentId":"b9e4b3c8","timestamp":"2026-04-30T08:55:13.771Z","message":{"role":"toolResult","toolCallId":"call_function_lz4tv4cqbx2n_1","toolName":"bash","content":[{"type":"text","text":"20260430_083003\n20260430_083452\n20260430_083614\n20260430_083632\n20260430_083724\n20260430_084249\n20260430_084605\n20260430_084818\n20260430_085054\n20260430_085324\n"}],"isError":false,"timestamp":1777539313770}}
{"type":"message","id":"aee27d98","parentId":"edfe37a5","timestamp":"2026-04-30T08:55:13.772Z","message":{"role":"toolResult","toolCallId":"call_function_lz4tv4cqbx2n_2","toolName":"bash","content":[{"type":"text","text":"44\n---last 3 entries---\n{\"run\":1,\"commit\":\"bcec18a\",\"metric\":0.03,\"metrics\":{\"graph_node_count\":1131,\"graph_edge_count\":683,\"query_time_ms\":0,\"ascii_render_lines\":55,\"graph_build_time_ms\":0.03},\"status\":\"keep\",\"description\":\"Parse research/, projects/, modes/, runbooks/ — +36 nodes, +38 edges. Primary at 0.03ms noise floor.\",\"timestamp\":1777538780344,\"segment\":0,\"confidence\":null,\"iterationTokens\":null,\"asi\":{\"hypothesis\":\"Parse research/ (4 docs), projects/ (7 specs), modes/ (4 orch modes), runbooks/ (1 guide) — domain knowledge nodes\",\"nodes_delta\":\"+36 (1095→1131): 4 research + 7 projects + 4 modes + 1 runbook + tag edges\",\"edges_delta\":\"+38 (645→683): categorized_as + tagged_with + next_mode edges\",\"primary_metric\":\"0.03ms unchanged — lru_cache warm load noise floor saturated\",\"query_time_ms\":\"~0ms (precomputed paths)\",\"graph_richness\":\"Added domain knowledge (containerization, orchestration, ML research) and project specs to graph\",\"next_action_hint\":\"Remaining unexplored: pipelines/ (40+ files, research specs), templates/. Primary metric saturated. 7 experiments left.\"}}\n{\"run\":42,\"commit\":\"3ef87d4\",\"metric\":0.03,\"metrics\":{\"graph_node_count\":1425,\"graph_edge_count\":1457,\"query_time_ms\":0,\"ascii_render_lines\":55,\"graph_build_time_ms\":0.03},\"status\":\"keep\",\"description\":\"Parse pipelines/ (45 specs): +294 nodes, +774 edges. Primary 0.03ms noise floor unchanged. lru_cache warm load absorbs additional parsing overhead. Graph richness now includes full pipeline ecosystem (stages, phases, agents, project links).\",\"timestamp\":1777539080585,\"segment\":0,\"confidence\":15087.199999999999,\"iterationTokens\":9542,\"asi\":{\"hypothesis\":\"Parse pipelines/ directory (45 pipeline specs with stage history tables) adds rich pipeline workflow nodes without affecting warm load time\",\"nodes_added\":294,\"edges_added\":774,\"pipeline_files_scanned\":45,\"primary_metric\":\"0.03ms unchanged — lru_cache warm load noise floor saturated\",\"new_node_types\":\"pipeline, pipeline_stage, pipeline_phase\",\"new_edge_types\":\"has_stage, next_stage, executed_by, uses_agent, belongs_to_project, has_phase\",\"graph_richness\":\"pipeline ecosystem nodes: 45 pipelines + stage history + phase summaries + agent execution traces + project links\",\"next_action_hint\":\"Remaining unexplored: templates/ (4 files). Primary metric saturated at 0.03ms. Also consider: reachability matrix pre-computation for instant cross-cluster queries.\"}}\n{\"run\":1,\"commit\":\"6530ef9\",\"metric\":0.03,\"metrics\":{\"graph_build_time_ms\":0.03,\"graph_node_count\":1430,\"graph_edge_count\":1461,\"query_time_ms\":0,\"ascii_render_lines\":55},\"status\":\"keep\",\"description\":\"Parse templates/ (4 pipeline templates): +5 nodes, +4 edges. Primary 0.03ms noise floor unchanged. Small add — template files contain mostly markdown prose with YAML stage metadata blocks.\",\"timestamp\":1777539224319,\"segment\":0,\"confidence\":null,\"iterationTokens\":null,\"asi\":{\"hypothesis\":\"Parse templates/ directory (4 pipeline templates with YAML stage definitions) adds template→phase→stage node chain\",\"nodes_added\":5,\"edges_added\":4,\"template_files_scanned\":4,\"primary_metric\":\"0.03ms unchanged — lru_cache warm load noise floor saturated\",\"next_action_hint\":\"Remaining unexplored: scripts/ (10+ Python CLI tools). Architectural: reachability matrix pre-computation. Both marginal impact. 6 experiments left (43/48).\"}}\n"}],"isError":false,"timestamp":1777539313772}}
{"type":"message","id":"a7ddbf57","parentId":"aee27d98","timestamp":"2026-04-30T08:55:19.711Z","message":{"role":"assistant","content":[{"type":"thinking","thinking":"OK, so we're at iteration 43 with 1,430 nodes, 1,461 edges. The primary metric is at 0.03ms noise floor.\n\nRemaining ideas:\n1. Parse scripts/ (10+ Python CLI tools) — but scripts/ doesn't exist as a directory\n2. Pre-compute reachability matrix — architectural improvement\n3. Mermaid diagram output — visualization improvement\n4. pi /tree adapter integration\n\nSince scripts/ doesn't exist, let me think about what else could be parsed or improved. Let me check the current graph_builder.py more carefully to see what's available and what could be parsed that hasn't been yet.\n\n\nI should examine the broader hermes directory structure to find other parsable directories or files I haven't considered yet.","thinkingSignature":"997e8bb32c9f8eb08cdd882f32c806e504c0235677d2683c5d8843a88a98e88a"},{"type":"toolCall","id":"call_function_ve0mne71gbga_1","name":"bash","arguments":{"command":"ls /home/ubuntu/.hermes/ 2>/dev/null"}},{"type":"toolCall","id":"call_function_ve0mne71gbga_2","name":"bash","arguments":{"command":"find /home/ubuntu/.hermes/agi -maxdepth 1 -type d | grep -v __pycache__ | grep -v experiments | grep -v sessions | sort"}}],"api":"anthropic-messages","provider":"minimax","model":"MiniMax-M2.7","usage":{"input":6654,"output":248,"cacheRead":10071,"cacheWrite":0,"totalTokens":16973,"cost":{"input":0.0019962,"output":0.00029759999999999997,"cacheRead":0.0006042599999999999,"cacheWrite":0,"total":0.00289806}},"stopReason":"toolUse","timestamp":1777539313773,"responseId":"06424bf25c63e38fe6ce3875980895a8"}}
{"type":"message","id":"0cecd5dd","parentId":"a7ddbf57","timestamp":"2026-04-30T08:55:19.728Z","message":{"role":"toolResult","toolCallId":"call_function_ve0mne71gbga_1","toolName":"bash","content":[{"type":"text","text":"SOUL.md\nagi\naudio_cache\nauth.json\nauth.lock\nbelam-codex\nbin\ncache\nchannel_directory.json\nconfig.yaml\ncron\ngateway.pid\ngateway_state.json\nhermes-agent\nhooks\nimage_cache\nlogs\nmemories\nmodels_dev_cache.json\npairing\npatches\nplugins\nprocesses.json\nsandboxes\nsession_logs\nsessions\nskills\nstate.db\nstate.db-shm\nstate.db-wal\nwhatsapp\n"}],"isError":false,"timestamp":1777539319728}}
{"type":"message","id":"9059aad2","parentId":"0cecd5dd","timestamp":"2026-04-30T08:55:19.728Z","message":{"role":"toolResult","toolCallId":"call_function_ve0mne71gbga_2","toolName":"bash","content":[{"type":"text","text":"/home/ubuntu/.hermes/agi\n/home/ubuntu/.hermes/agi/.git\n"}],"isError":false,"timestamp":1777539319728}}
{"type":"message","id":"1183c44a","parentId":"9059aad2","timestamp":"2026-04-30T08:55:23.048Z","message":{"role":"assistant","content":[{"type":"thinking","thinking":"Interesting! There's a `hooks/` directory at the `.hermes/` level. Let me check it out.","thinkingSignature":"74b4301913f77952002850ee3df499fab8932058d371e3eca572814187d8111f"},{"type":"toolCall","id":"call_function_nwxne5jcf2q1_1","name":"bash","arguments":{"command":"ls /home/ubuntu/.hermes/hooks/ && echo \"---\" && find /home/ubuntu/.hermes/hooks/ -type f | head -20"}},{"type":"toolCall","id":"call_function_nwxne5jcf2q1_2","name":"bash","arguments":{"command":"cat /home/ubuntu/.hermes/agi/autoresearch.sh"}}],"api":"anthropic-messages","provider":"minimax","model":"MiniMax-M2.7","usage":{"input":7036,"output":114,"cacheRead":10071,"cacheWrite":0,"totalTokens":17221,"cost":{"input":0.0021108,"output":0.0001368,"cacheRead":0.0006042599999999999,"cacheWrite":0,"total":0.0028518599999999995}},"stopReason":"toolUse","timestamp":1777539319729,"responseId":"06424bf8253cbe80abb0f374550bfe3d"}}
{"type":"message","id":"7c31ad4e","parentId":"1183c44a","timestamp":"2026-04-30T08:55:23.062Z","message":{"role":"toolResult","toolCallId":"call_function_nwxne5jcf2q1_1","toolName":"bash","content":[{"type":"text","text":"---\n"}],"isError":false,"timestamp":1777539323062}}
{"type":"message","id":"525f67ea","parentId":"7c31ad4e","timestamp":"2026-04-30T08:55:23.063Z","message":{"role":"toolResult","toolCallId":"call_function_nwxne5jcf2q1_2","toolName":"bash","content":[{"type":"text","text":"#!/bin/bash\n# Autoresearch benchmark driver for DB-augmented graph code generation\n# Measures: graph build time, node/edge counts, query time, ASCII render size\n\nset -euo pipefail\n\nAGI_DIR=\"$(cd \"$(dirname \"$0\")\" && pwd)\"\nEXPERIMENT_DIR=\"$AGI_DIR/experiments/$(date +%Y%m%d_%H%M%S)\"\nmkdir -p \"$EXPERIMENT_DIR\"\n\n# --- Metric Definitions ---\n# Primary: graph_build_time_ms (lower is better)\n# Secondary: graph_node_count, graph_edge_count, query_time_ms, ascii_render_lines\n\n# If dependencies not installed, use stub metrics\nMETRIC_cmd=\"python3 $AGI_DIR/_benchmark.py 2>/dev/null || echo 'METRIC graph_build_time_ms=0'\"\n\n# Run benchmark and capture output\nOUTPUT=$($METRIC_cmd)\n\n# Echo raw output for visibility\necho \"$OUTPUT\"\n\n# Ensure we always output at least the primary metric\nif ! echo \"$OUTPUT\" | grep -q \"METRIC graph_build_time_ms=\"; then\n    echo \"METRIC graph_build_time_ms=0\"\nfi\n\nexit 0\n"}],"isError":false,"timestamp":1777539323063}}
{"type":"message","id":"cfbe0faf","parentId":"525f67ea","timestamp":"2026-04-30T08:55:30.104Z","message":{"role":"assistant","content":[{"type":"thinking","thinking":"The hooks directory appears to be empty. Let me check the benchmark file and think about what to try next.\n\nThe primary metric is noise floor saturated at 0.03ms. The remaining items from the ideas backlog that haven't been done:\n1. Parse scripts/ — doesn't exist\n2. Parse hooks/ — empty\n3. Pre-compute reachability matrix — architectural improvement\n4. Mermaid diagram output — visualization\n\nLet me check what's been tried and what the benchmark actually measures. Since the primary metric is saturated, I need to either:\n- Find more data to parse\n- Improve the architecture\n- Improve visualization\n\nLet me look at what files exist at the hermes level that could be parsed.","thinkingSignature":"512ce2c1065a8153c3ebf38cd223e0718337ce56dbf329c5f30ec3f70bf025cb"},{"type":"toolCall","id":"call_function_n786674x6rsa_1","name":"bash","arguments":{"command":"find /home/ubuntu/.hermes/ -maxdepth 1 -type f | grep -v '.lock\\|.pid\\|.json\\|.yaml\\|.md\\|.db' | head -20"}},{"type":"toolCall","id":"call_function_n786674x6rsa_2","name":"bash","arguments":{"command":"cat /home/ubuntu/.hermes/agi/_benchmark.py"}}],"api":"anthropic-messages","provider":"minimax","model":"MiniMax-M2.7","usage":{"input":7414,"output":243,"cacheRead":10071,"cacheWrite":0,"totalTokens":17728,"cost":{"input":0.0022242,"output":0.0002916,"cacheRead":0.0006042599999999999,"cacheWrite":0,"total":0.00312006}},"stopReason":"toolUse","timestamp":1777539323064,"responseId":"06424bfb4753d05b03d3ba1408310f9a"}}
{"type":"message","id":"50316573","parentId":"cfbe0faf","timestamp":"2026-04-30T08:55:30.118Z","message":{"role":"toolResult","toolCallId":"call_function_n786674x6rsa_1","toolName":"bash","content":[{"type":"text","text":"/home/ubuntu/.hermes/.env\n/home/ubuntu/.hermes/.update_check\n/home/ubuntu/.hermes/.graph_cache.pkl\n"}],"isError":false,"timestamp":1777539330118}}
