{"type":"message","id":"31efbbc3","parentId":"046eb5a1","timestamp":"2026-04-30T08:48:10.352Z","message":{"role":"toolResult","toolCallId":"call_function_rxv62sclll73_1","toolName":"bash","content":[{"type":"text","text":"__pycache__\n_benchmark.py\nasciirender.py\nautoresearch.config.json\nautoresearch.ideas.md\nautoresearch.jsonl\nautoresearch.md\nautoresearch.sh\nexperiments\ngraph_builder.py\nloop.log\npi-agi.log\npi_tree_adapter.py\nquery_engine.py\nrun-loop.sh\nschema.sql\nsessions\nstart.sh\n---\n---\n"}],"isError":false,"timestamp":1777538890352}}
{"type":"message","id":"65dc3807","parentId":"31efbbc3","timestamp":"2026-04-30T08:48:14.746Z","message":{"role":"assistant","content":[{"type":"thinking","thinking":"The pipelines directory doesn't exist. The ideas said \"Parse pipelines/ (40+ research specs and setup guides)\" but it doesn't exist. Let me check the sessions directory and see what data is available. Also, let me look at the current graph_builder.py to understand what's being parsed.","thinkingSignature":"3b4b60973462a729100ddd91fd9c63457d63bf2343fcc08142a7b49d57ca526a"},{"type":"toolCall","id":"call_function_orxvo1kk3z2x_1","name":"bash","arguments":{"command":"ls /home/ubuntu/.hermes/agi/sessions/ && echo \"---\" && ls /home/ubuntu/.hermes/agi/experiments/ | tail -5"}},{"type":"toolCall","id":"call_function_orxvo1kk3z2x_2","name":"bash","arguments":{"command":"grep -n \"def _build\" /home/ubuntu/.hermes/agi/graph_builder.py | head -20"}}],"api":"anthropic-messages","provider":"minimax","model":"MiniMax-M2.7","usage":{"input":4921,"output":161,"cacheRead":10071,"cacheWrite":0,"totalTokens":15153,"cost":{"input":0.0014762999999999998,"output":0.00019319999999999998,"cacheRead":0.0006042599999999999,"cacheWrite":0,"total":0.0022737599999999997}},"stopReason":"toolUse","timestamp":1777538890353,"responseId":"06424a4a6f24bc92dddf7ff8592732f9"}}
{"type":"message","id":"736b8af1","parentId":"65dc3807","timestamp":"2026-04-30T08:48:14.764Z","message":{"role":"toolResult","toolCallId":"call_function_orxvo1kk3z2x_1","toolName":"bash","content":[{"type":"text","text":"2026-04-30T06-24-27-474Z_019ddd0f-6751-75bc-a374-6c0fe036e262.jsonl\n2026-04-30T06-28-50-488Z_019ddd13-6ab7-719c-a89c-ee16d5cd9699.jsonl\n2026-04-30T06-34-54-521Z_019ddd18-f8b8-77db-accd-54a3f0429914.jsonl\n2026-04-30T06-43-59-532Z_019ddd21-49ac-7242-a477-d8ed68a68595.jsonl\n2026-04-30T06-49-28-797Z_019ddd26-4fdc-74ea-800f-ea304ca573c2.jsonl\n2026-04-30T06-58-33-848Z_019ddd2e-a0f8-719b-880a-d4195125da4f.jsonl\n2026-04-30T07-07-38-888Z_019ddd36-f207-727a-a724-ee6f7d7c64d2.jsonl\n2026-04-30T07-14-57-886Z_019ddd3d-a4de-771f-89f5-d5f8cca8e332.jsonl\n2026-04-30T07-20-31-138Z_019ddd42-baa2-731c-b9f2-6faf0f5d1c50.jsonl\n2026-04-30T07-26-50-252Z_019ddd48-838c-7349-ac79-f88e03a125bc.jsonl\n2026-04-30T07-33-35-378Z_019ddd4e-b212-75cb-9084-27cb9f6ac0e8.jsonl\n2026-04-30T07-38-17-430Z_019ddd52-ffd6-7058-b89b-4b00833c5b20.jsonl\n2026-04-30T07-43-38-970Z_019ddd57-e7da-75f8-b14c-27ffa972d29b.jsonl\n2026-04-30T07-49-45-920Z_019ddd5d-8140-7031-bf20-1b4d0f32ef16.jsonl\n2026-04-30T07-58-50-980Z_019ddd65-d264-7538-a2c7-e02b6f4794ed.jsonl\n2026-04-30T08-05-51-715Z_019ddd6c-3de3-778b-b944-c32fc0ffa011.jsonl\n2026-04-30T08-14-18-622Z_019ddd73-f9fe-76ad-bcf7-9b1a9cc04058.jsonl\n2026-04-30T08-21-35-455Z_019ddd7a-a45f-7077-9592-4ad1cc6cdd8a.jsonl\n2026-04-30T08-29-46-760Z_019ddd82-2388-7658-a46e-5b98fb237f19.jsonl\n2026-04-30T08-38-51-778Z_019ddd8a-7482-7643-948c-f0f28a09e1cd.jsonl\n2026-04-30T08-47-47-903Z_019ddd92-a2bf-7268-bf49-6c9d60dbc05a.jsonl\n---\n20260430_083614\n20260430_083632\n20260430_083724\n20260430_084249\n20260430_084605\n"}],"isError":false,"timestamp":1777538894764}}
{"type":"message","id":"7f3c04a4","parentId":"736b8af1","timestamp":"2026-04-30T08:48:14.767Z","message":{"role":"toolResult","toolCallId":"call_function_orxvo1kk3z2x_2","toolName":"bash","content":[{"type":"text","text":"(no output)"}],"isError":false,"timestamp":1777538894767}}
{"type":"message","id":"69dd8624","parentId":"7f3c04a4","timestamp":"2026-04-30T08:48:18.579Z","message":{"role":"assistant","content":[{"type":"thinking","thinking":"The pipelines directory doesn't exist. The ideas.md mentioned it but it was aspirational. Let me check the current state of graph_builder.py to understand what's being parsed and find something useful to add.","thinkingSignature":"1caf28fa809e005bbf57e4c672a1cb9f184fcb61a7523401a965b3b32e637bd9"},{"type":"toolCall","id":"call_function_65t35sn1qgwq_1","name":"bash","arguments":{"command":"grep -n \"def _\" /home/ubuntu/.hermes/agi/graph_builder.py | head -40"}},{"type":"toolCall","id":"call_function_65t35sn1qgwq_2","name":"bash","arguments":{"command":"python3 /home/ubuntu/.hermes/agi/_benchmark.py 2>/dev/null"}}],"api":"anthropic-messages","provider":"minimax","model":"MiniMax-M2.7","usage":{"input":5972,"output":124,"cacheRead":10071,"cacheWrite":0,"totalTokens":16167,"cost":{"input":0.0017916,"output":0.00014879999999999998,"cacheRead":0.0006042599999999999,"cacheWrite":0,"total":0.00254466}},"stopReason":"toolUse","timestamp":1777538894767,"responseId":"06424a4f925ea333de4fa656ce2e990b"}}
{"type":"message","id":"98b486b1","parentId":"69dd8624","timestamp":"2026-04-30T08:48:18.595Z","message":{"role":"toolResult","toolCallId":"call_function_65t35sn1qgwq_1","toolName":"bash","content":[{"type":"text","text":"39:def _save_cache(data: str):\n54:    def __init__(self):\n926:    def _find_or_add_reference(self, ref: str, source: str) -> Optional[str]:\n1763:    def _precompute_key_paths(self):\n1778:    def _bfs_path(self, start_id: str, end_id: str) -> Optional[List[str]]:\n1804:    def _count_by_type(self) -> Dict[str, int]:\n1828:def _get_graph_cache_file(agi_dir: str) -> str:\n1834:def _get_source_mtimes(hermes_dir: str) -> Dict[str, float]:\n1857:def _try_load_graph_cache(agi_dir: str, source_mtimes: Dict[str, float],\n1887:def _save_graph_cache(agi_dir: str, builder: GraphBuilder,\n1906:def _cached_build_builder(hermes_dir: str, agi_dir: str, gitnexus_hash: int, _cache_ver: int = 1) -> GraphBuilder:\n"}],"isError":false,"timestamp":1777538898594}}
{"type":"message","id":"ea6f0dbd","parentId":"98b486b1","timestamp":"2026-04-30T08:48:18.746Z","message":{"role":"toolResult","toolCallId":"call_function_65t35sn1qgwq_2","toolName":"bash","content":[{"type":"text","text":"METRIC graph_build_time_ms=0.05\nMETRIC graph_node_count=1131\nMETRIC graph_edge_count=683\nMETRIC query_time_ms=0.0\nMETRIC ascii_render_lines=55\n\nMETRIC graph_build_time_ms=0.05\nMETRIC graph_node_count=1131\nMETRIC graph_edge_count=683\nMETRIC query_time_ms=0.0\nMETRIC ascii_render_lines=55\nUsing modular system: True\n"}],"isError":false,"timestamp":1777538898746}}
{"type":"message","id":"c8b12017","parentId":"ea6f0dbd","timestamp":"2026-04-30T08:48:26.539Z","message":{"role":"assistant","content":[{"type":"thinking","thinking":"The benchmark runs in 0.05ms with 1,131 nodes and 683 edges. The primary metric is noise-floor saturated. \n\nLet me look at what's left to explore. The ideas.md mentioned:\n- Parse pipelines/ — doesn't exist\n- Parse templates/ — doesn't exist\n\nLet me check the sessions files to see if there's structured data we can parse from the session logs. Also, let me look at the memory files in the memory repo.\n\nActually, wait — let me re-read the ideas. It mentions parsing \"pipeline\" type files. Let me check the memory directory for the AGI and see if there's more content to parse. Also, let me look at what kinds of source directories we have in the memory repos.","thinkingSignature":"1fe6fd2abc39aa952e03536725b1047dd396e890d8e432670f5b735797ba4a05"},{"type":"toolCall","id":"call_function_q492xk978z4j_1","name":"bash","arguments":{"command":"find /home/ubuntu/.hermes -maxdepth 2 -type d | sort | head -30"}},{"type":"toolCall","id":"call_function_q492xk978z4j_2","name":"bash","arguments":{"command":"cat /home/ubuntu/.hermes/agi/autoresearch.jsonl | tail -3"}}],"api":"anthropic-messages","provider":"minimax","model":"MiniMax-M2.7","usage":{"input":6429,"output":234,"cacheRead":10071,"cacheWrite":0,"totalTokens":16734,"cost":{"input":0.0019287,"output":0.0002808,"cacheRead":0.0006042599999999999,"cacheWrite":0,"total":0.0028137600000000002}},"stopReason":"toolUse","timestamp":1777538898747,"responseId":"06424a53372934260a5d88b75c8515fc"}}
{"type":"message","id":"cae80db2","parentId":"c8b12017","timestamp":"2026-04-30T08:48:26.558Z","message":{"role":"toolResult","toolCallId":"call_function_q492xk978z4j_1","toolName":"bash","content":[{"type":"text","text":"/home/ubuntu/.hermes\n/home/ubuntu/.hermes/.pytest_cache\n/home/ubuntu/.hermes/.pytest_cache/v\n/home/ubuntu/.hermes/agi\n/home/ubuntu/.hermes/agi/.git\n/home/ubuntu/.hermes/agi/__pycache__\n/home/ubuntu/.hermes/agi/experiments\n/home/ubuntu/.hermes/agi/sessions\n/home/ubuntu/.hermes/audio_cache\n/home/ubuntu/.hermes/belam-codex\n/home/ubuntu/.hermes/belam-codex/.claude\n/home/ubuntu/.hermes/belam-codex/.git\n/home/ubuntu/.hermes/belam-codex/.gitnexus\n/home/ubuntu/.hermes/belam-codex/.hermes\n/home/ubuntu/.hermes/belam-codex/.openclaw\n/home/ubuntu/.hermes/belam-codex/.pytest_cache\n/home/ubuntu/.hermes/belam-codex/agents\n/home/ubuntu/.hermes/belam-codex/archive\n/home/ubuntu/.hermes/belam-codex/bin\n/home/ubuntu/.hermes/belam-codex/canvas\n/home/ubuntu/.hermes/belam-codex/data\n/home/ubuntu/.hermes/belam-codex/decisions\n/home/ubuntu/.hermes/belam-codex/docker\n/home/ubuntu/.hermes/belam-codex/docs\n/home/ubuntu/.hermes/belam-codex/extensions-backup\n/home/ubuntu/.hermes/belam-codex/goals\n/home/ubuntu/.hermes/belam-codex/handoff\n/home/ubuntu/.hermes/belam-codex/hooks\n/home/ubuntu/.hermes/belam-codex/knowledge\n/home/ubuntu/.hermes/belam-codex/lessons\n"}],"isError":false,"timestamp":1777538906558}}
{"type":"message","id":"c28ea64a","parentId":"cae80db2","timestamp":"2026-04-30T08:48:26.559Z","message":{"role":"toolResult","toolCallId":"call_function_q492xk978z4j_2","toolName":"bash","content":[{"type":"text","text":"{\"run\":39,\"commit\":\"5519d8b\",\"metric\":0.03,\"metrics\":{\"graph_node_count\":1075,\"graph_edge_count\":585,\"query_time_ms\":0,\"ascii_render_lines\":55,\"graph_build_time_ms\":0.03},\"status\":\"keep\",\"description\":\"Parse skills/ directory: +115 nodes (26 skill_type categories, 89 skills with related_skill edges). Primary stays at 0.03ms noise floor; lru_cache absorbs additional data. Graph richness improved without speed regression.\",\"timestamp\":1777538214525,\"segment\":0,\"confidence\":1885.8999999999999,\"iterationTokens\":9542,\"asi\":{\"hypothesis\":\"Parse hermes/skills/ directory adds skill ecosystem nodes without affecting build time\",\"nodes_added\":115,\"edges_added\":89,\"skill_types\":26,\"skills\":89,\"primary_unchanged\":\"0.03ms noise floor\",\"lru_cache_effect\":\"absorbed additional parsing overhead\"}}\n{\"run\":40,\"commit\":\"187ee58\",\"metric\":0.03,\"metrics\":{\"graph_node_count\":1095,\"graph_edge_count\":645,\"query_time_ms\":0,\"ascii_render_lines\":55,\"graph_build_time_ms\":0.03},\"status\":\"keep\",\"description\":\"Parse docs/ and personas/ directories — +135 nodes, +149 edges, primary at 0.03ms noise floor\",\"timestamp\":1777538584496,\"segment\":0,\"confidence\":3279.826086956521,\"iterationTokens\":9542,\"asi\":{\"hypothesis\":\"Parse docs/ (operational guides) + personas/ (agent archetypes) for richer graph without affecting warm load\",\"nodes_delta\":\"+135 (960→1095): ~4 doc nodes + ~3 persona nodes + ~128 capability/boundary nodes\",\"edges_delta\":\"+149 (496→645): categorized_as + communicates_with + can_do/refuses_to edges\",\"primary_metric\":\"0.03ms unchanged (lru_cache warm load — noise floor saturated)\",\"query_time_ms\":\"~0ms (precomputed paths unchanged)\",\"graph_richness\":\"Added docs (operational guides) and personas (agent archetypes) to graph ecosystem\",\"next_action_hint\":\"Primary metric saturated at 0.03ms. Remaining: Mermaid output, reachability matrix pre-computation. Or shift to exploring other unexplored dirs (modes/, runbooks/, research/, projects/).\"}}\n{\"run\":1,\"commit\":\"bcec18a\",\"metric\":0.03,\"metrics\":{\"graph_node_count\":1131,\"graph_edge_count\":683,\"query_time_ms\":0,\"ascii_render_lines\":55,\"graph_build_time_ms\":0.03},\"status\":\"keep\",\"description\":\"Parse research/, projects/, modes/, runbooks/ — +36 nodes, +38 edges. Primary at 0.03ms noise floor.\",\"timestamp\":1777538780344,\"segment\":0,\"confidence\":null,\"iterationTokens\":null,\"asi\":{\"hypothesis\":\"Parse research/ (4 docs), projects/ (7 specs), modes/ (4 orch modes), runbooks/ (1 guide) — domain knowledge nodes\",\"nodes_delta\":\"+36 (1095→1131): 4 research + 7 projects + 4 modes + 1 runbook + tag edges\",\"edges_delta\":\"+38 (645→683): categorized_as + tagged_with + next_mode edges\",\"primary_metric\":\"0.03ms unchanged — lru_cache warm load noise floor saturated\",\"query_time_ms\":\"~0ms (precomputed paths)\",\"graph_richness\":\"Added domain knowledge (containerization, orchestration, ML research) and project specs to graph\",\"next_action_hint\":\"Remaining unexplored: pipelines/ (40+ files, research specs), templates/. Primary metric saturated. 7 experiments left.\"}}\n"}],"isError":false,"timestamp":1777538906559}}
{"type":"message","id":"f77a2cc1","parentId":"c28ea64a","timestamp":"2026-04-30T08:48:32.736Z","message":{"role":"assistant","content":[{"type":"thinking","thinking":"Let me check the belam-codex directory structure to see what's available. The graph_builder.py likely reads from `/home/ubuntu/.hermes/belam-codex/`.","thinkingSignature":"cb8f7c3c1325a680e382f16104fd0ec13c04a3376a8d73b6bb679d0f5b5c0d44"},{"type":"toolCall","id":"call_function_z0sspqti93sp_1","name":"bash","arguments":{"command":"grep -n \"hermes_dir\\|AGI_DIR\\|belam-codex\\|source_dir\" /home/ubuntu/.hermes/agi/graph_builder.py | head -20"}},{"type":"toolCall","id":"call_function_z0sspqti93sp_2","name":"bash","arguments":{"command":"grep -n \"source_dirs\\|base_dir\\|parse_\\|_build_\" /home/ubuntu/.hermes/agi/graph_builder.py | head -30"}}],"api":"anthropic-messages","provider":"minimax","model":"MiniMax-M2.7","usage":{"input":7846,"output":146,"cacheRead":10071,"cacheWrite":0,"totalTokens":18063,"cost":{"input":0.0023538,"output":0.0001752,"cacheRead":0.0006042599999999999,"cacheWrite":0,"total":0.0031332599999999997}},"stopReason":"toolUse","timestamp":1777538906559,"responseId":"06424a5a82c121e7401607e3873f6d9c"}}
{"type":"message","id":"0457f790","parentId":"f77a2cc1","timestamp":"2026-04-30T08:48:32.749Z","message":{"role":"toolResult","toolCallId":"call_function_z0sspqti93sp_1","toolName":"bash","content":[{"type":"text","text":"688:        # Canvas format: 'decision/belam-codex-resurrection'\n689:        # Our format: 'decision_belam-codex-resurrection' or 'decision_belam_codex_resurrection'\n1286:    def parse_research_projects(self, hermes_dir: str) -> int:\n1297:        base = os.path.join(hermes_dir, \"belam-codex\")\n1674:    def build_tag_bridges(self, hermes_dir: str) -> int:\n1678:        Reads frontmatter from source files via hermes_dir, extracts tags,\n1685:        source_dir_map = {\n1697:            for src_prefix, sub in source_dir_map.items():\n1705:            filepath = os.path.join(hermes_dir, 'belam-codex', subdir, filename)\n1834:def _get_source_mtimes(hermes_dir: str) -> Dict[str, float]:\n1838:        os.path.join(hermes_dir, \"belam-codex\", \"AGENTS.md\"),\n1841:    memory_dir = os.path.join(hermes_dir, \"belam-codex\", \"memory\")\n1847:    schema_dir = os.path.join(hermes_dir, \"belam-codex\", \"schemas\")\n1906:def _cached_build_builder(hermes_dir: str, agi_dir: str, gitnexus_hash: int, _cache_ver: int = 1) -> GraphBuilder:\n1919:    agents_md = os.path.join(hermes_dir, \"belam-codex\", \"AGENTS.md\")\n1923:    memory_dir = os.path.join(hermes_dir, \"belam-codex\", \"memory\")\n1927:    schema_dir = os.path.join(hermes_dir, \"belam-codex\", \"schemas\")\n1931:    decisions_dir = os.path.join(hermes_dir, \"belam-codex\", \"decisions\")\n1936:    lessons_dir = os.path.join(hermes_dir, \"belam-codex\", \"lessons\")\n1941:    tasks_dir = os.path.join(hermes_dir, \"belam-codex\", \"tasks\")\n"}],"isError":false,"timestamp":1777538912749}}
{"type":"message","id":"e71ef07e","parentId":"0457f790","timestamp":"2026-04-30T08:48:32.751Z","message":{"role":"toolResult","toolCallId":"call_function_z0sspqti93sp_2","toolName":"bash","content":[{"type":"text","text":"87:    def parse_agents_md(self, filepath: str) -> int:\n131:    def parse_memory_files(self, memory_dir: str, limit: int = 10) -> int:\n174:    def parse_schema_files(self, schema_dir: str) -> int:\n257:    def parse_decisions(self, decisions_dir: str, limit: int = 20) -> int:\n328:    def parse_lessons(self, lessons_dir: str, limit: int = 20) -> int:\n398:    def parse_tasks(self, tasks_dir: str, limit: int = 50) -> int:\n490:    def parse_goals(self, goals_dir: str) -> int:\n542:    def parse_agent_roles(self, agents_dir: str) -> int:\n664:    def parse_canvas_graph(self, canvas_dir: str) -> Tuple[int, int]:\n728:    def parse_knowledge(self, knowledge_dir: str) -> int:\n789:    def parse_skills(self, skills_dir: str) -> int:\n945:    def parse_handoff(self, handoff_dir: str) -> int:\n1010:    def parse_archive_commands(self, archive_dir: str) -> int:\n1094:    def parse_docs(self, docs_dir: str) -> int:\n1164:    def parse_personas(self, personas_dir: str) -> int:\n1286:    def parse_research_projects(self, hermes_dir: str) -> int:\n1446:    def parse_archive_tasks(self, archive_dir: str) -> int:\n1544:    def parse_codex_modules(self, archive_dir: str) -> int:\n1906:def _cached_build_builder(hermes_dir: str, agi_dir: str, gitnexus_hash: int, _cache_ver: int = 1) -> GraphBuilder:\n1920:    builder.parse_agents_md(agents_md)\n1924:    builder.parse_memory_files(memory_dir, limit=58)\n1928:    builder.parse_schema_files(schema_dir)\n1933:        builder.parse_decisions(decisions_dir, limit=999)\n1938:        builder.parse_lessons(lessons_dir, limit=999)\n1943:        builder.parse_tasks(tasks_dir, limit=999)\n1948:        builder.parse_goals(goals_dir)\n1953:        builder.parse_agent_roles(agents_dir)\n1958:        builder.parse_canvas_graph(canvas_dir)\n1963:        builder.parse_knowledge(knowledge_dir)\n1968:        builder.parse_skills(skills_dir)\n"}],"isError":false,"timestamp":1777538912751}}
{"type":"message","id":"d3b89cc0","parentId":"e71ef07e","timestamp":"2026-04-30T08:48:36.922Z","message":{"role":"assistant","content":[{"type":"thinking","thinking":"The source data comes from `/home/ubuntu/.hermes/belam-codex/`. Let me check what's left to parse there.","thinkingSignature":"8812ac913347c23efd16589bdbc45f8d89872ad1f953377c2e22c8becb6357c6"},{"type":"toolCall","id":"call_function_1xcc58n7r4dk_1","name":"bash","arguments":{"command":"ls /home/ubuntu/.hermes/belam-codex/ | sort"}},{"type":"toolCall","id":"call_function_1xcc58n7r4dk_2","name":"bash","arguments":{"command":"tail -30 /home/ubuntu/.hermes/agi/graph_builder.py"}}],"api":"anthropic-messages","provider":"minimax","model":"MiniMax-M2.7","usage":{"input":8997,"output":102,"cacheRead":10071,"cacheWrite":0,"totalTokens":19170,"cost":{"input":0.0026991,"output":0.0001224,"cacheRead":0.0006042599999999999,"cacheWrite":0,"total":0.00342576}},"stopReason":"toolUse","timestamp":1777538912753,"responseId":"06424a61242dfdb0da4b02f7efebd808"}}
{"type":"message","id":"529afe86","parentId":"d3b89cc0","timestamp":"2026-04-30T08:48:36.937Z","message":{"role":"toolResult","toolCallId":"call_function_1xcc58n7r4dk_1","toolName":"bash","content":[{"type":"text","text":"!cat\nAGENTS.md\nCLAUDE.md\nCOCKPIT_REFACTOR_GUIDE.md\nCODEX.codex\nCONTEXT_BOOT.md\nDockerfile\nHEARTBEAT.md\nIDENTITY.md\nMEMORY.md\nSOUL.md\nTOOLS.md\nUSER.md\nagents\narchive\nbin\ncanvas\ncodex_legend.md\ndata\ndecisions\ndocker\ndocker-compose.yml\ndocs\nextensions-backup\ngoals\nhandoff\nhooks\nincarnate.sh\nknowledge\nlessons\nlocal_plugins\nlogs\nmachinelearning\nmemory\nmodes\npersonas\npipeline_builds\npipelines\nplugins\nprojects\nrequirements-backtest.txt\nrequirements-base.txt\nrequirements-ml.txt\nrequirements-video.txt\nresearch\nrunbooks\nschemas\nscripts\nskills\nspecs\nstate\ntasks\ntemplates\ntests\n"}],"isError":false,"timestamp":1777538916937}}
{"type":"message","id":"fd8e5ba6","parentId":"529afe86","timestamp":"2026-04-30T08:48:36.938Z","message":{"role":"toolResult","toolCallId":"call_function_1xcc58n7r4dk_2","toolName":"bash","content":[{"type":"text","text":"        cache_to_use = _gitnexus_cache\n    if use_gitnexus and cache_to_use is None:\n        gitnexus_dir = os.path.join(hermes_dir, \"belam-codex\", \".gitnexus\")\n        if os.path.isdir(gitnexus_dir):\n            cache_to_use = run_subprocess(\n                f\"cd {hermes_dir}/belam-codex && npx --yes gitnexus query --repo belam-codex 'symbol' 2>/dev/null || echo ''\",\n                timeout=15\n            )\n            _save_cache(cache_to_use)\n\n    builder.process_gitnexus_cache(cache_to_use)\n    builder.build_adjacency()\n    _save_graph_cache(agi_dir, builder, cache_to_use)\n\n    elapsed_ms = (time.perf_counter() - start) * 1000\n    return builder, elapsed_ms\n\n\nif __name__ == \"__main__\":\n    import sys\n    hermes = os.path.expanduser(\"~/.hermes\")\n    agi = os.path.dirname(os.path.abspath(__file__))\n\n    builder, elapsed = build_graph(hermes, agi)\n    stats = builder.get_stats()\n\n    print(f\"Graph build: {elapsed:.2f}ms\")\n    print(f\"Nodes: {stats['node_count']}\")\n    print(f\"Edges: {stats['edge_count']}\")\n    print(f\"Types: {stats['nodes_by_type']}\")\n"}],"isError":false,"timestamp":1777538916938}}
